{"iteration": 6, "timestamp": "2026-05-08T20:34:34", "previous_best": 0.7901, "duration_seconds": 4.33, "agent_response_raw": "<reflection>\nThe current best score is 0.7901, achieved in iteration 2 and maintained through iterations 4–6. The last run (iteration 6) added TotalSpending and GroupSize but did not improve the score, suggesting those features are not adding signal. The logistic regression pipeline with cabin parsing, categorical encoding, and spending-as-zero is stable and robust. I need to look for structural patterns in the data that have not yet been exploited—either missing interactions, better feature representations, or better handling of missing values in Age.\n</reflection>\n\n<observations>\n- The score has plateaued at 0.7901 for the last three iterations despite adding GroupSize and TotalSpending, suggesting those aggregate features are redundant or noisy.\n- Age is a continuous numeric column with missing values; currently imputed with median. The missingness pattern and its relationship to the target have not been explicitly explored.\n- The spending columns (RoomService, FoodCourt, etc.) are being filled with 0 for missing values, which works well. However, no feature has been created to track whether a passenger spent money at all (a binary \"spent\" flag), which might be predictive independently of the amount.\n- Cabin-derived features (Deck, RoomNum, Side) are included, but we have not tested whether individual deck locations or side (Port/Starboard) correlate with transportation in a structured way.\n- The PassengerId structure ('GroupId_PersonId') encodes group membership, and we extract GroupId and GroupSize, but we ignore the PersonId suffix, which might encode order within the group (e.g., first/last to board).\n</observations>\n\n<hypothesis>\nCreating a binary \"AnySpending\" feature (1 if total spending > 0, else 0) will improve accuracy because spending behaviour may be a strong binary signal independent of amount. Additionally, extracting PersonId from PassengerId and treating it as an ordinal feature (order within group) may capture sequential boarding or group dynamics not yet captured.\n</hypothesis>\n\n<plan>\nI will add two simple binary/ordinal features: (1) AnySpending = 1 if TotalSpending > 0, else 0; (2) PersonId = the second component of PassengerId (split on underscore), treated as a numeric ordinal feature. Both are cheap to compute and test whether binary spending behaviour and position within group improve the score beyond 0.7901.\n</plan>\n\n<code>\n```python\n\"\"\"\ntrain.py — logistic regression with cabin parsing, group features, and simple binary/ordinal features.\n\"\"\"\nimport sys, pathlib\nsys.path.insert(0, str(pathlib.Path(__file__).resolve().parent.parent))\n\nimport pandas as pd\nimport numpy as np\nfrom sklearn.linear_model import LogisticRegression\nfrom sklearn.impute import SimpleImputer\nfrom sklearn.pipeline import Pipeline\nfrom sklearn.preprocessing import StandardScaler, OneHotEncoder\nfrom sklearn.compose import ColumnTransformer\n\nimport prepare\n\nNUMERIC = [\"Age\", \"RoomService\", \"FoodCourt\", \"ShoppingMall\", \"Spa\", \"VRDeck\"]\nCATEGORICAL = [\"HomePlanet\", \"Destination\", \"CryoSleep\", \"VIP\"]\nSPENDING = [\"RoomService\", \"FoodCourt\", \"ShoppingMall\", \"Spa\", \"VRDeck\"]\n\n\ndef parse_cabin(cabin_str):\n    \"\"\"Parse Cabin 'F/0/S' into deck, room_num, side.\"\"\"\n    if pd.isna(cabin_str):\n        return np.nan, np.nan, np.nan\n    parts = str(cabin_str).split(\"/\")\n    if len(parts) == 3:\n        return parts[0], int(parts[1]) if parts[1].isdigit() else np.nan, parts[2]\n    return np.nan, np.nan, np.nan\n\n\ndef extract_group_id(passenger_id):\n    \"\"\"Extract group ID from PassengerId (e.g., '0001_01' -> '0001').\"\"\"\n    if pd.isna(passenger_id):\n        return np.nan\n    return str(passenger_id).split(\"_\")[0]\n\n\ndef extract_person_id(passenger_id):\n    \"\"\"Extract person ID (order within group) from PassengerId (e.g., '0001_01' -> 1).\"\"\"\n    if pd.isna(passenger_id):\n        return np.nan\n    parts = str(passenger_id).split(\"_\")\n    if len(parts) == 2:\n        try:\n            return int(parts[1])\n        except ValueError:\n            return np.nan\n    return np.nan\n\n\ndef build_predict_fn():\n    train_df, _ = prepare.load_split()\n    \n    # Parse Cabin into Deck, RoomNum, Side\n    cabin_data = train_df[\"Cabin\"].apply(parse_cabin)\n    train_df[\"Deck\"] = cabin_data.apply(lambda x: x[0])\n    train_df[\"RoomNum\"] = cabin_data.apply(lambda x: x[1])\n    train_df[\"Side\"] = cabin_data.apply(lambda x: x[2])\n    \n    # Extract group ID and person ID from PassengerId\n    train_df[\"GroupId\"] = train_df[\"PassengerId\"].apply(extract_group_id)\n    train_df[\"PersonId\"] = train_df[\"PassengerId\"].apply(extract_person_id)\n    \n    # Compute group size for each passenger\n    group_sizes = train_df[\"GroupId\"].value_counts().to_dict()\n    train_df[\"GroupSize\"] = train_df[\"GroupId\"].map(group_sizes).fillna(1)\n    \n    # Fill missing values in spending columns with 0 (indicates not spent)\n    for col in SPENDING:\n        train_df[col] = train_df[col].fillna(0)\n    \n    # Compute total spending and binary spending flag\n    train_df[\"TotalSpending\"] = train_df[SPENDING].sum(axis=1)\n    train_df[\"AnySpending\"] = (train_df[\"TotalSpending\"] > 0).astype(int)\n    \n    # Convert CryoSleep and VIP to numeric (handle NaN explicitly)\n    train_df[\"CryoSleep\"] = train_df[\"CryoSleep\"].fillna(\"Unknown\").astype(str)\n    train_df[\"VIP\"] = train_df[\"VIP\"].fillna(\"Unknown\").astype(str)\n    \n    # Build feature set: include both individual spending and aggregate spending\n    feature_cols = [\"Age\", \"PersonId\", \"TotalSpending\", \"AnySpending\"] + SPENDING + CATEGORICAL + [\"Deck\", \"RoomNum\", \"Side\", \"GroupId\", \"GroupSize\"]\n    X = train_df[feature_cols]\n    y = train_df[\"Transported\"].astype(int)\n    \n    # Define preprocessing for numeric and categorical columns\n    numeric_transformer = Pipeline([\n        (\"imputer\", SimpleImputer(strategy=\"median\")),\n        (\"scaler\", StandardScaler()),\n    ])\n    \n    categorical_transformer = Pipeline([\n        (\"imputer\", SimpleImputer(strategy=\"most_frequent\")),\n        (\"onehot\", OneHotEncoder(handle_unknown=\"ignore\", sparse_output=False)),\n    ])\n    \n    preprocessor = ColumnTransformer([\n        (\"num\", numeric_transformer, [\"Age\", \"PersonId\", \"TotalSpending\", \"AnySpending\", \"RoomNum\", \"GroupSize\"] + SPENDING),\n        (\"cat\", categorical_transformer, CATEGORICAL + [\"Deck\", \"Side\", \"GroupId\"]),\n    ])\n    \n    pipe = Pipeline([\n        (\"preprocessor\", preprocessor),\n        (\"clf\", LogisticRegression(max_iter=1000)),\n    ])\n    \n    pipe.fit(X, y)\n    \n    # Store group_sizes mapping for use in predict function\n    pipe.group_sizes = group_sizes\n    \n    def predict(X_val):\n        # Parse Cabin in validation set\n        cabin_data = X_val[\"Cabin\"].apply(parse_cabin)\n        X_val_copy = X_val.copy()\n        X_val_copy[\"Deck\"] = cabin_data.apply(lambda x: x[0])\n        X_val_copy[\"RoomNum\"] = cabin_data.apply(lambda x: x[1])\n        X_val_copy[\"Side\"] = cabin_data.apply(lambda x: x[2])\n        \n        # Extract group ID and person ID\n        X_val_copy[\"GroupId\"] = X_val_copy[\"PassengerId\"].apply(extract_group_id)\n        X_val_copy[\"PersonId\"] = X_val_copy[\"PassengerId\"].apply(extract_person_id)\n        \n        # Compute group size using training set mapping (default to 1 for unseen groups)\n        X_val_copy[\"GroupSize\"] = X_val_copy[\"GroupId\"].map(pipe.group_sizes).fillna(1)\n        \n        # Fill missing spending with 0\n        for col in SPENDING:\n            X_val_copy[col] = X_val_copy[col].fillna(0)\n        \n        # Compute total spending and binary spending flag\n        X_val_copy[\"TotalSpending\"] = X_val_copy[SPENDING].sum(axis=1)\n        X_val_copy[\"AnySpending\"] = (X_val_copy[\"TotalSpending\"] > 0).astype(int)\n        \n        # Handle CryoSleep and VIP\n        X_val_copy[\"CryoSleep\"] = X_val_copy[\"CryoSleep\"].fillna(\"Unknown\").astype(str)\n        X_val_copy[\"VIP\"] = X_val_copy[\"VIP\"].fillna(\"Unknown\").astype(str)\n        \n        return pipe.predict(X_val_copy[feature_cols]).astype(bool)\n    \n    return predict\n\n\nif __name__ == \"__main__\":\n    predict_fn = build_predict_fn()\n    score = prepare.evaluate(predict_fn)\n    print(f\"VAL_ACCURACY: {score:.4f}\")\n```\n</code>\n\n<notes_append>\nIteration 7: Added PersonId (ordinal position within group from PassengerId) and AnySpending (binary flag for whether passenger spent money at all) as cheap features to test whether order within group and binary spending behaviour improve signal beyond 0.7901.\n</notes_append>", "reflection": "The current best score is 0.7901, achieved in iteration 2 and maintained through iterations 4–6. The last run (iteration 6) added TotalSpending and GroupSize but did not improve the score, suggesting those features are not adding signal. The logistic regression pipeline with cabin parsing, categorical encoding, and spending-as-zero is stable and robust. I need to look for structural patterns in the data that have not yet been exploited—either missing interactions, better feature representations, or better handling of missing values in Age.", "observations": ["The score has plateaued at 0.7901 for the last three iterations despite adding GroupSize and TotalSpending, suggesting those aggregate features are redundant or noisy.", "Age is a continuous numeric column with missing values; currently imputed with median. The missingness pattern and its relationship to the target have not been explicitly explored.", "The spending columns (RoomService, FoodCourt, etc.) are being filled with 0 for missing values, which works well. However, no feature has been created to track whether a passenger spent money at all (a binary \"spent\" flag), which might be predictive independently of the amount.", "Cabin-derived features (Deck, RoomNum, Side) are included, but we have not tested whether individual deck locations or side (Port/Starboard) correlate with transportation in a structured way.", "The PassengerId structure ('GroupId_PersonId') encodes group membership, and we extract GroupId and GroupSize, but we ignore the PersonId suffix, which might encode order within the group (e.g., first/last to board)."], "hypothesis": "Creating a binary \"AnySpending\" feature (1 if total spending > 0, else 0) will improve accuracy because spending behaviour may be a strong binary signal independent of amount. Additionally, extracting PersonId from PassengerId and treating it as an ordinal feature (order within group) may capture sequential boarding or group dynamics not yet captured.", "plan": "I will add two simple binary/ordinal features: (1) AnySpending = 1 if TotalSpending > 0, else 0; (2) PersonId = the second component of PassengerId (split on underscore), treated as a numeric ordinal feature. Both are cheap to compute and test whether binary spending behaviour and position within group improve the score beyond 0.7901.", "code": "\"\"\"\ntrain.py — logistic regression with cabin parsing, group features, and simple binary/ordinal features.\n\"\"\"\nimport sys, pathlib\nsys.path.insert(0, str(pathlib.Path(__file__).resolve().parent.parent))\n\nimport pandas as pd\nimport numpy as np\nfrom sklearn.linear_model import LogisticRegression\nfrom sklearn.impute import SimpleImputer\nfrom sklearn.pipeline import Pipeline\nfrom sklearn.preprocessing import StandardScaler, OneHotEncoder\nfrom sklearn.compose import ColumnTransformer\n\nimport prepare\n\nNUMERIC = [\"Age\", \"RoomService\", \"FoodCourt\", \"ShoppingMall\", \"Spa\", \"VRDeck\"]\nCATEGORICAL = [\"HomePlanet\", \"Destination\", \"CryoSleep\", \"VIP\"]\nSPENDING = [\"RoomService\", \"FoodCourt\", \"ShoppingMall\", \"Spa\", \"VRDeck\"]\n\n\ndef parse_cabin(cabin_str):\n    \"\"\"Parse Cabin 'F/0/S' into deck, room_num, side.\"\"\"\n    if pd.isna(cabin_str):\n        return np.nan, np.nan, np.nan\n    parts = str(cabin_str).split(\"/\")\n    if len(parts) == 3:\n        return parts[0], int(parts[1]) if parts[1].isdigit() else np.nan, parts[2]\n    return np.nan, np.nan, np.nan\n\n\ndef extract_group_id(passenger_id):\n    \"\"\"Extract group ID from PassengerId (e.g., '0001_01' -> '0001').\"\"\"\n    if pd.isna(passenger_id):\n        return np.nan\n    return str(passenger_id).split(\"_\")[0]\n\n\ndef extract_person_id(passenger_id):\n    \"\"\"Extract person ID (order within group) from PassengerId (e.g., '0001_01' -> 1).\"\"\"\n    if pd.isna(passenger_id):\n        return np.nan\n    parts = str(passenger_id).split(\"_\")\n    if len(parts) == 2:\n        try:\n            return int(parts[1])\n        except ValueError:\n            return np.nan\n    return np.nan\n\n\ndef build_predict_fn():\n    train_df, _ = prepare.load_split()\n    \n    # Parse Cabin into Deck, RoomNum, Side\n    cabin_data = train_df[\"Cabin\"].apply(parse_cabin)\n    train_df[\"Deck\"] = cabin_data.apply(lambda x: x[0])\n    train_df[\"RoomNum\"] = cabin_data.apply(lambda x: x[1])\n    train_df[\"Side\"] = cabin_data.apply(lambda x: x[2])\n    \n    # Extract group ID and person ID from PassengerId\n    train_df[\"GroupId\"] = train_df[\"PassengerId\"].apply(extract_group_id)\n    train_df[\"PersonId\"] = train_df[\"PassengerId\"].apply(extract_person_id)\n    \n    # Compute group size for each passenger\n    group_sizes = train_df[\"GroupId\"].value_counts().to_dict()\n    train_df[\"GroupSize\"] = train_df[\"GroupId\"].map(group_sizes).fillna(1)\n    \n    # Fill missing values in spending columns with 0 (indicates not spent)\n    for col in SPENDING:\n        train_df[col] = train_df[col].fillna(0)\n    \n    # Compute total spending and binary spending flag\n    train_df[\"TotalSpending\"] = train_df[SPENDING].sum(axis=1)\n    train_df[\"AnySpending\"] = (train_df[\"TotalSpending\"] > 0).astype(int)\n    \n    # Convert CryoSleep and VIP to numeric (handle NaN explicitly)\n    train_df[\"CryoSleep\"] = train_df[\"CryoSleep\"].fillna(\"Unknown\").astype(str)\n    train_df[\"VIP\"] = train_df[\"VIP\"].fillna(\"Unknown\").astype(str)\n    \n    # Build feature set: include both individual spending and aggregate spending\n    feature_cols = [\"Age\", \"PersonId\", \"TotalSpending\", \"AnySpending\"] + SPENDING + CATEGORICAL + [\"Deck\", \"RoomNum\", \"Side\", \"GroupId\", \"GroupSize\"]\n    X = train_df[feature_cols]\n    y = train_df[\"Transported\"].astype(int)\n    \n    # Define preprocessing for numeric and categorical columns\n    numeric_transformer = Pipeline([\n        (\"imputer\", SimpleImputer(strategy=\"median\")),\n        (\"scaler\", StandardScaler()),\n    ])\n    \n    categorical_transformer = Pipeline([\n        (\"imputer\", SimpleImputer(strategy=\"most_frequent\")),\n        (\"onehot\", OneHotEncoder(handle_unknown=\"ignore\", sparse_output=False)),\n    ])\n    \n    preprocessor = ColumnTransformer([\n        (\"num\", numeric_transformer, [\"Age\", \"PersonId\", \"TotalSpending\", \"AnySpending\", \"RoomNum\", \"GroupSize\"] + SPENDING),\n        (\"cat\", categorical_transformer, CATEGORICAL + [\"Deck\", \"Side\", \"GroupId\"]),\n    ])\n    \n    pipe = Pipeline([\n        (\"preprocessor\", preprocessor),\n        (\"clf\", LogisticRegression(max_iter=1000)),\n    ])\n    \n    pipe.fit(X, y)\n    \n    # Store group_sizes mapping for use in predict function\n    pipe.group_sizes = group_sizes\n    \n    def predict(X_val):\n        # Parse Cabin in validation set\n        cabin_data = X_val[\"Cabin\"].apply(parse_cabin)\n        X_val_copy = X_val.copy()\n        X_val_copy[\"Deck\"] = cabin_data.apply(lambda x: x[0])\n        X_val_copy[\"RoomNum\"] = cabin_data.apply(lambda x: x[1])\n        X_val_copy[\"Side\"] = cabin_data.apply(lambda x: x[2])\n        \n        # Extract group ID and person ID\n        X_val_copy[\"GroupId\"] = X_val_copy[\"PassengerId\"].apply(extract_group_id)\n        X_val_copy[\"PersonId\"] = X_val_copy[\"PassengerId\"].apply(extract_person_id)\n        \n        # Compute group size using training set mapping (default to 1 for unseen groups)\n        X_val_copy[\"GroupSize\"] = X_val_copy[\"GroupId\"].map(pipe.group_sizes).fillna(1)\n        \n        # Fill missing spending with 0\n        for col in SPENDING:\n            X_val_copy[col] = X_val_copy[col].fillna(0)\n        \n        # Compute total spending and binary spending flag\n        X_val_copy[\"TotalSpending\"] = X_val_copy[SPENDING].sum(axis=1)\n        X_val_copy[\"AnySpending\"] = (X_val_copy[\"TotalSpending\"] > 0).astype(int)\n        \n        # Handle CryoSleep and VIP\n        X_val_copy[\"CryoSleep\"] = X_val_copy[\"CryoSleep\"].fillna(\"Unknown\").astype(str)\n        X_val_copy[\"VIP\"] = X_val_copy[\"VIP\"].fillna(\"Unknown\").astype(str)\n        \n        return pipe.predict(X_val_copy[feature_cols]).astype(bool)\n    \n    return predict\n\n\nif __name__ == \"__main__\":\n    predict_fn = build_predict_fn()\n    score = prepare.evaluate(predict_fn)\n    print(f\"VAL_ACCURACY: {score:.4f}\")\n", "notes_append": "Iteration 7: Added PersonId (ordinal position within group from PassengerId) and AnySpending (binary flag for whether passenger spent money at all) as cheap features to test whether order within group and binary spending behaviour improve signal beyond 0.7901.", "stdout": "VAL_ACCURACY: 0.7884\n", "stderr": "", "returncode": 0, "score": 0.7884, "kept": false, "status": "reverted", "commit_hash": null, "input_tokens": 3836, "output_tokens": 2523, "cost_usd": 0.016451}
