{"iteration": 1, "timestamp": "2026-05-08T22:02:32", "previous_best": 0.8235, "duration_seconds": 6.37, "agent_response_raw": "<reflection>\nIteration 58's hyperparameter tuning held at 0.8235, meaning the grid search found no improvement. This suggests that the model capacity (depth, n_estimators, learning_rate) is not the bottleneck — the issue is likely either the feature set or the inherent separability of the data with the current features. I need to step back and examine the actual data structure more carefully to find new signal.\n</reflection>\n\n<observations>\n- The notes show a pattern of feature engineering attempts (iters 53-56) that all regressed or held flat, followed by a revert to the baseline (iter 57). This suggests the baseline's simplicity is capturing something important that complex interactions are obscuring.\n- Iteration 58 tuned XGBoost hyperparameters on the baseline feature set and got no gain, ruling out model underfitting as the cause of the 0.8235 plateau.\n- The hint about identifier columns suggests PassengerId encodes group structure. Current features (GroupSize, GroupMedianSpending) are minimal; I haven't explored whether the passenger ID format itself (e.g., sequence within group) or the distribution of group sizes yields signal.\n- No exploration yet of the raw missingness patterns in the data. The notes mention \"missing values may not be missing at random\" — looking at *when* values are missing (not just flagging it) might reveal structure.\n- I should do exploratory data analysis (EDA) on the training set itself: check class balance, feature correlations, missing data patterns, and group structure distributions before proposing the next feature.\n</observations>\n\n<hypothesis>\nThe current feature set is missing simple but powerful signal that exists in the raw data. By examining the actual training data distributions, correlations, and missingness patterns, I will identify one or two concrete new features or transformations that capture structure the current baseline overlooks.\n</hypothesis>\n\n<plan>\nBefore proposing a new feature engineering step, I will add explicit exploratory code to `train.py` that prints summary statistics, missing data patterns, feature correlations, and group structure. This will be run once per training, printed to stdout, and then removed in the next iteration once insights are gathered. The goal is to spot low-hanging fruit (e.g., a feature with high correlation to target, a non-random missingness pattern, an underutilized identifier structure) that can be engineered cleanly.\n</plan>\n\n<code>\n```python\n\"\"\"\ntrain.py — Iteration 59: Exploratory Data Analysis (EDA).\nPrint detailed statistics on the training set to identify structural features missed by baseline.\nRun EDA, gather insights, then revert to a feature-based improvement in next iteration.\n\"\"\"\nimport sys, pathlib\nsys.path.insert(0, str(pathlib.Path(__file__).resolve().parent.parent))\n\nimport pandas as pd\nimport numpy as np\nimport xgboost as xgb\nfrom sklearn.impute import SimpleImputer\nfrom sklearn.pipeline import Pipeline\nfrom sklearn.preprocessing import StandardScaler, OneHotEncoder\nfrom sklearn.compose import ColumnTransformer\nfrom sklearn.model_selection import cross_val_score\n\nimport prepare\n\nNUMERIC = [\"Age\", \"RoomService\", \"FoodCourt\", \"ShoppingMall\", \"Spa\", \"VRDeck\"]\nCATEGORICAL = [\"HomePlanet\", \"Destination\", \"CryoSleep\", \"VIP\"]\nSPENDING = [\"RoomService\", \"FoodCourt\", \"ShoppingMall\", \"Spa\", \"VRDeck\"]\n\n\ndef parse_cabin(cabin_str):\n    \"\"\"Parse Cabin 'F/0/S' into deck, room_num, side.\"\"\"\n    if pd.isna(cabin_str):\n        return np.nan, np.nan, np.nan\n    parts = str(cabin_str).split(\"/\")\n    if len(parts) == 3:\n        return parts[0], int(parts[1]) if parts[1].isdigit() else np.nan, parts[2]\n    return np.nan, np.nan, np.nan\n\n\ndef extract_group_id(passenger_id):\n    \"\"\"Extract group ID from PassengerId (e.g., '0001_01' -> '0001').\"\"\"\n    if pd.isna(passenger_id):\n        return np.nan\n    return str(passenger_id).split(\"_\")[0]\n\n\ndef extract_passenger_num(passenger_id):\n    \"\"\"Extract passenger number within group (e.g., '0001_01' -> 1).\"\"\"\n    if pd.isna(passenger_id):\n        return np.nan\n    try:\n        return int(str(passenger_id).split(\"_\")[1])\n    except (IndexError, ValueError):\n        return np.nan\n\n\ndef engineer_features(df):\n    \"\"\"Engineer spending and spending-cryo interaction features.\"\"\"\n    df_copy = df.copy()\n    \n    # Track which rows have any spending data recorded\n    spending_recorded = ~df_copy[SPENDING].isna().any(axis=1)\n    df_copy[\"Spending_Recorded\"] = spending_recorded.astype(int)\n    \n    # Fill missing spending with median per HomePlanet group\n    for col in SPENDING:\n        missing_mask = df_copy[col].isna()\n        if missing_mask.any():\n            group_medians = df_copy.groupby(\"HomePlanet\")[col].median()\n            df_copy.loc[missing_mask, col] = df_copy.loc[missing_mask, \"HomePlanet\"].map(group_medians)\n            global_median = df_copy[col].median()\n            df_copy[col] = df_copy[col].fillna(global_median)\n    \n    # Total spending\n    df_copy[\"TotalSpending\"] = df_copy[SPENDING].sum(axis=1)\n    \n    # Interaction: CryoSleep status and log spending\n    cryo_status = df_copy[\"CryoSleep\"].fillna(False)\n    log_spending = np.log1p(df_copy[\"TotalSpending\"])\n    df_copy[\"CryoSleep_LogSpending\"] = (\n        (cryo_status == True) * log_spending\n    )\n    \n    return df_copy\n\n\ndef add_group_features(df):\n    \"\"\"Add group-level aggregate features based on PassengerId group.\"\"\"\n    df_copy = df.copy()\n    \n    # Extract group ID\n    df_copy[\"GroupId\"] = df_copy[\"PassengerId\"].apply(extract_group_id)\n    \n    # Compute group size\n    group_sizes = df_copy.groupby(\"GroupId\").size()\n    df_copy[\"GroupSize\"] = df_copy[\"GroupId\"].map(group_sizes)\n    \n    # Compute group median total spending\n    group_median_spending = df_copy.groupby(\"GroupId\")[\"TotalSpending\"].median()\n    df_copy[\"GroupMedianSpending\"] = df_copy[\"GroupId\"].map(group_median_spending)\n    \n    return df_copy\n\n\ndef run_eda(df):\n    \"\"\"Print exploratory statistics to understand data structure.\"\"\"\n    print(\"\\n=== EDA SUMMARY ===\")\n    \n    # Class balance\n    target_dist = df[\"Transported\"].value_counts()\n    print(f\"\\nClass distribution:\\n{target_dist}\\nRatio (False:True) = {target_dist[False]:.0f}:{target_dist[True]:.0f}\")\n    \n    # Missing data\n    print(\"\\nMissing data (count, pct):\")\n    missing = df.isnull().sum()\n    missing = missing[missing > 0].sort_values(ascending=False)\n    for col, count in missing.items():\n        pct = 100 * count / len(df)\n        print(f\"  {col}: {count} ({pct:.1f}%)\")\n    \n    # Numeric correlations with target\n    print(\"\\nNumeric feature correlations with Transported:\")\n    for col in NUMERIC:\n        if col in df.columns:\n            corr = df[col].corr(df[\"Transported\"].astype(int))\n            print(f\"  {col}: {corr:.4f}\")\n    \n    # Categorical distributions\n    print(\"\\nCategorical feature distributions (counts per category):\")\n    for col in CATEGORICAL:\n        if col in df.columns:\n            print(f\"  {col}:\")\n            counts = df[col].value_counts(dropna=False)\n            for cat, count in counts.items():\n                print(f\"    {cat}: {count}\")\n    \n    # Cabin parsing\n    cabin_data = df[\"Cabin\"].apply(parse_cabin)\n    decks = cabin_data.apply(lambda x: x[0])\n    print(f\"\\nDeck distribution (counts):\")\n    deck_counts = decks.value_counts(dropna=False)\n    for deck, count in deck_counts.items():\n        print(f\"  {deck}: {count}\")\n    \n    # Group size distribution\n    group_ids = df[\"PassengerId\"].apply(extract_group_id)\n    group_sizes = group_ids.value_counts()\n    print(f\"\\nGroup size distribution:\")\n    print(f\"  Min: {group_sizes.min()}, Max: {group_sizes.max()}, Mean: {group_sizes.mean():.2f}\")\n    print(f\"  Count: {group_sizes.value_counts().to_dict()}\")\n    \n    # Passenger number within group\n    pax_nums = df[\"PassengerId\"].apply(extract_passenger_num)\n    print(f\"\\nPassenger number within group (unique values: {pax_nums.nunique()})\")\n    print(f\"  Distribution: {pax_nums.value_counts().sort_index().to_dict()}\")\n    \n    # Spending pattern by Transported\n    print(\"\\nSpending by Transported status:\")\n    for spending_col in SPENDING:\n        has_spending = (df[spending_col] > 0).sum()\n        transported_with_spending = df[df[\"Transported\"] & (df[spending_col] > 0)].shape[0]\n        not_transported_with_spending = df[~df[\"Transported\"] & (df[spending_col] > 0)].shape[0]\n        print(f\"  {spending_col}: {has_spending} total, {transported_with_spending} T, {not_transported_with_spending} NT\")\n    \n    # HomePlanet × Destination cross-tabulation\n    print(\"\\nHomePlanet × Destination cross-tabulation (counts):\")\n    cross = pd.crosstab(df[\"HomePlanet\"], df[\"Destination\"], margins=False)\n    print(cross)\n    \n    print(\"\\n=== END EDA ===\\n\")\n\n\ndef build_predict_fn():\n    train_df, _ = prepare.load_split()\n    \n    # Parse Cabin into Deck, RoomNum, Side\n    cabin_data = train_df[\"Cabin\"].apply(parse_cabin)\n    train_df[\"Deck\"] = cabin_data.apply(lambda x: x[0])\n    train_df[\"RoomNum\"] = cabin_data.apply(lambda x: x[1])\n    train_df[\"Side\"] = cabin_data.apply(lambda x: x[2])\n    \n    # Engineer features\n    train_df = engineer_features(train_df)\n    \n    # Add group-level features\n    train_df = add_group_features(train_df)\n    \n    # Run EDA before model building\n    run_eda(train_df)\n    \n    # Create explicit missingness flags for CryoSleep and VIP\n    train_df[\"CryoSleep_Missing\"] = train_df[\"CryoSleep\"].isna().astype(int)\n    train_df[\"VIP_Missing\"] = train_df[\"VIP\"].isna().astype(int)\n    \n    # Convert CryoSleep and VIP to string for categorical encoding\n    train_df[\"CryoSleep\"] = train_df[\"CryoSleep\"].fillna(\"Unknown\").astype(str)\n    train_df[\"VIP\"] = train_df[\"VIP\"].fillna(\"Unknown\").astype(str)\n    \n    # Build feature set\n    feature_cols = (\n        [\"Age\"] + SPENDING + [\"TotalSpending\", \"CryoSleep_LogSpending\", \"Spending_Recorded\"] +\n        CATEGORICAL + \n        [\"Deck\", \"RoomNum\", \"Side\", \"GroupId\"] + \n        [\"CryoSleep_Missing\", \"VIP_Missing\"] +\n        [\"GroupSize\", \"GroupMedianSpending\"]\n    )\n    X = train_df[feature_cols]\n    y = train_df[\"Transported\"].astype(int)\n    \n    # Define preprocessing\n    numeric_transformer = Pipeline([\n        (\"imputer\", SimpleImputer(strategy=\"median\")),\n        (\"scaler\", StandardScaler()),\n    ])\n    \n    categorical_transformer = Pipeline([\n        (\"imputer\", SimpleImputer(strategy=\"most_frequent\")),\n        (\"onehot\", OneHotEncoder(handle_unknown=\"ignore\", sparse_output=False)),\n    ])\n    \n    numeric_feature_cols = (\n        [\"Age\", \"RoomNum\", \"CryoSleep_Missing\", \"VIP_Missing\", \"Spending_Recorded\"] + \n        SPENDING + [\"TotalSpending\", \"CryoSleep_LogSpending\"] +\n        [\"GroupSize\", \"GroupMedianSpending\"]\n    )\n    categorical_feature_cols = CATEGORICAL + [\"Deck\", \"Side\", \"GroupId\"]\n    \n    preprocessor = ColumnTransformer([\n        (\"num\", numeric_transformer, numeric_feature_cols),\n        (\"cat\", categorical_transformer, categorical_feature_cols),\n    ])\n    \n    # Use best config from iter 58\n    pipe = Pipeline([\n        (\"preprocessor\", preprocessor),\n        (\"clf\", xgb.XGBClassifier(max_depth=6, n_estimators=100, learning_rate=0.1, random_state=42, verbosity=0)),\n    ])\n    \n    pipe.fit(X, y)\n    \n    def predict(X_val):\n        cabin_data = X_val[\"Cabin\"].apply(parse_cabin)\n        X_val_copy = X_val.copy()\n        X_val_copy[\"Deck\"] = cabin_data.apply(lambda x: x[0])\n        X_val_copy[\"RoomNum\"] = cabin_data.apply(lambda x: x[1])\n        X_val_copy[\"Side\"] = cabin_data.apply(lambda x: x[2])\n        \n        # Engineer features\n        X_val_copy = engineer_features(X_val_copy)\n        \n        # Add group-level features from training stats\n        X_val_copy[\"GroupId\"] = X_val_copy[\"PassengerId\"].apply(extract_group_id)\n        X_val_copy[\"GroupSize\"] = X_val_copy[\"GroupId\"].map(pd.Series(\n            train_df.groupby(\"GroupId\").size().to_dict()\n        ))\n        X_val_copy[\"GroupMedianSpending\"] = X_val_copy[\"GroupId\"].map(pd.Series(\n            train_df.groupby(\"GroupId\")[\"TotalSpending\"].median().to_dict()\n        ))\n        \n        # Missingness flags\n        X_val_copy[\"CryoSleep_Missing\"] = X_val_copy[\"CryoSleep\"].isna().astype(int)\n        X_val_copy[\"VIP_Missing\"] = X_val_copy[\"VIP\"].isna().astype(int)\n        \n        # Handle CryoSleep and VIP\n        X_val_copy[\"CryoSleep\"] = X_val_copy[\"CryoSleep\"].fillna(\"Unknown\").astype(str)\n        X_val_copy[\"VIP\"] = X_val_copy[\"VIP\"].fillna(\"Unknown\").astype(str)\n        \n        return pipe.predict(X_val_copy[feature_cols]).astype(bool)\n    \n    return predict\n\n\nif __name__ == \"__main__\":\n    predict_fn = build_predict_fn()\n    score = prepare.evaluate(predict_fn)\n    print(f\"VAL_ACCURACY: {score:.4f}\")\n```\n</code>\n\n<notes_append>\nIteration 59: Added comprehensive EDA (class balance, missing data, numeric correlations, categorical distributions, Cabin/Deck/Group structure) to identify overlooked signal before proposing next feature. Testing whether data inspection reveals low-hanging fruit that previous iterations missed.\n</notes_append>", "reflection": "Iteration 58's hyperparameter tuning held at 0.8235, meaning the grid search found no improvement. This suggests that the model capacity (depth, n_estimators, learning_rate) is not the bottleneck — the issue is likely either the feature set or the inherent separability of the data with the current features. I need to step back and examine the actual data structure more carefully to find new signal.", "observations": ["The notes show a pattern of feature engineering attempts (iters 53-56) that all regressed or held flat, followed by a revert to the baseline (iter 57). This suggests the baseline's simplicity is capturing something important that complex interactions are obscuring.", "Iteration 58 tuned XGBoost hyperparameters on the baseline feature set and got no gain, ruling out model underfitting as the cause of the 0.8235 plateau.", "The hint about identifier columns suggests PassengerId encodes group structure. Current features (GroupSize, GroupMedianSpending) are minimal; I haven't explored whether the passenger ID format itself (e.g., sequence within group) or the distribution of group sizes yields signal.", "No exploration yet of the raw missingness patterns in the data. The notes mention \"missing values may not be missing at random\" — looking at *when* values are missing (not just flagging it) might reveal structure.", "I should do exploratory data analysis (EDA) on the training set itself: check class balance, feature correlations, missing data patterns, and group structure distributions before proposing the next feature."], "hypothesis": "The current feature set is missing simple but powerful signal that exists in the raw data. By examining the actual training data distributions, correlations, and missingness patterns, I will identify one or two concrete new features or transformations that capture structure the current baseline overlooks.", "plan": "Before proposing a new feature engineering step, I will add explicit exploratory code to `train.py` that prints summary statistics, missing data patterns, feature correlations, and group structure. This will be run once per training, printed to stdout, and then removed in the next iteration once insights are gathered. The goal is to spot low-hanging fruit (e.g., a feature with high correlation to target, a non-random missingness pattern, an underutilized identifier structure) that can be engineered cleanly.", "code": "\"\"\"\ntrain.py — Iteration 59: Exploratory Data Analysis (EDA).\nPrint detailed statistics on the training set to identify structural features missed by baseline.\nRun EDA, gather insights, then revert to a feature-based improvement in next iteration.\n\"\"\"\nimport sys, pathlib\nsys.path.insert(0, str(pathlib.Path(__file__).resolve().parent.parent))\n\nimport pandas as pd\nimport numpy as np\nimport xgboost as xgb\nfrom sklearn.impute import SimpleImputer\nfrom sklearn.pipeline import Pipeline\nfrom sklearn.preprocessing import StandardScaler, OneHotEncoder\nfrom sklearn.compose import ColumnTransformer\nfrom sklearn.model_selection import cross_val_score\n\nimport prepare\n\nNUMERIC = [\"Age\", \"RoomService\", \"FoodCourt\", \"ShoppingMall\", \"Spa\", \"VRDeck\"]\nCATEGORICAL = [\"HomePlanet\", \"Destination\", \"CryoSleep\", \"VIP\"]\nSPENDING = [\"RoomService\", \"FoodCourt\", \"ShoppingMall\", \"Spa\", \"VRDeck\"]\n\n\ndef parse_cabin(cabin_str):\n    \"\"\"Parse Cabin 'F/0/S' into deck, room_num, side.\"\"\"\n    if pd.isna(cabin_str):\n        return np.nan, np.nan, np.nan\n    parts = str(cabin_str).split(\"/\")\n    if len(parts) == 3:\n        return parts[0], int(parts[1]) if parts[1].isdigit() else np.nan, parts[2]\n    return np.nan, np.nan, np.nan\n\n\ndef extract_group_id(passenger_id):\n    \"\"\"Extract group ID from PassengerId (e.g., '0001_01' -> '0001').\"\"\"\n    if pd.isna(passenger_id):\n        return np.nan\n    return str(passenger_id).split(\"_\")[0]\n\n\ndef extract_passenger_num(passenger_id):\n    \"\"\"Extract passenger number within group (e.g., '0001_01' -> 1).\"\"\"\n    if pd.isna(passenger_id):\n        return np.nan\n    try:\n        return int(str(passenger_id).split(\"_\")[1])\n    except (IndexError, ValueError):\n        return np.nan\n\n\ndef engineer_features(df):\n    \"\"\"Engineer spending and spending-cryo interaction features.\"\"\"\n    df_copy = df.copy()\n    \n    # Track which rows have any spending data recorded\n    spending_recorded = ~df_copy[SPENDING].isna().any(axis=1)\n    df_copy[\"Spending_Recorded\"] = spending_recorded.astype(int)\n    \n    # Fill missing spending with median per HomePlanet group\n    for col in SPENDING:\n        missing_mask = df_copy[col].isna()\n        if missing_mask.any():\n            group_medians = df_copy.groupby(\"HomePlanet\")[col].median()\n            df_copy.loc[missing_mask, col] = df_copy.loc[missing_mask, \"HomePlanet\"].map(group_medians)\n            global_median = df_copy[col].median()\n            df_copy[col] = df_copy[col].fillna(global_median)\n    \n    # Total spending\n    df_copy[\"TotalSpending\"] = df_copy[SPENDING].sum(axis=1)\n    \n    # Interaction: CryoSleep status and log spending\n    cryo_status = df_copy[\"CryoSleep\"].fillna(False)\n    log_spending = np.log1p(df_copy[\"TotalSpending\"])\n    df_copy[\"CryoSleep_LogSpending\"] = (\n        (cryo_status == True) * log_spending\n    )\n    \n    return df_copy\n\n\ndef add_group_features(df):\n    \"\"\"Add group-level aggregate features based on PassengerId group.\"\"\"\n    df_copy = df.copy()\n    \n    # Extract group ID\n    df_copy[\"GroupId\"] = df_copy[\"PassengerId\"].apply(extract_group_id)\n    \n    # Compute group size\n    group_sizes = df_copy.groupby(\"GroupId\").size()\n    df_copy[\"GroupSize\"] = df_copy[\"GroupId\"].map(group_sizes)\n    \n    # Compute group median total spending\n    group_median_spending = df_copy.groupby(\"GroupId\")[\"TotalSpending\"].median()\n    df_copy[\"GroupMedianSpending\"] = df_copy[\"GroupId\"].map(group_median_spending)\n    \n    return df_copy\n\n\ndef run_eda(df):\n    \"\"\"Print exploratory statistics to understand data structure.\"\"\"\n    print(\"\\n=== EDA SUMMARY ===\")\n    \n    # Class balance\n    target_dist = df[\"Transported\"].value_counts()\n    print(f\"\\nClass distribution:\\n{target_dist}\\nRatio (False:True) = {target_dist[False]:.0f}:{target_dist[True]:.0f}\")\n    \n    # Missing data\n    print(\"\\nMissing data (count, pct):\")\n    missing = df.isnull().sum()\n    missing = missing[missing > 0].sort_values(ascending=False)\n    for col, count in missing.items():\n        pct = 100 * count / len(df)\n        print(f\"  {col}: {count} ({pct:.1f}%)\")\n    \n    # Numeric correlations with target\n    print(\"\\nNumeric feature correlations with Transported:\")\n    for col in NUMERIC:\n        if col in df.columns:\n            corr = df[col].corr(df[\"Transported\"].astype(int))\n            print(f\"  {col}: {corr:.4f}\")\n    \n    # Categorical distributions\n    print(\"\\nCategorical feature distributions (counts per category):\")\n    for col in CATEGORICAL:\n        if col in df.columns:\n            print(f\"  {col}:\")\n            counts = df[col].value_counts(dropna=False)\n            for cat, count in counts.items():\n                print(f\"    {cat}: {count}\")\n    \n    # Cabin parsing\n    cabin_data = df[\"Cabin\"].apply(parse_cabin)\n    decks = cabin_data.apply(lambda x: x[0])\n    print(f\"\\nDeck distribution (counts):\")\n    deck_counts = decks.value_counts(dropna=False)\n    for deck, count in deck_counts.items():\n        print(f\"  {deck}: {count}\")\n    \n    # Group size distribution\n    group_ids = df[\"PassengerId\"].apply(extract_group_id)\n    group_sizes = group_ids.value_counts()\n    print(f\"\\nGroup size distribution:\")\n    print(f\"  Min: {group_sizes.min()}, Max: {group_sizes.max()}, Mean: {group_sizes.mean():.2f}\")\n    print(f\"  Count: {group_sizes.value_counts().to_dict()}\")\n    \n    # Passenger number within group\n    pax_nums = df[\"PassengerId\"].apply(extract_passenger_num)\n    print(f\"\\nPassenger numb