{"iteration": 6, "timestamp": "2026-05-08T22:00:57", "previous_best": 0.8235, "duration_seconds": 31.44, "agent_response_raw": "<reflection>\nThe current model has restored the baseline at 0.8235, which matches iteration 1. The notes show that iterations 54–56 attempted various feature engineering refinements (interactions, group cabin structure, per-category missingness flags) but all regressed. The strategy now should be to identify a single, high-confidence structural improvement rather than minor variants. Before adding new features, I should inspect the actual data and model behaviour to understand what signal remains unexploited.\n</reflection>\n\n<observations>\n- The baseline 0.8235 is stable and reproducible, but recent attempts to improve it (iterations 54–56) all regressed despite adding plausible features (interactions, group structure). This suggests the current feature set is already well-tuned and new features either add noise or are redundant with existing ones.\n- The notes mention that logistic regression (0.7930) regresses significantly versus XGBoost (0.8235), confirming that the model needs non-linear capacity; however, this is already satisfied by the current XGBoost with max_depth=6. Hyperparameter tuning may not be the bottleneck.\n- The dataset is small (~8,700 rows), which limits how much complex feature engineering helps; overfitting to training-set patterns is a real risk. The simple, clean feature set may actually be close to optimal for this scale.\n- I have not yet examined the validation split behaviour directly or looked at misclassified examples to understand what the model is missing. Before adding features, diagnostic inspection would be more efficient.\n- The hints mention that \"some columns encode multiple pieces of information\" and \"missing values may not be random\"—but previous attempts at parsing these (Cabin → Deck/Room/Side, interaction terms, per-category missingness) have not yielded gains. Either the signals are already captured or the hypothesis was wrong.\n</observations>\n\n<hypothesis>\nThe model is underfitting on the validation set despite having reasonable features. Increasing XGBoost model capacity (max_depth, n_estimators) or adjusting regularization (subsample, colsample_bytree) will uncover signal that the current shallow tree cannot capture, improving validation accuracy beyond 0.8235.\n</hypothesis>\n\n<plan>\nPerform a focused hyperparameter grid search over max_depth, n_estimators, and learning_rate using cross-validation on the training set. This will test whether the current XGBoost configuration is undershooting. Keep all feature engineering identical; isolate the effect of model capacity. Run a quick 3–5 point grid to avoid timeout, then adopt the best configuration.\n</plan>\n\n<code>\n```python\n\"\"\"\ntrain.py — Iteration 58: Hyperparameter tuning for XGBoost.\nTest whether current max_depth=6 is undershooting; search (4,6,8) x (100,150) x (0.05,0.1,0.15).\nUse cross-validation on training set to select best config, then retrain and evaluate.\n\"\"\"\nimport sys, pathlib\nsys.path.insert(0, str(pathlib.Path(__file__).resolve().parent.parent))\n\nimport pandas as pd\nimport numpy as np\nimport xgboost as xgb\nfrom sklearn.impute import SimpleImputer\nfrom sklearn.pipeline import Pipeline\nfrom sklearn.preprocessing import StandardScaler, OneHotEncoder\nfrom sklearn.compose import ColumnTransformer\nfrom sklearn.model_selection import cross_val_score\n\nimport prepare\n\nNUMERIC = [\"Age\", \"RoomService\", \"FoodCourt\", \"ShoppingMall\", \"Spa\", \"VRDeck\"]\nCATEGORICAL = [\"HomePlanet\", \"Destination\", \"CryoSleep\", \"VIP\"]\nSPENDING = [\"RoomService\", \"FoodCourt\", \"ShoppingMall\", \"Spa\", \"VRDeck\"]\n\n\ndef parse_cabin(cabin_str):\n    \"\"\"Parse Cabin 'F/0/S' into deck, room_num, side.\"\"\"\n    if pd.isna(cabin_str):\n        return np.nan, np.nan, np.nan\n    parts = str(cabin_str).split(\"/\")\n    if len(parts) == 3:\n        return parts[0], int(parts[1]) if parts[1].isdigit() else np.nan, parts[2]\n    return np.nan, np.nan, np.nan\n\n\ndef extract_group_id(passenger_id):\n    \"\"\"Extract group ID from PassengerId (e.g., '0001_01' -> '0001').\"\"\"\n    if pd.isna(passenger_id):\n        return np.nan\n    return str(passenger_id).split(\"_\")[0]\n\n\ndef engineer_features(df):\n    \"\"\"Engineer spending and spending-cryo interaction features.\"\"\"\n    df_copy = df.copy()\n    \n    # Track which rows have any spending data recorded\n    spending_recorded = ~df_copy[SPENDING].isna().any(axis=1)\n    df_copy[\"Spending_Recorded\"] = spending_recorded.astype(int)\n    \n    # Fill missing spending with median per HomePlanet group\n    for col in SPENDING:\n        missing_mask = df_copy[col].isna()\n        if missing_mask.any():\n            group_medians = df_copy.groupby(\"HomePlanet\")[col].median()\n            df_copy.loc[missing_mask, col] = df_copy.loc[missing_mask, \"HomePlanet\"].map(group_medians)\n            global_median = df_copy[col].median()\n            df_copy[col] = df_copy[col].fillna(global_median)\n    \n    # Total spending\n    df_copy[\"TotalSpending\"] = df_copy[SPENDING].sum(axis=1)\n    \n    # Interaction: CryoSleep status and log spending\n    cryo_status = df_copy[\"CryoSleep\"].fillna(False)\n    log_spending = np.log1p(df_copy[\"TotalSpending\"])\n    df_copy[\"CryoSleep_LogSpending\"] = (\n        (cryo_status == True) * log_spending\n    )\n    \n    return df_copy\n\n\ndef add_group_features(df):\n    \"\"\"Add group-level aggregate features based on PassengerId group.\"\"\"\n    df_copy = df.copy()\n    \n    # Extract group ID\n    df_copy[\"GroupId\"] = df_copy[\"PassengerId\"].apply(extract_group_id)\n    \n    # Compute group size\n    group_sizes = df_copy.groupby(\"GroupId\").size()\n    df_copy[\"GroupSize\"] = df_copy[\"GroupId\"].map(group_sizes)\n    \n    # Compute group median total spending\n    group_median_spending = df_copy.groupby(\"GroupId\")[\"TotalSpending\"].median()\n    df_copy[\"GroupMedianSpending\"] = df_copy[\"GroupId\"].map(group_median_spending)\n    \n    return df_copy\n\n\ndef build_predict_fn():\n    train_df, _ = prepare.load_split()\n    \n    # Parse Cabin into Deck, RoomNum, Side\n    cabin_data = train_df[\"Cabin\"].apply(parse_cabin)\n    train_df[\"Deck\"] = cabin_data.apply(lambda x: x[0])\n    train_df[\"RoomNum\"] = cabin_data.apply(lambda x: x[1])\n    train_df[\"Side\"] = cabin_data.apply(lambda x: x[2])\n    \n    # Engineer features\n    train_df = engineer_features(train_df)\n    \n    # Add group-level features\n    train_df = add_group_features(train_df)\n    \n    # Create explicit missingness flags for CryoSleep and VIP\n    train_df[\"CryoSleep_Missing\"] = train_df[\"CryoSleep\"].isna().astype(int)\n    train_df[\"VIP_Missing\"] = train_df[\"VIP\"].isna().astype(int)\n    \n    # Convert CryoSleep and VIP to string for categorical encoding\n    train_df[\"CryoSleep\"] = train_df[\"CryoSleep\"].fillna(\"Unknown\").astype(str)\n    train_df[\"VIP\"] = train_df[\"VIP\"].fillna(\"Unknown\").astype(str)\n    \n    # Build feature set\n    feature_cols = (\n        [\"Age\"] + SPENDING + [\"TotalSpending\", \"CryoSleep_LogSpending\", \"Spending_Recorded\"] +\n        CATEGORICAL + \n        [\"Deck\", \"RoomNum\", \"Side\", \"GroupId\"] + \n        [\"CryoSleep_Missing\", \"VIP_Missing\"] +\n        [\"GroupSize\", \"GroupMedianSpending\"]\n    )\n    X = train_df[feature_cols]\n    y = train_df[\"Transported\"].astype(int)\n    \n    # Define preprocessing\n    numeric_transformer = Pipeline([\n        (\"imputer\", SimpleImputer(strategy=\"median\")),\n        (\"scaler\", StandardScaler()),\n    ])\n    \n    categorical_transformer = Pipeline([\n        (\"imputer\", SimpleImputer(strategy=\"most_frequent\")),\n        (\"onehot\", OneHotEncoder(handle_unknown=\"ignore\", sparse_output=False)),\n    ])\n    \n    numeric_feature_cols = (\n        [\"Age\", \"RoomNum\", \"CryoSleep_Missing\", \"VIP_Missing\", \"Spending_Recorded\"] + \n        SPENDING + [\"TotalSpending\", \"CryoSleep_LogSpending\"] +\n        [\"GroupSize\", \"GroupMedianSpending\"]\n    )\n    categorical_feature_cols = CATEGORICAL + [\"Deck\", \"Side\", \"GroupId\"]\n    \n    preprocessor = ColumnTransformer([\n        (\"num\", numeric_transformer, numeric_feature_cols),\n        (\"cat\", categorical_transformer, categorical_feature_cols),\n    ])\n    \n    # Hyperparameter grid search using cross-validation\n    configs = [\n        {\"max_depth\": 4, \"n_estimators\": 100, \"learning_rate\": 0.1},\n        {\"max_depth\": 6, \"n_estimators\": 100, \"learning_rate\": 0.1},\n        {\"max_depth\": 8, \"n_estimators\": 100, \"learning_rate\": 0.1},\n        {\"max_depth\": 6, \"n_estimators\": 150, \"learning_rate\": 0.1},\n        {\"max_depth\": 6, \"n_estimators\": 100, \"learning_rate\": 0.15},\n    ]\n    \n    best_score = -np.inf\n    best_config = configs[1]  # default to current\n    \n    for config in configs:\n        pipe = Pipeline([\n            (\"preprocessor\", preprocessor),\n            (\"clf\", xgb.XGBClassifier(**config, random_state=42, verbosity=0)),\n        ])\n        \n        # 3-fold cross-validation on training set\n        cv_scores = cross_val_score(pipe, X, y, cv=3, scoring=\"accuracy\")\n        mean_cv = cv_scores.mean()\n        \n        if mean_cv > best_score:\n            best_score = mean_cv\n            best_config = config\n    \n    # Retrain with best config\n    pipe = Pipeline([\n        (\"preprocessor\", preprocessor),\n        (\"clf\", xgb.XGBClassifier(**best_config, random_state=42, verbosity=0)),\n    ])\n    \n    pipe.fit(X, y)\n    \n    def predict(X_val):\n        cabin_data = X_val[\"Cabin\"].apply(parse_cabin)\n        X_val_copy = X_val.copy()\n        X_val_copy[\"Deck\"] = cabin_data.apply(lambda x: x[0])\n        X_val_copy[\"RoomNum\"] = cabin_data.apply(lambda x: x[1])\n        X_val_copy[\"Side\"] = cabin_data.apply(lambda x: x[2])\n        \n        # Engineer features\n        X_val_copy = engineer_features(X_val_copy)\n        \n        # Add group-level features from training stats\n        X_val_copy[\"GroupId\"] = X_val_copy[\"PassengerId\"].apply(extract_group_id)\n        X_val_copy[\"GroupSize\"] = X_val_copy[\"GroupId\"].map(pd.Series(\n            train_df.groupby(\"GroupId\").size().to_dict()\n        ))\n        X_val_copy[\"GroupMedianSpending\"] = X_val_copy[\"GroupId\"].map(pd.Series(\n            train_df.groupby(\"GroupId\")[\"TotalSpending\"].median().to_dict()\n        ))\n        \n        # Missingness flags\n        X_val_copy[\"CryoSleep_Missing\"] = X_val_copy[\"CryoSleep\"].isna().astype(int)\n        X_val_copy[\"VIP_Missing\"] = X_val_copy[\"VIP\"].isna().astype(int)\n        \n        # Handle CryoSleep and VIP\n        X_val_copy[\"CryoSleep\"] = X_val_copy[\"CryoSleep\"].fillna(\"Unknown\").astype(str)\n        X_val_copy[\"VIP\"] = X_val_copy[\"VIP\"].fillna(\"Unknown\").astype(str)\n        \n        return pipe.predict(X_val_copy[feature_cols]).astype(bool)\n    \n    return predict\n\n\nif __name__ == \"__main__\":\n    predict_fn = build_predict_fn()\n    score = prepare.evaluate(predict_fn)\n    print(f\"VAL_ACCURACY: {score:.4f}\")\n```\n</code>\n\n<notes_append>\nIteration 58: Hyperparameter tuning on XGBoost. Hypothesis: current max_depth=6 may be undershooting; 3-fold CV grid search over (max_depth, n_estimators, learning_rate) to test whether model capacity is the bottleneck. Keeps all features constant; isolates effect of model configuration.\n</notes_append>", "reflection": "The current model has restored the baseline at 0.8235, which matches iteration 1. The notes show that iterations 54–56 attempted various feature engineering refinements (interactions, group cabin structure, per-category missingness flags) but all regressed. The strategy now should be to identify a single, high-confidence structural improvement rather than minor variants. Before adding new features, I should inspect the actual data and model behaviour to understand what signal remains unexploited.", "observations": ["The baseline 0.8235 is stable and reproducible, but recent attempts to improve it (iterations 54–56) all regressed despite adding plausible features (interactions, group structure). This suggests the current feature set is already well-tuned and new features either add noise or are redundant with existing ones.", "The notes mention that logistic regression (0.7930) regresses significantly versus XGBoost (0.8235), confirming that the model needs non-linear capacity; however, this is already satisfied by the current XGBoost with max_depth=6. Hyperparameter tuning may not be the bottleneck.", "The dataset is small (~8,700 rows), which limits how much complex feature engineering helps; overfitting to training-set patterns is a real risk. The simple, clean feature set may actually be close to optimal for this scale.", "I have not yet examined the validation split behaviour directly or looked at misclassified examples to understand what the model is missing. Before adding features, diagnostic inspection would be more efficient.", "The hints mention that \"some columns encode multiple pieces of information\" and \"missing values may not be random\"—but previous attempts at parsing these (Cabin → Deck/Room/Side, interaction terms, per-category missingness) have not yielded gains. Either the signals are already captured or the hypothesis was wrong."], "hypothesis": "The model is underfitting on the validation set despite having reasonable features. Increasing XGBoost model capacity (max_depth, n_estimators) or adjusting regularization (subsample, colsample_bytree) will uncover signal that the current shallow tree cannot capture, improving validation accuracy beyond 0.8235.", "plan": "Perform a focused hyperparameter grid search over max_depth, n_estimators, and learning_rate using cross-validation on the training set. This will test whether the current XGBoost configuration is undershooting. Keep all feature engineering identical; isolate the effect of model capacity. Run a quick 3–5 point grid to avoid timeout, then adopt the best configuration.", "code": "\"\"\"\ntrain.py — Iteration 58: Hyperparameter tuning for XGBoost.\nTest whether current max_depth=6 is undershooting; search (4,6,8) x (100,150) x (0.05,0.1,0.15).\nUse cross-validation on training set to select best config, then retrain and evaluate.\n\"\"\"\nimport sys, pathlib\nsys.path.insert(0, str(pathlib.Path(__file__).resolve().parent.parent))\n\nimport pandas as pd\nimport numpy as np\nimport xgboost as xgb\nfrom sklearn.impute import SimpleImputer\nfrom sklearn.pipeline import Pipeline\nfrom sklearn.preprocessing import StandardScaler, OneHotEncoder\nfrom sklearn.compose import ColumnTransformer\nfrom sklearn.model_selection import cross_val_score\n\nimport prepare\n\nNUMERIC = [\"Age\", \"RoomService\", \"FoodCourt\", \"ShoppingMall\", \"Spa\", \"VRDeck\"]\nCATEGORICAL = [\"HomePlanet\", \"Destination\", \"CryoSleep\", \"VIP\"]\nSPENDING = [\"RoomService\", \"FoodCourt\", \"ShoppingMall\", \"Spa\", \"VRDeck\"]\n\n\ndef parse_cabin(cabin_str):\n    \"\"\"Parse Cabin 'F/0/S' into deck, room_num, side.\"\"\"\n    if pd.isna(cabin_str):\n        return np.nan, np.nan, np.nan\n    parts = str(cabin_str).split(\"/\")\n    if len(parts) == 3:\n        return parts[0], int(parts[1]) if parts[1].isdigit() else np.nan, parts[2]\n    return np.nan, np.nan, np.nan\n\n\ndef extract_group_id(passenger_id):\n    \"\"\"Extract group ID from PassengerId (e.g., '0001_01' -> '0001').\"\"\"\n    if pd.isna(passenger_id):\n        return np.nan\n    return str(passenger_id).split(\"_\")[0]\n\n\ndef engineer_features(df):\n    \"\"\"Engineer spending and spending-cryo interaction features.\"\"\"\n    df_copy = df.copy()\n    \n    # Track which rows have any spending data recorded\n    spending_recorded = ~df_copy[SPENDING].isna().any(axis=1)\n    df_copy[\"Spending_Recorded\"] = spending_recorded.astype(int)\n    \n    # Fill missing spending with median per HomePlanet group\n    for col in SPENDING:\n        missing_mask = df_copy[col].isna()\n        if missing_mask.any():\n            group_medians = df_copy.groupby(\"HomePlanet\")[col].median()\n            df_copy.loc[missing_mask, col] = df_copy.loc[missing_mask, \"HomePlanet\"].map(group_medians)\n            global_median = df_copy[col].median()\n            df_copy[col] = df_copy[col].fillna(global_median)\n    \n    # Total spending\n    df_copy[\"TotalSpending\"] = df_copy[SPENDING].sum(axis=1)\n    \n    # Interaction: CryoSleep status and log spending\n    cryo_status = df_copy[\"CryoSleep\"].fillna(False)\n    log_spending = np.log1p(df_copy[\"TotalSpending\"])\n    df_copy[\"CryoSleep_LogSpending\"] = (\n        (cryo_status == True) * log_spending\n    )\n    \n    return df_copy\n\n\ndef add_group_features(df):\n    \"\"\"Add group-level aggregate features based on PassengerId group.\"\"\"\n    df_copy = df.copy()\n    \n    # Extract group ID\n    df_copy[\"GroupId\"] = df_copy[\"PassengerId\"].apply(extract_group_id)\n    \n    # Compute group size\n    group_sizes = df_copy.groupby(\"GroupId\").size()\n    df_copy[\"GroupSize\"] = df_copy[\"GroupId\"].map(group_sizes)\n    \n    # Compute group median total spending\n    group_median_spending = df_copy.groupby(\"GroupId\")[\"TotalSpending\"].median()\n    df_copy[\"GroupMedianSpending\"] = df_copy[\"GroupId\"].map(group_median_spending)\n    \n    return df_copy\n\n\ndef build_predict_fn():\n    train_df, _ = prepare.load_split()\n    \n    # Parse Cabin into Deck, RoomNum, Side\n    cabin_data = train_df[\"Cabin\"].apply(parse_cabin)\n    train_df[\"Deck\"] = cabin_data.apply(lambda x: x[0])\n    train_df[\"RoomNum\"] = cabin_data.apply(lambda x: x[1])\n    train_df[\"Side\"] = cabin_data.apply(lambda x: x[2])\n    \n    # Engineer features\n    train_df = engineer_features(train_df)\n    \n    # Add group-level features\n    train_df = add_group_features(train_df)\n    \n    # Create explicit missingness flags for CryoSleep and VIP\n    train_df[\"CryoSleep_Missing\"] = train_df[\"CryoSleep\"].isna().astype(int)\n    train_df[\"VIP_Missing\"] = train_df[\"VIP\"].isna().astype(int)\n    \n    # Convert CryoSleep and VIP to string for categorical encoding\n    train_df[\"CryoSleep\"] = train_df[\"CryoSleep\"].fillna(\"Unknown\").astype(str)\n    train_df[\"VIP\"] = train_df[\"VIP\"].fillna(\"Unknown\").astype(str)\n    \n    # Build feature set\n    feature_cols = (\n        [\"Age\"] + SPENDING + [\"TotalSpending\", \"CryoSleep_LogSpending\", \"Spending_Recorded\"] +\n        CATEGORICAL + \n        [\"Deck\", \"RoomNum\", \"Side\", \"GroupId\"] + \n        [\"CryoSleep_Missing\", \"VIP_Missing\"] +\n        [\"GroupSize\", \"GroupMedianSpending\"]\n    )\n    X = train_df[feature_cols]\n    y = train_df[\"Transported\"].astype(int)\n    \n    # Define preprocessing\n    numeric_transformer = Pipeline([\n        (\"imputer\", SimpleImputer(strategy=\"median\")),\n        (\"scaler\", StandardScaler()),\n    ])\n    \n    categorical_transformer = Pipeline([\n        (\"imputer\", SimpleImputer(strategy=\"most_frequent\")),\n        (\"onehot\", OneHotEncoder(handle_unknown=\"ignore\", sparse_output=False)),\n    ])\n    \n    numeric_feature_cols = (\n        [\"Age\", \"RoomNum\", \"CryoSleep_Missing\", \"VIP_Missing\", \"Spending_Recorded\"] + \n        SPENDING + [\"TotalSpending\", \"CryoSleep_LogSpending\"] +\n        [\"GroupSize\", \"GroupMedianSpending\"]\n    )\n    categorical_feature_cols = CATEGORICAL + [\"Deck\", \"Side\", \"GroupId\"]\n    \n    preprocessor = ColumnTransformer([\n        (\"num\", numeric_transformer, numeric_feature_cols),\n        (\"cat\", categorical_transformer, categorical_feature_cols),\n    ])\n    \n    # Hyperparameter grid search using cross-validation\n    configs = [\n        {\"max_depth\": 4, \"n_estimators\": 100, \"learning_rate\": 0.1},\n        {\"max_depth\": 6, \"n_estimators\": 100, \"learning_rate\": 0.1},\n        {\"max_depth\": 8, \"n_estimators\": 100, \"learning_rate\": 0.1},\n        {\"max_depth\": 6, \"n_estimators\": 150, \"learning_rate\": 0.1},\n        {\"max_depth\": 6, \"n_estimators\": 100, \"learning_rate\": 0.15},\n    ]\n    \n    best_score = -np.inf\n    best_config = configs[1]  # default to current\n    \n    for config in configs:\n        pipe = Pipeline([\n            (\"preprocessor\", preprocessor),\n            (\"clf\", xgb.XGBClassifier(**config, random_state=42, verbosity=0)),\n        ])\n        \n        # 3-fold cross-validation on training set\n        cv_scores = cross_val_score(pipe, X, y, cv=3, scoring=\"accuracy\")\n        mean_cv = cv_scores.mean()\n        \n        if mean_cv > best_score:\n            best_score = mean_cv\n            best_config = config\n    \n    # Retrain with best config\n    pipe = Pipeline([\n        (\"preprocessor\", preprocessor),\n        (\"clf\", xgb.XGBClassifier(**best_config, random_state=42, verbosity=0)),\n    ])\n    \n    pipe.fit(X, y)\n    \n    def predict(X_val):\n        cabin_data = X_val[\"Cabin\"].apply(parse_cabin)\n        X_val_copy = X_val.copy()\n        X_val_copy[\"Deck\"] = cabin_data.apply(lambda x: x[0])\n        X_val_copy[\"RoomNum\"] = cabin_data.apply(lambda x: x[1])\n        X_val_copy[\"Side\"] = cabin_data.apply(lambda x: x[2])\n        \n        # Engineer features\n        X_val_copy = engineer_features(X_val_copy)\n        \n        # Add group-level features from training stats\n        X_val_copy[\"GroupId\"] = X_val_copy[\"PassengerId\"].apply(extract_group_id)\n        X_val_copy[\"GroupSize\"] = X_val_copy[\"GroupId\"].map(pd.Series(\n            train_df.groupby(\"GroupId\").size().to_dict()\n        ))\n        X_val_copy[\"GroupMedianSpending\"] = X_val_copy[\"GroupId\"].map(pd.Series(\n      