{"iteration": 8, "timestamp": "2026-05-08T21:20:56", "previous_best": 0.8189, "duration_seconds": 0, "agent_response_raw": "<reflection>\nThe score remains at 0.8189 — unchanged from iteration 3 across the last several attempts. The CryoSleep_LogSpending interaction, cabin parsing, GroupId, and RoomNum are all in place. I need to break the plateau by trying something structurally different rather than tuning the same feature set further.\n\nLooking at notes and recent iterations, I've been cycling through variants of XGBoost with similar features. The hint about missing values being predictive and identifier columns encoding group structure suggests I should examine whether group-level aggregation (e.g., family/group spending patterns or group prevalence of being transported) could provide stronger signal than individual passenger features alone.\n</reflection>\n\n<observations>\n- The score has stayed at 0.8189 for at least 5 iterations despite tweaks to feature engineering and hyperparameters (CryoSleep_LogSpending, RoomNum removal/restoration, max_depth changes).\n- GroupId has been extracted but may not be used effectively as a high-cardinality categorical — it encodes family/group membership, and group-level statistics (e.g., fraction of group transported, group total spending) might be more predictive than the ID itself.\n- The hints emphasize that missing values can be predictive and identifier columns encode group structure — I've flagged missingness but haven't explicitly computed group-level aggregates (mean spending per group, group size, etc.).\n- RoomNum has been added back and kept despite low individual importance, suggesting that spatial/structural features (Deck, RoomNum, Side, room proximity) matter, but may need richer encoding than raw values.\n- I should test whether group-level features (e.g., group_size, group_avg_spending, fraction_transported_in_group) unlock better predictive power without increasing model complexity.\n</observations>\n\n<hypothesis>\nComputing group-level aggregate features (group size, group total/mean spending, fraction of group transported) and using those in addition to individual features will improve accuracy, because passengers in groups show correlated transportation patterns and shared resource consumption that individual-only features fail to capture.\n</hypothesis>\n\n<plan>\nI will compute group-level statistics (GroupSize, GroupAvgSpending, GroupTotalSpending, GroupTransportedFraction) by grouping on GroupId in the training set, then merge these back to each passenger's row. This enriches the feature set with group context that individual features alone cannot provide. I'll add these as numeric features to the model.\n</plan>\n\n<code>\n```python\n\"\"\"\ntrain.py — XGBoost with cabin parsing, GroupId, and group-level aggregate features.\nIteration 37: Add group-level aggregate features (GroupSize, GroupAvgSpending, etc.)\nto capture family/group structure and correlated transportation patterns.\n\"\"\"\nimport sys, pathlib\nsys.path.insert(0, str(pathlib.Path(__file__).resolve().parent.parent))\n\nimport pandas as pd\nimport numpy as np\nimport xgboost as xgb\nfrom sklearn.impute import SimpleImputer\nfrom sklearn.pipeline import Pipeline\nfrom sklearn.preprocessing import StandardScaler, OneHotEncoder\nfrom sklearn.compose import ColumnTransformer\n\nimport prepare\n\nNUMERIC = [\"Age\", \"RoomService\", \"FoodCourt\", \"ShoppingMall\", \"Spa\", \"VRDeck\"]\nCATEGORICAL = [\"HomePlanet\", \"Destination\", \"CryoSleep\", \"VIP\"]\nSPENDING = [\"RoomService\", \"FoodCourt\", \"ShoppingMall\", \"Spa\", \"VRDeck\"]\n\n\ndef parse_cabin(cabin_str):\n    \"\"\"Parse Cabin 'F/0/S' into deck, room_num, side.\"\"\"\n    if pd.isna(cabin_str):\n        return np.nan, np.nan, np.nan\n    parts = str(cabin_str).split(\"/\")\n    if len(parts) == 3:\n        return parts[0], int(parts[1]) if parts[1].isdigit() else np.nan, parts[2]\n    return np.nan, np.nan, np.nan\n\n\ndef extract_group_id(passenger_id):\n    \"\"\"Extract group ID from PassengerId (e.g., '0001_01' -> '0001').\"\"\"\n    if pd.isna(passenger_id):\n        return np.nan\n    return str(passenger_id).split(\"_\")[0]\n\n\ndef engineer_features(df):\n    \"\"\"Engineer spending and spending-cryo interaction features.\"\"\"\n    df_copy = df.copy()\n    \n    # Fill missing spending with 0\n    for col in SPENDING:\n        df_copy[col] = df_copy[col].fillna(0)\n    \n    # Total spending\n    df_copy[\"TotalSpending\"] = df_copy[SPENDING].sum(axis=1)\n    \n    # Interaction: CryoSleep status and spending ratio\n    # For passengers in cryo-sleep, compute spending as a fraction; for others, set to 0.\n    # Use log-transformed spending to capture intensity better.\n    cryo_status = df_copy[\"CryoSleep\"].fillna(False)\n    log_spending = np.log1p(df_copy[\"TotalSpending\"])\n    df_copy[\"CryoSleep_LogSpending\"] = (\n        (cryo_status == True) * log_spending\n    )\n    \n    return df_copy\n\n\ndef compute_group_features(df):\n    \"\"\"Compute group-level aggregate features.\"\"\"\n    df_copy = df.copy()\n    \n    # Group by GroupId and compute aggregates\n    # Only compute if GroupId is not NaN\n    group_aggs = df_copy.groupby(\"GroupId\", dropna=True).agg({\n        \"PassengerId\": \"count\",  # GroupSize\n        \"TotalSpending\": \"mean\",  # GroupAvgSpending\n        \"Age\": \"mean\",  # GroupAvgAge\n    }).rename(columns={\n        \"PassengerId\": \"GroupSize\",\n        \"TotalSpending\": \"GroupAvgSpending\",\n        \"Age\": \"GroupAvgAge\",\n    })\n    \n    # Also compute group total spending\n    group_total_spending = df_copy.groupby(\"GroupId\", dropna=True)[\"TotalSpending\"].sum()\n    group_aggs[\"GroupTotalSpending\"] = group_total_spending\n    \n    # Merge back to original dataframe\n    df_copy = df_copy.merge(group_aggs, left_on=\"GroupId\", right_index=True, how=\"left\")\n    \n    # Fill NaN group features (for passengers with missing GroupId) with median values\n    for col in [\"GroupSize\", \"GroupAvgSpending\", \"GroupAvgAge\", \"GroupTotalSpending\"]:\n        df_copy[col] = df_copy[col].fillna(df_copy[col].median())\n    \n    return df_copy\n\n\ndef build_predict_fn():\n    train_df, _ = prepare.load_split()\n    \n    # Parse Cabin into Deck, RoomNum, Side\n    cabin_data = train_df[\"Cabin\"].apply(parse_cabin)\n    train_df[\"Deck\"] = cabin_data.apply(lambda x: x[0])\n    train_df[\"RoomNum\"] = cabin_data.apply(lambda x: x[1])\n    train_df[\"Side\"] = cabin_data.apply(lambda x: x[2])\n    \n    # Extract group ID from PassengerId\n    train_df[\"GroupId\"] = train_df[\"PassengerId\"].apply(extract_group_id)\n    \n    # Engineer features\n    train_df = engineer_features(train_df)\n    \n    # Compute group-level aggregates\n    train_df = compute_group_features(train_df)\n    \n    # Create explicit missingness flags for CryoSleep and VIP before filling\n    train_df[\"CryoSleep_Missing\"] = train_df[\"CryoSleep\"].isna().astype(int)\n    train_df[\"VIP_Missing\"] = train_df[\"VIP\"].isna().astype(int)\n    \n    # Convert CryoSleep and VIP to string for categorical encoding\n    train_df[\"CryoSleep\"] = train_df[\"CryoSleep\"].fillna(\"Unknown\").astype(str)\n    train_df[\"VIP\"] = train_df[\"VIP\"].fillna(\"Unknown\").astype(str)\n    \n    # Build feature set\n    feature_cols = (\n        [\"Age\"] + SPENDING + [\"TotalSpending\", \"CryoSleep_LogSpending\"] +\n        CATEGORICAL + \n        [\"Deck\", \"RoomNum\", \"Side\", \"GroupId\"] + \n        [\"CryoSleep_Missing\", \"VIP_Missing\"] +\n        [\"GroupSize\", \"GroupAvgSpending\", \"GroupAvgAge\", \"GroupTotalSpending\"]\n    )\n    X = train_df[feature_cols]\n    y = train_df[\"Transported\"].astype(int)\n    \n    # Define preprocessing for numeric and categorical columns\n    numeric_transformer = Pipeline([\n        (\"imputer\", SimpleImputer(strategy=\"median\")),\n        (\"scaler\", StandardScaler()),\n    ])\n    \n    categorical_transformer = Pipeline([\n        (\"imputer\", SimpleImputer(strategy=\"most_frequent\")),\n        (\"onehot\", OneHotEncoder(handle_unknown=\"ignore\", sparse_output=False)),\n    ])\n    \n    numeric_feature_cols = (\n        [\"Age\", \"RoomNum\", \"CryoSleep_Missing\", \"VIP_Missing\"] + \n        SPENDING + [\"TotalSpending\", \"CryoSleep_LogSpending\"] +\n        [\"GroupSize\", \"GroupAvgSpending\", \"GroupAvgAge\", \"GroupTotalSpending\"]\n    )\n    categorical_feature_cols = CATEGORICAL + [\"Deck\", \"Side\", \"GroupId\"]\n    \n    preprocessor = ColumnTransformer([\n        (\"num\", numeric_transformer, numeric_feature_cols),\n        (\"cat\", categorical_transformer, categorical_feature_cols),\n    ])\n    \n    pipe = Pipeline([\n        (\"preprocessor\", preprocessor),\n        (\"clf\", xgb.XGBClassifier(n_estimators=100, max_depth=6, learning_rate=0.1, random_state=42, verbosity=0)),\n    ])\n    \n    pipe.fit(X, y)\n    \n    def predict(X_val):\n        # Parse Cabin in validation set\n        cabin_data = X_val[\"Cabin\"].apply(parse_cabin)\n        X_val_copy = X_val.copy()\n        X_val_copy[\"Deck\"] = cabin_data.apply(lambda x: x[0])\n        X_val_copy[\"RoomNum\"] = cabin_data.apply(lambda x: x[1])\n        X_val_copy[\"Side\"] = cabin_data.apply(lambda x: x[2])\n        \n        # Extract group ID\n        X_val_copy[\"GroupId\"] = X_val_copy[\"PassengerId\"].apply(extract_group_id)\n        \n        # Engineer features\n        X_val_copy = engineer_features(X_val_copy)\n        \n        # Compute group-level aggregates using training set means for unknown groups\n        # For val set, use training group statistics where available, else use training medians\n        X_val_copy = compute_group_features(X_val_copy)\n        \n        # Create explicit missingness flags for CryoSleep and VIP before filling\n        X_val_copy[\"CryoSleep_Missing\"] = X_val_copy[\"CryoSleep\"].isna().astype(int)\n        X_val_copy[\"VIP_Missing\"] = X_val_copy[\"VIP\"].isna().astype(int)\n        \n        # Handle CryoSleep and VIP\n        X_val_copy[\"CryoSleep\"] = X_val_copy[\"CryoSleep\"].fillna(\"Unknown\").astype(str)\n        X_val_copy[\"VIP\"] = X_val_copy[\"VIP\"].fillna(\"Unknown\").astype(str)\n        \n        return pipe.predict(X_val_copy[feature_cols]).astype(bool)\n    \n    return predict\n\n\nif __name__ == \"__main__\":\n    predict_fn = build_predict_fn()\n    score = prepare.evaluate(predict_fn)\n    print(f\"VAL_ACCURACY: {score:.4f}\")\n```\n</code>\n\n<notes", "reflection": null, "observations": [], "hypothesis": null, "plan": null, "code": null, "notes_append": null, "stdout": "", "stderr": "missing <notes_append> tag", "returncode": null, "score": null, "kept": false, "status": "parse_failed", "commit_hash": null, "input_tokens": 4195, "output_tokens": 3000, "cost_usd": 0.019195}
