{"iteration": 6, "timestamp": "2026-05-08T21:20:13", "previous_best": 0.8189, "duration_seconds": 1.75, "agent_response_raw": "<reflection>\nThe removal of RoomNum in iteration 34 caused a regression from 0.8189 to 0.8091, suggesting that RoomNum was actually contributing to the model despite low stated importance. This indicates the feature importance diagnostics may not have been fully accurate or that RoomNum has a subtle interaction with other features. I should restore RoomNum and instead focus on whether the current best configuration (iteration 3, which achieved 0.8189) is stable and what other structural changes might help.\n</reflection>\n\n<observations>\n- Iteration 34 removed RoomNum and regressed from 0.8189 to 0.8091, suggesting that the feature importance diagnostics in iteration 33 were misleading. RoomNum appears to contribute value despite low apparent importance, possibly through interactions.\n- The best score of 0.8189 has been stable across iterations 3 and 4 (both kept), which suggests the current feature engineering (cabin parsing, TotalSpending, CryoSleep_NoSpending, missingness flags) is solid.\n- The notes indicate that GroupId has been removed (iteration 31) due to high cardinality issues in validation, and subsequent removal of RoomNum (iter 34) caused regression, yet iter 3/4 achieved 0.8189 without GroupId but with RoomNum.\n- Current best configuration uses: Age, SPENDING, TotalSpending, CryoSleep_NoSpending, CATEGORICAL (HomePlanet, Destination, CryoSleep, VIP), Deck, RoomNum, Side, missingness flags.\n- The tight coupling between RoomNum's importance diagnostics (0.0152) and its actual predictive value suggests that feature importance metrics are not reliable guides here; empirical testing via ablation is more trustworthy.\n</observations>\n\n<hypothesis>\nRestoring RoomNum to the feature set will recover the 0.8189 accuracy, and the regression in iteration 34 was due to its unexpected interaction effects rather than a true lack of value. Once restored, the next step should be to explore whether different XGBoost hyperparameters (especially max_depth, which controls interaction depth) can push accuracy further.\n</hypothesis>\n\n<plan>\nI will restore RoomNum to the feature set (reverting the iteration 34 change), confirm that accuracy returns to 0.8189, and then try reducing max_depth from 6 to 4 to see if simpler trees improve generalization without overfitting via complex feature interactions.\n</plan>\n\n<code>\n```python\n\"\"\"\ntrain.py — XGBoost with cabin parsing, RoomNum restored, and depth tuning.\nIteration 35: Restore RoomNum to reverse regression from iter 34. Then test max_depth=4\nto see if reducing tree complexity (while keeping all features) improves generalization.\n\"\"\"\nimport sys, pathlib\nsys.path.insert(0, str(pathlib.Path(__file__).resolve().parent.parent))\n\nimport pandas as pd\nimport numpy as np\nimport xgboost as xgb\nfrom sklearn.impute import SimpleImputer\nfrom sklearn.pipeline import Pipeline\nfrom sklearn.preprocessing import StandardScaler, OneHotEncoder\nfrom sklearn.compose import ColumnTransformer\n\nimport prepare\n\nNUMERIC = [\"Age\", \"RoomService\", \"FoodCourt\", \"ShoppingMall\", \"Spa\", \"VRDeck\"]\nCATEGORICAL = [\"HomePlanet\", \"Destination\", \"CryoSleep\", \"VIP\"]\nSPENDING = [\"RoomService\", \"FoodCourt\", \"ShoppingMall\", \"Spa\", \"VRDeck\"]\n\n\ndef parse_cabin(cabin_str):\n    \"\"\"Parse Cabin 'F/0/S' into deck, room_num, side.\"\"\"\n    if pd.isna(cabin_str):\n        return np.nan, np.nan, np.nan\n    parts = str(cabin_str).split(\"/\")\n    if len(parts) == 3:\n        return parts[0], int(parts[1]) if parts[1].isdigit() else np.nan, parts[2]\n    return np.nan, np.nan, np.nan\n\n\ndef engineer_features(df):\n    \"\"\"Engineer interaction and spending features.\"\"\"\n    df_copy = df.copy()\n    \n    # Fill missing spending with 0\n    for col in SPENDING:\n        df_copy[col] = df_copy[col].fillna(0)\n    \n    # Total spending\n    df_copy[\"TotalSpending\"] = df_copy[SPENDING].sum(axis=1)\n    \n    # Interaction: CryoSleep and zero spending\n    cryo_status = df_copy[\"CryoSleep\"].fillna(False)\n    df_copy[\"CryoSleep_NoSpending\"] = (\n        (cryo_status == True) & (df_copy[\"TotalSpending\"] == 0)\n    ).astype(int)\n    \n    return df_copy\n\n\ndef build_predict_fn():\n    train_df, _ = prepare.load_split()\n    \n    # Parse Cabin into Deck, RoomNum, Side\n    cabin_data = train_df[\"Cabin\"].apply(parse_cabin)\n    train_df[\"Deck\"] = cabin_data.apply(lambda x: x[0])\n    train_df[\"RoomNum\"] = cabin_data.apply(lambda x: x[1])\n    train_df[\"Side\"] = cabin_data.apply(lambda x: x[2])\n    \n    # Engineer features\n    train_df = engineer_features(train_df)\n    \n    # Create explicit missingness flags for CryoSleep and VIP\n    train_df[\"CryoSleep_Missing\"] = train_df[\"CryoSleep\"].isna().astype(int)\n    train_df[\"VIP_Missing\"] = train_df[\"VIP\"].isna().astype(int)\n    \n    # Convert CryoSleep and VIP to string for categorical encoding\n    train_df[\"CryoSleep\"] = train_df[\"CryoSleep\"].fillna(\"Unknown\").astype(str)\n    train_df[\"VIP\"] = train_df[\"VIP\"].fillna(\"Unknown\").astype(str)\n    \n    # Build feature set (RoomNum restored)\n    feature_cols = (\n        [\"Age\"] + SPENDING + [\"TotalSpending\", \"CryoSleep_NoSpending\"] +\n        CATEGORICAL + \n        [\"Deck\", \"RoomNum\", \"Side\"] + \n        [\"CryoSleep_Missing\", \"VIP_Missing\"]\n    )\n    X = train_df[feature_cols]\n    y = train_df[\"Transported\"].astype(int)\n    \n    # Define preprocessing\n    numeric_transformer = Pipeline([\n        (\"imputer\", SimpleImputer(strategy=\"median\")),\n        (\"scaler\", StandardScaler()),\n    ])\n    \n    categorical_transformer = Pipeline([\n        (\"imputer\", SimpleImputer(strategy=\"most_frequent\")),\n        (\"onehot\", OneHotEncoder(handle_unknown=\"ignore\", sparse_output=False)),\n    ])\n    \n    numeric_feature_cols = (\n        [\"Age\", \"RoomNum\", \"CryoSleep_Missing\", \"VIP_Missing\"] + \n        SPENDING + [\"TotalSpending\", \"CryoSleep_NoSpending\"]\n    )\n    categorical_feature_cols = CATEGORICAL + [\"Deck\", \"Side\"]\n    \n    preprocessor = ColumnTransformer([\n        (\"num\", numeric_transformer, numeric_feature_cols),\n        (\"cat\", categorical_transformer, categorical_feature_cols),\n    ])\n    \n    pipe = Pipeline([\n        (\"preprocessor\", preprocessor),\n        (\"clf\", xgb.XGBClassifier(n_estimators=100, max_depth=4, learning_rate=0.1, random_state=42, verbosity=0)),\n    ])\n    \n    pipe.fit(X, y)\n    \n    def predict(X_val):\n        cabin_data = X_val[\"Cabin\"].apply(parse_cabin)\n        X_val_copy = X_val.copy()\n        X_val_copy[\"Deck\"] = cabin_data.apply(lambda x: x[0])\n        X_val_copy[\"RoomNum\"] = cabin_data.apply(lambda x: x[1])\n        X_val_copy[\"Side\"] = cabin_data.apply(lambda x: x[2])\n        \n        # Engineer features\n        X_val_copy = engineer_features(X_val_copy)\n        \n        # Create explicit missingness flags\n        X_val_copy[\"CryoSleep_Missing\"] = X_val_copy[\"CryoSleep\"].isna().astype(int)\n        X_val_copy[\"VIP_Missing\"] = X_val_copy[\"VIP\"].isna().astype(int)\n        \n        # Handle CryoSleep and VIP\n        X_val_copy[\"CryoSleep\"] = X_val_copy[\"CryoSleep\"].fillna(\"Unknown\").astype(str)\n        X_val_copy[\"VIP\"] = X_val_copy[\"VIP\"].fillna(\"Unknown\").astype(str)\n        \n        return pipe.predict(X_val_copy[feature_cols]).astype(bool)\n    \n    return predict\n\n\nif __name__ == \"__main__\":\n    predict_fn = build_predict_fn()\n    score = prepare.evaluate(predict_fn)\n    print(f\"VAL_ACCURACY: {score:.4f}\")\n```\n</code>\n\n<notes_append>\nIteration 35: Restored RoomNum and reduced max_depth to 4 to test if simpler trees improve generalization. RoomNum was unexpectedly predictive despite low feature importance; tuning tree depth may leverage this more effectively.\n</notes_append>", "reflection": "The removal of RoomNum in iteration 34 caused a regression from 0.8189 to 0.8091, suggesting that RoomNum was actually contributing to the model despite low stated importance. This indicates the feature importance diagnostics may not have been fully accurate or that RoomNum has a subtle interaction with other features. I should restore RoomNum and instead focus on whether the current best configuration (iteration 3, which achieved 0.8189) is stable and what other structural changes might help.", "observations": ["Iteration 34 removed RoomNum and regressed from 0.8189 to 0.8091, suggesting that the feature importance diagnostics in iteration 33 were misleading. RoomNum appears to contribute value despite low apparent importance, possibly through interactions.", "The best score of 0.8189 has been stable across iterations 3 and 4 (both kept), which suggests the current feature engineering (cabin parsing, TotalSpending, CryoSleep_NoSpending, missingness flags) is solid.", "The notes indicate that GroupId has been removed (iteration 31) due to high cardinality issues in validation, and subsequent removal of RoomNum (iter 34) caused regression, yet iter 3/4 achieved 0.8189 without GroupId but with RoomNum.", "Current best configuration uses: Age, SPENDING, TotalSpending, CryoSleep_NoSpending, CATEGORICAL (HomePlanet, Destination, CryoSleep, VIP), Deck, RoomNum, Side, missingness flags.", "The tight coupling between RoomNum's importance diagnostics (0.0152) and its actual predictive value suggests that feature importance metrics are not reliable guides here; empirical testing via ablation is more trustworthy."], "hypothesis": "Restoring RoomNum to the feature set will recover the 0.8189 accuracy, and the regression in iteration 34 was due to its unexpected interaction effects rather than a true lack of value. Once restored, the next step should be to explore whether different XGBoost hyperparameters (especially max_depth, which controls interaction depth) can push accuracy further.", "plan": "I will restore RoomNum to the feature set (reverting the iteration 34 change), confirm that accuracy returns to 0.8189, and then try reducing max_depth from 6 to 4 to see if simpler trees improve generalization without overfitting via complex feature interactions.", "code": "\"\"\"\ntrain.py — XGBoost with cabin parsing, RoomNum restored, and depth tuning.\nIteration 35: Restore RoomNum to reverse regression from iter 34. Then test max_depth=4\nto see if reducing tree complexity (while keeping all features) improves generalization.\n\"\"\"\nimport sys, pathlib\nsys.path.insert(0, str(pathlib.Path(__file__).resolve().parent.parent))\n\nimport pandas as pd\nimport numpy as np\nimport xgboost as xgb\nfrom sklearn.impute import SimpleImputer\nfrom sklearn.pipeline import Pipeline\nfrom sklearn.preprocessing import StandardScaler, OneHotEncoder\nfrom sklearn.compose import ColumnTransformer\n\nimport prepare\n\nNUMERIC = [\"Age\", \"RoomService\", \"FoodCourt\", \"ShoppingMall\", \"Spa\", \"VRDeck\"]\nCATEGORICAL = [\"HomePlanet\", \"Destination\", \"CryoSleep\", \"VIP\"]\nSPENDING = [\"RoomService\", \"FoodCourt\", \"ShoppingMall\", \"Spa\", \"VRDeck\"]\n\n\ndef parse_cabin(cabin_str):\n    \"\"\"Parse Cabin 'F/0/S' into deck, room_num, side.\"\"\"\n    if pd.isna(cabin_str):\n        return np.nan, np.nan, np.nan\n    parts = str(cabin_str).split(\"/\")\n    if len(parts) == 3:\n        return parts[0], int(parts[1]) if parts[1].isdigit() else np.nan, parts[2]\n    return np.nan, np.nan, np.nan\n\n\ndef engineer_features(df):\n    \"\"\"Engineer interaction and spending features.\"\"\"\n    df_copy = df.copy()\n    \n    # Fill missing spending with 0\n    for col in SPENDING:\n        df_copy[col] = df_copy[col].fillna(0)\n    \n    # Total spending\n    df_copy[\"TotalSpending\"] = df_copy[SPENDING].sum(axis=1)\n    \n    # Interaction: CryoSleep and zero spending\n    cryo_status = df_copy[\"CryoSleep\"].fillna(False)\n    df_copy[\"CryoSleep_NoSpending\"] = (\n        (cryo_status == True) & (df_copy[\"TotalSpending\"] == 0)\n    ).astype(int)\n    \n    return df_copy\n\n\ndef build_predict_fn():\n    train_df, _ = prepare.load_split()\n    \n    # Parse Cabin into Deck, RoomNum, Side\n    cabin_data = train_df[\"Cabin\"].apply(parse_cabin)\n    train_df[\"Deck\"] = cabin_data.apply(lambda x: x[0])\n    train_df[\"RoomNum\"] = cabin_data.apply(lambda x: x[1])\n    train_df[\"Side\"] = cabin_data.apply(lambda x: x[2])\n    \n    # Engineer features\n    train_df = engineer_features(train_df)\n    \n    # Create explicit missingness flags for CryoSleep and VIP\n    train_df[\"CryoSleep_Missing\"] = train_df[\"CryoSleep\"].isna().astype(int)\n    train_df[\"VIP_Missing\"] = train_df[\"VIP\"].isna().astype(int)\n    \n    # Convert CryoSleep and VIP to string for categorical encoding\n    train_df[\"CryoSleep\"] = train_df[\"CryoSleep\"].fillna(\"Unknown\").astype(str)\n    train_df[\"VIP\"] = train_df[\"VIP\"].fillna(\"Unknown\").astype(str)\n    \n    # Build feature set (RoomNum restored)\n    feature_cols = (\n        [\"Age\"] + SPENDING + [\"TotalSpending\", \"CryoSleep_NoSpending\"] +\n        CATEGORICAL + \n        [\"Deck\", \"RoomNum\", \"Side\"] + \n        [\"CryoSleep_Missing\", \"VIP_Missing\"]\n    )\n    X = train_df[feature_cols]\n    y = train_df[\"Transported\"].astype(int)\n    \n    # Define preprocessing\n    numeric_transformer = Pipeline([\n        (\"imputer\", SimpleImputer(strategy=\"median\")),\n        (\"scaler\", StandardScaler()),\n    ])\n    \n    categorical_transformer = Pipeline([\n        (\"imputer\", SimpleImputer(strategy=\"most_frequent\")),\n        (\"onehot\", OneHotEncoder(handle_unknown=\"ignore\", sparse_output=False)),\n    ])\n    \n    numeric_feature_cols = (\n        [\"Age\", \"RoomNum\", \"CryoSleep_Missing\", \"VIP_Missing\"] + \n        SPENDING + [\"TotalSpending\", \"CryoSleep_NoSpending\"]\n    )\n    categorical_feature_cols = CATEGORICAL + [\"Deck\", \"Side\"]\n    \n    preprocessor = ColumnTransformer([\n        (\"num\", numeric_transformer, numeric_feature_cols),\n        (\"cat\", categorical_transformer, categorical_feature_cols),\n    ])\n    \n    pipe = Pipeline([\n        (\"preprocessor\", preprocessor),\n        (\"clf\", xgb.XGBClassifier(n_estimators=100, max_depth=4, learning_rate=0.1, random_state=42, verbosity=0)),\n    ])\n    \n    pipe.fit(X, y)\n    \n    def predict(X_val):\n        cabin_data = X_val[\"Cabin\"].apply(parse_cabin)\n        X_val_copy = X_val.copy()\n        X_val_copy[\"Deck\"] = cabin_data.apply(lambda x: x[0])\n        X_val_copy[\"RoomNum\"] = cabin_data.apply(lambda x: x[1])\n        X_val_copy[\"Side\"] = cabin_data.apply(lambda x: x[2])\n        \n        # Engineer features\n        X_val_copy = engineer_features(X_val_copy)\n        \n        # Create explicit missingness flags\n        X_val_copy[\"CryoSleep_Missing\"] = X_val_copy[\"CryoSleep\"].isna().astype(int)\n        X_val_copy[\"VIP_Missing\"] = X_val_copy[\"VIP\"].isna().astype(int)\n        \n        # Handle CryoSleep and VIP\n        X_val_copy[\"CryoSleep\"] = X_val_copy[\"CryoSleep\"].fillna(\"Unknown\").astype(str)\n        X_val_copy[\"VIP\"] = X_val_copy[\"VIP\"].fillna(\"Unknown\").astype(str)\n        \n        return pipe.predict(X_val_copy[feature_cols]).astype(bool)\n    \n    return predict\n\n\nif __name__ == \"__main__\":\n    predict_fn = build_predict_fn()\n    score = prepare.evaluate(predict_fn)\n    print(f\"VAL_ACCURACY: {score:.4f}\")\n", "notes_append": "Iteration 35: Restored RoomNum and reduced max_depth to 4 to test if simpler trees improve generalization. RoomNum was unexpectedly predictive despite low feature importance; tuning tree depth may leverage this more effectively.", "stdout": "VAL_ACCURACY: 0.8068\n", "stderr": "", "returncode": 0, "score": 0.8068, "kept": false, "status": "reverted", "commit_hash": null, "input_tokens": 4482, "output_tokens": 2356, "cost_usd": 0.016262}
