{"iteration": 9, "timestamp": "2026-05-08T21:21:17", "previous_best": 0.8189, "duration_seconds": 4.48, "agent_response_raw": "<reflection>\nThe current best score is 0.8189 (iteration 3), and we've been hovering around that level for several iterations. The last run (iteration 36) achieved 0.8189 again with CryoSleep_LogSpending, suggesting the interaction feature helps but we're not making progress beyond the current plateau. I need to step back and try something structurally different rather than continue tweaking the same feature interactions.\n</reflection>\n\n<observations>\n- We've been stuck at 0.8189 for multiple iterations despite trying different interaction features (CryoSleep_NoSpending, CryoSleep_LogSpending, CryoSleep_Spending_Ratio variants). This suggests we've hit a local optimum with the current feature engineering approach.\n- The notes indicate we've tried removing/restoring RoomNum, adjusting tree depth, and adding various engineered features, but none have broken through the 0.8189 ceiling. This is a sign to try a fundamentally different model class or feature selection strategy.\n- XGBoost with max_depth tuning and extensive feature engineering may be overfitting slightly. A simpler model (e.g., logistic regression with better feature selection) or a completely different approach (e.g., LightGBM with different regularization) might generalize better.\n- The baseline logistic regression achieves ~0.78, and we're at 0.8189, so there's room for improvement. However, the plateau suggests we're missing a key insight rather than needing fine-grained hyperparameter tuning.\n- Notes show we added many features (cabin parsing, GroupId, spending ratios, missingness flags) but haven't systematically validated which ones matter. Feature selection or ablation might reveal the actual drivers.\n</observations>\n\n<hypothesis>\nLightGBM with aggressive L1/L2 regularization and a lower number of leaves may generalize better than XGBoost on this small dataset, breaking the 0.8189 plateau by reducing overfitting while preserving the cabin/group/interaction features we've engineered.\n</hypothesis>\n\n<plan>\nI will replace XGBoost with LightGBM using num_leaves=8, reg_alpha=1.0, reg_lambda=1.0 to encourage sparsity and regularization. This is a structural change to the model class (not another hyperparameter tweak), which follows the directive to try something different when stuck in local optima. If this doesn't work, I'll consider feature ablation or logistic regression next.\n</plan>\n\n<code>\n```python\n\"\"\"\ntrain.py — LightGBM with aggressive regularization to escape XGBoost plateau.\nIteration 37: Replace XGBoost with LightGBM (num_leaves=8, L1/L2 regularization)\nto test whether a simpler, more regularized boosting model breaks the 0.8189 plateau.\n\"\"\"\nimport sys, pathlib\nsys.path.insert(0, str(pathlib.Path(__file__).resolve().parent.parent))\n\nimport pandas as pd\nimport numpy as np\nimport lightgbm as lgb\nfrom sklearn.impute import SimpleImputer\nfrom sklearn.pipeline import Pipeline\nfrom sklearn.preprocessing import StandardScaler, OneHotEncoder\nfrom sklearn.compose import ColumnTransformer\n\nimport prepare\n\nNUMERIC = [\"Age\", \"RoomService\", \"FoodCourt\", \"ShoppingMall\", \"Spa\", \"VRDeck\"]\nCATEGORICAL = [\"HomePlanet\", \"Destination\", \"CryoSleep\", \"VIP\"]\nSPENDING = [\"RoomService\", \"FoodCourt\", \"ShoppingMall\", \"Spa\", \"VRDeck\"]\n\n\ndef parse_cabin(cabin_str):\n    \"\"\"Parse Cabin 'F/0/S' into deck, room_num, side.\"\"\"\n    if pd.isna(cabin_str):\n        return np.nan, np.nan, np.nan\n    parts = str(cabin_str).split(\"/\")\n    if len(parts) == 3:\n        return parts[0], int(parts[1]) if parts[1].isdigit() else np.nan, parts[2]\n    return np.nan, np.nan, np.nan\n\n\ndef extract_group_id(passenger_id):\n    \"\"\"Extract group ID from PassengerId (e.g., '0001_01' -> '0001').\"\"\"\n    if pd.isna(passenger_id):\n        return np.nan\n    return str(passenger_id).split(\"_\")[0]\n\n\ndef engineer_features(df):\n    \"\"\"Engineer spending and spending-cryo interaction features.\"\"\"\n    df_copy = df.copy()\n    \n    # Fill missing spending with 0\n    for col in SPENDING:\n        df_copy[col] = df_copy[col].fillna(0)\n    \n    # Total spending\n    df_copy[\"TotalSpending\"] = df_copy[SPENDING].sum(axis=1)\n    \n    # Interaction: CryoSleep status and log-transformed spending\n    cryo_status = df_copy[\"CryoSleep\"].fillna(False)\n    log_spending = np.log1p(df_copy[\"TotalSpending\"])\n    df_copy[\"CryoSleep_LogSpending\"] = (\n        (cryo_status == True) * log_spending\n    )\n    \n    return df_copy\n\n\ndef build_predict_fn():\n    train_df, _ = prepare.load_split()\n    \n    # Parse Cabin into Deck, RoomNum, Side\n    cabin_data = train_df[\"Cabin\"].apply(parse_cabin)\n    train_df[\"Deck\"] = cabin_data.apply(lambda x: x[0])\n    train_df[\"RoomNum\"] = cabin_data.apply(lambda x: x[1])\n    train_df[\"Side\"] = cabin_data.apply(lambda x: x[2])\n    \n    # Extract group ID from PassengerId\n    train_df[\"GroupId\"] = train_df[\"PassengerId\"].apply(extract_group_id)\n    \n    # Engineer features\n    train_df = engineer_features(train_df)\n    \n    # Create explicit missingness flags for CryoSleep and VIP before filling\n    train_df[\"CryoSleep_Missing\"] = train_df[\"CryoSleep\"].isna().astype(int)\n    train_df[\"VIP_Missing\"] = train_df[\"VIP\"].isna().astype(int)\n    \n    # Convert CryoSleep and VIP to string for categorical encoding\n    train_df[\"CryoSleep\"] = train_df[\"CryoSleep\"].fillna(\"Unknown\").astype(str)\n    train_df[\"VIP\"] = train_df[\"VIP\"].fillna(\"Unknown\").astype(str)\n    \n    # Build feature set\n    feature_cols = (\n        [\"Age\"] + SPENDING + [\"TotalSpending\", \"CryoSleep_LogSpending\"] +\n        CATEGORICAL + \n        [\"Deck\", \"RoomNum\", \"Side\", \"GroupId\"] + \n        [\"CryoSleep_Missing\", \"VIP_Missing\"]\n    )\n    X = train_df[feature_cols]\n    y = train_df[\"Transported\"].astype(int)\n    \n    # Define preprocessing for numeric and categorical columns\n    numeric_transformer = Pipeline([\n        (\"imputer\", SimpleImputer(strategy=\"median\")),\n        (\"scaler\", StandardScaler()),\n    ])\n    \n    categorical_transformer = Pipeline([\n        (\"imputer\", SimpleImputer(strategy=\"most_frequent\")),\n        (\"onehot\", OneHotEncoder(handle_unknown=\"ignore\", sparse_output=False)),\n    ])\n    \n    numeric_feature_cols = (\n        [\"Age\", \"RoomNum\", \"CryoSleep_Missing\", \"VIP_Missing\"] + \n        SPENDING + [\"TotalSpending\", \"CryoSleep_LogSpending\"]\n    )\n    categorical_feature_cols = CATEGORICAL + [\"Deck\", \"Side\", \"GroupId\"]\n    \n    preprocessor = ColumnTransformer([\n        (\"num\", numeric_transformer, numeric_feature_cols),\n        (\"cat\", categorical_transformer, categorical_feature_cols),\n    ])\n    \n    pipe = Pipeline([\n        (\"preprocessor\", preprocessor),\n        (\"clf\", lgb.LGBMClassifier(\n            num_leaves=8,\n            max_depth=5,\n            learning_rate=0.1,\n            n_estimators=100,\n            reg_alpha=1.0,\n            reg_lambda=1.0,\n            random_state=42,\n            verbosity=-1\n        )),\n    ])\n    \n    pipe.fit(X, y)\n    \n    def predict(X_val):\n        # Parse Cabin in validation set\n        cabin_data = X_val[\"Cabin\"].apply(parse_cabin)\n        X_val_copy = X_val.copy()\n        X_val_copy[\"Deck\"] = cabin_data.apply(lambda x: x[0])\n        X_val_copy[\"RoomNum\"] = cabin_data.apply(lambda x: x[1])\n        X_val_copy[\"Side\"] = cabin_data.apply(lambda x: x[2])\n        \n        # Extract group ID\n        X_val_copy[\"GroupId\"] = X_val_copy[\"PassengerId\"].apply(extract_group_id)\n        \n        # Engineer features\n        X_val_copy = engineer_features(X_val_copy)\n        \n        # Create explicit missingness flags for CryoSleep and VIP before filling\n        X_val_copy[\"CryoSleep_Missing\"] = X_val_copy[\"CryoSleep\"].isna().astype(int)\n        X_val_copy[\"VIP_Missing\"] = X_val_copy[\"VIP\"].isna().astype(int)\n        \n        # Handle CryoSleep and VIP\n        X_val_copy[\"CryoSleep\"] = X_val_copy[\"CryoSleep\"].fillna(\"Unknown\").astype(str)\n        X_val_copy[\"VIP\"] = X_val_copy[\"VIP\"].fillna(\"Unknown\").astype(str)\n        \n        return pipe.predict(X_val_copy[feature_cols]).astype(bool)\n    \n    return predict\n\n\nif __name__ == \"__main__\":\n    predict_fn = build_predict_fn()\n    score = prepare.evaluate(predict_fn)\n    print(f\"VAL_ACCURACY: {score:.4f}\")\n```\n</code>\n\n<notes_append>\nIteration 37: Replaced XGBoost with LightGBM (num_leaves=8, reg_alpha=1.0, reg_lambda=1.0, max_depth=5) to test whether aggressive regularization on a simpler boosting model breaks the 0.8189 plateau. XGBoost appeared to plateau despite many feature engineering attempts.\n</notes_append>", "reflection": "The current best score is 0.8189 (iteration 3), and we've been hovering around that level for several iterations. The last run (iteration 36) achieved 0.8189 again with CryoSleep_LogSpending, suggesting the interaction feature helps but we're not making progress beyond the current plateau. I need to step back and try something structurally different rather than continue tweaking the same feature interactions.", "observations": ["We've been stuck at 0.8189 for multiple iterations despite trying different interaction features (CryoSleep_NoSpending, CryoSleep_LogSpending, CryoSleep_Spending_Ratio variants). This suggests we've hit a local optimum with the current feature engineering approach.", "The notes indicate we've tried removing/restoring RoomNum, adjusting tree depth, and adding various engineered features, but none have broken through the 0.8189 ceiling. This is a sign to try a fundamentally different model class or feature selection strategy.", "XGBoost with max_depth tuning and extensive feature engineering may be overfitting slightly. A simpler model (e.g., logistic regression with better feature selection) or a completely different approach (e.g., LightGBM with different regularization) might generalize better.", "The baseline logistic regression achieves ~0.78, and we're at 0.8189, so there's room for improvement. However, the plateau suggests we're missing a key insight rather than needing fine-grained hyperparameter tuning.", "Notes show we added many features (cabin parsing, GroupId, spending ratios, missingness flags) but haven't systematically validated which ones matter. Feature selection or ablation might reveal the actual drivers."], "hypothesis": "LightGBM with aggressive L1/L2 regularization and a lower number of leaves may generalize better than XGBoost on this small dataset, breaking the 0.8189 plateau by reducing overfitting while preserving the cabin/group/interaction features we've engineered.", "plan": "I will replace XGBoost with LightGBM using num_leaves=8, reg_alpha=1.0, reg_lambda=1.0 to encourage sparsity and regularization. This is a structural change to the model class (not another hyperparameter tweak), which follows the directive to try something different when stuck in local optima. If this doesn't work, I'll consider feature ablation or logistic regression next.", "code": "\"\"\"\ntrain.py — LightGBM with aggressive regularization to escape XGBoost plateau.\nIteration 37: Replace XGBoost with LightGBM (num_leaves=8, L1/L2 regularization)\nto test whether a simpler, more regularized boosting model breaks the 0.8189 plateau.\n\"\"\"\nimport sys, pathlib\nsys.path.insert(0, str(pathlib.Path(__file__).resolve().parent.parent))\n\nimport pandas as pd\nimport numpy as np\nimport lightgbm as lgb\nfrom sklearn.impute import SimpleImputer\nfrom sklearn.pipeline import Pipeline\nfrom sklearn.preprocessing import StandardScaler, OneHotEncoder\nfrom sklearn.compose import ColumnTransformer\n\nimport prepare\n\nNUMERIC = [\"Age\", \"RoomService\", \"FoodCourt\", \"ShoppingMall\", \"Spa\", \"VRDeck\"]\nCATEGORICAL = [\"HomePlanet\", \"Destination\", \"CryoSleep\", \"VIP\"]\nSPENDING = [\"RoomService\", \"FoodCourt\", \"ShoppingMall\", \"Spa\", \"VRDeck\"]\n\n\ndef parse_cabin(cabin_str):\n    \"\"\"Parse Cabin 'F/0/S' into deck, room_num, side.\"\"\"\n    if pd.isna(cabin_str):\n        return np.nan, np.nan, np.nan\n    parts = str(cabin_str).split(\"/\")\n    if len(parts) == 3:\n        return parts[0], int(parts[1]) if parts[1].isdigit() else np.nan, parts[2]\n    return np.nan, np.nan, np.nan\n\n\ndef extract_group_id(passenger_id):\n    \"\"\"Extract group ID from PassengerId (e.g., '0001_01' -> '0001').\"\"\"\n    if pd.isna(passenger_id):\n        return np.nan\n    return str(passenger_id).split(\"_\")[0]\n\n\ndef engineer_features(df):\n    \"\"\"Engineer spending and spending-cryo interaction features.\"\"\"\n    df_copy = df.copy()\n    \n    # Fill missing spending with 0\n    for col in SPENDING:\n        df_copy[col] = df_copy[col].fillna(0)\n    \n    # Total spending\n    df_copy[\"TotalSpending\"] = df_copy[SPENDING].sum(axis=1)\n    \n    # Interaction: CryoSleep status and log-transformed spending\n    cryo_status = df_copy[\"CryoSleep\"].fillna(False)\n    log_spending = np.log1p(df_copy[\"TotalSpending\"])\n    df_copy[\"CryoSleep_LogSpending\"] = (\n        (cryo_status == True) * log_spending\n    )\n    \n    return df_copy\n\n\ndef build_predict_fn():\n    train_df, _ = prepare.load_split()\n    \n    # Parse Cabin into Deck, RoomNum, Side\n    cabin_data = train_df[\"Cabin\"].apply(parse_cabin)\n    train_df[\"Deck\"] = cabin_data.apply(lambda x: x[0])\n    train_df[\"RoomNum\"] = cabin_data.apply(lambda x: x[1])\n    train_df[\"Side\"] = cabin_data.apply(lambda x: x[2])\n    \n    # Extract group ID from PassengerId\n    train_df[\"GroupId\"] = train_df[\"PassengerId\"].apply(extract_group_id)\n    \n    # Engineer features\n    train_df = engineer_features(train_df)\n    \n    # Create explicit missingness flags for CryoSleep and VIP before filling\n    train_df[\"CryoSleep_Missing\"] = train_df[\"CryoSleep\"].isna().astype(int)\n    train_df[\"VIP_Missing\"] = train_df[\"VIP\"].isna().astype(int)\n    \n    # Convert CryoSleep and VIP to string for categorical encoding\n    train_df[\"CryoSleep\"] = train_df[\"CryoSleep\"].fillna(\"Unknown\").astype(str)\n    train_df[\"VIP\"] = train_df[\"VIP\"].fillna(\"Unknown\").astype(str)\n    \n    # Build feature set\n    feature_cols = (\n        [\"Age\"] + SPENDING + [\"TotalSpending\", \"CryoSleep_LogSpending\"] +\n        CATEGORICAL + \n        [\"Deck\", \"RoomNum\", \"Side\", \"GroupId\"] + \n        [\"CryoSleep_Missing\", \"VIP_Missing\"]\n    )\n    X = train_df[feature_cols]\n    y = train_df[\"Transported\"].astype(int)\n    \n    # Define preprocessing for numeric and categorical columns\n    numeric_transformer = Pipeline([\n        (\"imputer\", SimpleImputer(strategy=\"median\")),\n        (\"scaler\", StandardScaler()),\n    ])\n    \n    categorical_transformer = Pipeline([\n        (\"imputer\", SimpleImputer(strategy=\"most_frequent\")),\n        (\"onehot\", OneHotEncoder(handle_unknown=\"ignore\", sparse_output=False)),\n    ])\n    \n    numeric_feature_cols = (\n        [\"Age\", \"RoomNum\", \"CryoSleep_Missing\", \"VIP_Missing\"] + \n        SPENDING + [\"TotalSpending\", \"CryoSleep_LogSpending\"]\n    )\n    categorical_feature_cols = CATEGORICAL + [\"Deck\", \"Side\", \"GroupId\"]\n    \n    preprocessor = ColumnTransformer([\n        (\"num\", numeric_transformer, numeric_feature_cols),\n        (\"cat\", categorical_transformer, categorical_feature_cols),\n    ])\n    \n    pipe = Pipeline([\n        (\"preprocessor\", preprocessor),\n        (\"clf\", lgb.LGBMClassifier(\n            num_leaves=8,\n            max_depth=5,\n            learning_rate=0.1,\n            n_estimators=100,\n            reg_alpha=1.0,\n            reg_lambda=1.0,\n            random_state=42,\n            verbosity=-1\n        )),\n    ])\n    \n    pipe.fit(X, y)\n    \n    def predict(X_val):\n        # Parse Cabin in validation set\n        cabin_data = X_val[\"Cabin\"].apply(parse_cabin)\n        X_val_copy = X_val.copy()\n        X_val_copy[\"Deck\"] = cabin_data.apply(lambda x: x[0])\n        X_val_copy[\"RoomNum\"] = cabin_data.apply(lambda x: x[1])\n        X_val_copy[\"Side\"] = cabin_data.apply(lambda x: x[2])\n        \n        # Extract group ID\n        X_val_copy[\"GroupId\"] = X_val_copy[\"PassengerId\"].apply(extract_group_id)\n        \n        # Engineer features\n        X_val_copy = engineer_features(X_val_copy)\n        \n        # Create explicit missingness flags for CryoSleep and VIP before filling\n        X_val_copy[\"CryoSleep_Missing\"] = X_val_copy[\"CryoSleep\"].isna().astype(int)\n        X_val_copy[\"VIP_Missing\"] = X_val_copy[\"VIP\"].isna().astype(int)\n        \n        # Handle CryoSleep and VIP\n        X_val_copy[\"CryoSleep\"] = X_val_copy[\"CryoSleep\"].fillna(\"Unknown\").astype(str)\n        X_val_copy[\"VIP\"] = X_val_copy[\"VIP\"].fillna(\"Unknown\").astype(str)\n        \n        return pipe.predict(X_val_copy[feature_cols]).astype(bool)\n    \n    return predict\n\n\nif __name__ == \"__main__\":\n    predict_fn = build_predict_fn()\n    score = prepare.evaluate(predict_fn)\n    print(f\"VAL_ACCURACY: {score:.4f}\")\n", "notes_append": "Iteration 37: Replaced XGBoost with LightGBM (num_leaves=8, reg_alpha=1.0, reg_lambda=1.0, max_depth=5) to test whether aggressive regularization on a simpler boosting model breaks the 0.8189 plateau. XGBoost appeared to plateau despite many feature engineering attempts.", "stdout": "VAL_ACCURACY: 0.8062\n", "stderr": "C:\\Roger\\Creating\\Blog\\spaceship-titanic-autoresearch\\.venv\\Lib\\site-packages\\sklearn\\utils\\validation.py:2691: UserWarning: X does not have valid feature names, but LGBMClassifier was fitted with feature names\n  warnings.warn(\n", "returncode": 0, "score": 0.8062, "kept": false, "status": "reverted", "commit_hash": null, "input_tokens": 4158, "output_tokens": 2631, "cost_usd": 0.017313000000000002}
