{"iteration": 6, "timestamp": "2026-05-08T20:52:55", "previous_best": 0.7907, "duration_seconds": 4.13, "agent_response_raw": "<reflection>\nThe last experiment (iter 13) regressed to 0.7901, suggesting that regularization tuning (C=0.5, class_weight='balanced') didn't help. The best score remains 0.7907 from iteration 4, which added simple missingness flags (CryoSleep_Missing, VIP_Missing). I've tried feature engineering (spending aggregates, PersonId), tree models (RandomForest, XGBoost), and regularization — most have either regressed or plateaued. It's time to step back and look at the raw data more carefully to uncover structural patterns I've missed.\n</reflection>\n\n<observations>\n- Iteration 4 achieved 0.7907 with just cabin parsing, GroupId extraction, spending-as-zero imputation, and explicit missingness flags — this remains the best and is quite simple.\n- Iterations 5–13 tried adding more features (spending aggregates, tree models, regularization) but all regressed or matched 0.7901, suggesting I'm adding noise or overfitting.\n- The spending columns (RoomService, FoodCourt, etc.) are filled with 0 when missing, which treats \"no spending\" as a signal; but I haven't inspected whether these columns have natural groupings or whether their sum/patterns correlate with the target differently.\n- The notes mention hints about \"columns encoding multiple pieces of information\" and \"conditional distributions\" — I've parsed Cabin but haven't deeply explored correlations or interaction patterns in the data itself.\n- I should directly inspect the training data (distributions, missing patterns, correlations with target) before proposing the next model change.\n</observations>\n\n<hypothesis>\nInspecting the actual data distributions, missing patterns, and correlation with the target will reveal whether certain columns or missing patterns are strongly predictive in ways the current simple model is missing, and whether a small targeted feature addition (e.g., based on empirical correlation) can push beyond 0.7907.\n</hypothesis>\n\n<plan>\nI will add a brief data exploration phase at the start of build_predict_fn() to print summary statistics: missing value counts, correlation of numeric columns with target, and distribution of categorical columns. This will guide whether the next model change should focus on missing patterns, specific column interactions, or feature selection rather than blind parameter tuning.\n</plan>\n\n<code>\n```python\n\"\"\"\ntrain.py — logistic regression with cabin parsing, GroupId, and explicit missingness flags.\nWith added data inspection to guide next iteration.\n\"\"\"\nimport sys, pathlib\nsys.path.insert(0, str(pathlib.Path(__file__).resolve().parent.parent))\n\nimport pandas as pd\nimport numpy as np\nfrom sklearn.linear_model import LogisticRegression\nfrom sklearn.impute import SimpleImputer\nfrom sklearn.pipeline import Pipeline\nfrom sklearn.preprocessing import StandardScaler, OneHotEncoder\nfrom sklearn.compose import ColumnTransformer\n\nimport prepare\n\nNUMERIC = [\"Age\", \"RoomService\", \"FoodCourt\", \"ShoppingMall\", \"Spa\", \"VRDeck\"]\nCATEGORICAL = [\"HomePlanet\", \"Destination\", \"CryoSleep\", \"VIP\"]\nSPENDING = [\"RoomService\", \"FoodCourt\", \"ShoppingMall\", \"Spa\", \"VRDeck\"]\n\n\ndef parse_cabin(cabin_str):\n    \"\"\"Parse Cabin 'F/0/S' into deck, room_num, side.\"\"\"\n    if pd.isna(cabin_str):\n        return np.nan, np.nan, np.nan\n    parts = str(cabin_str).split(\"/\")\n    if len(parts) == 3:\n        return parts[0], int(parts[1]) if parts[1].isdigit() else np.nan, parts[2]\n    return np.nan, np.nan, np.nan\n\n\ndef extract_group_id(passenger_id):\n    \"\"\"Extract group ID from PassengerId (e.g., '0001_01' -> '0001').\"\"\"\n    if pd.isna(passenger_id):\n        return np.nan\n    return str(passenger_id).split(\"_\")[0]\n\n\ndef build_predict_fn():\n    train_df, _ = prepare.load_split()\n    \n    # === DATA INSPECTION ===\n    print(\"\\n=== DATA INSPECTION ===\")\n    print(\"\\nMissing value counts:\")\n    print(train_df.isnull().sum())\n    \n    print(\"\\nTarget distribution:\")\n    print(train_df[\"Transported\"].value_counts())\n    \n    print(\"\\nCorrelation of numeric columns with target:\")\n    numeric_corr = train_df[NUMERIC + [\"Transported\"]].corr()[\"Transported\"].drop(\"Transported\").sort_values(ascending=False)\n    print(numeric_corr)\n    \n    print(\"\\nCabin missing rate:\", train_df[\"Cabin\"].isnull().sum() / len(train_df))\n    print(\"CryoSleep missing rate:\", train_df[\"CryoSleep\"].isnull().sum() / len(train_df))\n    print(\"VIP missing rate:\", train_df[\"VIP\"].isnull().sum() / len(train_df))\n    \n    print(\"\\nCryoSleep value counts (including NaN):\")\n    print(train_df[\"CryoSleep\"].value_counts(dropna=False))\n    \n    print(\"\\nTransport rate by CryoSleep:\")\n    print(train_df.groupby(\"CryoSleep\", dropna=False)[\"Transported\"].agg([\"sum\", \"count\", \"mean\"]))\n    \n    print(\"\\n=== END INSPECTION ===\\n\")\n    \n    # Parse Cabin into Deck, RoomNum, Side\n    cabin_data = train_df[\"Cabin\"].apply(parse_cabin)\n    train_df[\"Deck\"] = cabin_data.apply(lambda x: x[0])\n    train_df[\"RoomNum\"] = cabin_data.apply(lambda x: x[1])\n    train_df[\"Side\"] = cabin_data.apply(lambda x: x[2])\n    \n    # Extract group ID from PassengerId\n    train_df[\"GroupId\"] = train_df[\"PassengerId\"].apply(extract_group_id)\n    \n    # Fill missing values in spending columns with 0 (indicates not spent)\n    for col in SPENDING:\n        train_df[col] = train_df[col].fillna(0)\n    \n    # Create explicit missingness flags for CryoSleep and VIP before filling\n    train_df[\"CryoSleep_Missing\"] = train_df[\"CryoSleep\"].isna().astype(int)\n    train_df[\"VIP_Missing\"] = train_df[\"VIP\"].isna().astype(int)\n    \n    # Convert CryoSleep and VIP to string for categorical encoding\n    train_df[\"CryoSleep\"] = train_df[\"CryoSleep\"].fillna(\"Unknown\").astype(str)\n    train_df[\"VIP\"] = train_df[\"VIP\"].fillna(\"Unknown\").astype(str)\n    \n    # Build feature set: core features + cabin parsing + missingness flags\n    feature_cols = (\n        [\"Age\"] + SPENDING + CATEGORICAL + \n        [\"Deck\", \"RoomNum\", \"Side\", \"GroupId\"] + \n        [\"CryoSleep_Missing\", \"VIP_Missing\"]\n    )\n    X = train_df[feature_cols]\n    y = train_df[\"Transported\"].astype(int)\n    \n    # Define preprocessing for numeric and categorical columns\n    numeric_transformer = Pipeline([\n        (\"imputer\", SimpleImputer(strategy=\"median\")),\n        (\"scaler\", StandardScaler()),\n    ])\n    \n    categorical_transformer = Pipeline([\n        (\"imputer\", SimpleImputer(strategy=\"most_frequent\")),\n        (\"onehot\", OneHotEncoder(handle_unknown=\"ignore\", sparse_output=False)),\n    ])\n    \n    preprocessor = ColumnTransformer([\n        (\"num\", numeric_transformer, [\"Age\", \"RoomNum\", \"CryoSleep_Missing\", \"VIP_Missing\"] + SPENDING),\n        (\"cat\", categorical_transformer, CATEGORICAL + [\"Deck\", \"Side\", \"GroupId\"]),\n    ])\n    \n    pipe = Pipeline([\n        (\"preprocessor\", preprocessor),\n        (\"clf\", LogisticRegression(max_iter=1000)),\n    ])\n    \n    pipe.fit(X, y)\n    \n    def predict(X_val):\n        # Parse Cabin in validation set\n        cabin_data = X_val[\"Cabin\"].apply(parse_cabin)\n        X_val_copy = X_val.copy()\n        X_val_copy[\"Deck\"] = cabin_data.apply(lambda x: x[0])\n        X_val_copy[\"RoomNum\"] = cabin_data.apply(lambda x: x[1])\n        X_val_copy[\"Side\"] = cabin_data.apply(lambda x: x[2])\n        \n        # Extract group ID\n        X_val_copy[\"GroupId\"] = X_val_copy[\"PassengerId\"].apply(extract_group_id)\n        \n        # Fill missing spending with 0\n        for col in SPENDING:\n            X_val_copy[col] = X_val_copy[col].fillna(0)\n        \n        # Create explicit missingness flags for CryoSleep and VIP before filling\n        X_val_copy[\"CryoSleep_Missing\"] = X_val_copy[\"CryoSleep\"].isna().astype(int)\n        X_val_copy[\"VIP_Missing\"] = X_val_copy[\"VIP\"].isna().astype(int)\n        \n        # Handle CryoSleep and VIP\n        X_val_copy[\"CryoSleep\"] = X_val_copy[\"CryoSleep\"].fillna(\"Unknown\").astype(str)\n        X_val_copy[\"VIP\"] = X_val_copy[\"VIP\"].fillna(\"Unknown\").astype(str)\n        \n        return pipe.predict(X_val_copy[feature_cols]).astype(bool)\n    \n    return predict\n\n\nif __name__ == \"__main__\":\n    predict_fn = build_predict_fn()\n    score = prepare.evaluate(predict_fn)\n    print(f\"VAL_ACCURACY: {score:.4f}\")\n```\n</code>\n\n<notes_append>\nIteration 14: Added data inspection output (missing counts, correlations, categorical distributions, transport rates by key columns) before training to guide next structural change. This run should reveal whether hidden patterns in the data are being missed by the current model.\n</notes_append>", "reflection": "The last experiment (iter 13) regressed to 0.7901, suggesting that regularization tuning (C=0.5, class_weight='balanced') didn't help. The best score remains 0.7907 from iteration 4, which added simple missingness flags (CryoSleep_Missing, VIP_Missing). I've tried feature engineering (spending aggregates, PersonId), tree models (RandomForest, XGBoost), and regularization — most have either regressed or plateaued. It's time to step back and look at the raw data more carefully to uncover structural patterns I've missed.", "observations": ["Iteration 4 achieved 0.7907 with just cabin parsing, GroupId extraction, spending-as-zero imputation, and explicit missingness flags — this remains the best and is quite simple.", "Iterations 5–13 tried adding more features (spending aggregates, tree models, regularization) but all regressed or matched 0.7901, suggesting I'm adding noise or overfitting.", "The spending columns (RoomService, FoodCourt, etc.) are filled with 0 when missing, which treats \"no spending\" as a signal; but I haven't inspected whether these columns have natural groupings or whether their sum/patterns correlate with the target differently.", "The notes mention hints about \"columns encoding multiple pieces of information\" and \"conditional distributions\" — I've parsed Cabin but haven't deeply explored correlations or interaction patterns in the data itself.", "I should directly inspect the training data (distributions, missing patterns, correlations with target) before proposing the next model change."], "hypothesis": "Inspecting the actual data distributions, missing patterns, and correlation with the target will reveal whether certain columns or missing patterns are strongly predictive in ways the current simple model is missing, and whether a small targeted feature addition (e.g., based on empirical correlation) can push beyond 0.7907.", "plan": "I will add a brief data exploration phase at the start of build_predict_fn() to print summary statistics: missing value counts, correlation of numeric columns with target, and distribution of categorical columns. This will guide whether the next model change should focus on missing patterns, specific column interactions, or feature selection rather than blind parameter tuning.", "code": "\"\"\"\ntrain.py — logistic regression with cabin parsing, GroupId, and explicit missingness flags.\nWith added data inspection to guide next iteration.\n\"\"\"\nimport sys, pathlib\nsys.path.insert(0, str(pathlib.Path(__file__).resolve().parent.parent))\n\nimport pandas as pd\nimport numpy as np\nfrom sklearn.linear_model import LogisticRegression\nfrom sklearn.impute import SimpleImputer\nfrom sklearn.pipeline import Pipeline\nfrom sklearn.preprocessing import StandardScaler, OneHotEncoder\nfrom sklearn.compose import ColumnTransformer\n\nimport prepare\n\nNUMERIC = [\"Age\", \"RoomService\", \"FoodCourt\", \"ShoppingMall\", \"Spa\", \"VRDeck\"]\nCATEGORICAL = [\"HomePlanet\", \"Destination\", \"CryoSleep\", \"VIP\"]\nSPENDING = [\"RoomService\", \"FoodCourt\", \"ShoppingMall\", \"Spa\", \"VRDeck\"]\n\n\ndef parse_cabin(cabin_str):\n    \"\"\"Parse Cabin 'F/0/S' into deck, room_num, side.\"\"\"\n    if pd.isna(cabin_str):\n        return np.nan, np.nan, np.nan\n    parts = str(cabin_str).split(\"/\")\n    if len(parts) == 3:\n        return parts[0], int(parts[1]) if parts[1].isdigit() else np.nan, parts[2]\n    return np.nan, np.nan, np.nan\n\n\ndef extract_group_id(passenger_id):\n    \"\"\"Extract group ID from PassengerId (e.g., '0001_01' -> '0001').\"\"\"\n    if pd.isna(passenger_id):\n        return np.nan\n    return str(passenger_id).split(\"_\")[0]\n\n\ndef build_predict_fn():\n    train_df, _ = prepare.load_split()\n    \n    # === DATA INSPECTION ===\n    print(\"\\n=== DATA INSPECTION ===\")\n    print(\"\\nMissing value counts:\")\n    print(train_df.isnull().sum())\n    \n    print(\"\\nTarget distribution:\")\n    print(train_df[\"Transported\"].value_counts())\n    \n    print(\"\\nCorrelation of numeric columns with target:\")\n    numeric_corr = train_df[NUMERIC + [\"Transported\"]].corr()[\"Transported\"].drop(\"Transported\").sort_values(ascending=False)\n    print(numeric_corr)\n    \n    print(\"\\nCabin missing rate:\", train_df[\"Cabin\"].isnull().sum() / len(train_df))\n    print(\"CryoSleep missing rate:\", train_df[\"CryoSleep\"].isnull().sum() / len(train_df))\n    print(\"VIP missing rate:\", train_df[\"VIP\"].isnull().sum() / len(train_df))\n    \n    print(\"\\nCryoSleep value counts (including NaN):\")\n    print(train_df[\"CryoSleep\"].value_counts(dropna=False))\n    \n    print(\"\\nTransport rate by CryoSleep:\")\n    print(train_df.groupby(\"CryoSleep\", dropna=False)[\"Transported\"].agg([\"sum\", \"count\", \"mean\"]))\n    \n    print(\"\\n=== END INSPECTION ===\\n\")\n    \n    # Parse Cabin into Deck, RoomNum, Side\n    cabin_data = train_df[\"Cabin\"].apply(parse_cabin)\n    train_df[\"Deck\"] = cabin_data.apply(lambda x: x[0])\n    train_df[\"RoomNum\"] = cabin_data.apply(lambda x: x[1])\n    train_df[\"Side\"] = cabin_data.apply(lambda x: x[2])\n    \n    # Extract group ID from PassengerId\n    train_df[\"GroupId\"] = train_df[\"PassengerId\"].apply(extract_group_id)\n    \n    # Fill missing values in spending columns with 0 (indicates not spent)\n    for col in SPENDING:\n        train_df[col] = train_df[col].fillna(0)\n    \n    # Create explicit missingness flags for CryoSleep and VIP before filling\n    train_df[\"CryoSleep_Missing\"] = train_df[\"CryoSleep\"].isna().astype(int)\n    train_df[\"VIP_Missing\"] = train_df[\"VIP\"].isna().astype(int)\n    \n    # Convert CryoSleep and VIP to string for categorical encoding\n    train_df[\"CryoSleep\"] = train_df[\"CryoSleep\"].fillna(\"Unknown\").astype(str)\n    train_df[\"VIP\"] = train_df[\"VIP\"].fillna(\"Unknown\").astype(str)\n    \n    # Build feature set: core features + cabin parsing + missingness flags\n    feature_cols = (\n        [\"Age\"] + SPENDING + CATEGORICAL + \n        [\"Deck\", \"RoomNum\", \"Side\", \"GroupId\"] + \n        [\"CryoSleep_Missing\", \"VIP_Missing\"]\n    )\n    X = train_df[feature_cols]\n    y = train_df[\"Transported\"].astype(int)\n    \n    # Define preprocessing for numeric and categorical columns\n    numeric_transformer = Pipeline([\n        (\"imputer\", SimpleImputer(strategy=\"median\")),\n        (\"scaler\", StandardScaler()),\n    ])\n    \n    categorical_transformer = Pipeline([\n        (\"imputer\", SimpleImputer(strategy=\"most_frequent\")),\n        (\"onehot\", OneHotEncoder(handle_unknown=\"ignore\", sparse_output=False)),\n    ])\n    \n    preprocessor = ColumnTransformer([\n        (\"num\", numeric_transformer, [\"Age\", \"RoomNum\", \"CryoSleep_Missing\", \"VIP_Missing\"] + SPENDING),\n        (\"cat\", categorical_transformer, CATEGORICAL + [\"Deck\", \"Side\", \"GroupId\"]),\n    ])\n    \n    pipe = Pipeline([\n        (\"preprocessor\", preprocessor),\n        (\"clf\", LogisticRegression(max_iter=1000)),\n    ])\n    \n    pipe.fit(X, y)\n    \n    def predict(X_val):\n        # Parse Cabin in validation set\n        cabin_data = X_val[\"Cabin\"].apply(parse_cabin)\n        X_val_copy = X_val.copy()\n        X_val_copy[\"Deck\"] = cabin_data.apply(lambda x: x[0])\n        X_val_copy[\"RoomNum\"] = cabin_data.apply(lambda x: x[1])\n        X_val_copy[\"Side\"] = cabin_data.apply(lambda x: x[2])\n        \n        # Extract group ID\n        X_val_copy[\"GroupId\"] = X_val_copy[\"PassengerId\"].apply(extract_group_id)\n        \n        # Fill missing spending with 0\n        for col in SPENDING:\n            X_val_copy[col] = X_val_copy[col].fillna(0)\n        \n        # Create explicit missingness flags for CryoSleep and VIP before filling\n        X_val_copy[\"CryoSleep_Missing\"] = X_val_copy[\"CryoSleep\"].isna().astype(int)\n        X_val_copy[\"VIP_Missing\"] = X_val_copy[\"VIP\"].isna().astype(int)\n        \n        # Handle CryoSleep and VIP\n        X_val_copy[\"CryoSleep\"] = X_val_copy[\"CryoSleep\"].fillna(\"Unknown\").astype(str)\n        X_val_copy[\"VIP\"] = X_val_copy[\"VIP\"].fillna(\"Unknown\").astype(str)\n        \n        return pipe.predict(X_val_copy[feature_cols]).astype(bool)\n    \n    return predict\n\n\nif __name__ == \"__main__\":\n    predict_fn = build_predict_fn()\n    score = prepare.evaluate(predict_fn)\n    print(f\"VAL_ACCURACY: {score:.4f}\")\n", "notes_append": "Iteration 14: Added data inspection output (missing counts, correlations, categorical distributions, transport rates by key columns) before training to guide next structural change. This run should reveal whether hidden patterns in the data are being missed by the current model.", "stdout": "\n=== DATA INSPECTION ===\n\nMissing value counts:\nPassengerId       0\nHomePlanet      169\nCryoSleep       168\nCabin           161\nDestination     153\nAge             139\nVIP             158\nRoomService     145\nFoodCourt       154\nShoppingMall    169\nSpa             150\nVRDeck          144\nName            159\nTransported       0\ndtype: int64\n\nTarget distribution:\nTransported\nTrue     3502\nFalse    3452\nName: count, dtype: int64\n\nCorrelation of numeric columns with target:\nFoodCourt       0.049405\nShoppingMall   -0.001678\nAge            -0.079660\nVRDeck         -0.206128\nSpa            -0.220299\nRoomService    -0.248558\nName: Transported, dtype: float64\n\nCabin missing rate: 0.023152142651711245\nCryoSleep missing rate: 0.024158757549611734\nVIP missing rate: 0.02272073626689675\n\nCryoSleep value counts (including NaN):\nCryoSleep\nFalse    4350\nTrue     2436\nNaN       168\nName: count, dtype: int64\n\nTransport rate by CryoSleep:\n            sum  count      mean\nCryoSleep                       \nFalse      1426   4350  0.327816\nTrue       1994   2436  0.818555\nNaN          82    168  0.488095\n\n=== END INSPECTION ===\n\nVAL_ACCURACY: 0.7907\n", "stderr": "", "returncode": 0, "score": 0.7907, "kept": true, "status": "kept", "commit_hash": "7c21890", "input_tokens": 3903, "output_tokens": 2553, "cost_usd": 0.016668}
