{"iteration": 2, "timestamp": "2026-05-08T22:14:34", "previous_best": 0.8235, "duration_seconds": 3.33, "agent_response_raw": "<reflection>\nIteration 84 (LightGBM with aggressive regularization) scored 0.8051, which is a regression from the baseline 0.8235. The notes show a pattern: we've tried XGBoost hyperparameter tweaking (iter 82–83, all failed), and LightGBM (iter 79, 84, both scored worse than 0.8235). The best score remains iter 0/80 with XGBoost max_depth=6, n_est=100, lr=0.1. Rather than continue tuning the same models, I need to examine the feature engineering itself — specifically whether the features I'm engineering are actually helping, or if simpler features would generalize better.\n</reflection>\n\n<observations>\n- The baseline (iter 80) with 20+ engineered features and XGBoost scores 0.8235. Every deviation from this (LightGBM, hyperparameter tuning, additional interaction features) has regressed or stalled at 0.8051–0.8091.\n- I have not yet systematically removed features to test whether each one actually contributes. The current feature set includes TotalSpending, CryoSleep_LogSpending, Spending_Recorded, GroupSize, GroupMedianSpending, parsed Cabin parts, and missingness flags — many of which I've never validated.\n- The notes mention \"recent stripping attempts scored 0.8091\" but there's no record of which features were removed, or ablation results. This is a critical gap: I don't know which engineered features hurt vs. help.\n- The data is small (~8,700 rows) and the target is binary. Complex feature engineering risks overfitting. A clean approach would be to start with a minimal feature set, validate it beats 0.78, then carefully add only features that improve validation accuracy.\n</observations>\n\n<hypothesis>\nRemoving redundant or overfitted features (specifically GroupSize, GroupMedianSpending, and CryoSleep_LogSpending) will either maintain or improve the validation score, because these features may be fitting noise in the small training set rather than signal. The parsing of Cabin, basic spending aggregation, and missingness flags are more likely to generalize.\n</hypothesis>\n\n<plan>\nDrop GroupSize, GroupMedianSpending, and CryoSleep_LogSpending from the iter 80 feature set. Keep all other engineering: TotalSpending, Spending_Recorded, parsed Cabin, missingness flags, and baseline categorical/numeric features. This reduces complexity and may reduce overfitting. If this scores ≥0.8235, I've found a cleaner solution; if it regresses, I'll know those features were necessary.\n</plan>\n\n<code>\n```python\n\"\"\"\ntrain.py — Iteration 85: Simplify feature set by removing group aggregates and interaction.\nTesting whether GroupSize, GroupMedianSpending, and CryoSleep_LogSpending add noise.\n\"\"\"\nimport sys, pathlib\nsys.path.insert(0, str(pathlib.Path(__file__).resolve().parent.parent))\n\nimport pandas as pd\nimport numpy as np\nimport xgboost as xgb\nfrom sklearn.impute import SimpleImputer\nfrom sklearn.pipeline import Pipeline\nfrom sklearn.preprocessing import StandardScaler, OneHotEncoder\nfrom sklearn.compose import ColumnTransformer\n\nimport prepare\n\nNUMERIC = [\"Age\", \"RoomService\", \"FoodCourt\", \"ShoppingMall\", \"Spa\", \"VRDeck\"]\nCATEGORICAL = [\"HomePlanet\", \"Destination\", \"CryoSleep\", \"VIP\"]\nSPENDING = [\"RoomService\", \"FoodCourt\", \"ShoppingMall\", \"Spa\", \"VRDeck\"]\n\n\ndef parse_cabin(cabin_str):\n    \"\"\"Parse Cabin 'F/0/S' into deck, room_num, side.\"\"\"\n    if pd.isna(cabin_str):\n        return np.nan, np.nan, np.nan\n    parts = str(cabin_str).split(\"/\")\n    if len(parts) == 3:\n        return parts[0], int(parts[1]) if parts[1].isdigit() else np.nan, parts[2]\n    return np.nan, np.nan, np.nan\n\n\ndef engineer_features(df):\n    \"\"\"Engineer spending and spending-related features (no interaction, no group agg).\"\"\"\n    df_copy = df.copy()\n    \n    # Track which rows have any spending data recorded\n    spending_recorded = ~df_copy[SPENDING].isna().any(axis=1)\n    df_copy[\"Spending_Recorded\"] = spending_recorded.astype(int)\n    \n    # Fill missing spending with median per HomePlanet group\n    for col in SPENDING:\n        missing_mask = df_copy[col].isna()\n        if missing_mask.any():\n            group_medians = df_copy.groupby(\"HomePlanet\")[col].median()\n            df_copy.loc[missing_mask, col] = df_copy.loc[missing_mask, \"HomePlanet\"].map(group_medians)\n            global_median = df_copy[col].median()\n            df_copy[col] = df_copy[col].fillna(global_median)\n    \n    # Total spending\n    df_copy[\"TotalSpending\"] = df_copy[SPENDING].sum(axis=1)\n    \n    return df_copy\n\n\ndef build_predict_fn():\n    train_df, _ = prepare.load_split()\n    \n    # Parse Cabin into Deck, RoomNum, Side\n    cabin_data = train_df[\"Cabin\"].apply(parse_cabin)\n    train_df[\"Deck\"] = cabin_data.apply(lambda x: x[0])\n    train_df[\"RoomNum\"] = cabin_data.apply(lambda x: x[1])\n    train_df[\"Side\"] = cabin_data.apply(lambda x: x[2])\n    \n    # Engineer features\n    train_df = engineer_features(train_df)\n    \n    # Create explicit missingness flags for CryoSleep and VIP\n    train_df[\"CryoSleep_Missing\"] = train_df[\"CryoSleep\"].isna().astype(int)\n    train_df[\"VIP_Missing\"] = train_df[\"VIP\"].isna().astype(int)\n    \n    # Convert CryoSleep and VIP to string for categorical encoding\n    train_df[\"CryoSleep\"] = train_df[\"CryoSleep\"].fillna(\"Unknown\").astype(str)\n    train_df[\"VIP\"] = train_df[\"VIP\"].fillna(\"Unknown\").astype(str)\n    \n    # Build feature set (no group aggregates, no CryoSleep_LogSpending)\n    feature_cols = (\n        [\"Age\"] + SPENDING + [\"TotalSpending\", \"Spending_Recorded\"] +\n        CATEGORICAL + \n        [\"Deck\", \"RoomNum\", \"Side\"] + \n        [\"CryoSleep_Missing\", \"VIP_Missing\"]\n    )\n    X = train_df[feature_cols]\n    y = train_df[\"Transported\"].astype(int)\n    \n    # Define preprocessing\n    numeric_transformer = Pipeline([\n        (\"imputer\", SimpleImputer(strategy=\"median\")),\n        (\"scaler\", StandardScaler()),\n    ])\n    \n    categorical_transformer = Pipeline([\n        (\"imputer\", SimpleImputer(strategy=\"most_frequent\")),\n        (\"onehot\", OneHotEncoder(handle_unknown=\"ignore\", sparse_output=False)),\n    ])\n    \n    numeric_feature_cols = (\n        [\"Age\", \"RoomNum\", \"CryoSleep_Missing\", \"VIP_Missing\", \"Spending_Recorded\"] + \n        SPENDING + [\"TotalSpending\"]\n    )\n    categorical_feature_cols = CATEGORICAL + [\"Deck\", \"Side\"]\n    \n    preprocessor = ColumnTransformer([\n        (\"num\", numeric_transformer, numeric_feature_cols),\n        (\"cat\", categorical_transformer, categorical_feature_cols),\n    ])\n    \n    # XGBoost baseline config\n    pipe = Pipeline([\n        (\"preprocessor\", preprocessor),\n        (\"clf\", xgb.XGBClassifier(max_depth=6, n_estimators=100, learning_rate=0.1, random_state=42, verbosity=0)),\n    ])\n    \n    pipe.fit(X, y)\n    \n    def predict(X_val):\n        cabin_data = X_val[\"Cabin\"].apply(parse_cabin)\n        X_val_copy = X_val.copy()\n        X_val_copy[\"Deck\"] = cabin_data.apply(lambda x: x[0])\n        X_val_copy[\"RoomNum\"] = cabin_data.apply(lambda x: x[1])\n        X_val_copy[\"Side\"] = cabin_data.apply(lambda x: x[2])\n        \n        # Engineer features\n        X_val_copy = engineer_features(X_val_copy)\n        \n        # Missingness flags\n        X_val_copy[\"CryoSleep_Missing\"] = X_val_copy[\"CryoSleep\"].isna().astype(int)\n        X_val_copy[\"VIP_Missing\"] = X_val_copy[\"VIP\"].isna().astype(int)\n        \n        # Handle CryoSleep and VIP\n        X_val_copy[\"CryoSleep\"] = X_val_copy[\"CryoSleep\"].fillna(\"Unknown\").astype(str)\n        X_val_copy[\"VIP\"] = X_val_copy[\"VIP\"].fillna(\"Unknown\").astype(str)\n        \n        return pipe.predict(X_val_copy[feature_cols]).astype(bool)\n    \n    return predict\n\n\nif __name__ == \"__main__\":\n    predict_fn = build_predict_fn()\n    score = prepare.evaluate(predict_fn)\n    print(f\"VAL_ACCURACY: {score:.4f}\")\n```\n</code>\n\n<notes_append>\nIteration 85: Removed GroupSize, GroupMedianSpending, CryoSleep_LogSpending from iter 80 to test if these engineered features add noise. Keeping Cabin parsing, TotalSpending, Spending_Recorded, and missingness flags. Testing hypothesis that simpler feature set generalizes better on small dataset.\n</notes_append>", "reflection": "Iteration 84 (LightGBM with aggressive regularization) scored 0.8051, which is a regression from the baseline 0.8235. The notes show a pattern: we've tried XGBoost hyperparameter tweaking (iter 82–83, all failed), and LightGBM (iter 79, 84, both scored worse than 0.8235). The best score remains iter 0/80 with XGBoost max_depth=6, n_est=100, lr=0.1. Rather than continue tuning the same models, I need to examine the feature engineering itself — specifically whether the features I'm engineering are actually helping, or if simpler features would generalize better.", "observations": ["The baseline (iter 80) with 20+ engineered features and XGBoost scores 0.8235. Every deviation from this (LightGBM, hyperparameter tuning, additional interaction features) has regressed or stalled at 0.8051–0.8091.", "I have not yet systematically removed features to test whether each one actually contributes. The current feature set includes TotalSpending, CryoSleep_LogSpending, Spending_Recorded, GroupSize, GroupMedianSpending, parsed Cabin parts, and missingness flags — many of which I've never validated.", "The notes mention \"recent stripping attempts scored 0.8091\" but there's no record of which features were removed, or ablation results. This is a critical gap: I don't know which engineered features hurt vs. help.", "The data is small (~8,700 rows) and the target is binary. Complex feature engineering risks overfitting. A clean approach would be to start with a minimal feature set, validate it beats 0.78, then carefully add only features that improve validation accuracy."], "hypothesis": "Removing redundant or overfitted features (specifically GroupSize, GroupMedianSpending, and CryoSleep_LogSpending) will either maintain or improve the validation score, because these features may be fitting noise in the small training set rather than signal. The parsing of Cabin, basic spending aggregation, and missingness flags are more likely to generalize.", "plan": "Drop GroupSize, GroupMedianSpending, and CryoSleep_LogSpending from the iter 80 feature set. Keep all other engineering: TotalSpending, Spending_Recorded, parsed Cabin, missingness flags, and baseline categorical/numeric features. This reduces complexity and may reduce overfitting. If this scores ≥0.8235, I've found a cleaner solution; if it regresses, I'll know those features were necessary.", "code": "\"\"\"\ntrain.py — Iteration 85: Simplify feature set by removing group aggregates and interaction.\nTesting whether GroupSize, GroupMedianSpending, and CryoSleep_LogSpending add noise.\n\"\"\"\nimport sys, pathlib\nsys.path.insert(0, str(pathlib.Path(__file__).resolve().parent.parent))\n\nimport pandas as pd\nimport numpy as np\nimport xgboost as xgb\nfrom sklearn.impute import SimpleImputer\nfrom sklearn.pipeline import Pipeline\nfrom sklearn.preprocessing import StandardScaler, OneHotEncoder\nfrom sklearn.compose import ColumnTransformer\n\nimport prepare\n\nNUMERIC = [\"Age\", \"RoomService\", \"FoodCourt\", \"ShoppingMall\", \"Spa\", \"VRDeck\"]\nCATEGORICAL = [\"HomePlanet\", \"Destination\", \"CryoSleep\", \"VIP\"]\nSPENDING = [\"RoomService\", \"FoodCourt\", \"ShoppingMall\", \"Spa\", \"VRDeck\"]\n\n\ndef parse_cabin(cabin_str):\n    \"\"\"Parse Cabin 'F/0/S' into deck, room_num, side.\"\"\"\n    if pd.isna(cabin_str):\n        return np.nan, np.nan, np.nan\n    parts = str(cabin_str).split(\"/\")\n    if len(parts) == 3:\n        return parts[0], int(parts[1]) if parts[1].isdigit() else np.nan, parts[2]\n    return np.nan, np.nan, np.nan\n\n\ndef engineer_features(df):\n    \"\"\"Engineer spending and spending-related features (no interaction, no group agg).\"\"\"\n    df_copy = df.copy()\n    \n    # Track which rows have any spending data recorded\n    spending_recorded = ~df_copy[SPENDING].isna().any(axis=1)\n    df_copy[\"Spending_Recorded\"] = spending_recorded.astype(int)\n    \n    # Fill missing spending with median per HomePlanet group\n    for col in SPENDING:\n        missing_mask = df_copy[col].isna()\n        if missing_mask.any():\n            group_medians = df_copy.groupby(\"HomePlanet\")[col].median()\n            df_copy.loc[missing_mask, col] = df_copy.loc[missing_mask, \"HomePlanet\"].map(group_medians)\n            global_median = df_copy[col].median()\n            df_copy[col] = df_copy[col].fillna(global_median)\n    \n    # Total spending\n    df_copy[\"TotalSpending\"] = df_copy[SPENDING].sum(axis=1)\n    \n    return df_copy\n\n\ndef build_predict_fn():\n    train_df, _ = prepare.load_split()\n    \n    # Parse Cabin into Deck, RoomNum, Side\n    cabin_data = train_df[\"Cabin\"].apply(parse_cabin)\n    train_df[\"Deck\"] = cabin_data.apply(lambda x: x[0])\n    train_df[\"RoomNum\"] = cabin_data.apply(lambda x: x[1])\n    train_df[\"Side\"] = cabin_data.apply(lambda x: x[2])\n    \n    # Engineer features\n    train_df = engineer_features(train_df)\n    \n    # Create explicit missingness flags for CryoSleep and VIP\n    train_df[\"CryoSleep_Missing\"] = train_df[\"CryoSleep\"].isna().astype(int)\n    train_df[\"VIP_Missing\"] = train_df[\"VIP\"].isna().astype(int)\n    \n    # Convert CryoSleep and VIP to string for categorical encoding\n    train_df[\"CryoSleep\"] = train_df[\"CryoSleep\"].fillna(\"Unknown\").astype(str)\n    train_df[\"VIP\"] = train_df[\"VIP\"].fillna(\"Unknown\").astype(str)\n    \n    # Build feature set (no group aggregates, no CryoSleep_LogSpending)\n    feature_cols = (\n        [\"Age\"] + SPENDING + [\"TotalSpending\", \"Spending_Recorded\"] +\n        CATEGORICAL + \n        [\"Deck\", \"RoomNum\", \"Side\"] + \n        [\"CryoSleep_Missing\", \"VIP_Missing\"]\n    )\n    X = train_df[feature_cols]\n    y = train_df[\"Transported\"].astype(int)\n    \n    # Define preprocessing\n    numeric_transformer = Pipeline([\n        (\"imputer\", SimpleImputer(strategy=\"median\")),\n        (\"scaler\", StandardScaler()),\n    ])\n    \n    categorical_transformer = Pipeline([\n        (\"imputer\", SimpleImputer(strategy=\"most_frequent\")),\n        (\"onehot\", OneHotEncoder(handle_unknown=\"ignore\", sparse_output=False)),\n    ])\n    \n    numeric_feature_cols = (\n        [\"Age\", \"RoomNum\", \"CryoSleep_Missing\", \"VIP_Missing\", \"Spending_Recorded\"] + \n        SPENDING + [\"TotalSpending\"]\n    )\n    categorical_feature_cols = CATEGORICAL + [\"Deck\", \"Side\"]\n    \n    preprocessor = ColumnTransformer([\n        (\"num\", numeric_transformer, numeric_feature_cols),\n        (\"cat\", categorical_transformer, categorical_feature_cols),\n    ])\n    \n    # XGBoost baseline config\n    pipe = Pipeline([\n        (\"preprocessor\", preprocessor),\n        (\"clf\", xgb.XGBClassifier(max_depth=6, n_estimators=100, learning_rate=0.1, random_state=42, verbosity=0)),\n    ])\n    \n    pipe.fit(X, y)\n    \n    def predict(X_val):\n        cabin_data = X_val[\"Cabin\"].apply(parse_cabin)\n        X_val_copy = X_val.copy()\n        X_val_copy[\"Deck\"] = cabin_data.apply(lambda x: x[0])\n        X_val_copy[\"RoomNum\"] = cabin_data.apply(lambda x: x[1])\n        X_val_copy[\"Side\"] = cabin_data.apply(lambda x: x[2])\n        \n        # Engineer features\n        X_val_copy = engineer_features(X_val_copy)\n        \n        # Missingness flags\n        X_val_copy[\"CryoSleep_Missing\"] = X_val_copy[\"CryoSleep\"].isna().astype(int)\n        X_val_copy[\"VIP_Missing\"] = X_val_copy[\"VIP\"].isna().astype(int)\n        \n        # Handle CryoSleep and VIP\n        X_val_copy[\"CryoSleep\"] = X_val_copy[\"CryoSleep\"].fillna(\"Unknown\").astype(str)\n        X_val_copy[\"VIP\"] = X_val_copy[\"VIP\"].fillna(\"Unknown\").astype(str)\n        \n        return pipe.predict(X_val_copy[feature_cols]).astype(bool)\n    \n    return predict\n\n\nif __name__ == \"__main__\":\n    predict_fn = build_predict_fn()\n    score = prepare.evaluate(predict_fn)\n    print(f\"VAL_ACCURACY: {score:.4f}\")\n", "notes_append": "Iteration 85: Removed GroupSize, GroupMedianSpending, CryoSleep_LogSpending from iter 80 to test if these engineered features add noise. Keeping Cabin parsing, TotalSpending, Spending_Recorded, and missingness flags. Testing hypothesis that simpler feature set generalizes better on small dataset.", "stdout": "VAL_ACCURACY: 0.8183\n", "stderr": "", "returncode": 0, "score": 0.8183, "kept": false, "status": "reverted", "commit_hash": null, "input_tokens": 4888, "output_tokens": 2502, "cost_usd": 0.017398}
