{"iteration": 2, "timestamp": "2026-05-08T21:27:07", "previous_best": 0.8229, "duration_seconds": 4.09, "agent_response_raw": "<reflection>\nThe last run scored 0.8229, which is better than baseline (0.8189) and is our current best. The warnings about chained assignment and inplace operations are cosmetic — the code works but is triggering pandas Copy-on-Write warnings. The smart spending imputation strategy (median per HomePlanet + Spending_Recorded flag) appears to be helping. I should clean up the pandas warnings and then explore whether adding one more structural insight (e.g., better use of group structure from PassengerId, or interaction with deck/side) can push further.\n</reflection>\n\n<observations>\n- Current best is 0.8229 (iteration 43), which beats 0.8189 baseline. The smart spending imputation with group-wise median + binary flag for whether spending was recorded seems effective.\n- The code generates pandas warnings about chained assignment, which are harmless but indicate code smell. Fixing these will make the code cleaner and avoid future issues.\n- The notes suggest previous iterations plateaued at 0.8189 despite many feature engineering attempts. The breakthrough to 0.8229 came from changing *how* we handle missingness (group median vs. 0), not from adding more features.\n- GroupId is already being extracted but may not be fully exploited. Passengers in the same group (same prefix in PassengerId) likely traveled together and share risk; group-level aggregates (e.g., group size, group median age) might encode valuable structure.\n- The current model uses XGBoost with moderate depth (max_depth=6, n_estimators=100). Given we're at 0.8229 and have limited runway, the next push should target structural features, not hyperparameter tweaking.\n</observations>\n\n<hypothesis>\nAdding group-level aggregates (group size, group median age, group mean spending) will improve upon 0.8229 because passengers traveling as a group likely share transportation fate, and group composition encodes collective risk factors not visible at individual level.\n</hypothesis>\n\n<plan>\nI will add three new features derived from GroupId: GroupSize (count of passengers in each group), GroupMedianAge, and GroupMeanSpending. These capture collective group dynamics. I'll also fix the pandas chained assignment warnings by using direct assignment instead of inplace operations. This should test whether group structure is a strong signal while keeping the code clean.\n</plan>\n\n<code>\n```python\n\"\"\"\ntrain.py — Iteration 44: Add group-level aggregates (size, median age, mean spending).\nTest whether group structure (passengers with same GroupId) encodes collective risk that\nimproves beyond 0.8229.\n\"\"\"\nimport sys, pathlib\nsys.path.insert(0, str(pathlib.Path(__file__).resolve().parent.parent))\n\nimport pandas as pd\nimport numpy as np\nimport xgboost as xgb\nfrom sklearn.impute import SimpleImputer\nfrom sklearn.pipeline import Pipeline\nfrom sklearn.preprocessing import StandardScaler, OneHotEncoder\nfrom sklearn.compose import ColumnTransformer\n\nimport prepare\n\nNUMERIC = [\"Age\", \"RoomService\", \"FoodCourt\", \"ShoppingMall\", \"Spa\", \"VRDeck\"]\nCATEGORICAL = [\"HomePlanet\", \"Destination\", \"CryoSleep\", \"VIP\"]\nSPENDING = [\"RoomService\", \"FoodCourt\", \"ShoppingMall\", \"Spa\", \"VRDeck\"]\n\n\ndef parse_cabin(cabin_str):\n    \"\"\"Parse Cabin 'F/0/S' into deck, room_num, side.\"\"\"\n    if pd.isna(cabin_str):\n        return np.nan, np.nan, np.nan\n    parts = str(cabin_str).split(\"/\")\n    if len(parts) == 3:\n        return parts[0], int(parts[1]) if parts[1].isdigit() else np.nan, parts[2]\n    return np.nan, np.nan, np.nan\n\n\ndef extract_group_id(passenger_id):\n    \"\"\"Extract group ID from PassengerId (e.g., '0001_01' -> '0001').\"\"\"\n    if pd.isna(passenger_id):\n        return np.nan\n    return str(passenger_id).split(\"_\")[0]\n\n\ndef engineer_features(df):\n    \"\"\"Engineer spending and spending-cryo interaction features, plus group aggregates.\"\"\"\n    df_copy = df.copy()\n    \n    # Track which spending values were originally recorded (not missing)\n    spending_recorded = ~df_copy[SPENDING].isna().any(axis=1)\n    df_copy[\"Spending_Recorded\"] = spending_recorded.astype(int)\n    \n    # Fill missing spending with median per HomePlanet group\n    for col in SPENDING:\n        missing_mask = df_copy[col].isna()\n        if missing_mask.any():\n            # Compute median per HomePlanet (ignoring NaN within groups)\n            group_medians = df_copy.groupby(\"HomePlanet\")[col].median()\n            # Fill group-wise; any remaining NaN use global median\n            fill_values = df_copy.loc[missing_mask, \"HomePlanet\"].map(group_medians)\n            df_copy.loc[missing_mask, col] = fill_values\n            # Fill any remaining NaN (if whole planet has no data) with global median\n            global_median = df_copy[col].median()\n            df_copy[col] = df_copy[col].fillna(global_median)\n    \n    # Total spending\n    df_copy[\"TotalSpending\"] = df_copy[SPENDING].sum(axis=1)\n    \n    # Interaction: CryoSleep status and spending ratio\n    cryo_status = df_copy[\"CryoSleep\"].fillna(False)\n    log_spending = np.log1p(df_copy[\"TotalSpending\"])\n    df_copy[\"CryoSleep_LogSpending\"] = (\n        (cryo_status == True) * log_spending\n    )\n    \n    # Group-level aggregates\n    if \"GroupId\" in df_copy.columns:\n        group_sizes = df_copy.groupby(\"GroupId\").size()\n        df_copy[\"GroupSize\"] = df_copy[\"GroupId\"].map(group_sizes)\n        \n        group_median_age = df_copy.groupby(\"GroupId\")[\"Age\"].median()\n        df_copy[\"GroupMedianAge\"] = df_copy[\"GroupId\"].map(group_median_age)\n        \n        group_mean_spending = df_copy.groupby(\"GroupId\")[\"TotalSpending\"].mean()\n        df_copy[\"GroupMeanSpending\"] = df_copy[\"GroupId\"].map(group_mean_spending)\n    \n    return df_copy\n\n\ndef build_predict_fn():\n    train_df, _ = prepare.load_split()\n    \n    # Parse Cabin into Deck, RoomNum, Side\n    cabin_data = train_df[\"Cabin\"].apply(parse_cabin)\n    train_df[\"Deck\"] = cabin_data.apply(lambda x: x[0])\n    train_df[\"RoomNum\"] = cabin_data.apply(lambda x: x[1])\n    train_df[\"Side\"] = cabin_data.apply(lambda x: x[2])\n    \n    # Extract group ID from PassengerId\n    train_df[\"GroupId\"] = train_df[\"PassengerId\"].apply(extract_group_id)\n    \n    # Engineer features (including smart spending imputation and group aggregates)\n    train_df = engineer_features(train_df)\n    \n    # Create explicit missingness flags for CryoSleep and VIP before filling\n    train_df[\"CryoSleep_Missing\"] = train_df[\"CryoSleep\"].isna().astype(int)\n    train_df[\"VIP_Missing\"] = train_df[\"VIP\"].isna().astype(int)\n    \n    # Convert CryoSleep and VIP to string for categorical encoding\n    train_df[\"CryoSleep\"] = train_df[\"CryoSleep\"].fillna(\"Unknown\").astype(str)\n    train_df[\"VIP\"] = train_df[\"VIP\"].fillna(\"Unknown\").astype(str)\n    \n    # Build feature set\n    feature_cols = (\n        [\"Age\"] + SPENDING + [\"TotalSpending\", \"CryoSleep_LogSpending\", \"Spending_Recorded\"] +\n        CATEGORICAL + \n        [\"Deck\", \"RoomNum\", \"Side\", \"GroupId\"] + \n        [\"CryoSleep_Missing\", \"VIP_Missing\"] +\n        [\"GroupSize\", \"GroupMedianAge\", \"GroupMeanSpending\"]\n    )\n    X = train_df[feature_cols]\n    y = train_df[\"Transported\"].astype(int)\n    \n    # Define preprocessing for numeric and categorical columns\n    numeric_transformer = Pipeline([\n        (\"imputer\", SimpleImputer(strategy=\"median\")),\n        (\"scaler\", StandardScaler()),\n    ])\n    \n    categorical_transformer = Pipeline([\n        (\"imputer\", SimpleImputer(strategy=\"most_frequent\")),\n        (\"onehot\", OneHotEncoder(handle_unknown=\"ignore\", sparse_output=False)),\n    ])\n    \n    numeric_feature_cols = (\n        [\"Age\", \"RoomNum\", \"CryoSleep_Missing\", \"VIP_Missing\", \"Spending_Recorded\"] + \n        SPENDING + [\"TotalSpending\", \"CryoSleep_LogSpending\",\n                    \"GroupSize\", \"GroupMedianAge\", \"GroupMeanSpending\"]\n    )\n    categorical_feature_cols = CATEGORICAL + [\"Deck\", \"Side\", \"GroupId\"]\n    \n    preprocessor = ColumnTransformer([\n        (\"num\", numeric_transformer, numeric_feature_cols),\n        (\"cat\", categorical_transformer, categorical_feature_cols),\n    ])\n    \n    pipe = Pipeline([\n        (\"preprocessor\", preprocessor),\n        (\"clf\", xgb.XGBClassifier(n_estimators=100, max_depth=6, learning_rate=0.1, random_state=42, verbosity=0)),\n    ])\n    \n    pipe.fit(X, y)\n    \n    def predict(X_val):\n        # Parse Cabin in validation set\n        cabin_data = X_val[\"Cabin\"].apply(parse_cabin)\n        X_val_copy = X_val.copy()\n        X_val_copy[\"Deck\"] = cabin_data.apply(lambda x: x[0])\n        X_val_copy[\"RoomNum\"] = cabin_data.apply(lambda x: x[1])\n        X_val_copy[\"Side\"] = cabin_data.apply(lambda x: x[2])\n        \n        # Extract group ID\n        X_val_copy[\"GroupId\"] = X_val_copy[\"PassengerId\"].apply(extract_group_id)\n        \n        # Engineer features (using same smart spending imputation and group aggregates)\n        X_val_copy = engineer_features(X_val_copy)\n        \n        # Create explicit missingness flags for CryoSleep and VIP before filling\n        X_val_copy[\"CryoSleep_Missing\"] = X_val_copy[\"CryoSleep\"].isna().astype(int)\n        X_val_copy[\"VIP_Missing\"] = X_val_copy[\"VIP\"].isna().astype(int)\n        \n        # Handle CryoSleep and VIP\n        X_val_copy[\"CryoSleep\"] = X_val_copy[\"CryoSleep\"].fillna(\"Unknown\").astype(str)\n        X_val_copy[\"VIP\"] = X_val_copy[\"VIP\"].fillna(\"Unknown\").astype(str)\n        \n        return pipe.predict(X_val_copy[feature_cols]).astype(bool)\n    \n    return predict\n\n\nif __name__ == \"__main__\":\n    predict_fn = build_predict_fn()\n    score = prepare.evaluate(predict_fn)\n    print(f\"VAL_ACCURACY: {score:.4f}\")\n```\n</code>\n\n<notes_append>\nIteration 44: Added group-level aggregates (GroupSize, GroupMedianAge, GroupMeanSpending) derived from GroupId to capture collective risk. Also fixed pandas chained assignment warnings. Hypothesis: group structure encodes shared transportation fate not visible at individual level.\n</notes_append>", "reflection": "The last run scored 0.8229, which is better than baseline (0.8189) and is our current best. The warnings about chained assignment and inplace operations are cosmetic — the code works but is triggering pandas Copy-on-Write warnings. The smart spending imputation strategy (median per HomePlanet + Spending_Recorded flag) appears to be helping. I should clean up the pandas warnings and then explore whether adding one more structural insight (e.g., better use of group structure from PassengerId, or interaction with deck/side) can push further.", "observations": ["Current best is 0.8229 (iteration 43), which beats 0.8189 baseline. The smart spending imputation with group-wise median + binary flag for whether spending was recorded seems effective.", "The code generates pandas warnings about chained assignment, which are harmless but indicate code smell. Fixing these will make the code cleaner and avoid future issues.", "The notes suggest previous iterations plateaued at 0.8189 despite many feature engineering attempts. The breakthrough to 0.8229 came from changing *how* we handle missingness (group median vs. 0), not from adding more features.", "GroupId is already being extracted but may not be fully exploited. Passengers in the same group (same prefix in PassengerId) likely traveled together and share risk; group-level aggregates (e.g., group size, group median age) might encode valuable structure.", "The current model uses XGBoost with moderate depth (max_depth=6, n_estimators=100). Given we're at 0.8229 and have limited runway, the next push should target structural features, not hyperparameter tweaking."], "hypothesis": "Adding group-level aggregates (group size, group median age, group mean spending) will improve upon 0.8229 because passengers traveling as a group likely share transportation fate, and group composition encodes collective risk factors not visible at individual level.", "plan": "I will add three new features derived from GroupId: GroupSize (count of passengers in each group), GroupMedianAge, and GroupMeanSpending. These capture collective group dynamics. I'll also fix the pandas chained assignment warnings by using direct assignment instead of inplace operations. This should test whether group structure is a strong signal while keeping the code clean.", "code": "\"\"\"\ntrain.py — Iteration 44: Add group-level aggregates (size, median age, mean spending).\nTest whether group structure (passengers with same GroupId) encodes collective risk that\nimproves beyond 0.8229.\n\"\"\"\nimport sys, pathlib\nsys.path.insert(0, str(pathlib.Path(__file__).resolve().parent.parent))\n\nimport pandas as pd\nimport numpy as np\nimport xgboost as xgb\nfrom sklearn.impute import SimpleImputer\nfrom sklearn.pipeline import Pipeline\nfrom sklearn.preprocessing import StandardScaler, OneHotEncoder\nfrom sklearn.compose import ColumnTransformer\n\nimport prepare\n\nNUMERIC = [\"Age\", \"RoomService\", \"FoodCourt\", \"ShoppingMall\", \"Spa\", \"VRDeck\"]\nCATEGORICAL = [\"HomePlanet\", \"Destination\", \"CryoSleep\", \"VIP\"]\nSPENDING = [\"RoomService\", \"FoodCourt\", \"ShoppingMall\", \"Spa\", \"VRDeck\"]\n\n\ndef parse_cabin(cabin_str):\n    \"\"\"Parse Cabin 'F/0/S' into deck, room_num, side.\"\"\"\n    if pd.isna(cabin_str):\n        return np.nan, np.nan, np.nan\n    parts = str(cabin_str).split(\"/\")\n    if len(parts) == 3:\n        return parts[0], int(parts[1]) if parts[1].isdigit() else np.nan, parts[2]\n    return np.nan, np.nan, np.nan\n\n\ndef extract_group_id(passenger_id):\n    \"\"\"Extract group ID from PassengerId (e.g., '0001_01' -> '0001').\"\"\"\n    if pd.isna(passenger_id):\n        return np.nan\n    return str(passenger_id).split(\"_\")[0]\n\n\ndef engineer_features(df):\n    \"\"\"Engineer spending and spending-cryo interaction features, plus group aggregates.\"\"\"\n    df_copy = df.copy()\n    \n    # Track which spending values were originally recorded (not missing)\n    spending_recorded = ~df_copy[SPENDING].isna().any(axis=1)\n    df_copy[\"Spending_Recorded\"] = spending_recorded.astype(int)\n    \n    # Fill missing spending with median per HomePlanet group\n    for col in SPENDING:\n        missing_mask = df_copy[col].isna()\n        if missing_mask.any():\n            # Compute median per HomePlanet (ignoring NaN within groups)\n            group_medians = df_copy.groupby(\"HomePlanet\")[col].median()\n            # Fill group-wise; any remaining NaN use global median\n            fill_values = df_copy.loc[missing_mask, \"HomePlanet\"].map(group_medians)\n            df_copy.loc[missing_mask, col] = fill_values\n            # Fill any remaining NaN (if whole planet has no data) with global median\n            global_median = df_copy[col].median()\n            df_copy[col] = df_copy[col].fillna(global_median)\n    \n    # Total spending\n    df_copy[\"TotalSpending\"] = df_copy[SPENDING].sum(axis=1)\n    \n    # Interaction: CryoSleep status and spending ratio\n    cryo_status = df_copy[\"CryoSleep\"].fillna(False)\n    log_spending = np.log1p(df_copy[\"TotalSpending\"])\n    df_copy[\"CryoSleep_LogSpending\"] = (\n        (cryo_status == True) * log_spending\n    )\n    \n    # Group-level aggregates\n    if \"GroupId\" in df_copy.columns:\n        group_sizes = df_copy.groupby(\"GroupId\").size()\n        df_copy[\"GroupSize\"] = df_copy[\"GroupId\"].map(group_sizes)\n        \n        group_median_age = df_copy.groupby(\"GroupId\")[\"Age\"].median()\n        df_copy[\"GroupMedianAge\"] = df_copy[\"GroupId\"].map(group_median_age)\n        \n        group_mean_spending = df_copy.groupby(\"GroupId\")[\"TotalSpending\"].mean()\n        df_copy[\"GroupMeanSpending\"] = df_copy[\"GroupId\"].map(group_mean_spending)\n    \n    return df_copy\n\n\ndef build_predict_fn():\n    train_df, _ = prepare.load_split()\n    \n    # Parse Cabin into Deck, RoomNum, Side\n    cabin_data = train_df[\"Cabin\"].apply(parse_cabin)\n    train_df[\"Deck\"] = cabin_data.apply(lambda x: x[0])\n    train_df[\"RoomNum\"] = cabin_data.apply(lambda x: x[1])\n    train_df[\"Side\"] = cabin_data.apply(lambda x: x[2])\n    \n    # Extract group ID from PassengerId\n    train_df[\"GroupId\"] = train_df[\"PassengerId\"].apply(extract_group_id)\n    \n    # Engineer features (including smart spending imputation and group aggregates)\n    train_df = engineer_features(train_df)\n    \n    # Create explicit missingness flags for CryoSleep and VIP before filling\n    train_df[\"CryoSleep_Missing\"] = train_df[\"CryoSleep\"].isna().astype(int)\n    train_df[\"VIP_Missing\"] = train_df[\"VIP\"].isna().astype(int)\n    \n    # Convert CryoSleep and VIP to string for categorical encoding\n    train_df[\"CryoSleep\"] = train_df[\"CryoSleep\"].fillna(\"Unknown\").astype(str)\n    train_df[\"VIP\"] = train_df[\"VIP\"].fillna(\"Unknown\").astype(str)\n    \n    # Build feature set\n    feature_cols = (\n        [\"Age\"] + SPENDING + [\"TotalSpending\", \"CryoSleep_LogSpending\", \"Spending_Recorded\"] +\n        CATEGORICAL + \n        [\"Deck\", \"RoomNum\", \"Side\", \"GroupId\"] + \n        [\"CryoSleep_Missing\", \"VIP_Missing\"] +\n        [\"GroupSize\", \"GroupMedianAge\", \"GroupMeanSpending\"]\n    )\n    X = train_df[feature_cols]\n    y = train_df[\"Transported\"].astype(int)\n    \n    # Define preprocessing for numeric and categorical columns\n    numeric_transformer = Pipeline([\n        (\"imputer\", SimpleImputer(strategy=\"median\")),\n        (\"scaler\", StandardScaler()),\n    ])\n    \n    categorical_transformer = Pipeline([\n        (\"imputer\", SimpleImputer(strategy=\"most_frequent\")),\n        (\"onehot\", OneHotEncoder(handle_unknown=\"ignore\", sparse_output=False)),\n    ])\n    \n    numeric_feature_cols = (\n        [\"Age\", \"RoomNum\", \"CryoSleep_Missing\", \"VIP_Missing\", \"Spending_Recorded\"] + \n        SPENDING + [\"TotalSpending\", \"CryoSleep_LogSpending\",\n                    \"GroupSize\", \"GroupMedianAge\", \"GroupMeanSpending\"]\n    )\n    categorical_feature_cols = CATEGORICAL + [\"Deck\", \"Side\", \"GroupId\"]\n    \n    preprocessor = ColumnTransformer([\n        (\"num\", numeric_transformer, numeric_feature_cols),\n        (\"cat\", categorical_transformer, categorical_feature_cols),\n    ])\n    \n    pipe = Pipeline([\n        (\"preprocessor\", preprocessor),\n        (\"clf\", xgb.XGBClassifier(n_estimators=100, max_depth=6, learning_rate=0.1, random_state=42, verbosity=0)),\n    ])\n    \n    pipe.fit(X, y)\n    \n    def predict(X_val):\n        # Parse Cabin in validation set\n        cabin_data = X_val[\"Cabin\"].apply(parse_cabin)\n        X_val_copy = X_val.copy()\n        X_val_copy[\"Deck\"] = cabin_data.apply(lambda x: x[0])\n        X_val_copy[\"RoomNum\"] = cabin_data.apply(lambda x: x[1])\n        X_val_copy[\"Side\"] = cabin_data.apply(lambda x: x[2])\n        \n        # Extract group ID\n        X_val_copy[\"GroupId\"] = X_val_copy[\"PassengerId\"].apply(extract_group_id)\n        \n        # Engineer features (using same smart spending imputation and group aggregates)\n        X_val_copy = engineer_features(X_val_copy)\n        \n        # Create explicit missingness flags for CryoSleep and VIP before filling\n        X_val_copy[\"CryoSleep_Missing\"] = X_val_copy[\"CryoSleep\"].isna().astype(int)\n        X_val_copy[\"VIP_Missing\"] = X_val_copy[\"VIP\"].isna().astype(int)\n        \n        # Handle CryoSleep and VIP\n        X_val_copy[\"CryoSleep\"] = X_val_copy[\"CryoSleep\"].fillna(\"Unknown\").astype(str)\n        X_val_copy[\"VIP\"] = X_val_copy[\"VIP\"].fillna(\"Unknown\").astype(str)\n        \n        return pipe.predict(X_val_copy[feature_cols]).astype(bool)\n    \n    return predict\n\n\nif __name__ == \"__main__\":\n    predict_fn = build_predict_fn()\n    score = prepare.evaluate(predict_fn)\n    print(f\"VAL_ACCURACY: {score:.4f}\")\n", "notes_append": "Iteration 44: Added group-level aggregates (GroupSize, GroupMedianAge, GroupMeanSpending) derived from GroupId to capture collective risk. Also fixed pandas chained assignment warnings. Hypothesis: group structure encodes shared transportation fate not visible at individual level.", "stdout": "VAL_ACCURACY: 0.8114\n", "stderr": "", "returncode": 0, "score": 0.8114, "kept": false, "status": "reverted", "commit_hash": null, "input_tokens": 4742, "output_tokens": 2979, "cost_usd": 0.019636999999999998}
