{"iteration": 3, "timestamp": "2026-05-08T21:27:34", "previous_best": 0.8229, "duration_seconds": 1.97, "agent_response_raw": "<reflection>\nThe last iteration (iter 2) added group-level aggregates (GroupSize, GroupMedianAge, GroupMeanSpending) but regressed from 0.8229 to 0.8114. This suggests that adding more complexity is not helping — the current best score is still 0.8229 from iteration 1, which used smart spending imputation with HomePlanet-median filling and a Spending_Recorded flag. The notes show a pattern of diminishing returns: 44 iterations with many feature engineering ideas, most staying at or below 0.8189 baseline, with only iteration 1 breaking through to 0.8229. The regression in iter 2 suggests group aggregates introduced noise rather than signal.\n</reflection>\n\n<observations>\n- Current best (0.8229) came from iteration 1, which added smart spending imputation (median per HomePlanet) and a Spending_Recorded binary flag. This is a relatively simple, interpretable change that beats baseline.\n- Iteration 2 attempted to build on this by adding group-level aggregates but regressed to 0.8114, suggesting overfitting or feature redundancy.\n- The notes show 44 prior iterations mostly stuck at 0.8189 baseline; feature engineering complexity has not consistently improved the score.\n- The current train.py (iter 43) uses the 0.8229-winning approach (smart spending + Spending_Recorded flag) but the last run output shows 0.8114, indicating this code is not the iter 1 winner — there may be a discrepancy between what's documented and what's actually in train.py.\n- Reverting to the exact iteration 1 code (or running it identically) should confirm whether 0.8229 is reproducible, before attempting any new direction.\n</observations>\n\n<hypothesis>\nThe train.py currently claims to be iteration 43 but the last run scored 0.8114 instead of the expected 0.8229 from iteration 1. This suggests the code may have drifted or the iteration numbering is inconsistent. Reverting to the cleanest known-winning version (iteration 1: smart spending imputation + Spending_Recorded flag, without group aggregates) will re-establish 0.8229 as the baseline and allow confident iteration forward.\n</hypothesis>\n\n<plan>\nI will carefully reconstruct train.py to match the exact structure of iteration 1, which achieved 0.8229. This means keeping smart HomePlanet-median spending imputation and the Spending_Recorded flag, but removing the group aggregates (GroupSize, GroupMedianAge, GroupMeanSpending) that were added in iteration 2 and caused regression. Once this baseline is confirmed, I can propose new directions with confidence.\n</plan>\n\n<code>\n```python\n\"\"\"\ntrain.py — Iteration 45: Revert to clean iteration 1 (smart spending + Spending_Recorded).\nRemove group aggregates that regressed score in iter 2.\nConfirm 0.8229 baseline before proposing new structural changes.\n\"\"\"\nimport sys, pathlib\nsys.path.insert(0, str(pathlib.Path(__file__).resolve().parent.parent))\n\nimport pandas as pd\nimport numpy as np\nimport xgboost as xgb\nfrom sklearn.impute import SimpleImputer\nfrom sklearn.pipeline import Pipeline\nfrom sklearn.preprocessing import StandardScaler, OneHotEncoder\nfrom sklearn.compose import ColumnTransformer\n\nimport prepare\n\nNUMERIC = [\"Age\", \"RoomService\", \"FoodCourt\", \"ShoppingMall\", \"Spa\", \"VRDeck\"]\nCATEGORICAL = [\"HomePlanet\", \"Destination\", \"CryoSleep\", \"VIP\"]\nSPENDING = [\"RoomService\", \"FoodCourt\", \"ShoppingMall\", \"Spa\", \"VRDeck\"]\n\n\ndef parse_cabin(cabin_str):\n    \"\"\"Parse Cabin 'F/0/S' into deck, room_num, side.\"\"\"\n    if pd.isna(cabin_str):\n        return np.nan, np.nan, np.nan\n    parts = str(cabin_str).split(\"/\")\n    if len(parts) == 3:\n        return parts[0], int(parts[1]) if parts[1].isdigit() else np.nan, parts[2]\n    return np.nan, np.nan, np.nan\n\n\ndef engineer_features(df):\n    \"\"\"Engineer spending and spending-cryo interaction features.\"\"\"\n    df_copy = df.copy()\n    \n    # Track which spending values were originally recorded (not missing)\n    spending_recorded = ~df_copy[SPENDING].isna().any(axis=1)\n    df_copy[\"Spending_Recorded\"] = spending_recorded.astype(int)\n    \n    # Fill missing spending with median per HomePlanet group\n    for col in SPENDING:\n        missing_mask = df_copy[col].isna()\n        if missing_mask.any():\n            # Compute median per HomePlanet (ignoring NaN within groups)\n            group_medians = df_copy.groupby(\"HomePlanet\")[col].median()\n            # Fill group-wise; any remaining NaN (if whole planet has no data) use global median\n            df_copy.loc[missing_mask, col] = df_copy.loc[missing_mask, \"HomePlanet\"].map(group_medians)\n            global_median = df_copy[col].median()\n            df_copy[col].fillna(global_median, inplace=True)\n    \n    # Total spending\n    df_copy[\"TotalSpending\"] = df_copy[SPENDING].sum(axis=1)\n    \n    # Interaction: CryoSleep status and spending ratio\n    cryo_status = df_copy[\"CryoSleep\"].fillna(False)\n    log_spending = np.log1p(df_copy[\"TotalSpending\"])\n    df_copy[\"CryoSleep_LogSpending\"] = (\n        (cryo_status == True) * log_spending\n    )\n    \n    return df_copy\n\n\ndef build_predict_fn():\n    train_df, _ = prepare.load_split()\n    \n    # Parse Cabin into Deck, RoomNum, Side\n    cabin_data = train_df[\"Cabin\"].apply(parse_cabin)\n    train_df[\"Deck\"] = cabin_data.apply(lambda x: x[0])\n    train_df[\"RoomNum\"] = cabin_data.apply(lambda x: x[1])\n    train_df[\"Side\"] = cabin_data.apply(lambda x: x[2])\n    \n    # Engineer features (including smart spending imputation)\n    train_df = engineer_features(train_df)\n    \n    # Create explicit missingness flags for CryoSleep and VIP before filling\n    train_df[\"CryoSleep_Missing\"] = train_df[\"CryoSleep\"].isna().astype(int)\n    train_df[\"VIP_Missing\"] = train_df[\"VIP\"].isna().astype(int)\n    \n    # Convert CryoSleep and VIP to string for categorical encoding\n    train_df[\"CryoSleep\"] = train_df[\"CryoSleep\"].fillna(\"Unknown\").astype(str)\n    train_df[\"VIP\"] = train_df[\"VIP\"].fillna(\"Unknown\").astype(str)\n    \n    # Build feature set\n    feature_cols = (\n        [\"Age\"] + SPENDING + [\"TotalSpending\", \"CryoSleep_LogSpending\", \"Spending_Recorded\"] +\n        CATEGORICAL + \n        [\"Deck\", \"RoomNum\", \"Side\"] + \n        [\"CryoSleep_Missing\", \"VIP_Missing\"]\n    )\n    X = train_df[feature_cols]\n    y = train_df[\"Transported\"].astype(int)\n    \n    # Define preprocessing for numeric and categorical columns\n    numeric_transformer = Pipeline([\n        (\"imputer\", SimpleImputer(strategy=\"median\")),\n        (\"scaler\", StandardScaler()),\n    ])\n    \n    categorical_transformer = Pipeline([\n        (\"imputer\", SimpleImputer(strategy=\"most_frequent\")),\n        (\"onehot\", OneHotEncoder(handle_unknown=\"ignore\", sparse_output=False)),\n    ])\n    \n    numeric_feature_cols = (\n        [\"Age\", \"RoomNum\", \"CryoSleep_Missing\", \"VIP_Missing\", \"Spending_Recorded\"] + \n        SPENDING + [\"TotalSpending\", \"CryoSleep_LogSpending\"]\n    )\n    categorical_feature_cols = CATEGORICAL + [\"Deck\", \"Side\"]\n    \n    preprocessor = ColumnTransformer([\n        (\"num\", numeric_transformer, numeric_feature_cols),\n        (\"cat\", categorical_transformer, categorical_feature_cols),\n    ])\n    \n    pipe = Pipeline([\n        (\"preprocessor\", preprocessor),\n        (\"clf\", xgb.XGBClassifier(n_estimators=100, max_depth=6, learning_rate=0.1, random_state=42, verbosity=0)),\n    ])\n    \n    pipe.fit(X, y)\n    \n    def predict(X_val):\n        # Parse Cabin in validation set\n        cabin_data = X_val[\"Cabin\"].apply(parse_cabin)\n        X_val_copy = X_val.copy()\n        X_val_copy[\"Deck\"] = cabin_data.apply(lambda x: x[0])\n        X_val_copy[\"RoomNum\"] = cabin_data.apply(lambda x: x[1])\n        X_val_copy[\"Side\"] = cabin_data.apply(lambda x: x[2])\n        \n        # Engineer features (using same smart spending imputation)\n        X_val_copy = engineer_features(X_val_copy)\n        \n        # Create explicit missingness flags for CryoSleep and VIP before filling\n        X_val_copy[\"CryoSleep_Missing\"] = X_val_copy[\"CryoSleep\"].isna().astype(int)\n        X_val_copy[\"VIP_Missing\"] = X_val_copy[\"VIP\"].isna().astype(int)\n        \n        # Handle CryoSleep and VIP\n        X_val_copy[\"CryoSleep\"] = X_val_copy[\"CryoSleep\"].fillna(\"Unknown\").astype(str)\n        X_val_copy[\"VIP\"] = X_val_copy[\"VIP\"].fillna(\"Unknown\").astype(str)\n        \n        return pipe.predict(X_val_copy[feature_cols]).astype(bool)\n    \n    return predict\n\n\nif __name__ == \"__main__\":\n    predict_fn = build_predict_fn()\n    score = prepare.evaluate(predict_fn)\n    print(f\"VAL_ACCURACY: {score:.4f}\")\n```\n</code>\n\n<notes_append>\nIteration 45: Reverted to clean iteration 1 code (smart spending imputation + Spending_Recorded flag, no group aggregates) to confirm 0.8229 baseline. Iteration 2's group aggregates regressed to 0.8114; removing them to rebuild confidence in the 0.8229 anchor point.\n</notes_append>", "reflection": "The last iteration (iter 2) added group-level aggregates (GroupSize, GroupMedianAge, GroupMeanSpending) but regressed from 0.8229 to 0.8114. This suggests that adding more complexity is not helping — the current best score is still 0.8229 from iteration 1, which used smart spending imputation with HomePlanet-median filling and a Spending_Recorded flag. The notes show a pattern of diminishing returns: 44 iterations with many feature engineering ideas, most staying at or below 0.8189 baseline, with only iteration 1 breaking through to 0.8229. The regression in iter 2 suggests group aggregates introduced noise rather than signal.", "observations": ["Current best (0.8229) came from iteration 1, which added smart spending imputation (median per HomePlanet) and a Spending_Recorded binary flag. This is a relatively simple, interpretable change that beats baseline.", "Iteration 2 attempted to build on this by adding group-level aggregates but regressed to 0.8114, suggesting overfitting or feature redundancy.", "The notes show 44 prior iterations mostly stuck at 0.8189 baseline; feature engineering complexity has not consistently improved the score.", "The current train.py (iter 43) uses the 0.8229-winning approach (smart spending + Spending_Recorded flag) but the last run output shows 0.8114, indicating this code is not the iter 1 winner — there may be a discrepancy between what's documented and what's actually in train.py.", "Reverting to the exact iteration 1 code (or running it identically) should confirm whether 0.8229 is reproducible, before attempting any new direction."], "hypothesis": "The train.py currently claims to be iteration 43 but the last run scored 0.8114 instead of the expected 0.8229 from iteration 1. This suggests the code may have drifted or the iteration numbering is inconsistent. Reverting to the cleanest known-winning version (iteration 1: smart spending imputation + Spending_Recorded flag, without group aggregates) will re-establish 0.8229 as the baseline and allow confident iteration forward.", "plan": "I will carefully reconstruct train.py to match the exact structure of iteration 1, which achieved 0.8229. This means keeping smart HomePlanet-median spending imputation and the Spending_Recorded flag, but removing the group aggregates (GroupSize, GroupMedianAge, GroupMeanSpending) that were added in iteration 2 and caused regression. Once this baseline is confirmed, I can propose new directions with confidence.", "code": "\"\"\"\ntrain.py — Iteration 45: Revert to clean iteration 1 (smart spending + Spending_Recorded).\nRemove group aggregates that regressed score in iter 2.\nConfirm 0.8229 baseline before proposing new structural changes.\n\"\"\"\nimport sys, pathlib\nsys.path.insert(0, str(pathlib.Path(__file__).resolve().parent.parent))\n\nimport pandas as pd\nimport numpy as np\nimport xgboost as xgb\nfrom sklearn.impute import SimpleImputer\nfrom sklearn.pipeline import Pipeline\nfrom sklearn.preprocessing import StandardScaler, OneHotEncoder\nfrom sklearn.compose import ColumnTransformer\n\nimport prepare\n\nNUMERIC = [\"Age\", \"RoomService\", \"FoodCourt\", \"ShoppingMall\", \"Spa\", \"VRDeck\"]\nCATEGORICAL = [\"HomePlanet\", \"Destination\", \"CryoSleep\", \"VIP\"]\nSPENDING = [\"RoomService\", \"FoodCourt\", \"ShoppingMall\", \"Spa\", \"VRDeck\"]\n\n\ndef parse_cabin(cabin_str):\n    \"\"\"Parse Cabin 'F/0/S' into deck, room_num, side.\"\"\"\n    if pd.isna(cabin_str):\n        return np.nan, np.nan, np.nan\n    parts = str(cabin_str).split(\"/\")\n    if len(parts) == 3:\n        return parts[0], int(parts[1]) if parts[1].isdigit() else np.nan, parts[2]\n    return np.nan, np.nan, np.nan\n\n\ndef engineer_features(df):\n    \"\"\"Engineer spending and spending-cryo interaction features.\"\"\"\n    df_copy = df.copy()\n    \n    # Track which spending values were originally recorded (not missing)\n    spending_recorded = ~df_copy[SPENDING].isna().any(axis=1)\n    df_copy[\"Spending_Recorded\"] = spending_recorded.astype(int)\n    \n    # Fill missing spending with median per HomePlanet group\n    for col in SPENDING:\n        missing_mask = df_copy[col].isna()\n        if missing_mask.any():\n            # Compute median per HomePlanet (ignoring NaN within groups)\n            group_medians = df_copy.groupby(\"HomePlanet\")[col].median()\n            # Fill group-wise; any remaining NaN (if whole planet has no data) use global median\n            df_copy.loc[missing_mask, col] = df_copy.loc[missing_mask, \"HomePlanet\"].map(group_medians)\n            global_median = df_copy[col].median()\n            df_copy[col].fillna(global_median, inplace=True)\n    \n    # Total spending\n    df_copy[\"TotalSpending\"] = df_copy[SPENDING].sum(axis=1)\n    \n    # Interaction: CryoSleep status and spending ratio\n    cryo_status = df_copy[\"CryoSleep\"].fillna(False)\n    log_spending = np.log1p(df_copy[\"TotalSpending\"])\n    df_copy[\"CryoSleep_LogSpending\"] = (\n        (cryo_status == True) * log_spending\n    )\n    \n    return df_copy\n\n\ndef build_predict_fn():\n    train_df, _ = prepare.load_split()\n    \n    # Parse Cabin into Deck, RoomNum, Side\n    cabin_data = train_df[\"Cabin\"].apply(parse_cabin)\n    train_df[\"Deck\"] = cabin_data.apply(lambda x: x[0])\n    train_df[\"RoomNum\"] = cabin_data.apply(lambda x: x[1])\n    train_df[\"Side\"] = cabin_data.apply(lambda x: x[2])\n    \n    # Engineer features (including smart spending imputation)\n    train_df = engineer_features(train_df)\n    \n    # Create explicit missingness flags for CryoSleep and VIP before filling\n    train_df[\"CryoSleep_Missing\"] = train_df[\"CryoSleep\"].isna().astype(int)\n    train_df[\"VIP_Missing\"] = train_df[\"VIP\"].isna().astype(int)\n    \n    # Convert CryoSleep and VIP to string for categorical encoding\n    train_df[\"CryoSleep\"] = train_df[\"CryoSleep\"].fillna(\"Unknown\").astype(str)\n    train_df[\"VIP\"] = train_df[\"VIP\"].fillna(\"Unknown\").astype(str)\n    \n    # Build feature set\n    feature_cols = (\n        [\"Age\"] + SPENDING + [\"TotalSpending\", \"CryoSleep_LogSpending\", \"Spending_Recorded\"] +\n        CATEGORICAL + \n        [\"Deck\", \"RoomNum\", \"Side\"] + \n        [\"CryoSleep_Missing\", \"VIP_Missing\"]\n    )\n    X = train_df[feature_cols]\n    y = train_df[\"Transported\"].astype(int)\n    \n    # Define preprocessing for numeric and categorical columns\n    numeric_transformer = Pipeline([\n        (\"imputer\", SimpleImputer(strategy=\"median\")),\n        (\"scaler\", StandardScaler()),\n    ])\n    \n    categorical_transformer = Pipeline([\n        (\"imputer\", SimpleImputer(strategy=\"most_frequent\")),\n        (\"onehot\", OneHotEncoder(handle_unknown=\"ignore\", sparse_output=False)),\n    ])\n    \n    numeric_feature_cols = (\n        [\"Age\", \"RoomNum\", \"CryoSleep_Missing\", \"VIP_Missing\", \"Spending_Recorded\"] + \n        SPENDING + [\"TotalSpending\", \"CryoSleep_LogSpending\"]\n    )\n    categorical_feature_cols = CATEGORICAL + [\"Deck\", \"Side\"]\n    \n    preprocessor = ColumnTransformer([\n        (\"num\", numeric_transformer, numeric_feature_cols),\n        (\"cat\", categorical_transformer, categorical_feature_cols),\n    ])\n    \n    pipe = Pipeline([\n        (\"preprocessor\", preprocessor),\n        (\"clf\", xgb.XGBClassifier(n_estimators=100, max_depth=6, learning_rate=0.1, random_state=42, verbosity=0)),\n    ])\n    \n    pipe.fit(X, y)\n    \n    def predict(X_val):\n        # Parse Cabin in validation set\n        cabin_data = X_val[\"Cabin\"].apply(parse_cabin)\n        X_val_copy = X_val.copy()\n        X_val_copy[\"Deck\"] = cabin_data.apply(lambda x: x[0])\n        X_val_copy[\"RoomNum\"] = cabin_data.apply(lambda x: x[1])\n        X_val_copy[\"Side\"] = cabin_data.apply(lambda x: x[2])\n        \n        # Engineer features (using same smart spending imputation)\n        X_val_copy = engineer_features(X_val_copy)\n        \n        # Create explicit missingness flags for CryoSleep and VIP before filling\n        X_val_copy[\"CryoSleep_Missing\"] = X_val_copy[\"CryoSleep\"].isna().astype(int)\n        X_val_copy[\"VIP_Missing\"] = X_val_copy[\"VIP\"].isna().astype(int)\n        \n        # Handle CryoSleep and VIP\n        X_val_copy[\"CryoSleep\"] = X_val_copy[\"CryoSleep\"].fillna(\"Unknown\").astype(str)\n        X_val_copy[\"VIP\"] = X_val_copy[\"VIP\"].fillna(\"Unknown\").astype(str)\n        \n        return pipe.predict(X_val_copy[feature_cols]).astype(bool)\n    \n    return predict\n\n\nif __name__ == \"__main__\":\n    predict_fn = build_predict_fn()\n    score = prepare.evaluate(predict_fn)\n    print(f\"VAL_ACCURACY: {score:.4f}\")\n", "notes_append": "Iteration 45: Reverted to clean iteration 1 code (smart spending imputation + Spending_Recorded flag, no group aggregates) to confirm 0.8229 baseline. Iteration 2's group aggregates regressed to 0.8114; removing them to rebuild confidence in the 0.8229 anchor point.", "stdout": "VAL_ACCURACY: 0.8183\n", "stderr": "ssignment using an inplace method.\nSuch inplace method never works to update the original DataFrame or Series, because the intermediate object on which we are setting values always behaves as a copy (due to Copy-on-Write).\n\nFor example, when doing 'df[col].method(value, inplace=True)', try using 'df.method({col: value}, inplace=True)' instead, to perform the operation inplace on the original object, or try to avoid an inplace operation using 'df[col] = df[col].method(value)'.\n\nSee the documentation for a more detailed explanation: https://pandas.pydata.org/pandas-docs/stable/user_guide/copy_on_write.html\n  df_copy[col].fillna(global_median, inplace=True)\nC:\\Roger\\Creating\\Blog\\spaceship-titanic-autoresearch\\workspace\\train.py:51: ChainedAssignmentError: A value is being set on a copy of a DataFrame or Series through chained assignment using an inplace method.\nSuch inplace method never works to update the original DataFrame or Series, because the intermediate object on which we are setting values always behaves as a copy (due to Copy-on-Write).\n\nFor example, when doing 'df[col].method(value, inplace=True)', try using 'df.method({col: value}, inplace=True)' instead, to perform the operation inplace on the original object, or try to avoid an inplace operation using 'df[col] = df[col].method(value)'.\n\nSee the documentation for a more detailed explanation: https://pandas.pydata.org/pandas-docs/stable/user_guide/copy_on_write.html\n  df_copy[col].fillna(global_median, inplace=True)\n", "returncode": 0, "score": 0.8183, "kept": false, "status": "reverted", "commit_hash": null, "input_tokens": 4361, "output_tokens": 2697, "cost_usd": 0.017846}
