{"iteration": 3, "timestamp": "2026-05-08T22:10:17", "previous_best": 0.8235, "duration_seconds": 3.32, "agent_response_raw": "<reflection>\nThe current best remains 0.8235 from iteration 0, but the script has been drifting through feature engineering and refactors that consistently regress to ~0.81. The last run (iter 75) scored 0.8114, suggesting the code in train.py does not match iter 0 exactly, or the EDA/print statements are interfering. I need to strip the code to absolute minimum, verify it matches the iter 0 baseline exactly, and then test one small, orthogonal change systematically.\n</reflection>\n\n<observations>\n- The notes show iter 0 achieved 0.8235 with a minimal baseline: Age + 5 spending + 4 categorical + parsed Cabin, XGBoost (max_depth=6, n_est=100, lr=0.1). Every subsequent change has regressed.\n- The current train.py includes EDA printing and group-level features not in iter 0, which may be noise. The notes claim \"Iteration 75: Restored exact iter 0 baseline\" but the actual file contains significantly more code, suggesting the notes and code are out of sync.\n- The EDA function calls `print_eda(train_df)` unconditionally before building the model, which adds latency and may interfere with the evaluation harness if stdout is being parsed.\n- Recent iterations (73, 74, 75) all scored below 0.8235, confirming that the \"restoration\" claims in notes are not reflected in actual code.\n- The simplest fix is to delete all EDA, group features, and engineering code and write the exact minimal pipeline from iter 0 again.\n</observations>\n\n<hypothesis>\nThe current train.py is not the iter 0 baseline despite notes claiming restoration. Removing all EDA, group features, and extra code and rewriting a minimal 100-line pipeline with only Age + 5 spending + 4 categorical + parsed Cabin will restore the 0.8235 score. Once baseline is confirmed, I can test one small feature (e.g., spending missingness flag) in isolation.\n</hypothesis>\n\n<plan>\nRewrite train.py from scratch to be a clean, minimal implementation of the iter 0 baseline: no EDA, no group features, no interaction terms. Only Age, 5 spending columns, 4 categorical columns, and Cabin parsed into Deck/RoomNum/Side. XGBoost with max_depth=6, n_estimators=100, learning_rate=0.1. This will confirm baseline performance and create a stable foundation for testing one orthogonal feature next.\n</plan>\n\n<code>\n```python\n\"\"\"\ntrain.py — Iteration 76: Minimal baseline restoration.\nAge + 5 spending + 4 categorical + parsed Cabin.\nXGBoost max_depth=6, n_estimators=100, learning_rate=0.1.\nNo EDA, no group features, no extra engineering.\nTarget: restore 0.8235.\n\"\"\"\nimport sys, pathlib\nsys.path.insert(0, str(pathlib.Path(__file__).resolve().parent.parent))\n\nimport pandas as pd\nimport numpy as np\nimport xgboost as xgb\nfrom sklearn.impute import SimpleImputer\nfrom sklearn.pipeline import Pipeline\nfrom sklearn.preprocessing import StandardScaler, OneHotEncoder\nfrom sklearn.compose import ColumnTransformer\n\nimport prepare\n\nNUMERIC = [\"Age\", \"RoomService\", \"FoodCourt\", \"ShoppingMall\", \"Spa\", \"VRDeck\"]\nCATEGORICAL = [\"HomePlanet\", \"Destination\", \"CryoSleep\", \"VIP\"]\nSPENDING = [\"RoomService\", \"FoodCourt\", \"ShoppingMall\", \"Spa\", \"VRDeck\"]\n\n\ndef parse_cabin(cabin_str):\n    \"\"\"Parse Cabin 'F/0/S' into (deck, room_num, side).\"\"\"\n    if pd.isna(cabin_str):\n        return np.nan, np.nan, np.nan\n    parts = str(cabin_str).split(\"/\")\n    if len(parts) == 3:\n        deck = parts[0]\n        try:\n            room_num = int(parts[1])\n        except (ValueError, TypeError):\n            room_num = np.nan\n        side = parts[2]\n        return deck, room_num, side\n    return np.nan, np.nan, np.nan\n\n\ndef build_predict_fn():\n    \"\"\"Build and train model on full training set, return predict function.\"\"\"\n    train_df, _ = prepare.load_split()\n    \n    # Parse Cabin into Deck, RoomNum, Side\n    cabin_data = train_df[\"Cabin\"].apply(parse_cabin)\n    train_df[\"Deck\"] = cabin_data.apply(lambda x: x[0])\n    train_df[\"RoomNum\"] = cabin_data.apply(lambda x: x[1])\n    train_df[\"Side\"] = cabin_data.apply(lambda x: x[2])\n    \n    # Build feature set\n    feature_cols = [\"Age\"] + SPENDING + CATEGORICAL + [\"Deck\", \"RoomNum\", \"Side\"]\n    X = train_df[feature_cols].copy()\n    y = train_df[\"Transported\"].astype(int)\n    \n    # Preprocessing\n    numeric_transformer = Pipeline([\n        (\"imputer\", SimpleImputer(strategy=\"median\")),\n        (\"scaler\", StandardScaler()),\n    ])\n    \n    categorical_transformer = Pipeline([\n        (\"imputer\", SimpleImputer(strategy=\"most_frequent\")),\n        (\"onehot\", OneHotEncoder(handle_unknown=\"ignore\", sparse_output=False)),\n    ])\n    \n    numeric_cols = [\"Age\"] + SPENDING + [\"RoomNum\"]\n    categorical_cols = CATEGORICAL + [\"Deck\", \"Side\"]\n    \n    preprocessor = ColumnTransformer([\n        (\"num\", numeric_transformer, numeric_cols),\n        (\"cat\", categorical_transformer, categorical_cols),\n    ])\n    \n    # Pipeline with XGBoost\n    pipe = Pipeline([\n        (\"preprocessor\", preprocessor),\n        (\"clf\", xgb.XGBClassifier(\n            max_depth=6,\n            n_estimators=100,\n            learning_rate=0.1,\n            random_state=42,\n            verbosity=0\n        )),\n    ])\n    \n    pipe.fit(X, y)\n    \n    def predict(X_val):\n        \"\"\"Apply same transformations to validation set and predict.\"\"\"\n        X_val_copy = X_val.copy()\n        \n        # Parse Cabin\n        cabin_data = X_val_copy[\"Cabin\"].apply(parse_cabin)\n        X_val_copy[\"Deck\"] = cabin_data.apply(lambda x: x[0])\n        X_val_copy[\"RoomNum\"] = cabin_data.apply(lambda x: x[1])\n        X_val_copy[\"Side\"] = cabin_data.apply(lambda x: x[2])\n        \n        return pipe.predict(X_val_copy[feature_cols]).astype(bool)\n    \n    return predict\n\n\nif __name__ == \"__main__\":\n    predict_fn = build_predict_fn()\n    score = prepare.evaluate(predict_fn)\n    print(f\"VAL_ACCURACY: {score:.4f}\")\n```\n</code>\n\n<notes_append>\nIteration 76: Stripped train.py to minimal 100-line baseline: Age + 5 spending + 4 categorical + parsed Cabin, XGBoost (max_depth=6, n_est=100, lr=0.1). Removed all EDA, group features, engineering, and code bloat. Hypothesis: current code has drifted from iter 0; expect to restore 0.8235 baseline.\n</notes_append>", "reflection": "The current best remains 0.8235 from iteration 0, but the script has been drifting through feature engineering and refactors that consistently regress to ~0.81. The last run (iter 75) scored 0.8114, suggesting the code in train.py does not match iter 0 exactly, or the EDA/print statements are interfering. I need to strip the code to absolute minimum, verify it matches the iter 0 baseline exactly, and then test one small, orthogonal change systematically.", "observations": ["The notes show iter 0 achieved 0.8235 with a minimal baseline: Age + 5 spending + 4 categorical + parsed Cabin, XGBoost (max_depth=6, n_est=100, lr=0.1). Every subsequent change has regressed.", "The current train.py includes EDA printing and group-level features not in iter 0, which may be noise. The notes claim \"Iteration 75: Restored exact iter 0 baseline\" but the actual file contains significantly more code, suggesting the notes and code are out of sync.", "The EDA function calls `print_eda(train_df)` unconditionally before building the model, which adds latency and may interfere with the evaluation harness if stdout is being parsed.", "Recent iterations (73, 74, 75) all scored below 0.8235, confirming that the \"restoration\" claims in notes are not reflected in actual code.", "The simplest fix is to delete all EDA, group features, and engineering code and write the exact minimal pipeline from iter 0 again."], "hypothesis": "The current train.py is not the iter 0 baseline despite notes claiming restoration. Removing all EDA, group features, and extra code and rewriting a minimal 100-line pipeline with only Age + 5 spending + 4 categorical + parsed Cabin will restore the 0.8235 score. Once baseline is confirmed, I can test one small feature (e.g., spending missingness flag) in isolation.", "plan": "Rewrite train.py from scratch to be a clean, minimal implementation of the iter 0 baseline: no EDA, no group features, no interaction terms. Only Age, 5 spending columns, 4 categorical columns, and Cabin parsed into Deck/RoomNum/Side. XGBoost with max_depth=6, n_estimators=100, learning_rate=0.1. This will confirm baseline performance and create a stable foundation for testing one orthogonal feature next.", "code": "\"\"\"\ntrain.py — Iteration 76: Minimal baseline restoration.\nAge + 5 spending + 4 categorical + parsed Cabin.\nXGBoost max_depth=6, n_estimators=100, learning_rate=0.1.\nNo EDA, no group features, no extra engineering.\nTarget: restore 0.8235.\n\"\"\"\nimport sys, pathlib\nsys.path.insert(0, str(pathlib.Path(__file__).resolve().parent.parent))\n\nimport pandas as pd\nimport numpy as np\nimport xgboost as xgb\nfrom sklearn.impute import SimpleImputer\nfrom sklearn.pipeline import Pipeline\nfrom sklearn.preprocessing import StandardScaler, OneHotEncoder\nfrom sklearn.compose import ColumnTransformer\n\nimport prepare\n\nNUMERIC = [\"Age\", \"RoomService\", \"FoodCourt\", \"ShoppingMall\", \"Spa\", \"VRDeck\"]\nCATEGORICAL = [\"HomePlanet\", \"Destination\", \"CryoSleep\", \"VIP\"]\nSPENDING = [\"RoomService\", \"FoodCourt\", \"ShoppingMall\", \"Spa\", \"VRDeck\"]\n\n\ndef parse_cabin(cabin_str):\n    \"\"\"Parse Cabin 'F/0/S' into (deck, room_num, side).\"\"\"\n    if pd.isna(cabin_str):\n        return np.nan, np.nan, np.nan\n    parts = str(cabin_str).split(\"/\")\n    if len(parts) == 3:\n        deck = parts[0]\n        try:\n            room_num = int(parts[1])\n        except (ValueError, TypeError):\n            room_num = np.nan\n        side = parts[2]\n        return deck, room_num, side\n    return np.nan, np.nan, np.nan\n\n\ndef build_predict_fn():\n    \"\"\"Build and train model on full training set, return predict function.\"\"\"\n    train_df, _ = prepare.load_split()\n    \n    # Parse Cabin into Deck, RoomNum, Side\n    cabin_data = train_df[\"Cabin\"].apply(parse_cabin)\n    train_df[\"Deck\"] = cabin_data.apply(lambda x: x[0])\n    train_df[\"RoomNum\"] = cabin_data.apply(lambda x: x[1])\n    train_df[\"Side\"] = cabin_data.apply(lambda x: x[2])\n    \n    # Build feature set\n    feature_cols = [\"Age\"] + SPENDING + CATEGORICAL + [\"Deck\", \"RoomNum\", \"Side\"]\n    X = train_df[feature_cols].copy()\n    y = train_df[\"Transported\"].astype(int)\n    \n    # Preprocessing\n    numeric_transformer = Pipeline([\n        (\"imputer\", SimpleImputer(strategy=\"median\")),\n        (\"scaler\", StandardScaler()),\n    ])\n    \n    categorical_transformer = Pipeline([\n        (\"imputer\", SimpleImputer(strategy=\"most_frequent\")),\n        (\"onehot\", OneHotEncoder(handle_unknown=\"ignore\", sparse_output=False)),\n    ])\n    \n    numeric_cols = [\"Age\"] + SPENDING + [\"RoomNum\"]\n    categorical_cols = CATEGORICAL + [\"Deck\", \"Side\"]\n    \n    preprocessor = ColumnTransformer([\n        (\"num\", numeric_transformer, numeric_cols),\n        (\"cat\", categorical_transformer, categorical_cols),\n    ])\n    \n    # Pipeline with XGBoost\n    pipe = Pipeline([\n        (\"preprocessor\", preprocessor),\n        (\"clf\", xgb.XGBClassifier(\n            max_depth=6,\n            n_estimators=100,\n            learning_rate=0.1,\n            random_state=42,\n            verbosity=0\n        )),\n    ])\n    \n    pipe.fit(X, y)\n    \n    def predict(X_val):\n        \"\"\"Apply same transformations to validation set and predict.\"\"\"\n        X_val_copy = X_val.copy()\n        \n        # Parse Cabin\n        cabin_data = X_val_copy[\"Cabin\"].apply(parse_cabin)\n        X_val_copy[\"Deck\"] = cabin_data.apply(lambda x: x[0])\n        X_val_copy[\"RoomNum\"] = cabin_data.apply(lambda x: x[1])\n        X_val_copy[\"Side\"] = cabin_data.apply(lambda x: x[2])\n        \n        return pipe.predict(X_val_copy[feature_cols]).astype(bool)\n    \n    return predict\n\n\nif __name__ == \"__main__\":\n    predict_fn = build_predict_fn()\n    score = prepare.evaluate(predict_fn)\n    print(f\"VAL_ACCURACY: {score:.4f}\")\n", "notes_append": "Iteration 76: Stripped train.py to minimal 100-line baseline: Age + 5 spending + 4 categorical + parsed Cabin, XGBoost (max_depth=6, n_est=100, lr=0.1). Removed all EDA, group features, engineering, and code bloat. Hypothesis: current code has drifted from iter 0; expect to restore 0.8235 baseline.", "stdout": "VAL_ACCURACY: 0.8079\n", "stderr": "", "returncode": 0, "score": 0.8079, "kept": false, "status": "reverted", "commit_hash": null, "input_tokens": 5325, "output_tokens": 1866, "cost_usd": 0.014655}
