{"iteration": 2, "timestamp": "2026-05-08T22:11:59", "previous_best": 0.8235, "duration_seconds": 6.26, "agent_response_raw": "<reflection>\nIteration 79 with LightGBM scored 0.8160, which is a regression from the baseline of 0.8235. The warning suggests feature name misalignment in the pipeline. The core issue is that our current best remains iter 0 at 0.8235, and we've been cycling through minor hyperparameter tweaks and model swaps without gaining ground. The notes indicate that iter 78 (with full feature engineering) should have matched or beaten the baseline, but we haven't confirmed that. Let me revert to the exact iter 78 configuration with XGBoost to verify whether the rich feature set truly recovers 0.8235.\n</reflection>\n\n<observations>\n- Iter 79 (LightGBM with full features) scored 0.8160, a clear regression. This suggests LightGBM is not a beneficial swap for this dataset with our current feature set, or there's a pipeline bug.\n- The notes claim iter 78 was \"likely what iter 0 actually contained\" but we never verified iter 78's score. We jumped straight to iter 79 with a model swap. We need to confirm iter 78 (XGBoost + full features) reproduces 0.8235.\n- The program.md hints suggest looking at Cabin parsing, group structure, and missingness. Our current feature set includes all three. If iter 78 scores 0.8235, these features are justified; if it scores lower, the engineering is hurting generalization.\n- We've spent 3 iterations on model swaps (iter 79 LightGBM, iter 74–77 simplifications) without testing whether our engineered features are actually helping. A clean re-run of iter 78's exact code will tell us.\n- The budget is ample (~22% of token limit used). A simple, definitive test is worth doing now.\n</observations>\n\n<hypothesis>\nReverting to iter 78 configuration (XGBoost max_depth=6, n_estimators=100, learning_rate=0.1 with all engineered features: TotalSpending, CryoSleep_LogSpending, Spending_Recorded, group features, and missingness flags) will restore the 0.8235 baseline and confirm that the rich feature set is both necessary and sufficient for best performance on this task.\n</hypothesis>\n\n<plan>\nRe-run the exact iter 78 code (which is very similar to the current train.py but with XGBoost instead of LightGBM as per iter 79). This will verify: (1) whether the engineered features actually help or hurt, and (2) whether iter 0's 0.8235 came from this exact configuration. If we score 0.8235 or better, we know the feature engineering is sound and should focus on model tuning or new feature ideas. If we score lower, the engineering is counterproductive and we should strip back to bare numerics.\n</plan>\n\n<code>\n```python\n\"\"\"\ntrain.py — Iteration 80: Restore iter 78 configuration exactly.\nFull feature engineering with XGBoost baseline to verify if 0.8235 reproduces.\n\"\"\"\nimport sys, pathlib\nsys.path.insert(0, str(pathlib.Path(__file__).resolve().parent.parent))\n\nimport pandas as pd\nimport numpy as np\nimport xgboost as xgb\nfrom sklearn.impute import SimpleImputer\nfrom sklearn.pipeline import Pipeline\nfrom sklearn.preprocessing import StandardScaler, OneHotEncoder\nfrom sklearn.compose import ColumnTransformer\n\nimport prepare\n\nNUMERIC = [\"Age\", \"RoomService\", \"FoodCourt\", \"ShoppingMall\", \"Spa\", \"VRDeck\"]\nCATEGORICAL = [\"HomePlanet\", \"Destination\", \"CryoSleep\", \"VIP\"]\nSPENDING = [\"RoomService\", \"FoodCourt\", \"ShoppingMall\", \"Spa\", \"VRDeck\"]\n\n\ndef parse_cabin(cabin_str):\n    \"\"\"Parse Cabin 'F/0/S' into deck, room_num, side.\"\"\"\n    if pd.isna(cabin_str):\n        return np.nan, np.nan, np.nan\n    parts = str(cabin_str).split(\"/\")\n    if len(parts) == 3:\n        return parts[0], int(parts[1]) if parts[1].isdigit() else np.nan, parts[2]\n    return np.nan, np.nan, np.nan\n\n\ndef extract_group_id(passenger_id):\n    \"\"\"Extract group ID from PassengerId (e.g., '0001_01' -> '0001').\"\"\"\n    if pd.isna(passenger_id):\n        return np.nan\n    return str(passenger_id).split(\"_\")[0]\n\n\ndef engineer_features(df):\n    \"\"\"Engineer spending and spending-cryo interaction features.\"\"\"\n    df_copy = df.copy()\n    \n    # Track which rows have any spending data recorded\n    spending_recorded = ~df_copy[SPENDING].isna().any(axis=1)\n    df_copy[\"Spending_Recorded\"] = spending_recorded.astype(int)\n    \n    # Fill missing spending with median per HomePlanet group\n    for col in SPENDING:\n        missing_mask = df_copy[col].isna()\n        if missing_mask.any():\n            group_medians = df_copy.groupby(\"HomePlanet\")[col].median()\n            df_copy.loc[missing_mask, col] = df_copy.loc[missing_mask, \"HomePlanet\"].map(group_medians)\n            global_median = df_copy[col].median()\n            df_copy[col] = df_copy[col].fillna(global_median)\n    \n    # Total spending\n    df_copy[\"TotalSpending\"] = df_copy[SPENDING].sum(axis=1)\n    \n    # Interaction: CryoSleep status and log spending\n    cryo_status = df_copy[\"CryoSleep\"].fillna(False)\n    log_spending = np.log1p(df_copy[\"TotalSpending\"])\n    df_copy[\"CryoSleep_LogSpending\"] = (\n        (cryo_status == True) * log_spending\n    )\n    \n    return df_copy\n\n\ndef add_group_features(df):\n    \"\"\"Add group-level aggregate features based on PassengerId group.\"\"\"\n    df_copy = df.copy()\n    \n    # Extract group ID\n    df_copy[\"GroupId\"] = df_copy[\"PassengerId\"].apply(extract_group_id)\n    \n    # Compute group size\n    group_sizes = df_copy.groupby(\"GroupId\").size()\n    df_copy[\"GroupSize\"] = df_copy[\"GroupId\"].map(group_sizes)\n    \n    # Compute group median total spending\n    group_median_spending = df_copy.groupby(\"GroupId\")[\"TotalSpending\"].median()\n    df_copy[\"GroupMedianSpending\"] = df_copy[\"GroupId\"].map(group_median_spending)\n    \n    return df_copy\n\n\ndef build_predict_fn():\n    train_df, _ = prepare.load_split()\n    \n    # Parse Cabin into Deck, RoomNum, Side\n    cabin_data = train_df[\"Cabin\"].apply(parse_cabin)\n    train_df[\"Deck\"] = cabin_data.apply(lambda x: x[0])\n    train_df[\"RoomNum\"] = cabin_data.apply(lambda x: x[1])\n    train_df[\"Side\"] = cabin_data.apply(lambda x: x[2])\n    \n    # Engineer features\n    train_df = engineer_features(train_df)\n    \n    # Add group-level features\n    train_df = add_group_features(train_df)\n    \n    # Create explicit missingness flags for CryoSleep and VIP\n    train_df[\"CryoSleep_Missing\"] = train_df[\"CryoSleep\"].isna().astype(int)\n    train_df[\"VIP_Missing\"] = train_df[\"VIP\"].isna().astype(int)\n    \n    # Convert CryoSleep and VIP to string for categorical encoding\n    train_df[\"CryoSleep\"] = train_df[\"CryoSleep\"].fillna(\"Unknown\").astype(str)\n    train_df[\"VIP\"] = train_df[\"VIP\"].fillna(\"Unknown\").astype(str)\n    \n    # Build feature set\n    feature_cols = (\n        [\"Age\"] + SPENDING + [\"TotalSpending\", \"CryoSleep_LogSpending\", \"Spending_Recorded\"] +\n        CATEGORICAL + \n        [\"Deck\", \"RoomNum\", \"Side\", \"GroupId\"] + \n        [\"CryoSleep_Missing\", \"VIP_Missing\"] +\n        [\"GroupSize\", \"GroupMedianSpending\"]\n    )\n    X = train_df[feature_cols]\n    y = train_df[\"Transported\"].astype(int)\n    \n    # Define preprocessing\n    numeric_transformer = Pipeline([\n        (\"imputer\", SimpleImputer(strategy=\"median\")),\n        (\"scaler\", StandardScaler()),\n    ])\n    \n    categorical_transformer = Pipeline([\n        (\"imputer\", SimpleImputer(strategy=\"most_frequent\")),\n        (\"onehot\", OneHotEncoder(handle_unknown=\"ignore\", sparse_output=False)),\n    ])\n    \n    numeric_feature_cols = (\n        [\"Age\", \"RoomNum\", \"CryoSleep_Missing\", \"VIP_Missing\", \"Spending_Recorded\"] + \n        SPENDING + [\"TotalSpending\", \"CryoSleep_LogSpending\"] +\n        [\"GroupSize\", \"GroupMedianSpending\"]\n    )\n    categorical_feature_cols = CATEGORICAL + [\"Deck\", \"Side\", \"GroupId\"]\n    \n    preprocessor = ColumnTransformer([\n        (\"num\", numeric_transformer, numeric_feature_cols),\n        (\"cat\", categorical_transformer, categorical_feature_cols),\n    ])\n    \n    # XGBoost baseline (iter 78 config)\n    pipe = Pipeline([\n        (\"preprocessor\", preprocessor),\n        (\"clf\", xgb.XGBClassifier(max_depth=6, n_estimators=100, learning_rate=0.1, random_state=42, verbosity=0)),\n    ])\n    \n    pipe.fit(X, y)\n    \n    def predict(X_val):\n        cabin_data = X_val[\"Cabin\"].apply(parse_cabin)\n        X_val_copy = X_val.copy()\n        X_val_copy[\"Deck\"] = cabin_data.apply(lambda x: x[0])\n        X_val_copy[\"RoomNum\"] = cabin_data.apply(lambda x: x[1])\n        X_val_copy[\"Side\"] = cabin_data.apply(lambda x: x[2])\n        \n        # Engineer features\n        X_val_copy = engineer_features(X_val_copy)\n        \n        # Add group-level features from training stats\n        X_val_copy[\"GroupId\"] = X_val_copy[\"PassengerId\"].apply(extract_group_id)\n        X_val_copy[\"GroupSize\"] = X_val_copy[\"GroupId\"].map(pd.Series(\n            train_df.groupby(\"GroupId\").size().to_dict()\n        ))\n        X_val_copy[\"GroupMedianSpending\"] = X_val_copy[\"GroupId\"].map(pd.Series(\n            train_df.groupby(\"GroupId\")[\"TotalSpending\"].median().to_dict()\n        ))\n        \n        # Missingness flags\n        X_val_copy[\"CryoSleep_Missing\"] = X_val_copy[\"CryoSleep\"].isna().astype(int)\n        X_val_copy[\"VIP_Missing\"] = X_val_copy[\"VIP\"].isna().astype(int)\n        \n        # Handle CryoSleep and VIP\n        X_val_copy[\"CryoSleep\"] = X_val_copy[\"CryoSleep\"].fillna(\"Unknown\").astype(str)\n        X_val_copy[\"VIP\"] = X_val_copy[\"VIP\"].fillna(\"Unknown\").astype(str)\n        \n        return pipe.predict(X_val_copy[feature_cols]).astype(bool)\n    \n    return predict\n\n\nif __name__ == \"__main__\":\n    predict_fn = build_predict_fn()\n    score = prepare.evaluate(predict_fn)\n    print(f\"VAL_ACCURACY: {score:.4f}\")\n```\n</code>\n\n<notes_append>\nIteration 80: Restore iter 78 config (XGBoost max_depth=6 n_est=100 lr=0.1 with all engineered features: TotalSpending, CryoSleep_LogSpending, Spending_Recorded, group features, missingness flags). Testing whether this exact config reproduces 0.8235 baseline, confirming that engineering is justified.\n</notes_append>", "reflection": "Iteration 79 with LightGBM scored 0.8160, which is a regression from the baseline of 0.8235. The warning suggests feature name misalignment in the pipeline. The core issue is that our current best remains iter 0 at 0.8235, and we've been cycling through minor hyperparameter tweaks and model swaps without gaining ground. The notes indicate that iter 78 (with full feature engineering) should have matched or beaten the baseline, but we haven't confirmed that. Let me revert to the exact iter 78 configuration with XGBoost to verify whether the rich feature set truly recovers 0.8235.", "observations": ["Iter 79 (LightGBM with full features) scored 0.8160, a clear regression. This suggests LightGBM is not a beneficial swap for this dataset with our current feature set, or there's a pipeline bug.", "The notes claim iter 78 was \"likely what iter 0 actually contained\" but we never verified iter 78's score. We jumped straight to iter 79 with a model swap. We need to confirm iter 78 (XGBoost + full features) reproduces 0.8235.", "The program.md hints suggest looking at Cabin parsing, group structure, and missingness. Our current feature set includes all three. If iter 78 scores 0.8235, these features are justified; if it scores lower, the engineering is hurting generalization.", "We've spent 3 iterations on model swaps (iter 79 LightGBM, iter 74–77 simplifications) without testing whether our engineered features are actually helping. A clean re-run of iter 78's exact code will tell us.", "The budget is ample (~22% of token limit used). A simple, definitive test is worth doing now."], "hypothesis": "Reverting to iter 78 configuration (XGBoost max_depth=6, n_estimators=100, learning_rate=0.1 with all engineered features: TotalSpending, CryoSleep_LogSpending, Spending_Recorded, group features, and missingness flags) will restore the 0.8235 baseline and confirm that the rich feature set is both necessary and sufficient for best performance on this task.", "plan": "Re-run the exact iter 78 code (which is very similar to the current train.py but with XGBoost instead of LightGBM as per iter 79). This will verify: (1) whether the engineered features actually help or hurt, and (2) whether iter 0's 0.8235 came from this exact configuration. If we score 0.8235 or better, we know the feature engineering is sound and should focus on model tuning or new feature ideas. If we score lower, the engineering is counterproductive and we should strip back to bare numerics.", "code": "\"\"\"\ntrain.py — Iteration 80: Restore iter 78 configuration exactly.\nFull feature engineering with XGBoost baseline to verify if 0.8235 reproduces.\n\"\"\"\nimport sys, pathlib\nsys.path.insert(0, str(pathlib.Path(__file__).resolve().parent.parent))\n\nimport pandas as pd\nimport numpy as np\nimport xgboost as xgb\nfrom sklearn.impute import SimpleImputer\nfrom sklearn.pipeline import Pipeline\nfrom sklearn.preprocessing import StandardScaler, OneHotEncoder\nfrom sklearn.compose import ColumnTransformer\n\nimport prepare\n\nNUMERIC = [\"Age\", \"RoomService\", \"FoodCourt\", \"ShoppingMall\", \"Spa\", \"VRDeck\"]\nCATEGORICAL = [\"HomePlanet\", \"Destination\", \"CryoSleep\", \"VIP\"]\nSPENDING = [\"RoomService\", \"FoodCourt\", \"ShoppingMall\", \"Spa\", \"VRDeck\"]\n\n\ndef parse_cabin(cabin_str):\n    \"\"\"Parse Cabin 'F/0/S' into deck, room_num, side.\"\"\"\n    if pd.isna(cabin_str):\n        return np.nan, np.nan, np.nan\n    parts = str(cabin_str).split(\"/\")\n    if len(parts) == 3:\n        return parts[0], int(parts[1]) if parts[1].isdigit() else np.nan, parts[2]\n    return np.nan, np.nan, np.nan\n\n\ndef extract_group_id(passenger_id):\n    \"\"\"Extract group ID from PassengerId (e.g., '0001_01' -> '0001').\"\"\"\n    if pd.isna(passenger_id):\n        return np.nan\n    return str(passenger_id).split(\"_\")[0]\n\n\ndef engineer_features(df):\n    \"\"\"Engineer spending and spending-cryo interaction features.\"\"\"\n    df_copy = df.copy()\n    \n    # Track which rows have any spending data recorded\n    spending_recorded = ~df_copy[SPENDING].isna().any(axis=1)\n    df_copy[\"Spending_Recorded\"] = spending_recorded.astype(int)\n    \n    # Fill missing spending with median per HomePlanet group\n    for col in SPENDING:\n        missing_mask = df_copy[col].isna()\n        if missing_mask.any():\n            group_medians = df_copy.groupby(\"HomePlanet\")[col].median()\n            df_copy.loc[missing_mask, col] = df_copy.loc[missing_mask, \"HomePlanet\"].map(group_medians)\n            global_median = df_copy[col].median()\n            df_copy[col] = df_copy[col].fillna(global_median)\n    \n    # Total spending\n    df_copy[\"TotalSpending\"] = df_copy[SPENDING].sum(axis=1)\n    \n    # Interaction: CryoSleep status and log spending\n    cryo_status = df_copy[\"CryoSleep\"].fillna(False)\n    log_spending = np.log1p(df_copy[\"TotalSpending\"])\n    df_copy[\"CryoSleep_LogSpending\"] = (\n        (cryo_status == True) * log_spending\n    )\n    \n    return df_copy\n\n\ndef add_group_features(df):\n    \"\"\"Add group-level aggregate features based on PassengerId group.\"\"\"\n    df_copy = df.copy()\n    \n    # Extract group ID\n    df_copy[\"GroupId\"] = df_copy[\"PassengerId\"].apply(extract_group_id)\n    \n    # Compute group size\n    group_sizes = df_copy.groupby(\"GroupId\").size()\n    df_copy[\"GroupSize\"] = df_copy[\"GroupId\"].map(group_sizes)\n    \n    # Compute group median total spending\n    group_median_spending = df_copy.groupby(\"GroupId\")[\"TotalSpending\"].median()\n    df_copy[\"GroupMedianSpending\"] = df_copy[\"GroupId\"].map(group_median_spending)\n    \n    return df_copy\n\n\ndef build_predict_fn():\n    train_df, _ = prepare.load_split()\n    \n    # Parse Cabin into Deck, RoomNum, Side\n    cabin_data = train_df[\"Cabin\"].apply(parse_cabin)\n    train_df[\"Deck\"] = cabin_data.apply(lambda x: x[0])\n    train_df[\"RoomNum\"] = cabin_data.apply(lambda x: x[1])\n    train_df[\"Side\"] = cabin_data.apply(lambda x: x[2])\n    \n    # Engineer features\n    train_df = engineer_features(train_df)\n    \n    # Add group-level features\n    train_df = add_group_features(train_df)\n    \n    # Create explicit missingness flags for CryoSleep and VIP\n    train_df[\"CryoSleep_Missing\"] = train_df[\"CryoSleep\"].isna().astype(int)\n    train_df[\"VIP_Missing\"] = train_df[\"VIP\"].isna().astype(int)\n    \n    # Convert CryoSleep and VIP to string for categorical encoding\n    train_df[\"CryoSleep\"] = train_df[\"CryoSleep\"].fillna(\"Unknown\").astype(str)\n    train_df[\"VIP\"] = train_df[\"VIP\"].fillna(\"Unknown\").astype(str)\n    \n    # Build feature set\n    feature_cols = (\n        [\"Age\"] + SPENDING + [\"TotalSpending\", \"CryoSleep_LogSpending\", \"Spending_Recorded\"] +\n        CATEGORICAL + \n        [\"Deck\", \"RoomNum\", \"Side\", \"GroupId\"] + \n        [\"CryoSleep_Missing\", \"VIP_Missing\"] +\n        [\"GroupSize\", \"GroupMedianSpending\"]\n    )\n    X = train_df[feature_cols]\n    y = train_df[\"Transported\"].astype(int)\n    \n    # Define preprocessing\n    numeric_transformer = Pipeline([\n        (\"imputer\", SimpleImputer(strategy=\"median\")),\n        (\"scaler\", StandardScaler()),\n    ])\n    \n    categorical_transformer = Pipeline([\n        (\"imputer\", SimpleImputer(strategy=\"most_frequent\")),\n        (\"onehot\", OneHotEncoder(handle_unknown=\"ignore\", sparse_output=False)),\n    ])\n    \n    numeric_feature_cols = (\n        [\"Age\", \"RoomNum\", \"CryoSleep_Missing\", \"VIP_Missing\", \"Spending_Recorded\"] + \n        SPENDING + [\"TotalSpending\", \"CryoSleep_LogSpending\"] +\n        [\"GroupSize\", \"GroupMedianSpending\"]\n    )\n    categorical_feature_cols = CATEGORICAL + [\"Deck\", \"Side\", \"GroupId\"]\n    \n    preprocessor = ColumnTransformer([\n        (\"num\", numeric_transformer, numeric_feature_cols),\n        (\"cat\", categorical_transformer, categorical_feature_cols),\n    ])\n    \n    # XGBoost baseline (iter 78 config)\n    pipe = Pipeline([\n        (\"preprocessor\", preprocessor),\n        (\"clf\", xgb.XGBClassifier(max_depth=6, n_estimators=100, learning_rate=0.1, random_state=42, verbosity=0)),\n    ])\n    \n    pipe.fit(X, y)\n    \n    def predict(X_val):\n        cabin_data = X_val[\"Cabin\"].apply(parse_cabin)\n        X_val_copy = X_val.copy()\n        X_val_copy[\"Deck\"] = cabin_data.apply(lambda x: x[0])\n        X_val_copy[\"RoomNum\"] = cabin_data.apply(lambda x: x[1])\n        X_val_copy[\"Side\"] = cabin_data.apply(lambda x: x[2])\n        \n        # Engineer features\n        X_val_copy = engineer_features(X_val_copy)\n        \n        # Add group-level features from training stats\n        X_val_copy[\"GroupId\"] = X_val_copy[\"PassengerId\"].apply(extract_group_id)\n        X_val_copy[\"GroupSize\"] = X_val_copy[\"GroupId\"].map(pd.Series(\n            train_df.groupby(\"GroupId\").size().to_dict()\n        ))\n        X_val_copy[\"GroupMedianSpending\"] = X_val_copy[\"GroupId\"].map(pd.Series(\n            train_df.groupby(\"GroupId\")[\"TotalSpending\"].median().to_dict()\n        ))\n        \n        # Missingness flags\n        X_val_copy[\"CryoSleep_Missing\"] = X_val_copy[\"CryoSleep\"].isna().astype(int)\n        X_val_copy[\"VIP_Missing\"] = X_val_copy[\"VIP\"].isna().astype(int)\n        \n        # Handle CryoSleep and VIP\n        X_val_copy[\"CryoSleep\"] = X_val_copy[\"CryoSleep\"].fillna(\"Unknown\").astype(str)\n        X_val_copy[\"VIP\"] = X_val_copy[\"VIP\"].fillna(\"Unknown\").astype(str)\n        \n        return pipe.predict(X_val_copy[feature_cols]).astype(bool)\n    \n    return predict\n\n\nif __name__ == \"__main__\":\n    predict_fn = build_predict_fn()\n    score = prepare.evaluate(predict_fn)\n    print(f\"VAL_ACCURACY: {score:.4f}\")\n", "notes_append": "Iteration 80: Restore iter 78 config (XGBoost max_depth=6 n_est=100 lr=0.1 with all engineered features: TotalSpending, CryoSleep_LogSpending, Spending_Recorded, group features, missingness flags). Testing whether this exact config reproduces 0.8235 baseline, confirming that engineering is justified.", "stdout": "VAL_ACCURACY: 0.8235\n", "stderr": "", "returncode": 0, "score": 0.8235, "kept": true, "status": "kept", "commit_hash": "3a35e93", "input_tokens": 4972, "output_tokens": 3139, "cost_usd": 0.020667}
