{"iteration": 5, "timestamp": "2026-05-08T22:07:16", "previous_best": 0.8235, "duration_seconds": 3.47, "agent_response_raw": "<reflection>\nThe LightGBM switch (iter 67) regressed to 0.8160, confirming that the XGBoost baseline at 0.8235 is not easily beaten by simply swapping models. The EDA output from iter 66 revealed strong signal: CryoSleep (56.9% vs 40.7% transport rate), RoomService/Spa/VRDeck (negative correlation ~-0.2-0.25). The current approach is sound — iter 0's feature set and XGBoost config are optimal so far. The next move should be to test whether *refining* the existing feature engineering (not model hyperparameters or switches) can extract more value from the signals the EDA identified.\n</reflection>\n\n<observations>\n- The EDA showed CryoSleep is the single strongest categorical predictor (56.9% transport rate when True vs 40.7% when False/missing), yet the current feature engineering only uses a CryoSleep×LogSpending interaction. A simple binary encoding of CryoSleep status itself (not as string categorical) might be more direct and powerful.\n- RoomService, Spa, and VRDeck all have ~-0.2 to -0.25 correlation with Transported; Age is weakest (~-0.05). Yet all are equally treated in TotalSpending. Testing whether individual spending categories are more predictive than the sum could uncover hidden signal.\n- The Spending_Recorded flag (whether any spending was recorded) captures missingness structure. However, it's possible that *which* spending categories are recorded (e.g., only FoodCourt vs all five) carries additional group/person-type signal.\n- GroupSize and GroupMedianSpending were added in iter 61–62 but the models regressed or stayed flat, suggesting group-level aggregates don't add clean signal at current model capacity.\n- XGBoost's performance (0.8235) is stable across capacity changes (iter 62–63 regressed) and hyperparameter tweaks (iter 65 regressed), indicating the bottleneck is likely feature representation, not model underfitting.\n</observations>\n\n<hypothesis>\nRemoving or deprioritizing group-level features (GroupSize, GroupMedianSpending, GroupId) and instead doubling down on individual-level feature quality — especially cleaner encoding of CryoSleep status and per-category spending signals — will improve accuracy because the XGBoost model has proven sensitive to feature composition but robust to model tweaks, suggesting feature engineering is the true lever.\n</hypothesis>\n\n<plan>\nSimplify the feature set by removing group-level aggregates (GroupSize, GroupMedianSpending, GroupId) which have consistently failed to improve or regressed; replace them with cleaner per-category spending flags (e.g., HasRoomService, HasSpa, etc.) that capture *which* services were used, not just totals. This tests whether the model benefits from more granular spending structure rather than group membership structure.\n</plan>\n\n<code>\n```python\n\"\"\"\ntrain.py — Iteration 68: Remove group features; add per-category spending flags.\nHypothesis: Individual spending patterns (HasRoomService, etc.) are more predictive\nthan group aggregates (GroupSize, GroupMedianSpending). Simplify feature set.\n\"\"\"\nimport sys, pathlib\nsys.path.insert(0, str(pathlib.Path(__file__).resolve().parent.parent))\n\nimport pandas as pd\nimport numpy as np\nimport xgboost as xgb\nfrom sklearn.impute import SimpleImputer\nfrom sklearn.pipeline import Pipeline\nfrom sklearn.preprocessing import StandardScaler, OneHotEncoder\nfrom sklearn.compose import ColumnTransformer\n\nimport prepare\n\nNUMERIC = [\"Age\", \"RoomService\", \"FoodCourt\", \"ShoppingMall\", \"Spa\", \"VRDeck\"]\nCATEGORICAL = [\"HomePlanet\", \"Destination\", \"CryoSleep\", \"VIP\"]\nSPENDING = [\"RoomService\", \"FoodCourt\", \"ShoppingMall\", \"Spa\", \"VRDeck\"]\n\n\ndef parse_cabin(cabin_str):\n    \"\"\"Parse Cabin 'F/0/S' into deck, room_num, side.\"\"\"\n    if pd.isna(cabin_str):\n        return np.nan, np.nan, np.nan\n    parts = str(cabin_str).split(\"/\")\n    if len(parts) == 3:\n        return parts[0], int(parts[1]) if parts[1].isdigit() else np.nan, parts[2]\n    return np.nan, np.nan, np.nan\n\n\ndef engineer_features(df):\n    \"\"\"Engineer spending and spending-cryo interaction features.\"\"\"\n    df_copy = df.copy()\n    \n    # Track which rows have any spending data recorded\n    spending_recorded = ~df_copy[SPENDING].isna().any(axis=1)\n    df_copy[\"Spending_Recorded\"] = spending_recorded.astype(int)\n    \n    # Fill missing spending with median per HomePlanet group\n    for col in SPENDING:\n        missing_mask = df_copy[col].isna()\n        if missing_mask.any():\n            group_medians = df_copy.groupby(\"HomePlanet\")[col].median()\n            df_copy.loc[missing_mask, col] = df_copy.loc[missing_mask, \"HomePlanet\"].map(group_medians)\n            global_median = df_copy[col].median()\n            df_copy[col] = df_copy[col].fillna(global_median)\n    \n    # Total spending\n    df_copy[\"TotalSpending\"] = df_copy[SPENDING].sum(axis=1)\n    \n    # Per-category spending flags (capturing which services were used)\n    for col in SPENDING:\n        df_copy[f\"Has{col}\"] = (df_copy[col] > 0).astype(int)\n    \n    # Interaction: CryoSleep status and log spending\n    cryo_status = df_copy[\"CryoSleep\"].fillna(False)\n    log_spending = np.log1p(df_copy[\"TotalSpending\"])\n    df_copy[\"CryoSleep_LogSpending\"] = (\n        (cryo_status == True) * log_spending\n    )\n    \n    return df_copy\n\n\ndef build_predict_fn():\n    train_df, _ = prepare.load_split()\n    \n    # Parse Cabin into Deck, RoomNum, Side\n    cabin_data = train_df[\"Cabin\"].apply(parse_cabin)\n    train_df[\"Deck\"] = cabin_data.apply(lambda x: x[0])\n    train_df[\"RoomNum\"] = cabin_data.apply(lambda x: x[1])\n    train_df[\"Side\"] = cabin_data.apply(lambda x: x[2])\n    \n    # Engineer features\n    train_df = engineer_features(train_df)\n    \n    # Create explicit missingness flags for CryoSleep and VIP\n    train_df[\"CryoSleep_Missing\"] = train_df[\"CryoSleep\"].isna().astype(int)\n    train_df[\"VIP_Missing\"] = train_df[\"VIP\"].isna().astype(int)\n    \n    # Convert CryoSleep and VIP to string for categorical encoding\n    train_df[\"CryoSleep\"] = train_df[\"CryoSleep\"].fillna(\"Unknown\").astype(str)\n    train_df[\"VIP\"] = train_df[\"VIP\"].fillna(\"Unknown\").astype(str)\n    \n    # Build feature set: remove group features, add per-category spending flags\n    spending_flags = [f\"Has{col}\" for col in SPENDING]\n    feature_cols = (\n        [\"Age\"] + SPENDING + [\"TotalSpending\", \"CryoSleep_LogSpending\", \"Spending_Recorded\"] +\n        spending_flags +\n        CATEGORICAL + \n        [\"Deck\", \"RoomNum\", \"Side\"] + \n        [\"CryoSleep_Missing\", \"VIP_Missing\"]\n    )\n    X = train_df[feature_cols]\n    y = train_df[\"Transported\"].astype(int)\n    \n    # Define preprocessing\n    numeric_transformer = Pipeline([\n        (\"imputer\", SimpleImputer(strategy=\"median\")),\n        (\"scaler\", StandardScaler()),\n    ])\n    \n    categorical_transformer = Pipeline([\n        (\"imputer\", SimpleImputer(strategy=\"most_frequent\")),\n        (\"onehot\", OneHotEncoder(handle_unknown=\"ignore\", sparse_output=False)),\n    ])\n    \n    numeric_feature_cols = (\n        [\"Age\", \"RoomNum\", \"CryoSleep_Missing\", \"VIP_Missing\", \"Spending_Recorded\"] + \n        SPENDING + [\"TotalSpending\", \"CryoSleep_LogSpending\"] +\n        spending_flags\n    )\n    categorical_feature_cols = CATEGORICAL + [\"Deck\", \"Side\"]\n    \n    preprocessor = ColumnTransformer([\n        (\"num\", numeric_transformer, numeric_feature_cols),\n        (\"cat\", categorical_transformer, categorical_feature_cols),\n    ])\n    \n    # Use baseline XGBoost config\n    pipe = Pipeline([\n        (\"preprocessor\", preprocessor),\n        (\"clf\", xgb.XGBClassifier(max_depth=6, n_estimators=100, learning_rate=0.1, random_state=42, verbosity=0)),\n    ])\n    \n    pipe.fit(X, y)\n    \n    def predict(X_val):\n        cabin_data = X_val[\"Cabin\"].apply(parse_cabin)\n        X_val_copy = X_val.copy()\n        X_val_copy[\"Deck\"] = cabin_data.apply(lambda x: x[0])\n        X_val_copy[\"RoomNum\"] = cabin_data.apply(lambda x: x[1])\n        X_val_copy[\"Side\"] = cabin_data.apply(lambda x: x[2])\n        \n        # Engineer features\n        X_val_copy = engineer_features(X_val_copy)\n        \n        # Missingness flags\n        X_val_copy[\"CryoSleep_Missing\"] = X_val_copy[\"CryoSleep\"].isna().astype(int)\n        X_val_copy[\"VIP_Missing\"] = X_val_copy[\"VIP\"].isna().astype(int)\n        \n        # Handle CryoSleep and VIP\n        X_val_copy[\"CryoSleep\"] = X_val_copy[\"CryoSleep\"].fillna(\"Unknown\").astype(str)\n        X_val_copy[\"VIP\"] = X_val_copy[\"VIP\"].fillna(\"Unknown\").astype(str)\n        \n        return pipe.predict(X_val_copy[feature_cols]).astype(bool)\n    \n    return predict\n\n\nif __name__ == \"__main__\":\n    predict_fn = build_predict_fn()\n    score = prepare.evaluate(predict_fn)\n    print(f\"VAL_ACCURACY: {score:.4f}\")\n```\n</code>\n\n<notes_append>\nIteration 68: Removed group-level features (GroupSize, GroupMedianSpending, GroupId) which consistently failed to improve; added per-category spending flags (HasRoomService, HasFoodCourt, etc.) to capture which services were used rather than just totals. Hypothesis: individual spending patterns are more granular and predictive than group membership aggregates.\n</notes_append>", "reflection": "The LightGBM switch (iter 67) regressed to 0.8160, confirming that the XGBoost baseline at 0.8235 is not easily beaten by simply swapping models. The EDA output from iter 66 revealed strong signal: CryoSleep (56.9% vs 40.7% transport rate), RoomService/Spa/VRDeck (negative correlation ~-0.2-0.25). The current approach is sound — iter 0's feature set and XGBoost config are optimal so far. The next move should be to test whether *refining* the existing feature engineering (not model hyperparameters or switches) can extract more value from the signals the EDA identified.", "observations": ["The EDA showed CryoSleep is the single strongest categorical predictor (56.9% transport rate when True vs 40.7% when False/missing), yet the current feature engineering only uses a CryoSleep×LogSpending interaction. A simple binary encoding of CryoSleep status itself (not as string categorical) might be more direct and powerful.", "RoomService, Spa, and VRDeck all have ~-0.2 to -0.25 correlation with Transported; Age is weakest (~-0.05). Yet all are equally treated in TotalSpending. Testing whether individual spending categories are more predictive than the sum could uncover hidden signal.", "The Spending_Recorded flag (whether any spending was recorded) captures missingness structure. However, it's possible that *which* spending categories are recorded (e.g., only FoodCourt vs all five) carries additional group/person-type signal.", "GroupSize and GroupMedianSpending were added in iter 61–62 but the models regressed or stayed flat, suggesting group-level aggregates don't add clean signal at current model capacity.", "XGBoost's performance (0.8235) is stable across capacity changes (iter 62–63 regressed) and hyperparameter tweaks (iter 65 regressed), indicating the bottleneck is likely feature representation, not model underfitting."], "hypothesis": "Removing or deprioritizing group-level features (GroupSize, GroupMedianSpending, GroupId) and instead doubling down on individual-level feature quality — especially cleaner encoding of CryoSleep status and per-category spending signals — will improve accuracy because the XGBoost model has proven sensitive to feature composition but robust to model tweaks, suggesting feature engineering is the true lever.", "plan": "Simplify the feature set by removing group-level aggregates (GroupSize, GroupMedianSpending, GroupId) which have consistently failed to improve or regressed; replace them with cleaner per-category spending flags (e.g., HasRoomService, HasSpa, etc.) that capture *which* services were used, not just totals. This tests whether the model benefits from more granular spending structure rather than group membership structure.", "code": "\"\"\"\ntrain.py — Iteration 68: Remove group features; add per-category spending flags.\nHypothesis: Individual spending patterns (HasRoomService, etc.) are more predictive\nthan group aggregates (GroupSize, GroupMedianSpending). Simplify feature set.\n\"\"\"\nimport sys, pathlib\nsys.path.insert(0, str(pathlib.Path(__file__).resolve().parent.parent))\n\nimport pandas as pd\nimport numpy as np\nimport xgboost as xgb\nfrom sklearn.impute import SimpleImputer\nfrom sklearn.pipeline import Pipeline\nfrom sklearn.preprocessing import StandardScaler, OneHotEncoder\nfrom sklearn.compose import ColumnTransformer\n\nimport prepare\n\nNUMERIC = [\"Age\", \"RoomService\", \"FoodCourt\", \"ShoppingMall\", \"Spa\", \"VRDeck\"]\nCATEGORICAL = [\"HomePlanet\", \"Destination\", \"CryoSleep\", \"VIP\"]\nSPENDING = [\"RoomService\", \"FoodCourt\", \"ShoppingMall\", \"Spa\", \"VRDeck\"]\n\n\ndef parse_cabin(cabin_str):\n    \"\"\"Parse Cabin 'F/0/S' into deck, room_num, side.\"\"\"\n    if pd.isna(cabin_str):\n        return np.nan, np.nan, np.nan\n    parts = str(cabin_str).split(\"/\")\n    if len(parts) == 3:\n        return parts[0], int(parts[1]) if parts[1].isdigit() else np.nan, parts[2]\n    return np.nan, np.nan, np.nan\n\n\ndef engineer_features(df):\n    \"\"\"Engineer spending and spending-cryo interaction features.\"\"\"\n    df_copy = df.copy()\n    \n    # Track which rows have any spending data recorded\n    spending_recorded = ~df_copy[SPENDING].isna().any(axis=1)\n    df_copy[\"Spending_Recorded\"] = spending_recorded.astype(int)\n    \n    # Fill missing spending with median per HomePlanet group\n    for col in SPENDING:\n        missing_mask = df_copy[col].isna()\n        if missing_mask.any():\n            group_medians = df_copy.groupby(\"HomePlanet\")[col].median()\n            df_copy.loc[missing_mask, col] = df_copy.loc[missing_mask, \"HomePlanet\"].map(group_medians)\n            global_median = df_copy[col].median()\n            df_copy[col] = df_copy[col].fillna(global_median)\n    \n    # Total spending\n    df_copy[\"TotalSpending\"] = df_copy[SPENDING].sum(axis=1)\n    \n    # Per-category spending flags (capturing which services were used)\n    for col in SPENDING:\n        df_copy[f\"Has{col}\"] = (df_copy[col] > 0).astype(int)\n    \n    # Interaction: CryoSleep status and log spending\n    cryo_status = df_copy[\"CryoSleep\"].fillna(False)\n    log_spending = np.log1p(df_copy[\"TotalSpending\"])\n    df_copy[\"CryoSleep_LogSpending\"] = (\n        (cryo_status == True) * log_spending\n    )\n    \n    return df_copy\n\n\ndef build_predict_fn():\n    train_df, _ = prepare.load_split()\n    \n    # Parse Cabin into Deck, RoomNum, Side\n    cabin_data = train_df[\"Cabin\"].apply(parse_cabin)\n    train_df[\"Deck\"] = cabin_data.apply(lambda x: x[0])\n    train_df[\"RoomNum\"] = cabin_data.apply(lambda x: x[1])\n    train_df[\"Side\"] = cabin_data.apply(lambda x: x[2])\n    \n    # Engineer features\n    train_df = engineer_features(train_df)\n    \n    # Create explicit missingness flags for CryoSleep and VIP\n    train_df[\"CryoSleep_Missing\"] = train_df[\"CryoSleep\"].isna().astype(int)\n    train_df[\"VIP_Missing\"] = train_df[\"VIP\"].isna().astype(int)\n    \n    # Convert CryoSleep and VIP to string for categorical encoding\n    train_df[\"CryoSleep\"] = train_df[\"CryoSleep\"].fillna(\"Unknown\").astype(str)\n    train_df[\"VIP\"] = train_df[\"VIP\"].fillna(\"Unknown\").astype(str)\n    \n    # Build feature set: remove group features, add per-category spending flags\n    spending_flags = [f\"Has{col}\" for col in SPENDING]\n    feature_cols = (\n        [\"Age\"] + SPENDING + [\"TotalSpending\", \"CryoSleep_LogSpending\", \"Spending_Recorded\"] +\n        spending_flags +\n        CATEGORICAL + \n        [\"Deck\", \"RoomNum\", \"Side\"] + \n        [\"CryoSleep_Missing\", \"VIP_Missing\"]\n    )\n    X = train_df[feature_cols]\n    y = train_df[\"Transported\"].astype(int)\n    \n    # Define preprocessing\n    numeric_transformer = Pipeline([\n        (\"imputer\", SimpleImputer(strategy=\"median\")),\n        (\"scaler\", StandardScaler()),\n    ])\n    \n    categorical_transformer = Pipeline([\n        (\"imputer\", SimpleImputer(strategy=\"most_frequent\")),\n        (\"onehot\", OneHotEncoder(handle_unknown=\"ignore\", sparse_output=False)),\n    ])\n    \n    numeric_feature_cols = (\n        [\"Age\", \"RoomNum\", \"CryoSleep_Missing\", \"VIP_Missing\", \"Spending_Recorded\"] + \n        SPENDING + [\"TotalSpending\", \"CryoSleep_LogSpending\"] +\n        spending_flags\n    )\n    categorical_feature_cols = CATEGORICAL + [\"Deck\", \"Side\"]\n    \n    preprocessor = ColumnTransformer([\n        (\"num\", numeric_transformer, numeric_feature_cols),\n        (\"cat\", categorical_transformer, categorical_feature_cols),\n    ])\n    \n    # Use baseline XGBoost config\n    pipe = Pipeline([\n        (\"preprocessor\", preprocessor),\n        (\"clf\", xgb.XGBClassifier(max_depth=6, n_estimators=100, learning_rate=0.1, random_state=42, verbosity=0)),\n    ])\n    \n    pipe.fit(X, y)\n    \n    def predict(X_val):\n        cabin_data = X_val[\"Cabin\"].apply(parse_cabin)\n        X_val_copy = X_val.copy()\n        X_val_copy[\"Deck\"] = cabin_data.apply(lambda x: x[0])\n        X_val_copy[\"RoomNum\"] = cabin_data.apply(lambda x: x[1])\n        X_val_copy[\"Side\"] = cabin_data.apply(lambda x: x[2])\n        \n        # Engineer features\n        X_val_copy = engineer_features(X_val_copy)\n        \n        # Missingness flags\n        X_val_copy[\"CryoSleep_Missing\"] = X_val_copy[\"CryoSleep\"].isna().astype(int)\n        X_val_copy[\"VIP_Missing\"] = X_val_copy[\"VIP\"].isna().astype(int)\n        \n        # Handle CryoSleep and VIP\n        X_val_copy[\"CryoSleep\"] = X_val_copy[\"CryoSleep\"].fillna(\"Unknown\").astype(str)\n        X_val_copy[\"VIP\"] = X_val_copy[\"VIP\"].fillna(\"Unknown\").astype(str)\n        \n        return pipe.predict(X_val_copy[feature_cols]).astype(bool)\n    \n    return predict\n\n\nif __name__ == \"__main__\":\n    predict_fn = build_predict_fn()\n    score = prepare.evaluate(predict_fn)\n    print(f\"VAL_ACCURACY: {score:.4f}\")\n", "notes_append": "Iteration 68: Removed group-level features (GroupSize, GroupMedianSpending, GroupId) which consistently failed to improve; added per-category spending flags (HasRoomService, HasFoodCourt, etc.) to capture which services were used rather than just totals. Hypothesis: individual spending patterns are more granular and predictive than group membership aggregates.", "stdout": "VAL_ACCURACY: 0.8183\n", "stderr": "", "returncode": 0, "score": 0.8183, "kept": false, "status": "reverted", "commit_hash": null, "input_tokens": 5324, "output_tokens": 2779, "cost_usd": 0.019219}
