{"iteration": 0, "timestamp": "2026-05-08T20:33:03", "duration_seconds": 1.68, "agent_response_raw": null, "reflection": "(baseline — no agent call)", "observations": [], "hypothesis": null, "plan": "baseline logistic regression on raw numeric columns", "code": "\"\"\"\ntrain.py — the agent's sandbox. Rewritten each turn.\nMust call prepare.evaluate(predict_fn) and print VAL_ACCURACY: 0.XXXX as the last line.\n\"\"\"\nimport sys, pathlib\nsys.path.insert(0, str(pathlib.Path(__file__).resolve().parent.parent))\n\nimport pandas as pd\nimport numpy as np\nfrom sklearn.linear_model import LogisticRegression\nfrom sklearn.impute import SimpleImputer\nfrom sklearn.pipeline import Pipeline\nfrom sklearn.preprocessing import StandardScaler\n\nimport prepare\n\nNUMERIC = [\"Age\", \"RoomService\", \"FoodCourt\", \"ShoppingMall\", \"Spa\", \"VRDeck\"]\n\n\ndef build_predict_fn():\n    train_df, _ = prepare.load_split()\n    \n    # First, explore the data structure\n    print(\"=== DATA EXPLORATION ===\", file=__import__('sys').stderr)\n    print(f\"Shape: {train_df.shape}\", file=__import__('sys').stderr)\n    print(f\"Columns: {list(train_df.columns)}\", file=__import__('sys').stderr)\n    print(f\"\\nMissing values:\\n{train_df.isnull().sum()}\", file=__import__('sys').stderr)\n    print(f\"\\nData types:\\n{train_df.dtypes}\", file=__import__('sys').stderr)\n    print(f\"\\nFirst few rows:\\n{train_df.head()}\", file=__import__('sys').stderr)\n    \n    # Check correlations with target for numeric columns\n    numeric_cols = train_df.select_dtypes(include=[np.number]).columns.tolist()\n    if \"Transported\" in numeric_cols:\n        numeric_cols.remove(\"Transported\")\n    print(f\"\\nNumeric columns: {numeric_cols}\", file=__import__('sys').stderr)\n    \n    corr_with_target = train_df[numeric_cols + [\"Transported\"]].corr()[\"Transported\"].drop(\"Transported\").sort_values(ascending=False)\n    print(f\"\\nCorrelation with Transported:\\n{corr_with_target}\", file=__import__('sys').stderr)\n    \n    # Standard model\n    X = train_df[NUMERIC]\n    y = train_df[\"Transported\"].astype(int)\n    pipe = Pipeline([\n        (\"imp\", SimpleImputer(strategy=\"median\")),\n        (\"sc\", StandardScaler()),\n        (\"clf\", LogisticRegression(max_iter=1000)),\n    ])\n    pipe.fit(X, y)\n\n    def predict(X_val):\n        return pipe.predict(X_val[NUMERIC]).astype(bool)\n    return predict\n\n\nif __name__ == \"__main__\":\n    predict_fn = build_predict_fn()\n    score = prepare.evaluate(predict_fn)\n    print(f\"VAL_ACCURACY: {score:.4f}\")\n", "notes_append": null, "stdout": "VAL_ACCURACY: 0.7809\n", "stderr": "Missing values:\nPassengerId       0\nHomePlanet      169\nCryoSleep       168\nCabin           161\nDestination     153\nAge             139\nVIP             158\nRoomService     145\nFoodCourt       154\nShoppingMall    169\nSpa             150\nVRDeck          144\nName            159\nTransported       0\ndtype: int64\n\nData types:\nPassengerId         str\nHomePlanet          str\nCryoSleep        object\nCabin               str\nDestination         str\nAge             float64\nVIP              object\nRoomService     float64\nFoodCourt       float64\nShoppingMall    float64\nSpa             float64\nVRDeck          float64\nName                str\nTransported        bool\ndtype: object\n\nFirst few rows:\n  PassengerId HomePlanet CryoSleep  ...  VRDeck                Name  Transported\n0     3868_04      Earth     False  ...     0.0      Harrie Braymon         True\n1     1336_01      Earth      True  ...     0.0                 NaN         True\n2     9193_01      Earth       NaN  ...     0.0      Camily Howence        False\n3     5422_01     Europa      True  ...     0.0       Pleion Sperap         True\n4     5076_01      Earth     False  ...  5147.0  Alicey Wolferguson        False\n\n[5 rows x 14 columns]\n\nNumeric columns: ['Age', 'RoomService', 'FoodCourt', 'ShoppingMall', 'Spa', 'VRDeck']\n\nCorrelation with Transported:\nFoodCourt       0.049405\nShoppingMall   -0.001678\nAge            -0.079660\nVRDeck         -0.206128\nSpa            -0.220299\nRoomService    -0.248558\nName: Transported, dtype: float64\n", "returncode": 0, "score": 0.7809, "previous_best": null, "kept": true, "status": "kept", "commit_hash": "52c7113", "input_tokens": 0, "output_tokens": 0, "cost_usd": 0.0}
{"iteration": 1, "timestamp": "2026-05-08T20:33:03", "previous_best": 0.7809, "duration_seconds": 1.68, "agent_response_raw": "<reflection>\nThe baseline model achieves 0.7809 validation accuracy using only 6 numeric columns. The data exploration reveals significant missing values in many columns (10–14% missing) and categorical features (HomePlanet, Destination, CryoSleep, VIP) that are currently unused. The spending columns (RoomService, FoodCourt, Spa, VRDeck) show negative correlations with Transported, suggesting passengers who spend more are less likely to be transported. The Cabin column (encoded as a string like \"F/0/S\") appears to contain structured information per the hints.\n</reflection>\n\n<observations>\n- The Cabin column is a string with three parts separated by \"/\" (e.g., \"F/0/S\"). This likely encodes deck, room number, and side; splitting it could reveal predictive structure.\n- The CryoSleep, VIP, and HomePlanet/Destination columns are completely unused by the baseline. Even though they have missing values, they may contain signal worth extracting after imputation.\n- PassengerId has a pattern: \"XXXX_YY\" where YY might represent a group identifier (passengers traveling together). The hint about identifier columns encoding group structure suggests this warrants investigation.\n- Missing values are not negligible (10–14% per column). The missingness pattern itself might be informative—e.g., certain groups or cabins have higher missingness rates.\n- The spending features have weak individual correlations with the target (–0.25 to +0.05), but their interactions or nonlinear patterns may still be valuable; XGBoost might capture these better than logistic regression.\n</observations>\n\n<hypothesis>\nSplitting the Cabin column into deck, room number, and side, and including categorical features (HomePlanet, Destination, CryoSleep, VIP) with appropriate imputation and encoding, will improve validation accuracy because they capture spatial, travel, and behavior patterns not present in the numeric features alone.\n</hypothesis>\n\n<plan>\nParse the Cabin column into three features (Deck, RoomNum, Side), impute all categorical columns with a mode/most-frequent strategy, one-hot encode them, and train a logistic regression on the combined numeric + encoded categorical feature set. This keeps the model simple while capturing domain structure evident in the data.\n</plan>\n\n<code>\n```python\n\"\"\"\ntrain.py — feature engineering from Cabin and categorical columns.\n\"\"\"\nimport sys, pathlib\nsys.path.insert(0, str(pathlib.Path(__file__).resolve().parent.parent))\n\nimport pandas as pd\nimport numpy as np\nfrom sklearn.linear_model import LogisticRegression\nfrom sklearn.impute import SimpleImputer\nfrom sklearn.pipeline import Pipeline\nfrom sklearn.preprocessing import StandardScaler, OneHotEncoder\nfrom sklearn.compose import ColumnTransformer\n\nimport prepare\n\nNUMERIC = [\"Age\", \"RoomService\", \"FoodCourt\", \"ShoppingMall\", \"Spa\", \"VRDeck\"]\nCATEGORICAL = [\"HomePlanet\", \"Destination\", \"CryoSleep\", \"VIP\"]\n\n\ndef parse_cabin(cabin_str):\n    \"\"\"Parse Cabin 'F/0/S' into deck, room_num, side.\"\"\"\n    if pd.isna(cabin_str):\n        return np.nan, np.nan, np.nan\n    parts = str(cabin_str).split(\"/\")\n    if len(parts) == 3:\n        return parts[0], int(parts[1]) if parts[1].isdigit() else np.nan, parts[2]\n    return np.nan, np.nan, np.nan\n\n\ndef build_predict_fn():\n    train_df, _ = prepare.load_split()\n    \n    # Parse Cabin into Deck, RoomNum, Side\n    cabin_data = train_df[\"Cabin\"].apply(parse_cabin)\n    train_df[\"Deck\"] = cabin_data.apply(lambda x: x[0])\n    train_df[\"RoomNum\"] = cabin_data.apply(lambda x: x[1])\n    train_df[\"Side\"] = cabin_data.apply(lambda x: x[2])\n    \n    # Convert CryoSleep and VIP to numeric (they are object dtype)\n    train_df[\"CryoSleep\"] = train_df[\"CryoSleep\"].astype(str)\n    train_df[\"VIP\"] = train_df[\"VIP\"].astype(str)\n    \n    # Build feature set\n    X = train_df[NUMERIC + CATEGORICAL + [\"Deck\", \"RoomNum\", \"Side\"]]\n    y = train_df[\"Transported\"].astype(int)\n    \n    # Define preprocessing for numeric and categorical columns\n    numeric_transformer = Pipeline([\n        (\"imputer\", SimpleImputer(strategy=\"median\")),\n        (\"scaler\", StandardScaler()),\n    ])\n    \n    categorical_transformer = Pipeline([\n        (\"imputer\", SimpleImputer(strategy=\"most_frequent\")),\n        (\"onehot\", OneHotEncoder(handle_unknown=\"ignore\", sparse_output=False)),\n    ])\n    \n    preprocessor = ColumnTransformer([\n        (\"num\", numeric_transformer, NUMERIC + [\"RoomNum\"]),\n        (\"cat\", categorical_transformer, CATEGORICAL + [\"Deck\", \"Side\"]),\n    ])\n    \n    pipe = Pipeline([\n        (\"preprocessor\", preprocessor),\n        (\"clf\", LogisticRegression(max_iter=1000)),\n    ])\n    \n    pipe.fit(X, y)\n    \n    def predict(X_val):\n        # Parse Cabin in validation set\n        cabin_data = X_val[\"Cabin\"].apply(parse_cabin)\n        X_val_copy = X_val.copy()\n        X_val_copy[\"Deck\"] = cabin_data.apply(lambda x: x[0])\n        X_val_copy[\"RoomNum\"] = cabin_data.apply(lambda x: x[1])\n        X_val_copy[\"Side\"] = cabin_data.apply(lambda x: x[2])\n        X_val_copy[\"CryoSleep\"] = X_val_copy[\"CryoSleep\"].astype(str)\n        X_val_copy[\"VIP\"] = X_val_copy[\"VIP\"].astype(str)\n        return pipe.predict(X_val_copy[NUMERIC + CATEGORICAL + [\"Deck\", \"RoomNum\", \"Side\"]]).astype(bool)\n    \n    return predict\n\n\nif __name__ == \"__main__\":\n    predict_fn = build_predict_fn()\n    score = prepare.evaluate(predict_fn)\n    print(f\"VAL_ACCURACY: {score:.4f}\")\n```\n</code>\n\n<notes_append>\nIteration 2: Parsed Cabin into Deck/RoomNum/Side, added categorical features (HomePlanet, Destination, CryoSleep, VIP) with mode imputation and one-hot encoding, kept logistic regression. Testing whether domain structure in categorical features and cabin location beats baseline.\n</notes_append>", "reflection": "The baseline model achieves 0.7809 validation accuracy using only 6 numeric columns. The data exploration reveals significant missing values in many columns (10–14% missing) and categorical features (HomePlanet, Destination, CryoSleep, VIP) that are currently unused. The spending columns (RoomService, FoodCourt, Spa, VRDeck) show negative correlations with Transported, suggesting passengers who spend more are less likely to be transported. The Cabin column (encoded as a string like \"F/0/S\") appears to contain structured information per the hints.", "observations": ["The Cabin column is a string with three parts separated by \"/\" (e.g., \"F/0/S\"). This likely encodes deck, room number, and side; splitting it could reveal predictive structure.", "The CryoSleep, VIP, and HomePlanet/Destination columns are completely unused by the baseline. Even though they have missing values, they may contain signal worth extracting after imputation.", "PassengerId has a pattern: \"XXXX_YY\" where YY might represent a group identifier (passengers traveling together). The hint about identifier columns encoding group structure suggests this warrants investigation.", "Missing values are not negligible (10–14% per column). The missingness pattern itself might be informative—e.g., certain groups or cabins have higher missingness rates.", "The spending features have weak individual correlations with the target (–0.25 to +0.05), but their interactions or nonlinear patterns may still be valuable; XGBoost might capture these better than logistic regression."], "hypothesis": "Splitting the Cabin column into deck, room number, and side, and including categorical features (HomePlanet, Destination, CryoSleep, VIP) with appropriate imputation and encoding, will improve validation accuracy because they capture spatial, travel, and behavior patterns not present in the numeric features alone.", "plan": "Parse the Cabin column into three features (Deck, RoomNum, Side), impute all categorical columns with a mode/most-frequent strategy, one-hot encode them, and train a logistic regression on the combined numeric + encoded categorical feature set. This keeps the model simple while capturing domain structure evident in the data.", "code": "\"\"\"\ntrain.py — feature engineering from Cabin and categorical columns.\n\"\"\"\nimport sys, pathlib\nsys.path.insert(0, str(pathlib.Path(__file__).resolve().parent.parent))\n\nimport pandas as pd\nimport numpy as np\nfrom sklearn.linear_model import LogisticRegression\nfrom sklearn.impute import SimpleImputer\nfrom sklearn.pipeline import Pipeline\nfrom sklearn.preprocessing import StandardScaler, OneHotEncoder\nfrom sklearn.compose import ColumnTransformer\n\nimport prepare\n\nNUMERIC = [\"Age\", \"RoomService\", \"FoodCourt\", \"ShoppingMall\", \"Spa\", \"VRDeck\"]\nCATEGORICAL = [\"HomePlanet\", \"Destination\", \"CryoSleep\", \"VIP\"]\n\n\ndef parse_cabin(cabin_str):\n    \"\"\"Parse Cabin 'F/0/S' into deck, room_num, side.\"\"\"\n    if pd.isna(cabin_str):\n        return np.nan, np.nan, np.nan\n    parts = str(cabin_str).split(\"/\")\n    if len(parts) == 3:\n        return parts[0], int(parts[1]) if parts[1].isdigit() else np.nan, parts[2]\n    return np.nan, np.nan, np.nan\n\n\ndef build_predict_fn():\n    train_df, _ = prepare.load_split()\n    \n    # Parse Cabin into Deck, RoomNum, Side\n    cabin_data = train_df[\"Cabin\"].apply(parse_cabin)\n    train_df[\"Deck\"] = cabin_data.apply(lambda x: x[0])\n    train_df[\"RoomNum\"] = cabin_data.apply(lambda x: x[1])\n    train_df[\"Side\"] = cabin_data.apply(lambda x: x[2])\n    \n    # Convert CryoSleep and VIP to numeric (they are object dtype)\n    train_df[\"CryoSleep\"] = train_df[\"CryoSleep\"].astype(str)\n    train_df[\"VIP\"] = train_df[\"VIP\"].astype(str)\n    \n    # Build feature set\n    X = train_df[NUMERIC + CATEGORICAL + [\"Deck\", \"RoomNum\", \"Side\"]]\n    y = train_df[\"Transported\"].astype(int)\n    \n    # Define preprocessing for numeric and categorical columns\n    numeric_transformer = Pipeline([\n        (\"imputer\", SimpleImputer(strategy=\"median\")),\n        (\"scaler\", StandardScaler()),\n    ])\n    \n    categorical_transformer = Pipeline([\n        (\"imputer\", SimpleImputer(strategy=\"most_frequent\")),\n        (\"onehot\", OneHotEncoder(handle_unknown=\"ignore\", sparse_output=False)),\n    ])\n    \n    preprocessor = ColumnTransformer([\n        (\"num\", numeric_transformer, NUMERIC + [\"RoomNum\"]),\n        (\"cat\", categorical_transformer, CATEGORICAL + [\"Deck\", \"Side\"]),\n    ])\n    \n    pipe = Pipeline([\n        (\"preprocessor\", preprocessor),\n        (\"clf\", LogisticRegression(max_iter=1000)),\n    ])\n    \n    pipe.fit(X, y)\n    \n    def predict(X_val):\n        # Parse Cabin in validation set\n        cabin_data = X_val[\"Cabin\"].apply(parse_cabin)\n        X_val_copy = X_val.copy()\n        X_val_copy[\"Deck\"] = cabin_data.apply(lambda x: x[0])\n        X_val_copy[\"RoomNum\"] = cabin_data.apply(lambda x: x[1])\n        X_val_copy[\"Side\"] = cabin_data.apply(lambda x: x[2])\n        X_val_copy[\"CryoSleep\"] = X_val_copy[\"CryoSleep\"].astype(str)\n        X_val_copy[\"VIP\"] = X_val_copy[\"VIP\"].astype(str)\n        return pipe.predict(X_val_copy[NUMERIC + CATEGORICAL + [\"Deck\", \"RoomNum\", \"Side\"]]).astype(bool)\n    \n    return predict\n\n\nif __name__ == \"__main__\":\n    predict_fn = build_predict_fn()\n    score = prepare.evaluate(predict_fn)\n    print(f\"VAL_ACCURACY: {score:.4f}\")\n", "notes_append": "Iteration 2: Parsed Cabin into Deck/RoomNum/Side, added categorical features (HomePlanet, Destination, CryoSleep, VIP) with mode imputation and one-hot encoding, kept logistic regression. Testing whether domain structure in categorical features and cabin location beats baseline.", "stdout": "VAL_ACCURACY: 0.7884\n", "stderr": "", "returncode": 0, "score": 0.7884, "kept": true, "status": "kept", "commit_hash": "507af2b", "input_tokens": 2888, "output_tokens": 1669, "cost_usd": 0.011233}
