{"iteration": 2, "timestamp": "2026-05-08T21:18:45", "previous_best": 0.8143, "duration_seconds": 1.87, "agent_response_raw": "<reflection>\nIteration 30 achieved 0.8143 (the same as baseline), confirming that the engineered spending features (ratios, totals) did not improve validation accuracy. This suggests that raw spending columns already encode the information we need, or that the engineered features add noise rather than signal. I need to shift strategy away from incremental feature engineering toward a more fundamental question: which features actually matter, and are we using the right model?\n</reflection>\n\n<observations>\n- The baseline logistic regression achieved 0.8143, and we've maintained that score through iterations 0–30 despite adding cabin parsing, GroupId, missingness flags, and spending ratios. This suggests either: (a) these features don't help, or (b) XGBoost is overfitting/underfitting with current hyperparameters.\n- Notes show that iter 27 (group aggregates) and iter 28 (LightGBM) were reverted, implying they didn't improve or broke. Iter 25–29 were mostly explorations of feature combinations and model types without breakthrough gains.\n- The notes mention \"high-cardinality GroupId\" as a concern. GroupId has ~800 unique values in ~8700 rows, which is a lot of categorical levels — this may be hurting XGBoost's tree-based learning or creating sparse feature space.\n- We are still well above the baseline (0.78), so there is room to explore. The fact that we haven't regressed much despite many changes suggests the current feature set is reasonably robust, but stagnant.\n- No feature selection or ablation study has been run. We don't know which of the current features (Age, spending columns, cabin parsing, GroupId, categorical features, missingness flags) are actually contributing to the 0.8143 score.\n</observations>\n\n<hypothesis>\nDropping high-cardinality GroupId and focusing on lower-cardinality features (Deck, Side, core numerics, categoricals, missingness flags) will improve generalization. High-cardinality categorical features may be overfitting in tree-based models or creating a sparse feature space that hurts performance on held-out data.\n</hypothesis>\n\n<plan>\nRemove GroupId from the feature set entirely, keeping the rest of the feature engineering (cabin parsing, missingness flags, spending columns but not spending ratios). Return to a simpler, lower-cardinality feature set. This will test whether GroupId is helping or hurting, and moves toward the \"simpler is better\" directive from program.md.\n</plan>\n\n<code>\n```python\n\"\"\"\ntrain.py — XGBoost with cabin parsing, missingness flags, no GroupId.\nIteration 31: Remove high-cardinality GroupId to reduce feature space sparsity.\nTest whether simpler feature set (Deck, Side, core numerics, categoricals, flags)\ngeneralizes better than the current 0.8143 plateau.\n\"\"\"\nimport sys, pathlib\nsys.path.insert(0, str(pathlib.Path(__file__).resolve().parent.parent))\n\nimport pandas as pd\nimport numpy as np\nimport xgboost as xgb\nfrom sklearn.impute import SimpleImputer\nfrom sklearn.pipeline import Pipeline\nfrom sklearn.preprocessing import StandardScaler, OneHotEncoder\nfrom sklearn.compose import ColumnTransformer\n\nimport prepare\n\nNUMERIC = [\"Age\", \"RoomService\", \"FoodCourt\", \"ShoppingMall\", \"Spa\", \"VRDeck\"]\nCATEGORICAL = [\"HomePlanet\", \"Destination\", \"CryoSleep\", \"VIP\"]\n\n\ndef parse_cabin(cabin_str):\n    \"\"\"Parse Cabin 'F/0/S' into deck, room_num, side.\"\"\"\n    if pd.isna(cabin_str):\n        return np.nan, np.nan, np.nan\n    parts = str(cabin_str).split(\"/\")\n    if len(parts) == 3:\n        return parts[0], int(parts[1]) if parts[1].isdigit() else np.nan, parts[2]\n    return np.nan, np.nan, np.nan\n\n\ndef build_predict_fn():\n    train_df, _ = prepare.load_split()\n    \n    # Parse Cabin into Deck, RoomNum, Side\n    cabin_data = train_df[\"Cabin\"].apply(parse_cabin)\n    train_df[\"Deck\"] = cabin_data.apply(lambda x: x[0])\n    train_df[\"RoomNum\"] = cabin_data.apply(lambda x: x[1])\n    train_df[\"Side\"] = cabin_data.apply(lambda x: x[2])\n    \n    # Create explicit missingness flags for CryoSleep and VIP before filling\n    train_df[\"CryoSleep_Missing\"] = train_df[\"CryoSleep\"].isna().astype(int)\n    train_df[\"VIP_Missing\"] = train_df[\"VIP\"].isna().astype(int)\n    \n    # Convert CryoSleep and VIP to string for categorical encoding\n    train_df[\"CryoSleep\"] = train_df[\"CryoSleep\"].fillna(\"Unknown\").astype(str)\n    train_df[\"VIP\"] = train_df[\"VIP\"].fillna(\"Unknown\").astype(str)\n    \n    # Build feature set: core features + cabin parsing + missingness flags (NO GroupId, NO spending ratios)\n    feature_cols = (\n        NUMERIC +\n        CATEGORICAL + \n        [\"Deck\", \"RoomNum\", \"Side\"] + \n        [\"CryoSleep_Missing\", \"VIP_Missing\"]\n    )\n    X = train_df[feature_cols]\n    y = train_df[\"Transported\"].astype(int)\n    \n    # Define preprocessing for numeric and categorical columns\n    numeric_transformer = Pipeline([\n        (\"imputer\", SimpleImputer(strategy=\"median\")),\n        (\"scaler\", StandardScaler()),\n    ])\n    \n    categorical_transformer = Pipeline([\n        (\"imputer\", SimpleImputer(strategy=\"most_frequent\")),\n        (\"onehot\", OneHotEncoder(handle_unknown=\"ignore\", sparse_output=False)),\n    ])\n    \n    numeric_feature_cols = [\"Age\", \"RoomNum\", \"CryoSleep_Missing\", \"VIP_Missing\"] + NUMERIC\n    categorical_feature_cols = CATEGORICAL + [\"Deck\", \"Side\"]\n    \n    preprocessor = ColumnTransformer([\n        (\"num\", numeric_transformer, numeric_feature_cols),\n        (\"cat\", categorical_transformer, categorical_feature_cols),\n    ])\n    \n    pipe = Pipeline([\n        (\"preprocessor\", preprocessor),\n        (\"clf\", xgb.XGBClassifier(n_estimators=100, max_depth=6, learning_rate=0.1, random_state=42, verbosity=0)),\n    ])\n    \n    pipe.fit(X, y)\n    \n    def predict(X_val):\n        # Parse Cabin in validation set\n        cabin_data = X_val[\"Cabin\"].apply(parse_cabin)\n        X_val_copy = X_val.copy()\n        X_val_copy[\"Deck\"] = cabin_data.apply(lambda x: x[0])\n        X_val_copy[\"RoomNum\"] = cabin_data.apply(lambda x: x[1])\n        X_val_copy[\"Side\"] = cabin_data.apply(lambda x: x[2])\n        \n        # Create explicit missingness flags for CryoSleep and VIP before filling\n        X_val_copy[\"CryoSleep_Missing\"] = X_val_copy[\"CryoSleep\"].isna().astype(int)\n        X_val_copy[\"VIP_Missing\"] = X_val_copy[\"VIP\"].isna().astype(int)\n        \n        # Handle CryoSleep and VIP\n        X_val_copy[\"CryoSleep\"] = X_val_copy[\"CryoSleep\"].fillna(\"Unknown\").astype(str)\n        X_val_copy[\"VIP\"] = X_val_copy[\"VIP\"].fillna(\"Unknown\").astype(str)\n        \n        return pipe.predict(X_val_copy[feature_cols]).astype(bool)\n    \n    return predict\n\n\nif __name__ == \"__main__\":\n    predict_fn = build_predict_fn()\n    score = prepare.evaluate(predict_fn)\n    print(f\"VAL_ACCURACY: {score:.4f}\")\n```\n</code>\n\n<notes_append>\nIteration 31: Removed high-cardinality GroupId and spending ratios, returning to simpler feature set (cabin parsing + RoomNum + Deck + Side + core numerics/categoricals + missingness flags). Testing whether reduced feature cardinality improves generalization beyond 0.8143 plateau.\n</notes_append>", "reflection": "Iteration 30 achieved 0.8143 (the same as baseline), confirming that the engineered spending features (ratios, totals) did not improve validation accuracy. This suggests that raw spending columns already encode the information we need, or that the engineered features add noise rather than signal. I need to shift strategy away from incremental feature engineering toward a more fundamental question: which features actually matter, and are we using the right model?", "observations": ["The baseline logistic regression achieved 0.8143, and we've maintained that score through iterations 0–30 despite adding cabin parsing, GroupId, missingness flags, and spending ratios. This suggests either: (a) these features don't help, or (b) XGBoost is overfitting/underfitting with current hyperparameters.", "Notes show that iter 27 (group aggregates) and iter 28 (LightGBM) were reverted, implying they didn't improve or broke. Iter 25–29 were mostly explorations of feature combinations and model types without breakthrough gains.", "The notes mention \"high-cardinality GroupId\" as a concern. GroupId has ~800 unique values in ~8700 rows, which is a lot of categorical levels — this may be hurting XGBoost's tree-based learning or creating sparse feature space.", "We are still well above the baseline (0.78), so there is room to explore. The fact that we haven't regressed much despite many changes suggests the current feature set is reasonably robust, but stagnant.", "No feature selection or ablation study has been run. We don't know which of the current features (Age, spending columns, cabin parsing, GroupId, categorical features, missingness flags) are actually contributing to the 0.8143 score."], "hypothesis": "Dropping high-cardinality GroupId and focusing on lower-cardinality features (Deck, Side, core numerics, categoricals, missingness flags) will improve generalization. High-cardinality categorical features may be overfitting in tree-based models or creating a sparse feature space that hurts performance on held-out data.", "plan": "Remove GroupId from the feature set entirely, keeping the rest of the feature engineering (cabin parsing, missingness flags, spending columns but not spending ratios). Return to a simpler, lower-cardinality feature set. This will test whether GroupId is helping or hurting, and moves toward the \"simpler is better\" directive from program.md.", "code": "\"\"\"\ntrain.py — XGBoost with cabin parsing, missingness flags, no GroupId.\nIteration 31: Remove high-cardinality GroupId to reduce feature space sparsity.\nTest whether simpler feature set (Deck, Side, core numerics, categoricals, flags)\ngeneralizes better than the current 0.8143 plateau.\n\"\"\"\nimport sys, pathlib\nsys.path.insert(0, str(pathlib.Path(__file__).resolve().parent.parent))\n\nimport pandas as pd\nimport numpy as np\nimport xgboost as xgb\nfrom sklearn.impute import SimpleImputer\nfrom sklearn.pipeline import Pipeline\nfrom sklearn.preprocessing import StandardScaler, OneHotEncoder\nfrom sklearn.compose import ColumnTransformer\n\nimport prepare\n\nNUMERIC = [\"Age\", \"RoomService\", \"FoodCourt\", \"ShoppingMall\", \"Spa\", \"VRDeck\"]\nCATEGORICAL = [\"HomePlanet\", \"Destination\", \"CryoSleep\", \"VIP\"]\n\n\ndef parse_cabin(cabin_str):\n    \"\"\"Parse Cabin 'F/0/S' into deck, room_num, side.\"\"\"\n    if pd.isna(cabin_str):\n        return np.nan, np.nan, np.nan\n    parts = str(cabin_str).split(\"/\")\n    if len(parts) == 3:\n        return parts[0], int(parts[1]) if parts[1].isdigit() else np.nan, parts[2]\n    return np.nan, np.nan, np.nan\n\n\ndef build_predict_fn():\n    train_df, _ = prepare.load_split()\n    \n    # Parse Cabin into Deck, RoomNum, Side\n    cabin_data = train_df[\"Cabin\"].apply(parse_cabin)\n    train_df[\"Deck\"] = cabin_data.apply(lambda x: x[0])\n    train_df[\"RoomNum\"] = cabin_data.apply(lambda x: x[1])\n    train_df[\"Side\"] = cabin_data.apply(lambda x: x[2])\n    \n    # Create explicit missingness flags for CryoSleep and VIP before filling\n    train_df[\"CryoSleep_Missing\"] = train_df[\"CryoSleep\"].isna().astype(int)\n    train_df[\"VIP_Missing\"] = train_df[\"VIP\"].isna().astype(int)\n    \n    # Convert CryoSleep and VIP to string for categorical encoding\n    train_df[\"CryoSleep\"] = train_df[\"CryoSleep\"].fillna(\"Unknown\").astype(str)\n    train_df[\"VIP\"] = train_df[\"VIP\"].fillna(\"Unknown\").astype(str)\n    \n    # Build feature set: core features + cabin parsing + missingness flags (NO GroupId, NO spending ratios)\n    feature_cols = (\n        NUMERIC +\n        CATEGORICAL + \n        [\"Deck\", \"RoomNum\", \"Side\"] + \n        [\"CryoSleep_Missing\", \"VIP_Missing\"]\n    )\n    X = train_df[feature_cols]\n    y = train_df[\"Transported\"].astype(int)\n    \n    # Define preprocessing for numeric and categorical columns\n    numeric_transformer = Pipeline([\n        (\"imputer\", SimpleImputer(strategy=\"median\")),\n        (\"scaler\", StandardScaler()),\n    ])\n    \n    categorical_transformer = Pipeline([\n        (\"imputer\", SimpleImputer(strategy=\"most_frequent\")),\n        (\"onehot\", OneHotEncoder(handle_unknown=\"ignore\", sparse_output=False)),\n    ])\n    \n    numeric_feature_cols = [\"Age\", \"RoomNum\", \"CryoSleep_Missing\", \"VIP_Missing\"] + NUMERIC\n    categorical_feature_cols = CATEGORICAL + [\"Deck\", \"Side\"]\n    \n    preprocessor = ColumnTransformer([\n        (\"num\", numeric_transformer, numeric_feature_cols),\n        (\"cat\", categorical_transformer, categorical_feature_cols),\n    ])\n    \n    pipe = Pipeline([\n        (\"preprocessor\", preprocessor),\n        (\"clf\", xgb.XGBClassifier(n_estimators=100, max_depth=6, learning_rate=0.1, random_state=42, verbosity=0)),\n    ])\n    \n    pipe.fit(X, y)\n    \n    def predict(X_val):\n        # Parse Cabin in validation set\n        cabin_data = X_val[\"Cabin\"].apply(parse_cabin)\n        X_val_copy = X_val.copy()\n        X_val_copy[\"Deck\"] = cabin_data.apply(lambda x: x[0])\n        X_val_copy[\"RoomNum\"] = cabin_data.apply(lambda x: x[1])\n        X_val_copy[\"Side\"] = cabin_data.apply(lambda x: x[2])\n        \n        # Create explicit missingness flags for CryoSleep and VIP before filling\n        X_val_copy[\"CryoSleep_Missing\"] = X_val_copy[\"CryoSleep\"].isna().astype(int)\n        X_val_copy[\"VIP_Missing\"] = X_val_copy[\"VIP\"].isna().astype(int)\n        \n        # Handle CryoSleep and VIP\n        X_val_copy[\"CryoSleep\"] = X_val_copy[\"CryoSleep\"].fillna(\"Unknown\").astype(str)\n        X_val_copy[\"VIP\"] = X_val_copy[\"VIP\"].fillna(\"Unknown\").astype(str)\n        \n        return pipe.predict(X_val_copy[feature_cols]).astype(bool)\n    \n    return predict\n\n\nif __name__ == \"__main__\":\n    predict_fn = build_predict_fn()\n    score = prepare.evaluate(predict_fn)\n    print(f\"VAL_ACCURACY: {score:.4f}\")\n", "notes_append": "Iteration 31: Removed high-cardinality GroupId and spending ratios, returning to simpler feature set (cabin parsing + RoomNum + Deck + Side + core numerics/categoricals + missingness flags). Testing whether reduced feature cardinality improves generalization beyond 0.8143 plateau.", "stdout": "VAL_ACCURACY: 0.8125\n", "stderr": "", "returncode": 0, "score": 0.8125, "kept": false, "status": "reverted", "commit_hash": null, "input_tokens": 4157, "output_tokens": 2105, "cost_usd": 0.014682}
