{"iteration": 1, "timestamp": "2026-05-08T21:18:21", "previous_best": 0.8143, "duration_seconds": 3.79, "agent_response_raw": "<reflection>\nThe current model achieves 0.8143 validation accuracy with XGBoost using cabin parsing, GroupId, RoomNum, and missingness flags. This matches the best score from iteration 0, suggesting the feature engineering has not yet yielded improvement. The notes show several attempted directions (HighSpender, PassengerSuffix, group aggregates, LightGBM) have been explored without gains. It's time to step back and examine the data more carefully to identify structural patterns or feature interactions that haven't been tested yet.\n</reflection>\n\n<observations>\n- The baseline score of 0.78 (logistic regression on raw numeric columns) is being beaten by the current model at 0.8143, but no improvement has been achieved beyond that in 29 iterations. This suggests the current feature set is solid but may be missing a key signal or interaction.\n- Group-level features (GroupId, GroupSize aggregates) have been added but the categorical cardinality of GroupId may be problematic. Iter 28 encountered validation GroupId values unseen in training, which is a hard signal that pure categorical encoding of GroupId is fragile.\n- Missingness flags for CryoSleep and VIP were added and retained, suggesting they capture signal. The fact that spending columns are filled with 0 (rather than median/forward-fill) is a deliberate choice encoding \"no spending\" as absence.\n- No deep inspection of feature correlations, target distribution by feature, or distribution shifts between train/validation have been performed. The notes focus on feature engineering iterations rather than exploratory data analysis.\n- The model has stabilized at one accuracy; the next direction should be either: (a) understand which features actually drive predictions via ablation or inspection, (b) test interaction features or nonlinear transformations of existing features, or (c) verify data assumptions (e.g., are spending columns truly predictive in their current form?).\n</observations>\n\n<hypothesis>\nSpending columns contain rich information that is being underutilized by treating them as raw numeric values. Creating derived spending features (total spending, spending ratios, spending patterns) and testing whether any combination of these or nonlinear transformations of spending improves signal. For example, `TotalSpending` and `SpendingPerCategory` ratios might capture passenger behavior patterns more directly than individual columns.\n</hypothesis>\n\n<plan>\nAdd engineered spending features: TotalSpending (sum of all spending columns), and ratios like RoomService/TotalSpending, etc., to capture spending patterns. Keep the current cabin+GroupId+missingness feature set and test whether these derived spending features improve accuracy. This tests whether the spending signal is being missed due to feature representation, without adding model complexity.\n</plan>\n\n<code>\n```python\n\"\"\"\ntrain.py — XGBoost with cabin parsing, GroupId, and spending ratio features.\nIteration 30: Add engineered spending features (TotalSpending, spending category ratios)\nto test whether spending patterns encode passenger behavior more predictively than raw values.\n\"\"\"\nimport sys, pathlib\nsys.path.insert(0, str(pathlib.Path(__file__).resolve().parent.parent))\n\nimport pandas as pd\nimport numpy as np\nimport xgboost as xgb\nfrom sklearn.impute import SimpleImputer\nfrom sklearn.pipeline import Pipeline\nfrom sklearn.preprocessing import StandardScaler, OneHotEncoder\nfrom sklearn.compose import ColumnTransformer\n\nimport prepare\n\nNUMERIC = [\"Age\", \"RoomService\", \"FoodCourt\", \"ShoppingMall\", \"Spa\", \"VRDeck\"]\nCATEGORICAL = [\"HomePlanet\", \"Destination\", \"CryoSleep\", \"VIP\"]\nSPENDING = [\"RoomService\", \"FoodCourt\", \"ShoppingMall\", \"Spa\", \"VRDeck\"]\n\n\ndef parse_cabin(cabin_str):\n    \"\"\"Parse Cabin 'F/0/S' into deck, room_num, side.\"\"\"\n    if pd.isna(cabin_str):\n        return np.nan, np.nan, np.nan\n    parts = str(cabin_str).split(\"/\")\n    if len(parts) == 3:\n        return parts[0], int(parts[1]) if parts[1].isdigit() else np.nan, parts[2]\n    return np.nan, np.nan, np.nan\n\n\ndef extract_group_id(passenger_id):\n    \"\"\"Extract group ID from PassengerId (e.g., '0001_01' -> '0001').\"\"\"\n    if pd.isna(passenger_id):\n        return np.nan\n    return str(passenger_id).split(\"_\")[0]\n\n\ndef engineer_spending_features(df):\n    \"\"\"Add derived spending features: TotalSpending and category ratios.\"\"\"\n    df_copy = df.copy()\n    \n    # Fill missing spending with 0 first\n    for col in SPENDING:\n        df_copy[col] = df_copy[col].fillna(0)\n    \n    # Total spending across all categories\n    df_copy[\"TotalSpending\"] = df_copy[SPENDING].sum(axis=1)\n    \n    # Ratio of each spending category to total (handle division by zero)\n    for col in SPENDING:\n        df_copy[f\"{col}_Ratio\"] = np.where(\n            df_copy[\"TotalSpending\"] > 0,\n            df_copy[col] / df_copy[\"TotalSpending\"],\n            0\n        )\n    \n    # Mark whether passenger spent anything (binary indicator)\n    df_copy[\"AnySpending\"] = (df_copy[\"TotalSpending\"] > 0).astype(int)\n    \n    return df_copy\n\n\ndef build_predict_fn():\n    train_df, _ = prepare.load_split()\n    \n    # Parse Cabin into Deck, RoomNum, Side\n    cabin_data = train_df[\"Cabin\"].apply(parse_cabin)\n    train_df[\"Deck\"] = cabin_data.apply(lambda x: x[0])\n    train_df[\"RoomNum\"] = cabin_data.apply(lambda x: x[1])\n    train_df[\"Side\"] = cabin_data.apply(lambda x: x[2])\n    \n    # Extract group ID from PassengerId\n    train_df[\"GroupId\"] = train_df[\"PassengerId\"].apply(extract_group_id)\n    \n    # Engineer spending features\n    train_df = engineer_spending_features(train_df)\n    \n    # Create explicit missingness flags for CryoSleep and VIP before filling\n    train_df[\"CryoSleep_Missing\"] = train_df[\"CryoSleep\"].isna().astype(int)\n    train_df[\"VIP_Missing\"] = train_df[\"VIP\"].isna().astype(int)\n    \n    # Convert CryoSleep and VIP to string for categorical encoding\n    train_df[\"CryoSleep\"] = train_df[\"CryoSleep\"].fillna(\"Unknown\").astype(str)\n    train_df[\"VIP\"] = train_df[\"VIP\"].fillna(\"Unknown\").astype(str)\n    \n    # Build feature set: core features + cabin parsing + spending engineering + missingness flags\n    spending_ratio_cols = [f\"{col}_Ratio\" for col in SPENDING]\n    feature_cols = (\n        [\"Age\"] + SPENDING + [\"TotalSpending\", \"AnySpending\"] + spending_ratio_cols +\n        CATEGORICAL + \n        [\"Deck\", \"RoomNum\", \"Side\", \"GroupId\"] + \n        [\"CryoSleep_Missing\", \"VIP_Missing\"]\n    )\n    X = train_df[feature_cols]\n    y = train_df[\"Transported\"].astype(int)\n    \n    # Define preprocessing for numeric and categorical columns\n    numeric_transformer = Pipeline([\n        (\"imputer\", SimpleImputer(strategy=\"median\")),\n        (\"scaler\", StandardScaler()),\n    ])\n    \n    categorical_transformer = Pipeline([\n        (\"imputer\", SimpleImputer(strategy=\"most_frequent\")),\n        (\"onehot\", OneHotEncoder(handle_unknown=\"ignore\", sparse_output=False)),\n    ])\n    \n    numeric_feature_cols = (\n        [\"Age\", \"RoomNum\", \"CryoSleep_Missing\", \"VIP_Missing\"] + \n        SPENDING + [\"TotalSpending\", \"AnySpending\"] + spending_ratio_cols\n    )\n    categorical_feature_cols = CATEGORICAL + [\"Deck\", \"Side\", \"GroupId\"]\n    \n    preprocessor = ColumnTransformer([\n        (\"num\", numeric_transformer, numeric_feature_cols),\n        (\"cat\", categorical_transformer, categorical_feature_cols),\n    ])\n    \n    pipe = Pipeline([\n        (\"preprocessor\", preprocessor),\n        (\"clf\", xgb.XGBClassifier(n_estimators=100, max_depth=6, learning_rate=0.1, random_state=42, verbosity=0)),\n    ])\n    \n    pipe.fit(X, y)\n    \n    def predict(X_val):\n        # Parse Cabin in validation set\n        cabin_data = X_val[\"Cabin\"].apply(parse_cabin)\n        X_val_copy = X_val.copy()\n        X_val_copy[\"Deck\"] = cabin_data.apply(lambda x: x[0])\n        X_val_copy[\"RoomNum\"] = cabin_data.apply(lambda x: x[1])\n        X_val_copy[\"Side\"] = cabin_data.apply(lambda x: x[2])\n        \n        # Extract group ID\n        X_val_copy[\"GroupId\"] = X_val_copy[\"PassengerId\"].apply(extract_group_id)\n        \n        # Engineer spending features\n        X_val_copy = engineer_spending_features(X_val_copy)\n        \n        # Create explicit missingness flags for CryoSleep and VIP before filling\n        X_val_copy[\"CryoSleep_Missing\"] = X_val_copy[\"CryoSleep\"].isna().astype(int)\n        X_val_copy[\"VIP_Missing\"] = X_val_copy[\"VIP\"].isna().astype(int)\n        \n        # Handle CryoSleep and VIP\n        X_val_copy[\"CryoSleep\"] = X_val_copy[\"CryoSleep\"].fillna(\"Unknown\").astype(str)\n        X_val_copy[\"VIP\"] = X_val_copy[\"VIP\"].fillna(\"Unknown\").astype(str)\n        \n        return pipe.predict(X_val_copy[feature_cols]).astype(bool)\n    \n    return predict\n\n\nif __name__ == \"__main__\":\n    predict_fn = build_predict_fn()\n    score = prepare.evaluate(predict_fn)\n    print(f\"VAL_ACCURACY: {score:.4f}\")\n```\n</code>\n\n<notes_append>\nIteration 30: Added engineered spending features (TotalSpending, spending category ratios, AnySpending) to capture passenger spending patterns more explicitly. Hypothesis: ratio-based features may encode passenger behavior better than raw spending values alone.\n</notes_append>", "reflection": "The current model achieves 0.8143 validation accuracy with XGBoost using cabin parsing, GroupId, RoomNum, and missingness flags. This matches the best score from iteration 0, suggesting the feature engineering has not yet yielded improvement. The notes show several attempted directions (HighSpender, PassengerSuffix, group aggregates, LightGBM) have been explored without gains. It's time to step back and examine the data more carefully to identify structural patterns or feature interactions that haven't been tested yet.", "observations": ["The baseline score of 0.78 (logistic regression on raw numeric columns) is being beaten by the current model at 0.8143, but no improvement has been achieved beyond that in 29 iterations. This suggests the current feature set is solid but may be missing a key signal or interaction.", "Group-level features (GroupId, GroupSize aggregates) have been added but the categorical cardinality of GroupId may be problematic. Iter 28 encountered validation GroupId values unseen in training, which is a hard signal that pure categorical encoding of GroupId is fragile.", "Missingness flags for CryoSleep and VIP were added and retained, suggesting they capture signal. The fact that spending columns are filled with 0 (rather than median/forward-fill) is a deliberate choice encoding \"no spending\" as absence.", "No deep inspection of feature correlations, target distribution by feature, or distribution shifts between train/validation have been performed. The notes focus on feature engineering iterations rather than exploratory data analysis.", "The model has stabilized at one accuracy; the next direction should be either: (a) understand which features actually drive predictions via ablation or inspection, (b) test interaction features or nonlinear transformations of existing features, or (c) verify data assumptions (e.g., are spending columns truly predictive in their current form?)."], "hypothesis": "Spending columns contain rich information that is being underutilized by treating them as raw numeric values. Creating derived spending features (total spending, spending ratios, spending patterns) and testing whether any combination of these or nonlinear transformations of spending improves signal. For example, `TotalSpending` and `SpendingPerCategory` ratios might capture passenger behavior patterns more directly than individual columns.", "plan": "Add engineered spending features: TotalSpending (sum of all spending columns), and ratios like RoomService/TotalSpending, etc., to capture spending patterns. Keep the current cabin+GroupId+missingness feature set and test whether these derived spending features improve accuracy. This tests whether the spending signal is being missed due to feature representation, without adding model complexity.", "code": "\"\"\"\ntrain.py — XGBoost with cabin parsing, GroupId, and spending ratio features.\nIteration 30: Add engineered spending features (TotalSpending, spending category ratios)\nto test whether spending patterns encode passenger behavior more predictively than raw values.\n\"\"\"\nimport sys, pathlib\nsys.path.insert(0, str(pathlib.Path(__file__).resolve().parent.parent))\n\nimport pandas as pd\nimport numpy as np\nimport xgboost as xgb\nfrom sklearn.impute import SimpleImputer\nfrom sklearn.pipeline import Pipeline\nfrom sklearn.preprocessing import StandardScaler, OneHotEncoder\nfrom sklearn.compose import ColumnTransformer\n\nimport prepare\n\nNUMERIC = [\"Age\", \"RoomService\", \"FoodCourt\", \"ShoppingMall\", \"Spa\", \"VRDeck\"]\nCATEGORICAL = [\"HomePlanet\", \"Destination\", \"CryoSleep\", \"VIP\"]\nSPENDING = [\"RoomService\", \"FoodCourt\", \"ShoppingMall\", \"Spa\", \"VRDeck\"]\n\n\ndef parse_cabin(cabin_str):\n    \"\"\"Parse Cabin 'F/0/S' into deck, room_num, side.\"\"\"\n    if pd.isna(cabin_str):\n        return np.nan, np.nan, np.nan\n    parts = str(cabin_str).split(\"/\")\n    if len(parts) == 3:\n        return parts[0], int(parts[1]) if parts[1].isdigit() else np.nan, parts[2]\n    return np.nan, np.nan, np.nan\n\n\ndef extract_group_id(passenger_id):\n    \"\"\"Extract group ID from PassengerId (e.g., '0001_01' -> '0001').\"\"\"\n    if pd.isna(passenger_id):\n        return np.nan\n    return str(passenger_id).split(\"_\")[0]\n\n\ndef engineer_spending_features(df):\n    \"\"\"Add derived spending features: TotalSpending and category ratios.\"\"\"\n    df_copy = df.copy()\n    \n    # Fill missing spending with 0 first\n    for col in SPENDING:\n        df_copy[col] = df_copy[col].fillna(0)\n    \n    # Total spending across all categories\n    df_copy[\"TotalSpending\"] = df_copy[SPENDING].sum(axis=1)\n    \n    # Ratio of each spending category to total (handle division by zero)\n    for col in SPENDING:\n        df_copy[f\"{col}_Ratio\"] = np.where(\n            df_copy[\"TotalSpending\"] > 0,\n            df_copy[col] / df_copy[\"TotalSpending\"],\n            0\n        )\n    \n    # Mark whether passenger spent anything (binary indicator)\n    df_copy[\"AnySpending\"] = (df_copy[\"TotalSpending\"] > 0).astype(int)\n    \n    return df_copy\n\n\ndef build_predict_fn():\n    train_df, _ = prepare.load_split()\n    \n    # Parse Cabin into Deck, RoomNum, Side\n    cabin_data = train_df[\"Cabin\"].apply(parse_cabin)\n    train_df[\"Deck\"] = cabin_data.apply(lambda x: x[0])\n    train_df[\"RoomNum\"] = cabin_data.apply(lambda x: x[1])\n    train_df[\"Side\"] = cabin_data.apply(lambda x: x[2])\n    \n    # Extract group ID from PassengerId\n    train_df[\"GroupId\"] = train_df[\"PassengerId\"].apply(extract_group_id)\n    \n    # Engineer spending features\n    train_df = engineer_spending_features(train_df)\n    \n    # Create explicit missingness flags for CryoSleep and VIP before filling\n    train_df[\"CryoSleep_Missing\"] = train_df[\"CryoSleep\"].isna().astype(int)\n    train_df[\"VIP_Missing\"] = train_df[\"VIP\"].isna().astype(int)\n    \n    # Convert CryoSleep and VIP to string for categorical encoding\n    train_df[\"CryoSleep\"] = train_df[\"CryoSleep\"].fillna(\"Unknown\").astype(str)\n    train_df[\"VIP\"] = train_df[\"VIP\"].fillna(\"Unknown\").astype(str)\n    \n    # Build feature set: core features + cabin parsing + spending engineering + missingness flags\n    spending_ratio_cols = [f\"{col}_Ratio\" for col in SPENDING]\n    feature_cols = (\n        [\"Age\"] + SPENDING + [\"TotalSpending\", \"AnySpending\"] + spending_ratio_cols +\n        CATEGORICAL + \n        [\"Deck\", \"RoomNum\", \"Side\", \"GroupId\"] + \n        [\"CryoSleep_Missing\", \"VIP_Missing\"]\n    )\n    X = train_df[feature_cols]\n    y = train_df[\"Transported\"].astype(int)\n    \n    # Define preprocessing for numeric and categorical columns\n    numeric_transformer = Pipeline([\n        (\"imputer\", SimpleImputer(strategy=\"median\")),\n        (\"scaler\", StandardScaler()),\n    ])\n    \n    categorical_transformer = Pipeline([\n        (\"imputer\", SimpleImputer(strategy=\"most_frequent\")),\n        (\"onehot\", OneHotEncoder(handle_unknown=\"ignore\", sparse_output=False)),\n    ])\n    \n    numeric_feature_cols = (\n        [\"Age\", \"RoomNum\", \"CryoSleep_Missing\", \"VIP_Missing\"] + \n        SPENDING + [\"TotalSpending\", \"AnySpending\"] + spending_ratio_cols\n    )\n    categorical_feature_cols = CATEGORICAL + [\"Deck\", \"Side\", \"GroupId\"]\n    \n    preprocessor = ColumnTransformer([\n        (\"num\", numeric_transformer, numeric_feature_cols),\n        (\"cat\", categorical_transformer, categorical_feature_cols),\n    ])\n    \n    pipe = Pipeline([\n        (\"preprocessor\", preprocessor),\n        (\"clf\", xgb.XGBClassifier(n_estimators=100, max_depth=6, learning_rate=0.1, random_state=42, verbosity=0)),\n    ])\n    \n    pipe.fit(X, y)\n    \n    def predict(X_val):\n        # Parse Cabin in validation set\n        cabin_data = X_val[\"Cabin\"].apply(parse_cabin)\n        X_val_copy = X_val.copy()\n        X_val_copy[\"Deck\"] = cabin_data.apply(lambda x: x[0])\n        X_val_copy[\"RoomNum\"] = cabin_data.apply(lambda x: x[1])\n        X_val_copy[\"Side\"] = cabin_data.apply(lambda x: x[2])\n        \n        # Extract group ID\n        X_val_copy[\"GroupId\"] = X_val_copy[\"PassengerId\"].apply(extract_group_id)\n        \n        # Engineer spending features\n        X_val_copy = engineer_spending_features(X_val_copy)\n        \n        # Create explicit missingness flags for CryoSleep and VIP before filling\n        X_val_copy[\"CryoSleep_Missing\"] = X_val_copy[\"CryoSleep\"].isna().astype(int)\n        X_val_copy[\"VIP_Missing\"] = X_val_copy[\"VIP\"].isna().astype(int)\n        \n        # Handle CryoSleep and VIP\n        X_val_copy[\"CryoSleep\"] = X_val_copy[\"CryoSleep\"].fillna(\"Unknown\").astype(str)\n        X_val_copy[\"VIP\"] = X_val_copy[\"VIP\"].fillna(\"Unknown\").astype(str)\n        \n        return pipe.predict(X_val_copy[feature_cols]).astype(bool)\n    \n    return predict\n\n\nif __name__ == \"__main__\":\n    predict_fn = build_predict_fn()\n    score = prepare.evaluate(predict_fn)\n    print(f\"VAL_ACCURACY: {score:.4f}\")\n", "notes_append": "Iteration 30: Added engineered spending features (TotalSpending, spending category ratios, AnySpending) to capture passenger spending patterns more explicitly. Hypothesis: ratio-based features may encode passenger behavior better than raw spending values alone.", "stdout": "VAL_ACCURACY: 0.8143\n", "stderr": "", "returncode": 0, "score": 0.8143, "kept": true, "status": "kept", "commit_hash": "4bd68cc", "input_tokens": 3830, "output_tokens": 2657, "cost_usd": 0.017115}
