{"iteration": 7, "timestamp": "2026-05-08T20:34:56", "previous_best": 0.7901, "duration_seconds": 4.07, "agent_response_raw": "<reflection>\nThe last iteration (7) added PersonId and AnySpending features but scored 0.7884, which is a regression from the best of 0.7901 (iteration 2/4/5). The revert indicates those features were not helpful. I need to step back and understand why iteration 5 (which kept 0.7901) worked well, then consider what structurally different direction to explore rather than continue minor feature tweaking.\n</reflection>\n\n<observations>\n- Iteration 5 achieved 0.7901 by restoring logistic regression + one-hot encoding while keeping cabin parsing, GroupId extraction, spending-as-zero imputation, and explicit \"Unknown\" handling for boolean NaNs. This suggests the core pipeline is sound.\n- Iterations 6 and 7 added aggregate features (TotalSpending, GroupSize, PersonId, AnySpending) but both regressed to 0.7884, indicating these features either added noise or collinearity without signal.\n- The notes show I've been iterating on feature engineering within the same logistic regression + one-hot architecture. Per the soft directives, continuing minor feature variants is a sign I'm stuck — I should try something structurally different.\n- I haven't tried interaction features, polynomial expansions, or different imputation strategies (e.g., forward-fill by group, or missingness flags). I also haven't systematically tested whether dropping low-variance or redundant features helps.\n- The baseline logistic regression on raw numeric columns scored ~0.78; we're at 0.7901, a modest gain. The dataset is small (~8,700 rows), so overfitting is a real risk with aggressive feature engineering.\n</observations>\n\n<hypothesis>\nAdding a binary \"IsMissing\" feature for Age (which has missing values) will improve accuracy because the missingness pattern itself may be predictive of transportation, without requiring complex aggregate engineering that adds noise.\n</hypothesis>\n\n<plan>\nI will revert to the iteration 5 pipeline (which scored 0.7901) but add one simple feature: a binary flag indicating whether Age is missing. This tests whether missingness is predictive, is cheap to compute, and avoids the collinearity/noise issues seen in iterations 6–7. If this helps, it's a clean win; if not, I'll pivot to a different structural change like regularization or feature selection.\n</plan>\n\n<code>\n```python\n\"\"\"\ntrain.py — logistic regression with cabin parsing, group features, age missingness flag.\n\"\"\"\nimport sys, pathlib\nsys.path.insert(0, str(pathlib.Path(__file__).resolve().parent.parent))\n\nimport pandas as pd\nimport numpy as np\nfrom sklearn.linear_model import LogisticRegression\nfrom sklearn.impute import SimpleImputer\nfrom sklearn.pipeline import Pipeline\nfrom sklearn.preprocessing import StandardScaler, OneHotEncoder\nfrom sklearn.compose import ColumnTransformer\n\nimport prepare\n\nNUMERIC = [\"Age\", \"RoomService\", \"FoodCourt\", \"ShoppingMall\", \"Spa\", \"VRDeck\"]\nCATEGORICAL = [\"HomePlanet\", \"Destination\", \"CryoSleep\", \"VIP\"]\nSPENDING = [\"RoomService\", \"FoodCourt\", \"ShoppingMall\", \"Spa\", \"VRDeck\"]\n\n\ndef parse_cabin(cabin_str):\n    \"\"\"Parse Cabin 'F/0/S' into deck, room_num, side.\"\"\"\n    if pd.isna(cabin_str):\n        return np.nan, np.nan, np.nan\n    parts = str(cabin_str).split(\"/\")\n    if len(parts) == 3:\n        return parts[0], int(parts[1]) if parts[1].isdigit() else np.nan, parts[2]\n    return np.nan, np.nan, np.nan\n\n\ndef extract_group_id(passenger_id):\n    \"\"\"Extract group ID from PassengerId (e.g., '0001_01' -> '0001').\"\"\"\n    if pd.isna(passenger_id):\n        return np.nan\n    return str(passenger_id).split(\"_\")[0]\n\n\ndef build_predict_fn():\n    train_df, _ = prepare.load_split()\n    \n    # Parse Cabin into Deck, RoomNum, Side\n    cabin_data = train_df[\"Cabin\"].apply(parse_cabin)\n    train_df[\"Deck\"] = cabin_data.apply(lambda x: x[0])\n    train_df[\"RoomNum\"] = cabin_data.apply(lambda x: x[1])\n    train_df[\"Side\"] = cabin_data.apply(lambda x: x[2])\n    \n    # Extract group ID from PassengerId\n    train_df[\"GroupId\"] = train_df[\"PassengerId\"].apply(extract_group_id)\n    \n    # Compute group size for each passenger\n    group_sizes = train_df[\"GroupId\"].value_counts().to_dict()\n    train_df[\"GroupSize\"] = train_df[\"GroupId\"].map(group_sizes).fillna(1)\n    \n    # Flag: is Age missing?\n    train_df[\"AgeMissing\"] = train_df[\"Age\"].isna().astype(int)\n    \n    # Fill missing values in spending columns with 0 (indicates not spent)\n    for col in SPENDING:\n        train_df[col] = train_df[col].fillna(0)\n    \n    # Compute total spending across all categories\n    train_df[\"TotalSpending\"] = train_df[SPENDING].sum(axis=1)\n    \n    # Convert CryoSleep and VIP to numeric (handle NaN explicitly)\n    train_df[\"CryoSleep\"] = train_df[\"CryoSleep\"].fillna(\"Unknown\").astype(str)\n    train_df[\"VIP\"] = train_df[\"VIP\"].fillna(\"Unknown\").astype(str)\n    \n    # Build feature set: include both individual spending and aggregate spending\n    feature_cols = [\"Age\", \"AgeMissing\", \"TotalSpending\"] + SPENDING + CATEGORICAL + [\"Deck\", \"RoomNum\", \"Side\", \"GroupId\", \"GroupSize\"]\n    X = train_df[feature_cols]\n    y = train_df[\"Transported\"].astype(int)\n    \n    # Define preprocessing for numeric and categorical columns\n    numeric_transformer = Pipeline([\n        (\"imputer\", SimpleImputer(strategy=\"median\")),\n        (\"scaler\", StandardScaler()),\n    ])\n    \n    categorical_transformer = Pipeline([\n        (\"imputer\", SimpleImputer(strategy=\"most_frequent\")),\n        (\"onehot\", OneHotEncoder(handle_unknown=\"ignore\", sparse_output=False)),\n    ])\n    \n    preprocessor = ColumnTransformer([\n        (\"num\", numeric_transformer, [\"Age\", \"AgeMissing\", \"TotalSpending\", \"RoomNum\", \"GroupSize\"] + SPENDING),\n        (\"cat\", categorical_transformer, CATEGORICAL + [\"Deck\", \"Side\", \"GroupId\"]),\n    ])\n    \n    pipe = Pipeline([\n        (\"preprocessor\", preprocessor),\n        (\"clf\", LogisticRegression(max_iter=1000)),\n    ])\n    \n    pipe.fit(X, y)\n    \n    # Store group_sizes mapping for use in predict function\n    pipe.group_sizes = group_sizes\n    \n    def predict(X_val):\n        # Parse Cabin in validation set\n        cabin_data = X_val[\"Cabin\"].apply(parse_cabin)\n        X_val_copy = X_val.copy()\n        X_val_copy[\"Deck\"] = cabin_data.apply(lambda x: x[0])\n        X_val_copy[\"RoomNum\"] = cabin_data.apply(lambda x: x[1])\n        X_val_copy[\"Side\"] = cabin_data.apply(lambda x: x[2])\n        \n        # Extract group ID\n        X_val_copy[\"GroupId\"] = X_val_copy[\"PassengerId\"].apply(extract_group_id)\n        \n        # Compute group size using training set mapping (default to 1 for unseen groups)\n        X_val_copy[\"GroupSize\"] = X_val_copy[\"GroupId\"].map(pipe.group_sizes).fillna(1)\n        \n        # Flag: is Age missing?\n        X_val_copy[\"AgeMissing\"] = X_val_copy[\"Age\"].isna().astype(int)\n        \n        # Fill missing spending with 0\n        for col in SPENDING:\n            X_val_copy[col] = X_val_copy[col].fillna(0)\n        \n        # Compute total spending\n        X_val_copy[\"TotalSpending\"] = X_val_copy[SPENDING].sum(axis=1)\n        \n        # Handle CryoSleep and VIP\n        X_val_copy[\"CryoSleep\"] = X_val_copy[\"CryoSleep\"].fillna(\"Unknown\").astype(str)\n        X_val_copy[\"VIP\"] = X_val_copy[\"VIP\"].fillna(\"Unknown\").astype(str)\n        \n        return pipe.predict(X_val_copy[feature_cols]).astype(bool)\n    \n    return predict\n\n\nif __name__ == \"__main__\":\n    predict_fn = build_predict_fn()\n    score = prepare.evaluate(predict_fn)\n    print(f\"VAL_ACCURACY: {score:.4f}\")\n```\n</code>\n\n<notes_append>\nIteration 8: Added binary AgeMissing flag (whether Age is NaN) to the iteration 5 pipeline, testing whether missingness is itself predictive. Simpler than recent feature engineering; if ineffective, will pivot to regularization or feature selection rather than continue feature addition.\n</notes_append>", "reflection": "The last iteration (7) added PersonId and AnySpending features but scored 0.7884, which is a regression from the best of 0.7901 (iteration 2/4/5). The revert indicates those features were not helpful. I need to step back and understand why iteration 5 (which kept 0.7901) worked well, then consider what structurally different direction to explore rather than continue minor feature tweaking.", "observations": ["Iteration 5 achieved 0.7901 by restoring logistic regression + one-hot encoding while keeping cabin parsing, GroupId extraction, spending-as-zero imputation, and explicit \"Unknown\" handling for boolean NaNs. This suggests the core pipeline is sound.", "Iterations 6 and 7 added aggregate features (TotalSpending, GroupSize, PersonId, AnySpending) but both regressed to 0.7884, indicating these features either added noise or collinearity without signal.", "The notes show I've been iterating on feature engineering within the same logistic regression + one-hot architecture. Per the soft directives, continuing minor feature variants is a sign I'm stuck — I should try something structurally different.", "I haven't tried interaction features, polynomial expansions, or different imputation strategies (e.g., forward-fill by group, or missingness flags). I also haven't systematically tested whether dropping low-variance or redundant features helps.", "The baseline logistic regression on raw numeric columns scored ~0.78; we're at 0.7901, a modest gain. The dataset is small (~8,700 rows), so overfitting is a real risk with aggressive feature engineering."], "hypothesis": "Adding a binary \"IsMissing\" feature for Age (which has missing values) will improve accuracy because the missingness pattern itself may be predictive of transportation, without requiring complex aggregate engineering that adds noise.", "plan": "I will revert to the iteration 5 pipeline (which scored 0.7901) but add one simple feature: a binary flag indicating whether Age is missing. This tests whether missingness is predictive, is cheap to compute, and avoids the collinearity/noise issues seen in iterations 6–7. If this helps, it's a clean win; if not, I'll pivot to a different structural change like regularization or feature selection.", "code": "\"\"\"\ntrain.py — logistic regression with cabin parsing, group features, age missingness flag.\n\"\"\"\nimport sys, pathlib\nsys.path.insert(0, str(pathlib.Path(__file__).resolve().parent.parent))\n\nimport pandas as pd\nimport numpy as np\nfrom sklearn.linear_model import LogisticRegression\nfrom sklearn.impute import SimpleImputer\nfrom sklearn.pipeline import Pipeline\nfrom sklearn.preprocessing import StandardScaler, OneHotEncoder\nfrom sklearn.compose import ColumnTransformer\n\nimport prepare\n\nNUMERIC = [\"Age\", \"RoomService\", \"FoodCourt\", \"ShoppingMall\", \"Spa\", \"VRDeck\"]\nCATEGORICAL = [\"HomePlanet\", \"Destination\", \"CryoSleep\", \"VIP\"]\nSPENDING = [\"RoomService\", \"FoodCourt\", \"ShoppingMall\", \"Spa\", \"VRDeck\"]\n\n\ndef parse_cabin(cabin_str):\n    \"\"\"Parse Cabin 'F/0/S' into deck, room_num, side.\"\"\"\n    if pd.isna(cabin_str):\n        return np.nan, np.nan, np.nan\n    parts = str(cabin_str).split(\"/\")\n    if len(parts) == 3:\n        return parts[0], int(parts[1]) if parts[1].isdigit() else np.nan, parts[2]\n    return np.nan, np.nan, np.nan\n\n\ndef extract_group_id(passenger_id):\n    \"\"\"Extract group ID from PassengerId (e.g., '0001_01' -> '0001').\"\"\"\n    if pd.isna(passenger_id):\n        return np.nan\n    return str(passenger_id).split(\"_\")[0]\n\n\ndef build_predict_fn():\n    train_df, _ = prepare.load_split()\n    \n    # Parse Cabin into Deck, RoomNum, Side\n    cabin_data = train_df[\"Cabin\"].apply(parse_cabin)\n    train_df[\"Deck\"] = cabin_data.apply(lambda x: x[0])\n    train_df[\"RoomNum\"] = cabin_data.apply(lambda x: x[1])\n    train_df[\"Side\"] = cabin_data.apply(lambda x: x[2])\n    \n    # Extract group ID from PassengerId\n    train_df[\"GroupId\"] = train_df[\"PassengerId\"].apply(extract_group_id)\n    \n    # Compute group size for each passenger\n    group_sizes = train_df[\"GroupId\"].value_counts().to_dict()\n    train_df[\"GroupSize\"] = train_df[\"GroupId\"].map(group_sizes).fillna(1)\n    \n    # Flag: is Age missing?\n    train_df[\"AgeMissing\"] = train_df[\"Age\"].isna().astype(int)\n    \n    # Fill missing values in spending columns with 0 (indicates not spent)\n    for col in SPENDING:\n        train_df[col] = train_df[col].fillna(0)\n    \n    # Compute total spending across all categories\n    train_df[\"TotalSpending\"] = train_df[SPENDING].sum(axis=1)\n    \n    # Convert CryoSleep and VIP to numeric (handle NaN explicitly)\n    train_df[\"CryoSleep\"] = train_df[\"CryoSleep\"].fillna(\"Unknown\").astype(str)\n    train_df[\"VIP\"] = train_df[\"VIP\"].fillna(\"Unknown\").astype(str)\n    \n    # Build feature set: include both individual spending and aggregate spending\n    feature_cols = [\"Age\", \"AgeMissing\", \"TotalSpending\"] + SPENDING + CATEGORICAL + [\"Deck\", \"RoomNum\", \"Side\", \"GroupId\", \"GroupSize\"]\n    X = train_df[feature_cols]\n    y = train_df[\"Transported\"].astype(int)\n    \n    # Define preprocessing for numeric and categorical columns\n    numeric_transformer = Pipeline([\n        (\"imputer\", SimpleImputer(strategy=\"median\")),\n        (\"scaler\", StandardScaler()),\n    ])\n    \n    categorical_transformer = Pipeline([\n        (\"imputer\", SimpleImputer(strategy=\"most_frequent\")),\n        (\"onehot\", OneHotEncoder(handle_unknown=\"ignore\", sparse_output=False)),\n    ])\n    \n    preprocessor = ColumnTransformer([\n        (\"num\", numeric_transformer, [\"Age\", \"AgeMissing\", \"TotalSpending\", \"RoomNum\", \"GroupSize\"] + SPENDING),\n        (\"cat\", categorical_transformer, CATEGORICAL + [\"Deck\", \"Side\", \"GroupId\"]),\n    ])\n    \n    pipe = Pipeline([\n        (\"preprocessor\", preprocessor),\n        (\"clf\", LogisticRegression(max_iter=1000)),\n    ])\n    \n    pipe.fit(X, y)\n    \n    # Store group_sizes mapping for use in predict function\n    pipe.group_sizes = group_sizes\n    \n    def predict(X_val):\n        # Parse Cabin in validation set\n        cabin_data = X_val[\"Cabin\"].apply(parse_cabin)\n        X_val_copy = X_val.copy()\n        X_val_copy[\"Deck\"] = cabin_data.apply(lambda x: x[0])\n        X_val_copy[\"RoomNum\"] = cabin_data.apply(lambda x: x[1])\n        X_val_copy[\"Side\"] = cabin_data.apply(lambda x: x[2])\n        \n        # Extract group ID\n        X_val_copy[\"GroupId\"] = X_val_copy[\"PassengerId\"].apply(extract_group_id)\n        \n        # Compute group size using training set mapping (default to 1 for unseen groups)\n        X_val_copy[\"GroupSize\"] = X_val_copy[\"GroupId\"].map(pipe.group_sizes).fillna(1)\n        \n        # Flag: is Age missing?\n        X_val_copy[\"AgeMissing\"] = X_val_copy[\"Age\"].isna().astype(int)\n        \n        # Fill missing spending with 0\n        for col in SPENDING:\n            X_val_copy[col] = X_val_copy[col].fillna(0)\n        \n        # Compute total spending\n        X_val_copy[\"TotalSpending\"] = X_val_copy[SPENDING].sum(axis=1)\n        \n        # Handle CryoSleep and VIP\n        X_val_copy[\"CryoSleep\"] = X_val_copy[\"CryoSleep\"].fillna(\"Unknown\").astype(str)\n        X_val_copy[\"VIP\"] = X_val_copy[\"VIP\"].fillna(\"Unknown\").astype(str)\n        \n        return pipe.predict(X_val_copy[feature_cols]).astype(bool)\n    \n    return predict\n\n\nif __name__ == \"__main__\":\n    predict_fn = build_predict_fn()\n    score = prepare.evaluate(predict_fn)\n    print(f\"VAL_ACCURACY: {score:.4f}\")\n", "notes_append": "Iteration 8: Added binary AgeMissing flag (whether Age is NaN) to the iteration 5 pipeline, testing whether missingness is itself predictive. Simpler than recent feature engineering; if ineffective, will pivot to regularization or feature selection rather than continue feature addition.", "stdout": "VAL_ACCURACY: 0.7901\n", "stderr": "", "returncode": 0, "score": 0.7901, "kept": true, "status": "kept", "commit_hash": "c2c057f", "input_tokens": 3897, "output_tokens": 2338, "cost_usd": 0.015586999999999998}
