{"iteration": 3, "timestamp": "2026-05-08T21:19:03", "previous_best": 0.8143, "duration_seconds": 4.27, "agent_response_raw": "<reflection>\nThe last iteration (iter 31) removed GroupId and spending ratios and scored 0.8125, which is a regression from the best of 0.8143. This suggests that GroupId was helping despite being high-cardinality. We're oscillating around 0.8143 without making progress. The notes show we've tried cabin parsing, GroupId handling, spending features, and LightGBM all without sustained improvement. Let me read the data directly and look for structural patterns we may have missed.\n</reflection>\n\n<observations>\n- The best score (0.8143) was achieved with cabin parsing + GroupId + RoomNum + missingness flags + core features. Attempts to simplify (remove GroupId) or add complexity (spending ratios, group aggregates) have not beaten it.\n- We have not systematically analyzed correlations or distributions in the raw data. The hints mention that missing values may be predictive, some columns encode multiple pieces of information, and identifier columns can encode group structure. We should inspect these directly.\n- Previous iterations removed spending ratios because they may not help, but we filled spending with 0 when missing. This loss of information about whether a passenger spent at all is worth investigating more carefully.\n- We've been using XGBoost with fixed hyperparameters (n_estimators=100, max_depth=6, learning_rate=0.1) since iter 26. Small hyperparameter changes could be worth testing, but only after confirming the best-performing feature set again.\n- The current code is reasonably clean and runs well. The focus should be on feature engineering insights rather than model tweaking.\n</observations>\n\n<hypothesis>\nThe interaction between CryoSleep and spending behavior may be predictive: passengers in cryo-sleep may have zero spending by definition, and this coupling could be more informative than treating them independently. Testing whether explicitly capturing cryo-sleep status and its relationship to spending improves accuracy.\n</hypothesis>\n\n<plan>\nI will restore the best-performing feature set from iteration 26 (which scored 0.8143) and add a single new feature: CryoSleep_NoSpending (a flag for whether the passenger is in cryo-sleep AND has zero total spending). This tests whether the interaction is predictive without adding high-cardinality features. If this beats 0.8143, we have a new baseline; if not, we'll try a different structural insight from the data.\n</plan>\n\n<code>\n```python\n\"\"\"\ntrain.py — XGBoost with cabin parsing, GroupId, and cryo-sleep/spending interaction.\nIteration 32: Add CryoSleep_NoSpending interaction feature to test whether the coupling\nbetween cryo-sleep status and zero spending is predictive.\n\"\"\"\nimport sys, pathlib\nsys.path.insert(0, str(pathlib.Path(__file__).resolve().parent.parent))\n\nimport pandas as pd\nimport numpy as np\nimport xgboost as xgb\nfrom sklearn.impute import SimpleImputer\nfrom sklearn.pipeline import Pipeline\nfrom sklearn.preprocessing import StandardScaler, OneHotEncoder\nfrom sklearn.compose import ColumnTransformer\n\nimport prepare\n\nNUMERIC = [\"Age\", \"RoomService\", \"FoodCourt\", \"ShoppingMall\", \"Spa\", \"VRDeck\"]\nCATEGORICAL = [\"HomePlanet\", \"Destination\", \"CryoSleep\", \"VIP\"]\nSPENDING = [\"RoomService\", \"FoodCourt\", \"ShoppingMall\", \"Spa\", \"VRDeck\"]\n\n\ndef parse_cabin(cabin_str):\n    \"\"\"Parse Cabin 'F/0/S' into deck, room_num, side.\"\"\"\n    if pd.isna(cabin_str):\n        return np.nan, np.nan, np.nan\n    parts = str(cabin_str).split(\"/\")\n    if len(parts) == 3:\n        return parts[0], int(parts[1]) if parts[1].isdigit() else np.nan, parts[2]\n    return np.nan, np.nan, np.nan\n\n\ndef extract_group_id(passenger_id):\n    \"\"\"Extract group ID from PassengerId (e.g., '0001_01' -> '0001').\"\"\"\n    if pd.isna(passenger_id):\n        return np.nan\n    return str(passenger_id).split(\"_\")[0]\n\n\ndef engineer_features(df):\n    \"\"\"Engineer interaction and spending features.\"\"\"\n    df_copy = df.copy()\n    \n    # Fill missing spending with 0\n    for col in SPENDING:\n        df_copy[col] = df_copy[col].fillna(0)\n    \n    # Total spending\n    df_copy[\"TotalSpending\"] = df_copy[SPENDING].sum(axis=1)\n    \n    # Interaction: CryoSleep and zero spending\n    # If CryoSleep is missing, treat as False for this interaction\n    cryo_status = df_copy[\"CryoSleep\"].fillna(False)\n    df_copy[\"CryoSleep_NoSpending\"] = (\n        (cryo_status == True) & (df_copy[\"TotalSpending\"] == 0)\n    ).astype(int)\n    \n    return df_copy\n\n\ndef build_predict_fn():\n    train_df, _ = prepare.load_split()\n    \n    # Parse Cabin into Deck, RoomNum, Side\n    cabin_data = train_df[\"Cabin\"].apply(parse_cabin)\n    train_df[\"Deck\"] = cabin_data.apply(lambda x: x[0])\n    train_df[\"RoomNum\"] = cabin_data.apply(lambda x: x[1])\n    train_df[\"Side\"] = cabin_data.apply(lambda x: x[2])\n    \n    # Extract group ID from PassengerId\n    train_df[\"GroupId\"] = train_df[\"PassengerId\"].apply(extract_group_id)\n    \n    # Engineer features\n    train_df = engineer_features(train_df)\n    \n    # Create explicit missingness flags for CryoSleep and VIP before filling\n    train_df[\"CryoSleep_Missing\"] = train_df[\"CryoSleep\"].isna().astype(int)\n    train_df[\"VIP_Missing\"] = train_df[\"VIP\"].isna().astype(int)\n    \n    # Convert CryoSleep and VIP to string for categorical encoding\n    train_df[\"CryoSleep\"] = train_df[\"CryoSleep\"].fillna(\"Unknown\").astype(str)\n    train_df[\"VIP\"] = train_df[\"VIP\"].fillna(\"Unknown\").astype(str)\n    \n    # Build feature set\n    feature_cols = (\n        [\"Age\"] + SPENDING + [\"TotalSpending\", \"CryoSleep_NoSpending\"] +\n        CATEGORICAL + \n        [\"Deck\", \"RoomNum\", \"Side\", \"GroupId\"] + \n        [\"CryoSleep_Missing\", \"VIP_Missing\"]\n    )\n    X = train_df[feature_cols]\n    y = train_df[\"Transported\"].astype(int)\n    \n    # Define preprocessing for numeric and categorical columns\n    numeric_transformer = Pipeline([\n        (\"imputer\", SimpleImputer(strategy=\"median\")),\n        (\"scaler\", StandardScaler()),\n    ])\n    \n    categorical_transformer = Pipeline([\n        (\"imputer\", SimpleImputer(strategy=\"most_frequent\")),\n        (\"onehot\", OneHotEncoder(handle_unknown=\"ignore\", sparse_output=False)),\n    ])\n    \n    numeric_feature_cols = (\n        [\"Age\", \"RoomNum\", \"CryoSleep_Missing\", \"VIP_Missing\"] + \n        SPENDING + [\"TotalSpending\", \"CryoSleep_NoSpending\"]\n    )\n    categorical_feature_cols = CATEGORICAL + [\"Deck\", \"Side\", \"GroupId\"]\n    \n    preprocessor = ColumnTransformer([\n        (\"num\", numeric_transformer, numeric_feature_cols),\n        (\"cat\", categorical_transformer, categorical_feature_cols),\n    ])\n    \n    pipe = Pipeline([\n        (\"preprocessor\", preprocessor),\n        (\"clf\", xgb.XGBClassifier(n_estimators=100, max_depth=6, learning_rate=0.1, random_state=42, verbosity=0)),\n    ])\n    \n    pipe.fit(X, y)\n    \n    def predict(X_val):\n        # Parse Cabin in validation set\n        cabin_data = X_val[\"Cabin\"].apply(parse_cabin)\n        X_val_copy = X_val.copy()\n        X_val_copy[\"Deck\"] = cabin_data.apply(lambda x: x[0])\n        X_val_copy[\"RoomNum\"] = cabin_data.apply(lambda x: x[1])\n        X_val_copy[\"Side\"] = cabin_data.apply(lambda x: x[2])\n        \n        # Extract group ID\n        X_val_copy[\"GroupId\"] = X_val_copy[\"PassengerId\"].apply(extract_group_id)\n        \n        # Engineer features\n        X_val_copy = engineer_features(X_val_copy)\n        \n        # Create explicit missingness flags for CryoSleep and VIP before filling\n        X_val_copy[\"CryoSleep_Missing\"] = X_val_copy[\"CryoSleep\"].isna().astype(int)\n        X_val_copy[\"VIP_Missing\"] = X_val_copy[\"VIP\"].isna().astype(int)\n        \n        # Handle CryoSleep and VIP\n        X_val_copy[\"CryoSleep\"] = X_val_copy[\"CryoSleep\"].fillna(\"Unknown\").astype(str)\n        X_val_copy[\"VIP\"] = X_val_copy[\"VIP\"].fillna(\"Unknown\").astype(str)\n        \n        return pipe.predict(X_val_copy[feature_cols]).astype(bool)\n    \n    return predict\n\n\nif __name__ == \"__main__\":\n    predict_fn = build_predict_fn()\n    score = prepare.evaluate(predict_fn)\n    print(f\"VAL_ACCURACY: {score:.4f}\")\n```\n</code>\n\n<notes_append>\nIteration 32: Added CryoSleep_NoSpending interaction feature (binary flag for passengers in cryo-sleep with zero spending). Hypothesis: coupling between cryo status and spending may be predictive. Testing whether this single interaction feature improves upon 0.8143 baseline without adding high-cardinality features.\n</notes_append>", "reflection": "The last iteration (iter 31) removed GroupId and spending ratios and scored 0.8125, which is a regression from the best of 0.8143. This suggests that GroupId was helping despite being high-cardinality. We're oscillating around 0.8143 without making progress. The notes show we've tried cabin parsing, GroupId handling, spending features, and LightGBM all without sustained improvement. Let me read the data directly and look for structural patterns we may have missed.", "observations": ["The best score (0.8143) was achieved with cabin parsing + GroupId + RoomNum + missingness flags + core features. Attempts to simplify (remove GroupId) or add complexity (spending ratios, group aggregates) have not beaten it.", "We have not systematically analyzed correlations or distributions in the raw data. The hints mention that missing values may be predictive, some columns encode multiple pieces of information, and identifier columns can encode group structure. We should inspect these directly.", "Previous iterations removed spending ratios because they may not help, but we filled spending with 0 when missing. This loss of information about whether a passenger spent at all is worth investigating more carefully.", "We've been using XGBoost with fixed hyperparameters (n_estimators=100, max_depth=6, learning_rate=0.1) since iter 26. Small hyperparameter changes could be worth testing, but only after confirming the best-performing feature set again.", "The current code is reasonably clean and runs well. The focus should be on feature engineering insights rather than model tweaking."], "hypothesis": "The interaction between CryoSleep and spending behavior may be predictive: passengers in cryo-sleep may have zero spending by definition, and this coupling could be more informative than treating them independently. Testing whether explicitly capturing cryo-sleep status and its relationship to spending improves accuracy.", "plan": "I will restore the best-performing feature set from iteration 26 (which scored 0.8143) and add a single new feature: CryoSleep_NoSpending (a flag for whether the passenger is in cryo-sleep AND has zero total spending). This tests whether the interaction is predictive without adding high-cardinality features. If this beats 0.8143, we have a new baseline; if not, we'll try a different structural insight from the data.", "code": "\"\"\"\ntrain.py — XGBoost with cabin parsing, GroupId, and cryo-sleep/spending interaction.\nIteration 32: Add CryoSleep_NoSpending interaction feature to test whether the coupling\nbetween cryo-sleep status and zero spending is predictive.\n\"\"\"\nimport sys, pathlib\nsys.path.insert(0, str(pathlib.Path(__file__).resolve().parent.parent))\n\nimport pandas as pd\nimport numpy as np\nimport xgboost as xgb\nfrom sklearn.impute import SimpleImputer\nfrom sklearn.pipeline import Pipeline\nfrom sklearn.preprocessing import StandardScaler, OneHotEncoder\nfrom sklearn.compose import ColumnTransformer\n\nimport prepare\n\nNUMERIC = [\"Age\", \"RoomService\", \"FoodCourt\", \"ShoppingMall\", \"Spa\", \"VRDeck\"]\nCATEGORICAL = [\"HomePlanet\", \"Destination\", \"CryoSleep\", \"VIP\"]\nSPENDING = [\"RoomService\", \"FoodCourt\", \"ShoppingMall\", \"Spa\", \"VRDeck\"]\n\n\ndef parse_cabin(cabin_str):\n    \"\"\"Parse Cabin 'F/0/S' into deck, room_num, side.\"\"\"\n    if pd.isna(cabin_str):\n        return np.nan, np.nan, np.nan\n    parts = str(cabin_str).split(\"/\")\n    if len(parts) == 3:\n        return parts[0], int(parts[1]) if parts[1].isdigit() else np.nan, parts[2]\n    return np.nan, np.nan, np.nan\n\n\ndef extract_group_id(passenger_id):\n    \"\"\"Extract group ID from PassengerId (e.g., '0001_01' -> '0001').\"\"\"\n    if pd.isna(passenger_id):\n        return np.nan\n    return str(passenger_id).split(\"_\")[0]\n\n\ndef engineer_features(df):\n    \"\"\"Engineer interaction and spending features.\"\"\"\n    df_copy = df.copy()\n    \n    # Fill missing spending with 0\n    for col in SPENDING:\n        df_copy[col] = df_copy[col].fillna(0)\n    \n    # Total spending\n    df_copy[\"TotalSpending\"] = df_copy[SPENDING].sum(axis=1)\n    \n    # Interaction: CryoSleep and zero spending\n    # If CryoSleep is missing, treat as False for this interaction\n    cryo_status = df_copy[\"CryoSleep\"].fillna(False)\n    df_copy[\"CryoSleep_NoSpending\"] = (\n        (cryo_status == True) & (df_copy[\"TotalSpending\"] == 0)\n    ).astype(int)\n    \n    return df_copy\n\n\ndef build_predict_fn():\n    train_df, _ = prepare.load_split()\n    \n    # Parse Cabin into Deck, RoomNum, Side\n    cabin_data = train_df[\"Cabin\"].apply(parse_cabin)\n    train_df[\"Deck\"] = cabin_data.apply(lambda x: x[0])\n    train_df[\"RoomNum\"] = cabin_data.apply(lambda x: x[1])\n    train_df[\"Side\"] = cabin_data.apply(lambda x: x[2])\n    \n    # Extract group ID from PassengerId\n    train_df[\"GroupId\"] = train_df[\"PassengerId\"].apply(extract_group_id)\n    \n    # Engineer features\n    train_df = engineer_features(train_df)\n    \n    # Create explicit missingness flags for CryoSleep and VIP before filling\n    train_df[\"CryoSleep_Missing\"] = train_df[\"CryoSleep\"].isna().astype(int)\n    train_df[\"VIP_Missing\"] = train_df[\"VIP\"].isna().astype(int)\n    \n    # Convert CryoSleep and VIP to string for categorical encoding\n    train_df[\"CryoSleep\"] = train_df[\"CryoSleep\"].fillna(\"Unknown\").astype(str)\n    train_df[\"VIP\"] = train_df[\"VIP\"].fillna(\"Unknown\").astype(str)\n    \n    # Build feature set\n    feature_cols = (\n        [\"Age\"] + SPENDING + [\"TotalSpending\", \"CryoSleep_NoSpending\"] +\n        CATEGORICAL + \n        [\"Deck\", \"RoomNum\", \"Side\", \"GroupId\"] + \n        [\"CryoSleep_Missing\", \"VIP_Missing\"]\n    )\n    X = train_df[feature_cols]\n    y = train_df[\"Transported\"].astype(int)\n    \n    # Define preprocessing for numeric and categorical columns\n    numeric_transformer = Pipeline([\n        (\"imputer\", SimpleImputer(strategy=\"median\")),\n        (\"scaler\", StandardScaler()),\n    ])\n    \n    categorical_transformer = Pipeline([\n        (\"imputer\", SimpleImputer(strategy=\"most_frequent\")),\n        (\"onehot\", OneHotEncoder(handle_unknown=\"ignore\", sparse_output=False)),\n    ])\n    \n    numeric_feature_cols = (\n        [\"Age\", \"RoomNum\", \"CryoSleep_Missing\", \"VIP_Missing\"] + \n        SPENDING + [\"TotalSpending\", \"CryoSleep_NoSpending\"]\n    )\n    categorical_feature_cols = CATEGORICAL + [\"Deck\", \"Side\", \"GroupId\"]\n    \n    preprocessor = ColumnTransformer([\n        (\"num\", numeric_transformer, numeric_feature_cols),\n        (\"cat\", categorical_transformer, categorical_feature_cols),\n    ])\n    \n    pipe = Pipeline([\n        (\"preprocessor\", preprocessor),\n        (\"clf\", xgb.XGBClassifier(n_estimators=100, max_depth=6, learning_rate=0.1, random_state=42, verbosity=0)),\n    ])\n    \n    pipe.fit(X, y)\n    \n    def predict(X_val):\n        # Parse Cabin in validation set\n        cabin_data = X_val[\"Cabin\"].apply(parse_cabin)\n        X_val_copy = X_val.copy()\n        X_val_copy[\"Deck\"] = cabin_data.apply(lambda x: x[0])\n        X_val_copy[\"RoomNum\"] = cabin_data.apply(lambda x: x[1])\n        X_val_copy[\"Side\"] = cabin_data.apply(lambda x: x[2])\n        \n        # Extract group ID\n        X_val_copy[\"GroupId\"] = X_val_copy[\"PassengerId\"].apply(extract_group_id)\n        \n        # Engineer features\n        X_val_copy = engineer_features(X_val_copy)\n        \n        # Create explicit missingness flags for CryoSleep and VIP before filling\n        X_val_copy[\"CryoSleep_Missing\"] = X_val_copy[\"CryoSleep\"].isna().astype(int)\n        X_val_copy[\"VIP_Missing\"] = X_val_copy[\"VIP\"].isna().astype(int)\n        \n        # Handle CryoSleep and VIP\n        X_val_copy[\"CryoSleep\"] = X_val_copy[\"CryoSleep\"].fillna(\"Unknown\").astype(str)\n        X_val_copy[\"VIP\"] = X_val_copy[\"VIP\"].fillna(\"Unknown\").astype(str)\n        \n        return pipe.predict(X_val_copy[feature_cols]).astype(bool)\n    \n    return predict\n\n\nif __name__ == \"__main__\":\n    predict_fn = build_predict_fn()\n    score = prepare.evaluate(predict_fn)\n    print(f\"VAL_ACCURACY: {score:.4f}\")\n", "notes_append": "Iteration 32: Added CryoSleep_NoSpending interaction feature (binary flag for passengers in cryo-sleep with zero spending). Hypothesis: coupling between cryo status and spending may be predictive. Testing whether this single interaction feature improves upon 0.8143 baseline without adding high-cardinality features.", "stdout": "VAL_ACCURACY: 0.8189\n", "stderr": "", "returncode": 0, "score": 0.8189, "kept": true, "status": "kept", "commit_hash": "d759eef", "input_tokens": 4206, "output_tokens": 2537, "cost_usd": 0.016891000000000003}
