{"iteration": 4, "timestamp": "2026-05-08T21:17:21", "previous_best": 0.8143, "duration_seconds": 1.94, "agent_response_raw": "<reflection>\nIteration 27 (group-level aggregates) regressed to 0.8051 from the best of 0.8143. The notes indicate that feature engineering attempts (iter 15, 22, 23, 24, 25, 27) have all regressed or stalled. The best approach so far is the clean baseline from iter 0/2/26: cabin parsing + GroupId + RoomNum + missingness flags with XGBoost (n_estimators=100, max_depth=6, learning_rate=0.1). Before trying more complex feature engineering, I should examine whether the model architecture or hyperparameter tuning is the limiting factor. A different model class (LightGBM) or regularization approach might yield gains more cleanly than adding more engineered features.\n</reflection>\n\n<observations>\n- The best score (0.8143) was achieved with a straightforward feature set: Age, spending columns, core categoricals (HomePlanet, Destination, CryoSleep, VIP), Deck/RoomNum/Side from cabin parsing, GroupId, and missingness flags. No complex interactions or group aggregates helped.\n- Three consecutive feature engineering iterations (25, 26, 27) all either matched or beat the baseline, but only iteration 26 matched 0.8143; iteration 27's group aggregates actually regressed to 0.8051, suggesting multicollinearity or overfitting when GroupId is paired with GroupSize/GroupMeanSpending.\n- The notes show a pattern: hyperparameter tuning (iters 19–20) regressed, and feature engineering with interactions/aggregates (iters 22–27) regressed except for the near-duplicate of iter 0. This suggests the current XGBoost configuration is already near-optimal for the feature set, and marginal gains are unlikely from small tweaks.\n- LightGBM is available (per rules) and has different regularization mechanisms (leaf-wise growth, built-in categorical support, different default depth/learning rate). Switching model class is a structural change, not a minor variant.\n- The dataset is small (~8,700 rows) and the current best accuracy is 0.8143; jumping from 0.78 baseline to 0.81 suggests the features are already capturing most signal. A second model or ensemble might help, but a different single model (e.g., LightGBM) is simpler and worth testing first.\n</observations>\n\n<hypothesis>\nLightGBM with default settings will match or exceed XGBoost's 0.8143 accuracy on the same feature set because it uses leaf-wise growth and has built-in categorical support, which may reduce overfitting and handle high-cardinality features (like GroupId) more gracefully than XGBoost's depth-wise growth.\n</hypothesis>\n\n<plan>\nReplace XGBoost with LightGBM using the same feature engineering (cabin parsing, GroupId, RoomNum, missingness flags) but with LightGBM's native categorical handling. Use similar default hyperparameters (num_leaves=31, learning_rate=0.1, n_estimators=100) and enable categorical_feature support to avoid one-hot encoding overhead on high-cardinality GroupId.\n</plan>\n\n<code>\n```python\n\"\"\"\ntrain.py — LightGBM with cabin parsing, GroupId, and missingness flags.\nIteration 28: Test LightGBM as an alternative to XGBoost on the best-performing feature set.\nLightGBM's leaf-wise growth and native categorical support may improve signal on high-cardinality features like GroupId.\n\"\"\"\nimport sys, pathlib\nsys.path.insert(0, str(pathlib.Path(__file__).resolve().parent.parent))\n\nimport pandas as pd\nimport numpy as np\nimport lightgbm as lgb\nfrom sklearn.impute import SimpleImputer\nfrom sklearn.pipeline import Pipeline\nfrom sklearn.preprocessing import StandardScaler, LabelEncoder\n\nimport prepare\n\nNUMERIC = [\"Age\", \"RoomService\", \"FoodCourt\", \"ShoppingMall\", \"Spa\", \"VRDeck\"]\nCATEGORICAL = [\"HomePlanet\", \"Destination\", \"CryoSleep\", \"VIP\"]\nSPENDING = [\"RoomService\", \"FoodCourt\", \"ShoppingMall\", \"Spa\", \"VRDeck\"]\n\n\ndef parse_cabin(cabin_str):\n    \"\"\"Parse Cabin 'F/0/S' into deck, room_num, side.\"\"\"\n    if pd.isna(cabin_str):\n        return np.nan, np.nan, np.nan\n    parts = str(cabin_str).split(\"/\")\n    if len(parts) == 3:\n        return parts[0], int(parts[1]) if parts[1].isdigit() else np.nan, parts[2]\n    return np.nan, np.nan, np.nan\n\n\ndef extract_group_id(passenger_id):\n    \"\"\"Extract group ID from PassengerId (e.g., '0001_01' -> '0001').\"\"\"\n    if pd.isna(passenger_id):\n        return np.nan\n    return str(passenger_id).split(\"_\")[0]\n\n\ndef build_predict_fn():\n    train_df, _ = prepare.load_split()\n    \n    # Parse Cabin into Deck, RoomNum, Side\n    cabin_data = train_df[\"Cabin\"].apply(parse_cabin)\n    train_df[\"Deck\"] = cabin_data.apply(lambda x: x[0])\n    train_df[\"RoomNum\"] = cabin_data.apply(lambda x: x[1])\n    train_df[\"Side\"] = cabin_data.apply(lambda x: x[2])\n    \n    # Extract group ID from PassengerId\n    train_df[\"GroupId\"] = train_df[\"PassengerId\"].apply(extract_group_id)\n    \n    # Fill missing values in spending columns with 0\n    for col in SPENDING:\n        train_df[col] = train_df[col].fillna(0)\n    \n    # Create explicit missingness flags for CryoSleep and VIP before filling\n    train_df[\"CryoSleep_Missing\"] = train_df[\"CryoSleep\"].isna().astype(int)\n    train_df[\"VIP_Missing\"] = train_df[\"VIP\"].isna().astype(int)\n    \n    # Fill categorical missingness with \"Unknown\"\n    train_df[\"CryoSleep\"] = train_df[\"CryoSleep\"].fillna(\"Unknown\").astype(str)\n    train_df[\"VIP\"] = train_df[\"VIP\"].fillna(\"Unknown\").astype(str)\n    \n    # Build feature set\n    feature_cols = (\n        [\"Age\"] + SPENDING + CATEGORICAL + \n        [\"Deck\", \"RoomNum\", \"Side\", \"GroupId\"] + \n        [\"CryoSleep_Missing\", \"VIP_Missing\"]\n    )\n    X = train_df[feature_cols].copy()\n    y = train_df[\"Transported\"].astype(int)\n    \n    # Impute numeric columns\n    numeric_cols = [\"Age\", \"RoomNum\", \"CryoSleep_Missing\", \"VIP_Missing\"] + SPENDING\n    imputer = SimpleImputer(strategy=\"median\")\n    X[numeric_cols] = imputer.fit_transform(X[numeric_cols])\n    \n    # Standardize numeric columns\n    scaler = StandardScaler()\n    X[numeric_cols] = scaler.fit_transform(X[numeric_cols])\n    \n    # Impute categorical columns with most frequent\n    categorical_cols = CATEGORICAL + [\"Deck\", \"Side\", \"GroupId\"]\n    for col in categorical_cols:\n        X[col] = X[col].fillna(X[col].mode()[0] if not X[col].mode().empty else \"Unknown\")\n    \n    # Encode categorical columns (LightGBM will treat as categorical if specified)\n    label_encoders = {}\n    for col in categorical_cols:\n        le = LabelEncoder()\n        X[col] = le.fit_transform(X[col].astype(str))\n        label_encoders[col] = le\n    \n    # Train LightGBM with categorical features\n    train_data = lgb.Dataset(\n        X, label=y,\n        categorical_feature=categorical_cols,\n        free_raw_data=False\n    )\n    \n    params = {\n        \"objective\": \"binary\",\n        \"metric\": \"binary_logloss\",\n        \"num_leaves\": 31,\n        \"learning_rate\": 0.1,\n        \"verbosity\": -1,\n    }\n    \n    lgb_model = lgb.train(params, train_data, num_boost_round=100)\n    \n    def predict(X_val):\n        # Parse Cabin in validation set\n        cabin_data = X_val[\"Cabin\"].apply(parse_cabin)\n        X_val_copy = X_val.copy()\n        X_val_copy[\"Deck\"] = cabin_data.apply(lambda x: x[0])\n        X_val_copy[\"RoomNum\"] = cabin_data.apply(lambda x: x[1])\n        X_val_copy[\"Side\"] = cabin_data.apply(lambda x: x[2])\n        \n        # Extract group ID\n        X_val_copy[\"GroupId\"] = X_val_copy[\"PassengerId\"].apply(extract_group_id)\n        \n        # Fill missing spending with 0\n        for col in SPENDING:\n            X_val_copy[col] = X_val_copy[col].fillna(0)\n        \n        # Create explicit missingness flags\n        X_val_copy[\"CryoSleep_Missing\"] = X_val_copy[\"CryoSleep\"].isna().astype(int)\n        X_val_copy[\"VIP_Missing\"] = X_val_copy[\"VIP\"].isna().astype(int)\n        \n        # Handle CryoSleep and VIP\n        X_val_copy[\"CryoSleep\"] = X_val_copy[\"CryoSleep\"].fillna(\"Unknown\").astype(str)\n        X_val_copy[\"VIP\"] = X_val_copy[\"VIP\"].fillna(\"Unknown\").astype(str)\n        \n        X_val_proc = X_val_copy[feature_cols].copy()\n        \n        # Impute numeric columns\n        X_val_proc[numeric_cols] = imputer.transform(X_val_proc[numeric_cols])\n        \n        # Standardize numeric columns\n        X_val_proc[numeric_cols] = scaler.transform(X_val_proc[numeric_cols])\n        \n        # Fill missing categoricals\n        categorical_cols = CATEGORICAL + [\"Deck\", \"Side\", \"GroupId\"]\n        for col in categorical_cols:\n            X_val_proc[col] = X_val_proc[col].fillna(X_val_proc[col].mode()[0] if not X_val_proc[col].mode().empty else \"Unknown\")\n        \n        # Encode using same label encoders\n        for col in categorical_cols:\n            X_val_proc[col] = label_encoders[col].transform(X_val_proc[col].astype(str))\n        \n        # Predict\n        preds = lgb_model.predict(X_val_proc)\n        return (preds > 0.5).astype(bool)\n    \n    return predict\n\n\nif __name__ == \"__main__\":\n    predict_fn = build_predict_fn()\n    score = prepare.evaluate(predict_fn)\n    print(f\"VAL_ACCURACY: {score:.4f}\")\n```\n</code>\n\n<notes_append>\nIteration 28: Switched from XGBoost to LightGBM on the best-performing feature set (cabin parsing + GroupId + RoomNum + missingness flags). LightGBM's leaf-wise growth and native categorical support may handle high-cardinality GroupId more gracefully than XGBoost's depth-wise approach.\n</notes_append>", "reflection": "Iteration 27 (group-level aggregates) regressed to 0.8051 from the best of 0.8143. The notes indicate that feature engineering attempts (iter 15, 22, 23, 24, 25, 27) have all regressed or stalled. The best approach so far is the clean baseline from iter 0/2/26: cabin parsing + GroupId + RoomNum + missingness flags with XGBoost (n_estimators=100, max_depth=6, learning_rate=0.1). Before trying more complex feature engineering, I should examine whether the model architecture or hyperparameter tuning is the limiting factor. A different model class (LightGBM) or regularization approach might yield gains more cleanly than adding more engineered features.", "observations": ["The best score (0.8143) was achieved with a straightforward feature set: Age, spending columns, core categoricals (HomePlanet, Destination, CryoSleep, VIP), Deck/RoomNum/Side from cabin parsing, GroupId, and missingness flags. No complex interactions or group aggregates helped.", "Three consecutive feature engineering iterations (25, 26, 27) all either matched or beat the baseline, but only iteration 26 matched 0.8143; iteration 27's group aggregates actually regressed to 0.8051, suggesting multicollinearity or overfitting when GroupId is paired with GroupSize/GroupMeanSpending.", "The notes show a pattern: hyperparameter tuning (iters 19–20) regressed, and feature engineering with interactions/aggregates (iters 22–27) regressed except for the near-duplicate of iter 0. This suggests the current XGBoost configuration is already near-optimal for the feature set, and marginal gains are unlikely from small tweaks.", "LightGBM is available (per rules) and has different regularization mechanisms (leaf-wise growth, built-in categorical support, different default depth/learning rate). Switching model class is a structural change, not a minor variant.", "The dataset is small (~8,700 rows) and the current best accuracy is 0.8143; jumping from 0.78 baseline to 0.81 suggests the features are already capturing most signal. A second model or ensemble might help, but a different single model (e.g., LightGBM) is simpler and worth testing first."], "hypothesis": "LightGBM with default settings will match or exceed XGBoost's 0.8143 accuracy on the same feature set because it uses leaf-wise growth and has built-in categorical support, which may reduce overfitting and handle high-cardinality features (like GroupId) more gracefully than XGBoost's depth-wise growth.", "plan": "Replace XGBoost with LightGBM using the same feature engineering (cabin parsing, GroupId, RoomNum, missingness flags) but with LightGBM's native categorical handling. Use similar default hyperparameters (num_leaves=31, learning_rate=0.1, n_estimators=100) and enable categorical_feature support to avoid one-hot encoding overhead on high-cardinality GroupId.", "code": "\"\"\"\ntrain.py — LightGBM with cabin parsing, GroupId, and missingness flags.\nIteration 28: Test LightGBM as an alternative to XGBoost on the best-performing feature set.\nLightGBM's leaf-wise growth and native categorical support may improve signal on high-cardinality features like GroupId.\n\"\"\"\nimport sys, pathlib\nsys.path.insert(0, str(pathlib.Path(__file__).resolve().parent.parent))\n\nimport pandas as pd\nimport numpy as np\nimport lightgbm as lgb\nfrom sklearn.impute import SimpleImputer\nfrom sklearn.pipeline import Pipeline\nfrom sklearn.preprocessing import StandardScaler, LabelEncoder\n\nimport prepare\n\nNUMERIC = [\"Age\", \"RoomService\", \"FoodCourt\", \"ShoppingMall\", \"Spa\", \"VRDeck\"]\nCATEGORICAL = [\"HomePlanet\", \"Destination\", \"CryoSleep\", \"VIP\"]\nSPENDING = [\"RoomService\", \"FoodCourt\", \"ShoppingMall\", \"Spa\", \"VRDeck\"]\n\n\ndef parse_cabin(cabin_str):\n    \"\"\"Parse Cabin 'F/0/S' into deck, room_num, side.\"\"\"\n    if pd.isna(cabin_str):\n        return np.nan, np.nan, np.nan\n    parts = str(cabin_str).split(\"/\")\n    if len(parts) == 3:\n        return parts[0], int(parts[1]) if parts[1].isdigit() else np.nan, parts[2]\n    return np.nan, np.nan, np.nan\n\n\ndef extract_group_id(passenger_id):\n    \"\"\"Extract group ID from PassengerId (e.g., '0001_01' -> '0001').\"\"\"\n    if pd.isna(passenger_id):\n        return np.nan\n    return str(passenger_id).split(\"_\")[0]\n\n\ndef build_predict_fn():\n    train_df, _ = prepare.load_split()\n    \n    # Parse Cabin into Deck, RoomNum, Side\n    cabin_data = train_df[\"Cabin\"].apply(parse_cabin)\n    train_df[\"Deck\"] = cabin_data.apply(lambda x: x[0])\n    train_df[\"RoomNum\"] = cabin_data.apply(lambda x: x[1])\n    train_df[\"Side\"] = cabin_data.apply(lambda x: x[2])\n    \n    # Extract group ID from PassengerId\n    train_df[\"GroupId\"] = train_df[\"PassengerId\"].apply(extract_group_id)\n    \n    # Fill missing values in spending columns with 0\n    for col in SPENDING:\n        train_df[col] = train_df[col].fillna(0)\n    \n    # Create explicit missingness flags for CryoSleep and VIP before filling\n    train_df[\"CryoSleep_Missing\"] = train_df[\"CryoSleep\"].isna().astype(int)\n    train_df[\"VIP_Missing\"] = train_df[\"VIP\"].isna().astype(int)\n    \n    # Fill categorical missingness with \"Unknown\"\n    train_df[\"CryoSleep\"] = train_df[\"CryoSleep\"].fillna(\"Unknown\").astype(str)\n    train_df[\"VIP\"] = train_df[\"VIP\"].fillna(\"Unknown\").astype(str)\n    \n    # Build feature set\n    feature_cols = (\n        [\"Age\"] + SPENDING + CATEGORICAL + \n        [\"Deck\", \"RoomNum\", \"Side\", \"GroupId\"] + \n        [\"CryoSleep_Missing\", \"VIP_Missing\"]\n    )\n    X = train_df[feature_cols].copy()\n    y = train_df[\"Transported\"].astype(int)\n    \n    # Impute numeric columns\n    numeric_cols = [\"Age\", \"RoomNum\", \"CryoSleep_Missing\", \"VIP_Missing\"] + SPENDING\n    imputer = SimpleImputer(strategy=\"median\")\n    X[numeric_cols] = imputer.fit_transform(X[numeric_cols])\n    \n    # Standardize numeric columns\n    scaler = StandardScaler()\n    X[numeric_cols] = scaler.fit_transform(X[numeric_cols])\n    \n    # Impute categorical columns with most frequent\n    categorical_cols = CATEGORICAL + [\"Deck\", \"Side\", \"GroupId\"]\n    for col in categorical_cols:\n        X[col] = X[col].fillna(X[col].mode()[0] if not X[col].mode().empty else \"Unknown\")\n    \n    # Encode categorical columns (LightGBM will treat as categorical if specified)\n    label_encoders = {}\n    for col in categorical_cols:\n        le = LabelEncoder()\n        X[col] = le.fit_transform(X[col].astype(str))\n        label_encoders[col] = le\n    \n    # Train LightGBM with categorical features\n    train_data = lgb.Dataset(\n        X, label=y,\n        categorical_feature=categorical_cols,\n        free_raw_data=False\n    )\n    \n    params = {\n        \"objective\": \"binary\",\n        \"metric\": \"binary_logloss\",\n        \"num_leaves\": 31,\n        \"learning_rate\": 0.1,\n        \"verbosity\": -1,\n    }\n    \n    lgb_model = lgb.train(params, train_data, num_boost_round=100)\n    \n    def predict(X_val):\n        # Parse Cabin in validation set\n        cabin_data = X_val[\"Cabin\"].apply(parse_cabin)\n        X_val_copy = X_val.copy()\n        X_val_copy[\"Deck\"] = cabin_data.apply(lambda x: x[0])\n        X_val_copy[\"RoomNum\"] = cabin_data.apply(lambda x: x[1])\n        X_val_copy[\"Side\"] = cabin_data.apply(lambda x: x[2])\n        \n        # Extract group ID\n        X_val_copy[\"GroupId\"] = X_val_copy[\"PassengerId\"].apply(extract_group_id)\n        \n        # Fill missing spending with 0\n        for col in SPENDING:\n            X_val_copy[col] = X_val_copy[col].fillna(0)\n        \n        # Create explicit missingness flags\n        X_val_copy[\"CryoSleep_Missing\"] = X_val_copy[\"CryoSleep\"].isna().astype(int)\n        X_val_copy[\"VIP_Missing\"] = X_val_copy[\"VIP\"].isna().astype(int)\n        \n        # Handle CryoSleep and VIP\n        X_val_copy[\"CryoSleep\"] = X_val_copy[\"CryoSleep\"].fillna(\"Unknown\").astype(str)\n        X_val_copy[\"VIP\"] = X_val_copy[\"VIP\"].fillna(\"Unknown\").astype(str)\n        \n        X_val_proc = X_val_copy[feature_cols].copy()\n        \n        # Impute numeric columns\n        X_val_proc[numeric_cols] = imputer.transform(X_val_proc[numeric_cols])\n        \n        # Standardize numeric columns\n        X_val_proc[numeric_cols] = scaler.transform(X_val_proc[numeric_cols])\n        \n        # Fill missing categoricals\n        categorical_cols = CATEGORICAL + [\"Deck\", \"Side\", \"GroupId\"]\n        for col in categorical_cols:\n            X_val_proc[col] = X_val_proc[col].fillna(X_val_proc[col].mode()[0] if not X_val_proc[col].mode().empty else \"Unknown\")\n        \n        # Encode using same label encoders\n        for col in categorical_cols:\n            X_val_proc[col] = label_encoders[col].transform(X_val_proc[col].astype(str))\n        \n        # Predict\n        preds = lgb_model.predict(X_val_proc)\n        return (preds > 0.5).astype(bool)\n    \n    return predict\n\n\nif __name__ == \"__main__\":\n    predict_fn = build_predict_fn()\n    score = prepare.evaluate(predict_fn)\n    print(f\"VAL_ACCURACY: {score:.4f}\")\n", "notes_append": "Iteration 28: Switched from XGBoost to LightGBM on the best-performing feature set (cabin parsing + GroupId + RoomNum + missingness flags). LightGBM's leaf-wise growth and native categorical support may handle high-cardinality GroupId more gracefully than XGBoost's depth-wise approach.", "stdout": "", "stderr": "er\\Creating\\Blog\\spaceship-titanic-autoresearch\\.venv\\Lib\\site-packages\\sklearn\\utils\\_encode.py\", line 168, in _map_to_integer\n    return xp.asarray([table[v] for v in values], device=device(values))\n                       ~~~~~^^^\n  File \"C:\\Roger\\Creating\\Blog\\spaceship-titanic-autoresearch\\.venv\\Lib\\site-packages\\sklearn\\utils\\_encode.py\", line 161, in __missing__\n    raise KeyError(key)\nKeyError: '3857'\n\nDuring handling of the above exception, another exception occurred:\n\nTraceback (most recent call last):\n  File \"C:\\Roger\\Creating\\Blog\\spaceship-titanic-autoresearch\\workspace\\train.py\", line 160, in <module>\n    score = prepare.evaluate(predict_fn)\n  File \"C:\\Roger\\Creating\\Blog\\spaceship-titanic-autoresearch\\prepare.py\", line 35, in evaluate\n    y_pred = predict_fn(X_val)\n  File \"C:\\Roger\\Creating\\Blog\\spaceship-titanic-autoresearch\\workspace\\train.py\", line 149, in predict\n    X_val_proc[col] = label_encoders[col].transform(X_val_proc[col].astype(str))\n                      ~~~~~~~~~~~~~~~~~~~~~~~~~~~~~^^^^^^^^^^^^^^^^^^^^^^^^^^^^^\n  File \"C:\\Roger\\Creating\\Blog\\spaceship-titanic-autoresearch\\.venv\\Lib\\site-packages\\sklearn\\preprocessing\\_label.py\", line 144, in transform\n    return _encode(y, uniques=self.classes_)\n  File \"C:\\Roger\\Creating\\Blog\\spaceship-titanic-autoresearch\\.venv\\Lib\\site-packages\\sklearn\\utils\\_encode.py\", line 231, in _encode\n    raise ValueError(f\"y contains previously unseen labels: {e}\")\nValueError: y contains previously unseen labels: '3857'\n", "returncode": 1, "score": null, "kept": false, "status": "crashed", "commit_hash": null, "input_tokens": 3954, "output_tokens": 2902, "cost_usd": 0.018464}
