{"iteration": 4, "timestamp": "2026-05-08T20:33:54", "previous_best": 0.7901, "duration_seconds": 4.11, "agent_response_raw": "<reflection>\nIteration 4 crashed because the validation set contains unseen values in the GroupId column that weren't in the training set. Label encoding cannot handle unseen categorical values at prediction time. The previous best score was 0.7901 from iteration 2, which used one-hot encoding with `handle_unknown=\"ignore\"`, a more robust approach for this situation. I need to revert to a working strategy but preserve the useful feature engineering (Cabin parsing, GroupId extraction, spending-as-zero imputation).\n</reflection>\n\n<observations>\n- The GroupId feature introduces unseen categories in validation that break label encoding. One-hot encoding with `handle_unknown=\"ignore\"` handles this gracefully by setting unknown categories to all-zeros.\n- The crash happened at prediction time on the validation set, not training, which means the training pipeline was fine but the inference path wasn't robust.\n- Iteration 2's logistic regression with proper one-hot encoding achieved 0.7901, which is still our best score. This tells us the feature engineering (Cabin, GroupId) was sound, but the model choice in iter 4 was incompatible with the feature types.\n- Spending columns filled with 0 (indicating non-use) in iteration 2 already beat the baseline, so that design choice is good.\n- XGBoost needs a different encoding strategy; either use ordinal encoding with missing-as-special-value, or stick with the proven pipeline from iter 2.\n</observations>\n\n<hypothesis>\nReverting to logistic regression with one-hot encoding (which handles unseen categories) while keeping the feature engineering from iterations 2 and 3 (Cabin parsing, GroupId, spending-as-zero) will recover the 0.7901 score and avoid the KeyError. The issue is encoding strategy, not the model or features.\n</hypothesis>\n\n<plan>\nI will restore the logistic regression pipeline from iteration 2, but add the explicit zero-filling for spending columns from iteration 3 and the \"Unknown\" handling for CryoSleep/VIP. This is the safest path: keep the proven model and encoding, add only the feature improvements that don't break inference.\n</plan>\n\n<code>\n```python\n\"\"\"\ntrain.py — logistic regression with robust categorical encoding, cabin parsing, group ID, spending-as-zero.\n\"\"\"\nimport sys, pathlib\nsys.path.insert(0, str(pathlib.Path(__file__).resolve().parent.parent))\n\nimport pandas as pd\nimport numpy as np\nfrom sklearn.linear_model import LogisticRegression\nfrom sklearn.impute import SimpleImputer\nfrom sklearn.pipeline import Pipeline\nfrom sklearn.preprocessing import StandardScaler, OneHotEncoder\nfrom sklearn.compose import ColumnTransformer\n\nimport prepare\n\nNUMERIC = [\"Age\", \"RoomService\", \"FoodCourt\", \"ShoppingMall\", \"Spa\", \"VRDeck\"]\nCATEGORICAL = [\"HomePlanet\", \"Destination\", \"CryoSleep\", \"VIP\"]\nSPENDING = [\"RoomService\", \"FoodCourt\", \"ShoppingMall\", \"Spa\", \"VRDeck\"]\n\n\ndef parse_cabin(cabin_str):\n    \"\"\"Parse Cabin 'F/0/S' into deck, room_num, side.\"\"\"\n    if pd.isna(cabin_str):\n        return np.nan, np.nan, np.nan\n    parts = str(cabin_str).split(\"/\")\n    if len(parts) == 3:\n        return parts[0], int(parts[1]) if parts[1].isdigit() else np.nan, parts[2]\n    return np.nan, np.nan, np.nan\n\n\ndef extract_group_id(passenger_id):\n    \"\"\"Extract group ID from PassengerId (e.g., '0001_01' -> '0001').\"\"\"\n    if pd.isna(passenger_id):\n        return np.nan\n    return str(passenger_id).split(\"_\")[0]\n\n\ndef build_predict_fn():\n    train_df, _ = prepare.load_split()\n    \n    # Parse Cabin into Deck, RoomNum, Side\n    cabin_data = train_df[\"Cabin\"].apply(parse_cabin)\n    train_df[\"Deck\"] = cabin_data.apply(lambda x: x[0])\n    train_df[\"RoomNum\"] = cabin_data.apply(lambda x: x[1])\n    train_df[\"Side\"] = cabin_data.apply(lambda x: x[2])\n    \n    # Extract group ID from PassengerId\n    train_df[\"GroupId\"] = train_df[\"PassengerId\"].apply(extract_group_id)\n    \n    # Fill missing values in spending columns with 0 (indicates not spent)\n    for col in SPENDING:\n        train_df[col] = train_df[col].fillna(0)\n    \n    # Convert CryoSleep and VIP to numeric (handle NaN explicitly)\n    train_df[\"CryoSleep\"] = train_df[\"CryoSleep\"].fillna(\"Unknown\").astype(str)\n    train_df[\"VIP\"] = train_df[\"VIP\"].fillna(\"Unknown\").astype(str)\n    \n    # Build feature set\n    X = train_df[[\"Age\"] + SPENDING + CATEGORICAL + [\"Deck\", \"RoomNum\", \"Side\", \"GroupId\"]]\n    y = train_df[\"Transported\"].astype(int)\n    \n    # Define preprocessing for numeric and categorical columns\n    numeric_transformer = Pipeline([\n        (\"imputer\", SimpleImputer(strategy=\"median\")),\n        (\"scaler\", StandardScaler()),\n    ])\n    \n    categorical_transformer = Pipeline([\n        (\"imputer\", SimpleImputer(strategy=\"most_frequent\")),\n        (\"onehot\", OneHotEncoder(handle_unknown=\"ignore\", sparse_output=False)),\n    ])\n    \n    preprocessor = ColumnTransformer([\n        (\"num\", numeric_transformer, [\"Age\", \"RoomNum\"]),\n        (\"cat\", categorical_transformer, CATEGORICAL + [\"Deck\", \"Side\", \"GroupId\"]),\n        (\"spending\", numeric_transformer, SPENDING),\n    ])\n    \n    pipe = Pipeline([\n        (\"preprocessor\", preprocessor),\n        (\"clf\", LogisticRegression(max_iter=1000)),\n    ])\n    \n    pipe.fit(X, y)\n    \n    def predict(X_val):\n        # Parse Cabin in validation set\n        cabin_data = X_val[\"Cabin\"].apply(parse_cabin)\n        X_val_copy = X_val.copy()\n        X_val_copy[\"Deck\"] = cabin_data.apply(lambda x: x[0])\n        X_val_copy[\"RoomNum\"] = cabin_data.apply(lambda x: x[1])\n        X_val_copy[\"Side\"] = cabin_data.apply(lambda x: x[2])\n        \n        # Extract group ID\n        X_val_copy[\"GroupId\"] = X_val_copy[\"PassengerId\"].apply(extract_group_id)\n        \n        # Fill missing spending with 0\n        for col in SPENDING:\n            X_val_copy[col] = X_val_copy[col].fillna(0)\n        \n        # Handle CryoSleep and VIP\n        X_val_copy[\"CryoSleep\"] = X_val_copy[\"CryoSleep\"].fillna(\"Unknown\").astype(str)\n        X_val_copy[\"VIP\"] = X_val_copy[\"VIP\"].fillna(\"Unknown\").astype(str)\n        \n        return pipe.predict(X_val_copy[[\"Age\"] + SPENDING + CATEGORICAL + [\"Deck\", \"RoomNum\", \"Side\", \"GroupId\"]]).astype(bool)\n    \n    return predict\n\n\nif __name__ == \"__main__\":\n    predict_fn = build_predict_fn()\n    score = prepare.evaluate(predict_fn)\n    print(f\"VAL_ACCURACY: {score:.4f}\")\n```\n</code>\n\n<notes_append>\nIteration 5: Reverted to logistic regression with one-hot encoding from iter 2, keeping the feature engineering (Cabin parsing, GroupId, spending-as-zero, Unknown handling for NaN in booleans). XGBoost with label encoding crashed due to unseen GroupId values in validation; one-hot with handle_unknown=\"ignore\" is robust to this. Should recover 0.7901.\n</notes_append>", "reflection": "Iteration 4 crashed because the validation set contains unseen values in the GroupId column that weren't in the training set. Label encoding cannot handle unseen categorical values at prediction time. The previous best score was 0.7901 from iteration 2, which used one-hot encoding with `handle_unknown=\"ignore\"`, a more robust approach for this situation. I need to revert to a working strategy but preserve the useful feature engineering (Cabin parsing, GroupId extraction, spending-as-zero imputation).", "observations": ["The GroupId feature introduces unseen categories in validation that break label encoding. One-hot encoding with `handle_unknown=\"ignore\"` handles this gracefully by setting unknown categories to all-zeros.", "The crash happened at prediction time on the validation set, not training, which means the training pipeline was fine but the inference path wasn't robust.", "Iteration 2's logistic regression with proper one-hot encoding achieved 0.7901, which is still our best score. This tells us the feature engineering (Cabin, GroupId) was sound, but the model choice in iter 4 was incompatible with the feature types.", "Spending columns filled with 0 (indicating non-use) in iteration 2 already beat the baseline, so that design choice is good.", "XGBoost needs a different encoding strategy; either use ordinal encoding with missing-as-special-value, or stick with the proven pipeline from iter 2."], "hypothesis": "Reverting to logistic regression with one-hot encoding (which handles unseen categories) while keeping the feature engineering from iterations 2 and 3 (Cabin parsing, GroupId, spending-as-zero) will recover the 0.7901 score and avoid the KeyError. The issue is encoding strategy, not the model or features.", "plan": "I will restore the logistic regression pipeline from iteration 2, but add the explicit zero-filling for spending columns from iteration 3 and the \"Unknown\" handling for CryoSleep/VIP. This is the safest path: keep the proven model and encoding, add only the feature improvements that don't break inference.", "code": "\"\"\"\ntrain.py — logistic regression with robust categorical encoding, cabin parsing, group ID, spending-as-zero.\n\"\"\"\nimport sys, pathlib\nsys.path.insert(0, str(pathlib.Path(__file__).resolve().parent.parent))\n\nimport pandas as pd\nimport numpy as np\nfrom sklearn.linear_model import LogisticRegression\nfrom sklearn.impute import SimpleImputer\nfrom sklearn.pipeline import Pipeline\nfrom sklearn.preprocessing import StandardScaler, OneHotEncoder\nfrom sklearn.compose import ColumnTransformer\n\nimport prepare\n\nNUMERIC = [\"Age\", \"RoomService\", \"FoodCourt\", \"ShoppingMall\", \"Spa\", \"VRDeck\"]\nCATEGORICAL = [\"HomePlanet\", \"Destination\", \"CryoSleep\", \"VIP\"]\nSPENDING = [\"RoomService\", \"FoodCourt\", \"ShoppingMall\", \"Spa\", \"VRDeck\"]\n\n\ndef parse_cabin(cabin_str):\n    \"\"\"Parse Cabin 'F/0/S' into deck, room_num, side.\"\"\"\n    if pd.isna(cabin_str):\n        return np.nan, np.nan, np.nan\n    parts = str(cabin_str).split(\"/\")\n    if len(parts) == 3:\n        return parts[0], int(parts[1]) if parts[1].isdigit() else np.nan, parts[2]\n    return np.nan, np.nan, np.nan\n\n\ndef extract_group_id(passenger_id):\n    \"\"\"Extract group ID from PassengerId (e.g., '0001_01' -> '0001').\"\"\"\n    if pd.isna(passenger_id):\n        return np.nan\n    return str(passenger_id).split(\"_\")[0]\n\n\ndef build_predict_fn():\n    train_df, _ = prepare.load_split()\n    \n    # Parse Cabin into Deck, RoomNum, Side\n    cabin_data = train_df[\"Cabin\"].apply(parse_cabin)\n    train_df[\"Deck\"] = cabin_data.apply(lambda x: x[0])\n    train_df[\"RoomNum\"] = cabin_data.apply(lambda x: x[1])\n    train_df[\"Side\"] = cabin_data.apply(lambda x: x[2])\n    \n    # Extract group ID from PassengerId\n    train_df[\"GroupId\"] = train_df[\"PassengerId\"].apply(extract_group_id)\n    \n    # Fill missing values in spending columns with 0 (indicates not spent)\n    for col in SPENDING:\n        train_df[col] = train_df[col].fillna(0)\n    \n    # Convert CryoSleep and VIP to numeric (handle NaN explicitly)\n    train_df[\"CryoSleep\"] = train_df[\"CryoSleep\"].fillna(\"Unknown\").astype(str)\n    train_df[\"VIP\"] = train_df[\"VIP\"].fillna(\"Unknown\").astype(str)\n    \n    # Build feature set\n    X = train_df[[\"Age\"] + SPENDING + CATEGORICAL + [\"Deck\", \"RoomNum\", \"Side\", \"GroupId\"]]\n    y = train_df[\"Transported\"].astype(int)\n    \n    # Define preprocessing for numeric and categorical columns\n    numeric_transformer = Pipeline([\n        (\"imputer\", SimpleImputer(strategy=\"median\")),\n        (\"scaler\", StandardScaler()),\n    ])\n    \n    categorical_transformer = Pipeline([\n        (\"imputer\", SimpleImputer(strategy=\"most_frequent\")),\n        (\"onehot\", OneHotEncoder(handle_unknown=\"ignore\", sparse_output=False)),\n    ])\n    \n    preprocessor = ColumnTransformer([\n        (\"num\", numeric_transformer, [\"Age\", \"RoomNum\"]),\n        (\"cat\", categorical_transformer, CATEGORICAL + [\"Deck\", \"Side\", \"GroupId\"]),\n        (\"spending\", numeric_transformer, SPENDING),\n    ])\n    \n    pipe = Pipeline([\n        (\"preprocessor\", preprocessor),\n        (\"clf\", LogisticRegression(max_iter=1000)),\n    ])\n    \n    pipe.fit(X, y)\n    \n    def predict(X_val):\n        # Parse Cabin in validation set\n        cabin_data = X_val[\"Cabin\"].apply(parse_cabin)\n        X_val_copy = X_val.copy()\n        X_val_copy[\"Deck\"] = cabin_data.apply(lambda x: x[0])\n        X_val_copy[\"RoomNum\"] = cabin_data.apply(lambda x: x[1])\n        X_val_copy[\"Side\"] = cabin_data.apply(lambda x: x[2])\n        \n        # Extract group ID\n        X_val_copy[\"GroupId\"] = X_val_copy[\"PassengerId\"].apply(extract_group_id)\n        \n        # Fill missing spending with 0\n        for col in SPENDING:\n            X_val_copy[col] = X_val_copy[col].fillna(0)\n        \n        # Handle CryoSleep and VIP\n        X_val_copy[\"CryoSleep\"] = X_val_copy[\"CryoSleep\"].fillna(\"Unknown\").astype(str)\n        X_val_copy[\"VIP\"] = X_val_copy[\"VIP\"].fillna(\"Unknown\").astype(str)\n        \n        return pipe.predict(X_val_copy[[\"Age\"] + SPENDING + CATEGORICAL + [\"Deck\", \"RoomNum\", \"Side\", \"GroupId\"]]).astype(bool)\n    \n    return predict\n\n\nif __name__ == \"__main__\":\n    predict_fn = build_predict_fn()\n    score = prepare.evaluate(predict_fn)\n    print(f\"VAL_ACCURACY: {score:.4f}\")\n", "notes_append": "Iteration 5: Reverted to logistic regression with one-hot encoding from iter 2, keeping the feature engineering (Cabin parsing, GroupId, spending-as-zero, Unknown handling for NaN in booleans). XGBoost with label encoding crashed due to unseen GroupId values in validation; one-hot with handle_unknown=\"ignore\" is robust to this. Should recover 0.7901.", "stdout": "VAL_ACCURACY: 0.7901\n", "stderr": "", "returncode": 0, "score": 0.7901, "kept": true, "status": "kept", "commit_hash": "ad4971d", "input_tokens": 3899, "output_tokens": 2009, "cost_usd": 0.013944}
