{"iteration": 2, "timestamp": "2026-05-08T22:38:17", "previous_best": 0.8235, "duration_seconds": 3.38, "agent_response_raw": "<reflection>\nThe diagnostic from iteration 89 shows that despite having 5263 total features (mostly from one-hot encoding), only 33 have non-zero importance. The top 15 features account for most signal: TotalSpending, HomePlanet variants, CryoSleep, Deck variants, individual spending columns, and Side. This suggests we can safely drop hundreds of low-signal categorical combinations and likely improve generalization. The current score of 0.8235 is stable; aggressive feature pruning based on importance thresholds should reveal whether dead features are hurting validation accuracy.\n</reflection>\n\n<observations>\n- Only 33 of 5263 features have non-zero XGBoost importance; the remaining 5230 are pure noise that the model learns to ignore during training but may overfit on in validation.\n- The top 15 features are all fundamental: total/category spending, home planet, cryo status, deck, and side. Engineered features like GroupSize, GroupMedianSpending, CryoSleep_LogSpending, and Age-based interactions don't appear in the top 15, suggesting they add little signal.\n- PassengerId and GroupId are likely creating thousands of one-hot dummies with near-zero importance. Dropping these ID columns entirely will slash feature count and may reduce overfitting.\n- The one-hot encoding of Deck, Side, HomePlanet, Destination, and CryoSleep (as string) creates many combinations; many are rare or redundant.\n- Feature count explosion (5263) on a training set of ~8,700 rows risks overfitting; fewer, higher-signal features should generalize better on the held-out validation set.\n</observations>\n\n<hypothesis>\nRemoving low-importance feature sources (PassengerId, GroupId, and dropping low-variance categorical combinations) will reduce feature count from 5263 to <100, eliminate noise, and improve validation accuracy above 0.8235 because the model will generalize better without spurious patterns from rare categorical levels.\n</hypothesis>\n\n<plan>\nI will remove PassengerId and GroupId from the feature set entirely (they are pure ID columns that create thousands of meaningless one-hot dummies). I will also drop the engineered group-level features (GroupSize, GroupMedianSpending) and Age polynomial interactions since they do not appear in the top 15 importances. This will shrink the feature space dramatically while keeping the proven high-signal features: spending columns, TotalSpending, missingness flags, Cabin parsing (Deck, RoomNum, Side), and core categoricals (HomePlanet, Destination, CryoSleep, VIP).\n</plan>\n\n<code>\n```python\n\"\"\"\ntrain.py — Iteration 90: Remove low-signal features (ID-based, group-level, age polynomials).\nKeep only high-importance features: spending, cabin parsing, core categoricals, missingness flags.\n\"\"\"\nimport sys, pathlib\nsys.path.insert(0, str(pathlib.Path(__file__).resolve().parent.parent))\n\nimport pandas as pd\nimport numpy as np\nimport xgboost as xgb\nfrom sklearn.impute import SimpleImputer\nfrom sklearn.pipeline import Pipeline\nfrom sklearn.preprocessing import StandardScaler, OneHotEncoder\nfrom sklearn.compose import ColumnTransformer\n\nimport prepare\n\nSPENDING = [\"RoomService\", \"FoodCourt\", \"ShoppingMall\", \"Spa\", \"VRDeck\"]\n\n\ndef parse_cabin(cabin_str):\n    \"\"\"Parse Cabin 'F/0/S' into deck, room_num, side.\"\"\"\n    if pd.isna(cabin_str):\n        return np.nan, np.nan, np.nan\n    parts = str(cabin_str).split(\"/\")\n    if len(parts) == 3:\n        return parts[0], int(parts[1]) if parts[1].isdigit() else np.nan, parts[2]\n    return np.nan, np.nan, np.nan\n\n\ndef engineer_features(df):\n    \"\"\"Engineer spending and missingness features. Drop low-signal interactions.\"\"\"\n    df_copy = df.copy()\n    \n    # Track which rows have any spending data recorded\n    spending_recorded = ~df_copy[SPENDING].isna().any(axis=1)\n    df_copy[\"Spending_Recorded\"] = spending_recorded.astype(int)\n    \n    # Fill missing spending with median per HomePlanet group\n    for col in SPENDING:\n        missing_mask = df_copy[col].isna()\n        if missing_mask.any():\n            group_medians = df_copy.groupby(\"HomePlanet\")[col].median()\n            df_copy.loc[missing_mask, col] = df_copy.loc[missing_mask, \"HomePlanet\"].map(group_medians)\n            global_median = df_copy[col].median()\n            df_copy[col] = df_copy[col].fillna(global_median)\n    \n    # Total spending\n    df_copy[\"TotalSpending\"] = df_copy[SPENDING].sum(axis=1)\n    \n    return df_copy\n\n\ndef build_predict_fn():\n    train_df, _ = prepare.load_split()\n    \n    # Parse Cabin into Deck, RoomNum, Side\n    cabin_data = train_df[\"Cabin\"].apply(parse_cabin)\n    train_df[\"Deck\"] = cabin_data.apply(lambda x: x[0])\n    train_df[\"RoomNum\"] = cabin_data.apply(lambda x: x[1])\n    train_df[\"Side\"] = cabin_data.apply(lambda x: x[2])\n    \n    # Engineer features\n    train_df = engineer_features(train_df)\n    \n    # Create explicit missingness flags for CryoSleep and VIP\n    train_df[\"CryoSleep_Missing\"] = train_df[\"CryoSleep\"].isna().astype(int)\n    train_df[\"VIP_Missing\"] = train_df[\"VIP\"].isna().astype(int)\n    \n    # Convert CryoSleep and VIP to string for categorical encoding\n    train_df[\"CryoSleep\"] = train_df[\"CryoSleep\"].fillna(\"Unknown\").astype(str)\n    train_df[\"VIP\"] = train_df[\"VIP\"].fillna(\"Unknown\").astype(str)\n    \n    # Build feature set: only high-signal features\n    feature_cols = (\n        [\"Age\"] + SPENDING + [\"TotalSpending\", \"Spending_Recorded\"] +\n        [\"HomePlanet\", \"Destination\", \"CryoSleep\", \"VIP\"] + \n        [\"Deck\", \"RoomNum\", \"Side\"] + \n        [\"CryoSleep_Missing\", \"VIP_Missing\"]\n    )\n    X = train_df[feature_cols]\n    y = train_df[\"Transported\"].astype(int)\n    \n    # Define preprocessing\n    numeric_transformer = Pipeline([\n        (\"imputer\", SimpleImputer(strategy=\"median\")),\n        (\"scaler\", StandardScaler()),\n    ])\n    \n    categorical_transformer = Pipeline([\n        (\"imputer\", SimpleImputer(strategy=\"most_frequent\")),\n        (\"onehot\", OneHotEncoder(handle_unknown=\"ignore\", sparse_output=False)),\n    ])\n    \n    numeric_feature_cols = (\n        [\"Age\", \"RoomNum\", \"CryoSleep_Missing\", \"VIP_Missing\", \"Spending_Recorded\"] + \n        SPENDING + [\"TotalSpending\"]\n    )\n    categorical_feature_cols = [\"HomePlanet\", \"Destination\", \"CryoSleep\", \"VIP\", \"Deck\", \"Side\"]\n    \n    preprocessor = ColumnTransformer([\n        (\"num\", numeric_transformer, numeric_feature_cols),\n        (\"cat\", categorical_transformer, categorical_feature_cols),\n    ])\n    \n    # XGBoost\n    pipe = Pipeline([\n        (\"preprocessor\", preprocessor),\n        (\"clf\", xgb.XGBClassifier(max_depth=6, n_estimators=100, learning_rate=0.1, random_state=42, verbosity=0)),\n    ])\n    \n    pipe.fit(X, y)\n    \n    def predict(X_val):\n        cabin_data = X_val[\"Cabin\"].apply(parse_cabin)\n        X_val_copy = X_val.copy()\n        X_val_copy[\"Deck\"] = cabin_data.apply(lambda x: x[0])\n        X_val_copy[\"RoomNum\"] = cabin_data.apply(lambda x: x[1])\n        X_val_copy[\"Side\"] = cabin_data.apply(lambda x: x[2])\n        \n        # Engineer features\n        X_val_copy = engineer_features(X_val_copy)\n        \n        # Missingness flags\n        X_val_copy[\"CryoSleep_Missing\"] = X_val_copy[\"CryoSleep\"].isna().astype(int)\n        X_val_copy[\"VIP_Missing\"] = X_val_copy[\"VIP\"].isna().astype(int)\n        \n        # Handle CryoSleep and VIP\n        X_val_copy[\"CryoSleep\"] = X_val_copy[\"CryoSleep\"].fillna(\"Unknown\").astype(str)\n        X_val_copy[\"VIP\"] = X_val_copy[\"VIP\"].fillna(\"Unknown\").astype(str)\n        \n        return pipe.predict(X_val_copy[feature_cols]).astype(bool)\n    \n    return predict\n\n\nif __name__ == \"__main__\":\n    predict_fn = build_predict_fn()\n    score = prepare.evaluate(predict_fn)\n    print(f\"VAL_ACCURACY: {score:.4f}\")\n```\n</code>\n\n<notes_append>\nIteration 90: Removed PassengerId, GroupId, GroupSize, GroupMedianSpending, CryoSleep_LogSpending, Age_Squared, Age_LogSpending, Age_CryoSleep, Deck_TotalSpending. Keeping only high-signal features: spending columns, TotalSpending, Spending_Recorded, missingness flags, Cabin parsing (Deck/RoomNum/Side), core categoricals (HomePlanet/Destination/CryoSleep/VIP). Feature count drops from 5263 to ~30 numeric + categorical levels. Hypothesis: reducing overfitting from ID-based one-hot dummies will improve validation accuracy.\n</notes_append>", "reflection": "The diagnostic from iteration 89 shows that despite having 5263 total features (mostly from one-hot encoding), only 33 have non-zero importance. The top 15 features account for most signal: TotalSpending, HomePlanet variants, CryoSleep, Deck variants, individual spending columns, and Side. This suggests we can safely drop hundreds of low-signal categorical combinations and likely improve generalization. The current score of 0.8235 is stable; aggressive feature pruning based on importance thresholds should reveal whether dead features are hurting validation accuracy.", "observations": ["Only 33 of 5263 features have non-zero XGBoost importance; the remaining 5230 are pure noise that the model learns to ignore during training but may overfit on in validation.", "The top 15 features are all fundamental: total/category spending, home planet, cryo status, deck, and side. Engineered features like GroupSize, GroupMedianSpending, CryoSleep_LogSpending, and Age-based interactions don't appear in the top 15, suggesting they add little signal.", "PassengerId and GroupId are likely creating thousands of one-hot dummies with near-zero importance. Dropping these ID columns entirely will slash feature count and may reduce overfitting.", "The one-hot encoding of Deck, Side, HomePlanet, Destination, and CryoSleep (as string) creates many combinations; many are rare or redundant.", "Feature count explosion (5263) on a training set of ~8,700 rows risks overfitting; fewer, higher-signal features should generalize better on the held-out validation set."], "hypothesis": "Removing low-importance feature sources (PassengerId, GroupId, and dropping low-variance categorical combinations) will reduce feature count from 5263 to <100, eliminate noise, and improve validation accuracy above 0.8235 because the model will generalize better without spurious patterns from rare categorical levels.", "plan": "I will remove PassengerId and GroupId from the feature set entirely (they are pure ID columns that create thousands of meaningless one-hot dummies). I will also drop the engineered group-level features (GroupSize, GroupMedianSpending) and Age polynomial interactions since they do not appear in the top 15 importances. This will shrink the feature space dramatically while keeping the proven high-signal features: spending columns, TotalSpending, missingness flags, Cabin parsing (Deck, RoomNum, Side), and core categoricals (HomePlanet, Destination, CryoSleep, VIP).", "code": "\"\"\"\ntrain.py — Iteration 90: Remove low-signal features (ID-based, group-level, age polynomials).\nKeep only high-importance features: spending, cabin parsing, core categoricals, missingness flags.\n\"\"\"\nimport sys, pathlib\nsys.path.insert(0, str(pathlib.Path(__file__).resolve().parent.parent))\n\nimport pandas as pd\nimport numpy as np\nimport xgboost as xgb\nfrom sklearn.impute import SimpleImputer\nfrom sklearn.pipeline import Pipeline\nfrom sklearn.preprocessing import StandardScaler, OneHotEncoder\nfrom sklearn.compose import ColumnTransformer\n\nimport prepare\n\nSPENDING = [\"RoomService\", \"FoodCourt\", \"ShoppingMall\", \"Spa\", \"VRDeck\"]\n\n\ndef parse_cabin(cabin_str):\n    \"\"\"Parse Cabin 'F/0/S' into deck, room_num, side.\"\"\"\n    if pd.isna(cabin_str):\n        return np.nan, np.nan, np.nan\n    parts = str(cabin_str).split(\"/\")\n    if len(parts) == 3:\n        return parts[0], int(parts[1]) if parts[1].isdigit() else np.nan, parts[2]\n    return np.nan, np.nan, np.nan\n\n\ndef engineer_features(df):\n    \"\"\"Engineer spending and missingness features. Drop low-signal interactions.\"\"\"\n    df_copy = df.copy()\n    \n    # Track which rows have any spending data recorded\n    spending_recorded = ~df_copy[SPENDING].isna().any(axis=1)\n    df_copy[\"Spending_Recorded\"] = spending_recorded.astype(int)\n    \n    # Fill missing spending with median per HomePlanet group\n    for col in SPENDING:\n        missing_mask = df_copy[col].isna()\n        if missing_mask.any():\n            group_medians = df_copy.groupby(\"HomePlanet\")[col].median()\n            df_copy.loc[missing_mask, col] = df_copy.loc[missing_mask, \"HomePlanet\"].map(group_medians)\n            global_median = df_copy[col].median()\n            df_copy[col] = df_copy[col].fillna(global_median)\n    \n    # Total spending\n    df_copy[\"TotalSpending\"] = df_copy[SPENDING].sum(axis=1)\n    \n    return df_copy\n\n\ndef build_predict_fn():\n    train_df, _ = prepare.load_split()\n    \n    # Parse Cabin into Deck, RoomNum, Side\n    cabin_data = train_df[\"Cabin\"].apply(parse_cabin)\n    train_df[\"Deck\"] = cabin_data.apply(lambda x: x[0])\n    train_df[\"RoomNum\"] = cabin_data.apply(lambda x: x[1])\n    train_df[\"Side\"] = cabin_data.apply(lambda x: x[2])\n    \n    # Engineer features\n    train_df = engineer_features(train_df)\n    \n    # Create explicit missingness flags for CryoSleep and VIP\n    train_df[\"CryoSleep_Missing\"] = train_df[\"CryoSleep\"].isna().astype(int)\n    train_df[\"VIP_Missing\"] = train_df[\"VIP\"].isna().astype(int)\n    \n    # Convert CryoSleep and VIP to string for categorical encoding\n    train_df[\"CryoSleep\"] = train_df[\"CryoSleep\"].fillna(\"Unknown\").astype(str)\n    train_df[\"VIP\"] = train_df[\"VIP\"].fillna(\"Unknown\").astype(str)\n    \n    # Build feature set: only high-signal features\n    feature_cols = (\n        [\"Age\"] + SPENDING + [\"TotalSpending\", \"Spending_Recorded\"] +\n        [\"HomePlanet\", \"Destination\", \"CryoSleep\", \"VIP\"] + \n        [\"Deck\", \"RoomNum\", \"Side\"] + \n        [\"CryoSleep_Missing\", \"VIP_Missing\"]\n    )\n    X = train_df[feature_cols]\n    y = train_df[\"Transported\"].astype(int)\n    \n    # Define preprocessing\n    numeric_transformer = Pipeline([\n        (\"imputer\", SimpleImputer(strategy=\"median\")),\n        (\"scaler\", StandardScaler()),\n    ])\n    \n    categorical_transformer = Pipeline([\n        (\"imputer\", SimpleImputer(strategy=\"most_frequent\")),\n        (\"onehot\", OneHotEncoder(handle_unknown=\"ignore\", sparse_output=False)),\n    ])\n    \n    numeric_feature_cols = (\n        [\"Age\", \"RoomNum\", \"CryoSleep_Missing\", \"VIP_Missing\", \"Spending_Recorded\"] + \n        SPENDING + [\"TotalSpending\"]\n    )\n    categorical_feature_cols = [\"HomePlanet\", \"Destination\", \"CryoSleep\", \"VIP\", \"Deck\", \"Side\"]\n    \n    preprocessor = ColumnTransformer([\n        (\"num\", numeric_transformer, numeric_feature_cols),\n        (\"cat\", categorical_transformer, categorical_feature_cols),\n    ])\n    \n    # XGBoost\n    pipe = Pipeline([\n        (\"preprocessor\", preprocessor),\n        (\"clf\", xgb.XGBClassifier(max_depth=6, n_estimators=100, learning_rate=0.1, random_state=42, verbosity=0)),\n    ])\n    \n    pipe.fit(X, y)\n    \n    def predict(X_val):\n        cabin_data = X_val[\"Cabin\"].apply(parse_cabin)\n        X_val_copy = X_val.copy()\n        X_val_copy[\"Deck\"] = cabin_data.apply(lambda x: x[0])\n        X_val_copy[\"RoomNum\"] = cabin_data.apply(lambda x: x[1])\n        X_val_copy[\"Side\"] = cabin_data.apply(lambda x: x[2])\n        \n        # Engineer features\n        X_val_copy = engineer_features(X_val_copy)\n        \n        # Missingness flags\n        X_val_copy[\"CryoSleep_Missing\"] = X_val_copy[\"CryoSleep\"].isna().astype(int)\n        X_val_copy[\"VIP_Missing\"] = X_val_copy[\"VIP\"].isna().astype(int)\n        \n        # Handle CryoSleep and VIP\n        X_val_copy[\"CryoSleep\"] = X_val_copy[\"CryoSleep\"].fillna(\"Unknown\").astype(str)\n        X_val_copy[\"VIP\"] = X_val_copy[\"VIP\"].fillna(\"Unknown\").astype(str)\n        \n        return pipe.predict(X_val_copy[feature_cols]).astype(bool)\n    \n    return predict\n\n\nif __name__ == \"__main__\":\n    predict_fn = build_predict_fn()\n    score = prepare.evaluate(predict_fn)\n    print(f\"VAL_ACCURACY: {score:.4f}\")\n", "notes_append": "Iteration 90: Removed PassengerId, GroupId, GroupSize, GroupMedianSpending, CryoSleep_LogSpending, Age_Squared, Age_LogSpending, Age_CryoSleep, Deck_TotalSpending. Keeping only high-signal features: spending columns, TotalSpending, Spending_Recorded, missingness flags, Cabin parsing (Deck/RoomNum/Side), core categoricals (HomePlanet/Destination/CryoSleep/VIP). Feature count drops from 5263 to ~30 numeric + categorical levels. Hypothesis: reducing overfitting from ID-based one-hot dummies will improve validation accuracy.", "stdout": "VAL_ACCURACY: 0.8183\n", "stderr": "", "returncode": 0, "score": 0.8183, "kept": false, "status": "reverted", "commit_hash": null, "input_tokens": 5256, "output_tokens": 2532, "cost_usd": 0.017916}
