{"iteration": 6, "timestamp": "2026-05-08T21:14:31", "previous_best": 0.8143, "duration_seconds": 3.81, "agent_response_raw": "<reflection>\nThe current best score is 0.8143 (iteration 2), which we've held steady for multiple iterations. Iterations 3–22 have involved various attempts at feature engineering and hyperparameter tuning (HighSpender, GroupSize, TotalSpending, etc.) but none have improved beyond 0.8143. The recent notes show that iterations 19–20 (hyperparameter tweaking) regressed, and iteration 21 confirmed that reverting to iteration 2's hyperparameters reproduces 0.8143. The HighSpender feature (iteration 22) held at 0.8143 but didn't improve it. The pattern suggests we're near a local ceiling with the current feature set and model class. I should examine the data more carefully to identify fundamentally new signal rather than iterating on spending-based features.\n</reflection>\n\n<observations>\n- The best score of 0.8143 has been stable across multiple feature iterations (iter 2, 21, 22), suggesting the current feature set captures most of the accessible low-hanging fruit. Hyperparameter tweaking has not helped.\n- Notes indicate that aggregate spending features (TotalSpending, HasSpent, GroupSize) introduced noise in earlier iterations, yet simpler spending indicators (HighSpender) also plateau. This suggests spending columns alone may not be the limiting factor.\n- The hints mention that identifier columns (PassengerId, GroupId) encode group structure; we've added GroupId but may not be fully exploiting the transport-group relationship. GroupSize was tried but reverted—perhaps a different group-level feature (e.g., group homogeneity, group-level missingness patterns) could be more informative.\n- Missing values in CryoSleep and VIP are currently flagged, but we're not exploring whether the missing-ness pattern interacts with group structure (e.g., are entire groups missing the same values?).\n- The cabin features (Deck, Side) are parsed but not combined in any way; the deck/side pair might have interaction patterns worth exploring (e.g., certain decks are more dangerous/safe on one side than the other).\n</observations>\n\n<hypothesis>\nDeck and Side interact non-linearly in predicting transport: certain deck-side combinations have higher transport rates. Creating an explicit Deck-Side interaction feature will capture this structure better than treating them separately, yielding a modest improvement over 0.8143.\n</hypothesis>\n\n<plan>\nI will create an explicit Deck-Side interaction feature by concatenating Deck and Side into a new categorical feature (e.g., \"F-S\", \"G-P\", etc.). This avoids adding numeric features and lets the OneHotEncoder handle the interaction directly. The interaction will be treated as a single categorical variable, which is simpler than hand-coded numeric interactions and exploits the tree model's ability to learn deck-side pairs.\n</plan>\n\n<code>\n```python\n\"\"\"\ntrain.py — XGBoost with cabin parsing, GroupId, missingness flags, Deck-Side interaction.\nIteration 23: Add Deck-Side interaction feature to test non-linear spatial patterns.\n\"\"\"\nimport sys, pathlib\nsys.path.insert(0, str(pathlib.Path(__file__).resolve().parent.parent))\n\nimport pandas as pd\nimport numpy as np\nimport xgboost as xgb\nfrom sklearn.impute import SimpleImputer\nfrom sklearn.pipeline import Pipeline\nfrom sklearn.preprocessing import StandardScaler, OneHotEncoder\nfrom sklearn.compose import ColumnTransformer\n\nimport prepare\n\nNUMERIC = [\"Age\", \"RoomService\", \"FoodCourt\", \"ShoppingMall\", \"Spa\", \"VRDeck\"]\nCATEGORICAL = [\"HomePlanet\", \"Destination\", \"CryoSleep\", \"VIP\"]\nSPENDING = [\"RoomService\", \"FoodCourt\", \"ShoppingMall\", \"Spa\", \"VRDeck\"]\n\n\ndef parse_cabin(cabin_str):\n    \"\"\"Parse Cabin 'F/0/S' into deck, room_num, side.\"\"\"\n    if pd.isna(cabin_str):\n        return np.nan, np.nan, np.nan\n    parts = str(cabin_str).split(\"/\")\n    if len(parts) == 3:\n        return parts[0], int(parts[1]) if parts[1].isdigit() else np.nan, parts[2]\n    return np.nan, np.nan, np.nan\n\n\ndef extract_group_id(passenger_id):\n    \"\"\"Extract group ID from PassengerId (e.g., '0001_01' -> '0001').\"\"\"\n    if pd.isna(passenger_id):\n        return np.nan\n    return str(passenger_id).split(\"_\")[0]\n\n\ndef build_predict_fn():\n    train_df, _ = prepare.load_split()\n    \n    # Parse Cabin into Deck, RoomNum, Side\n    cabin_data = train_df[\"Cabin\"].apply(parse_cabin)\n    train_df[\"Deck\"] = cabin_data.apply(lambda x: x[0])\n    train_df[\"RoomNum\"] = cabin_data.apply(lambda x: x[1])\n    train_df[\"Side\"] = cabin_data.apply(lambda x: x[2])\n    \n    # Create Deck-Side interaction feature\n    train_df[\"DeckSide\"] = train_df[\"Deck\"].fillna(\"Unknown\") + \"-\" + train_df[\"Side\"].fillna(\"Unknown\")\n    \n    # Extract group ID from PassengerId\n    train_df[\"GroupId\"] = train_df[\"PassengerId\"].apply(extract_group_id)\n    \n    # Fill missing values in spending columns with 0 (indicates not spent)\n    for col in SPENDING:\n        train_df[col] = train_df[col].fillna(0)\n    \n    # Create explicit missingness flags for CryoSleep and VIP before filling\n    train_df[\"CryoSleep_Missing\"] = train_df[\"CryoSleep\"].isna().astype(int)\n    train_df[\"VIP_Missing\"] = train_df[\"VIP\"].isna().astype(int)\n    \n    # Convert CryoSleep and VIP to string for categorical encoding\n    train_df[\"CryoSleep\"] = train_df[\"CryoSleep\"].fillna(\"Unknown\").astype(str)\n    train_df[\"VIP\"] = train_df[\"VIP\"].fillna(\"Unknown\").astype(str)\n    \n    # Build feature set: core features + cabin parsing + interaction + missingness flags\n    feature_cols = (\n        [\"Age\"] + SPENDING + CATEGORICAL + \n        [\"Deck\", \"RoomNum\", \"Side\", \"GroupId\", \"DeckSide\"] + \n        [\"CryoSleep_Missing\", \"VIP_Missing\"]\n    )\n    X = train_df[feature_cols]\n    y = train_df[\"Transported\"].astype(int)\n    \n    # Define preprocessing for numeric and categorical columns\n    numeric_transformer = Pipeline([\n        (\"imputer\", SimpleImputer(strategy=\"median\")),\n        (\"scaler\", StandardScaler()),\n    ])\n    \n    categorical_transformer = Pipeline([\n        (\"imputer\", SimpleImputer(strategy=\"most_frequent\")),\n        (\"onehot\", OneHotEncoder(handle_unknown=\"ignore\", sparse_output=False)),\n    ])\n    \n    preprocessor = ColumnTransformer([\n        (\"num\", numeric_transformer, [\"Age\", \"RoomNum\", \"CryoSleep_Missing\", \"VIP_Missing\"] + SPENDING),\n        (\"cat\", categorical_transformer, CATEGORICAL + [\"Deck\", \"Side\", \"GroupId\", \"DeckSide\"]),\n    ])\n    \n    pipe = Pipeline([\n        (\"preprocessor\", preprocessor),\n        (\"clf\", xgb.XGBClassifier(n_estimators=100, max_depth=6, learning_rate=0.1, random_state=42, verbosity=0)),\n    ])\n    \n    pipe.fit(X, y)\n    \n    def predict(X_val):\n        # Parse Cabin in validation set\n        cabin_data = X_val[\"Cabin\"].apply(parse_cabin)\n        X_val_copy = X_val.copy()\n        X_val_copy[\"Deck\"] = cabin_data.apply(lambda x: x[0])\n        X_val_copy[\"RoomNum\"] = cabin_data.apply(lambda x: x[1])\n        X_val_copy[\"Side\"] = cabin_data.apply(lambda x: x[2])\n        \n        # Create Deck-Side interaction feature\n        X_val_copy[\"DeckSide\"] = X_val_copy[\"Deck\"].fillna(\"Unknown\") + \"-\" + X_val_copy[\"Side\"].fillna(\"Unknown\")\n        \n        # Extract group ID\n        X_val_copy[\"GroupId\"] = X_val_copy[\"PassengerId\"].apply(extract_group_id)\n        \n        # Fill missing spending with 0\n        for col in SPENDING:\n            X_val_copy[col] = X_val_copy[col].fillna(0)\n        \n        # Create explicit missingness flags for CryoSleep and VIP before filling\n        X_val_copy[\"CryoSleep_Missing\"] = X_val_copy[\"CryoSleep\"].isna().astype(int)\n        X_val_copy[\"VIP_Missing\"] = X_val_copy[\"VIP\"].isna().astype(int)\n        \n        # Handle CryoSleep and VIP\n        X_val_copy[\"CryoSleep\"] = X_val_copy[\"CryoSleep\"].fillna(\"Unknown\").astype(str)\n        X_val_copy[\"VIP\"] = X_val_copy[\"VIP\"].fillna(\"Unknown\").astype(str)\n        \n        return pipe.predict(X_val_copy[feature_cols]).astype(bool)\n    \n    return predict\n\n\nif __name__ == \"__main__\":\n    predict_fn = build_predict_fn()\n    score = prepare.evaluate(predict_fn)\n    print(f\"VAL_ACCURACY: {score:.4f}\")\n```\n</code>\n\n<notes_append>\nIteration 23: Added Deck-Side interaction feature (concatenated as categorical) to test whether deck-side pair patterns improve signal beyond treating Deck and Side separately. Removed HighSpender; reverting to simpler feature set focused on structural cabin-group features.\n</notes_append>", "reflection": "The current best score is 0.8143 (iteration 2), which we've held steady for multiple iterations. Iterations 3–22 have involved various attempts at feature engineering and hyperparameter tuning (HighSpender, GroupSize, TotalSpending, etc.) but none have improved beyond 0.8143. The recent notes show that iterations 19–20 (hyperparameter tweaking) regressed, and iteration 21 confirmed that reverting to iteration 2's hyperparameters reproduces 0.8143. The HighSpender feature (iteration 22) held at 0.8143 but didn't improve it. The pattern suggests we're near a local ceiling with the current feature set and model class. I should examine the data more carefully to identify fundamentally new signal rather than iterating on spending-based features.", "observations": ["The best score of 0.8143 has been stable across multiple feature iterations (iter 2, 21, 22), suggesting the current feature set captures most of the accessible low-hanging fruit. Hyperparameter tweaking has not helped.", "Notes indicate that aggregate spending features (TotalSpending, HasSpent, GroupSize) introduced noise in earlier iterations, yet simpler spending indicators (HighSpender) also plateau. This suggests spending columns alone may not be the limiting factor.", "The hints mention that identifier columns (PassengerId, GroupId) encode group structure; we've added GroupId but may not be fully exploiting the transport-group relationship. GroupSize was tried but reverted—perhaps a different group-level feature (e.g., group homogeneity, group-level missingness patterns) could be more informative.", "Missing values in CryoSleep and VIP are currently flagged, but we're not exploring whether the missing-ness pattern interacts with group structure (e.g., are entire groups missing the same values?).", "The cabin features (Deck, Side) are parsed but not combined in any way; the deck/side pair might have interaction patterns worth exploring (e.g., certain decks are more dangerous/safe on one side than the other)."], "hypothesis": "Deck and Side interact non-linearly in predicting transport: certain deck-side combinations have higher transport rates. Creating an explicit Deck-Side interaction feature will capture this structure better than treating them separately, yielding a modest improvement over 0.8143.", "plan": "I will create an explicit Deck-Side interaction feature by concatenating Deck and Side into a new categorical feature (e.g., \"F-S\", \"G-P\", etc.). This avoids adding numeric features and lets the OneHotEncoder handle the interaction directly. The interaction will be treated as a single categorical variable, which is simpler than hand-coded numeric interactions and exploits the tree model's ability to learn deck-side pairs.", "code": "\"\"\"\ntrain.py — XGBoost with cabin parsing, GroupId, missingness flags, Deck-Side interaction.\nIteration 23: Add Deck-Side interaction feature to test non-linear spatial patterns.\n\"\"\"\nimport sys, pathlib\nsys.path.insert(0, str(pathlib.Path(__file__).resolve().parent.parent))\n\nimport pandas as pd\nimport numpy as np\nimport xgboost as xgb\nfrom sklearn.impute import SimpleImputer\nfrom sklearn.pipeline import Pipeline\nfrom sklearn.preprocessing import StandardScaler, OneHotEncoder\nfrom sklearn.compose import ColumnTransformer\n\nimport prepare\n\nNUMERIC = [\"Age\", \"RoomService\", \"FoodCourt\", \"ShoppingMall\", \"Spa\", \"VRDeck\"]\nCATEGORICAL = [\"HomePlanet\", \"Destination\", \"CryoSleep\", \"VIP\"]\nSPENDING = [\"RoomService\", \"FoodCourt\", \"ShoppingMall\", \"Spa\", \"VRDeck\"]\n\n\ndef parse_cabin(cabin_str):\n    \"\"\"Parse Cabin 'F/0/S' into deck, room_num, side.\"\"\"\n    if pd.isna(cabin_str):\n        return np.nan, np.nan, np.nan\n    parts = str(cabin_str).split(\"/\")\n    if len(parts) == 3:\n        return parts[0], int(parts[1]) if parts[1].isdigit() else np.nan, parts[2]\n    return np.nan, np.nan, np.nan\n\n\ndef extract_group_id(passenger_id):\n    \"\"\"Extract group ID from PassengerId (e.g., '0001_01' -> '0001').\"\"\"\n    if pd.isna(passenger_id):\n        return np.nan\n    return str(passenger_id).split(\"_\")[0]\n\n\ndef build_predict_fn():\n    train_df, _ = prepare.load_split()\n    \n    # Parse Cabin into Deck, RoomNum, Side\n    cabin_data = train_df[\"Cabin\"].apply(parse_cabin)\n    train_df[\"Deck\"] = cabin_data.apply(lambda x: x[0])\n    train_df[\"RoomNum\"] = cabin_data.apply(lambda x: x[1])\n    train_df[\"Side\"] = cabin_data.apply(lambda x: x[2])\n    \n    # Create Deck-Side interaction feature\n    train_df[\"DeckSide\"] = train_df[\"Deck\"].fillna(\"Unknown\") + \"-\" + train_df[\"Side\"].fillna(\"Unknown\")\n    \n    # Extract group ID from PassengerId\n    train_df[\"GroupId\"] = train_df[\"PassengerId\"].apply(extract_group_id)\n    \n    # Fill missing values in spending columns with 0 (indicates not spent)\n    for col in SPENDING:\n        train_df[col] = train_df[col].fillna(0)\n    \n    # Create explicit missingness flags for CryoSleep and VIP before filling\n    train_df[\"CryoSleep_Missing\"] = train_df[\"CryoSleep\"].isna().astype(int)\n    train_df[\"VIP_Missing\"] = train_df[\"VIP\"].isna().astype(int)\n    \n    # Convert CryoSleep and VIP to string for categorical encoding\n    train_df[\"CryoSleep\"] = train_df[\"CryoSleep\"].fillna(\"Unknown\").astype(str)\n    train_df[\"VIP\"] = train_df[\"VIP\"].fillna(\"Unknown\").astype(str)\n    \n    # Build feature set: core features + cabin parsing + interaction + missingness flags\n    feature_cols = (\n        [\"Age\"] + SPENDING + CATEGORICAL + \n        [\"Deck\", \"RoomNum\", \"Side\", \"GroupId\", \"DeckSide\"] + \n        [\"CryoSleep_Missing\", \"VIP_Missing\"]\n    )\n    X = train_df[feature_cols]\n    y = train_df[\"Transported\"].astype(int)\n    \n    # Define preprocessing for numeric and categorical columns\n    numeric_transformer = Pipeline([\n        (\"imputer\", SimpleImputer(strategy=\"median\")),\n        (\"scaler\", StandardScaler()),\n    ])\n    \n    categorical_transformer = Pipeline([\n        (\"imputer\", SimpleImputer(strategy=\"most_frequent\")),\n        (\"onehot\", OneHotEncoder(handle_unknown=\"ignore\", sparse_output=False)),\n    ])\n    \n    preprocessor = ColumnTransformer([\n        (\"num\", numeric_transformer, [\"Age\", \"RoomNum\", \"CryoSleep_Missing\", \"VIP_Missing\"] + SPENDING),\n        (\"cat\", categorical_transformer, CATEGORICAL + [\"Deck\", \"Side\", \"GroupId\", \"DeckSide\"]),\n    ])\n    \n    pipe = Pipeline([\n        (\"preprocessor\", preprocessor),\n        (\"clf\", xgb.XGBClassifier(n_estimators=100, max_depth=6, learning_rate=0.1, random_state=42, verbosity=0)),\n    ])\n    \n    pipe.fit(X, y)\n    \n    def predict(X_val):\n        # Parse Cabin in validation set\n        cabin_data = X_val[\"Cabin\"].apply(parse_cabin)\n        X_val_copy = X_val.copy()\n        X_val_copy[\"Deck\"] = cabin_data.apply(lambda x: x[0])\n        X_val_copy[\"RoomNum\"] = cabin_data.apply(lambda x: x[1])\n        X_val_copy[\"Side\"] = cabin_data.apply(lambda x: x[2])\n        \n        # Create Deck-Side interaction feature\n        X_val_copy[\"DeckSide\"] = X_val_copy[\"Deck\"].fillna(\"Unknown\") + \"-\" + X_val_copy[\"Side\"].fillna(\"Unknown\")\n        \n        # Extract group ID\n        X_val_copy[\"GroupId\"] = X_val_copy[\"PassengerId\"].apply(extract_group_id)\n        \n        # Fill missing spending with 0\n        for col in SPENDING:\n            X_val_copy[col] = X_val_copy[col].fillna(0)\n        \n        # Create explicit missingness flags for CryoSleep and VIP before filling\n        X_val_copy[\"CryoSleep_Missing\"] = X_val_copy[\"CryoSleep\"].isna().astype(int)\n        X_val_copy[\"VIP_Missing\"] = X_val_copy[\"VIP\"].isna().astype(int)\n        \n        # Handle CryoSleep and VIP\n        X_val_copy[\"CryoSleep\"] = X_val_copy[\"CryoSleep\"].fillna(\"Unknown\").astype(str)\n        X_val_copy[\"VIP\"] = X_val_copy[\"VIP\"].fillna(\"Unknown\").astype(str)\n        \n        return pipe.predict(X_val_copy[feature_cols]).astype(bool)\n    \n    return predict\n\n\nif __name__ == \"__main__\":\n    predict_fn = build_predict_fn()\n    score = prepare.evaluate(predict_fn)\n    print(f\"VAL_ACCURACY: {score:.4f}\")\n", "notes_append": "Iteration 23: Added Deck-Side interaction feature (concatenated as categorical) to test whether deck-side pair patterns improve signal beyond treating Deck and Side separately. Removed HighSpender; reverting to simpler feature set focused on structural cabin-group features.", "stdout": "VAL_ACCURACY: 0.8114\n", "stderr": "", "returncode": 0, "score": 0.8114, "kept": false, "status": "reverted", "commit_hash": null, "input_tokens": 4174, "output_tokens": 2500, "cost_usd": 0.016674}
