{"iteration": 3, "timestamp": "2026-05-08T20:33:37", "previous_best": 0.7901, "duration_seconds": 1.93, "agent_response_raw": "<reflection>\nThe current best score is 0.7901 (iteration 2), which beats the baseline of 0.78. The current train.py is extracting group IDs from PassengerId and parsing Cabin into Deck/RoomNum/Side, with explicit 0-filling for spending columns. The marginal gain from iteration 2 to 3 was minimal (0.7884 to 0.7901), suggesting the group ID extraction added only ~0.0017 improvement. I should explore structurally different directions: different model classes (XGBoost/LightGBM), better feature engineering, or examining which features are actually driving predictions.\n</reflection>\n\n<observations>\n- The current model uses LogisticRegression with one-hot encoded categorical features and median-imputed numeric features. We're at 0.7901, which is only a modest improvement over baseline.\n- The spending columns (RoomService, FoodCourt, ShoppingMall, Spa, VRDeck) being filled with 0 likely indicates passengers who didn't use those services. This binary signal (used/not-used) might be more predictive than the actual amounts.\n- Cabin parsing into Deck/RoomNum/Side added structure, but we haven't tested whether all three components are equally valuable or if some should be dropped.\n- GroupId extraction from PassengerId assumes group membership is important, but we haven't validated that it actually improves the model significantly compared to the cost of the feature.\n- We haven't yet tried a tree-based model (XGBoost/LightGBM), which can naturally capture non-linear interactions and feature importance, and might outperform linear models on this structured data.\n</observations>\n\n<hypothesis>\nA tree-based model (XGBoost) will outperform logistic regression because it can automatically capture non-linear interactions between spending patterns, cabin location, and passenger attributes without requiring explicit feature engineering. Additionally, tree models are more robust to the categorical/numeric mix in this dataset.\n</hypothesis>\n\n<plan>\nI will replace LogisticRegression with XGBoost, remove the one-hot encoding for categorical variables (XGBoost handles categories natively via label encoding), and simplify the preprocessing pipeline. This tests whether a more expressive model class can yield better performance on this dataset's structure.\n</plan>\n\n<code>\n```python\n\"\"\"\ntrain.py — XGBoost with label encoding and simplified preprocessing.\n\"\"\"\nimport sys, pathlib\nsys.path.insert(0, str(pathlib.Path(__file__).resolve().parent.parent))\n\nimport pandas as pd\nimport numpy as np\nfrom sklearn.impute import SimpleImputer\nfrom sklearn.preprocessing import LabelEncoder\nimport xgboost as xgb\n\nimport prepare\n\nNUMERIC = [\"Age\", \"RoomService\", \"FoodCourt\", \"ShoppingMall\", \"Spa\", \"VRDeck\"]\nCATEGORICAL = [\"HomePlanet\", \"Destination\", \"CryoSleep\", \"VIP\"]\nSPENDING = [\"RoomService\", \"FoodCourt\", \"ShoppingMall\", \"Spa\", \"VRDeck\"]\n\n\ndef parse_cabin(cabin_str):\n    \"\"\"Parse Cabin 'F/0/S' into deck, room_num, side.\"\"\"\n    if pd.isna(cabin_str):\n        return np.nan, np.nan, np.nan\n    parts = str(cabin_str).split(\"/\")\n    if len(parts) == 3:\n        return parts[0], int(parts[1]) if parts[1].isdigit() else np.nan, parts[2]\n    return np.nan, np.nan, np.nan\n\n\ndef extract_group_id(passenger_id):\n    \"\"\"Extract group ID from PassengerId (e.g., '0001_01' -> '0001').\"\"\"\n    if pd.isna(passenger_id):\n        return np.nan\n    return str(passenger_id).split(\"_\")[0]\n\n\ndef build_predict_fn():\n    train_df, _ = prepare.load_split()\n    \n    # Parse Cabin into Deck, RoomNum, Side\n    cabin_data = train_df[\"Cabin\"].apply(parse_cabin)\n    train_df[\"Deck\"] = cabin_data.apply(lambda x: x[0])\n    train_df[\"RoomNum\"] = cabin_data.apply(lambda x: x[1])\n    train_df[\"Side\"] = cabin_data.apply(lambda x: x[2])\n    \n    # Extract group ID from PassengerId\n    train_df[\"GroupId\"] = train_df[\"PassengerId\"].apply(extract_group_id)\n    \n    # Fill missing values in spending columns with 0\n    for col in SPENDING:\n        train_df[col] = train_df[col].fillna(0)\n    \n    # Handle CryoSleep and VIP NaNs as explicit category\n    train_df[\"CryoSleep\"] = train_df[\"CryoSleep\"].fillna(\"Unknown\").astype(str)\n    train_df[\"VIP\"] = train_df[\"VIP\"].fillna(\"Unknown\").astype(str)\n    \n    # Build feature set\n    feature_cols = [\"Age\"] + SPENDING + CATEGORICAL + [\"Deck\", \"RoomNum\", \"Side\", \"GroupId\"]\n    X = train_df[feature_cols].copy()\n    y = train_df[\"Transported\"].astype(int)\n    \n    # Impute numeric columns\n    numeric_imputer = SimpleImputer(strategy=\"median\")\n    numeric_cols = [\"Age\", \"RoomNum\"]\n    X[numeric_cols] = numeric_imputer.fit_transform(X[numeric_cols])\n    \n    # Impute categorical columns\n    categorical_imputer = SimpleImputer(strategy=\"most_frequent\")\n    X[CATEGORICAL + [\"Deck\", \"Side\", \"GroupId\"]] = categorical_imputer.fit_transform(\n        X[CATEGORICAL + [\"Deck\", \"Side\", \"GroupId\"]]\n    )\n    \n    # Label encode categorical columns\n    label_encoders = {}\n    for col in CATEGORICAL + [\"Deck\", \"Side\", \"GroupId\"]:\n        le = LabelEncoder()\n        X[col] = le.fit_transform(X[col].astype(str))\n        label_encoders[col] = le\n    \n    # Train XGBoost\n    model = xgb.XGBClassifier(\n        n_estimators=100,\n        max_depth=5,\n        learning_rate=0.1,\n        random_state=42,\n        eval_metric=\"logloss\"\n    )\n    model.fit(X, y)\n    \n    def predict(X_val):\n        # Parse Cabin in validation set\n        cabin_data = X_val[\"Cabin\"].apply(parse_cabin)\n        X_val_copy = X_val.copy()\n        X_val_copy[\"Deck\"] = cabin_data.apply(lambda x: x[0])\n        X_val_copy[\"RoomNum\"] = cabin_data.apply(lambda x: x[1])\n        X_val_copy[\"Side\"] = cabin_data.apply(lambda x: x[2])\n        \n        # Extract group ID\n        X_val_copy[\"GroupId\"] = X_val_copy[\"PassengerId\"].apply(extract_group_id)\n        \n        # Fill missing spending with 0\n        for col in SPENDING:\n            X_val_copy[col] = X_val_copy[col].fillna(0)\n        \n        # Handle CryoSleep and VIP\n        X_val_copy[\"CryoSleep\"] = X_val_copy[\"CryoSleep\"].fillna(\"Unknown\").astype(str)\n        X_val_copy[\"VIP\"] = X_val_copy[\"VIP\"].fillna(\"Unknown\").astype(str)\n        \n        X_val_proc = X_val_copy[feature_cols].copy()\n        \n        # Impute numeric\n        X_val_proc[numeric_cols] = numeric_imputer.transform(X_val_proc[numeric_cols])\n        \n        # Impute categorical\n        X_val_proc[CATEGORICAL + [\"Deck\", \"Side\", \"GroupId\"]] = categorical_imputer.transform(\n            X_val_proc[CATEGORICAL + [\"Deck\", \"Side\", \"GroupId\"]]\n        )\n        \n        # Label encode using fitted encoders\n        for col in CATEGORICAL + [\"Deck\", \"Side\", \"GroupId\"]:\n            X_val_proc[col] = label_encoders[col].transform(X_val_proc[col].astype(str))\n        \n        return model.predict(X_val_proc).astype(bool)\n    \n    return predict\n\n\nif __name__ == \"__main__\":\n    predict_fn = build_predict_fn()\n    score = prepare.evaluate(predict_fn)\n    print(f\"VAL_ACCURACY: {score:.4f}\")\n```\n</code>\n\n<notes_append>\nIteration 4: Switched from LogisticRegression to XGBoost (n_estimators=100, max_depth=5, learning_rate=0.1) with label encoding instead of one-hot encoding. Tree-based models can capture non-linear interactions without explicit feature engineering. Testing whether this structurally different approach beats 0.7901.\n</notes_append>", "reflection": "The current best score is 0.7901 (iteration 2), which beats the baseline of 0.78. The current train.py is extracting group IDs from PassengerId and parsing Cabin into Deck/RoomNum/Side, with explicit 0-filling for spending columns. The marginal gain from iteration 2 to 3 was minimal (0.7884 to 0.7901), suggesting the group ID extraction added only ~0.0017 improvement. I should explore structurally different directions: different model classes (XGBoost/LightGBM), better feature engineering, or examining which features are actually driving predictions.", "observations": ["The current model uses LogisticRegression with one-hot encoded categorical features and median-imputed numeric features. We're at 0.7901, which is only a modest improvement over baseline.", "The spending columns (RoomService, FoodCourt, ShoppingMall, Spa, VRDeck) being filled with 0 likely indicates passengers who didn't use those services. This binary signal (used/not-used) might be more predictive than the actual amounts.", "Cabin parsing into Deck/RoomNum/Side added structure, but we haven't tested whether all three components are equally valuable or if some should be dropped.", "GroupId extraction from PassengerId assumes group membership is important, but we haven't validated that it actually improves the model significantly compared to the cost of the feature.", "We haven't yet tried a tree-based model (XGBoost/LightGBM), which can naturally capture non-linear interactions and feature importance, and might outperform linear models on this structured data."], "hypothesis": "A tree-based model (XGBoost) will outperform logistic regression because it can automatically capture non-linear interactions between spending patterns, cabin location, and passenger attributes without requiring explicit feature engineering. Additionally, tree models are more robust to the categorical/numeric mix in this dataset.", "plan": "I will replace LogisticRegression with XGBoost, remove the one-hot encoding for categorical variables (XGBoost handles categories natively via label encoding), and simplify the preprocessing pipeline. This tests whether a more expressive model class can yield better performance on this dataset's structure.", "code": "\"\"\"\ntrain.py — XGBoost with label encoding and simplified preprocessing.\n\"\"\"\nimport sys, pathlib\nsys.path.insert(0, str(pathlib.Path(__file__).resolve().parent.parent))\n\nimport pandas as pd\nimport numpy as np\nfrom sklearn.impute import SimpleImputer\nfrom sklearn.preprocessing import LabelEncoder\nimport xgboost as xgb\n\nimport prepare\n\nNUMERIC = [\"Age\", \"RoomService\", \"FoodCourt\", \"ShoppingMall\", \"Spa\", \"VRDeck\"]\nCATEGORICAL = [\"HomePlanet\", \"Destination\", \"CryoSleep\", \"VIP\"]\nSPENDING = [\"RoomService\", \"FoodCourt\", \"ShoppingMall\", \"Spa\", \"VRDeck\"]\n\n\ndef parse_cabin(cabin_str):\n    \"\"\"Parse Cabin 'F/0/S' into deck, room_num, side.\"\"\"\n    if pd.isna(cabin_str):\n        return np.nan, np.nan, np.nan\n    parts = str(cabin_str).split(\"/\")\n    if len(parts) == 3:\n        return parts[0], int(parts[1]) if parts[1].isdigit() else np.nan, parts[2]\n    return np.nan, np.nan, np.nan\n\n\ndef extract_group_id(passenger_id):\n    \"\"\"Extract group ID from PassengerId (e.g., '0001_01' -> '0001').\"\"\"\n    if pd.isna(passenger_id):\n        return np.nan\n    return str(passenger_id).split(\"_\")[0]\n\n\ndef build_predict_fn():\n    train_df, _ = prepare.load_split()\n    \n    # Parse Cabin into Deck, RoomNum, Side\n    cabin_data = train_df[\"Cabin\"].apply(parse_cabin)\n    train_df[\"Deck\"] = cabin_data.apply(lambda x: x[0])\n    train_df[\"RoomNum\"] = cabin_data.apply(lambda x: x[1])\n    train_df[\"Side\"] = cabin_data.apply(lambda x: x[2])\n    \n    # Extract group ID from PassengerId\n    train_df[\"GroupId\"] = train_df[\"PassengerId\"].apply(extract_group_id)\n    \n    # Fill missing values in spending columns with 0\n    for col in SPENDING:\n        train_df[col] = train_df[col].fillna(0)\n    \n    # Handle CryoSleep and VIP NaNs as explicit category\n    train_df[\"CryoSleep\"] = train_df[\"CryoSleep\"].fillna(\"Unknown\").astype(str)\n    train_df[\"VIP\"] = train_df[\"VIP\"].fillna(\"Unknown\").astype(str)\n    \n    # Build feature set\n    feature_cols = [\"Age\"] + SPENDING + CATEGORICAL + [\"Deck\", \"RoomNum\", \"Side\", \"GroupId\"]\n    X = train_df[feature_cols].copy()\n    y = train_df[\"Transported\"].astype(int)\n    \n    # Impute numeric columns\n    numeric_imputer = SimpleImputer(strategy=\"median\")\n    numeric_cols = [\"Age\", \"RoomNum\"]\n    X[numeric_cols] = numeric_imputer.fit_transform(X[numeric_cols])\n    \n    # Impute categorical columns\n    categorical_imputer = SimpleImputer(strategy=\"most_frequent\")\n    X[CATEGORICAL + [\"Deck\", \"Side\", \"GroupId\"]] = categorical_imputer.fit_transform(\n        X[CATEGORICAL + [\"Deck\", \"Side\", \"GroupId\"]]\n    )\n    \n    # Label encode categorical columns\n    label_encoders = {}\n    for col in CATEGORICAL + [\"Deck\", \"Side\", \"GroupId\"]:\n        le = LabelEncoder()\n        X[col] = le.fit_transform(X[col].astype(str))\n        label_encoders[col] = le\n    \n    # Train XGBoost\n    model = xgb.XGBClassifier(\n        n_estimators=100,\n        max_depth=5,\n        learning_rate=0.1,\n        random_state=42,\n        eval_metric=\"logloss\"\n    )\n    model.fit(X, y)\n    \n    def predict(X_val):\n        # Parse Cabin in validation set\n        cabin_data = X_val[\"Cabin\"].apply(parse_cabin)\n        X_val_copy = X_val.copy()\n        X_val_copy[\"Deck\"] = cabin_data.apply(lambda x: x[0])\n        X_val_copy[\"RoomNum\"] = cabin_data.apply(lambda x: x[1])\n        X_val_copy[\"Side\"] = cabin_data.apply(lambda x: x[2])\n        \n        # Extract group ID\n        X_val_copy[\"GroupId\"] = X_val_copy[\"PassengerId\"].apply(extract_group_id)\n        \n        # Fill missing spending with 0\n        for col in SPENDING:\n            X_val_copy[col] = X_val_copy[col].fillna(0)\n        \n        # Handle CryoSleep and VIP\n        X_val_copy[\"CryoSleep\"] = X_val_copy[\"CryoSleep\"].fillna(\"Unknown\").astype(str)\n        X_val_copy[\"VIP\"] = X_val_copy[\"VIP\"].fillna(\"Unknown\").astype(str)\n        \n        X_val_proc = X_val_copy[feature_cols].copy()\n        \n        # Impute numeric\n        X_val_proc[numeric_cols] = numeric_imputer.transform(X_val_proc[numeric_cols])\n        \n        # Impute categorical\n        X_val_proc[CATEGORICAL + [\"Deck\", \"Side\", \"GroupId\"]] = categorical_imputer.transform(\n            X_val_proc[CATEGORICAL + [\"Deck\", \"Side\", \"GroupId\"]]\n        )\n        \n        # Label encode using fitted encoders\n        for col in CATEGORICAL + [\"Deck\", \"Side\", \"GroupId\"]:\n            X_val_proc[col] = label_encoders[col].transform(X_val_proc[col].astype(str))\n        \n        return model.predict(X_val_proc).astype(bool)\n    \n    return predict\n\n\nif __name__ == \"__main__\":\n    predict_fn = build_predict_fn()\n    score = prepare.evaluate(predict_fn)\n    print(f\"VAL_ACCURACY: {score:.4f}\")\n", "notes_append": "Iteration 4: Switched from LogisticRegression to XGBoost (n_estimators=100, max_depth=5, learning_rate=0.1) with label encoding instead of one-hot encoding. Tree-based models can capture non-linear interactions without explicit feature engineering. Testing whether this structurally different approach beats 0.7901.", "stdout": "", "stderr": "er\\Creating\\Blog\\spaceship-titanic-autoresearch\\.venv\\Lib\\site-packages\\sklearn\\utils\\_encode.py\", line 168, in _map_to_integer\n    return xp.asarray([table[v] for v in values], device=device(values))\n                       ~~~~~^^^\n  File \"C:\\Roger\\Creating\\Blog\\spaceship-titanic-autoresearch\\.venv\\Lib\\site-packages\\sklearn\\utils\\_encode.py\", line 161, in __missing__\n    raise KeyError(key)\nKeyError: '3857'\n\nDuring handling of the above exception, another exception occurred:\n\nTraceback (most recent call last):\n  File \"C:\\Roger\\Creating\\Blog\\spaceship-titanic-autoresearch\\workspace\\train.py\", line 130, in <module>\n    score = prepare.evaluate(predict_fn)\n  File \"C:\\Roger\\Creating\\Blog\\spaceship-titanic-autoresearch\\prepare.py\", line 35, in evaluate\n    y_pred = predict_fn(X_val)\n  File \"C:\\Roger\\Creating\\Blog\\spaceship-titanic-autoresearch\\workspace\\train.py\", line 121, in predict\n    X_val_proc[col] = label_encoders[col].transform(X_val_proc[col].astype(str))\n                      ~~~~~~~~~~~~~~~~~~~~~~~~~~~~~^^^^^^^^^^^^^^^^^^^^^^^^^^^^^\n  File \"C:\\Roger\\Creating\\Blog\\spaceship-titanic-autoresearch\\.venv\\Lib\\site-packages\\sklearn\\preprocessing\\_label.py\", line 144, in transform\n    return _encode(y, uniques=self.classes_)\n  File \"C:\\Roger\\Creating\\Blog\\spaceship-titanic-autoresearch\\.venv\\Lib\\site-packages\\sklearn\\utils\\_encode.py\", line 231, in _encode\n    raise ValueError(f\"y contains previously unseen labels: {e}\")\nValueError: y contains previously unseen labels: '3857'\n", "returncode": 1, "score": null, "kept": false, "status": "crashed", "commit_hash": null, "input_tokens": 3333, "output_tokens": 2242, "cost_usd": 0.014543}
