{"iteration": 3, "timestamp": "2026-05-08T22:06:16", "previous_best": 0.8235, "duration_seconds": 6.34, "agent_response_raw": "<reflection>\nThe last iteration (iter 65) regressed significantly to 0.8114 with slower learning and more estimators, suggesting the baseline hyperparameters (lr=0.1, n_estimators=100) are already well-tuned for this feature set. We've tried multiple feature engineering variations (interactions, group features, MemberIndex) and model capacity changes, all of which regressed or stayed flat. The best score remains 0.8235 from iter 0 (clean baseline). I should inspect the data more carefully to find genuinely new signal rather than continuing hyperparameter tweaks.\n</reflection>\n\n<observations>\n- The baseline from iter 0 (0.8235) remains unbeaten across 65 iterations, despite many feature engineering attempts. This suggests either the iter 0 feature set is already near-optimal, or we're missing something structural about the data.\n- Recent iterations (62–65) all regressed or matched the baseline, indicating we're not on a productive path. Iter 2 also regressed with learning_rate changes, confirming hyperparameter tuning is not the bottleneck.\n- The notes mention \"comprehensive EDA\" but the train.py code doesn't actually print or inspect the data in detail. Before proposing another feature, I should actually look at the raw data structure, distributions, and relationships.\n- We've engineered interactions (Age×CryoSleep, HomePlanet×Destination) and group aggregates (GroupSize, GroupMedianSpending), but haven't tested whether these features actually correlate with the target in the training data.\n- The current feature set includes Cabin parsing (Deck, RoomNum, Side) and group-based features, but we haven't verified whether they are actually useful or just noise.\n</observations>\n\n<hypothesis>\nBefore proposing the next feature, I should inspect the training data directly to identify which columns are actually predictive of Transported. A quick correlation check and conditional distribution analysis will reveal whether current features are earning their place, and may expose signal in columns we've overlooked.\n</hypothesis>\n\n<plan>\nAdd an EDA section at the start of build_predict_fn() that prints correlations between numeric features and the target, as well as the conditional distribution of categorical features by target. This will reveal which features are actually carrying signal, and may uncover overlooked columns or interactions. I'll keep the iter 0 feature set and model for now, since it's the best performer; the EDA will inform the next feature proposal.\n</plan>\n\n<code>\n```python\n\"\"\"\ntrain.py — Iteration 66: Add EDA before feature engineering.\nInspect data correlations and conditional distributions to find true signal.\nKeep iter 0 baseline model; let data inspection guide next feature proposals.\n\"\"\"\nimport sys, pathlib\nsys.path.insert(0, str(pathlib.Path(__file__).resolve().parent.parent))\n\nimport pandas as pd\nimport numpy as np\nimport xgboost as xgb\nfrom sklearn.impute import SimpleImputer\nfrom sklearn.pipeline import Pipeline\nfrom sklearn.preprocessing import StandardScaler, OneHotEncoder\nfrom sklearn.compose import ColumnTransformer\n\nimport prepare\n\nNUMERIC = [\"Age\", \"RoomService\", \"FoodCourt\", \"ShoppingMall\", \"Spa\", \"VRDeck\"]\nCATEGORICAL = [\"HomePlanet\", \"Destination\", \"CryoSleep\", \"VIP\"]\nSPENDING = [\"RoomService\", \"FoodCourt\", \"ShoppingMall\", \"Spa\", \"VRDeck\"]\n\n\ndef parse_cabin(cabin_str):\n    \"\"\"Parse Cabin 'F/0/S' into deck, room_num, side.\"\"\"\n    if pd.isna(cabin_str):\n        return np.nan, np.nan, np.nan\n    parts = str(cabin_str).split(\"/\")\n    if len(parts) == 3:\n        return parts[0], int(parts[1]) if parts[1].isdigit() else np.nan, parts[2]\n    return np.nan, np.nan, np.nan\n\n\ndef extract_group_id(passenger_id):\n    \"\"\"Extract group ID from PassengerId (e.g., '0001_01' -> '0001').\"\"\"\n    if pd.isna(passenger_id):\n        return np.nan\n    return str(passenger_id).split(\"_\")[0]\n\n\ndef engineer_features(df):\n    \"\"\"Engineer spending and spending-cryo interaction features.\"\"\"\n    df_copy = df.copy()\n    \n    # Track which rows have any spending data recorded\n    spending_recorded = ~df_copy[SPENDING].isna().any(axis=1)\n    df_copy[\"Spending_Recorded\"] = spending_recorded.astype(int)\n    \n    # Fill missing spending with median per HomePlanet group\n    for col in SPENDING:\n        missing_mask = df_copy[col].isna()\n        if missing_mask.any():\n            group_medians = df_copy.groupby(\"HomePlanet\")[col].median()\n            df_copy.loc[missing_mask, col] = df_copy.loc[missing_mask, \"HomePlanet\"].map(group_medians)\n            global_median = df_copy[col].median()\n            df_copy[col] = df_copy[col].fillna(global_median)\n    \n    # Total spending\n    df_copy[\"TotalSpending\"] = df_copy[SPENDING].sum(axis=1)\n    \n    # Interaction: CryoSleep status and log spending\n    cryo_status = df_copy[\"CryoSleep\"].fillna(False)\n    log_spending = np.log1p(df_copy[\"TotalSpending\"])\n    df_copy[\"CryoSleep_LogSpending\"] = (\n        (cryo_status == True) * log_spending\n    )\n    \n    return df_copy\n\n\ndef add_group_features(df):\n    \"\"\"Add group-level aggregate features based on PassengerId group.\"\"\"\n    df_copy = df.copy()\n    \n    # Extract group ID\n    df_copy[\"GroupId\"] = df_copy[\"PassengerId\"].apply(extract_group_id)\n    \n    # Compute group size\n    group_sizes = df_copy.groupby(\"GroupId\").size()\n    df_copy[\"GroupSize\"] = df_copy[\"GroupId\"].map(group_sizes)\n    \n    # Compute group median total spending\n    group_median_spending = df_copy.groupby(\"GroupId\")[\"TotalSpending\"].median()\n    df_copy[\"GroupMedianSpending\"] = df_copy[\"GroupId\"].map(group_median_spending)\n    \n    return df_copy\n\n\ndef print_eda(df, target_col=\"Transported\"):\n    \"\"\"Print correlation and conditional distributions to guide feature engineering.\"\"\"\n    print(\"\\n=== EDA: Numeric Feature Correlations with Target ===\")\n    numeric_cols = df.select_dtypes(include=[np.number]).columns.tolist()\n    if target_col in numeric_cols:\n        numeric_cols.remove(target_col)\n    \n    target = df[target_col].astype(int)\n    corrs = {}\n    for col in numeric_cols:\n        if col in df.columns:\n            # Compute correlation, filling NaN with median\n            col_filled = df[col].fillna(df[col].median())\n            corr = col_filled.corr(target)\n            corrs[col] = corr\n    \n    # Sort by absolute correlation and print\n    sorted_corrs = sorted(corrs.items(), key=lambda x: abs(x[1]), reverse=True)\n    for col, corr in sorted_corrs:\n        print(f\"  {col:25s}: {corr:7.4f}\")\n    \n    print(\"\\n=== EDA: Categorical Feature Distribution by Target ===\")\n    categorical_cols = [c for c in CATEGORICAL if c in df.columns]\n    for col in categorical_cols:\n        print(f\"\\n  {col}:\")\n        cross = pd.crosstab(df[col].fillna(\"Missing\"), target, margins=False, normalize=\"columns\")\n        print(cross.to_string())\n\n\ndef build_predict_fn():\n    train_df, _ = prepare.load_split()\n    \n    # Run EDA on raw data\n    print_eda(train_df)\n    \n    # Parse Cabin into Deck, RoomNum, Side\n    cabin_data = train_df[\"Cabin\"].apply(parse_cabin)\n    train_df[\"Deck\"] = cabin_data.apply(lambda x: x[0])\n    train_df[\"RoomNum\"] = cabin_data.apply(lambda x: x[1])\n    train_df[\"Side\"] = cabin_data.apply(lambda x: x[2])\n    \n    # Engineer features\n    train_df = engineer_features(train_df)\n    \n    # Add group-level features\n    train_df = add_group_features(train_df)\n    \n    # Create explicit missingness flags for CryoSleep and VIP\n    train_df[\"CryoSleep_Missing\"] = train_df[\"CryoSleep\"].isna().astype(int)\n    train_df[\"VIP_Missing\"] = train_df[\"VIP\"].isna().astype(int)\n    \n    # Convert CryoSleep and VIP to string for categorical encoding\n    train_df[\"CryoSleep\"] = train_df[\"CryoSleep\"].fillna(\"Unknown\").astype(str)\n    train_df[\"VIP\"] = train_df[\"VIP\"].fillna(\"Unknown\").astype(str)\n    \n    # Build feature set (clean baseline from iter 0)\n    feature_cols = (\n        [\"Age\"] + SPENDING + [\"TotalSpending\", \"CryoSleep_LogSpending\", \"Spending_Recorded\"] +\n        CATEGORICAL + \n        [\"Deck\", \"RoomNum\", \"Side\", \"GroupId\"] + \n        [\"CryoSleep_Missing\", \"VIP_Missing\"] +\n        [\"GroupSize\", \"GroupMedianSpending\"]\n    )\n    X = train_df[feature_cols]\n    y = train_df[\"Transported\"].astype(int)\n    \n    # Define preprocessing\n    numeric_transformer = Pipeline([\n        (\"imputer\", SimpleImputer(strategy=\"median\")),\n        (\"scaler\", StandardScaler()),\n    ])\n    \n    categorical_transformer = Pipeline([\n        (\"imputer\", SimpleImputer(strategy=\"most_frequent\")),\n        (\"onehot\", OneHotEncoder(handle_unknown=\"ignore\", sparse_output=False)),\n    ])\n    \n    numeric_feature_cols = (\n        [\"Age\", \"RoomNum\", \"CryoSleep_Missing\", \"VIP_Missing\", \"Spending_Recorded\"] + \n        SPENDING + [\"TotalSpending\", \"CryoSleep_LogSpending\"] +\n        [\"GroupSize\", \"GroupMedianSpending\"]\n    )\n    categorical_feature_cols = CATEGORICAL + [\"Deck\", \"Side\", \"GroupId\"]\n    \n    preprocessor = ColumnTransformer([\n        (\"num\", numeric_transformer, numeric_feature_cols),\n        (\"cat\", categorical_transformer, categorical_feature_cols),\n    ])\n    \n    # Use baseline XGBoost config from iter 0\n    pipe = Pipeline([\n        (\"preprocessor\", preprocessor),\n        (\"clf\", xgb.XGBClassifier(max_depth=6, n_estimators=100, learning_rate=0.1, random_state=42, verbosity=0)),\n    ])\n    \n    pipe.fit(X, y)\n    \n    def predict(X_val):\n        cabin_data = X_val[\"Cabin\"].apply(parse_cabin)\n        X_val_copy = X_val.copy()\n        X_val_copy[\"Deck\"] = cabin_data.apply(lambda x: x[0])\n        X_val_copy[\"RoomNum\"] = cabin_data.apply(lambda x: x[1])\n        X_val_copy[\"Side\"] = cabin_data.apply(lambda x: x[2])\n        \n        # Engineer features\n        X_val_copy = engineer_features(X_val_copy)\n        \n        # Add group-level features from training stats\n        X_val_copy[\"GroupId\"] = X_val_copy[\"PassengerId\"].apply(extract_group_id)\n        X_val_copy[\"GroupSize\"] = X_val_copy[\"GroupId\"].map(pd.Series(\n            train_df.groupby(\"GroupId\").size().to_dict()\n        ))\n        X_val_copy[\"GroupMedianSpending\"] = X_val_copy[\"GroupId\"].map(pd.Series(\n            train_df.groupby(\"GroupId\")[\"TotalSpending\"].median().to_dict()\n        ))\n        \n        # Missingness flags\n        X_val_copy[\"CryoSleep_Missing\"] = X_val_copy[\"CryoSleep\"].isna().astype(int)\n        X_val_copy[\"VIP_Missing\"] = X_val_copy[\"VIP\"].isna().astype(int)\n        \n        # Handle CryoSleep and VIP\n        X_val_copy[\"CryoSleep\"] = X_val_copy[\"CryoSleep\"].fillna(\"Unknown\").astype(str)\n        X_val_copy[\"VIP\"] = X_val_copy[\"VIP\"].fillna(\"Unknown\").astype(str)\n        \n        return pipe.predict(X_val_copy[feature_cols]).astype(bool)\n    \n    return predict\n\n\nif __name__ == \"__main__\":\n    predict_fn = build_predict_fn()\n    score = prepare.evaluate(predict_fn)\n    print(f\"VAL_ACCURACY: {score:.4f}\")\n```\n</code>\n\n<notes_append>\nIteration 66: Added EDA (correlation analysis + conditional distributions) to inspect which features actually carry signal. Keeps iter 0 baseline model and feature set. Goal: let data inspection reveal overlooked signal before proposing next feature.\n</notes_append>", "reflection": "The last iteration (iter 65) regressed significantly to 0.8114 with slower learning and more estimators, suggesting the baseline hyperparameters (lr=0.1, n_estimators=100) are already well-tuned for this feature set. We've tried multiple feature engineering variations (interactions, group features, MemberIndex) and model capacity changes, all of which regressed or stayed flat. The best score remains 0.8235 from iter 0 (clean baseline). I should inspect the data more carefully to find genuinely new signal rather than continuing hyperparameter tweaks.", "observations": ["The baseline from iter 0 (0.8235) remains unbeaten across 65 iterations, despite many feature engineering attempts. This suggests either the iter 0 feature set is already near-optimal, or we're missing something structural about the data.", "Recent iterations (62–65) all regressed or matched the baseline, indicating we're not on a productive path. Iter 2 also regressed with learning_rate changes, confirming hyperparameter tuning is not the bottleneck.", "The notes mention \"comprehensive EDA\" but the train.py code doesn't actually print or inspect the data in detail. Before proposing another feature, I should actually look at the raw data structure, distributions, and relationships.", "We've engineered interactions (Age×CryoSleep, HomePlanet×Destination) and group aggregates (GroupSize, GroupMedianSpending), but haven't tested whether these features actually correlate with the target in the training data.", "The current feature set includes Cabin parsing (Deck, RoomNum, Side) and group-based features, but we haven't verified whether they are actually useful or just noise."], "hypothesis": "Before proposing the next feature, I should inspect the training data directly to identify which columns are actually predictive of Transported. A quick correlation check and conditional distribution analysis will reveal whether current features are earning their place, and may expose signal in columns we've overlooked.", "plan": "Add an EDA section at the start of build_predict_fn() that prints correlations between numeric features and the target, as well as the conditional distribution of categorical features by target. This will reveal which features are actually carrying signal, and may uncover overlooked columns or interactions. I'll keep the iter 0 feature set and model for now, since it's the best performer; the EDA will inform the next feature proposal.", "code": "\"\"\"\ntrain.py — Iteration 66: Add EDA before feature engineering.\nInspect data correlations and conditional distributions to find true signal.\nKeep iter 0 baseline model; let data inspection guide next feature proposals.\n\"\"\"\nimport sys, pathlib\nsys.path.insert(0, str(pathlib.Path(__file__).resolve().parent.parent))\n\nimport pandas as pd\nimport numpy as np\nimport xgboost as xgb\nfrom sklearn.impute import SimpleImputer\nfrom sklearn.pipeline import Pipeline\nfrom sklearn.preprocessing import StandardScaler, OneHotEncoder\nfrom sklearn.compose import ColumnTransformer\n\nimport prepare\n\nNUMERIC = [\"Age\", \"RoomService\", \"FoodCourt\", \"ShoppingMall\", \"Spa\", \"VRDeck\"]\nCATEGORICAL = [\"HomePlanet\", \"Destination\", \"CryoSleep\", \"VIP\"]\nSPENDING = [\"RoomService\", \"FoodCourt\", \"ShoppingMall\", \"Spa\", \"VRDeck\"]\n\n\ndef parse_cabin(cabin_str):\n    \"\"\"Parse Cabin 'F/0/S' into deck, room_num, side.\"\"\"\n    if pd.isna(cabin_str):\n        return np.nan, np.nan, np.nan\n    parts = str(cabin_str).split(\"/\")\n    if len(parts) == 3:\n        return parts[0], int(parts[1]) if parts[1].isdigit() else np.nan, parts[2]\n    return np.nan, np.nan, np.nan\n\n\ndef extract_group_id(passenger_id):\n    \"\"\"Extract group ID from PassengerId (e.g., '0001_01' -> '0001').\"\"\"\n    if pd.isna(passenger_id):\n        return np.nan\n    return str(passenger_id).split(\"_\")[0]\n\n\ndef engineer_features(df):\n    \"\"\"Engineer spending and spending-cryo interaction features.\"\"\"\n    df_copy = df.copy()\n    \n    # Track which rows have any spending data recorded\n    spending_recorded = ~df_copy[SPENDING].isna().any(axis=1)\n    df_copy[\"Spending_Recorded\"] = spending_recorded.astype(int)\n    \n    # Fill missing spending with median per HomePlanet group\n    for col in SPENDING:\n        missing_mask = df_copy[col].isna()\n        if missing_mask.any():\n            group_medians = df_copy.groupby(\"HomePlanet\")[col].median()\n            df_copy.loc[missing_mask, col] = df_copy.loc[missing_mask, \"HomePlanet\"].map(group_medians)\n            global_median = df_copy[col].median()\n            df_copy[col] = df_copy[col].fillna(global_median)\n    \n    # Total spending\n    df_copy[\"TotalSpending\"] = df_copy[SPENDING].sum(axis=1)\n    \n    # Interaction: CryoSleep status and log spending\n    cryo_status = df_copy[\"CryoSleep\"].fillna(False)\n    log_spending = np.log1p(df_copy[\"TotalSpending\"])\n    df_copy[\"CryoSleep_LogSpending\"] = (\n        (cryo_status == True) * log_spending\n    )\n    \n    return df_copy\n\n\ndef add_group_features(df):\n    \"\"\"Add group-level aggregate features based on PassengerId group.\"\"\"\n    df_copy = df.copy()\n    \n    # Extract group ID\n    df_copy[\"GroupId\"] = df_copy[\"PassengerId\"].apply(extract_group_id)\n    \n    # Compute group size\n    group_sizes = df_copy.groupby(\"GroupId\").size()\n    df_copy[\"GroupSize\"] = df_copy[\"GroupId\"].map(group_sizes)\n    \n    # Compute group median total spending\n    group_median_spending = df_copy.groupby(\"GroupId\")[\"TotalSpending\"].median()\n    df_copy[\"GroupMedianSpending\"] = df_copy[\"GroupId\"].map(group_median_spending)\n    \n    return df_copy\n\n\ndef print_eda(df, target_col=\"Transported\"):\n    \"\"\"Print correlation and conditional distributions to guide feature engineering.\"\"\"\n    print(\"\\n=== EDA: Numeric Feature Correlations with Target ===\")\n    numeric_cols = df.select_dtypes(include=[np.number]).columns.tolist()\n    if target_col in numeric_cols:\n        numeric_cols.remove(target_col)\n    \n    target = df[target_col].astype(int)\n    corrs = {}\n    for col in numeric_cols:\n        if col in df.columns:\n            # Compute correlation, filling NaN with median\n            col_filled = df[col].fillna(df[col].median())\n            corr = col_filled.corr(target)\n            corrs[col] = corr\n    \n    # Sort by absolute correlation and print\n    sorted_corrs = sorted(corrs.items(), key=lambda x: abs(x[1]), reverse=True)\n    for col, corr in sorted_corrs:\n        print(f\"  {col:25s}: {corr:7.4f}\")\n    \n    print(\"\\n=== EDA: Categorical Feature Distribution by Target ===\")\n    categorical_cols = [c for c in CATEGORICAL if c in df.columns]\n    for col in categorical_cols:\n        print(f\"\\n  {col}:\")\n        cross = pd.crosstab(df[col].fillna(\"Missing\"), target, margins=False, normalize=\"columns\")\n        print(cross.to_string())\n\n\ndef build_predict_fn():\n    train_df, _ = prepare.load_split()\n    \n    # Run EDA on raw data\n    print_eda(train_df)\n    \n    # Parse Cabin into Deck, RoomNum, Side\n    cabin_data = train_df[\"Cabin\"].apply(parse_cabin)\n    train_df[\"Deck\"] = cabin_data.apply(lambda x: x[0])\n    train_df[\"RoomNum\"] = cabin_data.apply(lambda x: x[1])\n    train_df[\"Side\"] = cabin_data.apply(lambda x: x[2])\n    \n    # Engineer features\n    train_df = engineer_features(train_df)\n    \n    # Add group-level features\n    train_df = add_group_features(train_df)\n    \n    # Create explicit missingness flags for CryoSleep and VIP\n    train_df[\"CryoSleep_Missing\"] = train_df[\"CryoSleep\"].isna().astype(int)\n    train_df[\"VIP_Missing\"] = train_df[\"VIP\"].isna().astype(int)\n    \n    # Convert CryoSleep and VIP to string for categorical encoding\n    train_df[\"CryoSleep\"] = train_df[\"CryoSleep\"].fillna(\"Unknown\").astype(str)\n    train_df[\"VIP\"] = train_df[\"VIP\"].fillna(\"Unknown\").astype(str)\n    \n    # Build feature set (clean baseline from iter 0)\n    feature_cols = (\n        [\"Age\"] + SPENDING + [\"TotalSpending\", \"CryoSleep_LogSpending\", \"Spending_Recorded\"] +\n        CATEGORICAL + \n        [\"Deck\", \"RoomNum\", \"Side\", \"GroupId\"] + \n        [\"CryoSleep_Missing\", \"VIP_Missing\"] +\n        [\"GroupSize\", \"GroupMedianSpending\"]\n    )\n    X = train_df[feature_cols]\n    y = train_df[\"Transported\"].astype(int)\n    \n    # Define preprocessing\n    numeric_transformer = Pipeline([\n        (\"imputer\", SimpleImputer(strategy=\"median\")),\n        (\"scaler\", StandardScaler()),\n    ])\n    \n    categorical_transformer = Pipeline([\n        (\"imputer\", SimpleImputer(strategy=\"most_frequent\")),\n        (\"onehot\", OneHotEncoder(handle_unknown=\"ignore\", sparse_output=False)),\n    ])\n    \n    numeric_feature_cols = (\n        [\"Age\", \"RoomNum\", \"CryoSleep_Missing\", \"VIP_Missing\", \"Spending_Recorded\"] + \n        SPENDING + [\"TotalSpending\", \"CryoSleep_LogSpending\"] +\n        [\"GroupSize\", \"GroupMedianSpending\"]\n    )\n    categorical_feature_cols = CATEGORICAL + [\"Deck\", \"Side\", \"GroupId\"]\n    \n    preprocessor = ColumnTransformer([\n        (\"num\", numeric_transformer, numeric_feature_cols),\n        (\"cat\", categorical_transformer, categorical_feature_cols),\n    ])\n    \n    # Use baseline XGBoost config from iter 0\n    pipe = Pipeline([\n        (\"preprocessor\", preprocessor),\n        (\"clf\", xgb.XGBClassifier(max_depth=6, n_estimators=100, learning_rate=0.1, random_state=42, verbosity=0)),\n    ])\n    \n    pipe.fit(X, y)\n    \n    def predict(X_val):\n        cabin_data = X_val[\"Cabin\"].apply(parse_cabin)\n        X_val_copy = X_val.copy()\n        X_val_copy[\"Deck\"] = cabin_data.apply(lambda x: x[0])\n        X_val_copy[\"RoomNum\"] = cabin_data.apply(lambda x: x[1])\n        X_val_copy[\"Side\"] = cabin_data.apply(lambda x: x[2])\n        \n        # Engineer features\n        X_val_copy = engineer_features(X_val_copy)\n        \n        # Add group-level features from training stats\n        X_val_copy[\"GroupId\"] = X_val_copy[\"PassengerId\"].apply(extract_group_id)\n        X_v