{"iteration": 5, "timestamp": "2026-05-08T22:13:29", "previous_best": 0.8235, "duration_seconds": 6.11, "agent_response_raw": "<reflection>\nIteration 82's hyperparameter changes (n_estimators=200, learning_rate=0.05) regressed the score from 0.8235 to 0.8114. This suggests that either increased regularization is over-damping the model, or the feature set + original hyperparameters (n_estimators=100, learning_rate=0.1) were already well-tuned. I should revert to the exact iter 80 baseline configuration and look for structural improvements elsewhere — different feature engineering or a model-agnostic change.\n</reflection>\n\n<observations>\n- The best score of 0.8235 was achieved in iter 80 with XGBoost (max_depth=6, n_estimators=100, learning_rate=0.1) and a specific set of engineered features (TotalSpending, CryoSleep_LogSpending, Spending_Recorded, group features, missingness flags).\n- Recent hyperparameter tuning (iter 82) decreased the learning_rate and increased n_estimators, which caused regression to 0.8114. This suggests the original hyperparameters were near-optimal for this feature set and data size.\n- The notes indicate several failed attempts at adding new features (AnySpending, Deck_HasSpending) in iter 81, all of which regressed. This suggests the feature set is already well-optimized and adding ad-hoc features is counterproductive.\n- I have not yet explored class imbalance handling (scale_pos_weight) or alternative objective functions (focal loss equivalent in XGBoost), which may help with the small dataset size.\n- The current code is clean and not bloated, so a refactor is not necessary this turn.\n</observations>\n\n<hypothesis>\nThe class imbalance in the target variable (Transported) may not be well-handled by the default XGBoost objective. Adding scale_pos_weight to penalize minority class misclassification more heavily will improve validation accuracy by focusing the model on the harder class.\n</hypothesis>\n\n<plan>\nRevert to iter 80's exact hyperparameters (max_depth=6, n_estimators=100, learning_rate=0.1) and add scale_pos_weight tuned to the class balance of the training set. This is a lightweight, targeted change that addresses a potential learning imbalance without adding complexity or new features.\n</plan>\n\n<code>\n```python\n\"\"\"\ntrain.py — Iteration 83: Restore iter 80 + add scale_pos_weight for class balance.\nRevert hyperparameters to iter 80 baseline; add scale_pos_weight tuning.\n\"\"\"\nimport sys, pathlib\nsys.path.insert(0, str(pathlib.Path(__file__).resolve().parent.parent))\n\nimport pandas as pd\nimport numpy as np\nimport xgboost as xgb\nfrom sklearn.impute import SimpleImputer\nfrom sklearn.pipeline import Pipeline\nfrom sklearn.preprocessing import StandardScaler, OneHotEncoder\nfrom sklearn.compose import ColumnTransformer\n\nimport prepare\n\nNUMERIC = [\"Age\", \"RoomService\", \"FoodCourt\", \"ShoppingMall\", \"Spa\", \"VRDeck\"]\nCATEGORICAL = [\"HomePlanet\", \"Destination\", \"CryoSleep\", \"VIP\"]\nSPENDING = [\"RoomService\", \"FoodCourt\", \"ShoppingMall\", \"Spa\", \"VRDeck\"]\n\n\ndef parse_cabin(cabin_str):\n    \"\"\"Parse Cabin 'F/0/S' into deck, room_num, side.\"\"\"\n    if pd.isna(cabin_str):\n        return np.nan, np.nan, np.nan\n    parts = str(cabin_str).split(\"/\")\n    if len(parts) == 3:\n        return parts[0], int(parts[1]) if parts[1].isdigit() else np.nan, parts[2]\n    return np.nan, np.nan, np.nan\n\n\ndef extract_group_id(passenger_id):\n    \"\"\"Extract group ID from PassengerId (e.g., '0001_01' -> '0001').\"\"\"\n    if pd.isna(passenger_id):\n        return np.nan\n    return str(passenger_id).split(\"_\")[0]\n\n\ndef engineer_features(df):\n    \"\"\"Engineer spending and spending-cryo interaction features.\"\"\"\n    df_copy = df.copy()\n    \n    # Track which rows have any spending data recorded\n    spending_recorded = ~df_copy[SPENDING].isna().any(axis=1)\n    df_copy[\"Spending_Recorded\"] = spending_recorded.astype(int)\n    \n    # Fill missing spending with median per HomePlanet group\n    for col in SPENDING:\n        missing_mask = df_copy[col].isna()\n        if missing_mask.any():\n            group_medians = df_copy.groupby(\"HomePlanet\")[col].median()\n            df_copy.loc[missing_mask, col] = df_copy.loc[missing_mask, \"HomePlanet\"].map(group_medians)\n            global_median = df_copy[col].median()\n            df_copy[col] = df_copy[col].fillna(global_median)\n    \n    # Total spending\n    df_copy[\"TotalSpending\"] = df_copy[SPENDING].sum(axis=1)\n    \n    # Interaction: CryoSleep status and log spending\n    cryo_status = df_copy[\"CryoSleep\"].fillna(False)\n    log_spending = np.log1p(df_copy[\"TotalSpending\"])\n    df_copy[\"CryoSleep_LogSpending\"] = (\n        (cryo_status == True) * log_spending\n    )\n    \n    return df_copy\n\n\ndef add_group_features(df):\n    \"\"\"Add group-level aggregate features based on PassengerId group.\"\"\"\n    df_copy = df.copy()\n    \n    # Extract group ID\n    df_copy[\"GroupId\"] = df_copy[\"PassengerId\"].apply(extract_group_id)\n    \n    # Compute group size\n    group_sizes = df_copy.groupby(\"GroupId\").size()\n    df_copy[\"GroupSize\"] = df_copy[\"GroupId\"].map(group_sizes)\n    \n    # Compute group median total spending\n    group_median_spending = df_copy.groupby(\"GroupId\")[\"TotalSpending\"].median()\n    df_copy[\"GroupMedianSpending\"] = df_copy[\"GroupId\"].map(group_median_spending)\n    \n    return df_copy\n\n\ndef build_predict_fn():\n    train_df, _ = prepare.load_split()\n    \n    # Parse Cabin into Deck, RoomNum, Side\n    cabin_data = train_df[\"Cabin\"].apply(parse_cabin)\n    train_df[\"Deck\"] = cabin_data.apply(lambda x: x[0])\n    train_df[\"RoomNum\"] = cabin_data.apply(lambda x: x[1])\n    train_df[\"Side\"] = cabin_data.apply(lambda x: x[2])\n    \n    # Engineer features\n    train_df = engineer_features(train_df)\n    \n    # Add group-level features\n    train_df = add_group_features(train_df)\n    \n    # Create explicit missingness flags for CryoSleep and VIP\n    train_df[\"CryoSleep_Missing\"] = train_df[\"CryoSleep\"].isna().astype(int)\n    train_df[\"VIP_Missing\"] = train_df[\"VIP\"].isna().astype(int)\n    \n    # Convert CryoSleep and VIP to string for categorical encoding\n    train_df[\"CryoSleep\"] = train_df[\"CryoSleep\"].fillna(\"Unknown\").astype(str)\n    train_df[\"VIP\"] = train_df[\"VIP\"].fillna(\"Unknown\").astype(str)\n    \n    # Build feature set\n    feature_cols = (\n        [\"Age\"] + SPENDING + [\"TotalSpending\", \"CryoSleep_LogSpending\", \"Spending_Recorded\"] +\n        CATEGORICAL + \n        [\"Deck\", \"RoomNum\", \"Side\", \"GroupId\"] + \n        [\"CryoSleep_Missing\", \"VIP_Missing\"] +\n        [\"GroupSize\", \"GroupMedianSpending\"]\n    )\n    X = train_df[feature_cols]\n    y = train_df[\"Transported\"].astype(int)\n    \n    # Define preprocessing\n    numeric_transformer = Pipeline([\n        (\"imputer\", SimpleImputer(strategy=\"median\")),\n        (\"scaler\", StandardScaler()),\n    ])\n    \n    categorical_transformer = Pipeline([\n        (\"imputer\", SimpleImputer(strategy=\"most_frequent\")),\n        (\"onehot\", OneHotEncoder(handle_unknown=\"ignore\", sparse_output=False)),\n    ])\n    \n    numeric_feature_cols = (\n        [\"Age\", \"RoomNum\", \"CryoSleep_Missing\", \"VIP_Missing\", \"Spending_Recorded\"] + \n        SPENDING + [\"TotalSpending\", \"CryoSleep_LogSpending\"] +\n        [\"GroupSize\", \"GroupMedianSpending\"]\n    )\n    categorical_feature_cols = CATEGORICAL + [\"Deck\", \"Side\", \"GroupId\"]\n    \n    preprocessor = ColumnTransformer([\n        (\"num\", numeric_transformer, numeric_feature_cols),\n        (\"cat\", categorical_transformer, categorical_feature_cols),\n    ])\n    \n    # Compute scale_pos_weight for class balance\n    n_negative = (y == 0).sum()\n    n_positive = (y == 1).sum()\n    scale_pos_weight = n_negative / n_positive if n_positive > 0 else 1.0\n    \n    # XGBoost with scale_pos_weight for class balance\n    pipe = Pipeline([\n        (\"preprocessor\", preprocessor),\n        (\"clf\", xgb.XGBClassifier(\n            max_depth=6,\n            n_estimators=100,\n            learning_rate=0.1,\n            scale_pos_weight=scale_pos_weight,\n            random_state=42,\n            verbosity=0\n        )),\n    ])\n    \n    pipe.fit(X, y)\n    \n    def predict(X_val):\n        cabin_data = X_val[\"Cabin\"].apply(parse_cabin)\n        X_val_copy = X_val.copy()\n        X_val_copy[\"Deck\"] = cabin_data.apply(lambda x: x[0])\n        X_val_copy[\"RoomNum\"] = cabin_data.apply(lambda x: x[1])\n        X_val_copy[\"Side\"] = cabin_data.apply(lambda x: x[2])\n        \n        # Engineer features\n        X_val_copy = engineer_features(X_val_copy)\n        \n        # Add group-level features from training stats\n        X_val_copy[\"GroupId\"] = X_val_copy[\"PassengerId\"].apply(extract_group_id)\n        X_val_copy[\"GroupSize\"] = X_val_copy[\"GroupId\"].map(pd.Series(\n            train_df.groupby(\"GroupId\").size().to_dict()\n        ))\n        X_val_copy[\"GroupMedianSpending\"] = X_val_copy[\"GroupId\"].map(pd.Series(\n            train_df.groupby(\"GroupId\")[\"TotalSpending\"].median().to_dict()\n        ))\n        \n        # Missingness flags\n        X_val_copy[\"CryoSleep_Missing\"] = X_val_copy[\"CryoSleep\"].isna().astype(int)\n        X_val_copy[\"VIP_Missing\"] = X_val_copy[\"VIP\"].isna().astype(int)\n        \n        # Handle CryoSleep and VIP\n        X_val_copy[\"CryoSleep\"] = X_val_copy[\"CryoSleep\"].fillna(\"Unknown\").astype(str)\n        X_val_copy[\"VIP\"] = X_val_copy[\"VIP\"].fillna(\"Unknown\").astype(str)\n        \n        return pipe.predict(X_val_copy[feature_cols]).astype(bool)\n    \n    return predict\n\n\nif __name__ == \"__main__\":\n    predict_fn = build_predict_fn()\n    score = prepare.evaluate(predict_fn)\n    print(f\"VAL_ACCURACY: {score:.4f}\")\n```\n</code>\n\n<notes_append>\nIteration 83: Reverted to iter 80 hyperparameters (max_depth=6, n_est=100, lr=0.1) and added scale_pos_weight tuning for class balance. Testing whether addressing class imbalance improves generalization without feature engineering changes.\n</notes_append>", "reflection": "Iteration 82's hyperparameter changes (n_estimators=200, learning_rate=0.05) regressed the score from 0.8235 to 0.8114. This suggests that either increased regularization is over-damping the model, or the feature set + original hyperparameters (n_estimators=100, learning_rate=0.1) were already well-tuned. I should revert to the exact iter 80 baseline configuration and look for structural improvements elsewhere — different feature engineering or a model-agnostic change.", "observations": ["The best score of 0.8235 was achieved in iter 80 with XGBoost (max_depth=6, n_estimators=100, learning_rate=0.1) and a specific set of engineered features (TotalSpending, CryoSleep_LogSpending, Spending_Recorded, group features, missingness flags).", "Recent hyperparameter tuning (iter 82) decreased the learning_rate and increased n_estimators, which caused regression to 0.8114. This suggests the original hyperparameters were near-optimal for this feature set and data size.", "The notes indicate several failed attempts at adding new features (AnySpending, Deck_HasSpending) in iter 81, all of which regressed. This suggests the feature set is already well-optimized and adding ad-hoc features is counterproductive.", "I have not yet explored class imbalance handling (scale_pos_weight) or alternative objective functions (focal loss equivalent in XGBoost), which may help with the small dataset size.", "The current code is clean and not bloated, so a refactor is not necessary this turn."], "hypothesis": "The class imbalance in the target variable (Transported) may not be well-handled by the default XGBoost objective. Adding scale_pos_weight to penalize minority class misclassification more heavily will improve validation accuracy by focusing the model on the harder class.", "plan": "Revert to iter 80's exact hyperparameters (max_depth=6, n_estimators=100, learning_rate=0.1) and add scale_pos_weight tuned to the class balance of the training set. This is a lightweight, targeted change that addresses a potential learning imbalance without adding complexity or new features.", "code": "\"\"\"\ntrain.py — Iteration 83: Restore iter 80 + add scale_pos_weight for class balance.\nRevert hyperparameters to iter 80 baseline; add scale_pos_weight tuning.\n\"\"\"\nimport sys, pathlib\nsys.path.insert(0, str(pathlib.Path(__file__).resolve().parent.parent))\n\nimport pandas as pd\nimport numpy as np\nimport xgboost as xgb\nfrom sklearn.impute import SimpleImputer\nfrom sklearn.pipeline import Pipeline\nfrom sklearn.preprocessing import StandardScaler, OneHotEncoder\nfrom sklearn.compose import ColumnTransformer\n\nimport prepare\n\nNUMERIC = [\"Age\", \"RoomService\", \"FoodCourt\", \"ShoppingMall\", \"Spa\", \"VRDeck\"]\nCATEGORICAL = [\"HomePlanet\", \"Destination\", \"CryoSleep\", \"VIP\"]\nSPENDING = [\"RoomService\", \"FoodCourt\", \"ShoppingMall\", \"Spa\", \"VRDeck\"]\n\n\ndef parse_cabin(cabin_str):\n    \"\"\"Parse Cabin 'F/0/S' into deck, room_num, side.\"\"\"\n    if pd.isna(cabin_str):\n        return np.nan, np.nan, np.nan\n    parts = str(cabin_str).split(\"/\")\n    if len(parts) == 3:\n        return parts[0], int(parts[1]) if parts[1].isdigit() else np.nan, parts[2]\n    return np.nan, np.nan, np.nan\n\n\ndef extract_group_id(passenger_id):\n    \"\"\"Extract group ID from PassengerId (e.g., '0001_01' -> '0001').\"\"\"\n    if pd.isna(passenger_id):\n        return np.nan\n    return str(passenger_id).split(\"_\")[0]\n\n\ndef engineer_features(df):\n    \"\"\"Engineer spending and spending-cryo interaction features.\"\"\"\n    df_copy = df.copy()\n    \n    # Track which rows have any spending data recorded\n    spending_recorded = ~df_copy[SPENDING].isna().any(axis=1)\n    df_copy[\"Spending_Recorded\"] = spending_recorded.astype(int)\n    \n    # Fill missing spending with median per HomePlanet group\n    for col in SPENDING:\n        missing_mask = df_copy[col].isna()\n        if missing_mask.any():\n            group_medians = df_copy.groupby(\"HomePlanet\")[col].median()\n            df_copy.loc[missing_mask, col] = df_copy.loc[missing_mask, \"HomePlanet\"].map(group_medians)\n            global_median = df_copy[col].median()\n            df_copy[col] = df_copy[col].fillna(global_median)\n    \n    # Total spending\n    df_copy[\"TotalSpending\"] = df_copy[SPENDING].sum(axis=1)\n    \n    # Interaction: CryoSleep status and log spending\n    cryo_status = df_copy[\"CryoSleep\"].fillna(False)\n    log_spending = np.log1p(df_copy[\"TotalSpending\"])\n    df_copy[\"CryoSleep_LogSpending\"] = (\n        (cryo_status == True) * log_spending\n    )\n    \n    return df_copy\n\n\ndef add_group_features(df):\n    \"\"\"Add group-level aggregate features based on PassengerId group.\"\"\"\n    df_copy = df.copy()\n    \n    # Extract group ID\n    df_copy[\"GroupId\"] = df_copy[\"PassengerId\"].apply(extract_group_id)\n    \n    # Compute group size\n    group_sizes = df_copy.groupby(\"GroupId\").size()\n    df_copy[\"GroupSize\"] = df_copy[\"GroupId\"].map(group_sizes)\n    \n    # Compute group median total spending\n    group_median_spending = df_copy.groupby(\"GroupId\")[\"TotalSpending\"].median()\n    df_copy[\"GroupMedianSpending\"] = df_copy[\"GroupId\"].map(group_median_spending)\n    \n    return df_copy\n\n\ndef build_predict_fn():\n    train_df, _ = prepare.load_split()\n    \n    # Parse Cabin into Deck, RoomNum, Side\n    cabin_data = train_df[\"Cabin\"].apply(parse_cabin)\n    train_df[\"Deck\"] = cabin_data.apply(lambda x: x[0])\n    train_df[\"RoomNum\"] = cabin_data.apply(lambda x: x[1])\n    train_df[\"Side\"] = cabin_data.apply(lambda x: x[2])\n    \n    # Engineer features\n    train_df = engineer_features(train_df)\n    \n    # Add group-level features\n    train_df = add_group_features(train_df)\n    \n    # Create explicit missingness flags for CryoSleep and VIP\n    train_df[\"CryoSleep_Missing\"] = train_df[\"CryoSleep\"].isna().astype(int)\n    train_df[\"VIP_Missing\"] = train_df[\"VIP\"].isna().astype(int)\n    \n    # Convert CryoSleep and VIP to string for categorical encoding\n    train_df[\"CryoSleep\"] = train_df[\"CryoSleep\"].fillna(\"Unknown\").astype(str)\n    train_df[\"VIP\"] = train_df[\"VIP\"].fillna(\"Unknown\").astype(str)\n    \n    # Build feature set\n    feature_cols = (\n        [\"Age\"] + SPENDING + [\"TotalSpending\", \"CryoSleep_LogSpending\", \"Spending_Recorded\"] +\n        CATEGORICAL + \n        [\"Deck\", \"RoomNum\", \"Side\", \"GroupId\"] + \n        [\"CryoSleep_Missing\", \"VIP_Missing\"] +\n        [\"GroupSize\", \"GroupMedianSpending\"]\n    )\n    X = train_df[feature_cols]\n    y = train_df[\"Transported\"].astype(int)\n    \n    # Define preprocessing\n    numeric_transformer = Pipeline([\n        (\"imputer\", SimpleImputer(strategy=\"median\")),\n        (\"scaler\", StandardScaler()),\n    ])\n    \n    categorical_transformer = Pipeline([\n        (\"imputer\", SimpleImputer(strategy=\"most_frequent\")),\n        (\"onehot\", OneHotEncoder(handle_unknown=\"ignore\", sparse_output=False)),\n    ])\n    \n    numeric_feature_cols = (\n        [\"Age\", \"RoomNum\", \"CryoSleep_Missing\", \"VIP_Missing\", \"Spending_Recorded\"] + \n        SPENDING + [\"TotalSpending\", \"CryoSleep_LogSpending\"] +\n        [\"GroupSize\", \"GroupMedianSpending\"]\n    )\n    categorical_feature_cols = CATEGORICAL + [\"Deck\", \"Side\", \"GroupId\"]\n    \n    preprocessor = ColumnTransformer([\n        (\"num\", numeric_transformer, numeric_feature_cols),\n        (\"cat\", categorical_transformer, categorical_feature_cols),\n    ])\n    \n    # Compute scale_pos_weight for class balance\n    n_negative = (y == 0).sum()\n    n_positive = (y == 1).sum()\n    scale_pos_weight = n_negative / n_positive if n_positive > 0 else 1.0\n    \n    # XGBoost with scale_pos_weight for class balance\n    pipe = Pipeline([\n        (\"preprocessor\", preprocessor),\n        (\"clf\", xgb.XGBClassifier(\n            max_depth=6,\n            n_estimators=100,\n            learning_rate=0.1,\n            scale_pos_weight=scale_pos_weight,\n            random_state=42,\n            verbosity=0\n        )),\n    ])\n    \n    pipe.fit(X, y)\n    \n    def predict(X_val):\n        cabin_data = X_val[\"Cabin\"].apply(parse_cabin)\n        X_val_copy = X_val.copy()\n        X_val_copy[\"Deck\"] = cabin_data.apply(lambda x: x[0])\n        X_val_copy[\"RoomNum\"] = cabin_data.apply(lambda x: x[1])\n        X_val_copy[\"Side\"] = cabin_data.apply(lambda x: x[2])\n        \n        # Engineer features\n        X_val_copy = engineer_features(X_val_copy)\n        \n        # Add group-level features from training stats\n        X_val_copy[\"GroupId\"] = X_val_copy[\"PassengerId\"].apply(extract_group_id)\n        X_val_copy[\"GroupSize\"] = X_val_copy[\"GroupId\"].map(pd.Series(\n            train_df.groupby(\"GroupId\").size().to_dict()\n        ))\n        X_val_copy[\"GroupMedianSpending\"] = X_val_copy[\"GroupId\"].map(pd.Series(\n            train_df.groupby(\"GroupId\")[\"TotalSpending\"].median().to_dict()\n        ))\n        \n        # Missingness flags\n        X_val_copy[\"CryoSleep_Missing\"] = X_val_copy[\"CryoSleep\"].isna().astype(int)\n        X_val_copy[\"VIP_Missing\"] = X_val_copy[\"VIP\"].isna().astype(int)\n        \n        # Handle CryoSleep and VIP\n        X_val_copy[\"CryoSleep\"] = X_val_copy[\"CryoSleep\"].fillna(\"Unknown\").astype(str)\n        X_val_copy[\"VIP\"] = X_val_copy[\"VIP\"].fillna(\"Unknown\").astype(str)\n        \n        return pipe.predict(X_val_copy[feature_cols]).astype(bool)\n    \n    return predict\n\n\nif __name__ == \"__main__\":\n    predict_fn = build_predict_fn()\n    score = prepare.evaluate(predict_fn)\n    print(f\"VAL_ACCURACY: {score:.4f}\")\n", "notes_append": "Iteration 83: Reverted to iter 80 hyperparameters (max_depth=6, n_est=100, lr=0.1) and added scale_pos_weight tuning for class balance. Testing whether addressing class imbalance improves generalization without feature engineering changes.", "stdout": "VAL_ACCURACY: 0.8183\n", "stderr": "", "returncode": 0, "score": 0.8183, "kept": false, "status": "reverted", "commit_hash": null, "input_tokens": 4930, "output_tokens": 3095, "cost_usd": 0.020405}
