{"iteration": 3, "timestamp": "2026-05-08T21:25:02", "previous_best": 0.8189, "duration_seconds": 1.67, "agent_response_raw": "<reflection>\nThe last run attempted EDA but crashed due to a string formatting error in the column name construction (invalid escape sequence). The issue is a typo: `\"\\ \" + col` instead of `\" \" + col`. This is a simple syntax bug that derailed the diagnostic run. The best score remains 0.8189 from iteration 0 (baseline logistic regression). Notes show 39 iterations of plateau-fighting, suggesting the problem needs either structural insight from proper EDA or a fundamentally different approach. I need to fix the EDA script first to understand the data properly before resuming modeling.\n</reflection>\n\n<observations>\n- The crash was caused by an invalid escape sequence in string concatenation (`\"\\ \"` should be `\" \"`). This is a trivial typo but prevented the EDA from running.\n- The notes indicate 39 iterations of hyperparameter tweaking and feature engineering that could not beat 0.8189, suggesting brute-force tuning has reached diminishing returns.\n- Iteration 38 simplified to logistic regression with minimal features but the result is not recorded in notes or best.json, implying it either failed or regressed.\n- The target is well-balanced (3502 transported vs 3452 not transported), so class imbalance is not the issue.\n- Missingness is scattered across most columns (139–169 missing values per column in ~7000 rows), suggesting missing-not-at-random patterns could be signal if explored properly.\n</observations>\n\n<hypothesis>\nRunning a corrected EDA script will reveal which columns have the strongest univariate predictive power and whether missing patterns themselves are predictive. This will guide the next modeling choice toward a simpler, more targeted feature set rather than continuing blind hyperparameter search.\n</hypothesis>\n\n<plan>\nFix the EDA script (correct the string escape sequence) and run it to completion. This will print clean summary statistics, missingness patterns, and correlation/univariate analyses. From that output, I can identify which features matter most and whether missing-ness flags are useful, then return to modeling with a clearer, data-driven hypothesis.\n</plan>\n\n<code>\n```python\n\"\"\"\ntrain.py — EDA to understand data structure before modeling.\nIteration 40: Fix escape sequence bug and run complete EDA to guide feature selection.\n\"\"\"\nimport sys, pathlib\nsys.path.insert(0, str(pathlib.Path(__file__).resolve().parent.parent))\n\nimport pandas as pd\nimport numpy as np\nimport prepare\n\n# Load data\ntrain_df, val_df = prepare.load_split()\n\nprint(\"=\" * 60)\nprint(\"DATASET SHAPE & SUMMARY\")\nprint(\"=\" * 60)\nprint(f\"Train shape: {train_df.shape}\")\nprint(f\"Val shape: {val_df.shape}\")\nprint(\"\\nTarget distribution (train):\")\nprint(train_df[\"Transported\"].value_counts())\n\nprint(\"\\nColumn dtypes:\")\nprint(train_df.dtypes)\n\nprint(\"\\n\" + \"=\" * 60)\nprint(\"MISSINGNESS\")\nprint(\"=\" * 60)\nprint(train_df.isnull().sum())\n\nprint(\"\\n\" + \"=\" * 60)\nprint(\"NUMERIC COLUMNS: SUMMARY STATS BY TRANSPORTED\")\nprint(\"=\" * 60)\nnumeric_cols = [\"Age\", \"RoomService\", \"FoodCourt\", \"ShoppingMall\", \"Spa\", \"VRDeck\"]\nfor col in numeric_cols:\n    transported_mean = train_df[train_df[\"Transported\"] == True][col].mean()\n    not_transported_mean = train_df[train_df[\"Transported\"] == False][col].mean()\n    print(f\"{col:15s} | Transported=T: {transported_mean:8.2f} | Transported=F: {not_transported_mean:8.2f}\")\n\nprint(\"\\n\" + \"=\" * 60)\nprint(\"CATEGORICAL COLUMNS: DISTRIBUTION & TARGET RATE\")\nprint(\"=\" * 60)\ncategorical_cols = [\"HomePlanet\", \"Destination\", \"CryoSleep\", \"VIP\"]\nfor col in categorical_cols:\n    print(f\"\\n{col}:\")\n    dist = train_df.groupby(col)[\"Transported\"].agg([\"count\", \"sum\"])\n    dist[\"transported_rate\"] = dist[\"sum\"] / dist[\"count\"]\n    print(dist)\n\nprint(\"\\n\" + \"=\" * 60)\nprint(\"CABIN PARSING: DECK AND SIDE DISTRIBUTIONS\")\nprint(\"=\" * 60)\n\ndef parse_cabin(cabin_str):\n    \"\"\"Parse Cabin 'F/0/S' into deck, room_num, side.\"\"\"\n    if pd.isna(cabin_str):\n        return np.nan, np.nan, np.nan\n    parts = str(cabin_str).split(\"/\")\n    if len(parts) == 3:\n        return parts[0], int(parts[1]) if parts[1].isdigit() else np.nan, parts[2]\n    return np.nan, np.nan, np.nan\n\ncabin_data = train_df[\"Cabin\"].apply(parse_cabin)\ntrain_df[\"Deck\"] = cabin_data.apply(lambda x: x[0])\ntrain_df[\"Side\"] = cabin_data.apply(lambda x: x[2])\n\nprint(\"\\nDeck distribution & transport rate:\")\ndeck_dist = train_df.groupby(\"Deck\")[\"Transported\"].agg([\"count\", \"sum\"])\ndeck_dist[\"transported_rate\"] = deck_dist[\"sum\"] / deck_dist[\"count\"]\nprint(deck_dist)\n\nprint(\"\\nSide distribution & transport rate:\")\nside_dist = train_df.groupby(\"Side\")[\"Transported\"].agg([\"count\", \"sum\"])\nside_dist[\"transported_rate\"] = side_dist[\"sum\"] / side_dist[\"count\"]\nprint(side_dist)\n\nprint(\"\\n\" + \"=\" * 60)\nprint(\"CORRELATIONS: NUMERIC FEATURES WITH TARGET\")\nprint(\"=\" * 60)\ntotal_spending = train_df[numeric_cols].sum(axis=1)\ncorrelations = pd.DataFrame({\n    \"feature\": numeric_cols + [\"TotalSpending\"],\n    \"correlation_with_transported\": [train_df[col].corr(train_df[\"Transported\"]) for col in numeric_cols] + [total_spending.corr(train_df[\"Transported\"])],\n})\ncorrelations = correlations.sort_values(\"correlation_with_transported\", ascending=False)\nprint(correlations.to_string(index=False))\n\nprint(\"\\n\" + \"=\" * 60)\nprint(\"MISSINGNESS AS SIGNAL: MISSING RATE BY TRANSPORTED\")\nprint(\"=\" * 60)\nall_cols = list(train_df.columns)\nmissing_analysis = []\nfor col in all_cols:\n    if col == \"Transported\":\n        continue\n    missing_count = train_df[col].isnull().sum()\n    if missing_count > 0:\n        missing_rate_transported = train_df[train_df[\"Transported\"] == True][col].isnull().mean()\n        missing_rate_not = train_df[train_df[\"Transported\"] == False][col].isnull().mean()\n        missing_analysis.append({\n            \"column\": col,\n            \"missing_rate_T\": missing_rate_transported,\n            \"missing_rate_F\": missing_rate_not,\n            \"diff\": abs(missing_rate_transported - missing_rate_not),\n        })\n\nif missing_analysis:\n    missing_df = pd.DataFrame(missing_analysis).sort_values(\"diff\", ascending=False)\n    print(missing_df.head(10).to_string(index=False))\n\nprint(\"\\n\" + \"=\" * 60)\nprint(\"END EDA\")\nprint(\"=\" * 60)\nprint(\"VAL_ACCURACY: 0.0000\")\n```\n</code>\n\n<notes_append>\nIteration 40: Fixed EDA script (escape sequence bug) to run data exploration before modeling. Will identify strongest univariate signals and missing-value patterns to guide next model choice away from blind hyperparameter search.\n</notes_append>", "reflection": "The last run attempted EDA but crashed due to a string formatting error in the column name construction (invalid escape sequence). The issue is a typo: `\"\\ \" + col` instead of `\" \" + col`. This is a simple syntax bug that derailed the diagnostic run. The best score remains 0.8189 from iteration 0 (baseline logistic regression). Notes show 39 iterations of plateau-fighting, suggesting the problem needs either structural insight from proper EDA or a fundamentally different approach. I need to fix the EDA script first to understand the data properly before resuming modeling.", "observations": ["The crash was caused by an invalid escape sequence in string concatenation (`\"\\ \"` should be `\" \"`). This is a trivial typo but prevented the EDA from running.", "The notes indicate 39 iterations of hyperparameter tweaking and feature engineering that could not beat 0.8189, suggesting brute-force tuning has reached diminishing returns.", "Iteration 38 simplified to logistic regression with minimal features but the result is not recorded in notes or best.json, implying it either failed or regressed.", "The target is well-balanced (3502 transported vs 3452 not transported), so class imbalance is not the issue.", "Missingness is scattered across most columns (139–169 missing values per column in ~7000 rows), suggesting missing-not-at-random patterns could be signal if explored properly."], "hypothesis": "Running a corrected EDA script will reveal which columns have the strongest univariate predictive power and whether missing patterns themselves are predictive. This will guide the next modeling choice toward a simpler, more targeted feature set rather than continuing blind hyperparameter search.", "plan": "Fix the EDA script (correct the string escape sequence) and run it to completion. This will print clean summary statistics, missingness patterns, and correlation/univariate analyses. From that output, I can identify which features matter most and whether missing-ness flags are useful, then return to modeling with a clearer, data-driven hypothesis.", "code": "\"\"\"\ntrain.py — EDA to understand data structure before modeling.\nIteration 40: Fix escape sequence bug and run complete EDA to guide feature selection.\n\"\"\"\nimport sys, pathlib\nsys.path.insert(0, str(pathlib.Path(__file__).resolve().parent.parent))\n\nimport pandas as pd\nimport numpy as np\nimport prepare\n\n# Load data\ntrain_df, val_df = prepare.load_split()\n\nprint(\"=\" * 60)\nprint(\"DATASET SHAPE & SUMMARY\")\nprint(\"=\" * 60)\nprint(f\"Train shape: {train_df.shape}\")\nprint(f\"Val shape: {val_df.shape}\")\nprint(\"\\nTarget distribution (train):\")\nprint(train_df[\"Transported\"].value_counts())\n\nprint(\"\\nColumn dtypes:\")\nprint(train_df.dtypes)\n\nprint(\"\\n\" + \"=\" * 60)\nprint(\"MISSINGNESS\")\nprint(\"=\" * 60)\nprint(train_df.isnull().sum())\n\nprint(\"\\n\" + \"=\" * 60)\nprint(\"NUMERIC COLUMNS: SUMMARY STATS BY TRANSPORTED\")\nprint(\"=\" * 60)\nnumeric_cols = [\"Age\", \"RoomService\", \"FoodCourt\", \"ShoppingMall\", \"Spa\", \"VRDeck\"]\nfor col in numeric_cols:\n    transported_mean = train_df[train_df[\"Transported\"] == True][col].mean()\n    not_transported_mean = train_df[train_df[\"Transported\"] == False][col].mean()\n    print(f\"{col:15s} | Transported=T: {transported_mean:8.2f} | Transported=F: {not_transported_mean:8.2f}\")\n\nprint(\"\\n\" + \"=\" * 60)\nprint(\"CATEGORICAL COLUMNS: DISTRIBUTION & TARGET RATE\")\nprint(\"=\" * 60)\ncategorical_cols = [\"HomePlanet\", \"Destination\", \"CryoSleep\", \"VIP\"]\nfor col in categorical_cols:\n    print(f\"\\n{col}:\")\n    dist = train_df.groupby(col)[\"Transported\"].agg([\"count\", \"sum\"])\n    dist[\"transported_rate\"] = dist[\"sum\"] / dist[\"count\"]\n    print(dist)\n\nprint(\"\\n\" + \"=\" * 60)\nprint(\"CABIN PARSING: DECK AND SIDE DISTRIBUTIONS\")\nprint(\"=\" * 60)\n\ndef parse_cabin(cabin_str):\n    \"\"\"Parse Cabin 'F/0/S' into deck, room_num, side.\"\"\"\n    if pd.isna(cabin_str):\n        return np.nan, np.nan, np.nan\n    parts = str(cabin_str).split(\"/\")\n    if len(parts) == 3:\n        return parts[0], int(parts[1]) if parts[1].isdigit() else np.nan, parts[2]\n    return np.nan, np.nan, np.nan\n\ncabin_data = train_df[\"Cabin\"].apply(parse_cabin)\ntrain_df[\"Deck\"] = cabin_data.apply(lambda x: x[0])\ntrain_df[\"Side\"] = cabin_data.apply(lambda x: x[2])\n\nprint(\"\\nDeck distribution & transport rate:\")\ndeck_dist = train_df.groupby(\"Deck\")[\"Transported\"].agg([\"count\", \"sum\"])\ndeck_dist[\"transported_rate\"] = deck_dist[\"sum\"] / deck_dist[\"count\"]\nprint(deck_dist)\n\nprint(\"\\nSide distribution & transport rate:\")\nside_dist = train_df.groupby(\"Side\")[\"Transported\"].agg([\"count\", \"sum\"])\nside_dist[\"transported_rate\"] = side_dist[\"sum\"] / side_dist[\"count\"]\nprint(side_dist)\n\nprint(\"\\n\" + \"=\" * 60)\nprint(\"CORRELATIONS: NUMERIC FEATURES WITH TARGET\")\nprint(\"=\" * 60)\ntotal_spending = train_df[numeric_cols].sum(axis=1)\ncorrelations = pd.DataFrame({\n    \"feature\": numeric_cols + [\"TotalSpending\"],\n    \"correlation_with_transported\": [train_df[col].corr(train_df[\"Transported\"]) for col in numeric_cols] + [total_spending.corr(train_df[\"Transported\"])],\n})\ncorrelations = correlations.sort_values(\"correlation_with_transported\", ascending=False)\nprint(correlations.to_string(index=False))\n\nprint(\"\\n\" + \"=\" * 60)\nprint(\"MISSINGNESS AS SIGNAL: MISSING RATE BY TRANSPORTED\")\nprint(\"=\" * 60)\nall_cols = list(train_df.columns)\nmissing_analysis = []\nfor col in all_cols:\n    if col == \"Transported\":\n        continue\n    missing_count = train_df[col].isnull().sum()\n    if missing_count > 0:\n        missing_rate_transported = train_df[train_df[\"Transported\"] == True][col].isnull().mean()\n        missing_rate_not = train_df[train_df[\"Transported\"] == False][col].isnull().mean()\n        missing_analysis.append({\n            \"column\": col,\n            \"missing_rate_T\": missing_rate_transported,\n            \"missing_rate_F\": missing_rate_not,\n            \"diff\": abs(missing_rate_transported - missing_rate_not),\n        })\n\nif missing_analysis:\n    missing_df = pd.DataFrame(missing_analysis).sort_values(\"diff\", ascending=False)\n    print(missing_df.head(10).to_string(index=False))\n\nprint(\"\\n\" + \"=\" * 60)\nprint(\"END EDA\")\nprint(\"=\" * 60)\nprint(\"VAL_ACCURACY: 0.0000\")\n", "notes_append": "Iteration 40: Fixed EDA script (escape sequence bug) to run data exploration before modeling. Will identify strongest univariate signals and missing-value patterns to guide next model choice away from blind hyperparameter search.", "stdout": "=========================\n\nHomePlanet:\n            count   sum  transported_rate\nHomePlanet                               \nEarth        3673  1561          0.424993\nEuropa       1692  1120          0.661939\nMars         1420   738          0.519718\n\nDestination:\n               count   sum  transported_rate\nDestination                                 \n55 Cancri e     1452   876          0.603306\nPSO J318.5-22    655   330          0.503817\nTRAPPIST-1e     4694  2218          0.472518\n\nCryoSleep:\n           count   sum  transported_rate\nCryoSleep                               \nFalse       4350  1426          0.327816\nTrue        2436  1994          0.818555\n\nVIP:\n       count   sum  transported_rate\nVIP                                 \nFalse   6637  3367          0.507308\nTrue     159    59          0.371069\n\n============================================================\nCABIN PARSING: DECK AND SIDE DISTRIBUTIONS\n============================================================\n\nDeck distribution & transport rate:\n      count   sum  transported_rate\nDeck                               \nA       199   101          0.507538\nB       630   464          0.736508\nC       584   391          0.669521\nD       386   173          0.448187\nE       703   260          0.369844\nF      2228   966          0.433573\nG      2059  1067          0.518213\nT         4     1          0.250000\n\nSide distribution & transport rate:\n      count   sum  transported_rate\nSide                               \nP      3381  1532           0.45312\nS      3412  1891           0.55422\n\n============================================================\nCORRELATIONS: NUMERIC FEATURES WITH TARGET\n============================================================\n      feature  correlation_with_transported\n    FoodCourt                      0.049405\n ShoppingMall                     -0.001678\n          Age                     -0.079660\nTotalSpending                     -0.203253\n       VRDeck                     -0.206128\n          Spa                     -0.220299\n  RoomService                     -0.248558\n\n============================================================\nMISSINGNESS AS SIGNAL: MISSING RATE BY TRANSPORTED\n============================================================\n      column  missing_rate_T  missing_rate_F     diff\n   FoodCourt        0.024557        0.019699 0.004859\n         Spa        0.023130        0.019988 0.003141\n RoomService        0.019703        0.022016 0.002313\n         VIP        0.021702        0.023754 0.002052\n         Age        0.019132        0.020857 0.001726\nShoppingMall        0.025128        0.023465 0.001664\n   CryoSleep        0.023415        0.024913 0.001498\n  HomePlanet        0.023701        0.024913 0.001212\n        Side        0.022559        0.023754 0.001196\n       Cabin        0.022559        0.023754 0.001196\n\n============================================================\nEND EDA\n============================================================\nVAL_ACCURACY: 0.0000\n", "stderr": "", "returncode": 0, "score": 0.0, "kept": false, "status": "reverted", "commit_hash": null, "input_tokens": 4927, "output_tokens": 1950, "cost_usd": 0.014676999999999999}
