{"iteration": 5, "timestamp": "2026-05-08T21:19:51", "previous_best": 0.8189, "duration_seconds": 3.69, "agent_response_raw": "<reflection>\nThe last run confirms we're at 0.8189 validation accuracy, which is our best score. Feature importance diagnostics show that HomePlanet_Earth, TotalSpending, and CryoSleep_NoSpending are the top three drivers. The CryoSleep_NoSpending interaction feature (importance 0.0755) and correlation with target (0.4626) validate the hypothesis that this interaction is genuinely predictive. We're no longer in a regressing spiral, and the engineered features appear to have real signal.\n</reflection>\n\n<observations>\n- HomePlanet_Earth dominates with 0.189 importance, suggesting categorical encoding is working well and geography is a strong signal. This is not news but validates basic preprocessing.\n- TotalSpending (importance 0.159) is the second-strongest feature, much stronger than any individual spending category, confirming that aggregate spending (not fine-grained ratios) captures the right level of abstraction.\n- CryoSleep_NoSpending (importance 0.0755, correlation 0.4626) is genuinely valuable—it's in the top 15 features and has the highest single-feature correlation with the target. This validates the interaction hypothesis and suggests that the combination of cryo status and spending behavior is more predictive than either alone.\n- RoomNum (importance 0.0152) is barely contributing despite being engineered. This suggests that cabin deck (Deck_E, Deck_G, etc.) captures spatial structure better than raw room number, and room number may be redundant noise.\n- Age (correlation -0.0797) and RoomNum (correlation -0.0454) have weak correlations with the target, but they're not harmful—they rank outside the top 15 by importance, so they're being deprioritized naturally by the model.\n</observations>\n\n<hypothesis>\nRemoving RoomNum and relying on Deck/Side for spatial structure will reduce feature cardinality without losing signal, potentially improving generalization slightly. RoomNum is barely used by the model (importance 0.0152), and its weak correlation (-0.045) suggests it adds noise rather than signal compared to Deck alone.\n</hypothesis>\n\n<plan>\nRemove RoomNum from the feature set entirely. Keep all other engineering (cabin parsing for Deck/Side, TotalSpending, CryoSleep_NoSpending, GroupId, missingness flags). This simplifies the feature space without removing any high-importance features, which aligns with the soft directive that simpler is better.\n</plan>\n\n<code>\n```python\n\"\"\"\ntrain.py — XGBoost with cabin parsing, GroupId, and cryo-sleep/spending interaction.\nIteration 34: Remove RoomNum feature (importance 0.0152, correlation -0.045) to reduce\nfeature cardinality. Deck/Side are stronger spatial signals.\n\"\"\"\nimport sys, pathlib\nsys.path.insert(0, str(pathlib.Path(__file__).resolve().parent.parent))\n\nimport pandas as pd\nimport numpy as np\nimport xgboost as xgb\nfrom sklearn.impute import SimpleImputer\nfrom sklearn.pipeline import Pipeline\nfrom sklearn.preprocessing import StandardScaler, OneHotEncoder\nfrom sklearn.compose import ColumnTransformer\n\nimport prepare\n\nNUMERIC = [\"Age\", \"RoomService\", \"FoodCourt\", \"ShoppingMall\", \"Spa\", \"VRDeck\"]\nCATEGORICAL = [\"HomePlanet\", \"Destination\", \"CryoSleep\", \"VIP\"]\nSPENDING = [\"RoomService\", \"FoodCourt\", \"ShoppingMall\", \"Spa\", \"VRDeck\"]\n\n\ndef parse_cabin(cabin_str):\n    \"\"\"Parse Cabin 'F/0/S' into deck, room_num, side.\"\"\"\n    if pd.isna(cabin_str):\n        return np.nan, np.nan, np.nan\n    parts = str(cabin_str).split(\"/\")\n    if len(parts) == 3:\n        return parts[0], int(parts[1]) if parts[1].isdigit() else np.nan, parts[2]\n    return np.nan, np.nan, np.nan\n\n\ndef extract_group_id(passenger_id):\n    \"\"\"Extract group ID from PassengerId (e.g., '0001_01' -> '0001').\"\"\"\n    if pd.isna(passenger_id):\n        return np.nan\n    return str(passenger_id).split(\"_\")[0]\n\n\ndef engineer_features(df):\n    \"\"\"Engineer interaction and spending features.\"\"\"\n    df_copy = df.copy()\n    \n    # Fill missing spending with 0\n    for col in SPENDING:\n        df_copy[col] = df_copy[col].fillna(0)\n    \n    # Total spending\n    df_copy[\"TotalSpending\"] = df_copy[SPENDING].sum(axis=1)\n    \n    # Interaction: CryoSleep and zero spending\n    # If CryoSleep is missing, treat as False for this interaction\n    cryo_status = df_copy[\"CryoSleep\"].fillna(False)\n    df_copy[\"CryoSleep_NoSpending\"] = (\n        (cryo_status == True) & (df_copy[\"TotalSpending\"] == 0)\n    ).astype(int)\n    \n    return df_copy\n\n\ndef build_predict_fn():\n    train_df, _ = prepare.load_split()\n    \n    # Parse Cabin into Deck, RoomNum, Side\n    cabin_data = train_df[\"Cabin\"].apply(parse_cabin)\n    train_df[\"Deck\"] = cabin_data.apply(lambda x: x[0])\n    train_df[\"Side\"] = cabin_data.apply(lambda x: x[2])\n    \n    # Extract group ID from PassengerId\n    train_df[\"GroupId\"] = train_df[\"PassengerId\"].apply(extract_group_id)\n    \n    # Engineer features\n    train_df = engineer_features(train_df)\n    \n    # Create explicit missingness flags for CryoSleep and VIP before filling\n    train_df[\"CryoSleep_Missing\"] = train_df[\"CryoSleep\"].isna().astype(int)\n    train_df[\"VIP_Missing\"] = train_df[\"VIP\"].isna().astype(int)\n    \n    # Convert CryoSleep and VIP to string for categorical encoding\n    train_df[\"CryoSleep\"] = train_df[\"CryoSleep\"].fillna(\"Unknown\").astype(str)\n    train_df[\"VIP\"] = train_df[\"VIP\"].fillna(\"Unknown\").astype(str)\n    \n    # Build feature set (no RoomNum)\n    feature_cols = (\n        [\"Age\"] + SPENDING + [\"TotalSpending\", \"CryoSleep_NoSpending\"] +\n        CATEGORICAL + \n        [\"Deck\", \"Side\", \"GroupId\"] + \n        [\"CryoSleep_Missing\", \"VIP_Missing\"]\n    )\n    X = train_df[feature_cols]\n    y = train_df[\"Transported\"].astype(int)\n    \n    # Define preprocessing for numeric and categorical columns\n    numeric_transformer = Pipeline([\n        (\"imputer\", SimpleImputer(strategy=\"median\")),\n        (\"scaler\", StandardScaler()),\n    ])\n    \n    categorical_transformer = Pipeline([\n        (\"imputer\", SimpleImputer(strategy=\"most_frequent\")),\n        (\"onehot\", OneHotEncoder(handle_unknown=\"ignore\", sparse_output=False)),\n    ])\n    \n    numeric_feature_cols = (\n        [\"Age\", \"CryoSleep_Missing\", \"VIP_Missing\"] + \n        SPENDING + [\"TotalSpending\", \"CryoSleep_NoSpending\"]\n    )\n    categorical_feature_cols = CATEGORICAL + [\"Deck\", \"Side\", \"GroupId\"]\n    \n    preprocessor = ColumnTransformer([\n        (\"num\", numeric_transformer, numeric_feature_cols),\n        (\"cat\", categorical_transformer, categorical_feature_cols),\n    ])\n    \n    pipe = Pipeline([\n        (\"preprocessor\", preprocessor),\n        (\"clf\", xgb.XGBClassifier(n_estimators=100, max_depth=6, learning_rate=0.1, random_state=42, verbosity=0)),\n    ])\n    \n    pipe.fit(X, y)\n    \n    def predict(X_val):\n        # Parse Cabin in validation set\n        cabin_data = X_val[\"Cabin\"].apply(parse_cabin)\n        X_val_copy = X_val.copy()\n        X_val_copy[\"Deck\"] = cabin_data.apply(lambda x: x[0])\n        X_val_copy[\"Side\"] = cabin_data.apply(lambda x: x[2])\n        \n        # Extract group ID\n        X_val_copy[\"GroupId\"] = X_val_copy[\"PassengerId\"].apply(extract_group_id)\n        \n        # Engineer features\n        X_val_copy = engineer_features(X_val_copy)\n        \n        # Create explicit missingness flags for CryoSleep and VIP before filling\n        X_val_copy[\"CryoSleep_Missing\"] = X_val_copy[\"CryoSleep\"].isna().astype(int)\n        X_val_copy[\"VIP_Missing\"] = X_val_copy[\"VIP\"].isna().astype(int)\n        \n        # Handle CryoSleep and VIP\n        X_val_copy[\"CryoSleep\"] = X_val_copy[\"CryoSleep\"].fillna(\"Unknown\").astype(str)\n        X_val_copy[\"VIP\"] = X_val_copy[\"VIP\"].fillna(\"Unknown\").astype(str)\n        \n        return pipe.predict(X_val_copy[feature_cols]).astype(bool)\n    \n    return predict\n\n\nif __name__ == \"__main__\":\n    predict_fn = build_predict_fn()\n    score = prepare.evaluate(predict_fn)\n    print(f\"VAL_ACCURACY: {score:.4f}\")\n```\n</code>\n\n<notes_append>\nIteration 34: Removed RoomNum feature (importance 0.0152, weak correlation -0.045) to reduce feature cardinality. Keeping Deck/Side as stronger spatial signals. Hypothesis: simplification without losing high-importance features may improve generalization.\n</notes_append>", "reflection": "The last run confirms we're at 0.8189 validation accuracy, which is our best score. Feature importance diagnostics show that HomePlanet_Earth, TotalSpending, and CryoSleep_NoSpending are the top three drivers. The CryoSleep_NoSpending interaction feature (importance 0.0755) and correlation with target (0.4626) validate the hypothesis that this interaction is genuinely predictive. We're no longer in a regressing spiral, and the engineered features appear to have real signal.", "observations": ["HomePlanet_Earth dominates with 0.189 importance, suggesting categorical encoding is working well and geography is a strong signal. This is not news but validates basic preprocessing.", "TotalSpending (importance 0.159) is the second-strongest feature, much stronger than any individual spending category, confirming that aggregate spending (not fine-grained ratios) captures the right level of abstraction.", "CryoSleep_NoSpending (importance 0.0755, correlation 0.4626) is genuinely valuable—it's in the top 15 features and has the highest single-feature correlation with the target. This validates the interaction hypothesis and suggests that the combination of cryo status and spending behavior is more predictive than either alone.", "RoomNum (importance 0.0152) is barely contributing despite being engineered. This suggests that cabin deck (Deck_E, Deck_G, etc.) captures spatial structure better than raw room number, and room number may be redundant noise.", "Age (correlation -0.0797) and RoomNum (correlation -0.0454) have weak correlations with the target, but they're not harmful—they rank outside the top 15 by importance, so they're being deprioritized naturally by the model."], "hypothesis": "Removing RoomNum and relying on Deck/Side for spatial structure will reduce feature cardinality without losing signal, potentially improving generalization slightly. RoomNum is barely used by the model (importance 0.0152), and its weak correlation (-0.045) suggests it adds noise rather than signal compared to Deck alone.", "plan": "Remove RoomNum from the feature set entirely. Keep all other engineering (cabin parsing for Deck/Side, TotalSpending, CryoSleep_NoSpending, GroupId, missingness flags). This simplifies the feature space without removing any high-importance features, which aligns with the soft directive that simpler is better.", "code": "\"\"\"\ntrain.py — XGBoost with cabin parsing, GroupId, and cryo-sleep/spending interaction.\nIteration 34: Remove RoomNum feature (importance 0.0152, correlation -0.045) to reduce\nfeature cardinality. Deck/Side are stronger spatial signals.\n\"\"\"\nimport sys, pathlib\nsys.path.insert(0, str(pathlib.Path(__file__).resolve().parent.parent))\n\nimport pandas as pd\nimport numpy as np\nimport xgboost as xgb\nfrom sklearn.impute import SimpleImputer\nfrom sklearn.pipeline import Pipeline\nfrom sklearn.preprocessing import StandardScaler, OneHotEncoder\nfrom sklearn.compose import ColumnTransformer\n\nimport prepare\n\nNUMERIC = [\"Age\", \"RoomService\", \"FoodCourt\", \"ShoppingMall\", \"Spa\", \"VRDeck\"]\nCATEGORICAL = [\"HomePlanet\", \"Destination\", \"CryoSleep\", \"VIP\"]\nSPENDING = [\"RoomService\", \"FoodCourt\", \"ShoppingMall\", \"Spa\", \"VRDeck\"]\n\n\ndef parse_cabin(cabin_str):\n    \"\"\"Parse Cabin 'F/0/S' into deck, room_num, side.\"\"\"\n    if pd.isna(cabin_str):\n        return np.nan, np.nan, np.nan\n    parts = str(cabin_str).split(\"/\")\n    if len(parts) == 3:\n        return parts[0], int(parts[1]) if parts[1].isdigit() else np.nan, parts[2]\n    return np.nan, np.nan, np.nan\n\n\ndef extract_group_id(passenger_id):\n    \"\"\"Extract group ID from PassengerId (e.g., '0001_01' -> '0001').\"\"\"\n    if pd.isna(passenger_id):\n        return np.nan\n    return str(passenger_id).split(\"_\")[0]\n\n\ndef engineer_features(df):\n    \"\"\"Engineer interaction and spending features.\"\"\"\n    df_copy = df.copy()\n    \n    # Fill missing spending with 0\n    for col in SPENDING:\n        df_copy[col] = df_copy[col].fillna(0)\n    \n    # Total spending\n    df_copy[\"TotalSpending\"] = df_copy[SPENDING].sum(axis=1)\n    \n    # Interaction: CryoSleep and zero spending\n    # If CryoSleep is missing, treat as False for this interaction\n    cryo_status = df_copy[\"CryoSleep\"].fillna(False)\n    df_copy[\"CryoSleep_NoSpending\"] = (\n        (cryo_status == True) & (df_copy[\"TotalSpending\"] == 0)\n    ).astype(int)\n    \n    return df_copy\n\n\ndef build_predict_fn():\n    train_df, _ = prepare.load_split()\n    \n    # Parse Cabin into Deck, RoomNum, Side\n    cabin_data = train_df[\"Cabin\"].apply(parse_cabin)\n    train_df[\"Deck\"] = cabin_data.apply(lambda x: x[0])\n    train_df[\"Side\"] = cabin_data.apply(lambda x: x[2])\n    \n    # Extract group ID from PassengerId\n    train_df[\"GroupId\"] = train_df[\"PassengerId\"].apply(extract_group_id)\n    \n    # Engineer features\n    train_df = engineer_features(train_df)\n    \n    # Create explicit missingness flags for CryoSleep and VIP before filling\n    train_df[\"CryoSleep_Missing\"] = train_df[\"CryoSleep\"].isna().astype(int)\n    train_df[\"VIP_Missing\"] = train_df[\"VIP\"].isna().astype(int)\n    \n    # Convert CryoSleep and VIP to string for categorical encoding\n    train_df[\"CryoSleep\"] = train_df[\"CryoSleep\"].fillna(\"Unknown\").astype(str)\n    train_df[\"VIP\"] = train_df[\"VIP\"].fillna(\"Unknown\").astype(str)\n    \n    # Build feature set (no RoomNum)\n    feature_cols = (\n        [\"Age\"] + SPENDING + [\"TotalSpending\", \"CryoSleep_NoSpending\"] +\n        CATEGORICAL + \n        [\"Deck\", \"Side\", \"GroupId\"] + \n        [\"CryoSleep_Missing\", \"VIP_Missing\"]\n    )\n    X = train_df[feature_cols]\n    y = train_df[\"Transported\"].astype(int)\n    \n    # Define preprocessing for numeric and categorical columns\n    numeric_transformer = Pipeline([\n        (\"imputer\", SimpleImputer(strategy=\"median\")),\n        (\"scaler\", StandardScaler()),\n    ])\n    \n    categorical_transformer = Pipeline([\n        (\"imputer\", SimpleImputer(strategy=\"most_frequent\")),\n        (\"onehot\", OneHotEncoder(handle_unknown=\"ignore\", sparse_output=False)),\n    ])\n    \n    numeric_feature_cols = (\n        [\"Age\", \"CryoSleep_Missing\", \"VIP_Missing\"] + \n        SPENDING + [\"TotalSpending\", \"CryoSleep_NoSpending\"]\n    )\n    categorical_feature_cols = CATEGORICAL + [\"Deck\", \"Side\", \"GroupId\"]\n    \n    preprocessor = ColumnTransformer([\n        (\"num\", numeric_transformer, numeric_feature_cols),\n        (\"cat\", categorical_transformer, categorical_feature_cols),\n    ])\n    \n    pipe = Pipeline([\n        (\"preprocessor\", preprocessor),\n        (\"clf\", xgb.XGBClassifier(n_estimators=100, max_depth=6, learning_rate=0.1, random_state=42, verbosity=0)),\n    ])\n    \n    pipe.fit(X, y)\n    \n    def predict(X_val):\n        # Parse Cabin in validation set\n        cabin_data = X_val[\"Cabin\"].apply(parse_cabin)\n        X_val_copy = X_val.copy()\n        X_val_copy[\"Deck\"] = cabin_data.apply(lambda x: x[0])\n        X_val_copy[\"Side\"] = cabin_data.apply(lambda x: x[2])\n        \n        # Extract group ID\n        X_val_copy[\"GroupId\"] = X_val_copy[\"PassengerId\"].apply(extract_group_id)\n        \n        # Engineer features\n        X_val_copy = engineer_features(X_val_copy)\n        \n        # Create explicit missingness flags for CryoSleep and VIP before filling\n        X_val_copy[\"CryoSleep_Missing\"] = X_val_copy[\"CryoSleep\"].isna().astype(int)\n        X_val_copy[\"VIP_Missing\"] = X_val_copy[\"VIP\"].isna().astype(int)\n        \n        # Handle CryoSleep and VIP\n        X_val_copy[\"CryoSleep\"] = X_val_copy[\"CryoSleep\"].fillna(\"Unknown\").astype(str)\n        X_val_copy[\"VIP\"] = X_val_copy[\"VIP\"].fillna(\"Unknown\").astype(str)\n        \n        return pipe.predict(X_val_copy[feature_cols]).astype(bool)\n    \n    return predict\n\n\nif __name__ == \"__main__\":\n    predict_fn = build_predict_fn()\n    score = prepare.evaluate(predict_fn)\n    print(f\"VAL_ACCURACY: {score:.4f}\")\n", "notes_append": "Iteration 34: Removed RoomNum feature (importance 0.0152, weak correlation -0.045) to reduce feature cardinality. Keeping Deck/Side as stronger spatial signals. Hypothesis: simplification without losing high-importance features may improve generalization.", "stdout": "VAL_ACCURACY: 0.8091\n", "stderr": "", "returncode": 0, "score": 0.8091, "kept": false, "status": "reverted", "commit_hash": null, "input_tokens": 4732, "output_tokens": 2507, "cost_usd": 0.017267}
