{"iteration": 4, "timestamp": "2026-05-08T20:52:11", "previous_best": 0.7901, "duration_seconds": 4.05, "agent_response_raw": "<reflection>\nThe last three iterations (10, 11, 3) all tried non-linear models (XGBoost, RandomForest) and all regressed below the baseline 0.7901. The revert history suggests that LogisticRegression with the simple feature engineering (Cabin parsing, GroupId, spending-as-zero) is the stable winner. I need to stop chasing tree-based models and instead focus on what might meaningfully improve the linear model — either better feature engineering or regularization tuning.\n</reflection>\n\n<observations>\n- LogisticRegression baseline (iter 9, iter 1) consistently achieves 0.7901, which beats the Kaggle baseline of 0.78. Tree models (RF, XGBoost) drop to 0.7372–0.74xx, suggesting overfitting or that the feature space doesn't reward non-linearity.\n- The current feature set includes Age, 5 spending columns (filled with 0), 4 categorical columns (HomePlanet, Destination, CryoSleep, VIP with Unknown filling), plus Deck/RoomNum/Side/GroupId from Cabin parsing. This is clean and minimal.\n- Spending columns are filled with 0 for missingness, which treats \"no spending\" as a signal. This may be correct, but the assumption is never validated — it could be that NaN and 0 encode different information.\n- CryoSleep and VIP are converted to \"Unknown\" string when missing, then one-hot encoded. This loses the missingness signal as a distinct category if the encoder doesn't treat \"Unknown\" specially.\n- GroupId (extracted from PassengerId prefix) is included but never validated to be predictive. It could be noise or could have real group-structure signal.\n</observations>\n\n<hypothesis>\nAdding a binary flag for missing CryoSleep and missing VIP will allow the model to distinguish between \"unknown\" and \"truly absent,\" because missingness itself may be predictive of transportation. This is a lightweight feature addition that tests whether the current \"Unknown\" string encoding is sufficient or whether explicit missingness indicators help.\n</hypothesis>\n\n<plan>\nI will add two binary features: `CryoSleep_Missing` and `VIP_Missing`, set to 1 when the original value is NaN and 0 otherwise. I will include these in the feature set before filling with \"Unknown\", allowing the one-hot encoder to see both the missingness and the category separately. This is a small, interpretable addition that respects the \"simpler is better\" directive while testing a concrete hypothesis.\n</plan>\n\n<code>\n```python\n\"\"\"\ntrain.py — logistic regression with cabin parsing, GroupId, and explicit missingness flags for CryoSleep and VIP.\n\"\"\"\nimport sys, pathlib\nsys.path.insert(0, str(pathlib.Path(__file__).resolve().parent.parent))\n\nimport pandas as pd\nimport numpy as np\nfrom sklearn.linear_model import LogisticRegression\nfrom sklearn.impute import SimpleImputer\nfrom sklearn.pipeline import Pipeline\nfrom sklearn.preprocessing import StandardScaler, OneHotEncoder\nfrom sklearn.compose import ColumnTransformer\n\nimport prepare\n\nNUMERIC = [\"Age\", \"RoomService\", \"FoodCourt\", \"ShoppingMall\", \"Spa\", \"VRDeck\"]\nCATEGORICAL = [\"HomePlanet\", \"Destination\", \"CryoSleep\", \"VIP\"]\nSPENDING = [\"RoomService\", \"FoodCourt\", \"ShoppingMall\", \"Spa\", \"VRDeck\"]\n\n\ndef parse_cabin(cabin_str):\n    \"\"\"Parse Cabin 'F/0/S' into deck, room_num, side.\"\"\"\n    if pd.isna(cabin_str):\n        return np.nan, np.nan, np.nan\n    parts = str(cabin_str).split(\"/\")\n    if len(parts) == 3:\n        return parts[0], int(parts[1]) if parts[1].isdigit() else np.nan, parts[2]\n    return np.nan, np.nan, np.nan\n\n\ndef extract_group_id(passenger_id):\n    \"\"\"Extract group ID from PassengerId (e.g., '0001_01' -> '0001').\"\"\"\n    if pd.isna(passenger_id):\n        return np.nan\n    return str(passenger_id).split(\"_\")[0]\n\n\ndef build_predict_fn():\n    train_df, _ = prepare.load_split()\n    \n    # Parse Cabin into Deck, RoomNum, Side\n    cabin_data = train_df[\"Cabin\"].apply(parse_cabin)\n    train_df[\"Deck\"] = cabin_data.apply(lambda x: x[0])\n    train_df[\"RoomNum\"] = cabin_data.apply(lambda x: x[1])\n    train_df[\"Side\"] = cabin_data.apply(lambda x: x[2])\n    \n    # Extract group ID from PassengerId\n    train_df[\"GroupId\"] = train_df[\"PassengerId\"].apply(extract_group_id)\n    \n    # Fill missing values in spending columns with 0 (indicates not spent)\n    for col in SPENDING:\n        train_df[col] = train_df[col].fillna(0)\n    \n    # Create explicit missingness flags for CryoSleep and VIP before filling\n    train_df[\"CryoSleep_Missing\"] = train_df[\"CryoSleep\"].isna().astype(int)\n    train_df[\"VIP_Missing\"] = train_df[\"VIP\"].isna().astype(int)\n    \n    # Convert CryoSleep and VIP to string for categorical encoding\n    train_df[\"CryoSleep\"] = train_df[\"CryoSleep\"].fillna(\"Unknown\").astype(str)\n    train_df[\"VIP\"] = train_df[\"VIP\"].fillna(\"Unknown\").astype(str)\n    \n    # Build feature set: core features + cabin parsing + missingness flags\n    feature_cols = (\n        [\"Age\"] + SPENDING + CATEGORICAL + \n        [\"Deck\", \"RoomNum\", \"Side\", \"GroupId\"] + \n        [\"CryoSleep_Missing\", \"VIP_Missing\"]\n    )\n    X = train_df[feature_cols]\n    y = train_df[\"Transported\"].astype(int)\n    \n    # Define preprocessing for numeric and categorical columns\n    numeric_transformer = Pipeline([\n        (\"imputer\", SimpleImputer(strategy=\"median\")),\n        (\"scaler\", StandardScaler()),\n    ])\n    \n    categorical_transformer = Pipeline([\n        (\"imputer\", SimpleImputer(strategy=\"most_frequent\")),\n        (\"onehot\", OneHotEncoder(handle_unknown=\"ignore\", sparse_output=False)),\n    ])\n    \n    preprocessor = ColumnTransformer([\n        (\"num\", numeric_transformer, [\"Age\", \"RoomNum\", \"CryoSleep_Missing\", \"VIP_Missing\"] + SPENDING),\n        (\"cat\", categorical_transformer, CATEGORICAL + [\"Deck\", \"Side\", \"GroupId\"]),\n    ])\n    \n    pipe = Pipeline([\n        (\"preprocessor\", preprocessor),\n        (\"clf\", LogisticRegression(max_iter=1000)),\n    ])\n    \n    pipe.fit(X, y)\n    \n    def predict(X_val):\n        # Parse Cabin in validation set\n        cabin_data = X_val[\"Cabin\"].apply(parse_cabin)\n        X_val_copy = X_val.copy()\n        X_val_copy[\"Deck\"] = cabin_data.apply(lambda x: x[0])\n        X_val_copy[\"RoomNum\"] = cabin_data.apply(lambda x: x[1])\n        X_val_copy[\"Side\"] = cabin_data.apply(lambda x: x[2])\n        \n        # Extract group ID\n        X_val_copy[\"GroupId\"] = X_val_copy[\"PassengerId\"].apply(extract_group_id)\n        \n        # Fill missing spending with 0\n        for col in SPENDING:\n            X_val_copy[col] = X_val_copy[col].fillna(0)\n        \n        # Create explicit missingness flags for CryoSleep and VIP before filling\n        X_val_copy[\"CryoSleep_Missing\"] = X_val_copy[\"CryoSleep\"].isna().astype(int)\n        X_val_copy[\"VIP_Missing\"] = X_val_copy[\"VIP\"].isna().astype(int)\n        \n        # Handle CryoSleep and VIP\n        X_val_copy[\"CryoSleep\"] = X_val_copy[\"CryoSleep\"].fillna(\"Unknown\").astype(str)\n        X_val_copy[\"VIP\"] = X_val_copy[\"VIP\"].fillna(\"Unknown\").astype(str)\n        \n        return pipe.predict(X_val_copy[feature_cols]).astype(bool)\n    \n    return predict\n\n\nif __name__ == \"__main__\":\n    predict_fn = build_predict_fn()\n    score = prepare.evaluate(predict_fn)\n    print(f\"VAL_ACCURACY: {score:.4f}\")\n```\n</code>\n\n<notes_append>\nIteration 12: Added explicit binary missingness flags CryoSleep_Missing and VIP_Missing (set to 1 when original value is NaN) before filling with \"Unknown\". Tests whether missingness itself is predictive beyond the categorical value, keeping LogisticRegression + proven cabin/GroupId engineering. Lightweight addition to explore signal in NaN pattern.\n</notes_append>", "reflection": "The last three iterations (10, 11, 3) all tried non-linear models (XGBoost, RandomForest) and all regressed below the baseline 0.7901. The revert history suggests that LogisticRegression with the simple feature engineering (Cabin parsing, GroupId, spending-as-zero) is the stable winner. I need to stop chasing tree-based models and instead focus on what might meaningfully improve the linear model — either better feature engineering or regularization tuning.", "observations": ["LogisticRegression baseline (iter 9, iter 1) consistently achieves 0.7901, which beats the Kaggle baseline of 0.78. Tree models (RF, XGBoost) drop to 0.7372–0.74xx, suggesting overfitting or that the feature space doesn't reward non-linearity.", "The current feature set includes Age, 5 spending columns (filled with 0), 4 categorical columns (HomePlanet, Destination, CryoSleep, VIP with Unknown filling), plus Deck/RoomNum/Side/GroupId from Cabin parsing. This is clean and minimal.", "Spending columns are filled with 0 for missingness, which treats \"no spending\" as a signal. This may be correct, but the assumption is never validated — it could be that NaN and 0 encode different information.", "CryoSleep and VIP are converted to \"Unknown\" string when missing, then one-hot encoded. This loses the missingness signal as a distinct category if the encoder doesn't treat \"Unknown\" specially.", "GroupId (extracted from PassengerId prefix) is included but never validated to be predictive. It could be noise or could have real group-structure signal."], "hypothesis": "Adding a binary flag for missing CryoSleep and missing VIP will allow the model to distinguish between \"unknown\" and \"truly absent,\" because missingness itself may be predictive of transportation. This is a lightweight feature addition that tests whether the current \"Unknown\" string encoding is sufficient or whether explicit missingness indicators help.", "plan": "I will add two binary features: `CryoSleep_Missing` and `VIP_Missing`, set to 1 when the original value is NaN and 0 otherwise. I will include these in the feature set before filling with \"Unknown\", allowing the one-hot encoder to see both the missingness and the category separately. This is a small, interpretable addition that respects the \"simpler is better\" directive while testing a concrete hypothesis.", "code": "\"\"\"\ntrain.py — logistic regression with cabin parsing, GroupId, and explicit missingness flags for CryoSleep and VIP.\n\"\"\"\nimport sys, pathlib\nsys.path.insert(0, str(pathlib.Path(__file__).resolve().parent.parent))\n\nimport pandas as pd\nimport numpy as np\nfrom sklearn.linear_model import LogisticRegression\nfrom sklearn.impute import SimpleImputer\nfrom sklearn.pipeline import Pipeline\nfrom sklearn.preprocessing import StandardScaler, OneHotEncoder\nfrom sklearn.compose import ColumnTransformer\n\nimport prepare\n\nNUMERIC = [\"Age\", \"RoomService\", \"FoodCourt\", \"ShoppingMall\", \"Spa\", \"VRDeck\"]\nCATEGORICAL = [\"HomePlanet\", \"Destination\", \"CryoSleep\", \"VIP\"]\nSPENDING = [\"RoomService\", \"FoodCourt\", \"ShoppingMall\", \"Spa\", \"VRDeck\"]\n\n\ndef parse_cabin(cabin_str):\n    \"\"\"Parse Cabin 'F/0/S' into deck, room_num, side.\"\"\"\n    if pd.isna(cabin_str):\n        return np.nan, np.nan, np.nan\n    parts = str(cabin_str).split(\"/\")\n    if len(parts) == 3:\n        return parts[0], int(parts[1]) if parts[1].isdigit() else np.nan, parts[2]\n    return np.nan, np.nan, np.nan\n\n\ndef extract_group_id(passenger_id):\n    \"\"\"Extract group ID from PassengerId (e.g., '0001_01' -> '0001').\"\"\"\n    if pd.isna(passenger_id):\n        return np.nan\n    return str(passenger_id).split(\"_\")[0]\n\n\ndef build_predict_fn():\n    train_df, _ = prepare.load_split()\n    \n    # Parse Cabin into Deck, RoomNum, Side\n    cabin_data = train_df[\"Cabin\"].apply(parse_cabin)\n    train_df[\"Deck\"] = cabin_data.apply(lambda x: x[0])\n    train_df[\"RoomNum\"] = cabin_data.apply(lambda x: x[1])\n    train_df[\"Side\"] = cabin_data.apply(lambda x: x[2])\n    \n    # Extract group ID from PassengerId\n    train_df[\"GroupId\"] = train_df[\"PassengerId\"].apply(extract_group_id)\n    \n    # Fill missing values in spending columns with 0 (indicates not spent)\n    for col in SPENDING:\n        train_df[col] = train_df[col].fillna(0)\n    \n    # Create explicit missingness flags for CryoSleep and VIP before filling\n    train_df[\"CryoSleep_Missing\"] = train_df[\"CryoSleep\"].isna().astype(int)\n    train_df[\"VIP_Missing\"] = train_df[\"VIP\"].isna().astype(int)\n    \n    # Convert CryoSleep and VIP to string for categorical encoding\n    train_df[\"CryoSleep\"] = train_df[\"CryoSleep\"].fillna(\"Unknown\").astype(str)\n    train_df[\"VIP\"] = train_df[\"VIP\"].fillna(\"Unknown\").astype(str)\n    \n    # Build feature set: core features + cabin parsing + missingness flags\n    feature_cols = (\n        [\"Age\"] + SPENDING + CATEGORICAL + \n        [\"Deck\", \"RoomNum\", \"Side\", \"GroupId\"] + \n        [\"CryoSleep_Missing\", \"VIP_Missing\"]\n    )\n    X = train_df[feature_cols]\n    y = train_df[\"Transported\"].astype(int)\n    \n    # Define preprocessing for numeric and categorical columns\n    numeric_transformer = Pipeline([\n        (\"imputer\", SimpleImputer(strategy=\"median\")),\n        (\"scaler\", StandardScaler()),\n    ])\n    \n    categorical_transformer = Pipeline([\n        (\"imputer\", SimpleImputer(strategy=\"most_frequent\")),\n        (\"onehot\", OneHotEncoder(handle_unknown=\"ignore\", sparse_output=False)),\n    ])\n    \n    preprocessor = ColumnTransformer([\n        (\"num\", numeric_transformer, [\"Age\", \"RoomNum\", \"CryoSleep_Missing\", \"VIP_Missing\"] + SPENDING),\n        (\"cat\", categorical_transformer, CATEGORICAL + [\"Deck\", \"Side\", \"GroupId\"]),\n    ])\n    \n    pipe = Pipeline([\n        (\"preprocessor\", preprocessor),\n        (\"clf\", LogisticRegression(max_iter=1000)),\n    ])\n    \n    pipe.fit(X, y)\n    \n    def predict(X_val):\n        # Parse Cabin in validation set\n        cabin_data = X_val[\"Cabin\"].apply(parse_cabin)\n        X_val_copy = X_val.copy()\n        X_val_copy[\"Deck\"] = cabin_data.apply(lambda x: x[0])\n        X_val_copy[\"RoomNum\"] = cabin_data.apply(lambda x: x[1])\n        X_val_copy[\"Side\"] = cabin_data.apply(lambda x: x[2])\n        \n        # Extract group ID\n        X_val_copy[\"GroupId\"] = X_val_copy[\"PassengerId\"].apply(extract_group_id)\n        \n        # Fill missing spending with 0\n        for col in SPENDING:\n            X_val_copy[col] = X_val_copy[col].fillna(0)\n        \n        # Create explicit missingness flags for CryoSleep and VIP before filling\n        X_val_copy[\"CryoSleep_Missing\"] = X_val_copy[\"CryoSleep\"].isna().astype(int)\n        X_val_copy[\"VIP_Missing\"] = X_val_copy[\"VIP\"].isna().astype(int)\n        \n        # Handle CryoSleep and VIP\n        X_val_copy[\"CryoSleep\"] = X_val_copy[\"CryoSleep\"].fillna(\"Unknown\").astype(str)\n        X_val_copy[\"VIP\"] = X_val_copy[\"VIP\"].fillna(\"Unknown\").astype(str)\n        \n        return pipe.predict(X_val_copy[feature_cols]).astype(bool)\n    \n    return predict\n\n\nif __name__ == \"__main__\":\n    predict_fn = build_predict_fn()\n    score = prepare.evaluate(predict_fn)\n    print(f\"VAL_ACCURACY: {score:.4f}\")\n", "notes_append": "Iteration 12: Added explicit binary missingness flags CryoSleep_Missing and VIP_Missing (set to 1 when original value is NaN) before filling with \"Unknown\". Tests whether missingness itself is predictive beyond the categorical value, keeping LogisticRegression + proven cabin/GroupId engineering. Lightweight addition to explore signal in NaN pattern.", "stdout": "VAL_ACCURACY: 0.7907\n", "stderr": "", "returncode": 0, "score": 0.7907, "kept": true, "status": "kept", "commit_hash": "a0b5d5d", "input_tokens": 3645, "output_tokens": 2293, "cost_usd": 0.015109999999999998}
