{"iteration": 2, "timestamp": "2026-05-08T22:09:59", "previous_best": 0.8235, "duration_seconds": 3.3, "agent_response_raw": "<reflection>\nIteration 74 regressed to 0.8097 (worse than 0.8235), confirming that reducing XGBoost complexity (max_depth=4, n_est=50) hurts generalization on this dataset. The baseline hyperparameters (max_depth=6, n_est=100) are not overfitting; they're actually necessary for the signal. I should restore the exact iter 0 code and then try a fundamentally different direction — perhaps feature engineering that was previously abandoned deserves another look with the iter 0 hyperparameters locked in place.\n</reflection>\n\n<observations>\n- The regression from 0.8235 → 0.8097 when simplifying XGBoost confirms the baseline hyperparameters are tuned correctly; the model is not overfitting to spurious patterns.\n- Notes show many feature engineering attempts have failed since iter 0 (group features, interactions, spending flags), but all were tested with modified hyperparameters or alongside other changes. None were tested against the locked baseline hyperparameters.\n- The best approach now is to restore iter 0 exactly, then systematically test small, orthogonal feature additions one at a time while keeping hyperparameters frozen at (max_depth=6, n_est=100, lr=0.1).\n- EDA in iter 73 notes confirms RoomService, Spa, VRDeck, and CryoSleep as primary signals; other features contribute less but may add marginal value if engineered carefully.\n- The code has accumulated dead weight (EDA function, unused group feature helpers) that should be removed for clarity and token efficiency.\n</observations>\n\n<hypothesis>\nRestoring the exact iter 0 baseline (Age + 5 spending + 4 categorical + parsed Cabin) with XGBoost (max_depth=6, n_est=100, lr=0.1) will re-achieve 0.8235. Once locked, a single small feature addition (e.g., a binary \"any spending recorded\" flag) may improve the score without regression.\n</hypothesis>\n\n<plan>\nRewrite train.py to restore the exact iter 0 baseline code: minimal, clean, no EDA, no failed feature engineering. Parse Cabin into Deck/RoomNum/Side, use Age + 5 spending columns + 4 categorical features + parsed Cabin features. XGBoost with original hyperparameters. Remove all dead code (print_eda, add_group_features, etc.). This will verify the baseline is solid, then next iteration I can test one orthogonal feature addition.\n</plan>\n\n<code>\n```python\n\"\"\"\ntrain.py — Iteration 75: Restore exact iter 0 baseline code.\nMinimal clean implementation: Age + 5 spending + 4 categorical + parsed Cabin.\nXGBoost max_depth=6, n_est=100, lr=0.1. No EDA, no failed feature engineering.\nExpect 0.8235. Once verified, test single orthogonal feature additions.\n\"\"\"\nimport sys, pathlib\nsys.path.insert(0, str(pathlib.Path(__file__).resolve().parent.parent))\n\nimport pandas as pd\nimport numpy as np\nimport xgboost as xgb\nfrom sklearn.impute import SimpleImputer\nfrom sklearn.pipeline import Pipeline\nfrom sklearn.preprocessing import StandardScaler, OneHotEncoder\nfrom sklearn.compose import ColumnTransformer\n\nimport prepare\n\nNUMERIC = [\"Age\", \"RoomService\", \"FoodCourt\", \"ShoppingMall\", \"Spa\", \"VRDeck\"]\nCATEGORICAL = [\"HomePlanet\", \"Destination\", \"CryoSleep\", \"VIP\"]\nSPENDING = [\"RoomService\", \"FoodCourt\", \"ShoppingMall\", \"Spa\", \"VRDeck\"]\n\n\ndef parse_cabin(cabin_str):\n    \"\"\"Parse Cabin 'F/0/S' into deck, room_num, side.\"\"\"\n    if pd.isna(cabin_str):\n        return np.nan, np.nan, np.nan\n    parts = str(cabin_str).split(\"/\")\n    if len(parts) == 3:\n        return parts[0], int(parts[1]) if parts[1].isdigit() else np.nan, parts[2]\n    return np.nan, np.nan, np.nan\n\n\ndef build_predict_fn():\n    \"\"\"Build and return the prediction function.\"\"\"\n    train_df, _ = prepare.load_split()\n    \n    # Parse Cabin into Deck, RoomNum, Side\n    cabin_data = train_df[\"Cabin\"].apply(parse_cabin)\n    train_df[\"Deck\"] = cabin_data.apply(lambda x: x[0])\n    train_df[\"RoomNum\"] = cabin_data.apply(lambda x: x[1])\n    train_df[\"Side\"] = cabin_data.apply(lambda x: x[2])\n    \n    # Build feature set\n    feature_cols = NUMERIC + CATEGORICAL + [\"Deck\", \"RoomNum\", \"Side\"]\n    X = train_df[feature_cols]\n    y = train_df[\"Transported\"].astype(int)\n    \n    # Define preprocessing\n    numeric_transformer = Pipeline([\n        (\"imputer\", SimpleImputer(strategy=\"median\")),\n        (\"scaler\", StandardScaler()),\n    ])\n    \n    categorical_transformer = Pipeline([\n        (\"imputer\", SimpleImputer(strategy=\"most_frequent\")),\n        (\"onehot\", OneHotEncoder(handle_unknown=\"ignore\", sparse_output=False)),\n    ])\n    \n    numeric_feature_cols = NUMERIC\n    categorical_feature_cols = CATEGORICAL + [\"Deck\", \"Side\"]\n    # RoomNum is numeric but will be imputed in numeric transformer\n    \n    preprocessor = ColumnTransformer([\n        (\"num\", numeric_transformer, numeric_feature_cols),\n        (\"cat\", categorical_transformer, categorical_feature_cols),\n    ])\n    \n    # XGBoost with original baseline hyperparameters\n    pipe = Pipeline([\n        (\"preprocessor\", preprocessor),\n        (\"clf\", xgb.XGBClassifier(\n            max_depth=6,\n            n_estimators=100,\n            learning_rate=0.1,\n            random_state=42,\n            verbosity=0\n        )),\n    ])\n    \n    pipe.fit(X, y)\n    \n    def predict(X_val):\n        \"\"\"Predict on validation set.\"\"\"\n        # Parse Cabin for validation set\n        cabin_data = X_val[\"Cabin\"].apply(parse_cabin)\n        X_val_copy = X_val.copy()\n        X_val_copy[\"Deck\"] = cabin_data.apply(lambda x: x[0])\n        X_val_copy[\"RoomNum\"] = cabin_data.apply(lambda x: x[1])\n        X_val_copy[\"Side\"] = cabin_data.apply(lambda x: x[2])\n        \n        return pipe.predict(X_val_copy[feature_cols]).astype(bool)\n    \n    return predict\n\n\nif __name__ == \"__main__\":\n    predict_fn = build_predict_fn()\n    score = prepare.evaluate(predict_fn)\n    print(f\"VAL_ACCURACY: {score:.4f}\")\n```\n</code>\n\n<notes_append>\nIteration 75: Restored exact iter 0 baseline (Age + 5 spending + 4 categorical + parsed Cabin, XGBoost max_depth=6 n_est=100 lr=0.1). Removed all EDA, group features, and failed engineering to verify baseline is solid at 0.8235. Next: test single orthogonal feature addition (e.g., spending missingness flag) with hyperparameters locked.\n</notes_append>", "reflection": "Iteration 74 regressed to 0.8097 (worse than 0.8235), confirming that reducing XGBoost complexity (max_depth=4, n_est=50) hurts generalization on this dataset. The baseline hyperparameters (max_depth=6, n_est=100) are not overfitting; they're actually necessary for the signal. I should restore the exact iter 0 code and then try a fundamentally different direction — perhaps feature engineering that was previously abandoned deserves another look with the iter 0 hyperparameters locked in place.", "observations": ["The regression from 0.8235 → 0.8097 when simplifying XGBoost confirms the baseline hyperparameters are tuned correctly; the model is not overfitting to spurious patterns.", "Notes show many feature engineering attempts have failed since iter 0 (group features, interactions, spending flags), but all were tested with modified hyperparameters or alongside other changes. None were tested against the locked baseline hyperparameters.", "The best approach now is to restore iter 0 exactly, then systematically test small, orthogonal feature additions one at a time while keeping hyperparameters frozen at (max_depth=6, n_est=100, lr=0.1).", "EDA in iter 73 notes confirms RoomService, Spa, VRDeck, and CryoSleep as primary signals; other features contribute less but may add marginal value if engineered carefully.", "The code has accumulated dead weight (EDA function, unused group feature helpers) that should be removed for clarity and token efficiency."], "hypothesis": "Restoring the exact iter 0 baseline (Age + 5 spending + 4 categorical + parsed Cabin) with XGBoost (max_depth=6, n_est=100, lr=0.1) will re-achieve 0.8235. Once locked, a single small feature addition (e.g., a binary \"any spending recorded\" flag) may improve the score without regression.", "plan": "Rewrite train.py to restore the exact iter 0 baseline code: minimal, clean, no EDA, no failed feature engineering. Parse Cabin into Deck/RoomNum/Side, use Age + 5 spending columns + 4 categorical features + parsed Cabin features. XGBoost with original hyperparameters. Remove all dead code (print_eda, add_group_features, etc.). This will verify the baseline is solid, then next iteration I can test one orthogonal feature addition.", "code": "\"\"\"\ntrain.py — Iteration 75: Restore exact iter 0 baseline code.\nMinimal clean implementation: Age + 5 spending + 4 categorical + parsed Cabin.\nXGBoost max_depth=6, n_est=100, lr=0.1. No EDA, no failed feature engineering.\nExpect 0.8235. Once verified, test single orthogonal feature additions.\n\"\"\"\nimport sys, pathlib\nsys.path.insert(0, str(pathlib.Path(__file__).resolve().parent.parent))\n\nimport pandas as pd\nimport numpy as np\nimport xgboost as xgb\nfrom sklearn.impute import SimpleImputer\nfrom sklearn.pipeline import Pipeline\nfrom sklearn.preprocessing import StandardScaler, OneHotEncoder\nfrom sklearn.compose import ColumnTransformer\n\nimport prepare\n\nNUMERIC = [\"Age\", \"RoomService\", \"FoodCourt\", \"ShoppingMall\", \"Spa\", \"VRDeck\"]\nCATEGORICAL = [\"HomePlanet\", \"Destination\", \"CryoSleep\", \"VIP\"]\nSPENDING = [\"RoomService\", \"FoodCourt\", \"ShoppingMall\", \"Spa\", \"VRDeck\"]\n\n\ndef parse_cabin(cabin_str):\n    \"\"\"Parse Cabin 'F/0/S' into deck, room_num, side.\"\"\"\n    if pd.isna(cabin_str):\n        return np.nan, np.nan, np.nan\n    parts = str(cabin_str).split(\"/\")\n    if len(parts) == 3:\n        return parts[0], int(parts[1]) if parts[1].isdigit() else np.nan, parts[2]\n    return np.nan, np.nan, np.nan\n\n\ndef build_predict_fn():\n    \"\"\"Build and return the prediction function.\"\"\"\n    train_df, _ = prepare.load_split()\n    \n    # Parse Cabin into Deck, RoomNum, Side\n    cabin_data = train_df[\"Cabin\"].apply(parse_cabin)\n    train_df[\"Deck\"] = cabin_data.apply(lambda x: x[0])\n    train_df[\"RoomNum\"] = cabin_data.apply(lambda x: x[1])\n    train_df[\"Side\"] = cabin_data.apply(lambda x: x[2])\n    \n    # Build feature set\n    feature_cols = NUMERIC + CATEGORICAL + [\"Deck\", \"RoomNum\", \"Side\"]\n    X = train_df[feature_cols]\n    y = train_df[\"Transported\"].astype(int)\n    \n    # Define preprocessing\n    numeric_transformer = Pipeline([\n        (\"imputer\", SimpleImputer(strategy=\"median\")),\n        (\"scaler\", StandardScaler()),\n    ])\n    \n    categorical_transformer = Pipeline([\n        (\"imputer\", SimpleImputer(strategy=\"most_frequent\")),\n        (\"onehot\", OneHotEncoder(handle_unknown=\"ignore\", sparse_output=False)),\n    ])\n    \n    numeric_feature_cols = NUMERIC\n    categorical_feature_cols = CATEGORICAL + [\"Deck\", \"Side\"]\n    # RoomNum is numeric but will be imputed in numeric transformer\n    \n    preprocessor = ColumnTransformer([\n        (\"num\", numeric_transformer, numeric_feature_cols),\n        (\"cat\", categorical_transformer, categorical_feature_cols),\n    ])\n    \n    # XGBoost with original baseline hyperparameters\n    pipe = Pipeline([\n        (\"preprocessor\", preprocessor),\n        (\"clf\", xgb.XGBClassifier(\n            max_depth=6,\n            n_estimators=100,\n            learning_rate=0.1,\n            random_state=42,\n            verbosity=0\n        )),\n    ])\n    \n    pipe.fit(X, y)\n    \n    def predict(X_val):\n        \"\"\"Predict on validation set.\"\"\"\n        # Parse Cabin for validation set\n        cabin_data = X_val[\"Cabin\"].apply(parse_cabin)\n        X_val_copy = X_val.copy()\n        X_val_copy[\"Deck\"] = cabin_data.apply(lambda x: x[0])\n        X_val_copy[\"RoomNum\"] = cabin_data.apply(lambda x: x[1])\n        X_val_copy[\"Side\"] = cabin_data.apply(lambda x: x[2])\n        \n        return pipe.predict(X_val_copy[feature_cols]).astype(bool)\n    \n    return predict\n\n\nif __name__ == \"__main__\":\n    predict_fn = build_predict_fn()\n    score = prepare.evaluate(predict_fn)\n    print(f\"VAL_ACCURACY: {score:.4f}\")\n", "notes_append": "Iteration 75: Restored exact iter 0 baseline (Age + 5 spending + 4 categorical + parsed Cabin, XGBoost max_depth=6 n_est=100 lr=0.1). Removed all EDA, group features, and failed engineering to verify baseline is solid at 0.8235. Next: test single orthogonal feature addition (e.g., spending missingness flag) with hyperparameters locked.", "stdout": "VAL_ACCURACY: 0.8114\n", "stderr": "", "returncode": 0, "score": 0.8114, "kept": false, "status": "reverted", "commit_hash": null, "input_tokens": 5258, "output_tokens": 1857, "cost_usd": 0.014543}
