{"iteration": 4, "timestamp": "2026-05-08T23:08:37", "previous_best": 0.8235, "duration_seconds": 12.73, "agent_response_raw": "<reflection>\nThe LightGBM swap (iter 124) regressed from 0.8235 → 0.8160, so that structural change did not help. The baseline XGBoost with the current feature set and engineering is still the best approach at 0.8235. I need to move away from hyperparameter and model-class tweaking toward fresh data inspection or feature construction. The notes suggest that only CryoSleep_Missing and VIP_Missing carry signal among missingness flags, and sparse ID one-hots are valuable. Time to look at the data from a different angle.\n</reflection>\n\n<observations>\n- LightGBM with histogram-based splitting did not improve on XGBoost's 0.8235; the regression to 0.8160 suggests XGBoost's tree structure is better suited to this dataset or the preprocessing pipeline.\n- The notes confirm that adding Age_Missing and RoomNum_Missing features regressed the score, meaning structural missingness in non-boolean columns is not predictive—only the explicit boolean columns (CryoSleep, VIP) gain signal from missingness flags.\n- PassengerId and GroupId as one-hot features are retained because iter 122 showed their removal caused regression; these sparse identifiers encode group membership that improves prediction.\n- The baseline is 0.8235 and has been stable across iterations 80, 120, 123. The main variance comes from feature engineering attempts (failed) and model swaps (failed). No hyperparameter tuning has improved it.\n- I have not yet systematically examined feature correlations, interaction patterns, or whether the cabin parsing is optimal. The hints mention that identifiers can encode group structure and some columns may benefit from different parsing.\n</observations>\n\n<hypothesis>\nThe Cabin column may encode additional signal beyond Deck/RoomNum/Side parsing. Examining the conditional distribution of Transported given Cabin patterns (e.g., by deck or by cabin assignment density) may reveal a feature that directly uses cabin structure without breaking it apart, or a derived feature like \"isolation\" (sparse cabin occupancy on a deck) that predicts transport likelihood.\n</hypothesis>\n\n<plan>\nBefore making any model change, perform exploratory data analysis: load the training data, inspect Cabin structure, compute group-level statistics (size, spending, transport rate by deck), and check correlations between existing features and Transported. This will either reveal a new engineered feature worth adding, or confirm that the current feature set and model are near-optimal and further progress requires tuning with larger data.\n</plan>\n\n<code>\n```python\n\"\"\"\ntrain.py — Iteration 125: Exploratory data analysis before feature engineering.\nRevert to iter 80/123 baseline (0.8235) and add inline diagnostics to understand\ndata structure and feature importance.\n\"\"\"\nimport sys, pathlib\nsys.path.insert(0, str(pathlib.Path(__file__).resolve().parent.parent))\n\nimport pandas as pd\nimport numpy as np\nimport xgboost as xgb\nfrom sklearn.impute import SimpleImputer\nfrom sklearn.pipeline import Pipeline\nfrom sklearn.preprocessing import StandardScaler, OneHotEncoder\nfrom sklearn.compose import ColumnTransformer\n\nimport prepare\n\nNUMERIC = [\"Age\", \"RoomService\", \"FoodCourt\", \"ShoppingMall\", \"Spa\", \"VRDeck\"]\nCATEGORICAL = [\"HomePlanet\", \"Destination\", \"CryoSleep\", \"VIP\"]\nSPENDING = [\"RoomService\", \"FoodCourt\", \"ShoppingMall\", \"Spa\", \"VRDeck\"]\n\n\ndef parse_cabin(cabin_str):\n    \"\"\"Parse Cabin 'F/0/S' into deck, room_num, side.\"\"\"\n    if pd.isna(cabin_str):\n        return np.nan, np.nan, np.nan\n    parts = str(cabin_str).split(\"/\")\n    if len(parts) == 3:\n        return parts[0], int(parts[1]) if parts[1].isdigit() else np.nan, parts[2]\n    return np.nan, np.nan, np.nan\n\n\ndef extract_group_id(passenger_id):\n    \"\"\"Extract group ID from PassengerId (e.g., '0001_01' -> '0001').\"\"\"\n    if pd.isna(passenger_id):\n        return np.nan\n    return str(passenger_id).split(\"_\")[0]\n\n\ndef engineer_features(df):\n    \"\"\"Engineer spending and spending-cryo interaction features.\"\"\"\n    df_copy = df.copy()\n    \n    # Track which rows have any spending data recorded\n    spending_recorded = ~df_copy[SPENDING].isna().any(axis=1)\n    df_copy[\"Spending_Recorded\"] = spending_recorded.astype(int)\n    \n    # Fill missing spending with median per HomePlanet group, then global median\n    for col in SPENDING:\n        missing_mask = df_copy[col].isna()\n        if missing_mask.any():\n            group_medians = df_copy.groupby(\"HomePlanet\")[col].median()\n            df_copy.loc[missing_mask, col] = df_copy.loc[missing_mask, \"HomePlanet\"].map(group_medians)\n            global_median = df_copy[col].median()\n            df_copy[col] = df_copy[col].fillna(global_median)\n    \n    # Total spending\n    df_copy[\"TotalSpending\"] = df_copy[SPENDING].sum(axis=1)\n    \n    # Interaction: CryoSleep status and log spending\n    cryo_status = df_copy[\"CryoSleep\"].fillna(False)\n    log_spending = np.log1p(df_copy[\"TotalSpending\"])\n    df_copy[\"CryoSleep_LogSpending\"] = (cryo_status == True) * log_spending\n    \n    return df_copy\n\n\ndef add_group_features(df):\n    \"\"\"Add group-level aggregate features based on PassengerId group.\"\"\"\n    df_copy = df.copy()\n    \n    # Extract group ID\n    df_copy[\"GroupId\"] = df_copy[\"PassengerId\"].apply(extract_group_id)\n    \n    # Compute group size\n    group_sizes = df_copy.groupby(\"GroupId\").size()\n    df_copy[\"GroupSize\"] = df_copy[\"GroupId\"].map(group_sizes)\n    \n    # Compute group median total spending\n    group_median_spending = df_copy.groupby(\"GroupId\")[\"TotalSpending\"].median()\n    df_copy[\"GroupMedianSpending\"] = df_copy[\"GroupId\"].map(group_median_spending)\n    \n    return df_copy\n\n\ndef build_predict_fn():\n    train_df, _ = prepare.load_split()\n    \n    # Exploratory analysis (printed to STDERR, will not affect stdout output)\n    print(\"\\n=== DATA EXPLORATION ===\", file=sys.stderr)\n    print(f\"Train shape: {train_df.shape}\", file=sys.stderr)\n    print(f\"\\nTransported distribution:\\n{train_df['Transported'].value_counts(dropna=False)}\", file=sys.stderr)\n    print(f\"\\nCabin nulls: {train_df['Cabin'].isna().sum()}\", file=sys.stderr)\n    cabin_data = train_df[\"Cabin\"].apply(parse_cabin)\n    decks = [x[0] for x in cabin_data]\n    deck_counts = pd.Series(decks).value_counts(dropna=False)\n    print(f\"\\nDeck distribution:\\n{deck_counts}\", file=sys.stderr)\n    \n    # Parse Cabin into Deck, RoomNum, Side\n    train_df[\"Deck\"] = cabin_data.apply(lambda x: x[0])\n    train_df[\"RoomNum\"] = cabin_data.apply(lambda x: x[1])\n    train_df[\"Side\"] = cabin_data.apply(lambda x: x[2])\n    \n    # Engineer features\n    train_df = engineer_features(train_df)\n    \n    # Add group-level features\n    train_df = add_group_features(train_df)\n    \n    # Exploration: transport rate by deck\n    deck_transport = train_df.groupby(\"Deck\")[\"Transported\"].agg([\"sum\", \"count\", \"mean\"])\n    print(f\"\\nTransport rate by Deck:\\n{deck_transport}\", file=sys.stderr)\n    \n    # Exploration: group size vs transport\n    group_stats = train_df.groupby(\"GroupId\").agg({\"Transported\": [\"sum\", \"count\", \"mean\"], \"GroupSize\": \"first\"})\n    print(f\"\\nGroup-level stats (first 10):\\n{group_stats.head(10)}\", file=sys.stderr)\n    \n    # Create explicit missingness flags for CryoSleep and VIP only\n    train_df[\"CryoSleep_Missing\"] = train_df[\"CryoSleep\"].isna().astype(int)\n    train_df[\"VIP_Missing\"] = train_df[\"VIP\"].isna().astype(int)\n    \n    # Convert CryoSleep and VIP to string for categorical encoding\n    train_df[\"CryoSleep\"] = train_df[\"CryoSleep\"].fillna(\"Unknown\").astype(str)\n    train_df[\"VIP\"] = train_df[\"VIP\"].fillna(\"Unknown\").astype(str)\n    \n    # Build feature set: order matters for reproducibility\n    feature_cols = (\n        [\"Age\"] + SPENDING + [\"TotalSpending\", \"CryoSleep_LogSpending\", \"Spending_Recorded\"] +\n        CATEGORICAL + \n        [\"Deck\", \"RoomNum\", \"Side\", \"PassengerId\", \"GroupId\"] + \n        [\"CryoSleep_Missing\", \"VIP_Missing\"] +\n        [\"GroupSize\", \"GroupMedianSpending\"]\n    )\n    X = train_df[feature_cols]\n    y = train_df[\"Transported\"].astype(int)\n    \n    # Define preprocessing\n    numeric_transformer = Pipeline([\n        (\"imputer\", SimpleImputer(strategy=\"median\")),\n        (\"scaler\", StandardScaler()),\n    ])\n    \n    categorical_transformer = Pipeline([\n        (\"imputer\", SimpleImputer(strategy=\"most_frequent\")),\n        (\"onehot\", OneHotEncoder(handle_unknown=\"ignore\", sparse_output=False)),\n    ])\n    \n    numeric_feature_cols = (\n        [\"Age\", \"RoomNum\", \"CryoSleep_Missing\", \"VIP_Missing\", \"Spending_Recorded\"] + \n        SPENDING + [\"TotalSpending\", \"CryoSleep_LogSpending\"] +\n        [\"GroupSize\", \"GroupMedianSpending\"]\n    )\n    categorical_feature_cols = CATEGORICAL + [\"Deck\", \"Side\", \"PassengerId\", \"GroupId\"]\n    \n    preprocessor = ColumnTransformer([\n        (\"num\", numeric_transformer, numeric_feature_cols),\n        (\"cat\", categorical_transformer, categorical_feature_cols),\n    ])\n    \n    # XGBoost with iter 80 hyperparameters\n    pipe = Pipeline([\n        (\"preprocessor\", preprocessor),\n        (\"clf\", xgb.XGBClassifier(\n            max_depth=6,\n            n_estimators=100,\n            learning_rate=0.1,\n            random_state=42,\n            verbosity=0\n        )),\n    ])\n    \n    pipe.fit(X, y)\n    \n    def predict(X_val):\n        cabin_data = X_val[\"Cabin\"].apply(parse_cabin)\n        X_val_copy = X_val.copy()\n        X_val_copy[\"Deck\"] = cabin_data.apply(lambda x: x[0])\n        X_val_copy[\"RoomNum\"] = cabin_data.apply(lambda x: x[1])\n        X_val_copy[\"Side\"] = cabin_data.apply(lambda x: x[2])\n        \n        # Engineer features\n        X_val_copy = engineer_features(X_val_copy)\n        \n        # Add group-level features from training stats\n        X_val_copy[\"GroupId\"] = X_val_copy[\"PassengerId\"].apply(extract_group_id)\n        X_val_copy[\"GroupSize\"] = X_val_copy[\"GroupId\"].map(pd.Series(\n            train_df.groupby(\"GroupId\").size().to_dict()\n        ))\n        X_val_copy[\"GroupMedianSpending\"] = X_val_copy[\"GroupId\"].map(pd.Series(\n            train_df.groupby(\"GroupId\")[\"TotalSpending\"].median().to_dict()\n        ))\n        \n        # Missingness flags for CryoSleep and VIP only\n        X_val_copy[\"CryoSleep_Missing\"] = X_val_copy[\"CryoSleep\"].isna().astype(int)\n        X_val_copy[\"VIP_Missing\"] = X_val_copy[\"VIP\"].isna().astype(int)\n        \n        # Handle CryoSleep and VIP\n        X_val_copy[\"CryoSleep\"] = X_val_copy[\"CryoSleep\"].fillna(\"Unknown\").astype(str)\n        X_val_copy[\"VIP\"] = X_val_copy[\"VIP\"].fillna(\"Unknown\").astype(str)\n        \n        return pipe.predict(X_val_copy[feature_cols]).astype(bool)\n    \n    return predict\n\n\nif __name__ == \"__main__\":\n    predict_fn = build_predict_fn()\n    score = prepare.evaluate(predict_fn)\n    print(f\"VAL_ACCURACY: {score:.4f}\")\n```\n</code>\n\n<notes_append>\nIteration 125: Added inline exploratory analysis (transport by deck, group-level stats) printed to stderr to diagnose data structure without affecting stdout. Baseline XGBoost (iter 80/123) still at 0.8235. Next: analyze EDA output to identify new engineering targets (e.g., deck isolation, cabin density patterns).\n</notes_append>", "reflection": "The LightGBM swap (iter 124) regressed from 0.8235 → 0.8160, so that structural change did not help. The baseline XGBoost with the current feature set and engineering is still the best approach at 0.8235. I need to move away from hyperparameter and model-class tweaking toward fresh data inspection or feature construction. The notes suggest that only CryoSleep_Missing and VIP_Missing carry signal among missingness flags, and sparse ID one-hots are valuable. Time to look at the data from a different angle.", "observations": ["LightGBM with histogram-based splitting did not improve on XGBoost's 0.8235; the regression to 0.8160 suggests XGBoost's tree structure is better suited to this dataset or the preprocessing pipeline.", "The notes confirm that adding Age_Missing and RoomNum_Missing features regressed the score, meaning structural missingness in non-boolean columns is not predictive—only the explicit boolean columns (CryoSleep, VIP) gain signal from missingness flags.", "PassengerId and GroupId as one-hot features are retained because iter 122 showed their removal caused regression; these sparse identifiers encode group membership that improves prediction.", "The baseline is 0.8235 and has been stable across iterations 80, 120, 123. The main variance comes from feature engineering attempts (failed) and model swaps (failed). No hyperparameter tuning has improved it.", "I have not yet systematically examined feature correlations, interaction patterns, or whether the cabin parsing is optimal. The hints mention that identifiers can encode group structure and some columns may benefit from different parsing."], "hypothesis": "The Cabin column may encode additional signal beyond Deck/RoomNum/Side parsing. Examining the conditional distribution of Transported given Cabin patterns (e.g., by deck or by cabin assignment density) may reveal a feature that directly uses cabin structure without breaking it apart, or a derived feature like \"isolation\" (sparse cabin occupancy on a deck) that predicts transport likelihood.", "plan": "Before making any model change, perform exploratory data analysis: load the training data, inspect Cabin structure, compute group-level statistics (size, spending, transport rate by deck), and check correlations between existing features and Transported. This will either reveal a new engineered feature worth adding, or confirm that the current feature set and model are near-optimal and further progress requires tuning with larger data.", "code": "\"\"\"\ntrain.py — Iteration 125: Exploratory data analysis before feature engineering.\nRevert to iter 80/123 baseline (0.8235) and add inline diagnostics to understand\ndata structure and feature importance.\n\"\"\"\nimport sys, pathlib\nsys.path.insert(0, str(pathlib.Path(__file__).resolve().parent.parent))\n\nimport pandas as pd\nimport numpy as np\nimport xgboost as xgb\nfrom sklearn.impute import SimpleImputer\nfrom sklearn.pipeline import Pipeline\nfrom sklearn.preprocessing import StandardScaler, OneHotEncoder\nfrom sklearn.compose import ColumnTransformer\n\nimport prepare\n\nNUMERIC = [\"Age\", \"RoomService\", \"FoodCourt\", \"ShoppingMall\", \"Spa\", \"VRDeck\"]\nCATEGORICAL = [\"HomePlanet\", \"Destination\", \"CryoSleep\", \"VIP\"]\nSPENDING = [\"RoomService\", \"FoodCourt\", \"ShoppingMall\", \"Spa\", \"VRDeck\"]\n\n\ndef parse_cabin(cabin_str):\n    \"\"\"Parse Cabin 'F/0/S' into deck, room_num, side.\"\"\"\n    if pd.isna(cabin_str):\n        return np.nan, np.nan, np.nan\n    parts = str(cabin_str).split(\"/\")\n    if len(parts) == 3:\n        return parts[0], int(parts[1]) if parts[1].isdigit() else np.nan, parts[2]\n    return np.nan, np.nan, np.nan\n\n\ndef extract_group_id(passenger_id):\n    \"\"\"Extract group ID from PassengerId (e.g., '0001_01' -> '0001').\"\"\"\n    if pd.isna(passenger_id):\n        return np.nan\n    return str(passenger_id).split(\"_\")[0]\n\n\ndef engineer_features(df):\n    \"\"\"Engineer spending and spending-cryo interaction features.\"\"\"\n    df_copy = df.copy()\n    \n    # Track which rows have any spending data recorded\n    spending_recorded = ~df_copy[SPENDING].isna().any(axis=1)\n    df_copy[\"Spending_Recorded\"] = spending_recorded.astype(int)\n    \n    # Fill missing spending with median per HomePlanet group, then global median\n    for col in SPENDING:\n        missing_mask = df_copy[col].isna()\n        if missing_mask.any():\n            group_medians = df_copy.groupby(\"HomePlanet\")[col].median()\n            df_copy.loc[missing_mask, col] = df_copy.loc[missing_mask, \"HomePlanet\"].map(group_medians)\n            global_median = df_copy[col].median()\n            df_copy[col] = df_copy[col].fillna(global_median)\n    \n    # Total spending\n    df_copy[\"TotalSpending\"] = df_copy[SPENDING].sum(axis=1)\n    \n    # Interaction: CryoSleep status and log spending\n    cryo_status = df_copy[\"CryoSleep\"].fillna(False)\n    log_spending = np.log1p(df_copy[\"TotalSpending\"])\n    df_copy[\"CryoSleep_LogSpending\"] = (cryo_status == True) * log_spending\n    \n    return df_copy\n\n\ndef add_group_features(df):\n    \"\"\"Add group-level aggregate features based on PassengerId group.\"\"\"\n    df_copy = df.copy()\n    \n    # Extract group ID\n    df_copy[\"GroupId\"] = df_copy[\"PassengerId\"].apply(extract_group_id)\n    \n    # Compute group size\n    group_sizes = df_copy.groupby(\"GroupId\").size()\n    df_copy[\"GroupSize\"] = df_copy[\"GroupId\"].map(group_sizes)\n    \n    # Compute group median total spending\n    group_median_spending = df_copy.groupby(\"GroupId\")[\"TotalSpending\"].median()\n    df_copy[\"GroupMedianSpending\"] = df_copy[\"GroupId\"].map(group_median_spending)\n    \n    return df_copy\n\n\ndef build_predict_fn():\n    train_df, _ = prepare.load_split()\n    \n    # Exploratory analysis (printed to STDERR, will not affect stdout output)\n    print(\"\\n=== DATA EXPLORATION ===\", file=sys.stderr)\n    print(f\"Train shape: {train_df.shape}\", file=sys.stderr)\n    print(f\"\\nTransported distribution:\\n{train_df['Transported'].value_counts(dropna=False)}\", file=sys.stderr)\n    print(f\"\\nCabin nulls: {train_df['Cabin'].isna().sum()}\", file=sys.stderr)\n    cabin_data = train_df[\"Cabin\"].apply(parse_cabin)\n    decks = [x[0] for x in cabin_data]\n    deck_counts = pd.Series(decks).value_counts(dropna=False)\n    print(f\"\\nDeck distribution:\\n{deck_counts}\", file=sys.stderr)\n    \n    # Parse Cabin into Deck, RoomNum, Side\n    train_df[\"Deck\"] = cabin_data.apply(lambda x: x[0])\n    train_df[\"RoomNum\"] = cabin_data.apply(lambda x: x[1])\n    train_df[\"Side\"] = cabin_data.apply(lambda x: x[2])\n    \n    # Engineer features\n    train_df = engineer_features(train_df)\n    \n    # Add group-level features\n    train_df = add_group_features(train_df)\n    \n    # Exploration: transport rate by deck\n    deck_transport = train_df.groupby(\"Deck\")[\"Transported\"].agg([\"sum\", \"count\", \"mean\"])\n    print(f\"\\nTransport rate by Deck:\\n{deck_transport}\", file=sys.stderr)\n    \n    # Exploration: group size vs transport\n    group_stats = train_df.groupby(\"GroupId\").agg({\"Transported\": [\"sum\", \"count\", \"mean\"], \"GroupSize\": \"first\"})\n    print(f\"\\nGroup-level stats (first 10):\\n{group_stats.head(10)}\", file=sys.stderr)\n    \n    # Create explicit missingness flags for CryoSleep and VIP only\n    train_df[\"CryoSleep_Missing\"] = train_df[\"CryoSleep\"].isna().astype(int)\n    train_df[\"VIP_Missing\"] = train_df[\"VIP\"].isna().astype(int)\n    \n    # Convert CryoSleep and VIP to string for categorical encoding\n    train_df[\"CryoSleep\"] = train_df[\"CryoSleep\"].fillna(\"Unknown\").astype(str)\n    train_df[\"VIP\"] = train_df[\"VIP\"].fillna(\"Unknown\").astype(str)\n    \n    # Build feature set: order matters for reproducibility\n    feature_cols = (\n        [\"Age\"] + SPENDING + [\"TotalSpending\", \"CryoSleep_LogSpending\", \"Spending_Recorded\"] +\n        CATEGORICAL + \n        [\"Deck\", \"RoomNum\", \"Side\", \"PassengerId\", \"GroupId\"] + \n        [\"CryoSleep_Missing\", \"VIP_Missing\"] +\n        [\"GroupSize\", \"GroupMedianSpending\"]\n    )\n    X = train_df[feature_cols]\n    y = train_df[\"Transported\"].astype(int)\n    \n    # Define preprocessing\n    numeric_transformer = Pipeline([\n        (\"imputer\", SimpleImputer(strategy=\"median\")),\n        (\"scaler\", StandardScaler()),\n    ])\n    \n    categorical_transformer = Pipeline([\n        (\"imputer\", SimpleImputer(strategy=\"most_frequent\")),\n        (\"onehot\", OneHotEncoder(handle_unknown=\"ignore\", sparse_output=False)),\n    ])\n    \n    numeric_feature_cols = (\n        [\"Age\", \"RoomNum\", \"CryoSleep_Missing\", \"VIP_Missing\", \"Spending_Recorded\"] + \n        SPENDING + [\"TotalSpending\", \"CryoSleep_LogSpending\"] +\n        [\"GroupSize\", \"GroupMedianSpending\"]\n    )\n    categorical_feature_cols = CATEGORICAL + [\"Deck\", \"Side\", \"PassengerId\", \"GroupId\"]\n    \n    preprocessor = ColumnTransformer([\n        (\"num\", numeric_transformer, numeric_feature_cols),\n        (\"cat\", categorical_transformer, categorical_feature_cols),\n    ])\n    \n    # XGBoost with iter 80 hyperparameters\n    pipe = Pipeline([\n        (\"preprocessor\", preprocessor),\n        (\"clf\", xgb.XGBClassifier(\n            max_depth=6,\n            n_estimators=100,\n            learning_rate=0.1,\n            random_state=42,\n            verbosity=0\n        )),\n    ])\n    \n    pipe.fit(X, y)\n    \n    def predict(X_val):\n        cabin_data = X_val[\"Cabin\"].apply(parse_cabin)\n        X_val_copy = X_val.copy()\n        X_val_copy[\"Deck\"] = cabin_data.apply(lambda x: x[0])\n        X_val_copy[\"RoomNum\"] = cabin_data.apply(lambda x: x[1])\n        X_val_copy[\"Side\"] = cabin_data.apply(lambda x: x[2])\n        \n        # Engineer features\n        X_val_copy = engineer_features(X_val_copy)\n        \n        # Add group-level features from training stats\n        X_val_copy[\"GroupId\"] = X_val_copy[\"PassengerId\"].apply(extract_group_id)\n        X_val_copy[\"GroupSize\"] = X_val_copy[\"GroupId\"].map(pd.Series(\n          