{"iteration": 3, "timestamp": "2026-05-08T21:16:56", "previous_best": 0.8143, "duration_seconds": 4.88, "agent_response_raw": "<reflection>\nThe script is stable and reproducing the 0.8143 baseline from iteration 0. This is the best score achieved so far. The current approach uses cabin parsing (Deck, RoomNum, Side), GroupId extraction, spending columns filled with zeros, and explicit missingness flags for CryoSleep and VIP. The model is XGBoost with moderate hyperparameters. Since we're at the same score as the baseline and previous iterations of hyperparameter tweaking and feature engineering have either regressed or stalled, I need to investigate the data more deeply to identify structural patterns that haven't been exploited yet.\n</reflection>\n\n<observations>\n- The notes indicate extensive feature engineering (HighSpender, Deck-Side interactions, PassengerId suffix parity) has been tried and either reverted or didn't improve the score, suggesting diminishing returns on ad-hoc feature creation.\n- Iteration 25 removed GroupId and RoomNum and regressed, confirming these features have predictive value; iteration 26 restored them and recovered 0.8143, establishing that cabin-derived features + GroupId are foundational.\n- The hints mention that \"identifier columns can encode group structure\" and \"missing values may not be missing at random.\" GroupId is already used, but I haven't deeply explored whether the group structure itself (group size, group composition) is predictive.\n- The spending columns are filled with zeros, treating \"no spending\" as a meaningful signal. But I haven't tested whether the pattern of which spending columns are missing differs between transported/not-transported passengers.\n- No exploration yet of whether Age interacts with other features, or whether certain cabin decks have different transported rates by age/spending profile.\n</observations>\n\n<hypothesis>\nGroup-level aggregated features (group size, group mean spending, group mode Deck) will improve signal because passengers in the same group share cabins and may have correlated transport outcomes, and the current model treats group membership only as a categorical identifier without capturing group composition patterns.\n</hypothesis>\n\n<plan>\nI will engineer group-level features: GroupSize (count of passengers per group), GroupMeanSpending (mean of total spending across group members), and GroupModeDeck (most common deck in the group). These aggregate group structure into numeric features that capture the \"collective\" properties of a group, which may be more predictive than group ID alone. I'll add these to the feature set and re-train.\n</plan>\n\n<code>\n```python\n\"\"\"\ntrain.py — XGBoost with cabin parsing, GroupId, missingness flags, and group aggregates.\nIteration 27: Add group-level aggregated features (GroupSize, GroupMeanSpending, GroupModeDeck)\nto capture group composition and structure beyond treating GroupId as a categorical.\n\"\"\"\nimport sys, pathlib\nsys.path.insert(0, str(pathlib.Path(__file__).resolve().parent.parent))\n\nimport pandas as pd\nimport numpy as np\nimport xgboost as xgb\nfrom sklearn.impute import SimpleImputer\nfrom sklearn.pipeline import Pipeline\nfrom sklearn.preprocessing import StandardScaler, OneHotEncoder\nfrom sklearn.compose import ColumnTransformer\n\nimport prepare\n\nNUMERIC = [\"Age\", \"RoomService\", \"FoodCourt\", \"ShoppingMall\", \"Spa\", \"VRDeck\"]\nCATEGORICAL = [\"HomePlanet\", \"Destination\", \"CryoSleep\", \"VIP\"]\nSPENDING = [\"RoomService\", \"FoodCourt\", \"ShoppingMall\", \"Spa\", \"VRDeck\"]\n\n\ndef parse_cabin(cabin_str):\n    \"\"\"Parse Cabin 'F/0/S' into deck, room_num, side.\"\"\"\n    if pd.isna(cabin_str):\n        return np.nan, np.nan, np.nan\n    parts = str(cabin_str).split(\"/\")\n    if len(parts) == 3:\n        return parts[0], int(parts[1]) if parts[1].isdigit() else np.nan, parts[2]\n    return np.nan, np.nan, np.nan\n\n\ndef extract_group_id(passenger_id):\n    \"\"\"Extract group ID from PassengerId (e.g., '0001_01' -> '0001').\"\"\"\n    if pd.isna(passenger_id):\n        return np.nan\n    return str(passenger_id).split(\"_\")[0]\n\n\ndef build_predict_fn():\n    train_df, _ = prepare.load_split()\n    \n    # Parse Cabin into Deck, RoomNum, Side\n    cabin_data = train_df[\"Cabin\"].apply(parse_cabin)\n    train_df[\"Deck\"] = cabin_data.apply(lambda x: x[0])\n    train_df[\"RoomNum\"] = cabin_data.apply(lambda x: x[1])\n    train_df[\"Side\"] = cabin_data.apply(lambda x: x[2])\n    \n    # Extract group ID from PassengerId\n    train_df[\"GroupId\"] = train_df[\"PassengerId\"].apply(extract_group_id)\n    \n    # Fill missing values in spending columns with 0 (indicates not spent)\n    for col in SPENDING:\n        train_df[col] = train_df[col].fillna(0)\n    \n    # Create explicit missingness flags for CryoSleep and VIP before filling\n    train_df[\"CryoSleep_Missing\"] = train_df[\"CryoSleep\"].isna().astype(int)\n    train_df[\"VIP_Missing\"] = train_df[\"VIP\"].isna().astype(int)\n    \n    # Convert CryoSleep and VIP to string for categorical encoding\n    train_df[\"CryoSleep\"] = train_df[\"CryoSleep\"].fillna(\"Unknown\").astype(str)\n    train_df[\"VIP\"] = train_df[\"VIP\"].fillna(\"Unknown\").astype(str)\n    \n    # Compute group-level aggregated features\n    train_df[\"TotalSpending\"] = train_df[SPENDING].sum(axis=1)\n    group_stats = train_df.groupby(\"GroupId\").agg({\n        \"PassengerId\": \"count\",  # GroupSize\n        \"TotalSpending\": \"mean\",  # GroupMeanSpending\n        \"Deck\": lambda x: x.mode()[0] if len(x.mode()) > 0 else np.nan,  # GroupModeDeck\n    }).rename(columns={\"PassengerId\": \"GroupSize\", \"TotalSpending\": \"GroupMeanSpending\", \"Deck\": \"GroupModeDeck\"})\n    \n    train_df = train_df.join(group_stats, on=\"GroupId\", rsuffix=\"_agg\")\n    \n    # Build feature set: core features + cabin parsing + missingness flags + group aggregates\n    feature_cols = (\n        [\"Age\"] + SPENDING + CATEGORICAL + \n        [\"Deck\", \"RoomNum\", \"Side\", \"GroupId\"] + \n        [\"CryoSleep_Missing\", \"VIP_Missing\"] +\n        [\"GroupSize\", \"GroupMeanSpending\", \"GroupModeDeck\"]\n    )\n    X = train_df[feature_cols]\n    y = train_df[\"Transported\"].astype(int)\n    \n    # Define preprocessing for numeric and categorical columns\n    numeric_transformer = Pipeline([\n        (\"imputer\", SimpleImputer(strategy=\"median\")),\n        (\"scaler\", StandardScaler()),\n    ])\n    \n    categorical_transformer = Pipeline([\n        (\"imputer\", SimpleImputer(strategy=\"most_frequent\")),\n        (\"onehot\", OneHotEncoder(handle_unknown=\"ignore\", sparse_output=False)),\n    ])\n    \n    preprocessor = ColumnTransformer([\n        (\"num\", numeric_transformer, [\"Age\", \"RoomNum\", \"CryoSleep_Missing\", \"VIP_Missing\", \"GroupSize\", \"GroupMeanSpending\"] + SPENDING),\n        (\"cat\", categorical_transformer, CATEGORICAL + [\"Deck\", \"Side\", \"GroupId\", \"GroupModeDeck\"]),\n    ])\n    \n    pipe = Pipeline([\n        (\"preprocessor\", preprocessor),\n        (\"clf\", xgb.XGBClassifier(n_estimators=100, max_depth=6, learning_rate=0.1, random_state=42, verbosity=0)),\n    ])\n    \n    pipe.fit(X, y)\n    \n    def predict(X_val):\n        # Parse Cabin in validation set\n        cabin_data = X_val[\"Cabin\"].apply(parse_cabin)\n        X_val_copy = X_val.copy()\n        X_val_copy[\"Deck\"] = cabin_data.apply(lambda x: x[0])\n        X_val_copy[\"RoomNum\"] = cabin_data.apply(lambda x: x[1])\n        X_val_copy[\"Side\"] = cabin_data.apply(lambda x: x[2])\n        \n        # Extract group ID\n        X_val_copy[\"GroupId\"] = X_val_copy[\"PassengerId\"].apply(extract_group_id)\n        \n        # Fill missing spending with 0\n        for col in SPENDING:\n            X_val_copy[col] = X_val_copy[col].fillna(0)\n        \n        # Create explicit missingness flags for CryoSleep and VIP before filling\n        X_val_copy[\"CryoSleep_Missing\"] = X_val_copy[\"CryoSleep\"].isna().astype(int)\n        X_val_copy[\"VIP_Missing\"] = X_val_copy[\"VIP\"].isna().astype(int)\n        \n        # Handle CryoSleep and VIP\n        X_val_copy[\"CryoSleep\"] = X_val_copy[\"CryoSleep\"].fillna(\"Unknown\").astype(str)\n        X_val_copy[\"VIP\"] = X_val_copy[\"VIP\"].fillna(\"Unknown\").astype(str)\n        \n        # Compute total spending and group aggregates for validation set\n        X_val_copy[\"TotalSpending\"] = X_val_copy[SPENDING].sum(axis=1)\n        val_group_stats = X_val_copy.groupby(\"GroupId\").agg({\n            \"PassengerId\": \"count\",\n            \"TotalSpending\": \"mean\",\n            \"Deck\": lambda x: x.mode()[0] if len(x.mode()) > 0 else np.nan,\n        }).rename(columns={\"PassengerId\": \"GroupSize\", \"TotalSpending\": \"GroupMeanSpending\", \"Deck\": \"GroupModeDeck\"})\n        \n        X_val_copy = X_val_copy.join(val_group_stats, on=\"GroupId\", rsuffix=\"_agg\")\n        \n        return pipe.predict(X_val_copy[feature_cols]).astype(bool)\n    \n    return predict\n\n\nif __name__ == \"__main__\":\n    predict_fn = build_predict_fn()\n    score = prepare.evaluate(predict_fn)\n    print(f\"VAL_ACCURACY: {score:.4f}\")\n```\n</code>\n\n<notes_append>\nIteration 27: Added group-level aggregates (GroupSize, GroupMeanSpending, GroupModeDeck) to capture collective group properties beyond treating GroupId as categorical. Hypothesis: group composition patterns (size, spending profile, cabin deck concentration) may be more predictive than group ID alone.\n</notes_append>", "reflection": "The script is stable and reproducing the 0.8143 baseline from iteration 0. This is the best score achieved so far. The current approach uses cabin parsing (Deck, RoomNum, Side), GroupId extraction, spending columns filled with zeros, and explicit missingness flags for CryoSleep and VIP. The model is XGBoost with moderate hyperparameters. Since we're at the same score as the baseline and previous iterations of hyperparameter tweaking and feature engineering have either regressed or stalled, I need to investigate the data more deeply to identify structural patterns that haven't been exploited yet.", "observations": ["The notes indicate extensive feature engineering (HighSpender, Deck-Side interactions, PassengerId suffix parity) has been tried and either reverted or didn't improve the score, suggesting diminishing returns on ad-hoc feature creation.", "Iteration 25 removed GroupId and RoomNum and regressed, confirming these features have predictive value; iteration 26 restored them and recovered 0.8143, establishing that cabin-derived features + GroupId are foundational.", "The hints mention that \"identifier columns can encode group structure\" and \"missing values may not be missing at random.\" GroupId is already used, but I haven't deeply explored whether the group structure itself (group size, group composition) is predictive.", "The spending columns are filled with zeros, treating \"no spending\" as a meaningful signal. But I haven't tested whether the pattern of which spending columns are missing differs between transported/not-transported passengers.", "No exploration yet of whether Age interacts with other features, or whether certain cabin decks have different transported rates by age/spending profile."], "hypothesis": "Group-level aggregated features (group size, group mean spending, group mode Deck) will improve signal because passengers in the same group share cabins and may have correlated transport outcomes, and the current model treats group membership only as a categorical identifier without capturing group composition patterns.", "plan": "I will engineer group-level features: GroupSize (count of passengers per group), GroupMeanSpending (mean of total spending across group members), and GroupModeDeck (most common deck in the group). These aggregate group structure into numeric features that capture the \"collective\" properties of a group, which may be more predictive than group ID alone. I'll add these to the feature set and re-train.", "code": "\"\"\"\ntrain.py — XGBoost with cabin parsing, GroupId, missingness flags, and group aggregates.\nIteration 27: Add group-level aggregated features (GroupSize, GroupMeanSpending, GroupModeDeck)\nto capture group composition and structure beyond treating GroupId as a categorical.\n\"\"\"\nimport sys, pathlib\nsys.path.insert(0, str(pathlib.Path(__file__).resolve().parent.parent))\n\nimport pandas as pd\nimport numpy as np\nimport xgboost as xgb\nfrom sklearn.impute import SimpleImputer\nfrom sklearn.pipeline import Pipeline\nfrom sklearn.preprocessing import StandardScaler, OneHotEncoder\nfrom sklearn.compose import ColumnTransformer\n\nimport prepare\n\nNUMERIC = [\"Age\", \"RoomService\", \"FoodCourt\", \"ShoppingMall\", \"Spa\", \"VRDeck\"]\nCATEGORICAL = [\"HomePlanet\", \"Destination\", \"CryoSleep\", \"VIP\"]\nSPENDING = [\"RoomService\", \"FoodCourt\", \"ShoppingMall\", \"Spa\", \"VRDeck\"]\n\n\ndef parse_cabin(cabin_str):\n    \"\"\"Parse Cabin 'F/0/S' into deck, room_num, side.\"\"\"\n    if pd.isna(cabin_str):\n        return np.nan, np.nan, np.nan\n    parts = str(cabin_str).split(\"/\")\n    if len(parts) == 3:\n        return parts[0], int(parts[1]) if parts[1].isdigit() else np.nan, parts[2]\n    return np.nan, np.nan, np.nan\n\n\ndef extract_group_id(passenger_id):\n    \"\"\"Extract group ID from PassengerId (e.g., '0001_01' -> '0001').\"\"\"\n    if pd.isna(passenger_id):\n        return np.nan\n    return str(passenger_id).split(\"_\")[0]\n\n\ndef build_predict_fn():\n    train_df, _ = prepare.load_split()\n    \n    # Parse Cabin into Deck, RoomNum, Side\n    cabin_data = train_df[\"Cabin\"].apply(parse_cabin)\n    train_df[\"Deck\"] = cabin_data.apply(lambda x: x[0])\n    train_df[\"RoomNum\"] = cabin_data.apply(lambda x: x[1])\n    train_df[\"Side\"] = cabin_data.apply(lambda x: x[2])\n    \n    # Extract group ID from PassengerId\n    train_df[\"GroupId\"] = train_df[\"PassengerId\"].apply(extract_group_id)\n    \n    # Fill missing values in spending columns with 0 (indicates not spent)\n    for col in SPENDING:\n        train_df[col] = train_df[col].fillna(0)\n    \n    # Create explicit missingness flags for CryoSleep and VIP before filling\n    train_df[\"CryoSleep_Missing\"] = train_df[\"CryoSleep\"].isna().astype(int)\n    train_df[\"VIP_Missing\"] = train_df[\"VIP\"].isna().astype(int)\n    \n    # Convert CryoSleep and VIP to string for categorical encoding\n    train_df[\"CryoSleep\"] = train_df[\"CryoSleep\"].fillna(\"Unknown\").astype(str)\n    train_df[\"VIP\"] = train_df[\"VIP\"].fillna(\"Unknown\").astype(str)\n    \n    # Compute group-level aggregated features\n    train_df[\"TotalSpending\"] = train_df[SPENDING].sum(axis=1)\n    group_stats = train_df.groupby(\"GroupId\").agg({\n        \"PassengerId\": \"count\",  # GroupSize\n        \"TotalSpending\": \"mean\",  # GroupMeanSpending\n        \"Deck\": lambda x: x.mode()[0] if len(x.mode()) > 0 else np.nan,  # GroupModeDeck\n    }).rename(columns={\"PassengerId\": \"GroupSize\", \"TotalSpending\": \"GroupMeanSpending\", \"Deck\": \"GroupModeDeck\"})\n    \n    train_df = train_df.join(group_stats, on=\"GroupId\", rsuffix=\"_agg\")\n    \n    # Build feature set: core features + cabin parsing + missingness flags + group aggregates\n    feature_cols = (\n        [\"Age\"] + SPENDING + CATEGORICAL + \n        [\"Deck\", \"RoomNum\", \"Side\", \"GroupId\"] + \n        [\"CryoSleep_Missing\", \"VIP_Missing\"] +\n        [\"GroupSize\", \"GroupMeanSpending\", \"GroupModeDeck\"]\n    )\n    X = train_df[feature_cols]\n    y = train_df[\"Transported\"].astype(int)\n    \n    # Define preprocessing for numeric and categorical columns\n    numeric_transformer = Pipeline([\n        (\"imputer\", SimpleImputer(strategy=\"median\")),\n        (\"scaler\", StandardScaler()),\n    ])\n    \n    categorical_transformer = Pipeline([\n        (\"imputer\", SimpleImputer(strategy=\"most_frequent\")),\n        (\"onehot\", OneHotEncoder(handle_unknown=\"ignore\", sparse_output=False)),\n    ])\n    \n    preprocessor = ColumnTransformer([\n        (\"num\", numeric_transformer, [\"Age\", \"RoomNum\", \"CryoSleep_Missing\", \"VIP_Missing\", \"GroupSize\", \"GroupMeanSpending\"] + SPENDING),\n        (\"cat\", categorical_transformer, CATEGORICAL + [\"Deck\", \"Side\", \"GroupId\", \"GroupModeDeck\"]),\n    ])\n    \n    pipe = Pipeline([\n        (\"preprocessor\", preprocessor),\n        (\"clf\", xgb.XGBClassifier(n_estimators=100, max_depth=6, learning_rate=0.1, random_state=42, verbosity=0)),\n    ])\n    \n    pipe.fit(X, y)\n    \n    def predict(X_val):\n        # Parse Cabin in validation set\n        cabin_data = X_val[\"Cabin\"].apply(parse_cabin)\n        X_val_copy = X_val.copy()\n        X_val_copy[\"Deck\"] = cabin_data.apply(lambda x: x[0])\n        X_val_copy[\"RoomNum\"] = cabin_data.apply(lambda x: x[1])\n        X_val_copy[\"Side\"] = cabin_data.apply(lambda x: x[2])\n        \n        # Extract group ID\n        X_val_copy[\"GroupId\"] = X_val_copy[\"PassengerId\"].apply(extract_group_id)\n        \n        # Fill missing spending with 0\n        for col in SPENDING:\n            X_val_copy[col] = X_val_copy[col].fillna(0)\n        \n        # Create explicit missingness flags for CryoSleep and VIP before filling\n        X_val_copy[\"CryoSleep_Missing\"] = X_val_copy[\"CryoSleep\"].isna().astype(int)\n        X_val_copy[\"VIP_Missing\"] = X_val_copy[\"VIP\"].isna().astype(int)\n        \n        # Handle CryoSleep and VIP\n        X_val_copy[\"CryoSleep\"] = X_val_copy[\"CryoSleep\"].fillna(\"Unknown\").astype(str)\n        X_val_copy[\"VIP\"] = X_val_copy[\"VIP\"].fillna(\"Unknown\").astype(str)\n        \n        # Compute total spending and group aggregates for validation set\n        X_val_copy[\"TotalSpending\"] = X_val_copy[SPENDING].sum(axis=1)\n        val_group_stats = X_val_copy.groupby(\"GroupId\").agg({\n            \"PassengerId\": \"count\",\n            \"TotalSpending\": \"mean\",\n            \"Deck\": lambda x: x.mode()[0] if len(x.mode()) > 0 else np.nan,\n        }).rename(columns={\"PassengerId\": \"GroupSize\", \"TotalSpending\": \"GroupMeanSpending\", \"Deck\": \"GroupModeDeck\"})\n        \n        X_val_copy = X_val_copy.join(val_group_stats, on=\"GroupId\", rsuffix=\"_agg\")\n        \n        return pipe.predict(X_val_copy[feature_cols]).astype(bool)\n    \n    return predict\n\n\nif __name__ == \"__main__\":\n    predict_fn = build_predict_fn()\n    score = prepare.evaluate(predict_fn)\n    print(f\"VAL_ACCURACY: {score:.4f}\")\n", "notes_append": "Iteration 27: Added group-level aggregates (GroupSize, GroupMeanSpending, GroupModeDeck) to capture collective group properties beyond treating GroupId as categorical. Hypothesis: group composition patterns (size, spending profile, cabin deck concentration) may be more predictive than group ID alone.", "stdout": "VAL_ACCURACY: 0.8051\n", "stderr": "", "returncode": 0, "score": 0.8051, "kept": false, "status": "reverted", "commit_hash": null, "input_tokens": 3952, "output_tokens": 2729, "cost_usd": 0.017597}
