{"iteration": 5, "timestamp": "2026-05-08T20:34:13", "previous_best": 0.7901, "duration_seconds": 4.07, "agent_response_raw": "<reflection>\nThe current best score is 0.7901, achieved in iteration 2 and re-confirmed in iteration 5 with the logistic regression pipeline that includes cabin parsing, group ID extraction, categorical encoding with one-hot, and spending-as-zero filling. The model is stable and has not improved beyond this point despite trying XGBoost. The baseline was 0.78, so we are 1% above baseline. Now I need to look deeper at the data structure to find additional signal that the current features are missing.\n</reflection>\n\n<observations>\n- The current feature set includes parsed cabin components (Deck, RoomNum, Side), group ID, spending patterns, and basic demographics (Age, HomePlanet, Destination, CryoSleep, VIP), but RoomNum and Side are added as categorical/numeric features without explicit investigation of their predictive power.\n- CryoSleep and VIP are boolean columns with missing values; the current approach fills them as \"Unknown\" which treats missingness as a category. This is reasonable, but we haven't validated whether missingness itself or the original boolean encoding carries more signal.\n- The SPENDING columns (RoomService, FoodCourt, ShoppingMall, Spa, VRDeck) are filled with 0 for missing values, treating \"not recorded\" as \"did not spend.\" A binary \"spent_anything\" flag or total spending amount might capture variance better than individual columns.\n- No interaction features have been engineered (e.g., total spending, spending per deck, age×cryosleep interactions), which logistic regression would benefit from if such interactions exist in the data.\n- The GroupId feature assumes passengers in the same group (same PassengerId prefix) share similar transport outcomes, but we haven't validated this or tried encoding group size as a feature.\n</observations>\n\n<hypothesis>\nCreating aggregate spending features (total spending, binary \"spent anything\" indicator) and adding group size as a feature will improve signal by capturing economic behavior patterns and family/group dynamics that individual spending columns may not represent clearly to logistic regression.\n</hypothesis>\n\n<plan>\nI will add two engineered features: (1) TotalSpending = sum of all spending columns (replacing individual columns may be too aggressive, so I'll keep both), and (2) GroupSize = count of passengers in the same group within the training set. These capture aggregate economic behavior and group cohesion, which may be predictive of transport outcomes.\n</plan>\n\n<code>\n```python\n\"\"\"\ntrain.py — logistic regression with cabin parsing, group features, and aggregate spending.\n\"\"\"\nimport sys, pathlib\nsys.path.insert(0, str(pathlib.Path(__file__).resolve().parent.parent))\n\nimport pandas as pd\nimport numpy as np\nfrom sklearn.linear_model import LogisticRegression\nfrom sklearn.impute import SimpleImputer\nfrom sklearn.pipeline import Pipeline\nfrom sklearn.preprocessing import StandardScaler, OneHotEncoder\nfrom sklearn.compose import ColumnTransformer\n\nimport prepare\n\nNUMERIC = [\"Age\", \"RoomService\", \"FoodCourt\", \"ShoppingMall\", \"Spa\", \"VRDeck\"]\nCATEGORICAL = [\"HomePlanet\", \"Destination\", \"CryoSleep\", \"VIP\"]\nSPENDING = [\"RoomService\", \"FoodCourt\", \"ShoppingMall\", \"Spa\", \"VRDeck\"]\n\n\ndef parse_cabin(cabin_str):\n    \"\"\"Parse Cabin 'F/0/S' into deck, room_num, side.\"\"\"\n    if pd.isna(cabin_str):\n        return np.nan, np.nan, np.nan\n    parts = str(cabin_str).split(\"/\")\n    if len(parts) == 3:\n        return parts[0], int(parts[1]) if parts[1].isdigit() else np.nan, parts[2]\n    return np.nan, np.nan, np.nan\n\n\ndef extract_group_id(passenger_id):\n    \"\"\"Extract group ID from PassengerId (e.g., '0001_01' -> '0001').\"\"\"\n    if pd.isna(passenger_id):\n        return np.nan\n    return str(passenger_id).split(\"_\")[0]\n\n\ndef build_predict_fn():\n    train_df, _ = prepare.load_split()\n    \n    # Parse Cabin into Deck, RoomNum, Side\n    cabin_data = train_df[\"Cabin\"].apply(parse_cabin)\n    train_df[\"Deck\"] = cabin_data.apply(lambda x: x[0])\n    train_df[\"RoomNum\"] = cabin_data.apply(lambda x: x[1])\n    train_df[\"Side\"] = cabin_data.apply(lambda x: x[2])\n    \n    # Extract group ID from PassengerId\n    train_df[\"GroupId\"] = train_df[\"PassengerId\"].apply(extract_group_id)\n    \n    # Compute group size for each passenger\n    group_sizes = train_df[\"GroupId\"].value_counts().to_dict()\n    train_df[\"GroupSize\"] = train_df[\"GroupId\"].map(group_sizes).fillna(1)\n    \n    # Fill missing values in spending columns with 0 (indicates not spent)\n    for col in SPENDING:\n        train_df[col] = train_df[col].fillna(0)\n    \n    # Compute total spending across all categories\n    train_df[\"TotalSpending\"] = train_df[SPENDING].sum(axis=1)\n    \n    # Convert CryoSleep and VIP to numeric (handle NaN explicitly)\n    train_df[\"CryoSleep\"] = train_df[\"CryoSleep\"].fillna(\"Unknown\").astype(str)\n    train_df[\"VIP\"] = train_df[\"VIP\"].fillna(\"Unknown\").astype(str)\n    \n    # Build feature set: include both individual spending and aggregate spending\n    feature_cols = [\"Age\", \"TotalSpending\"] + SPENDING + CATEGORICAL + [\"Deck\", \"RoomNum\", \"Side\", \"GroupId\", \"GroupSize\"]\n    X = train_df[feature_cols]\n    y = train_df[\"Transported\"].astype(int)\n    \n    # Define preprocessing for numeric and categorical columns\n    numeric_transformer = Pipeline([\n        (\"imputer\", SimpleImputer(strategy=\"median\")),\n        (\"scaler\", StandardScaler()),\n    ])\n    \n    categorical_transformer = Pipeline([\n        (\"imputer\", SimpleImputer(strategy=\"most_frequent\")),\n        (\"onehot\", OneHotEncoder(handle_unknown=\"ignore\", sparse_output=False)),\n    ])\n    \n    preprocessor = ColumnTransformer([\n        (\"num\", numeric_transformer, [\"Age\", \"TotalSpending\", \"RoomNum\", \"GroupSize\"] + SPENDING),\n        (\"cat\", categorical_transformer, CATEGORICAL + [\"Deck\", \"Side\", \"GroupId\"]),\n    ])\n    \n    pipe = Pipeline([\n        (\"preprocessor\", preprocessor),\n        (\"clf\", LogisticRegression(max_iter=1000)),\n    ])\n    \n    pipe.fit(X, y)\n    \n    # Store group_sizes mapping for use in predict function\n    pipe.group_sizes = group_sizes\n    \n    def predict(X_val):\n        # Parse Cabin in validation set\n        cabin_data = X_val[\"Cabin\"].apply(parse_cabin)\n        X_val_copy = X_val.copy()\n        X_val_copy[\"Deck\"] = cabin_data.apply(lambda x: x[0])\n        X_val_copy[\"RoomNum\"] = cabin_data.apply(lambda x: x[1])\n        X_val_copy[\"Side\"] = cabin_data.apply(lambda x: x[2])\n        \n        # Extract group ID\n        X_val_copy[\"GroupId\"] = X_val_copy[\"PassengerId\"].apply(extract_group_id)\n        \n        # Compute group size using training set mapping (default to 1 for unseen groups)\n        X_val_copy[\"GroupSize\"] = X_val_copy[\"GroupId\"].map(pipe.group_sizes).fillna(1)\n        \n        # Fill missing spending with 0\n        for col in SPENDING:\n            X_val_copy[col] = X_val_copy[col].fillna(0)\n        \n        # Compute total spending\n        X_val_copy[\"TotalSpending\"] = X_val_copy[SPENDING].sum(axis=1)\n        \n        # Handle CryoSleep and VIP\n        X_val_copy[\"CryoSleep\"] = X_val_copy[\"CryoSleep\"].fillna(\"Unknown\").astype(str)\n        X_val_copy[\"VIP\"] = X_val_copy[\"VIP\"].fillna(\"Unknown\").astype(str)\n        \n        return pipe.predict(X_val_copy[feature_cols]).astype(bool)\n    \n    return predict\n\n\nif __name__ == \"__main__\":\n    predict_fn = build_predict_fn()\n    score = prepare.evaluate(predict_fn)\n    print(f\"VAL_ACCURACY: {score:.4f}\")\n```\n</code>\n\n<notes_append>\nIteration 6: Added TotalSpending aggregate feature (sum of all spending columns) and GroupSize feature (count of passengers with same GroupId prefix in training set) to capture economic behavior patterns and family/group dynamics; kept individual spending columns and all prior engineering (cabin parsing, GroupId, spending-as-zero, Unknown handling) to test if these aggregate features improve on 0.7901.\n</notes_append>", "reflection": "The current best score is 0.7901, achieved in iteration 2 and re-confirmed in iteration 5 with the logistic regression pipeline that includes cabin parsing, group ID extraction, categorical encoding with one-hot, and spending-as-zero filling. The model is stable and has not improved beyond this point despite trying XGBoost. The baseline was 0.78, so we are 1% above baseline. Now I need to look deeper at the data structure to find additional signal that the current features are missing.", "observations": ["The current feature set includes parsed cabin components (Deck, RoomNum, Side), group ID, spending patterns, and basic demographics (Age, HomePlanet, Destination, CryoSleep, VIP), but RoomNum and Side are added as categorical/numeric features without explicit investigation of their predictive power.", "CryoSleep and VIP are boolean columns with missing values; the current approach fills them as \"Unknown\" which treats missingness as a category. This is reasonable, but we haven't validated whether missingness itself or the original boolean encoding carries more signal.", "The SPENDING columns (RoomService, FoodCourt, ShoppingMall, Spa, VRDeck) are filled with 0 for missing values, treating \"not recorded\" as \"did not spend.\" A binary \"spent_anything\" flag or total spending amount might capture variance better than individual columns.", "No interaction features have been engineered (e.g., total spending, spending per deck, age×cryosleep interactions), which logistic regression would benefit from if such interactions exist in the data.", "The GroupId feature assumes passengers in the same group (same PassengerId prefix) share similar transport outcomes, but we haven't validated this or tried encoding group size as a feature."], "hypothesis": "Creating aggregate spending features (total spending, binary \"spent anything\" indicator) and adding group size as a feature will improve signal by capturing economic behavior patterns and family/group dynamics that individual spending columns may not represent clearly to logistic regression.", "plan": "I will add two engineered features: (1) TotalSpending = sum of all spending columns (replacing individual columns may be too aggressive, so I'll keep both), and (2) GroupSize = count of passengers in the same group within the training set. These capture aggregate economic behavior and group cohesion, which may be predictive of transport outcomes.", "code": "\"\"\"\ntrain.py — logistic regression with cabin parsing, group features, and aggregate spending.\n\"\"\"\nimport sys, pathlib\nsys.path.insert(0, str(pathlib.Path(__file__).resolve().parent.parent))\n\nimport pandas as pd\nimport numpy as np\nfrom sklearn.linear_model import LogisticRegression\nfrom sklearn.impute import SimpleImputer\nfrom sklearn.pipeline import Pipeline\nfrom sklearn.preprocessing import StandardScaler, OneHotEncoder\nfrom sklearn.compose import ColumnTransformer\n\nimport prepare\n\nNUMERIC = [\"Age\", \"RoomService\", \"FoodCourt\", \"ShoppingMall\", \"Spa\", \"VRDeck\"]\nCATEGORICAL = [\"HomePlanet\", \"Destination\", \"CryoSleep\", \"VIP\"]\nSPENDING = [\"RoomService\", \"FoodCourt\", \"ShoppingMall\", \"Spa\", \"VRDeck\"]\n\n\ndef parse_cabin(cabin_str):\n    \"\"\"Parse Cabin 'F/0/S' into deck, room_num, side.\"\"\"\n    if pd.isna(cabin_str):\n        return np.nan, np.nan, np.nan\n    parts = str(cabin_str).split(\"/\")\n    if len(parts) == 3:\n        return parts[0], int(parts[1]) if parts[1].isdigit() else np.nan, parts[2]\n    return np.nan, np.nan, np.nan\n\n\ndef extract_group_id(passenger_id):\n    \"\"\"Extract group ID from PassengerId (e.g., '0001_01' -> '0001').\"\"\"\n    if pd.isna(passenger_id):\n        return np.nan\n    return str(passenger_id).split(\"_\")[0]\n\n\ndef build_predict_fn():\n    train_df, _ = prepare.load_split()\n    \n    # Parse Cabin into Deck, RoomNum, Side\n    cabin_data = train_df[\"Cabin\"].apply(parse_cabin)\n    train_df[\"Deck\"] = cabin_data.apply(lambda x: x[0])\n    train_df[\"RoomNum\"] = cabin_data.apply(lambda x: x[1])\n    train_df[\"Side\"] = cabin_data.apply(lambda x: x[2])\n    \n    # Extract group ID from PassengerId\n    train_df[\"GroupId\"] = train_df[\"PassengerId\"].apply(extract_group_id)\n    \n    # Compute group size for each passenger\n    group_sizes = train_df[\"GroupId\"].value_counts().to_dict()\n    train_df[\"GroupSize\"] = train_df[\"GroupId\"].map(group_sizes).fillna(1)\n    \n    # Fill missing values in spending columns with 0 (indicates not spent)\n    for col in SPENDING:\n        train_df[col] = train_df[col].fillna(0)\n    \n    # Compute total spending across all categories\n    train_df[\"TotalSpending\"] = train_df[SPENDING].sum(axis=1)\n    \n    # Convert CryoSleep and VIP to numeric (handle NaN explicitly)\n    train_df[\"CryoSleep\"] = train_df[\"CryoSleep\"].fillna(\"Unknown\").astype(str)\n    train_df[\"VIP\"] = train_df[\"VIP\"].fillna(\"Unknown\").astype(str)\n    \n    # Build feature set: include both individual spending and aggregate spending\n    feature_cols = [\"Age\", \"TotalSpending\"] + SPENDING + CATEGORICAL + [\"Deck\", \"RoomNum\", \"Side\", \"GroupId\", \"GroupSize\"]\n    X = train_df[feature_cols]\n    y = train_df[\"Transported\"].astype(int)\n    \n    # Define preprocessing for numeric and categorical columns\n    numeric_transformer = Pipeline([\n        (\"imputer\", SimpleImputer(strategy=\"median\")),\n        (\"scaler\", StandardScaler()),\n    ])\n    \n    categorical_transformer = Pipeline([\n        (\"imputer\", SimpleImputer(strategy=\"most_frequent\")),\n        (\"onehot\", OneHotEncoder(handle_unknown=\"ignore\", sparse_output=False)),\n    ])\n    \n    preprocessor = ColumnTransformer([\n        (\"num\", numeric_transformer, [\"Age\", \"TotalSpending\", \"RoomNum\", \"GroupSize\"] + SPENDING),\n        (\"cat\", categorical_transformer, CATEGORICAL + [\"Deck\", \"Side\", \"GroupId\"]),\n    ])\n    \n    pipe = Pipeline([\n        (\"preprocessor\", preprocessor),\n        (\"clf\", LogisticRegression(max_iter=1000)),\n    ])\n    \n    pipe.fit(X, y)\n    \n    # Store group_sizes mapping for use in predict function\n    pipe.group_sizes = group_sizes\n    \n    def predict(X_val):\n        # Parse Cabin in validation set\n        cabin_data = X_val[\"Cabin\"].apply(parse_cabin)\n        X_val_copy = X_val.copy()\n        X_val_copy[\"Deck\"] = cabin_data.apply(lambda x: x[0])\n        X_val_copy[\"RoomNum\"] = cabin_data.apply(lambda x: x[1])\n        X_val_copy[\"Side\"] = cabin_data.apply(lambda x: x[2])\n        \n        # Extract group ID\n        X_val_copy[\"GroupId\"] = X_val_copy[\"PassengerId\"].apply(extract_group_id)\n        \n        # Compute group size using training set mapping (default to 1 for unseen groups)\n        X_val_copy[\"GroupSize\"] = X_val_copy[\"GroupId\"].map(pipe.group_sizes).fillna(1)\n        \n        # Fill missing spending with 0\n        for col in SPENDING:\n            X_val_copy[col] = X_val_copy[col].fillna(0)\n        \n        # Compute total spending\n        X_val_copy[\"TotalSpending\"] = X_val_copy[SPENDING].sum(axis=1)\n        \n        # Handle CryoSleep and VIP\n        X_val_copy[\"CryoSleep\"] = X_val_copy[\"CryoSleep\"].fillna(\"Unknown\").astype(str)\n        X_val_copy[\"VIP\"] = X_val_copy[\"VIP\"].fillna(\"Unknown\").astype(str)\n        \n        return pipe.predict(X_val_copy[feature_cols]).astype(bool)\n    \n    return predict\n\n\nif __name__ == \"__main__\":\n    predict_fn = build_predict_fn()\n    score = prepare.evaluate(predict_fn)\n    print(f\"VAL_ACCURACY: {score:.4f}\")\n", "notes_append": "Iteration 6: Added TotalSpending aggregate feature (sum of all spending columns) and GroupSize feature (count of passengers with same GroupId prefix in training set) to capture economic behavior patterns and family/group dynamics; kept individual spending columns and all prior engineering (cabin parsing, GroupId, spending-as-zero, Unknown handling) to test if these aggregate features improve on 0.7901.", "stdout": "VAL_ACCURACY: 0.7901\n", "stderr": "", "returncode": 0, "score": 0.7901, "kept": true, "status": "kept", "commit_hash": "7493a49", "input_tokens": 3530, "output_tokens": 2275, "cost_usd": 0.014905}
