{"iteration": 0, "timestamp": "2026-05-08T20:51:11", "duration_seconds": 4.25, "agent_response_raw": null, "reflection": "(baseline — no agent call)", "observations": [], "hypothesis": null, "plan": "baseline logistic regression on raw numeric columns", "code": "\"\"\"\ntrain.py — logistic regression with cabin parsing, group features, age missingness flag.\n\"\"\"\nimport sys, pathlib\nsys.path.insert(0, str(pathlib.Path(__file__).resolve().parent.parent))\n\nimport pandas as pd\nimport numpy as np\nfrom sklearn.linear_model import LogisticRegression\nfrom sklearn.impute import SimpleImputer\nfrom sklearn.pipeline import Pipeline\nfrom sklearn.preprocessing import StandardScaler, OneHotEncoder\nfrom sklearn.compose import ColumnTransformer\n\nimport prepare\n\nNUMERIC = [\"Age\", \"RoomService\", \"FoodCourt\", \"ShoppingMall\", \"Spa\", \"VRDeck\"]\nCATEGORICAL = [\"HomePlanet\", \"Destination\", \"CryoSleep\", \"VIP\"]\nSPENDING = [\"RoomService\", \"FoodCourt\", \"ShoppingMall\", \"Spa\", \"VRDeck\"]\n\n\ndef parse_cabin(cabin_str):\n    \"\"\"Parse Cabin 'F/0/S' into deck, room_num, side.\"\"\"\n    if pd.isna(cabin_str):\n        return np.nan, np.nan, np.nan\n    parts = str(cabin_str).split(\"/\")\n    if len(parts) == 3:\n        return parts[0], int(parts[1]) if parts[1].isdigit() else np.nan, parts[2]\n    return np.nan, np.nan, np.nan\n\n\ndef extract_group_id(passenger_id):\n    \"\"\"Extract group ID from PassengerId (e.g., '0001_01' -> '0001').\"\"\"\n    if pd.isna(passenger_id):\n        return np.nan\n    return str(passenger_id).split(\"_\")[0]\n\n\ndef build_predict_fn():\n    train_df, _ = prepare.load_split()\n    \n    # Parse Cabin into Deck, RoomNum, Side\n    cabin_data = train_df[\"Cabin\"].apply(parse_cabin)\n    train_df[\"Deck\"] = cabin_data.apply(lambda x: x[0])\n    train_df[\"RoomNum\"] = cabin_data.apply(lambda x: x[1])\n    train_df[\"Side\"] = cabin_data.apply(lambda x: x[2])\n    \n    # Extract group ID from PassengerId\n    train_df[\"GroupId\"] = train_df[\"PassengerId\"].apply(extract_group_id)\n    \n    # Compute group size for each passenger\n    group_sizes = train_df[\"GroupId\"].value_counts().to_dict()\n    train_df[\"GroupSize\"] = train_df[\"GroupId\"].map(group_sizes).fillna(1)\n    \n    # Flag: is Age missing?\n    train_df[\"AgeMissing\"] = train_df[\"Age\"].isna().astype(int)\n    \n    # Fill missing values in spending columns with 0 (indicates not spent)\n    for col in SPENDING:\n        train_df[col] = train_df[col].fillna(0)\n    \n    # Compute total spending across all categories\n    train_df[\"TotalSpending\"] = train_df[SPENDING].sum(axis=1)\n    \n    # Convert CryoSleep and VIP to numeric (handle NaN explicitly)\n    train_df[\"CryoSleep\"] = train_df[\"CryoSleep\"].fillna(\"Unknown\").astype(str)\n    train_df[\"VIP\"] = train_df[\"VIP\"].fillna(\"Unknown\").astype(str)\n    \n    # Build feature set: include both individual spending and aggregate spending\n    feature_cols = [\"Age\", \"AgeMissing\", \"TotalSpending\"] + SPENDING + CATEGORICAL + [\"Deck\", \"RoomNum\", \"Side\", \"GroupId\", \"GroupSize\"]\n    X = train_df[feature_cols]\n    y = train_df[\"Transported\"].astype(int)\n    \n    # Define preprocessing for numeric and categorical columns\n    numeric_transformer = Pipeline([\n        (\"imputer\", SimpleImputer(strategy=\"median\")),\n        (\"scaler\", StandardScaler()),\n    ])\n    \n    categorical_transformer = Pipeline([\n        (\"imputer\", SimpleImputer(strategy=\"most_frequent\")),\n        (\"onehot\", OneHotEncoder(handle_unknown=\"ignore\", sparse_output=False)),\n    ])\n    \n    preprocessor = ColumnTransformer([\n        (\"num\", numeric_transformer, [\"Age\", \"AgeMissing\", \"TotalSpending\", \"RoomNum\", \"GroupSize\"] + SPENDING),\n        (\"cat\", categorical_transformer, CATEGORICAL + [\"Deck\", \"Side\", \"GroupId\"]),\n    ])\n    \n    pipe = Pipeline([\n        (\"preprocessor\", preprocessor),\n        (\"clf\", LogisticRegression(max_iter=1000)),\n    ])\n    \n    pipe.fit(X, y)\n    \n    # Store group_sizes mapping for use in predict function\n    pipe.group_sizes = group_sizes\n    \n    def predict(X_val):\n        # Parse Cabin in validation set\n        cabin_data = X_val[\"Cabin\"].apply(parse_cabin)\n        X_val_copy = X_val.copy()\n        X_val_copy[\"Deck\"] = cabin_data.apply(lambda x: x[0])\n        X_val_copy[\"RoomNum\"] = cabin_data.apply(lambda x: x[1])\n        X_val_copy[\"Side\"] = cabin_data.apply(lambda x: x[2])\n        \n        # Extract group ID\n        X_val_copy[\"GroupId\"] = X_val_copy[\"PassengerId\"].apply(extract_group_id)\n        \n        # Compute group size using training set mapping (default to 1 for unseen groups)\n        X_val_copy[\"GroupSize\"] = X_val_copy[\"GroupId\"].map(pipe.group_sizes).fillna(1)\n        \n        # Flag: is Age missing?\n        X_val_copy[\"AgeMissing\"] = X_val_copy[\"Age\"].isna().astype(int)\n        \n        # Fill missing spending with 0\n        for col in SPENDING:\n            X_val_copy[col] = X_val_copy[col].fillna(0)\n        \n        # Compute total spending\n        X_val_copy[\"TotalSpending\"] = X_val_copy[SPENDING].sum(axis=1)\n        \n        # Handle CryoSleep and VIP\n        X_val_copy[\"CryoSleep\"] = X_val_copy[\"CryoSleep\"].fillna(\"Unknown\").astype(str)\n        X_val_copy[\"VIP\"] = X_val_copy[\"VIP\"].fillna(\"Unknown\").astype(str)\n        \n        return pipe.predict(X_val_copy[feature_cols]).astype(bool)\n    \n    return predict\n\n\nif __name__ == \"__main__\":\n    predict_fn = build_predict_fn()\n    score = prepare.evaluate(predict_fn)\n    print(f\"VAL_ACCURACY: {score:.4f}\")\n", "notes_append": null, "stdout": "VAL_ACCURACY: 0.7901\n", "stderr": "", "returncode": 0, "score": 0.7901, "previous_best": null, "kept": true, "status": "kept", "commit_hash": "f7f2bb6", "input_tokens": 0, "output_tokens": 0, "cost_usd": 0.0}
{"iteration": 1, "timestamp": "2026-05-08T20:51:11", "previous_best": 0.7901, "duration_seconds": 4.31, "agent_response_raw": "<reflection>\nThe baseline logistic regression with cabin parsing, group features, and age missingness flag is scoring 0.7901, which exactly matches the best we've achieved. The notes show we've tried many feature engineering approaches (PersonId, AnySpending, TotalSpending, GroupSize) but none have improved beyond baseline. We're at the point of diminishing returns with feature addition — the model seems robust but not advancing. I should try a structurally different approach: either regularization/hyperparameter tuning of the logistic regression, or a different model class entirely with careful feature selection.\n</reflection>\n\n<observations>\n- Current score of 0.7901 has been stable across iterations 5–8, suggesting the feature engineering from iteration 5 (Cabin parsing, GroupId, spending-as-zero, Unknown handling) is near-optimal for logistic regression, but additional features (TotalSpending, GroupSize, PersonId, AnySpending, AgeMissing) aren't helping.\n- We've added 10+ engineered features in recent iterations without moving the needle, which is a strong signal we're overfitting or adding noise. The notes explicitly warn: \"If you find yourself trying minor variants of the same idea, stop.\"\n- Logistic regression with one-hot encoding proved more robust than XGBoost with label encoding (iter 4 crashed due to unseen GroupId values), suggesting the current pipeline is well-structured for this data.\n- The baseline numeric-only logistic regression scored ~0.78; we've gained ~0.01 through feature engineering alone. Further gains likely require either better feature selection (removing noisy engineered features) or a different learning approach.\n- No evidence yet that hyperparameter tuning (e.g., regularization, learning rate) has been tried on the current feature set.\n</observations>\n\n<hypothesis>\nRemoving the noisy engineered features (TotalSpending, GroupSize, PersonId, AnySpending, AgeMissing) and relying only on core features (Cabin parsing, GroupId, spending-as-zero) will improve generalization, because these features add variance without reducing bias. Alternatively, adding L2 regularization (tuning C) to logistic regression may help if the current model is overfit.\n</hypothesis>\n\n<plan>\nI will simplify the feature set by removing TotalSpending, GroupSize, PersonId, AnySpending, and AgeMissing, keeping only the minimal feature engineering from iteration 5 (Cabin deck/room/side, GroupId, spending-as-zero, and Unknown handling for booleans). This tests whether we've been adding noise; if score stays ≥0.7901, the simplification is a win (cleaner model). If score drops, I will then try regularization (L2 with C tuning) rather than further feature addition.\n</plan>\n\n<code>\n```python\n\"\"\"\ntrain.py — simplified logistic regression: minimal feature engineering without noisy aggregate features.\n\"\"\"\nimport sys, pathlib\nsys.path.insert(0, str(pathlib.Path(__file__).resolve().parent.parent))\n\nimport pandas as pd\nimport numpy as np\nfrom sklearn.linear_model import LogisticRegression\nfrom sklearn.impute import SimpleImputer\nfrom sklearn.pipeline import Pipeline\nfrom sklearn.preprocessing import StandardScaler, OneHotEncoder\nfrom sklearn.compose import ColumnTransformer\n\nimport prepare\n\nNUMERIC = [\"Age\", \"RoomService\", \"FoodCourt\", \"ShoppingMall\", \"Spa\", \"VRDeck\"]\nCATEGORICAL = [\"HomePlanet\", \"Destination\", \"CryoSleep\", \"VIP\"]\nSPENDING = [\"RoomService\", \"FoodCourt\", \"ShoppingMall\", \"Spa\", \"VRDeck\"]\n\n\ndef parse_cabin(cabin_str):\n    \"\"\"Parse Cabin 'F/0/S' into deck, room_num, side.\"\"\"\n    if pd.isna(cabin_str):\n        return np.nan, np.nan, np.nan\n    parts = str(cabin_str).split(\"/\")\n    if len(parts) == 3:\n        return parts[0], int(parts[1]) if parts[1].isdigit() else np.nan, parts[2]\n    return np.nan, np.nan, np.nan\n\n\ndef extract_group_id(passenger_id):\n    \"\"\"Extract group ID from PassengerId (e.g., '0001_01' -> '0001').\"\"\"\n    if pd.isna(passenger_id):\n        return np.nan\n    return str(passenger_id).split(\"_\")[0]\n\n\ndef build_predict_fn():\n    train_df, _ = prepare.load_split()\n    \n    # Parse Cabin into Deck, RoomNum, Side\n    cabin_data = train_df[\"Cabin\"].apply(parse_cabin)\n    train_df[\"Deck\"] = cabin_data.apply(lambda x: x[0])\n    train_df[\"RoomNum\"] = cabin_data.apply(lambda x: x[1])\n    train_df[\"Side\"] = cabin_data.apply(lambda x: x[2])\n    \n    # Extract group ID from PassengerId\n    train_df[\"GroupId\"] = train_df[\"PassengerId\"].apply(extract_group_id)\n    \n    # Fill missing values in spending columns with 0 (indicates not spent)\n    for col in SPENDING:\n        train_df[col] = train_df[col].fillna(0)\n    \n    # Convert CryoSleep and VIP to numeric (handle NaN explicitly)\n    train_df[\"CryoSleep\"] = train_df[\"CryoSleep\"].fillna(\"Unknown\").astype(str)\n    train_df[\"VIP\"] = train_df[\"VIP\"].fillna(\"Unknown\").astype(str)\n    \n    # Build feature set: minimal core features only\n    feature_cols = [\"Age\"] + SPENDING + CATEGORICAL + [\"Deck\", \"RoomNum\", \"Side\", \"GroupId\"]\n    X = train_df[feature_cols]\n    y = train_df[\"Transported\"].astype(int)\n    \n    # Define preprocessing for numeric and categorical columns\n    numeric_transformer = Pipeline([\n        (\"imputer\", SimpleImputer(strategy=\"median\")),\n        (\"scaler\", StandardScaler()),\n    ])\n    \n    categorical_transformer = Pipeline([\n        (\"imputer\", SimpleImputer(strategy=\"most_frequent\")),\n        (\"onehot\", OneHotEncoder(handle_unknown=\"ignore\", sparse_output=False)),\n    ])\n    \n    preprocessor = ColumnTransformer([\n        (\"num\", numeric_transformer, [\"Age\", \"RoomNum\"] + SPENDING),\n        (\"cat\", categorical_transformer, CATEGORICAL + [\"Deck\", \"Side\", \"GroupId\"]),\n    ])\n    \n    pipe = Pipeline([\n        (\"preprocessor\", preprocessor),\n        (\"clf\", LogisticRegression(max_iter=1000)),\n    ])\n    \n    pipe.fit(X, y)\n    \n    def predict(X_val):\n        # Parse Cabin in validation set\n        cabin_data = X_val[\"Cabin\"].apply(parse_cabin)\n        X_val_copy = X_val.copy()\n        X_val_copy[\"Deck\"] = cabin_data.apply(lambda x: x[0])\n        X_val_copy[\"RoomNum\"] = cabin_data.apply(lambda x: x[1])\n        X_val_copy[\"Side\"] = cabin_data.apply(lambda x: x[2])\n        \n        # Extract group ID\n        X_val_copy[\"GroupId\"] = X_val_copy[\"PassengerId\"].apply(extract_group_id)\n        \n        # Fill missing spending with 0\n        for col in SPENDING:\n            X_val_copy[col] = X_val_copy[col].fillna(0)\n        \n        # Handle CryoSleep and VIP\n        X_val_copy[\"CryoSleep\"] = X_val_copy[\"CryoSleep\"].fillna(\"Unknown\").astype(str)\n        X_val_copy[\"VIP\"] = X_val_copy[\"VIP\"].fillna(\"Unknown\").astype(str)\n        \n        return pipe.predict(X_val_copy[feature_cols]).astype(bool)\n    \n    return predict\n\n\nif __name__ == \"__main__\":\n    predict_fn = build_predict_fn()\n    score = prepare.evaluate(predict_fn)\n    print(f\"VAL_ACCURACY: {score:.4f}\")\n```\n</code>\n\n<notes_append>\nIteration 9: Simplified feature set by removing TotalSpending, GroupSize, PersonId, AnySpending, and AgeMissing. Keeping only core minimal engineering (Cabin parsing, GroupId, spending-as-zero, Unknown handling). Testing whether recent feature additions were noise or additive; if score holds ≥0.7901, simpler is better.\n</notes_append>", "reflection": "The baseline logistic regression with cabin parsing, group features, and age missingness flag is scoring 0.7901, which exactly matches the best we've achieved. The notes show we've tried many feature engineering approaches (PersonId, AnySpending, TotalSpending, GroupSize) but none have improved beyond baseline. We're at the point of diminishing returns with feature addition — the model seems robust but not advancing. I should try a structurally different approach: either regularization/hyperparameter tuning of the logistic regression, or a different model class entirely with careful feature selection.", "observations": ["Current score of 0.7901 has been stable across iterations 5–8, suggesting the feature engineering from iteration 5 (Cabin parsing, GroupId, spending-as-zero, Unknown handling) is near-optimal for logistic regression, but additional features (TotalSpending, GroupSize, PersonId, AnySpending, AgeMissing) aren't helping.", "We've added 10+ engineered features in recent iterations without moving the needle, which is a strong signal we're overfitting or adding noise. The notes explicitly warn: \"If you find yourself trying minor variants of the same idea, stop.\"", "Logistic regression with one-hot encoding proved more robust than XGBoost with label encoding (iter 4 crashed due to unseen GroupId values), suggesting the current pipeline is well-structured for this data.", "The baseline numeric-only logistic regression scored ~0.78; we've gained ~0.01 through feature engineering alone. Further gains likely require either better feature selection (removing noisy engineered features) or a different learning approach.", "No evidence yet that hyperparameter tuning (e.g., regularization, learning rate) has been tried on the current feature set."], "hypothesis": "Removing the noisy engineered features (TotalSpending, GroupSize, PersonId, AnySpending, AgeMissing) and relying only on core features (Cabin parsing, GroupId, spending-as-zero) will improve generalization, because these features add variance without reducing bias. Alternatively, adding L2 regularization (tuning C) to logistic regression may help if the current model is overfit.", "plan": "I will simplify the feature set by removing TotalSpending, GroupSize, PersonId, AnySpending, and AgeMissing, keeping only the minimal feature engineering from iteration 5 (Cabin deck/room/side, GroupId, spending-as-zero, and Unknown handling for booleans). This tests whether we've been adding noise; if score stays ≥0.7901, the simplification is a win (cleaner model). If score drops, I will then try regularization (L2 with C tuning) rather than further feature addition.", "code": "\"\"\"\ntrain.py — simplified logistic regression: minimal feature engineering without noisy aggregate features.\n\"\"\"\nimport sys, pathlib\nsys.path.insert(0, str(pathlib.Path(__file__).resolve().parent.parent))\n\nimport pandas as pd\nimport numpy as np\nfrom sklearn.linear_model import LogisticRegression\nfrom sklearn.impute import SimpleImputer\nfrom sklearn.pipeline import Pipeline\nfrom sklearn.preprocessing import StandardScaler, OneHotEncoder\nfrom sklearn.compose import ColumnTransformer\n\nimport prepare\n\nNUMERIC = [\"Age\", \"RoomService\", \"FoodCourt\", \"ShoppingMall\", \"Spa\", \"VRDeck\"]\nCATEGORICAL = [\"HomePlanet\", \"Destination\", \"CryoSleep\", \"VIP\"]\nSPENDING = [\"RoomService\", \"FoodCourt\", \"ShoppingMall\", \"Spa\", \"VRDeck\"]\n\n\ndef parse_cabin(cabin_str):\n    \"\"\"Parse Cabin 'F/0/S' into deck, room_num, side.\"\"\"\n    if pd.isna(cabin_str):\n        return np.nan, np.nan, np.nan\n    parts = str(cabin_str).split(\"/\")\n    if len(parts) == 3:\n        return parts[0], int(parts[1]) if parts[1].isdigit() else np.nan, parts[2]\n    return np.nan, np.nan, np.nan\n\n\ndef extract_group_id(passenger_id):\n    \"\"\"Extract group ID from PassengerId (e.g., '0001_01' -> '0001').\"\"\"\n    if pd.isna(passenger_id):\n        return np.nan\n    return str(passenger_id).split(\"_\")[0]\n\n\ndef build_predict_fn():\n    train_df, _ = prepare.load_split()\n    \n    # Parse Cabin into Deck, RoomNum, Side\n    cabin_data = train_df[\"Cabin\"].apply(parse_cabin)\n    train_df[\"Deck\"] = cabin_data.apply(lambda x: x[0])\n    train_df[\"RoomNum\"] = cabin_data.apply(lambda x: x[1])\n    train_df[\"Side\"] = cabin_data.apply(lambda x: x[2])\n    \n    # Extract group ID from PassengerId\n    train_df[\"GroupId\"] = train_df[\"PassengerId\"].apply(extract_group_id)\n    \n    # Fill missing values in spending columns with 0 (indicates not spent)\n    for col in SPENDING:\n        train_df[col] = train_df[col].fillna(0)\n    \n    # Convert CryoSleep and VIP to numeric (handle NaN explicitly)\n    train_df[\"CryoSleep\"] = train_df[\"CryoSleep\"].fillna(\"Unknown\").astype(str)\n    train_df[\"VIP\"] = train_df[\"VIP\"].fillna(\"Unknown\").astype(str)\n    \n    # Build feature set: minimal core features only\n    feature_cols = [\"Age\"] + SPENDING + CATEGORICAL + [\"Deck\", \"RoomNum\", \"Side\", \"GroupId\"]\n    X = train_df[feature_cols]\n    y = train_df[\"Transported\"].astype(int)\n    \n    # Define preprocessing for numeric and categorical columns\n    numeric_transformer = Pipeline([\n        (\"imputer\", SimpleImputer(strategy=\"median\")),\n        (\"scaler\", StandardScaler()),\n    ])\n    \n    categorical_transformer = Pipeline([\n        (\"imputer\", SimpleImputer(strategy=\"most_frequent\")),\n        (\"onehot\", OneHotEncoder(handle_unknown=\"ignore\", sparse_output=False)),\n    ])\n    \n    preprocessor = ColumnTransformer([\n        (\"num\", numeric_transformer, [\"Age\", \"RoomNum\"] + SPENDING),\n        (\"cat\", categorical_transformer, CATEGORICAL + [\"Deck\", \"Side\", \"GroupId\"]),\n    ])\n    \n    pipe = Pipeline([\n        (\"preprocessor\", preprocessor),\n        (\"clf\", LogisticRegression(max_iter=1000)),\n    ])\n    \n    pipe.fit(X, y)\n    \n    def predict(X_val):\n        # Parse Cabin in validation set\n        cabin_data = X_val[\"Cabin\"].apply(parse_cabin)\n        X_val_copy = X_val.copy()\n        X_val_copy[\"Deck\"] = cabin_data.apply(lambda x: x[0])\n        X_val_copy[\"RoomNum\"] = cabin_data.apply(lambda x: x[1])\n        X_val_copy[\"Side\"] = cabin_data.apply(lambda x: x[2])\n        \n        # Extract group ID\n        X_val_copy[\"GroupId\"] = X_val_copy[\"PassengerId\"].apply(extract_group_id)\n        \n        # Fill missing spending with 0\n        for col in SPENDING:\n            X_val_copy[col] = X_val_copy[col].fillna(0)\n        \n        # Handle CryoSleep and VIP\n        X_val_copy[\"CryoSleep\"] = X_val_copy[\"CryoSleep\"].fillna(\"Unknown\").astype(str)\n        X_val_copy[\"VIP\"] = X_val_copy[\"VIP\"].fillna(\"Unknown\").astype(str)\n        \n        return pipe.predict(X_val_copy[feature_cols]).astype(bool)\n    \n    return predict\n\n\nif __name__ == \"__main__\":\n    predict_fn = build_predict_fn()\n    score = prepare.evaluate(predict_fn)\n    print(f\"VAL_ACCURACY: {score:.4f}\")\n", "notes_append": "Iteration 9: Simplified feature set by removing TotalSpending, GroupSize, PersonId, AnySpending, and AgeMissing. Keeping only core minimal engineering (Cabin parsing, GroupId, spending-as-zero, Unknown handling). Testing whether recent feature additions were noise or additive; if score holds ≥0.7901, simpler is better.", "stdout": "VAL_ACCURACY: 0.7901\n", "stderr": "", "returncode": 0, "score": 0.7901, "kept": true, "status": "kept", "commit_hash": "de0b380", "input_tokens": 3838, "output_tokens": 2125, "cost_usd": 0.014463}
