{"iteration": 4, "timestamp": "2026-05-08T21:25:20", "previous_best": 0.8189, "duration_seconds": 1.68, "agent_response_raw": "<reflection>\nThe last run crashed trying to run an EDA script, returning 0.0000 accuracy. Looking back at the notes, iteration 40 was supposed to fix an escape sequence bug in the EDA script, but the EDA output shown suggests the script did run and produce clean statistics. However, the final VAL_ACCURACY is 0.0000, which means train.py itself is broken. The issue is that train.py is still set up as a modeling script, not an EDA script. I need to restore train.py to a working model state and use the EDA insights to guide a concrete improvement.\n</reflection>\n\n<observations>\n- The EDA output reveals strong categorical signals: CryoSleep=True has 81.9% transport rate vs 32.8% for False; Deck B/C have higher rates (73.7%, 66.9%); Side S > Side P (55.4% vs 45.3%); Europa has 66.2% vs Earth 42.5%. These are very strong univariate signals.\n- Spending columns (RoomService, Spa, VRDeck) have negative correlation with transport (~-0.21 to -0.25), suggesting passengers who spend money are less likely to be transported. This contradicts the intuition that spending activity = staying aboard; transported passengers likely skipped paid amenities.\n- Missing value patterns are nearly uniform across transported/not transported (diff <0.005), so missingness itself is not a strong predictor despite being tracked in recent iterations.\n- The current best score is 0.8189 (iteration 0). After 40 iterations of feature engineering and hyperparameter tuning, we have not beaten this. Simplification and focusing on the strongest univariate signals (CryoSleep, Deck, Side, HomePlanet, Destination) may be the way forward.\n- Current train.py is broken (returning 0.0000), likely due to the EDA script overwriting it. Need to restore a clean, minimal model using the EDA insights.\n</observations>\n\n<hypothesis>\nA logistic regression or simple XGBoost using only the strongest univariate predictors (CryoSleep, Deck, Side, HomePlanet, Destination, Age) without complex interactions or many derived features will beat 0.8189 because the EDA shows these features alone have very high signal, and past iterations suggest feature complexity is adding noise rather than signal.\n</hypothesis>\n\n<plan>\nRestore train.py to a clean, minimal model: logistic regression with only Age, TotalSpending, and the cabin/categorical features parsed from Cabin and PassengerId. Remove all interaction features (CryoSleep_LogSpending, CryoSleep_Missing, VIP_Missing flags, etc.) and complex engineering that has not helped. Focus on getting the strongest univariate signals right with minimal preprocessing.\n</plan>\n\n<code>\n```python\n\"\"\"\ntrain.py — Minimal logistic regression with cabin parsing.\nBack to simplicity after 40 iterations of plateau. Using EDA-identified strong signals:\nCryoSleep, Deck, Side, HomePlanet, Destination. Removing interaction features that add noise.\n\"\"\"\nimport sys, pathlib\nsys.path.insert(0, str(pathlib.Path(__file__).resolve().parent.parent))\n\nimport pandas as pd\nimport numpy as np\nfrom sklearn.impute import SimpleImputer\nfrom sklearn.pipeline import Pipeline\nfrom sklearn.preprocessing import StandardScaler, OneHotEncoder\nfrom sklearn.compose import ColumnTransformer\nfrom sklearn.linear_model import LogisticRegression\n\nimport prepare\n\n\ndef parse_cabin(cabin_str):\n    \"\"\"Parse Cabin 'F/0/S' into deck and side.\"\"\"\n    if pd.isna(cabin_str):\n        return np.nan, np.nan\n    parts = str(cabin_str).split(\"/\")\n    if len(parts) == 3:\n        return parts[0], parts[2]\n    return np.nan, np.nan\n\n\ndef build_predict_fn():\n    train_df, _ = prepare.load_split()\n    \n    # Parse Cabin into Deck and Side\n    cabin_data = train_df[\"Cabin\"].apply(parse_cabin)\n    train_df[\"Deck\"] = cabin_data.apply(lambda x: x[0])\n    train_df[\"Side\"] = cabin_data.apply(lambda x: x[1])\n    \n    # Total spending (fill missing with 0)\n    spending_cols = [\"RoomService\", \"FoodCourt\", \"ShoppingMall\", \"Spa\", \"VRDeck\"]\n    for col in spending_cols:\n        train_df[col] = train_df[col].fillna(0)\n    train_df[\"TotalSpending\"] = train_df[spending_cols].sum(axis=1)\n    \n    # Feature set: minimal, strong signals only\n    numeric_cols = [\"Age\", \"TotalSpending\"]\n    categorical_cols = [\"HomePlanet\", \"Destination\", \"CryoSleep\", \"VIP\", \"Deck\", \"Side\"]\n    \n    # Fill categorical NaNs\n    for col in categorical_cols:\n        train_df[col] = train_df[col].fillna(\"Unknown\").astype(str)\n    \n    X = train_df[numeric_cols + categorical_cols]\n    y = train_df[\"Transported\"].astype(int)\n    \n    # Preprocessing\n    numeric_transformer = Pipeline([\n        (\"imputer\", SimpleImputer(strategy=\"median\")),\n        (\"scaler\", StandardScaler()),\n    ])\n    \n    categorical_transformer = Pipeline([\n        (\"onehot\", OneHotEncoder(handle_unknown=\"ignore\", sparse_output=False, max_categories=20)),\n    ])\n    \n    preprocessor = ColumnTransformer([\n        (\"num\", numeric_transformer, numeric_cols),\n        (\"cat\", categorical_transformer, categorical_cols),\n    ])\n    \n    pipe = Pipeline([\n        (\"preprocessor\", preprocessor),\n        (\"clf\", LogisticRegression(max_iter=1000, random_state=42)),\n    ])\n    \n    pipe.fit(X, y)\n    \n    def predict(X_val):\n        X_val_copy = X_val.copy()\n        \n        # Parse Cabin\n        cabin_data = X_val_copy[\"Cabin\"].apply(parse_cabin)\n        X_val_copy[\"Deck\"] = cabin_data.apply(lambda x: x[0])\n        X_val_copy[\"Side\"] = cabin_data.apply(lambda x: x[1])\n        \n        # Total spending\n        for col in spending_cols:\n            X_val_copy[col] = X_val_copy[col].fillna(0)\n        X_val_copy[\"TotalSpending\"] = X_val_copy[spending_cols].sum(axis=1)\n        \n        # Fill categorical\n        for col in categorical_cols:\n            X_val_copy[col] = X_val_copy[col].fillna(\"Unknown\").astype(str)\n        \n        return pipe.predict(X_val_copy[numeric_cols + categorical_cols]).astype(bool)\n    \n    return predict\n\n\nif __name__ == \"__main__\":\n    predict_fn = build_predict_fn()\n    score = prepare.evaluate(predict_fn)\n    print(f\"VAL_ACCURACY: {score:.4f}\")\n```\n</code>\n\n<notes_append>\nIteration 41: Returned to clean logistic regression with only strongest EDA-identified features (Age, TotalSpending, HomePlanet, Destination, CryoSleep, VIP, Deck, Side). Removed all interaction features and complex engineering. Previous 40 iterations plateaued at 0.8189; hypothesis is that feature complexity adds noise rather than signal.\n</notes_append>", "reflection": "The last run crashed trying to run an EDA script, returning 0.0000 accuracy. Looking back at the notes, iteration 40 was supposed to fix an escape sequence bug in the EDA script, but the EDA output shown suggests the script did run and produce clean statistics. However, the final VAL_ACCURACY is 0.0000, which means train.py itself is broken. The issue is that train.py is still set up as a modeling script, not an EDA script. I need to restore train.py to a working model state and use the EDA insights to guide a concrete improvement.", "observations": ["The EDA output reveals strong categorical signals: CryoSleep=True has 81.9% transport rate vs 32.8% for False; Deck B/C have higher rates (73.7%, 66.9%); Side S > Side P (55.4% vs 45.3%); Europa has 66.2% vs Earth 42.5%. These are very strong univariate signals.", "Spending columns (RoomService, Spa, VRDeck) have negative correlation with transport (~-0.21 to -0.25), suggesting passengers who spend money are less likely to be transported. This contradicts the intuition that spending activity = staying aboard; transported passengers likely skipped paid amenities.", "Missing value patterns are nearly uniform across transported/not transported (diff <0.005), so missingness itself is not a strong predictor despite being tracked in recent iterations.", "The current best score is 0.8189 (iteration 0). After 40 iterations of feature engineering and hyperparameter tuning, we have not beaten this. Simplification and focusing on the strongest univariate signals (CryoSleep, Deck, Side, HomePlanet, Destination) may be the way forward.", "Current train.py is broken (returning 0.0000), likely due to the EDA script overwriting it. Need to restore a clean, minimal model using the EDA insights."], "hypothesis": "A logistic regression or simple XGBoost using only the strongest univariate predictors (CryoSleep, Deck, Side, HomePlanet, Destination, Age) without complex interactions or many derived features will beat 0.8189 because the EDA shows these features alone have very high signal, and past iterations suggest feature complexity is adding noise rather than signal.", "plan": "Restore train.py to a clean, minimal model: logistic regression with only Age, TotalSpending, and the cabin/categorical features parsed from Cabin and PassengerId. Remove all interaction features (CryoSleep_LogSpending, CryoSleep_Missing, VIP_Missing flags, etc.) and complex engineering that has not helped. Focus on getting the strongest univariate signals right with minimal preprocessing.", "code": "\"\"\"\ntrain.py — Minimal logistic regression with cabin parsing.\nBack to simplicity after 40 iterations of plateau. Using EDA-identified strong signals:\nCryoSleep, Deck, Side, HomePlanet, Destination. Removing interaction features that add noise.\n\"\"\"\nimport sys, pathlib\nsys.path.insert(0, str(pathlib.Path(__file__).resolve().parent.parent))\n\nimport pandas as pd\nimport numpy as np\nfrom sklearn.impute import SimpleImputer\nfrom sklearn.pipeline import Pipeline\nfrom sklearn.preprocessing import StandardScaler, OneHotEncoder\nfrom sklearn.compose import ColumnTransformer\nfrom sklearn.linear_model import LogisticRegression\n\nimport prepare\n\n\ndef parse_cabin(cabin_str):\n    \"\"\"Parse Cabin 'F/0/S' into deck and side.\"\"\"\n    if pd.isna(cabin_str):\n        return np.nan, np.nan\n    parts = str(cabin_str).split(\"/\")\n    if len(parts) == 3:\n        return parts[0], parts[2]\n    return np.nan, np.nan\n\n\ndef build_predict_fn():\n    train_df, _ = prepare.load_split()\n    \n    # Parse Cabin into Deck and Side\n    cabin_data = train_df[\"Cabin\"].apply(parse_cabin)\n    train_df[\"Deck\"] = cabin_data.apply(lambda x: x[0])\n    train_df[\"Side\"] = cabin_data.apply(lambda x: x[1])\n    \n    # Total spending (fill missing with 0)\n    spending_cols = [\"RoomService\", \"FoodCourt\", \"ShoppingMall\", \"Spa\", \"VRDeck\"]\n    for col in spending_cols:\n        train_df[col] = train_df[col].fillna(0)\n    train_df[\"TotalSpending\"] = train_df[spending_cols].sum(axis=1)\n    \n    # Feature set: minimal, strong signals only\n    numeric_cols = [\"Age\", \"TotalSpending\"]\n    categorical_cols = [\"HomePlanet\", \"Destination\", \"CryoSleep\", \"VIP\", \"Deck\", \"Side\"]\n    \n    # Fill categorical NaNs\n    for col in categorical_cols:\n        train_df[col] = train_df[col].fillna(\"Unknown\").astype(str)\n    \n    X = train_df[numeric_cols + categorical_cols]\n    y = train_df[\"Transported\"].astype(int)\n    \n    # Preprocessing\n    numeric_transformer = Pipeline([\n        (\"imputer\", SimpleImputer(strategy=\"median\")),\n        (\"scaler\", StandardScaler()),\n    ])\n    \n    categorical_transformer = Pipeline([\n        (\"onehot\", OneHotEncoder(handle_unknown=\"ignore\", sparse_output=False, max_categories=20)),\n    ])\n    \n    preprocessor = ColumnTransformer([\n        (\"num\", numeric_transformer, numeric_cols),\n        (\"cat\", categorical_transformer, categorical_cols),\n    ])\n    \n    pipe = Pipeline([\n        (\"preprocessor\", preprocessor),\n        (\"clf\", LogisticRegression(max_iter=1000, random_state=42)),\n    ])\n    \n    pipe.fit(X, y)\n    \n    def predict(X_val):\n        X_val_copy = X_val.copy()\n        \n        # Parse Cabin\n        cabin_data = X_val_copy[\"Cabin\"].apply(parse_cabin)\n        X_val_copy[\"Deck\"] = cabin_data.apply(lambda x: x[0])\n        X_val_copy[\"Side\"] = cabin_data.apply(lambda x: x[1])\n        \n        # Total spending\n        for col in spending_cols:\n            X_val_copy[col] = X_val_copy[col].fillna(0)\n        X_val_copy[\"TotalSpending\"] = X_val_copy[spending_cols].sum(axis=1)\n        \n        # Fill categorical\n        for col in categorical_cols:\n            X_val_copy[col] = X_val_copy[col].fillna(\"Unknown\").astype(str)\n        \n        return pipe.predict(X_val_copy[numeric_cols + categorical_cols]).astype(bool)\n    \n    return predict\n\n\nif __name__ == \"__main__\":\n    predict_fn = build_predict_fn()\n    score = prepare.evaluate(predict_fn)\n    print(f\"VAL_ACCURACY: {score:.4f}\")\n", "notes_append": "Iteration 41: Returned to clean logistic regression with only strongest EDA-identified features (Age, TotalSpending, HomePlanet, Destination, CryoSleep, VIP, Deck, Side). Removed all interaction features and complex engineering. Previous 40 iterations plateaued at 0.8189; hypothesis is that feature complexity adds noise rather than signal.", "stdout": "VAL_ACCURACY: 0.7234\n", "stderr": "", "returncode": 0, "score": 0.7234, "kept": false, "status": "reverted", "commit_hash": null, "input_tokens": 4958, "output_tokens": 1865, "cost_usd": 0.014283}
