{"iteration": 7, "timestamp": "2026-05-08T21:14:54", "previous_best": 0.8143, "duration_seconds": 3.84, "agent_response_raw": "<reflection>\nThe last run (iter 23) with Deck-Side interaction regressed to 0.8114, confirming that adding complexity without a strong structural hypothesis doesn't help. The best score remains 0.8143 from iteration 2, achieved with HighSpender as a simple quantile-based spending tier indicator. The notes show that hyperparameter tuning has plateaued and feature engineering attempts (TotalSpending, HasSpent, GroupSize, Deck-Side interaction) have consistently regressed. I should examine the data more carefully to find structural patterns that haven't been tested yet.\n</reflection>\n\n<observations>\n- The best model (iter 2: 0.8143) uses HighSpender as a simple binary threshold feature, suggesting spending level matters but aggregate features are noisy. The current script includes HighSpender and achieves 0.8143, which is still the baseline to beat.\n- Deck-Side interaction (iter 23) regressed to 0.8114, confirming that concatenating categorical features doesn't automatically improve signal. This suggests the value of Deck and Side is already captured by treating them separately.\n- The notes reveal a pattern: simple, atomic features (cabin parsing, GroupId, missingness flags, HighSpender) are stable around 0.8143, while aggregate features (TotalSpending, HasSpent, GroupSize) and interaction features consistently regress. This points to the model fitting noise rather than signal on complex derived features.\n- I have not yet tested whether the model is overfitting (needs regularization) or underfitting (needs different architecture). The XGBoost hyperparameters have been tuned without major gains, suggesting the ceiling is feature-driven, not hyperparameter-driven.\n- Looking at the hints: \"Some columns encode multiple pieces of information\" — I've split Cabin. \"Identifier columns can encode group structure\" — I've used GroupId. But I haven't tested whether PassengerId itself encodes cabin assignment or deck structure beyond the group extraction I'm already doing.\n</observations>\n\n<hypothesis>\nPassengerId may encode sequential cabin assignment or deck location beyond just the group prefix. Testing whether additional PassengerId structure (e.g., the numeric suffix as a proxy for cabin sequence or cabin location within a group) improves prediction over treating it as a pure group identifier.\n</hypothesis>\n\n<plan>\nI will extract and engineer two new features from PassengerId: (1) the numeric suffix (after the underscore), treated as an ordinal feature representing position within the group, and (2) a feature indicating whether the suffix is \"odd\" or \"even\", which may correlate with cabin side or deck structure. I'll add these to the feature set and test whether they improve accuracy over the current 0.8143 baseline.\n</plan>\n\n<code>\n```python\n\"\"\"\ntrain.py — XGBoost with cabin parsing, GroupId, PassengerId structure features, and HighSpender.\nIteration 24: Extract PassengerId numeric suffix and parity to test if passenger position within group correlates with transport.\n\"\"\"\nimport sys, pathlib\nsys.path.insert(0, str(pathlib.Path(__file__).resolve().parent.parent))\n\nimport pandas as pd\nimport numpy as np\nimport xgboost as xgb\nfrom sklearn.impute import SimpleImputer\nfrom sklearn.pipeline import Pipeline\nfrom sklearn.preprocessing import StandardScaler, OneHotEncoder\nfrom sklearn.compose import ColumnTransformer\n\nimport prepare\n\nNUMERIC = [\"Age\", \"RoomService\", \"FoodCourt\", \"ShoppingMall\", \"Spa\", \"VRDeck\"]\nCATEGORICAL = [\"HomePlanet\", \"Destination\", \"CryoSleep\", \"VIP\"]\nSPENDING = [\"RoomService\", \"FoodCourt\", \"ShoppingMall\", \"Spa\", \"VRDeck\"]\n\n\ndef parse_cabin(cabin_str):\n    \"\"\"Parse Cabin 'F/0/S' into deck, room_num, side.\"\"\"\n    if pd.isna(cabin_str):\n        return np.nan, np.nan, np.nan\n    parts = str(cabin_str).split(\"/\")\n    if len(parts) == 3:\n        return parts[0], int(parts[1]) if parts[1].isdigit() else np.nan, parts[2]\n    return np.nan, np.nan, np.nan\n\n\ndef extract_group_id(passenger_id):\n    \"\"\"Extract group ID from PassengerId (e.g., '0001_01' -> '0001').\"\"\"\n    if pd.isna(passenger_id):\n        return np.nan\n    return str(passenger_id).split(\"_\")[0]\n\n\ndef extract_passenger_suffix(passenger_id):\n    \"\"\"Extract numeric suffix from PassengerId (e.g., '0001_01' -> 1).\"\"\"\n    if pd.isna(passenger_id):\n        return np.nan\n    try:\n        suffix = str(passenger_id).split(\"_\")[1]\n        return int(suffix) if suffix.isdigit() else np.nan\n    except:\n        return np.nan\n\n\ndef build_predict_fn():\n    train_df, _ = prepare.load_split()\n    \n    # Parse Cabin into Deck, RoomNum, Side\n    cabin_data = train_df[\"Cabin\"].apply(parse_cabin)\n    train_df[\"Deck\"] = cabin_data.apply(lambda x: x[0])\n    train_df[\"RoomNum\"] = cabin_data.apply(lambda x: x[1])\n    train_df[\"Side\"] = cabin_data.apply(lambda x: x[2])\n    \n    # Extract group ID from PassengerId\n    train_df[\"GroupId\"] = train_df[\"PassengerId\"].apply(extract_group_id)\n    \n    # Extract passenger suffix (position within group)\n    train_df[\"PassengerSuffix\"] = train_df[\"PassengerId\"].apply(extract_passenger_suffix)\n    \n    # Create parity feature from suffix (odd=1, even=0)\n    train_df[\"SuffixOdd\"] = (train_df[\"PassengerSuffix\"] % 2).fillna(0).astype(int)\n    \n    # Fill missing values in spending columns with 0 (indicates not spent)\n    for col in SPENDING:\n        train_df[col] = train_df[col].fillna(0)\n    \n    # Create HighSpender feature: 1 if total spending is in top quartile\n    total_spending = train_df[SPENDING].sum(axis=1)\n    spending_q3 = total_spending.quantile(0.75)\n    train_df[\"HighSpender\"] = (total_spending >= spending_q3).astype(int)\n    \n    # Create explicit missingness flags for CryoSleep and VIP before filling\n    train_df[\"CryoSleep_Missing\"] = train_df[\"CryoSleep\"].isna().astype(int)\n    train_df[\"VIP_Missing\"] = train_df[\"VIP\"].isna().astype(int)\n    \n    # Convert CryoSleep and VIP to string for categorical encoding\n    train_df[\"CryoSleep\"] = train_df[\"CryoSleep\"].fillna(\"Unknown\").astype(str)\n    train_df[\"VIP\"] = train_df[\"VIP\"].fillna(\"Unknown\").astype(str)\n    \n    # Build feature set: core features + cabin parsing + PassengerId structure + missingness flags + HighSpender\n    feature_cols = (\n        [\"Age\"] + SPENDING + CATEGORICAL + \n        [\"Deck\", \"RoomNum\", \"Side\", \"GroupId\", \"PassengerSuffix\", \"SuffixOdd\"] + \n        [\"CryoSleep_Missing\", \"VIP_Missing\", \"HighSpender\"]\n    )\n    X = train_df[feature_cols]\n    y = train_df[\"Transported\"].astype(int)\n    \n    # Define preprocessing for numeric and categorical columns\n    numeric_transformer = Pipeline([\n        (\"imputer\", SimpleImputer(strategy=\"median\")),\n        (\"scaler\", StandardScaler()),\n    ])\n    \n    categorical_transformer = Pipeline([\n        (\"imputer\", SimpleImputer(strategy=\"most_frequent\")),\n        (\"onehot\", OneHotEncoder(handle_unknown=\"ignore\", sparse_output=False)),\n    ])\n    \n    preprocessor = ColumnTransformer([\n        (\"num\", numeric_transformer, [\"Age\", \"RoomNum\", \"PassengerSuffix\", \"SuffixOdd\", \"CryoSleep_Missing\", \"VIP_Missing\", \"HighSpender\"] + SPENDING),\n        (\"cat\", categorical_transformer, CATEGORICAL + [\"Deck\", \"Side\", \"GroupId\"]),\n    ])\n    \n    pipe = Pipeline([\n        (\"preprocessor\", preprocessor),\n        (\"clf\", xgb.XGBClassifier(n_estimators=100, max_depth=6, learning_rate=0.1, random_state=42, verbosity=0)),\n    ])\n    \n    pipe.fit(X, y)\n    \n    def predict(X_val):\n        # Parse Cabin in validation set\n        cabin_data = X_val[\"Cabin\"].apply(parse_cabin)\n        X_val_copy = X_val.copy()\n        X_val_copy[\"Deck\"] = cabin_data.apply(lambda x: x[0])\n        X_val_copy[\"RoomNum\"] = cabin_data.apply(lambda x: x[1])\n        X_val_copy[\"Side\"] = cabin_data.apply(lambda x: x[2])\n        \n        # Extract group ID\n        X_val_copy[\"GroupId\"] = X_val_copy[\"PassengerId\"].apply(extract_group_id)\n        \n        # Extract passenger suffix and parity\n        X_val_copy[\"PassengerSuffix\"] = X_val_copy[\"PassengerId\"].apply(extract_passenger_suffix)\n        X_val_copy[\"SuffixOdd\"] = (X_val_copy[\"PassengerSuffix\"] % 2).fillna(0).astype(int)\n        \n        # Fill missing spending with 0\n        for col in SPENDING:\n            X_val_copy[col] = X_val_copy[col].fillna(0)\n        \n        # Create HighSpender feature using same threshold as training\n        total_spending = X_val_copy[SPENDING].sum(axis=1)\n        X_val_copy[\"HighSpender\"] = (total_spending >= spending_q3).astype(int)\n        \n        # Create explicit missingness flags for CryoSleep and VIP before filling\n        X_val_copy[\"CryoSleep_Missing\"] = X_val_copy[\"CryoSleep\"].isna().astype(int)\n        X_val_copy[\"VIP_Missing\"] = X_val_copy[\"VIP\"].isna().astype(int)\n        \n        # Handle CryoSleep and VIP\n        X_val_copy[\"CryoSleep\"] = X_val_copy[\"CryoSleep\"].fillna(\"Unknown\").astype(str)\n        X_val_copy[\"VIP\"] = X_val_copy[\"VIP\"].fillna(\"Unknown\").astype(str)\n        \n        return pipe.predict(X_val_copy[feature_cols]).astype(bool)\n    \n    return predict\n\n\nif __name__ == \"__main__\":\n    predict_fn = build_predict_fn()\n    score = prepare.evaluate(predict_fn)\n    print(f\"VAL_ACCURACY: {score:.4f}\")\n```\n</code>\n\n<notes_append>\nIteration 24: Extracted PassengerId numeric suffix and parity (odd/even) to test whether passenger position within group encodes cabin structure. Adding PassengerSuffix and SuffixOdd as numeric/parity features while keeping HighSpender, cabin parsing, and GroupId. Hypothesis: position within group may correlate with deck/cabin assignment.\n</notes_append>", "reflection": "The last run (iter 23) with Deck-Side interaction regressed to 0.8114, confirming that adding complexity without a strong structural hypothesis doesn't help. The best score remains 0.8143 from iteration 2, achieved with HighSpender as a simple quantile-based spending tier indicator. The notes show that hyperparameter tuning has plateaued and feature engineering attempts (TotalSpending, HasSpent, GroupSize, Deck-Side interaction) have consistently regressed. I should examine the data more carefully to find structural patterns that haven't been tested yet.", "observations": ["The best model (iter 2: 0.8143) uses HighSpender as a simple binary threshold feature, suggesting spending level matters but aggregate features are noisy. The current script includes HighSpender and achieves 0.8143, which is still the baseline to beat.", "Deck-Side interaction (iter 23) regressed to 0.8114, confirming that concatenating categorical features doesn't automatically improve signal. This suggests the value of Deck and Side is already captured by treating them separately.", "The notes reveal a pattern: simple, atomic features (cabin parsing, GroupId, missingness flags, HighSpender) are stable around 0.8143, while aggregate features (TotalSpending, HasSpent, GroupSize) and interaction features consistently regress. This points to the model fitting noise rather than signal on complex derived features.", "I have not yet tested whether the model is overfitting (needs regularization) or underfitting (needs different architecture). The XGBoost hyperparameters have been tuned without major gains, suggesting the ceiling is feature-driven, not hyperparameter-driven.", "Looking at the hints: \"Some columns encode multiple pieces of information\" — I've split Cabin. \"Identifier columns can encode group structure\" — I've used GroupId. But I haven't tested whether PassengerId itself encodes cabin assignment or deck structure beyond the group extraction I'm already doing."], "hypothesis": "PassengerId may encode sequential cabin assignment or deck location beyond just the group prefix. Testing whether additional PassengerId structure (e.g., the numeric suffix as a proxy for cabin sequence or cabin location within a group) improves prediction over treating it as a pure group identifier.", "plan": "I will extract and engineer two new features from PassengerId: (1) the numeric suffix (after the underscore), treated as an ordinal feature representing position within the group, and (2) a feature indicating whether the suffix is \"odd\" or \"even\", which may correlate with cabin side or deck structure. I'll add these to the feature set and test whether they improve accuracy over the current 0.8143 baseline.", "code": "\"\"\"\ntrain.py — XGBoost with cabin parsing, GroupId, PassengerId structure features, and HighSpender.\nIteration 24: Extract PassengerId numeric suffix and parity to test if passenger position within group correlates with transport.\n\"\"\"\nimport sys, pathlib\nsys.path.insert(0, str(pathlib.Path(__file__).resolve().parent.parent))\n\nimport pandas as pd\nimport numpy as np\nimport xgboost as xgb\nfrom sklearn.impute import SimpleImputer\nfrom sklearn.pipeline import Pipeline\nfrom sklearn.preprocessing import StandardScaler, OneHotEncoder\nfrom sklearn.compose import ColumnTransformer\n\nimport prepare\n\nNUMERIC = [\"Age\", \"RoomService\", \"FoodCourt\", \"ShoppingMall\", \"Spa\", \"VRDeck\"]\nCATEGORICAL = [\"HomePlanet\", \"Destination\", \"CryoSleep\", \"VIP\"]\nSPENDING = [\"RoomService\", \"FoodCourt\", \"ShoppingMall\", \"Spa\", \"VRDeck\"]\n\n\ndef parse_cabin(cabin_str):\n    \"\"\"Parse Cabin 'F/0/S' into deck, room_num, side.\"\"\"\n    if pd.isna(cabin_str):\n        return np.nan, np.nan, np.nan\n    parts = str(cabin_str).split(\"/\")\n    if len(parts) == 3:\n        return parts[0], int(parts[1]) if parts[1].isdigit() else np.nan, parts[2]\n    return np.nan, np.nan, np.nan\n\n\ndef extract_group_id(passenger_id):\n    \"\"\"Extract group ID from PassengerId (e.g., '0001_01' -> '0001').\"\"\"\n    if pd.isna(passenger_id):\n        return np.nan\n    return str(passenger_id).split(\"_\")[0]\n\n\ndef extract_passenger_suffix(passenger_id):\n    \"\"\"Extract numeric suffix from PassengerId (e.g., '0001_01' -> 1).\"\"\"\n    if pd.isna(passenger_id):\n        return np.nan\n    try:\n        suffix = str(passenger_id).split(\"_\")[1]\n        return int(suffix) if suffix.isdigit() else np.nan\n    except:\n        return np.nan\n\n\ndef build_predict_fn():\n    train_df, _ = prepare.load_split()\n    \n    # Parse Cabin into Deck, RoomNum, Side\n    cabin_data = train_df[\"Cabin\"].apply(parse_cabin)\n    train_df[\"Deck\"] = cabin_data.apply(lambda x: x[0])\n    train_df[\"RoomNum\"] = cabin_data.apply(lambda x: x[1])\n    train_df[\"Side\"] = cabin_data.apply(lambda x: x[2])\n    \n    # Extract group ID from PassengerId\n    train_df[\"GroupId\"] = train_df[\"PassengerId\"].apply(extract_group_id)\n    \n    # Extract passenger suffix (position within group)\n    train_df[\"PassengerSuffix\"] = train_df[\"PassengerId\"].apply(extract_passenger_suffix)\n    \n    # Create parity feature from suffix (odd=1, even=0)\n    train_df[\"SuffixOdd\"] = (train_df[\"PassengerSuffix\"] % 2).fillna(0).astype(int)\n    \n    # Fill missing values in spending columns with 0 (indicates not spent)\n    for col in SPENDING:\n        train_df[col] = train_df[col].fillna(0)\n    \n    # Create HighSpender feature: 1 if total spending is in top quartile\n    total_spending = train_df[SPENDING].sum(axis=1)\n    spending_q3 = total_spending.quantile(0.75)\n    train_df[\"HighSpender\"] = (total_spending >= spending_q3).astype(int)\n    \n    # Create explicit missingness flags for CryoSleep and VIP before filling\n    train_df[\"CryoSleep_Missing\"] = train_df[\"CryoSleep\"].isna().astype(int)\n    train_df[\"VIP_Missing\"] = train_df[\"VIP\"].isna().astype(int)\n    \n    # Convert CryoSleep and VIP to string for categorical encoding\n    train_df[\"CryoSleep\"] = train_df[\"CryoSleep\"].fillna(\"Unknown\").astype(str)\n    train_df[\"VIP\"] = train_df[\"VIP\"].fillna(\"Unknown\").astype(str)\n    \n    # Build feature set: core features + cabin parsing + PassengerId structure + missingness flags + HighSpender\n    feature_cols = (\n        [\"Age\"] + SPENDING + CATEGORICAL + \n        [\"Deck\", \"RoomNum\", \"Side\", \"GroupId\", \"PassengerSuffix\", \"SuffixOdd\"] + \n        [\"CryoSleep_Missing\", \"VIP_Missing\", \"HighSpender\"]\n    )\n    X = train_df[feature_cols]\n    y = train_df[\"Transported\"].astype(int)\n    \n    # Define preprocessing for numeric and categorical columns\n    numeric_transformer = Pipeline([\n        (\"imputer\", SimpleImputer(strategy=\"median\")),\n        (\"scaler\", StandardScaler()),\n    ])\n    \n    categorical_transformer = Pipeline([\n        (\"imputer\", SimpleImputer(strategy=\"most_frequent\")),\n        (\"onehot\", OneHotEncoder(handle_unknown=\"ignore\", sparse_output=False)),\n    ])\n    \n    preprocessor = ColumnTransformer([\n        (\"num\", numeric_transformer, [\"Age\", \"RoomNum\", \"PassengerSuffix\", \"SuffixOdd\", \"CryoSleep_Missing\", \"VIP_Missing\", \"HighSpender\"] + SPENDING),\n        (\"cat\", categorical_transformer, CATEGORICAL + [\"Deck\", \"Side\", \"GroupId\"]),\n    ])\n    \n    pipe = Pipeline([\n        (\"preprocessor\", preprocessor),\n        (\"clf\", xgb.XGBClassifier(n_estimators=100, max_depth=6, learning_rate=0.1, random_state=42, verbosity=0)),\n    ])\n    \n    pipe.fit(X, y)\n    \n    def predict(X_val):\n        # Parse Cabin in validation set\n        cabin_data = X_val[\"Cabin\"].apply(parse_cabin)\n        X_val_copy = X_val.copy()\n        X_val_copy[\"Deck\"] = cabin_data.apply(lambda x: x[0])\n        X_val_copy[\"RoomNum\"] = cabin_data.apply(lambda x: x[1])\n        X_val_copy[\"Side\"] = cabin_data.apply(lambda x: x[2])\n        \n        # Extract group ID\n        X_val_copy[\"GroupId\"] = X_val_copy[\"PassengerId\"].apply(extract_group_id)\n        \n        # Extract passenger suffix and parity\n        X_val_copy[\"PassengerSuffix\"] = X_val_copy[\"PassengerId\"].apply(extract_passenger_suffix)\n        X_val_copy[\"SuffixOdd\"] = (X_val_copy[\"PassengerSuffix\"] % 2).fillna(0).astype(int)\n        \n        # Fill missing spending with 0\n        for col in SPENDING:\n            X_val_copy[col] = X_val_copy[col].fillna(0)\n        \n        # Create HighSpender feature using same threshold as training\n        total_spending = X_val_copy[SPENDING].sum(axis=1)\n        X_val_copy[\"HighSpender\"] = (total_spending >= spending_q3).astype(int)\n        \n        # Create explicit missingness flags for CryoSleep and VIP before filling\n        X_val_copy[\"CryoSleep_Missing\"] = X_val_copy[\"CryoSleep\"].isna().astype(int)\n        X_val_copy[\"VIP_Missing\"] = X_val_copy[\"VIP\"].isna().astype(int)\n        \n        # Handle CryoSleep and VIP\n        X_val_copy[\"CryoSleep\"] = X_val_copy[\"CryoSleep\"].fillna(\"Unknown\").astype(str)\n        X_val_copy[\"VIP\"] = X_val_copy[\"VIP\"].fillna(\"Unknown\").astype(str)\n        \n        return pipe.predict(X_val_copy[feature_cols]).astype(bool)\n    \n    return predict\n\n\nif __name__ == \"__main__\":\n    predict_fn = build_predict_fn()\n    score = prepare.evaluate(predict_fn)\n    print(f\"VAL_ACCURACY: {score:.4f}\")\n", "notes_append": "Iteration 24: Extracted PassengerId numeric suffix and parity (odd/even) to test whether passenger position within group encodes cabin structure. Adding PassengerSuffix and SuffixOdd as numeric/parity features while keeping HighSpender, cabin parsing, and GroupId. Hypothesis: position within group may correlate with deck/cabin assignment.", "stdout": "VAL_ACCURACY: 0.8091\n", "stderr": "", "returncode": 0, "score": 0.8091, "kept": false, "status": "reverted", "commit_hash": null, "input_tokens": 4175, "output_tokens": 2880, "cost_usd": 0.018575}
