{"iteration": 8, "timestamp": "2026-05-08T20:53:41", "previous_best": 0.7907, "duration_seconds": 3.77, "agent_response_raw": "<reflection>\nThe last run regressed from 0.7907 to 0.7884, so the TotalSpending and HasSpent features were reverted. The current best remains 0.7907 from iteration 6 (data inspection baseline). The data inspection output revealed patterns in spending and CryoSleep correlations, but subsequent attempts to engineer new features have not improved beyond the baseline. I need to examine whether the issue is feature redundancy, model capacity, or whether the current pipeline is already near its ceiling for this approach.\n</reflection>\n\n<observations>\n- The current best score (0.7907) has held steady through iterations 6, 12, 13, and 14. Attempts to add new features (TotalSpending, HasSpent) in iter 15 caused regression to 0.7884, suggesting overfitting or feature noise.\n- The notes indicate multiple model class experiments (RandomForest in iter 11, XGBoost in iter 10) both regressed from 0.7907, suggesting LogisticRegression with the proven feature set is well-tuned for this data.\n- The data inspection in iter 6 revealed correlations and distributions but hasn't yet been converted into a successful new feature beyond what's already in the pipeline.\n- The feature engineering so far includes: Cabin parsing (Deck, RoomNum, Side), GroupId extraction, spending-as-zero filling, explicit missingness flags for CryoSleep and VIP. This is already fairly comprehensive.\n- The regression in iter 15 when adding aggregate spending features suggests the model may already be capturing spending signal adequately through individual columns, and that adding derived features introduces noise rather than signal.\n</observations>\n\n<hypothesis>\nThe current LogisticRegression pipeline with Cabin parsing, GroupId, and missingness flags has saturated the signal available from the training data at ~0.7907. The next improvement requires either: (a) discovering a latent grouping or structure in the ID columns that hasn't been extracted yet, or (b) testing whether removing low-signal features (e.g., redundant categorical variables) and simplifying the model reduces overfitting. I will test hypothesis (a) by examining whether PassengerId or GroupId encode family/group structure that could be modeled as group-level features.\n</hypothesis>\n\n<plan>\nI will add a feature that counts the group size (number of passengers with the same GroupId) and test whether group size correlates with transportation. This tests whether group-level statistics contain signal. If groups of 1 or very large groups have different transport rates, group size could be a useful feature without introducing the noise that previous aggregate spending features did.\n</plan>\n\n<code>\n```python\n\"\"\"\ntrain.py — logistic regression with cabin parsing, GroupId, and group size feature.\nTesting whether group-level statistics improve over baseline.\n\"\"\"\nimport sys, pathlib\nsys.path.insert(0, str(pathlib.Path(__file__).resolve().parent.parent))\n\nimport pandas as pd\nimport numpy as np\nfrom sklearn.linear_model import LogisticRegression\nfrom sklearn.impute import SimpleImputer\nfrom sklearn.pipeline import Pipeline\nfrom sklearn.preprocessing import StandardScaler, OneHotEncoder\nfrom sklearn.compose import ColumnTransformer\n\nimport prepare\n\nNUMERIC = [\"Age\", \"RoomService\", \"FoodCourt\", \"ShoppingMall\", \"Spa\", \"VRDeck\"]\nCATEGORICAL = [\"HomePlanet\", \"Destination\", \"CryoSleep\", \"VIP\"]\nSPENDING = [\"RoomService\", \"FoodCourt\", \"ShoppingMall\", \"Spa\", \"VRDeck\"]\n\n\ndef parse_cabin(cabin_str):\n    \"\"\"Parse Cabin 'F/0/S' into deck, room_num, side.\"\"\"\n    if pd.isna(cabin_str):\n        return np.nan, np.nan, np.nan\n    parts = str(cabin_str).split(\"/\")\n    if len(parts) == 3:\n        return parts[0], int(parts[1]) if parts[1].isdigit() else np.nan, parts[2]\n    return np.nan, np.nan, np.nan\n\n\ndef extract_group_id(passenger_id):\n    \"\"\"Extract group ID from PassengerId (e.g., '0001_01' -> '0001').\"\"\"\n    if pd.isna(passenger_id):\n        return np.nan\n    return str(passenger_id).split(\"_\")[0]\n\n\ndef build_predict_fn():\n    train_df, _ = prepare.load_split()\n    \n    # Parse Cabin into Deck, RoomNum, Side\n    cabin_data = train_df[\"Cabin\"].apply(parse_cabin)\n    train_df[\"Deck\"] = cabin_data.apply(lambda x: x[0])\n    train_df[\"RoomNum\"] = cabin_data.apply(lambda x: x[1])\n    train_df[\"Side\"] = cabin_data.apply(lambda x: x[2])\n    \n    # Extract group ID from PassengerId\n    train_df[\"GroupId\"] = train_df[\"PassengerId\"].apply(extract_group_id)\n    \n    # Add group size: count of passengers in each group\n    train_df[\"GroupSize\"] = train_df.groupby(\"GroupId\", dropna=False)[\"GroupId\"].transform(\"count\")\n    \n    # Fill missing values in spending columns with 0 (indicates not spent)\n    for col in SPENDING:\n        train_df[col] = train_df[col].fillna(0)\n    \n    # Create explicit missingness flags for CryoSleep and VIP before filling\n    train_df[\"CryoSleep_Missing\"] = train_df[\"CryoSleep\"].isna().astype(int)\n    train_df[\"VIP_Missing\"] = train_df[\"VIP\"].isna().astype(int)\n    \n    # Convert CryoSleep and VIP to string for categorical encoding\n    train_df[\"CryoSleep\"] = train_df[\"CryoSleep\"].fillna(\"Unknown\").astype(str)\n    train_df[\"VIP\"] = train_df[\"VIP\"].fillna(\"Unknown\").astype(str)\n    \n    # Build feature set: core features + cabin parsing + missingness flags + group size\n    feature_cols = (\n        [\"Age\"] + SPENDING + CATEGORICAL + \n        [\"Deck\", \"RoomNum\", \"Side\", \"GroupId\", \"GroupSize\"] + \n        [\"CryoSleep_Missing\", \"VIP_Missing\"]\n    )\n    X = train_df[feature_cols]\n    y = train_df[\"Transported\"].astype(int)\n    \n    # Define preprocessing for numeric and categorical columns\n    numeric_transformer = Pipeline([\n        (\"imputer\", SimpleImputer(strategy=\"median\")),\n        (\"scaler\", StandardScaler()),\n    ])\n    \n    categorical_transformer = Pipeline([\n        (\"imputer\", SimpleImputer(strategy=\"most_frequent\")),\n        (\"onehot\", OneHotEncoder(handle_unknown=\"ignore\", sparse_output=False)),\n    ])\n    \n    preprocessor = ColumnTransformer([\n        (\"num\", numeric_transformer, [\"Age\", \"RoomNum\", \"GroupSize\", \"CryoSleep_Missing\", \"VIP_Missing\"] + SPENDING),\n        (\"cat\", categorical_transformer, CATEGORICAL + [\"Deck\", \"Side\", \"GroupId\"]),\n    ])\n    \n    pipe = Pipeline([\n        (\"preprocessor\", preprocessor),\n        (\"clf\", LogisticRegression(max_iter=1000)),\n    ])\n    \n    pipe.fit(X, y)\n    \n    def predict(X_val):\n        # Parse Cabin in validation set\n        cabin_data = X_val[\"Cabin\"].apply(parse_cabin)\n        X_val_copy = X_val.copy()\n        X_val_copy[\"Deck\"] = cabin_data.apply(lambda x: x[0])\n        X_val_copy[\"RoomNum\"] = cabin_data.apply(lambda x: x[1])\n        X_val_copy[\"Side\"] = cabin_data.apply(lambda x: x[2])\n        \n        # Extract group ID\n        X_val_copy[\"GroupId\"] = X_val_copy[\"PassengerId\"].apply(extract_group_id)\n        \n        # Compute group size on validation set\n        X_val_copy[\"GroupSize\"] = X_val_copy.groupby(\"GroupId\", dropna=False)[\"GroupId\"].transform(\"count\")\n        \n        # Fill missing spending with 0\n        for col in SPENDING:\n            X_val_copy[col] = X_val_copy[col].fillna(0)\n        \n        # Create explicit missingness flags for CryoSleep and VIP before filling\n        X_val_copy[\"CryoSleep_Missing\"] = X_val_copy[\"CryoSleep\"].isna().astype(int)\n        X_val_copy[\"VIP_Missing\"] = X_val_copy[\"VIP\"].isna().astype(int)\n        \n        # Handle CryoSleep and VIP\n        X_val_copy[\"CryoSleep\"] = X_val_copy[\"CryoSleep\"].fillna(\"Unknown\").astype(str)\n        X_val_copy[\"VIP\"] = X_val_copy[\"VIP\"].fillna(\"Unknown\").astype(str)\n        \n        return pipe.predict(X_val_copy[feature_cols]).astype(bool)\n    \n    return predict\n\n\nif __name__ == \"__main__\":\n    predict_fn = build_predict_fn()\n    score = prepare.evaluate(predict_fn)\n    print(f\"VAL_ACCURACY: {score:.4f}\")\n```\n</code>\n\n<notes_append>\nIteration 16: Added GroupSize (count of passengers per GroupId) as numeric feature to test whether group-level statistics encode transport signal. Light structural change that doesn't add noise like aggregate spending did.\n</notes_append>", "reflection": "The last run regressed from 0.7907 to 0.7884, so the TotalSpending and HasSpent features were reverted. The current best remains 0.7907 from iteration 6 (data inspection baseline). The data inspection output revealed patterns in spending and CryoSleep correlations, but subsequent attempts to engineer new features have not improved beyond the baseline. I need to examine whether the issue is feature redundancy, model capacity, or whether the current pipeline is already near its ceiling for this approach.", "observations": ["The current best score (0.7907) has held steady through iterations 6, 12, 13, and 14. Attempts to add new features (TotalSpending, HasSpent) in iter 15 caused regression to 0.7884, suggesting overfitting or feature noise.", "The notes indicate multiple model class experiments (RandomForest in iter 11, XGBoost in iter 10) both regressed from 0.7907, suggesting LogisticRegression with the proven feature set is well-tuned for this data.", "The data inspection in iter 6 revealed correlations and distributions but hasn't yet been converted into a successful new feature beyond what's already in the pipeline.", "The feature engineering so far includes: Cabin parsing (Deck, RoomNum, Side), GroupId extraction, spending-as-zero filling, explicit missingness flags for CryoSleep and VIP. This is already fairly comprehensive.", "The regression in iter 15 when adding aggregate spending features suggests the model may already be capturing spending signal adequately through individual columns, and that adding derived features introduces noise rather than signal."], "hypothesis": "The current LogisticRegression pipeline with Cabin parsing, GroupId, and missingness flags has saturated the signal available from the training data at ~0.7907. The next improvement requires either: (a) discovering a latent grouping or structure in the ID columns that hasn't been extracted yet, or (b) testing whether removing low-signal features (e.g., redundant categorical variables) and simplifying the model reduces overfitting. I will test hypothesis (a) by examining whether PassengerId or GroupId encode family/group structure that could be modeled as group-level features.", "plan": "I will add a feature that counts the group size (number of passengers with the same GroupId) and test whether group size correlates with transportation. This tests whether group-level statistics contain signal. If groups of 1 or very large groups have different transport rates, group size could be a useful feature without introducing the noise that previous aggregate spending features did.", "code": "\"\"\"\ntrain.py — logistic regression with cabin parsing, GroupId, and group size feature.\nTesting whether group-level statistics improve over baseline.\n\"\"\"\nimport sys, pathlib\nsys.path.insert(0, str(pathlib.Path(__file__).resolve().parent.parent))\n\nimport pandas as pd\nimport numpy as np\nfrom sklearn.linear_model import LogisticRegression\nfrom sklearn.impute import SimpleImputer\nfrom sklearn.pipeline import Pipeline\nfrom sklearn.preprocessing import StandardScaler, OneHotEncoder\nfrom sklearn.compose import ColumnTransformer\n\nimport prepare\n\nNUMERIC = [\"Age\", \"RoomService\", \"FoodCourt\", \"ShoppingMall\", \"Spa\", \"VRDeck\"]\nCATEGORICAL = [\"HomePlanet\", \"Destination\", \"CryoSleep\", \"VIP\"]\nSPENDING = [\"RoomService\", \"FoodCourt\", \"ShoppingMall\", \"Spa\", \"VRDeck\"]\n\n\ndef parse_cabin(cabin_str):\n    \"\"\"Parse Cabin 'F/0/S' into deck, room_num, side.\"\"\"\n    if pd.isna(cabin_str):\n        return np.nan, np.nan, np.nan\n    parts = str(cabin_str).split(\"/\")\n    if len(parts) == 3:\n        return parts[0], int(parts[1]) if parts[1].isdigit() else np.nan, parts[2]\n    return np.nan, np.nan, np.nan\n\n\ndef extract_group_id(passenger_id):\n    \"\"\"Extract group ID from PassengerId (e.g., '0001_01' -> '0001').\"\"\"\n    if pd.isna(passenger_id):\n        return np.nan\n    return str(passenger_id).split(\"_\")[0]\n\n\ndef build_predict_fn():\n    train_df, _ = prepare.load_split()\n    \n    # Parse Cabin into Deck, RoomNum, Side\n    cabin_data = train_df[\"Cabin\"].apply(parse_cabin)\n    train_df[\"Deck\"] = cabin_data.apply(lambda x: x[0])\n    train_df[\"RoomNum\"] = cabin_data.apply(lambda x: x[1])\n    train_df[\"Side\"] = cabin_data.apply(lambda x: x[2])\n    \n    # Extract group ID from PassengerId\n    train_df[\"GroupId\"] = train_df[\"PassengerId\"].apply(extract_group_id)\n    \n    # Add group size: count of passengers in each group\n    train_df[\"GroupSize\"] = train_df.groupby(\"GroupId\", dropna=False)[\"GroupId\"].transform(\"count\")\n    \n    # Fill missing values in spending columns with 0 (indicates not spent)\n    for col in SPENDING:\n        train_df[col] = train_df[col].fillna(0)\n    \n    # Create explicit missingness flags for CryoSleep and VIP before filling\n    train_df[\"CryoSleep_Missing\"] = train_df[\"CryoSleep\"].isna().astype(int)\n    train_df[\"VIP_Missing\"] = train_df[\"VIP\"].isna().astype(int)\n    \n    # Convert CryoSleep and VIP to string for categorical encoding\n    train_df[\"CryoSleep\"] = train_df[\"CryoSleep\"].fillna(\"Unknown\").astype(str)\n    train_df[\"VIP\"] = train_df[\"VIP\"].fillna(\"Unknown\").astype(str)\n    \n    # Build feature set: core features + cabin parsing + missingness flags + group size\n    feature_cols = (\n        [\"Age\"] + SPENDING + CATEGORICAL + \n        [\"Deck\", \"RoomNum\", \"Side\", \"GroupId\", \"GroupSize\"] + \n        [\"CryoSleep_Missing\", \"VIP_Missing\"]\n    )\n    X = train_df[feature_cols]\n    y = train_df[\"Transported\"].astype(int)\n    \n    # Define preprocessing for numeric and categorical columns\n    numeric_transformer = Pipeline([\n        (\"imputer\", SimpleImputer(strategy=\"median\")),\n        (\"scaler\", StandardScaler()),\n    ])\n    \n    categorical_transformer = Pipeline([\n        (\"imputer\", SimpleImputer(strategy=\"most_frequent\")),\n        (\"onehot\", OneHotEncoder(handle_unknown=\"ignore\", sparse_output=False)),\n    ])\n    \n    preprocessor = ColumnTransformer([\n        (\"num\", numeric_transformer, [\"Age\", \"RoomNum\", \"GroupSize\", \"CryoSleep_Missing\", \"VIP_Missing\"] + SPENDING),\n        (\"cat\", categorical_transformer, CATEGORICAL + [\"Deck\", \"Side\", \"GroupId\"]),\n    ])\n    \n    pipe = Pipeline([\n        (\"preprocessor\", preprocessor),\n        (\"clf\", LogisticRegression(max_iter=1000)),\n    ])\n    \n    pipe.fit(X, y)\n    \n    def predict(X_val):\n        # Parse Cabin in validation set\n        cabin_data = X_val[\"Cabin\"].apply(parse_cabin)\n        X_val_copy = X_val.copy()\n        X_val_copy[\"Deck\"] = cabin_data.apply(lambda x: x[0])\n        X_val_copy[\"RoomNum\"] = cabin_data.apply(lambda x: x[1])\n        X_val_copy[\"Side\"] = cabin_data.apply(lambda x: x[2])\n        \n        # Extract group ID\n        X_val_copy[\"GroupId\"] = X_val_copy[\"PassengerId\"].apply(extract_group_id)\n        \n        # Compute group size on validation set\n        X_val_copy[\"GroupSize\"] = X_val_copy.groupby(\"GroupId\", dropna=False)[\"GroupId\"].transform(\"count\")\n        \n        # Fill missing spending with 0\n        for col in SPENDING:\n            X_val_copy[col] = X_val_copy[col].fillna(0)\n        \n        # Create explicit missingness flags for CryoSleep and VIP before filling\n        X_val_copy[\"CryoSleep_Missing\"] = X_val_copy[\"CryoSleep\"].isna().astype(int)\n        X_val_copy[\"VIP_Missing\"] = X_val_copy[\"VIP\"].isna().astype(int)\n        \n        # Handle CryoSleep and VIP\n        X_val_copy[\"CryoSleep\"] = X_val_copy[\"CryoSleep\"].fillna(\"Unknown\").astype(str)\n        X_val_copy[\"VIP\"] = X_val_copy[\"VIP\"].fillna(\"Unknown\").astype(str)\n        \n        return pipe.predict(X_val_copy[feature_cols]).astype(bool)\n    \n    return predict\n\n\nif __name__ == \"__main__\":\n    predict_fn = build_predict_fn()\n    score = prepare.evaluate(predict_fn)\n    print(f\"VAL_ACCURACY: {score:.4f}\")\n", "notes_append": "Iteration 16: Added GroupSize (count of passengers per GroupId) as numeric feature to test whether group-level statistics encode transport signal. Light structural change that doesn't add noise like aggregate spending did.", "stdout": "VAL_ACCURACY: 0.7895\n", "stderr": "", "returncode": 0, "score": 0.7895, "kept": false, "status": "reverted", "commit_hash": null, "input_tokens": 4228, "output_tokens": 2377, "cost_usd": 0.016113000000000002}
