{"iteration": 5, "timestamp": "2026-05-08T23:09:15", "previous_best": 0.8235, "duration_seconds": 11.65, "agent_response_raw": "<reflection>\nThe baseline is holding steady at 0.8235 across multiple iterations. The EDA output reveals strong variation in transport rates across decks (B at 73.7%, D at 44.8%, E at 36.9%), and most passengers are on decks F and G. The current model with XGBoost and all engineered features has plateaued. I should investigate whether deck-specific patterns or deck isolation (treating decks as distinct subgroups) could improve the model, since the transport rate spread across decks is large enough to be predictively useful.\n</reflection>\n\n<observations>\n- Deck assignment has extremely strong variation in transport rates: deck B transports 73.7% of passengers, while deck E transports only 36.9%. This is a 37-percentage-point spread—far too large to ignore.\n- The current model includes Deck as a one-hot categorical feature, but it treats all decks equally. We might be missing nonlinear interactions: passengers on high-risk decks (D, E) might respond differently to spending or CryoSleep than passengers on safe decks (B).\n- Group sizes span 1 to 6 passengers in the shown sample, and transport mean varies widely per group. The grouping signal is real but might be suppressed by global preprocessing that doesn't account for deck-level differences.\n- ~161 missing cabins (2.3%) are labeled NaN in Deck; these are currently treated as a separate category, but we could test whether imputing them to the modal deck (F) or treating them as a risk signal improves fit.\n- The current best (0.8235) is solid but static across 5 iterations. A structural change—not another hyperparameter tweak—is needed.\n</observations>\n\n<hypothesis>\nDeck drives transport risk so strongly (37pp spread) that a deck-aware model—either stratifying preprocessing per deck or adding deck-specific interaction features—will improve accuracy. Specifically, adding interaction terms between Deck and high-signal features like CryoSleep and TotalSpending will help the model learn that the same behavior carries different risk on different decks.\n</hypothesis>\n\n<plan>\nAdd deck-specific interaction features: CryoSleep×Deck and TotalSpending×Deck (via polynomial expansion or explicit interaction columns). Keep the same XGBoost config and preprocessing; the goal is to let the model discover that deck modulates the effect of behavior. This tests whether the hidden structure is deck-driven without requiring model refactoring.\n</plan>\n\n<code>\n```python\n\"\"\"\ntrain.py — Iteration 126: Add deck-specific interaction features.\nDeck shows 37pp transport rate spread (B:73.7% vs E:36.9%).\nHypothesis: CryoSleep×Deck and TotalSpending×Deck interactions improve fit.\n\"\"\"\nimport sys, pathlib\nsys.path.insert(0, str(pathlib.Path(__file__).resolve().parent.parent))\n\nimport pandas as pd\nimport numpy as np\nimport xgboost as xgb\nfrom sklearn.impute import SimpleImputer\nfrom sklearn.pipeline import Pipeline\nfrom sklearn.preprocessing import StandardScaler, OneHotEncoder\nfrom sklearn.compose import ColumnTransformer\n\nimport prepare\n\nNUMERIC = [\"Age\", \"RoomService\", \"FoodCourt\", \"ShoppingMall\", \"Spa\", \"VRDeck\"]\nCATEGORICAL = [\"HomePlanet\", \"Destination\", \"CryoSleep\", \"VIP\"]\nSPENDING = [\"RoomService\", \"FoodCourt\", \"ShoppingMall\", \"Spa\", \"VRDeck\"]\n\n\ndef parse_cabin(cabin_str):\n    \"\"\"Parse Cabin 'F/0/S' into deck, room_num, side.\"\"\"\n    if pd.isna(cabin_str):\n        return np.nan, np.nan, np.nan\n    parts = str(cabin_str).split(\"/\")\n    if len(parts) == 3:\n        return parts[0], int(parts[1]) if parts[1].isdigit() else np.nan, parts[2]\n    return np.nan, np.nan, np.nan\n\n\ndef extract_group_id(passenger_id):\n    \"\"\"Extract group ID from PassengerId (e.g., '0001_01' -> '0001').\"\"\"\n    if pd.isna(passenger_id):\n        return np.nan\n    return str(passenger_id).split(\"_\")[0]\n\n\ndef engineer_features(df):\n    \"\"\"Engineer spending and spending-cryo interaction features.\"\"\"\n    df_copy = df.copy()\n    \n    # Track which rows have any spending data recorded\n    spending_recorded = ~df_copy[SPENDING].isna().any(axis=1)\n    df_copy[\"Spending_Recorded\"] = spending_recorded.astype(int)\n    \n    # Fill missing spending with median per HomePlanet group, then global median\n    for col in SPENDING:\n        missing_mask = df_copy[col].isna()\n        if missing_mask.any():\n            group_medians = df_copy.groupby(\"HomePlanet\")[col].median()\n            df_copy.loc[missing_mask, col] = df_copy.loc[missing_mask, \"HomePlanet\"].map(group_medians)\n            global_median = df_copy[col].median()\n            df_copy[col] = df_copy[col].fillna(global_median)\n    \n    # Total spending\n    df_copy[\"TotalSpending\"] = df_copy[SPENDING].sum(axis=1)\n    \n    # Interaction: CryoSleep status and log spending\n    cryo_status = df_copy[\"CryoSleep\"].fillna(False)\n    log_spending = np.log1p(df_copy[\"TotalSpending\"])\n    df_copy[\"CryoSleep_LogSpending\"] = (cryo_status == True) * log_spending\n    \n    return df_copy\n\n\ndef add_group_features(df):\n    \"\"\"Add group-level aggregate features based on PassengerId group.\"\"\"\n    df_copy = df.copy()\n    \n    # Extract group ID\n    df_copy[\"GroupId\"] = df_copy[\"PassengerId\"].apply(extract_group_id)\n    \n    # Compute group size\n    group_sizes = df_copy.groupby(\"GroupId\").size()\n    df_copy[\"GroupSize\"] = df_copy[\"GroupId\"].map(group_sizes)\n    \n    # Compute group median total spending\n    group_median_spending = df_copy.groupby(\"GroupId\")[\"TotalSpending\"].median()\n    df_copy[\"GroupMedianSpending\"] = df_copy[\"GroupId\"].map(group_median_spending)\n    \n    return df_copy\n\n\ndef add_deck_interactions(df, decks_in_data=None):\n    \"\"\"Add deck-specific interaction features.\"\"\"\n    df_copy = df.copy()\n    \n    # Normalize TotalSpending for interaction (scale to [0,1] or log)\n    ts_normalized = np.log1p(df_copy[\"TotalSpending\"])\n    ts_normalized = (ts_normalized - ts_normalized.min()) / (ts_normalized.max() - ts_normalized.min() + 1e-8)\n    \n    # CryoSleep as numeric for interaction\n    cryo_numeric = (df_copy[\"CryoSleep\"].fillna(\"Unknown\") == \"True\").astype(float)\n    \n    # Create interaction features per deck\n    if decks_in_data is None:\n        decks_in_data = df_copy[\"Deck\"].dropna().unique()\n    \n    for deck in decks_in_data:\n        deck_mask = (df_copy[\"Deck\"] == deck).astype(float)\n        \n        # Deck × Normalized TotalSpending\n        df_copy[f\"Deck_{deck}_x_TotalSpending\"] = deck_mask * ts_normalized\n        \n        # Deck × CryoSleep\n        df_copy[f\"Deck_{deck}_x_CryoSleep\"] = deck_mask * cryo_numeric\n    \n    return df_copy\n\n\ndef build_predict_fn():\n    train_df, _ = prepare.load_split()\n    \n    # Parse Cabin into Deck, RoomNum, Side\n    cabin_data = train_df[\"Cabin\"].apply(parse_cabin)\n    train_df[\"Deck\"] = cabin_data.apply(lambda x: x[0])\n    train_df[\"RoomNum\"] = cabin_data.apply(lambda x: x[1])\n    train_df[\"Side\"] = cabin_data.apply(lambda x: x[2])\n    \n    # Engineer features\n    train_df = engineer_features(train_df)\n    \n    # Add group-level features\n    train_df = add_group_features(train_df)\n    \n    # Store deck values for validation set\n    decks_in_train = train_df[\"Deck\"].dropna().unique().tolist()\n    \n    # Add deck interactions\n    train_df = add_deck_interactions(train_df, decks_in_data=decks_in_train)\n    \n    # Create explicit missingness flags for CryoSleep and VIP only\n    train_df[\"CryoSleep_Missing\"] = train_df[\"CryoSleep\"].isna().astype(int)\n    train_df[\"VIP_Missing\"] = train_df[\"VIP\"].isna().astype(int)\n    \n    # Convert CryoSleep and VIP to string for categorical encoding\n    train_df[\"CryoSleep\"] = train_df[\"CryoSleep\"].fillna(\"Unknown\").astype(str)\n    train_df[\"VIP\"] = train_df[\"VIP\"].fillna(\"Unknown\").astype(str)\n    \n    # Build feature set with deck interactions\n    deck_interaction_cols = [col for col in train_df.columns if col.startswith(\"Deck_\") and \"_x_\" in col]\n    \n    feature_cols = (\n        [\"Age\"] + SPENDING + [\"TotalSpending\", \"CryoSleep_LogSpending\", \"Spending_Recorded\"] +\n        CATEGORICAL + \n        [\"Deck\", \"RoomNum\", \"Side\", \"PassengerId\", \"GroupId\"] + \n        [\"CryoSleep_Missing\", \"VIP_Missing\"] +\n        [\"GroupSize\", \"GroupMedianSpending\"] +\n        deck_interaction_cols\n    )\n    X = train_df[feature_cols]\n    y = train_df[\"Transported\"].astype(int)\n    \n    # Define preprocessing\n    numeric_transformer = Pipeline([\n        (\"imputer\", SimpleImputer(strategy=\"median\")),\n        (\"scaler\", StandardScaler()),\n    ])\n    \n    categorical_transformer = Pipeline([\n        (\"imputer\", SimpleImputer(strategy=\"most_frequent\")),\n        (\"onehot\", OneHotEncoder(handle_unknown=\"ignore\", sparse_output=False)),\n    ])\n    \n    numeric_feature_cols = (\n        [\"Age\", \"RoomNum\", \"CryoSleep_Missing\", \"VIP_Missing\", \"Spending_Recorded\"] + \n        SPENDING + [\"TotalSpending\", \"CryoSleep_LogSpending\"] +\n        [\"GroupSize\", \"GroupMedianSpending\"] +\n        deck_interaction_cols\n    )\n    categorical_feature_cols = CATEGORICAL + [\"Deck\", \"Side\", \"PassengerId\", \"GroupId\"]\n    \n    preprocessor = ColumnTransformer([\n        (\"num\", numeric_transformer, numeric_feature_cols),\n        (\"cat\", categorical_transformer, categorical_feature_cols),\n    ])\n    \n    # XGBoost with iter 80 hyperparameters\n    pipe = Pipeline([\n        (\"preprocessor\", preprocessor),\n        (\"clf\", xgb.XGBClassifier(\n            max_depth=6,\n            n_estimators=100,\n            learning_rate=0.1,\n            random_state=42,\n            verbosity=0\n        )),\n    ])\n    \n    pipe.fit(X, y)\n    \n    def predict(X_val):\n        cabin_data = X_val[\"Cabin\"].apply(parse_cabin)\n        X_val_copy = X_val.copy()\n        X_val_copy[\"Deck\"] = cabin_data.apply(lambda x: x[0])\n        X_val_copy[\"RoomNum\"] = cabin_data.apply(lambda x: x[1])\n        X_val_copy[\"Side\"] = cabin_data.apply(lambda x: x[2])\n        \n        # Engineer features\n        X_val_copy = engineer_features(X_val_copy)\n        \n        # Add group-level features from training stats\n        X_val_copy[\"GroupId\"] = X_val_copy[\"PassengerId\"].apply(extract_group_id)\n        X_val_copy[\"GroupSize\"] = X_val_copy[\"GroupId\"].map(pd.Series(\n            train_df.groupby(\"GroupId\").size().to_dict()\n        ))\n        X_val_copy[\"GroupMedianSpending\"] = X_val_copy[\"GroupId\"].map(pd.Series(\n            train_df.groupby(\"GroupId\")[\"TotalSpending\"].median().to_dict()\n        ))\n        \n        # Add deck interactions (aligned with training decks)\n        X_val_copy = add_deck_interactions(X_val_copy, decks_in_data=decks_in_train)\n        \n        # Missingness flags for CryoSleep and VIP only\n        X_val_copy[\"CryoSleep_Missing\"] = X_val_copy[\"CryoSleep\"].isna().astype(int)\n        X_val_copy[\"VIP_Missing\"] = X_val_copy[\"VIP\"].isna().astype(int)\n        \n        # Handle CryoSleep and VIP\n        X_val_copy[\"CryoSleep\"] = X_val_copy[\"CryoSleep\"].fillna(\"Unknown\").astype(str)\n        X_val_copy[\"VIP\"] = X_val_copy[\"VIP\"].fillna(\"Unknown\").astype(str)\n        \n        return pipe.predict(X_val_copy[feature_cols]).astype(bool)\n    \n    return predict\n\n\nif __name__ == \"__main__\":\n    predict_fn = build_predict_fn()\n    score = prepare.evaluate(predict_fn)\n    print(f\"VAL_ACCURACY: {score:.4f}\")\n```\n</code>\n\n<notes_append>\nIteration 126: Added deck-specific interaction features (Deck_X×TotalSpending, Deck_X×CryoSleep) to capture nonlinear deck-driven risk. Deck B (73.7% transport) vs E (36.9%) suggests deck modulates feature effects; testing if interactions help the model learn deck-conditional risk profiles.\n</notes_append>", "reflection": "The baseline is holding steady at 0.8235 across multiple iterations. The EDA output reveals strong variation in transport rates across decks (B at 73.7%, D at 44.8%, E at 36.9%), and most passengers are on decks F and G. The current model with XGBoost and all engineered features has plateaued. I should investigate whether deck-specific patterns or deck isolation (treating decks as distinct subgroups) could improve the model, since the transport rate spread across decks is large enough to be predictively useful.", "observations": ["Deck assignment has extremely strong variation in transport rates: deck B transports 73.7% of passengers, while deck E transports only 36.9%. This is a 37-percentage-point spread—far too large to ignore.", "The current model includes Deck as a one-hot categorical feature, but it treats all decks equally. We might be missing nonlinear interactions: passengers on high-risk decks (D, E) might respond differently to spending or CryoSleep than passengers on safe decks (B).", "Group sizes span 1 to 6 passengers in the shown sample, and transport mean varies widely per group. The grouping signal is real but might be suppressed by global preprocessing that doesn't account for deck-level differences.", "~161 missing cabins (2.3%) are labeled NaN in Deck; these are currently treated as a separate category, but we could test whether imputing them to the modal deck (F) or treating them as a risk signal improves fit.", "The current best (0.8235) is solid but static across 5 iterations. A structural change—not another hyperparameter tweak—is needed."], "hypothesis": "Deck drives transport risk so strongly (37pp spread) that a deck-aware model—either stratifying preprocessing per deck or adding deck-specific interaction features—will improve accuracy. Specifically, adding interaction terms between Deck and high-signal features like CryoSleep and TotalSpending will help the model learn that the same behavior carries different risk on different decks.", "plan": "Add deck-specific interaction features: CryoSleep×Deck and TotalSpending×Deck (via polynomial expansion or explicit interaction columns). Keep the same XGBoost config and preprocessing; the goal is to let the model discover that deck modulates the effect of behavior. This tests whether the hidden structure is deck-driven without requiring model refactoring.", "code": "\"\"\"\ntrain.py — Iteration 126: Add deck-specific interaction features.\nDeck shows 37pp transport rate spread (B:73.7% vs E:36.9%).\nHypothesis: CryoSleep×Deck and TotalSpending×Deck interactions improve fit.\n\"\"\"\nimport sys, pathlib\nsys.path.insert(0, str(pathlib.Path(__file__).resolve().parent.parent))\n\nimport pandas as pd\nimport numpy as np\nimport xgboost as xgb\nfrom sklearn.impute import SimpleImputer\nfrom sklearn.pipeline import Pipeline\nfrom sklearn.preprocessing import StandardScaler, OneHotEncoder\nfrom sklearn.compose import ColumnTransformer\n\nimport prepare\n\nNUMERIC = [\"Age\", \"RoomService\", \"FoodCourt\", \"ShoppingMall\", \"Spa\", \"VRDeck\"]\nCATEGORICAL = [\"HomePlanet\", \"Destination\", \"CryoSleep\", \"VIP\"]\nSPENDING = [\"RoomService\", \"FoodCourt\", \"ShoppingMall\", \"Spa\", \"VRDeck\"]\n\n\ndef parse_cabin(cabin_str):\n    \"\"\"Parse Cabin 'F/0/S' into deck, room_num, side.\"\"\"\n    if pd.isna(cabin_str):\n        return np.nan, np.nan, np.nan\n    parts = str(cabin_str).split(\"/\")\n    if len(parts) == 3:\n        return parts[0], int(parts[1]) if parts[1].isdigit() else np.nan, parts[2]\n    return np.nan, np.nan, np.nan\n\n\ndef extract_group_id(passenger_id):\n    \"\"\"Extract group ID from PassengerId (e.g., '0001_01' -> '0001').\"\"\"\n    if pd.isna(passenger_id):\n        return np.nan\n    return str(passenger_id).split(\"_\")[0]\n\n\ndef engineer_features(df):\n    \"\"\"Engineer spending and spending-cryo interaction features.\"\"\"\n    df_copy = df.copy()\n    \n    # Track which rows have any spending data recorded\n    spending_recorded = ~df_copy[SPENDING].isna().any(axis=1)\n    df_copy[\"Spending_Recorded\"] = spending_recorded.astype(int)\n    \n    # Fill missing spending with median per HomePlanet group, then global median\n    for col in SPENDING:\n        missing_mask = df_copy[col].isna()\n        if missing_mask.any():\n            group_medians = df_copy.groupby(\"HomePlanet\")[col].median()\n            df_copy.loc[missing_mask, col] = df_copy.loc[missing_mask, \"HomePlanet\"].map(group_medians)\n            global_median = df_copy[col].median()\n            df_copy[col] = df_copy[col].fillna(global_median)\n    \n    # Total spending\n    df_copy[\"TotalSpending\"] = df_copy[SPENDING].sum(axis=1)\n    \n    # Interaction: CryoSleep status and log spending\n    cryo_status = df_copy[\"CryoSleep\"].fillna(False)\n    log_spending = np.log1p(df_copy[\"TotalSpending\"])\n    df_copy[\"CryoSleep_LogSpending\"] = (cryo_status == True) * log_spending\n    \n    return df_copy\n\n\ndef add_group_features(df):\n    \"\"\"Add group-level aggregate features based on PassengerId group.\"\"\"\n    df_copy = df.copy()\n    \n    # Extract group ID\n    df_copy[\"GroupId\"] = df_copy[\"PassengerId\"].apply(extract_group_id)\n    \n    # Compute group size\n    group_sizes = df_copy.groupby(\"GroupId\").size()\n    df_copy[\"GroupSize\"] = df_copy[\"GroupId\"].map(group_sizes)\n    \n    # Compute group median total spending\n    group_median_spending = df_copy.groupby(\"GroupId\")[\"TotalSpending\"].median()\n    df_copy[\"GroupMedianSpending\"] = df_copy[\"GroupId\"].map(group_median_spending)\n    \n    return df_copy\n\n\ndef add_deck_interactions(df, decks_in_data=None):\n    \"\"\"Add deck-specific interaction features.\"\"\"\n    df_copy = df.copy()\n    \n    # Normalize TotalSpending for interaction (scale to [0,1] or log)\n    ts_normalized = np.log1p(df_copy[\"TotalSpending\"])\n    ts_normalized = (ts_normalized - ts_normalized.min()) / (ts_normalized.max() - ts_normalized.min() + 1e-8)\n    \n    # CryoSleep as numeric for interaction\n    cryo_numeric = (df_copy[\"CryoSleep\"].fillna(\"Unknown\") == \"True\").astype(float)\n    \n    # Create interaction features per deck\n    if decks_in_data is None:\n        decks_in_data = df_copy[\"Deck\"].dropna().unique()\n    \n    for deck in decks_in_data:\n        deck_mask = (df_copy[\"Deck\"] == deck).astype(float)\n        \n        # Deck × Normalized TotalSpending\n        df_copy[f\"Deck_{deck}_x_TotalSpending\"] = deck_mask * ts_normalized\n        \n        # Deck × CryoSleep\n        df_copy[f\"Deck_{deck}_x_CryoSleep\"] = deck_mask * cryo_numeric\n    \n    return df_copy\n\n\ndef build_predict_fn():\n    train_df, _ = prepare.load_split()\n    \n    # Parse Cabin into Deck, RoomNum, Side\n    cabin_data = train_df[\"Cabin\"].apply(parse_cabin)\n    train_df[\"Deck\"] = cabin_data.apply(lambda x: x[0])\n    train_df[\"RoomNum\"] = cabin_data.apply(lambda x: x[1])\n    train_df[\"Side\"] = cabin_data.apply(lambda x: x[2])\n    \n    # Engineer features\n    train_df = engineer_features(train_df)\n    \n    # Add group-level features\n    train_df = add_group_features(train_df)\n    \n    # Store deck values for validation set\n    decks_in_train = train_df[\"Deck\"].dropna().unique().tolist()\n    \n    # Add deck interactions\n    train_df = add_deck_interactions(train_df, decks_in_data=decks_in_train)\n    \n    # Create explicit missingness flags for CryoSleep and VIP only\n    train_df[\"CryoSleep_Missing\"] = train_df[\"CryoSleep\"].isna().astype(int)\n    train_df[\"VIP_Missing\"] = train_df[\"VIP\"].isna().astype(int)\n    \n    # Convert CryoSleep and VIP to string for categorical encoding\n    train_df[\"CryoSleep\"] = train_df[\"CryoSleep\"].fillna(\"Unknown\").astype(str)\n    train_df[\"VIP\"] = train_df[\"VIP\"].fillna(\"Unknown\").astype(str)\n    \n    # Build feature set with deck interactions\n    deck_interaction_cols = [col for col in train_df.columns if col.startswith(\"Deck_\") and \"_x_\" in col]\n    \n    feature_cols = (\n        [\"Age\"] + SPENDING + [\"TotalSpending\", \"CryoSleep_LogSpending\", \"Spending_Recorded\"] +\n        CATEGORICAL + \n        [\"Deck\", \"RoomNum\", \"Side\", \"PassengerId\", \"GroupId\"] + \n        [\"CryoSleep_Missing\", \"VIP_Missing\"] +\n        [\"GroupSize\", \"GroupMedianSpending\"] +\n        deck_interaction_cols\n    )\n    X = train_df[feature_cols]\n    y = train_df[\"Transported\"].astype(int)\n    \n    # Define preprocessing\n    numeric_transformer = Pipeline([\n        (\"imputer\", SimpleImputer(strategy=\"median\")),\n        (\"scaler\", StandardScaler()),\n    ])\n    \n    categorical_transformer = Pipeline([\n        (\"imputer\", SimpleImputer(strategy=\"most_frequent\")),\n        (\"onehot\", OneHotEncoder(handle_unknown=\"ignore\", sparse_output=False)),\n    ])\n    \n    numeric_feature_cols = (\n        [\"Age\", \"RoomNum\", \"CryoSleep_Missing\", \"VIP_Missing\", \"Spending_Recorded\"] + \n        SPENDING + [\"TotalSpending\", \"CryoSleep_LogSpending\"] +\n        [\"GroupSize\", \"GroupMedianSpending\"] +\n        deck_interaction_cols\n    )\n    categorical_feature_cols = CATEGORICAL + [\"Deck\", \"Side\", \"PassengerId\", \"GroupId\"]\n    \n    preprocessor = ColumnTransformer([\n        (\"num\", numeric_transformer, numeric_feature_cols),\n        (\"cat\", categorical_transformer, categorical_feature_cols),\n    ])\n    \n    # XGBoost with iter 80 hyperparameters\n    pipe = Pipeline([\n        (\"preprocessor\", preprocessor),\n        (\"clf\", xgb.XGBClassifier(\n            max_depth=6,\n            n_estimators=100,\n            learning_rate=0.1,\n            random_state=42,\n            verbosity=0\n        )),\n    ])\n    \n    pipe.fit(X, y)\n    \n    def predict(X_val):\n        cabin_data = X_val[\"Cabin\"