{"iteration": 7, "timestamp": "2026-05-08T21:29:05", "previous_best": 0.8229, "duration_seconds": 4.04, "agent_response_raw": "<reflection>\nThe last run confirmed the 0.8229 baseline is stable. The smart spending imputation (median per HomePlanet, with a Spending_Recorded flag) and cabin/group parsing are working correctly. Now I need to push beyond this score by exploring structural patterns in the data that haven't been fully leveraged yet.\n</reflection>\n\n<observations>\n- The current model achieves 0.8229 on validation; this is our anchor point and represents sensible feature engineering (spending imputation, cabin parsing, group ID extraction).\n- Notes from prior iterations mention that group structure may encode shared transportation fate, but iteration 44's explicit aggregates (GroupSize, GroupMedianAge, GroupMeanSpending) regressed to 0.8114, suggesting crude aggregation is noisy.\n- The hints suggest that identifier columns (PassengerId, GroupId) may encode more than group size—they could encode sequential or temporal structure that correlates with transport outcome.\n- Spending patterns (missingness + values) have been partially exploited via Spending_Recorded + group-wise imputation, but no interaction with cabin location (Deck) or destination has been tested.\n- Missing values in CryoSleep and VIP are tracked as flags, but the relationship between these missingness patterns and outcome hasn't been explored (e.g., do passengers with missing CryoSleep differ systematically from those with recorded values?).\n</observations>\n\n<hypothesis>\nCabin Deck and Destination interact in predicting transport: certain deck–destination combinations may have stronger or weaker transport signals than their individual features suggest, because crew logistics or ship geography may concentrate transported passengers in specific regions. Adding a deck×destination interaction term will capture this structure.\n</hypothesis>\n\n<plan>\nI will add an explicit interaction feature: Deck × Destination (created as a categorical combination before one-hot encoding). This tests whether specific ship regions have higher transportation rates. If deck location correlates with crew vs. passenger areas, or if certain destinations are reached via specific decks, this interaction should improve validation accuracy without adding complexity beyond a single engineered column.\n</plan>\n\n<code>\n```python\n\"\"\"\ntrain.py — Iteration 47: Add Deck × Destination interaction feature.\nTest whether specific deck–destination combinations predict transport better\nthan deck and destination independently.\n\"\"\"\nimport sys, pathlib\nsys.path.insert(0, str(pathlib.Path(__file__).resolve().parent.parent))\n\nimport pandas as pd\nimport numpy as np\nimport xgboost as xgb\nfrom sklearn.impute import SimpleImputer\nfrom sklearn.pipeline import Pipeline\nfrom sklearn.preprocessing import StandardScaler, OneHotEncoder\nfrom sklearn.compose import ColumnTransformer\n\nimport prepare\n\nNUMERIC = [\"Age\", \"RoomService\", \"FoodCourt\", \"ShoppingMall\", \"Spa\", \"VRDeck\"]\nCATEGORICAL = [\"HomePlanet\", \"Destination\", \"CryoSleep\", \"VIP\"]\nSPENDING = [\"RoomService\", \"FoodCourt\", \"ShoppingMall\", \"Spa\", \"VRDeck\"]\n\n\ndef parse_cabin(cabin_str):\n    \"\"\"Parse Cabin 'F/0/S' into deck, room_num, side.\"\"\"\n    if pd.isna(cabin_str):\n        return np.nan, np.nan, np.nan\n    parts = str(cabin_str).split(\"/\")\n    if len(parts) == 3:\n        return parts[0], int(parts[1]) if parts[1].isdigit() else np.nan, parts[2]\n    return np.nan, np.nan, np.nan\n\n\ndef extract_group_id(passenger_id):\n    \"\"\"Extract group ID from PassengerId (e.g., '0001_01' -> '0001').\"\"\"\n    if pd.isna(passenger_id):\n        return np.nan\n    return str(passenger_id).split(\"_\")[0]\n\n\ndef engineer_features(df):\n    \"\"\"Engineer spending and spending-cryo interaction features.\"\"\"\n    df_copy = df.copy()\n    \n    # Track which spending values were originally recorded (not missing)\n    spending_recorded = ~df_copy[SPENDING].isna().any(axis=1)\n    df_copy[\"Spending_Recorded\"] = spending_recorded.astype(int)\n    \n    # Fill missing spending with median per HomePlanet group\n    for col in SPENDING:\n        missing_mask = df_copy[col].isna()\n        if missing_mask.any():\n            # Compute median per HomePlanet (ignoring NaN within groups)\n            group_medians = df_copy.groupby(\"HomePlanet\")[col].median()\n            # Fill group-wise; any remaining NaN (if whole planet has no data) use global median\n            df_copy.loc[missing_mask, col] = df_copy.loc[missing_mask, \"HomePlanet\"].map(group_medians)\n            global_median = df_copy[col].median()\n            # Fix: use direct assignment instead of inplace to avoid CoW issues\n            df_copy[col] = df_copy[col].fillna(global_median)\n    \n    # Total spending\n    df_copy[\"TotalSpending\"] = df_copy[SPENDING].sum(axis=1)\n    \n    # Interaction: CryoSleep status and spending ratio\n    cryo_status = df_copy[\"CryoSleep\"].fillna(False)\n    log_spending = np.log1p(df_copy[\"TotalSpending\"])\n    df_copy[\"CryoSleep_LogSpending\"] = (\n        (cryo_status == True) * log_spending\n    )\n    \n    return df_copy\n\n\ndef build_predict_fn():\n    train_df, _ = prepare.load_split()\n    \n    # Parse Cabin into Deck, RoomNum, Side\n    cabin_data = train_df[\"Cabin\"].apply(parse_cabin)\n    train_df[\"Deck\"] = cabin_data.apply(lambda x: x[0])\n    train_df[\"RoomNum\"] = cabin_data.apply(lambda x: x[1])\n    train_df[\"Side\"] = cabin_data.apply(lambda x: x[2])\n    \n    # Extract group ID from PassengerId\n    train_df[\"GroupId\"] = train_df[\"PassengerId\"].apply(extract_group_id)\n    \n    # Engineer features (including smart spending imputation)\n    train_df = engineer_features(train_df)\n    \n    # Create explicit missingness flags for CryoSleep and VIP before filling\n    train_df[\"CryoSleep_Missing\"] = train_df[\"CryoSleep\"].isna().astype(int)\n    train_df[\"VIP_Missing\"] = train_df[\"VIP\"].isna().astype(int)\n    \n    # Convert CryoSleep and VIP to string for categorical encoding\n    train_df[\"CryoSleep\"] = train_df[\"CryoSleep\"].fillna(\"Unknown\").astype(str)\n    train_df[\"VIP\"] = train_df[\"VIP\"].fillna(\"Unknown\").astype(str)\n    \n    # Create Deck × Destination interaction\n    train_df[\"Deck_Destination\"] = (\n        train_df[\"Deck\"].fillna(\"Unknown\").astype(str) + \"_\" + \n        train_df[\"Destination\"].fillna(\"Unknown\").astype(str)\n    )\n    \n    # Build feature set\n    feature_cols = (\n        [\"Age\"] + SPENDING + [\"TotalSpending\", \"CryoSleep_LogSpending\", \"Spending_Recorded\"] +\n        CATEGORICAL + \n        [\"Deck\", \"RoomNum\", \"Side\", \"GroupId\"] + \n        [\"CryoSleep_Missing\", \"VIP_Missing\", \"Deck_Destination\"]\n    )\n    X = train_df[feature_cols]\n    y = train_df[\"Transported\"].astype(int)\n    \n    # Define preprocessing for numeric and categorical columns\n    numeric_transformer = Pipeline([\n        (\"imputer\", SimpleImputer(strategy=\"median\")),\n        (\"scaler\", StandardScaler()),\n    ])\n    \n    categorical_transformer = Pipeline([\n        (\"imputer\", SimpleImputer(strategy=\"most_frequent\")),\n        (\"onehot\", OneHotEncoder(handle_unknown=\"ignore\", sparse_output=False)),\n    ])\n    \n    numeric_feature_cols = (\n        [\"Age\", \"RoomNum\", \"CryoSleep_Missing\", \"VIP_Missing\", \"Spending_Recorded\"] + \n        SPENDING + [\"TotalSpending\", \"CryoSleep_LogSpending\"]\n    )\n    categorical_feature_cols = CATEGORICAL + [\"Deck\", \"Side\", \"GroupId\", \"Deck_Destination\"]\n    \n    preprocessor = ColumnTransformer([\n        (\"num\", numeric_transformer, numeric_feature_cols),\n        (\"cat\", categorical_transformer, categorical_feature_cols),\n    ])\n    \n    pipe = Pipeline([\n        (\"preprocessor\", preprocessor),\n        (\"clf\", xgb.XGBClassifier(n_estimators=100, max_depth=6, learning_rate=0.1, random_state=42, verbosity=0)),\n    ])\n    \n    pipe.fit(X, y)\n    \n    def predict(X_val):\n        # Parse Cabin in validation set\n        cabin_data = X_val[\"Cabin\"].apply(parse_cabin)\n        X_val_copy = X_val.copy()\n        X_val_copy[\"Deck\"] = cabin_data.apply(lambda x: x[0])\n        X_val_copy[\"RoomNum\"] = cabin_data.apply(lambda x: x[1])\n        X_val_copy[\"Side\"] = cabin_data.apply(lambda x: x[2])\n        \n        # Extract group ID\n        X_val_copy[\"GroupId\"] = X_val_copy[\"PassengerId\"].apply(extract_group_id)\n        \n        # Engineer features (using same smart spending imputation)\n        X_val_copy = engineer_features(X_val_copy)\n        \n        # Create explicit missingness flags for CryoSleep and VIP before filling\n        X_val_copy[\"CryoSleep_Missing\"] = X_val_copy[\"CryoSleep\"].isna().astype(int)\n        X_val_copy[\"VIP_Missing\"] = X_val_copy[\"VIP\"].isna().astype(int)\n        \n        # Handle CryoSleep and VIP\n        X_val_copy[\"CryoSleep\"] = X_val_copy[\"CryoSleep\"].fillna(\"Unknown\").astype(str)\n        X_val_copy[\"VIP\"] = X_val_copy[\"VIP\"].fillna(\"Unknown\").astype(str)\n        \n        # Create Deck × Destination interaction\n        X_val_copy[\"Deck_Destination\"] = (\n            X_val_copy[\"Deck\"].fillna(\"Unknown\").astype(str) + \"_\" + \n            X_val_copy[\"Destination\"].fillna(\"Unknown\").astype(str)\n        )\n        \n        return pipe.predict(X_val_copy[feature_cols]).astype(bool)\n    \n    return predict\n\n\nif __name__ == \"__main__\":\n    predict_fn = build_predict_fn()\n    score = prepare.evaluate(predict_fn)\n    print(f\"VAL_ACCURACY: {score:.4f}\")\n```\n</code>\n\n<notes_append>\nIteration 47: Added Deck × Destination interaction feature to test whether specific deck–destination combinations predict transport better than individual features. Hypothesis: ship geography may concentrate transported passengers in specific regions. Testing whether this structured interaction improves beyond 0.8229 baseline without adding explicit group aggregates.\n</notes_append>", "reflection": "The last run confirmed the 0.8229 baseline is stable. The smart spending imputation (median per HomePlanet, with a Spending_Recorded flag) and cabin/group parsing are working correctly. Now I need to push beyond this score by exploring structural patterns in the data that haven't been fully leveraged yet.", "observations": ["The current model achieves 0.8229 on validation; this is our anchor point and represents sensible feature engineering (spending imputation, cabin parsing, group ID extraction).", "Notes from prior iterations mention that group structure may encode shared transportation fate, but iteration 44's explicit aggregates (GroupSize, GroupMedianAge, GroupMeanSpending) regressed to 0.8114, suggesting crude aggregation is noisy.", "The hints suggest that identifier columns (PassengerId, GroupId) may encode more than group size—they could encode sequential or temporal structure that correlates with transport outcome.", "Spending patterns (missingness + values) have been partially exploited via Spending_Recorded + group-wise imputation, but no interaction with cabin location (Deck) or destination has been tested.", "Missing values in CryoSleep and VIP are tracked as flags, but the relationship between these missingness patterns and outcome hasn't been explored (e.g., do passengers with missing CryoSleep differ systematically from those with recorded values?)."], "hypothesis": "Cabin Deck and Destination interact in predicting transport: certain deck–destination combinations may have stronger or weaker transport signals than their individual features suggest, because crew logistics or ship geography may concentrate transported passengers in specific regions. Adding a deck×destination interaction term will capture this structure.", "plan": "I will add an explicit interaction feature: Deck × Destination (created as a categorical combination before one-hot encoding). This tests whether specific ship regions have higher transportation rates. If deck location correlates with crew vs. passenger areas, or if certain destinations are reached via specific decks, this interaction should improve validation accuracy without adding complexity beyond a single engineered column.", "code": "\"\"\"\ntrain.py — Iteration 47: Add Deck × Destination interaction feature.\nTest whether specific deck–destination combinations predict transport better\nthan deck and destination independently.\n\"\"\"\nimport sys, pathlib\nsys.path.insert(0, str(pathlib.Path(__file__).resolve().parent.parent))\n\nimport pandas as pd\nimport numpy as np\nimport xgboost as xgb\nfrom sklearn.impute import SimpleImputer\nfrom sklearn.pipeline import Pipeline\nfrom sklearn.preprocessing import StandardScaler, OneHotEncoder\nfrom sklearn.compose import ColumnTransformer\n\nimport prepare\n\nNUMERIC = [\"Age\", \"RoomService\", \"FoodCourt\", \"ShoppingMall\", \"Spa\", \"VRDeck\"]\nCATEGORICAL = [\"HomePlanet\", \"Destination\", \"CryoSleep\", \"VIP\"]\nSPENDING = [\"RoomService\", \"FoodCourt\", \"ShoppingMall\", \"Spa\", \"VRDeck\"]\n\n\ndef parse_cabin(cabin_str):\n    \"\"\"Parse Cabin 'F/0/S' into deck, room_num, side.\"\"\"\n    if pd.isna(cabin_str):\n        return np.nan, np.nan, np.nan\n    parts = str(cabin_str).split(\"/\")\n    if len(parts) == 3:\n        return parts[0], int(parts[1]) if parts[1].isdigit() else np.nan, parts[2]\n    return np.nan, np.nan, np.nan\n\n\ndef extract_group_id(passenger_id):\n    \"\"\"Extract group ID from PassengerId (e.g., '0001_01' -> '0001').\"\"\"\n    if pd.isna(passenger_id):\n        return np.nan\n    return str(passenger_id).split(\"_\")[0]\n\n\ndef engineer_features(df):\n    \"\"\"Engineer spending and spending-cryo interaction features.\"\"\"\n    df_copy = df.copy()\n    \n    # Track which spending values were originally recorded (not missing)\n    spending_recorded = ~df_copy[SPENDING].isna().any(axis=1)\n    df_copy[\"Spending_Recorded\"] = spending_recorded.astype(int)\n    \n    # Fill missing spending with median per HomePlanet group\n    for col in SPENDING:\n        missing_mask = df_copy[col].isna()\n        if missing_mask.any():\n            # Compute median per HomePlanet (ignoring NaN within groups)\n            group_medians = df_copy.groupby(\"HomePlanet\")[col].median()\n            # Fill group-wise; any remaining NaN (if whole planet has no data) use global median\n            df_copy.loc[missing_mask, col] = df_copy.loc[missing_mask, \"HomePlanet\"].map(group_medians)\n            global_median = df_copy[col].median()\n            # Fix: use direct assignment instead of inplace to avoid CoW issues\n            df_copy[col] = df_copy[col].fillna(global_median)\n    \n    # Total spending\n    df_copy[\"TotalSpending\"] = df_copy[SPENDING].sum(axis=1)\n    \n    # Interaction: CryoSleep status and spending ratio\n    cryo_status = df_copy[\"CryoSleep\"].fillna(False)\n    log_spending = np.log1p(df_copy[\"TotalSpending\"])\n    df_copy[\"CryoSleep_LogSpending\"] = (\n        (cryo_status == True) * log_spending\n    )\n    \n    return df_copy\n\n\ndef build_predict_fn():\n    train_df, _ = prepare.load_split()\n    \n    # Parse Cabin into Deck, RoomNum, Side\n    cabin_data = train_df[\"Cabin\"].apply(parse_cabin)\n    train_df[\"Deck\"] = cabin_data.apply(lambda x: x[0])\n    train_df[\"RoomNum\"] = cabin_data.apply(lambda x: x[1])\n    train_df[\"Side\"] = cabin_data.apply(lambda x: x[2])\n    \n    # Extract group ID from PassengerId\n    train_df[\"GroupId\"] = train_df[\"PassengerId\"].apply(extract_group_id)\n    \n    # Engineer features (including smart spending imputation)\n    train_df = engineer_features(train_df)\n    \n    # Create explicit missingness flags for CryoSleep and VIP before filling\n    train_df[\"CryoSleep_Missing\"] = train_df[\"CryoSleep\"].isna().astype(int)\n    train_df[\"VIP_Missing\"] = train_df[\"VIP\"].isna().astype(int)\n    \n    # Convert CryoSleep and VIP to string for categorical encoding\n    train_df[\"CryoSleep\"] = train_df[\"CryoSleep\"].fillna(\"Unknown\").astype(str)\n    train_df[\"VIP\"] = train_df[\"VIP\"].fillna(\"Unknown\").astype(str)\n    \n    # Create Deck × Destination interaction\n    train_df[\"Deck_Destination\"] = (\n        train_df[\"Deck\"].fillna(\"Unknown\").astype(str) + \"_\" + \n        train_df[\"Destination\"].fillna(\"Unknown\").astype(str)\n    )\n    \n    # Build feature set\n    feature_cols = (\n        [\"Age\"] + SPENDING + [\"TotalSpending\", \"CryoSleep_LogSpending\", \"Spending_Recorded\"] +\n        CATEGORICAL + \n        [\"Deck\", \"RoomNum\", \"Side\", \"GroupId\"] + \n        [\"CryoSleep_Missing\", \"VIP_Missing\", \"Deck_Destination\"]\n    )\n    X = train_df[feature_cols]\n    y = train_df[\"Transported\"].astype(int)\n    \n    # Define preprocessing for numeric and categorical columns\n    numeric_transformer = Pipeline([\n        (\"imputer\", SimpleImputer(strategy=\"median\")),\n        (\"scaler\", StandardScaler()),\n    ])\n    \n    categorical_transformer = Pipeline([\n        (\"imputer\", SimpleImputer(strategy=\"most_frequent\")),\n        (\"onehot\", OneHotEncoder(handle_unknown=\"ignore\", sparse_output=False)),\n    ])\n    \n    numeric_feature_cols = (\n        [\"Age\", \"RoomNum\", \"CryoSleep_Missing\", \"VIP_Missing\", \"Spending_Recorded\"] + \n        SPENDING + [\"TotalSpending\", \"CryoSleep_LogSpending\"]\n    )\n    categorical_feature_cols = CATEGORICAL + [\"Deck\", \"Side\", \"GroupId\", \"Deck_Destination\"]\n    \n    preprocessor = ColumnTransformer([\n        (\"num\", numeric_transformer, numeric_feature_cols),\n        (\"cat\", categorical_transformer, categorical_feature_cols),\n    ])\n    \n    pipe = Pipeline([\n        (\"preprocessor\", preprocessor),\n        (\"clf\", xgb.XGBClassifier(n_estimators=100, max_depth=6, learning_rate=0.1, random_state=42, verbosity=0)),\n    ])\n    \n    pipe.fit(X, y)\n    \n    def predict(X_val):\n        # Parse Cabin in validation set\n        cabin_data = X_val[\"Cabin\"].apply(parse_cabin)\n        X_val_copy = X_val.copy()\n        X_val_copy[\"Deck\"] = cabin_data.apply(lambda x: x[0])\n        X_val_copy[\"RoomNum\"] = cabin_data.apply(lambda x: x[1])\n        X_val_copy[\"Side\"] = cabin_data.apply(lambda x: x[2])\n        \n        # Extract group ID\n        X_val_copy[\"GroupId\"] = X_val_copy[\"PassengerId\"].apply(extract_group_id)\n        \n        # Engineer features (using same smart spending imputation)\n        X_val_copy = engineer_features(X_val_copy)\n        \n        # Create explicit missingness flags for CryoSleep and VIP before filling\n        X_val_copy[\"CryoSleep_Missing\"] = X_val_copy[\"CryoSleep\"].isna().astype(int)\n        X_val_copy[\"VIP_Missing\"] = X_val_copy[\"VIP\"].isna().astype(int)\n        \n        # Handle CryoSleep and VIP\n        X_val_copy[\"CryoSleep\"] = X_val_copy[\"CryoSleep\"].fillna(\"Unknown\").astype(str)\n        X_val_copy[\"VIP\"] = X_val_copy[\"VIP\"].fillna(\"Unknown\").astype(str)\n        \n        # Create Deck × Destination interaction\n        X_val_copy[\"Deck_Destination\"] = (\n            X_val_copy[\"Deck\"].fillna(\"Unknown\").astype(str) + \"_\" + \n            X_val_copy[\"Destination\"].fillna(\"Unknown\").astype(str)\n        )\n        \n        return pipe.predict(X_val_copy[feature_cols]).astype(bool)\n    \n    return predict\n\n\nif __name__ == \"__main__\":\n    predict_fn = build_predict_fn()\n    score = prepare.evaluate(predict_fn)\n    print(f\"VAL_ACCURACY: {score:.4f}\")\n", "notes_append": "Iteration 47: Added Deck × Destination interaction feature to test whether specific deck–destination combinations predict transport better than individual features. Hypothesis: ship geography may concentrate transported passengers in specific regions. Testing whether this structured interaction improves beyond 0.8229 baseline without adding explicit group aggregates.", "stdout": "VAL_ACCURACY: 0.8171\n", "stderr": "", "returncode": 0, "score": 0.8171, "kept": false, "status": "reverted", "commit_hash": null, "input_tokens": 4355, "output_tokens": 2834, "cost_usd": 0.018525}
