{"iteration": 5, "timestamp": "2026-05-08T21:17:44", "previous_best": 0.8143, "duration_seconds": 3.73, "agent_response_raw": "<reflection>\nThe last run crashed because iter 28 (LightGBM with group-level aggregates) introduced a label encoding issue: GroupId values in the validation set that weren't seen during training caused a KeyError. The best score remains 0.8143 from iter 0/2 (XGBoost with cabin parsing, GroupId, RoomNum, and missingness flags). I need to revert to the known-good XGBoost setup and avoid the categorical encoding trap with high-cardinality features like GroupId.\n</reflection>\n\n<observations>\n- The crash was caused by attempting to encode GroupId as categorical via OneHotEncoder or LabelEncoder; validation GroupIds that weren't in training data caused a mismatch. The ColumnTransformer with OneHotEncoder in the current code should handle this via `handle_unknown=\"ignore\"`, but the iter 28 code used explicit LabelEncoders without that protection.\n- The current train.py (iter 26 code shown) uses OneHotEncoder with `handle_unknown=\"ignore\"`, which should be safe for high-cardinality features. The crash suggests iter 28 deviated and introduced explicit LabelEncoders without proper handling.\n- Best performance (0.8143) came from iter 0/2: XGBoost + cabin parsing (Deck, RoomNum, Side) + GroupId (as categorical via OneHotEncoder) + missingness flags. This is a solid, working baseline.\n- The notes show multiple attempts at feature engineering (HighSpender, group aggregates, PassengerId suffix parity) that either regressed or added complexity without gain.\n- The session has explored LightGBM (iter 28, crashed), group aggregates (iter 27, likely regressed), and simplification (iter 25, regressed). The data supports the cabin-parsing + group structure, not additional engineered aggregates.\n</observations>\n\n<hypothesis>\nThe current train.py (iter 26 code) is correct and safe; the crash in iter 28 was due to manual label encoding without `handle_unknown` protection. Running the current code should reproduce the 0.8143 baseline. Before trying new directions, I will verify the code runs cleanly and confirm the best score is still valid.\n</hypothesis>\n\n<plan>\nI will re-run the current train.py (iter 26) as-is to confirm it executes without error and produces the expected ~0.8143 score. This establishes a clean, validated state before attempting further feature or model improvements. If it runs cleanly, I can then consider structural changes (e.g., different imputation strategies, interaction features, or a simpler model).\n</plan>\n\n<code>\n```python\n\"\"\"\ntrain.py — XGBoost with cabin parsing, GroupId, and missingness flags.\nIteration 26: Restore best-performing feature set (iter 0): cabin parsing + GroupId + missingness flags.\nRemove HighSpender (unvalidated); restore RoomNum which was removed in iter 25 and caused regression.\n\"\"\"\nimport sys, pathlib\nsys.path.insert(0, str(pathlib.Path(__file__).resolve().parent.parent))\n\nimport pandas as pd\nimport numpy as np\nimport xgboost as xgb\nfrom sklearn.impute import SimpleImputer\nfrom sklearn.pipeline import Pipeline\nfrom sklearn.preprocessing import StandardScaler, OneHotEncoder\nfrom sklearn.compose import ColumnTransformer\n\nimport prepare\n\nNUMERIC = [\"Age\", \"RoomService\", \"FoodCourt\", \"ShoppingMall\", \"Spa\", \"VRDeck\"]\nCATEGORICAL = [\"HomePlanet\", \"Destination\", \"CryoSleep\", \"VIP\"]\nSPENDING = [\"RoomService\", \"FoodCourt\", \"ShoppingMall\", \"Spa\", \"VRDeck\"]\n\n\ndef parse_cabin(cabin_str):\n    \"\"\"Parse Cabin 'F/0/S' into deck, room_num, side.\"\"\"\n    if pd.isna(cabin_str):\n        return np.nan, np.nan, np.nan\n    parts = str(cabin_str).split(\"/\")\n    if len(parts) == 3:\n        return parts[0], int(parts[1]) if parts[1].isdigit() else np.nan, parts[2]\n    return np.nan, np.nan, np.nan\n\n\ndef extract_group_id(passenger_id):\n    \"\"\"Extract group ID from PassengerId (e.g., '0001_01' -> '0001').\"\"\"\n    if pd.isna(passenger_id):\n        return np.nan\n    return str(passenger_id).split(\"_\")[0]\n\n\ndef build_predict_fn():\n    train_df, _ = prepare.load_split()\n    \n    # Parse Cabin into Deck, RoomNum, Side\n    cabin_data = train_df[\"Cabin\"].apply(parse_cabin)\n    train_df[\"Deck\"] = cabin_data.apply(lambda x: x[0])\n    train_df[\"RoomNum\"] = cabin_data.apply(lambda x: x[1])\n    train_df[\"Side\"] = cabin_data.apply(lambda x: x[2])\n    \n    # Extract group ID from PassengerId\n    train_df[\"GroupId\"] = train_df[\"PassengerId\"].apply(extract_group_id)\n    \n    # Fill missing values in spending columns with 0 (indicates not spent)\n    for col in SPENDING:\n        train_df[col] = train_df[col].fillna(0)\n    \n    # Create explicit missingness flags for CryoSleep and VIP before filling\n    train_df[\"CryoSleep_Missing\"] = train_df[\"CryoSleep\"].isna().astype(int)\n    train_df[\"VIP_Missing\"] = train_df[\"VIP\"].isna().astype(int)\n    \n    # Convert CryoSleep and VIP to string for categorical encoding\n    train_df[\"CryoSleep\"] = train_df[\"CryoSleep\"].fillna(\"Unknown\").astype(str)\n    train_df[\"VIP\"] = train_df[\"VIP\"].fillna(\"Unknown\").astype(str)\n    \n    # Build feature set: core features + cabin parsing + missingness flags\n    # (removed HighSpender, keeping GroupId and RoomNum)\n    feature_cols = (\n        [\"Age\"] + SPENDING + CATEGORICAL + \n        [\"Deck\", \"RoomNum\", \"Side\", \"GroupId\"] + \n        [\"CryoSleep_Missing\", \"VIP_Missing\"]\n    )\n    X = train_df[feature_cols]\n    y = train_df[\"Transported\"].astype(int)\n    \n    # Define preprocessing for numeric and categorical columns\n    numeric_transformer = Pipeline([\n        (\"imputer\", SimpleImputer(strategy=\"median\")),\n        (\"scaler\", StandardScaler()),\n    ])\n    \n    categorical_transformer = Pipeline([\n        (\"imputer\", SimpleImputer(strategy=\"most_frequent\")),\n        (\"onehot\", OneHotEncoder(handle_unknown=\"ignore\", sparse_output=False)),\n    ])\n    \n    preprocessor = ColumnTransformer([\n        (\"num\", numeric_transformer, [\"Age\", \"RoomNum\", \"CryoSleep_Missing\", \"VIP_Missing\"] + SPENDING),\n        (\"cat\", categorical_transformer, CATEGORICAL + [\"Deck\", \"Side\", \"GroupId\"]),\n    ])\n    \n    pipe = Pipeline([\n        (\"preprocessor\", preprocessor),\n        (\"clf\", xgb.XGBClassifier(n_estimators=100, max_depth=6, learning_rate=0.1, random_state=42, verbosity=0)),\n    ])\n    \n    pipe.fit(X, y)\n    \n    def predict(X_val):\n        # Parse Cabin in validation set\n        cabin_data = X_val[\"Cabin\"].apply(parse_cabin)\n        X_val_copy = X_val.copy()\n        X_val_copy[\"Deck\"] = cabin_data.apply(lambda x: x[0])\n        X_val_copy[\"RoomNum\"] = cabin_data.apply(lambda x: x[1])\n        X_val_copy[\"Side\"] = cabin_data.apply(lambda x: x[2])\n        \n        # Extract group ID\n        X_val_copy[\"GroupId\"] = X_val_copy[\"PassengerId\"].apply(extract_group_id)\n        \n        # Fill missing spending with 0\n        for col in SPENDING:\n            X_val_copy[col] = X_val_copy[col].fillna(0)\n        \n        # Create explicit missingness flags for CryoSleep and VIP before filling\n        X_val_copy[\"CryoSleep_Missing\"] = X_val_copy[\"CryoSleep\"].isna().astype(int)\n        X_val_copy[\"VIP_Missing\"] = X_val_copy[\"VIP\"].isna().astype(int)\n        \n        # Handle CryoSleep and VIP\n        X_val_copy[\"CryoSleep\"] = X_val_copy[\"CryoSleep\"].fillna(\"Unknown\").astype(str)\n        X_val_copy[\"VIP\"] = X_val_copy[\"VIP\"].fillna(\"Unknown\").astype(str)\n        \n        return pipe.predict(X_val_copy[feature_cols]).astype(bool)\n    \n    return predict\n\n\nif __name__ == \"__main__\":\n    predict_fn = build_predict_fn()\n    score = prepare.evaluate(predict_fn)\n    print(f\"VAL_ACCURACY: {score:.4f}\")\n```\n</code>\n\n<notes_append>\nIteration 29: Reverted to iter 26 (XGBoost + cabin parsing + GroupId + RoomNum + missingness flags) after iter 28 LightGBM crashed due to unseen GroupId values in validation. Running baseline to confirm 0.8143 score is reproducible and code is clean before exploring next direction (interaction features, hyperparameter tuning, or feature selection).\n</notes_append>", "reflection": "The last run crashed because iter 28 (LightGBM with group-level aggregates) introduced a label encoding issue: GroupId values in the validation set that weren't seen during training caused a KeyError. The best score remains 0.8143 from iter 0/2 (XGBoost with cabin parsing, GroupId, RoomNum, and missingness flags). I need to revert to the known-good XGBoost setup and avoid the categorical encoding trap with high-cardinality features like GroupId.", "observations": ["The crash was caused by attempting to encode GroupId as categorical via OneHotEncoder or LabelEncoder; validation GroupIds that weren't in training data caused a mismatch. The ColumnTransformer with OneHotEncoder in the current code should handle this via `handle_unknown=\"ignore\"`, but the iter 28 code used explicit LabelEncoders without that protection.", "The current train.py (iter 26 code shown) uses OneHotEncoder with `handle_unknown=\"ignore\"`, which should be safe for high-cardinality features. The crash suggests iter 28 deviated and introduced explicit LabelEncoders without proper handling.", "Best performance (0.8143) came from iter 0/2: XGBoost + cabin parsing (Deck, RoomNum, Side) + GroupId (as categorical via OneHotEncoder) + missingness flags. This is a solid, working baseline.", "The notes show multiple attempts at feature engineering (HighSpender, group aggregates, PassengerId suffix parity) that either regressed or added complexity without gain.", "The session has explored LightGBM (iter 28, crashed), group aggregates (iter 27, likely regressed), and simplification (iter 25, regressed). The data supports the cabin-parsing + group structure, not additional engineered aggregates."], "hypothesis": "The current train.py (iter 26 code) is correct and safe; the crash in iter 28 was due to manual label encoding without `handle_unknown` protection. Running the current code should reproduce the 0.8143 baseline. Before trying new directions, I will verify the code runs cleanly and confirm the best score is still valid.", "plan": "I will re-run the current train.py (iter 26) as-is to confirm it executes without error and produces the expected ~0.8143 score. This establishes a clean, validated state before attempting further feature or model improvements. If it runs cleanly, I can then consider structural changes (e.g., different imputation strategies, interaction features, or a simpler model).", "code": "\"\"\"\ntrain.py — XGBoost with cabin parsing, GroupId, and missingness flags.\nIteration 26: Restore best-performing feature set (iter 0): cabin parsing + GroupId + missingness flags.\nRemove HighSpender (unvalidated); restore RoomNum which was removed in iter 25 and caused regression.\n\"\"\"\nimport sys, pathlib\nsys.path.insert(0, str(pathlib.Path(__file__).resolve().parent.parent))\n\nimport pandas as pd\nimport numpy as np\nimport xgboost as xgb\nfrom sklearn.impute import SimpleImputer\nfrom sklearn.pipeline import Pipeline\nfrom sklearn.preprocessing import StandardScaler, OneHotEncoder\nfrom sklearn.compose import ColumnTransformer\n\nimport prepare\n\nNUMERIC = [\"Age\", \"RoomService\", \"FoodCourt\", \"ShoppingMall\", \"Spa\", \"VRDeck\"]\nCATEGORICAL = [\"HomePlanet\", \"Destination\", \"CryoSleep\", \"VIP\"]\nSPENDING = [\"RoomService\", \"FoodCourt\", \"ShoppingMall\", \"Spa\", \"VRDeck\"]\n\n\ndef parse_cabin(cabin_str):\n    \"\"\"Parse Cabin 'F/0/S' into deck, room_num, side.\"\"\"\n    if pd.isna(cabin_str):\n        return np.nan, np.nan, np.nan\n    parts = str(cabin_str).split(\"/\")\n    if len(parts) == 3:\n        return parts[0], int(parts[1]) if parts[1].isdigit() else np.nan, parts[2]\n    return np.nan, np.nan, np.nan\n\n\ndef extract_group_id(passenger_id):\n    \"\"\"Extract group ID from PassengerId (e.g., '0001_01' -> '0001').\"\"\"\n    if pd.isna(passenger_id):\n        return np.nan\n    return str(passenger_id).split(\"_\")[0]\n\n\ndef build_predict_fn():\n    train_df, _ = prepare.load_split()\n    \n    # Parse Cabin into Deck, RoomNum, Side\n    cabin_data = train_df[\"Cabin\"].apply(parse_cabin)\n    train_df[\"Deck\"] = cabin_data.apply(lambda x: x[0])\n    train_df[\"RoomNum\"] = cabin_data.apply(lambda x: x[1])\n    train_df[\"Side\"] = cabin_data.apply(lambda x: x[2])\n    \n    # Extract group ID from PassengerId\n    train_df[\"GroupId\"] = train_df[\"PassengerId\"].apply(extract_group_id)\n    \n    # Fill missing values in spending columns with 0 (indicates not spent)\n    for col in SPENDING:\n        train_df[col] = train_df[col].fillna(0)\n    \n    # Create explicit missingness flags for CryoSleep and VIP before filling\n    train_df[\"CryoSleep_Missing\"] = train_df[\"CryoSleep\"].isna().astype(int)\n    train_df[\"VIP_Missing\"] = train_df[\"VIP\"].isna().astype(int)\n    \n    # Convert CryoSleep and VIP to string for categorical encoding\n    train_df[\"CryoSleep\"] = train_df[\"CryoSleep\"].fillna(\"Unknown\").astype(str)\n    train_df[\"VIP\"] = train_df[\"VIP\"].fillna(\"Unknown\").astype(str)\n    \n    # Build feature set: core features + cabin parsing + missingness flags\n    # (removed HighSpender, keeping GroupId and RoomNum)\n    feature_cols = (\n        [\"Age\"] + SPENDING + CATEGORICAL + \n        [\"Deck\", \"RoomNum\", \"Side\", \"GroupId\"] + \n        [\"CryoSleep_Missing\", \"VIP_Missing\"]\n    )\n    X = train_df[feature_cols]\n    y = train_df[\"Transported\"].astype(int)\n    \n    # Define preprocessing for numeric and categorical columns\n    numeric_transformer = Pipeline([\n        (\"imputer\", SimpleImputer(strategy=\"median\")),\n        (\"scaler\", StandardScaler()),\n    ])\n    \n    categorical_transformer = Pipeline([\n        (\"imputer\", SimpleImputer(strategy=\"most_frequent\")),\n        (\"onehot\", OneHotEncoder(handle_unknown=\"ignore\", sparse_output=False)),\n    ])\n    \n    preprocessor = ColumnTransformer([\n        (\"num\", numeric_transformer, [\"Age\", \"RoomNum\", \"CryoSleep_Missing\", \"VIP_Missing\"] + SPENDING),\n        (\"cat\", categorical_transformer, CATEGORICAL + [\"Deck\", \"Side\", \"GroupId\"]),\n    ])\n    \n    pipe = Pipeline([\n        (\"preprocessor\", preprocessor),\n        (\"clf\", xgb.XGBClassifier(n_estimators=100, max_depth=6, learning_rate=0.1, random_state=42, verbosity=0)),\n    ])\n    \n    pipe.fit(X, y)\n    \n    def predict(X_val):\n        # Parse Cabin in validation set\n        cabin_data = X_val[\"Cabin\"].apply(parse_cabin)\n        X_val_copy = X_val.copy()\n        X_val_copy[\"Deck\"] = cabin_data.apply(lambda x: x[0])\n        X_val_copy[\"RoomNum\"] = cabin_data.apply(lambda x: x[1])\n        X_val_copy[\"Side\"] = cabin_data.apply(lambda x: x[2])\n        \n        # Extract group ID\n        X_val_copy[\"GroupId\"] = X_val_copy[\"PassengerId\"].apply(extract_group_id)\n        \n        # Fill missing spending with 0\n        for col in SPENDING:\n            X_val_copy[col] = X_val_copy[col].fillna(0)\n        \n        # Create explicit missingness flags for CryoSleep and VIP before filling\n        X_val_copy[\"CryoSleep_Missing\"] = X_val_copy[\"CryoSleep\"].isna().astype(int)\n        X_val_copy[\"VIP_Missing\"] = X_val_copy[\"VIP\"].isna().astype(int)\n        \n        # Handle CryoSleep and VIP\n        X_val_copy[\"CryoSleep\"] = X_val_copy[\"CryoSleep\"].fillna(\"Unknown\").astype(str)\n        X_val_copy[\"VIP\"] = X_val_copy[\"VIP\"].fillna(\"Unknown\").astype(str)\n        \n        return pipe.predict(X_val_copy[feature_cols]).astype(bool)\n    \n    return predict\n\n\nif __name__ == \"__main__\":\n    predict_fn = build_predict_fn()\n    score = prepare.evaluate(predict_fn)\n    print(f\"VAL_ACCURACY: {score:.4f}\")\n", "notes_append": "Iteration 29: Reverted to iter 26 (XGBoost + cabin parsing + GroupId + RoomNum + missingness flags) after iter 28 LightGBM crashed due to unseen GroupId values in validation. Running baseline to confirm 0.8143 score is reproducible and code is clean before exploring next direction (interaction features, hyperparameter tuning, or feature selection).", "stdout": "VAL_ACCURACY: 0.8143\n", "stderr": "", "returncode": 0, "score": 0.8143, "kept": true, "status": "kept", "commit_hash": null, "input_tokens": 4419, "output_tokens": 2415, "cost_usd": 0.016494}
