{"iteration": 1, "timestamp": "2026-05-08T22:09:39", "previous_best": 0.8235, "duration_seconds": 4.07, "agent_response_raw": "<reflection>\nThe last run confirms the baseline iter 0 score of 0.8235 is stable and reproducible. The EDA output shows clear signal in the data: RoomService, Spa, VRDeck have moderate negative correlation with transportation (~-0.20 to -0.25); CryoSleep is the strongest categorical signal (True passengers are transported 57% of the time vs. False at 41%); HomePlanet and Destination show conditional structure. All prior feature engineering (group aggregates, interaction terms, spending flags) failed to improve over the baseline, suggesting the model is already capturing these patterns adequately or that added complexity causes overfitting. The task now is to find a truly novel signal that the baseline XGBoost misses.\n</reflection>\n\n<observations>\n- The EDA reveals CryoSleep is the dominant categorical signal (57% transported if True vs 41% if False), yet the baseline already uses it. This suggests the baseline is leveraging it well and simple feature engineering won't unlock more.\n- RoomService, Spa, VRDeck show consistent negative correlation (-0.20 to -0.25), implying high spending in these categories is protective (less likely to be transported). The baseline includes all five spending columns and should capture this.\n- HomePlanet distribution is skewed: Earth passengers are transported at 45% but non-transported at 61%; Europa and Mars show the opposite pattern. This is already in the baseline as categorical.\n- Destination shows strong imbalance: TRAPPIST-1e is 72% of non-transported but only 63% of transported; 55 Cancri e is 17% of transported but only 17% of non-transported. The baseline uses this too.\n- Missing value patterns (CryoSleep, VIP) show small but non-zero imbalance (<3% difference), so missingness flags may not add much. However, the prevalence of missing CryoSleep (2.4%) is notable and the baseline does not explicitly flag it.\n</observations>\n\n<hypothesis>\nThe baseline model (Age + 5 spending + 4 categorical + Cabin parse) achieves 0.8235 by capturing main effects well, but misses interaction or non-linear patterns. Since all prior feature engineering attempts failed, the bottleneck is likely not missing signal in the features themselves, but rather model capacity or regularization. Testing a simpler model (logistic regression) or different hyperparameters on the same feature set will reveal whether the baseline is overfitting or underfitting.\n</hypothesis>\n\n<plan>\nReduce XGBoost complexity to prevent overfitting while keeping the exact iter 0 feature set. Lower max_depth from 6 to 4 and reduce n_estimators from 100 to 50, keeping learning_rate at 0.1. This tests whether the current baseline is overfit and whether a simpler ensemble scores better on validation.\n</plan>\n\n<code>\n```python\n\"\"\"\ntrain.py — Iteration 74: Test simpler XGBoost on iter 0 feature set.\nHypothesis: baseline (max_depth=6, n_est=100) may overfit. Try max_depth=4, n_est=50.\n\"\"\"\nimport sys, pathlib\nsys.path.insert(0, str(pathlib.Path(__file__).resolve().parent.parent))\n\nimport pandas as pd\nimport numpy as np\nimport xgboost as xgb\nfrom sklearn.impute import SimpleImputer\nfrom sklearn.pipeline import Pipeline\nfrom sklearn.preprocessing import StandardScaler, OneHotEncoder\nfrom sklearn.compose import ColumnTransformer\n\nimport prepare\n\n\ndef parse_cabin(cabin_str):\n    \"\"\"Parse Cabin 'F/0/S' into deck, room_num, side.\"\"\"\n    if pd.isna(cabin_str):\n        return np.nan, np.nan, np.nan\n    parts = str(cabin_str).split(\"/\")\n    if len(parts) == 3:\n        return parts[0], int(parts[1]) if parts[1].isdigit() else np.nan, parts[2]\n    return np.nan, np.nan, np.nan\n\n\ndef build_predict_fn():\n    train_df, _ = prepare.load_split()\n    \n    # Parse Cabin into Deck, RoomNum, Side\n    cabin_data = train_df[\"Cabin\"].apply(parse_cabin)\n    train_df[\"Deck\"] = cabin_data.apply(lambda x: x[0])\n    train_df[\"RoomNum\"] = cabin_data.apply(lambda x: x[1])\n    train_df[\"Side\"] = cabin_data.apply(lambda x: x[2])\n    \n    # Feature set: iter 0 baseline\n    numeric_cols = [\"Age\", \"RoomService\", \"FoodCourt\", \"ShoppingMall\", \"Spa\", \"VRDeck\"]\n    categorical_cols = [\"HomePlanet\", \"Destination\", \"CryoSleep\", \"VIP\"]\n    cabin_cols = [\"Deck\", \"RoomNum\", \"Side\"]\n    feature_cols = numeric_cols + categorical_cols + cabin_cols\n    \n    X = train_df[feature_cols]\n    y = train_df[\"Transported\"].astype(int)\n    \n    # Preprocessing\n    numeric_transformer = Pipeline([\n        (\"imputer\", SimpleImputer(strategy=\"median\")),\n        (\"scaler\", StandardScaler()),\n    ])\n    \n    categorical_transformer = Pipeline([\n        (\"imputer\", SimpleImputer(strategy=\"most_frequent\")),\n        (\"onehot\", OneHotEncoder(handle_unknown=\"ignore\", sparse_output=False)),\n    ])\n    \n    preprocessor = ColumnTransformer([\n        (\"num\", numeric_transformer, numeric_cols),\n        (\"cat\", categorical_transformer, categorical_cols + cabin_cols),\n    ])\n    \n    # Test simpler XGBoost: max_depth=4, n_estimators=50 (vs baseline 6, 100)\n    pipe = Pipeline([\n        (\"preprocessor\", preprocessor),\n        (\"clf\", xgb.XGBClassifier(\n            max_depth=4, n_estimators=50, learning_rate=0.1, \n            random_state=42, verbosity=0\n        )),\n    ])\n    \n    pipe.fit(X, y)\n    \n    def predict(X_val):\n        X_val_copy = X_val.copy()\n        cabin_data = X_val_copy[\"Cabin\"].apply(parse_cabin)\n        X_val_copy[\"Deck\"] = cabin_data.apply(lambda x: x[0])\n        X_val_copy[\"RoomNum\"] = cabin_data.apply(lambda x: x[1])\n        X_val_copy[\"Side\"] = cabin_data.apply(lambda x: x[2])\n        return pipe.predict(X_val_copy[feature_cols]).astype(bool)\n    \n    return predict\n\n\nif __name__ == \"__main__\":\n    predict_fn = build_predict_fn()\n    score = prepare.evaluate(predict_fn)\n    print(f\"VAL_ACCURACY: {score:.4f}\")\n```\n</code>\n\n<notes_append>\nIteration 74: Test simpler XGBoost on exact iter 0 feature set. Reduced max_depth from 6 to 4 and n_estimators from 100 to 50 to prevent overfitting. Hypothesis: baseline may be overfitting on training data; simpler model may generalize better. If score improves, continue reducing complexity; if regresses, revert to depth=6 n_est=100.\n</notes_append>", "reflection": "The last run confirms the baseline iter 0 score of 0.8235 is stable and reproducible. The EDA output shows clear signal in the data: RoomService, Spa, VRDeck have moderate negative correlation with transportation (~-0.20 to -0.25); CryoSleep is the strongest categorical signal (True passengers are transported 57% of the time vs. False at 41%); HomePlanet and Destination show conditional structure. All prior feature engineering (group aggregates, interaction terms, spending flags) failed to improve over the baseline, suggesting the model is already capturing these patterns adequately or that added complexity causes overfitting. The task now is to find a truly novel signal that the baseline XGBoost misses.", "observations": ["The EDA reveals CryoSleep is the dominant categorical signal (57% transported if True vs 41% if False), yet the baseline already uses it. This suggests the baseline is leveraging it well and simple feature engineering won't unlock more.", "RoomService, Spa, VRDeck show consistent negative correlation (-0.20 to -0.25), implying high spending in these categories is protective (less likely to be transported). The baseline includes all five spending columns and should capture this.", "HomePlanet distribution is skewed: Earth passengers are transported at 45% but non-transported at 61%; Europa and Mars show the opposite pattern. This is already in the baseline as categorical.", "Destination shows strong imbalance: TRAPPIST-1e is 72% of non-transported but only 63% of transported; 55 Cancri e is 17% of transported but only 17% of non-transported. The baseline uses this too.", "Missing value patterns (CryoSleep, VIP) show small but non-zero imbalance (<3% difference), so missingness flags may not add much. However, the prevalence of missing CryoSleep (2.4%) is notable and the baseline does not explicitly flag it."], "hypothesis": "The baseline model (Age + 5 spending + 4 categorical + Cabin parse) achieves 0.8235 by capturing main effects well, but misses interaction or non-linear patterns. Since all prior feature engineering attempts failed, the bottleneck is likely not missing signal in the features themselves, but rather model capacity or regularization. Testing a simpler model (logistic regression) or different hyperparameters on the same feature set will reveal whether the baseline is overfitting or underfitting.", "plan": "Reduce XGBoost complexity to prevent overfitting while keeping the exact iter 0 feature set. Lower max_depth from 6 to 4 and reduce n_estimators from 100 to 50, keeping learning_rate at 0.1. This tests whether the current baseline is overfit and whether a simpler ensemble scores better on validation.", "code": "\"\"\"\ntrain.py — Iteration 74: Test simpler XGBoost on iter 0 feature set.\nHypothesis: baseline (max_depth=6, n_est=100) may overfit. Try max_depth=4, n_est=50.\n\"\"\"\nimport sys, pathlib\nsys.path.insert(0, str(pathlib.Path(__file__).resolve().parent.parent))\n\nimport pandas as pd\nimport numpy as np\nimport xgboost as xgb\nfrom sklearn.impute import SimpleImputer\nfrom sklearn.pipeline import Pipeline\nfrom sklearn.preprocessing import StandardScaler, OneHotEncoder\nfrom sklearn.compose import ColumnTransformer\n\nimport prepare\n\n\ndef parse_cabin(cabin_str):\n    \"\"\"Parse Cabin 'F/0/S' into deck, room_num, side.\"\"\"\n    if pd.isna(cabin_str):\n        return np.nan, np.nan, np.nan\n    parts = str(cabin_str).split(\"/\")\n    if len(parts) == 3:\n        return parts[0], int(parts[1]) if parts[1].isdigit() else np.nan, parts[2]\n    return np.nan, np.nan, np.nan\n\n\ndef build_predict_fn():\n    train_df, _ = prepare.load_split()\n    \n    # Parse Cabin into Deck, RoomNum, Side\n    cabin_data = train_df[\"Cabin\"].apply(parse_cabin)\n    train_df[\"Deck\"] = cabin_data.apply(lambda x: x[0])\n    train_df[\"RoomNum\"] = cabin_data.apply(lambda x: x[1])\n    train_df[\"Side\"] = cabin_data.apply(lambda x: x[2])\n    \n    # Feature set: iter 0 baseline\n    numeric_cols = [\"Age\", \"RoomService\", \"FoodCourt\", \"ShoppingMall\", \"Spa\", \"VRDeck\"]\n    categorical_cols = [\"HomePlanet\", \"Destination\", \"CryoSleep\", \"VIP\"]\n    cabin_cols = [\"Deck\", \"RoomNum\", \"Side\"]\n    feature_cols = numeric_cols + categorical_cols + cabin_cols\n    \n    X = train_df[feature_cols]\n    y = train_df[\"Transported\"].astype(int)\n    \n    # Preprocessing\n    numeric_transformer = Pipeline([\n        (\"imputer\", SimpleImputer(strategy=\"median\")),\n        (\"scaler\", StandardScaler()),\n    ])\n    \n    categorical_transformer = Pipeline([\n        (\"imputer\", SimpleImputer(strategy=\"most_frequent\")),\n        (\"onehot\", OneHotEncoder(handle_unknown=\"ignore\", sparse_output=False)),\n    ])\n    \n    preprocessor = ColumnTransformer([\n        (\"num\", numeric_transformer, numeric_cols),\n        (\"cat\", categorical_transformer, categorical_cols + cabin_cols),\n    ])\n    \n    # Test simpler XGBoost: max_depth=4, n_estimators=50 (vs baseline 6, 100)\n    pipe = Pipeline([\n        (\"preprocessor\", preprocessor),\n        (\"clf\", xgb.XGBClassifier(\n            max_depth=4, n_estimators=50, learning_rate=0.1, \n            random_state=42, verbosity=0\n        )),\n    ])\n    \n    pipe.fit(X, y)\n    \n    def predict(X_val):\n        X_val_copy = X_val.copy()\n        cabin_data = X_val_copy[\"Cabin\"].apply(parse_cabin)\n        X_val_copy[\"Deck\"] = cabin_data.apply(lambda x: x[0])\n        X_val_copy[\"RoomNum\"] = cabin_data.apply(lambda x: x[1])\n        X_val_copy[\"Side\"] = cabin_data.apply(lambda x: x[2])\n        return pipe.predict(X_val_copy[feature_cols]).astype(bool)\n    \n    return predict\n\n\nif __name__ == \"__main__\":\n    predict_fn = build_predict_fn()\n    score = prepare.evaluate(predict_fn)\n    print(f\"VAL_ACCURACY: {score:.4f}\")\n", "notes_append": "Iteration 74: Test simpler XGBoost on exact iter 0 feature set. Reduced max_depth from 6 to 4 and n_estimators from 100 to 50 to prevent overfitting. Hypothesis: baseline may be overfitting on training data; simpler model may generalize better. If score improves, continue reducing complexity; if regresses, revert to depth=6 n_est=100.", "stdout": "VAL_ACCURACY: 0.8097\n", "stderr": "", "returncode": 0, "score": 0.8097, "kept": false, "status": "reverted", "commit_hash": null, "input_tokens": 5552, "output_tokens": 1821, "cost_usd": 0.014657}
