{"iteration": 7, "timestamp": "2026-05-08T21:20:32", "previous_best": 0.8189, "duration_seconds": 4.06, "agent_response_raw": "<reflection>\nThe last run (iteration 6) with max_depth=4 scored 0.8068, which is a regression from the best of 0.8189. The notes indicate that RoomNum was restored in iteration 35 but the depth reduction backfired. The current code has RoomNum and max_depth=6, and was kept at 0.8189 in iteration 4. I need to verify the current state and understand why recent changes regressed. Let me check: the current code shows max_depth=6 and RoomNum is present, which matches iteration 4's kept state (0.8189). The issue is that iterations 5 and 6 tried removing RoomNum and reducing depth, both of which regressed. I should focus on a different angle: perhaps the CryoSleep_NoSpending interaction or the missingness flags are not helping, or perhaps hyperparameter tuning in a different direction (e.g., learning_rate, n_estimators) could help.\n</reflection>\n\n<observations>\n- Best score is 0.8189 from iteration 4, which used XGBoost with cabin parsing (Deck/RoomNum/Side), TotalSpending, CryoSleep_NoSpending interaction, and explicit missingness flags for CryoSleep and VIP.\n- Iterations 5 and 6 both regressed: removing RoomNum dropped to 0.8091, and reducing max_depth to 4 dropped to 0.8068. This suggests the current feature set and max_depth=6 are stable.\n- The feature importance diagnostics in iteration 4 printed to stderr but were not captured in the last output. I should focus on understanding which engineered features are actually driving the score, not just adding diagnostics.\n- Recent iterations have been stuck in micro-tuning (depth, removing one feature at a time). The soft directive warns against this; I should try something structurally different.\n- The dataset is small (~8,700 rows). The current approach with cabin parsing and grouping is reasonable, but I haven't explored whether interaction terms beyond CryoSleep_NoSpending might help (e.g., Age with CryoSleep, Destination with Deck).\n</observations>\n\n<hypothesis>\nThe CryoSleep_NoSpending interaction is too narrow. A broader interaction between CryoSleep status and total spending (not just binary zero-spending) will better capture passenger behavior and improve accuracy beyond 0.8189.\n</hypothesis>\n\n<plan>\nI will replace the binary CryoSleep_NoSpending flag with a richer feature: CryoSleep_Spending_Ratio (total spending divided by 1 + TotalSpending to handle zero spending smoothly, multiplied by CryoSleep status). This tests whether the *intensity* of spending conditioned on cryo status matters more than just zero/non-zero.\n</plan>\n\n<code>\n```python\n\"\"\"\ntrain.py — XGBoost with cabin parsing, GroupId, and richer CryoSleep-spending interaction.\nIteration 36: Replace binary CryoSleep_NoSpending with CryoSleep_Spending_Ratio to test\nwhether the intensity of spending conditioned on cryo status improves prediction.\n\"\"\"\nimport sys, pathlib\nsys.path.insert(0, str(pathlib.Path(__file__).resolve().parent.parent))\n\nimport pandas as pd\nimport numpy as np\nimport xgboost as xgb\nfrom sklearn.impute import SimpleImputer\nfrom sklearn.pipeline import Pipeline\nfrom sklearn.preprocessing import StandardScaler, OneHotEncoder\nfrom sklearn.compose import ColumnTransformer\n\nimport prepare\n\nNUMERIC = [\"Age\", \"RoomService\", \"FoodCourt\", \"ShoppingMall\", \"Spa\", \"VRDeck\"]\nCATEGORICAL = [\"HomePlanet\", \"Destination\", \"CryoSleep\", \"VIP\"]\nSPENDING = [\"RoomService\", \"FoodCourt\", \"ShoppingMall\", \"Spa\", \"VRDeck\"]\n\n\ndef parse_cabin(cabin_str):\n    \"\"\"Parse Cabin 'F/0/S' into deck, room_num, side.\"\"\"\n    if pd.isna(cabin_str):\n        return np.nan, np.nan, np.nan\n    parts = str(cabin_str).split(\"/\")\n    if len(parts) == 3:\n        return parts[0], int(parts[1]) if parts[1].isdigit() else np.nan, parts[2]\n    return np.nan, np.nan, np.nan\n\n\ndef extract_group_id(passenger_id):\n    \"\"\"Extract group ID from PassengerId (e.g., '0001_01' -> '0001').\"\"\"\n    if pd.isna(passenger_id):\n        return np.nan\n    return str(passenger_id).split(\"_\")[0]\n\n\ndef engineer_features(df):\n    \"\"\"Engineer spending and spending-cryo interaction features.\"\"\"\n    df_copy = df.copy()\n    \n    # Fill missing spending with 0\n    for col in SPENDING:\n        df_copy[col] = df_copy[col].fillna(0)\n    \n    # Total spending\n    df_copy[\"TotalSpending\"] = df_copy[SPENDING].sum(axis=1)\n    \n    # Interaction: CryoSleep status and spending ratio\n    # For passengers in cryo-sleep, compute spending as a fraction; for others, set to 0.\n    # Use log-transformed spending to capture intensity better.\n    cryo_status = df_copy[\"CryoSleep\"].fillna(False)\n    log_spending = np.log1p(df_copy[\"TotalSpending\"])\n    df_copy[\"CryoSleep_LogSpending\"] = (\n        (cryo_status == True) * log_spending\n    )\n    \n    return df_copy\n\n\ndef build_predict_fn():\n    train_df, _ = prepare.load_split()\n    \n    # Parse Cabin into Deck, RoomNum, Side\n    cabin_data = train_df[\"Cabin\"].apply(parse_cabin)\n    train_df[\"Deck\"] = cabin_data.apply(lambda x: x[0])\n    train_df[\"RoomNum\"] = cabin_data.apply(lambda x: x[1])\n    train_df[\"Side\"] = cabin_data.apply(lambda x: x[2])\n    \n    # Extract group ID from PassengerId\n    train_df[\"GroupId\"] = train_df[\"PassengerId\"].apply(extract_group_id)\n    \n    # Engineer features\n    train_df = engineer_features(train_df)\n    \n    # Create explicit missingness flags for CryoSleep and VIP before filling\n    train_df[\"CryoSleep_Missing\"] = train_df[\"CryoSleep\"].isna().astype(int)\n    train_df[\"VIP_Missing\"] = train_df[\"VIP\"].isna().astype(int)\n    \n    # Convert CryoSleep and VIP to string for categorical encoding\n    train_df[\"CryoSleep\"] = train_df[\"CryoSleep\"].fillna(\"Unknown\").astype(str)\n    train_df[\"VIP\"] = train_df[\"VIP\"].fillna(\"Unknown\").astype(str)\n    \n    # Build feature set\n    feature_cols = (\n        [\"Age\"] + SPENDING + [\"TotalSpending\", \"CryoSleep_LogSpending\"] +\n        CATEGORICAL + \n        [\"Deck\", \"RoomNum\", \"Side\", \"GroupId\"] + \n        [\"CryoSleep_Missing\", \"VIP_Missing\"]\n    )\n    X = train_df[feature_cols]\n    y = train_df[\"Transported\"].astype(int)\n    \n    # Define preprocessing for numeric and categorical columns\n    numeric_transformer = Pipeline([\n        (\"imputer\", SimpleImputer(strategy=\"median\")),\n        (\"scaler\", StandardScaler()),\n    ])\n    \n    categorical_transformer = Pipeline([\n        (\"imputer\", SimpleImputer(strategy=\"most_frequent\")),\n        (\"onehot\", OneHotEncoder(handle_unknown=\"ignore\", sparse_output=False)),\n    ])\n    \n    numeric_feature_cols = (\n        [\"Age\", \"RoomNum\", \"CryoSleep_Missing\", \"VIP_Missing\"] + \n        SPENDING + [\"TotalSpending\", \"CryoSleep_LogSpending\"]\n    )\n    categorical_feature_cols = CATEGORICAL + [\"Deck\", \"Side\", \"GroupId\"]\n    \n    preprocessor = ColumnTransformer([\n        (\"num\", numeric_transformer, numeric_feature_cols),\n        (\"cat\", categorical_transformer, categorical_feature_cols),\n    ])\n    \n    pipe = Pipeline([\n        (\"preprocessor\", preprocessor),\n        (\"clf\", xgb.XGBClassifier(n_estimators=100, max_depth=6, learning_rate=0.1, random_state=42, verbosity=0)),\n    ])\n    \n    pipe.fit(X, y)\n    \n    def predict(X_val):\n        # Parse Cabin in validation set\n        cabin_data = X_val[\"Cabin\"].apply(parse_cabin)\n        X_val_copy = X_val.copy()\n        X_val_copy[\"Deck\"] = cabin_data.apply(lambda x: x[0])\n        X_val_copy[\"RoomNum\"] = cabin_data.apply(lambda x: x[1])\n        X_val_copy[\"Side\"] = cabin_data.apply(lambda x: x[2])\n        \n        # Extract group ID\n        X_val_copy[\"GroupId\"] = X_val_copy[\"PassengerId\"].apply(extract_group_id)\n        \n        # Engineer features\n        X_val_copy = engineer_features(X_val_copy)\n        \n        # Create explicit missingness flags for CryoSleep and VIP before filling\n        X_val_copy[\"CryoSleep_Missing\"] = X_val_copy[\"CryoSleep\"].isna().astype(int)\n        X_val_copy[\"VIP_Missing\"] = X_val_copy[\"VIP\"].isna().astype(int)\n        \n        # Handle CryoSleep and VIP\n        X_val_copy[\"CryoSleep\"] = X_val_copy[\"CryoSleep\"].fillna(\"Unknown\").astype(str)\n        X_val_copy[\"VIP\"] = X_val_copy[\"VIP\"].fillna(\"Unknown\").astype(str)\n        \n        return pipe.predict(X_val_copy[feature_cols]).astype(bool)\n    \n    return predict\n\n\nif __name__ == \"__main__\":\n    predict_fn = build_predict_fn()\n    score = prepare.evaluate(predict_fn)\n    print(f\"VAL_ACCURACY: {score:.4f}\")\n```\n</code>\n\n<notes_append>\nIteration 36: Replaced binary CryoSleep_NoSpending interaction with CryoSleep_LogSpending (log-transformed spending intensity for cryo-sleep passengers only). Testing whether continuous interaction captures spending-cryo relationship better than binary flag.\n</notes_append>", "reflection": "The last run (iteration 6) with max_depth=4 scored 0.8068, which is a regression from the best of 0.8189. The notes indicate that RoomNum was restored in iteration 35 but the depth reduction backfired. The current code has RoomNum and max_depth=6, and was kept at 0.8189 in iteration 4. I need to verify the current state and understand why recent changes regressed. Let me check: the current code shows max_depth=6 and RoomNum is present, which matches iteration 4's kept state (0.8189). The issue is that iterations 5 and 6 tried removing RoomNum and reducing depth, both of which regressed. I should focus on a different angle: perhaps the CryoSleep_NoSpending interaction or the missingness flags are not helping, or perhaps hyperparameter tuning in a different direction (e.g., learning_rate, n_estimators) could help.", "observations": ["Best score is 0.8189 from iteration 4, which used XGBoost with cabin parsing (Deck/RoomNum/Side), TotalSpending, CryoSleep_NoSpending interaction, and explicit missingness flags for CryoSleep and VIP.", "Iterations 5 and 6 both regressed: removing RoomNum dropped to 0.8091, and reducing max_depth to 4 dropped to 0.8068. This suggests the current feature set and max_depth=6 are stable.", "The feature importance diagnostics in iteration 4 printed to stderr but were not captured in the last output. I should focus on understanding which engineered features are actually driving the score, not just adding diagnostics.", "Recent iterations have been stuck in micro-tuning (depth, removing one feature at a time). The soft directive warns against this; I should try something structurally different.", "The dataset is small (~8,700 rows). The current approach with cabin parsing and grouping is reasonable, but I haven't explored whether interaction terms beyond CryoSleep_NoSpending might help (e.g., Age with CryoSleep, Destination with Deck)."], "hypothesis": "The CryoSleep_NoSpending interaction is too narrow. A broader interaction between CryoSleep status and total spending (not just binary zero-spending) will better capture passenger behavior and improve accuracy beyond 0.8189.", "plan": "I will replace the binary CryoSleep_NoSpending flag with a richer feature: CryoSleep_Spending_Ratio (total spending divided by 1 + TotalSpending to handle zero spending smoothly, multiplied by CryoSleep status). This tests whether the *intensity* of spending conditioned on cryo status matters more than just zero/non-zero.", "code": "\"\"\"\ntrain.py — XGBoost with cabin parsing, GroupId, and richer CryoSleep-spending interaction.\nIteration 36: Replace binary CryoSleep_NoSpending with CryoSleep_Spending_Ratio to test\nwhether the intensity of spending conditioned on cryo status improves prediction.\n\"\"\"\nimport sys, pathlib\nsys.path.insert(0, str(pathlib.Path(__file__).resolve().parent.parent))\n\nimport pandas as pd\nimport numpy as np\nimport xgboost as xgb\nfrom sklearn.impute import SimpleImputer\nfrom sklearn.pipeline import Pipeline\nfrom sklearn.preprocessing import StandardScaler, OneHotEncoder\nfrom sklearn.compose import ColumnTransformer\n\nimport prepare\n\nNUMERIC = [\"Age\", \"RoomService\", \"FoodCourt\", \"ShoppingMall\", \"Spa\", \"VRDeck\"]\nCATEGORICAL = [\"HomePlanet\", \"Destination\", \"CryoSleep\", \"VIP\"]\nSPENDING = [\"RoomService\", \"FoodCourt\", \"ShoppingMall\", \"Spa\", \"VRDeck\"]\n\n\ndef parse_cabin(cabin_str):\n    \"\"\"Parse Cabin 'F/0/S' into deck, room_num, side.\"\"\"\n    if pd.isna(cabin_str):\n        return np.nan, np.nan, np.nan\n    parts = str(cabin_str).split(\"/\")\n    if len(parts) == 3:\n        return parts[0], int(parts[1]) if parts[1].isdigit() else np.nan, parts[2]\n    return np.nan, np.nan, np.nan\n\n\ndef extract_group_id(passenger_id):\n    \"\"\"Extract group ID from PassengerId (e.g., '0001_01' -> '0001').\"\"\"\n    if pd.isna(passenger_id):\n        return np.nan\n    return str(passenger_id).split(\"_\")[0]\n\n\ndef engineer_features(df):\n    \"\"\"Engineer spending and spending-cryo interaction features.\"\"\"\n    df_copy = df.copy()\n    \n    # Fill missing spending with 0\n    for col in SPENDING:\n        df_copy[col] = df_copy[col].fillna(0)\n    \n    # Total spending\n    df_copy[\"TotalSpending\"] = df_copy[SPENDING].sum(axis=1)\n    \n    # Interaction: CryoSleep status and spending ratio\n    # For passengers in cryo-sleep, compute spending as a fraction; for others, set to 0.\n    # Use log-transformed spending to capture intensity better.\n    cryo_status = df_copy[\"CryoSleep\"].fillna(False)\n    log_spending = np.log1p(df_copy[\"TotalSpending\"])\n    df_copy[\"CryoSleep_LogSpending\"] = (\n        (cryo_status == True) * log_spending\n    )\n    \n    return df_copy\n\n\ndef build_predict_fn():\n    train_df, _ = prepare.load_split()\n    \n    # Parse Cabin into Deck, RoomNum, Side\n    cabin_data = train_df[\"Cabin\"].apply(parse_cabin)\n    train_df[\"Deck\"] = cabin_data.apply(lambda x: x[0])\n    train_df[\"RoomNum\"] = cabin_data.apply(lambda x: x[1])\n    train_df[\"Side\"] = cabin_data.apply(lambda x: x[2])\n    \n    # Extract group ID from PassengerId\n    train_df[\"GroupId\"] = train_df[\"PassengerId\"].apply(extract_group_id)\n    \n    # Engineer features\n    train_df = engineer_features(train_df)\n    \n    # Create explicit missingness flags for CryoSleep and VIP before filling\n    train_df[\"CryoSleep_Missing\"] = train_df[\"CryoSleep\"].isna().astype(int)\n    train_df[\"VIP_Missing\"] = train_df[\"VIP\"].isna().astype(int)\n    \n    # Convert CryoSleep and VIP to string for categorical encoding\n    train_df[\"CryoSleep\"] = train_df[\"CryoSleep\"].fillna(\"Unknown\").astype(str)\n    train_df[\"VIP\"] = train_df[\"VIP\"].fillna(\"Unknown\").astype(str)\n    \n    # Build feature set\n    feature_cols = (\n        [\"Age\"] + SPENDING + [\"TotalSpending\", \"CryoSleep_LogSpending\"] +\n        CATEGORICAL + \n        [\"Deck\", \"RoomNum\", \"Side\", \"GroupId\"] + \n        [\"CryoSleep_Missing\", \"VIP_Missing\"]\n    )\n    X = train_df[feature_cols]\n    y = train_df[\"Transported\"].astype(int)\n    \n    # Define preprocessing for numeric and categorical columns\n    numeric_transformer = Pipeline([\n        (\"imputer\", SimpleImputer(strategy=\"median\")),\n        (\"scaler\", StandardScaler()),\n    ])\n    \n    categorical_transformer = Pipeline([\n        (\"imputer\", SimpleImputer(strategy=\"most_frequent\")),\n        (\"onehot\", OneHotEncoder(handle_unknown=\"ignore\", sparse_output=False)),\n    ])\n    \n    numeric_feature_cols = (\n        [\"Age\", \"RoomNum\", \"CryoSleep_Missing\", \"VIP_Missing\"] + \n        SPENDING + [\"TotalSpending\", \"CryoSleep_LogSpending\"]\n    )\n    categorical_feature_cols = CATEGORICAL + [\"Deck\", \"Side\", \"GroupId\"]\n    \n    preprocessor = ColumnTransformer([\n        (\"num\", numeric_transformer, numeric_feature_cols),\n        (\"cat\", categorical_transformer, categorical_feature_cols),\n    ])\n    \n    pipe = Pipeline([\n        (\"preprocessor\", preprocessor),\n        (\"clf\", xgb.XGBClassifier(n_estimators=100, max_depth=6, learning_rate=0.1, random_state=42, verbosity=0)),\n    ])\n    \n    pipe.fit(X, y)\n    \n    def predict(X_val):\n        # Parse Cabin in validation set\n        cabin_data = X_val[\"Cabin\"].apply(parse_cabin)\n        X_val_copy = X_val.copy()\n        X_val_copy[\"Deck\"] = cabin_data.apply(lambda x: x[0])\n        X_val_copy[\"RoomNum\"] = cabin_data.apply(lambda x: x[1])\n        X_val_copy[\"Side\"] = cabin_data.apply(lambda x: x[2])\n        \n        # Extract group ID\n        X_val_copy[\"GroupId\"] = X_val_copy[\"PassengerId\"].apply(extract_group_id)\n        \n        # Engineer features\n        X_val_copy = engineer_features(X_val_copy)\n        \n        # Create explicit missingness flags for CryoSleep and VIP before filling\n        X_val_copy[\"CryoSleep_Missing\"] = X_val_copy[\"CryoSleep\"].isna().astype(int)\n        X_val_copy[\"VIP_Missing\"] = X_val_copy[\"VIP\"].isna().astype(int)\n        \n        # Handle CryoSleep and VIP\n        X_val_copy[\"CryoSleep\"] = X_val_copy[\"CryoSleep\"].fillna(\"Unknown\").astype(str)\n        X_val_copy[\"VIP\"] = X_val_copy[\"VIP\"].fillna(\"Unknown\").astype(str)\n        \n        return pipe.predict(X_val_copy[feature_cols]).astype(bool)\n    \n    return predict\n\n\nif __name__ == \"__main__\":\n    predict_fn = build_predict_fn()\n    score = prepare.evaluate(predict_fn)\n    print(f\"VAL_ACCURACY: {score:.4f}\")\n", "notes_append": "Iteration 36: Replaced binary CryoSleep_NoSpending interaction with CryoSleep_LogSpending (log-transformed spending intensity for cryo-sleep passengers only). Testing whether continuous interaction captures spending-cryo relationship better than binary flag.", "stdout": "VAL_ACCURACY: 0.8189\n", "stderr": "", "returncode": 0, "score": 0.8189, "kept": true, "status": "kept", "commit_hash": "30d3d09", "input_tokens": 4471, "output_tokens": 2681, "cost_usd": 0.017876}
