{"iteration": 7, "timestamp": "2026-05-08T20:53:17", "previous_best": 0.7907, "duration_seconds": 4.39, "agent_response_raw": "<reflection>\nThe data inspection reveals critical signal: passengers with CryoSleep=True have an 81.8% transport rate vs. 32.8% for False, and missing CryoSleep has 48.8% (intermediate). The spending columns all have negative correlations with transport (strongest: RoomService -0.248, Spa -0.220, VRDeck -0.206), suggesting travelers who don't spend are more likely to be transported. The current model at 0.7907 is close to baseline but hasn't improved beyond iteration 4. The inspection data shows the signal exists—I need to engineer features that better capture the spending behavior and CryoSleep patterns.\n</reflection>\n\n<observations>\n- **CryoSleep is highly predictive**: Passengers in cryo are transported 81.8% of the time; this dominates the decision boundary. The \"Unknown\" category (missing) sits at 48.8%, suggesting missingness itself carries meaning but may be confounded with other missing data patterns.\n- **Spending behavior inversely correlates with transport**: All five spending columns are negatively correlated with the target (RoomService -0.248 is strongest). This suggests \"not spending = traveling\" rather than \"spending = staying\". Filling NaN with 0 is correct, but the current model may not be weighting these signals strongly enough.\n- **Negative correlations suggest the model may be underfitting interactions**: LogisticRegression with one-hot encoding cannot learn that \"high spending across all categories\" is different from \"zero spending across all categories.\" A feature capturing total or aggregate spending behavior might help.\n- **GroupId may encode family/group structure**: The hints mention identifier columns encoding group structure. We extract GroupId but may not be leveraging it fully—passengers in the same group might have correlated transport outcomes.\n- **Current score is plateaued**: At 0.7907 for 10+ iterations, the simple one-hot + LogisticRegression approach has likely hit its ceiling. A structural change—either a different feature engineering scheme or a model class better suited to detecting non-linear spending patterns—is needed.\n</observations>\n\n<hypothesis>\nCreating an aggregate spending feature (total or mean across the five spending categories) will help the model distinguish passengers with zero spending (high transport likelihood) from those with any spending (lower likelihood), allowing LogisticRegression to capture this spending-transport pattern more effectively.\n</hypothesis>\n\n<plan>\nI will add two new features: `TotalSpending` (sum of all five spending columns) and `HasSpent` (binary: 1 if TotalSpending > 0, else 0). These will be included in the numeric feature set alongside individual spending columns. The hypothesis is that the model can then learn that high or low aggregate spending modulates the effect of other features, improving on the current 0.7907 plateau.\n</plan>\n\n<code>\n```python\n\"\"\"\ntrain.py — logistic regression with cabin parsing, GroupId, missingness flags, and spending aggregates.\nAdded TotalSpending and HasSpent to better capture the inverse spending-transport relationship.\n\"\"\"\nimport sys, pathlib\nsys.path.insert(0, str(pathlib.Path(__file__).resolve().parent.parent))\n\nimport pandas as pd\nimport numpy as np\nfrom sklearn.linear_model import LogisticRegression\nfrom sklearn.impute import SimpleImputer\nfrom sklearn.pipeline import Pipeline\nfrom sklearn.preprocessing import StandardScaler, OneHotEncoder\nfrom sklearn.compose import ColumnTransformer\n\nimport prepare\n\nNUMERIC = [\"Age\", \"RoomService\", \"FoodCourt\", \"ShoppingMall\", \"Spa\", \"VRDeck\"]\nCATEGORICAL = [\"HomePlanet\", \"Destination\", \"CryoSleep\", \"VIP\"]\nSPENDING = [\"RoomService\", \"FoodCourt\", \"ShoppingMall\", \"Spa\", \"VRDeck\"]\n\n\ndef parse_cabin(cabin_str):\n    \"\"\"Parse Cabin 'F/0/S' into deck, room_num, side.\"\"\"\n    if pd.isna(cabin_str):\n        return np.nan, np.nan, np.nan\n    parts = str(cabin_str).split(\"/\")\n    if len(parts) == 3:\n        return parts[0], int(parts[1]) if parts[1].isdigit() else np.nan, parts[2]\n    return np.nan, np.nan, np.nan\n\n\ndef extract_group_id(passenger_id):\n    \"\"\"Extract group ID from PassengerId (e.g., '0001_01' -> '0001').\"\"\"\n    if pd.isna(passenger_id):\n        return np.nan\n    return str(passenger_id).split(\"_\")[0]\n\n\ndef build_predict_fn():\n    train_df, _ = prepare.load_split()\n    \n    # Parse Cabin into Deck, RoomNum, Side\n    cabin_data = train_df[\"Cabin\"].apply(parse_cabin)\n    train_df[\"Deck\"] = cabin_data.apply(lambda x: x[0])\n    train_df[\"RoomNum\"] = cabin_data.apply(lambda x: x[1])\n    train_df[\"Side\"] = cabin_data.apply(lambda x: x[2])\n    \n    # Extract group ID from PassengerId\n    train_df[\"GroupId\"] = train_df[\"PassengerId\"].apply(extract_group_id)\n    \n    # Fill missing values in spending columns with 0 (indicates not spent)\n    for col in SPENDING:\n        train_df[col] = train_df[col].fillna(0)\n    \n    # Create aggregate spending features\n    train_df[\"TotalSpending\"] = train_df[SPENDING].sum(axis=1)\n    train_df[\"HasSpent\"] = (train_df[\"TotalSpending\"] > 0).astype(int)\n    \n    # Create explicit missingness flags for CryoSleep and VIP before filling\n    train_df[\"CryoSleep_Missing\"] = train_df[\"CryoSleep\"].isna().astype(int)\n    train_df[\"VIP_Missing\"] = train_df[\"VIP\"].isna().astype(int)\n    \n    # Convert CryoSleep and VIP to string for categorical encoding\n    train_df[\"CryoSleep\"] = train_df[\"CryoSleep\"].fillna(\"Unknown\").astype(str)\n    train_df[\"VIP\"] = train_df[\"VIP\"].fillna(\"Unknown\").astype(str)\n    \n    # Build feature set: core features + cabin parsing + spending aggregates + missingness flags\n    feature_cols = (\n        [\"Age\"] + SPENDING + [\"TotalSpending\", \"HasSpent\"] + CATEGORICAL + \n        [\"Deck\", \"RoomNum\", \"Side\", \"GroupId\"] + \n        [\"CryoSleep_Missing\", \"VIP_Missing\"]\n    )\n    X = train_df[feature_cols]\n    y = train_df[\"Transported\"].astype(int)\n    \n    # Define preprocessing for numeric and categorical columns\n    numeric_transformer = Pipeline([\n        (\"imputer\", SimpleImputer(strategy=\"median\")),\n        (\"scaler\", StandardScaler()),\n    ])\n    \n    categorical_transformer = Pipeline([\n        (\"imputer\", SimpleImputer(strategy=\"most_frequent\")),\n        (\"onehot\", OneHotEncoder(handle_unknown=\"ignore\", sparse_output=False)),\n    ])\n    \n    preprocessor = ColumnTransformer([\n        (\"num\", numeric_transformer, [\"Age\", \"RoomNum\", \"CryoSleep_Missing\", \"VIP_Missing\", \"TotalSpending\", \"HasSpent\"] + SPENDING),\n        (\"cat\", categorical_transformer, CATEGORICAL + [\"Deck\", \"Side\", \"GroupId\"]),\n    ])\n    \n    pipe = Pipeline([\n        (\"preprocessor\", preprocessor),\n        (\"clf\", LogisticRegression(max_iter=1000)),\n    ])\n    \n    pipe.fit(X, y)\n    \n    def predict(X_val):\n        # Parse Cabin in validation set\n        cabin_data = X_val[\"Cabin\"].apply(parse_cabin)\n        X_val_copy = X_val.copy()\n        X_val_copy[\"Deck\"] = cabin_data.apply(lambda x: x[0])\n        X_val_copy[\"RoomNum\"] = cabin_data.apply(lambda x: x[1])\n        X_val_copy[\"Side\"] = cabin_data.apply(lambda x: x[2])\n        \n        # Extract group ID\n        X_val_copy[\"GroupId\"] = X_val_copy[\"PassengerId\"].apply(extract_group_id)\n        \n        # Fill missing spending with 0\n        for col in SPENDING:\n            X_val_copy[col] = X_val_copy[col].fillna(0)\n        \n        # Create aggregate spending features\n        X_val_copy[\"TotalSpending\"] = X_val_copy[SPENDING].sum(axis=1)\n        X_val_copy[\"HasSpent\"] = (X_val_copy[\"TotalSpending\"] > 0).astype(int)\n        \n        # Create explicit missingness flags for CryoSleep and VIP before filling\n        X_val_copy[\"CryoSleep_Missing\"] = X_val_copy[\"CryoSleep\"].isna().astype(int)\n        X_val_copy[\"VIP_Missing\"] = X_val_copy[\"VIP\"].isna().astype(int)\n        \n        # Handle CryoSleep and VIP\n        X_val_copy[\"CryoSleep\"] = X_val_copy[\"CryoSleep\"].fillna(\"Unknown\").astype(str)\n        X_val_copy[\"VIP\"] = X_val_copy[\"VIP\"].fillna(\"Unknown\").astype(str)\n        \n        return pipe.predict(X_val_copy[feature_cols]).astype(bool)\n    \n    return predict\n\n\nif __name__ == \"__main__\":\n    predict_fn = build_predict_fn()\n    score = prepare.evaluate(predict_fn)\n    print(f\"VAL_ACCURACY: {score:.4f}\")\n```\n</code>\n\n<notes_append>\nIteration 15: Added TotalSpending (sum of five spending cols) and HasSpent (binary indicator) to capture the inverse spending-transport relationship revealed by data inspection. Testing whether aggregate spending features allow LogisticRegression to better learn spending-transport modulation beyond the plateaued 0.7907.\n</notes_append>", "reflection": "The data inspection reveals critical signal: passengers with CryoSleep=True have an 81.8% transport rate vs. 32.8% for False, and missing CryoSleep has 48.8% (intermediate). The spending columns all have negative correlations with transport (strongest: RoomService -0.248, Spa -0.220, VRDeck -0.206), suggesting travelers who don't spend are more likely to be transported. The current model at 0.7907 is close to baseline but hasn't improved beyond iteration 4. The inspection data shows the signal exists—I need to engineer features that better capture the spending behavior and CryoSleep patterns.", "observations": ["**CryoSleep is highly predictive**: Passengers in cryo are transported 81.8% of the time; this dominates the decision boundary. The \"Unknown\" category (missing) sits at 48.8%, suggesting missingness itself carries meaning but may be confounded with other missing data patterns.", "**Spending behavior inversely correlates with transport**: All five spending columns are negatively correlated with the target (RoomService -0.248 is strongest). This suggests \"not spending = traveling\" rather than \"spending = staying\". Filling NaN with 0 is correct, but the current model may not be weighting these signals strongly enough.", "**Negative correlations suggest the model may be underfitting interactions**: LogisticRegression with one-hot encoding cannot learn that \"high spending across all categories\" is different from \"zero spending across all categories.\" A feature capturing total or aggregate spending behavior might help.", "**GroupId may encode family/group structure**: The hints mention identifier columns encoding group structure. We extract GroupId but may not be leveraging it fully—passengers in the same group might have correlated transport outcomes.", "**Current score is plateaued**: At 0.7907 for 10+ iterations, the simple one-hot + LogisticRegression approach has likely hit its ceiling. A structural change—either a different feature engineering scheme or a model class better suited to detecting non-linear spending patterns—is needed."], "hypothesis": "Creating an aggregate spending feature (total or mean across the five spending categories) will help the model distinguish passengers with zero spending (high transport likelihood) from those with any spending (lower likelihood), allowing LogisticRegression to capture this spending-transport pattern more effectively.", "plan": "I will add two new features: `TotalSpending` (sum of all five spending columns) and `HasSpent` (binary: 1 if TotalSpending > 0, else 0). These will be included in the numeric feature set alongside individual spending columns. The hypothesis is that the model can then learn that high or low aggregate spending modulates the effect of other features, improving on the current 0.7907 plateau.", "code": "\"\"\"\ntrain.py — logistic regression with cabin parsing, GroupId, missingness flags, and spending aggregates.\nAdded TotalSpending and HasSpent to better capture the inverse spending-transport relationship.\n\"\"\"\nimport sys, pathlib\nsys.path.insert(0, str(pathlib.Path(__file__).resolve().parent.parent))\n\nimport pandas as pd\nimport numpy as np\nfrom sklearn.linear_model import LogisticRegression\nfrom sklearn.impute import SimpleImputer\nfrom sklearn.pipeline import Pipeline\nfrom sklearn.preprocessing import StandardScaler, OneHotEncoder\nfrom sklearn.compose import ColumnTransformer\n\nimport prepare\n\nNUMERIC = [\"Age\", \"RoomService\", \"FoodCourt\", \"ShoppingMall\", \"Spa\", \"VRDeck\"]\nCATEGORICAL = [\"HomePlanet\", \"Destination\", \"CryoSleep\", \"VIP\"]\nSPENDING = [\"RoomService\", \"FoodCourt\", \"ShoppingMall\", \"Spa\", \"VRDeck\"]\n\n\ndef parse_cabin(cabin_str):\n    \"\"\"Parse Cabin 'F/0/S' into deck, room_num, side.\"\"\"\n    if pd.isna(cabin_str):\n        return np.nan, np.nan, np.nan\n    parts = str(cabin_str).split(\"/\")\n    if len(parts) == 3:\n        return parts[0], int(parts[1]) if parts[1].isdigit() else np.nan, parts[2]\n    return np.nan, np.nan, np.nan\n\n\ndef extract_group_id(passenger_id):\n    \"\"\"Extract group ID from PassengerId (e.g., '0001_01' -> '0001').\"\"\"\n    if pd.isna(passenger_id):\n        return np.nan\n    return str(passenger_id).split(\"_\")[0]\n\n\ndef build_predict_fn():\n    train_df, _ = prepare.load_split()\n    \n    # Parse Cabin into Deck, RoomNum, Side\n    cabin_data = train_df[\"Cabin\"].apply(parse_cabin)\n    train_df[\"Deck\"] = cabin_data.apply(lambda x: x[0])\n    train_df[\"RoomNum\"] = cabin_data.apply(lambda x: x[1])\n    train_df[\"Side\"] = cabin_data.apply(lambda x: x[2])\n    \n    # Extract group ID from PassengerId\n    train_df[\"GroupId\"] = train_df[\"PassengerId\"].apply(extract_group_id)\n    \n    # Fill missing values in spending columns with 0 (indicates not spent)\n    for col in SPENDING:\n        train_df[col] = train_df[col].fillna(0)\n    \n    # Create aggregate spending features\n    train_df[\"TotalSpending\"] = train_df[SPENDING].sum(axis=1)\n    train_df[\"HasSpent\"] = (train_df[\"TotalSpending\"] > 0).astype(int)\n    \n    # Create explicit missingness flags for CryoSleep and VIP before filling\n    train_df[\"CryoSleep_Missing\"] = train_df[\"CryoSleep\"].isna().astype(int)\n    train_df[\"VIP_Missing\"] = train_df[\"VIP\"].isna().astype(int)\n    \n    # Convert CryoSleep and VIP to string for categorical encoding\n    train_df[\"CryoSleep\"] = train_df[\"CryoSleep\"].fillna(\"Unknown\").astype(str)\n    train_df[\"VIP\"] = train_df[\"VIP\"].fillna(\"Unknown\").astype(str)\n    \n    # Build feature set: core features + cabin parsing + spending aggregates + missingness flags\n    feature_cols = (\n        [\"Age\"] + SPENDING + [\"TotalSpending\", \"HasSpent\"] + CATEGORICAL + \n        [\"Deck\", \"RoomNum\", \"Side\", \"GroupId\"] + \n        [\"CryoSleep_Missing\", \"VIP_Missing\"]\n    )\n    X = train_df[feature_cols]\n    y = train_df[\"Transported\"].astype(int)\n    \n    # Define preprocessing for numeric and categorical columns\n    numeric_transformer = Pipeline([\n        (\"imputer\", SimpleImputer(strategy=\"median\")),\n        (\"scaler\", StandardScaler()),\n    ])\n    \n    categorical_transformer = Pipeline([\n        (\"imputer\", SimpleImputer(strategy=\"most_frequent\")),\n        (\"onehot\", OneHotEncoder(handle_unknown=\"ignore\", sparse_output=False)),\n    ])\n    \n    preprocessor = ColumnTransformer([\n        (\"num\", numeric_transformer, [\"Age\", \"RoomNum\", \"CryoSleep_Missing\", \"VIP_Missing\", \"TotalSpending\", \"HasSpent\"] + SPENDING),\n        (\"cat\", categorical_transformer, CATEGORICAL + [\"Deck\", \"Side\", \"GroupId\"]),\n    ])\n    \n    pipe = Pipeline([\n        (\"preprocessor\", preprocessor),\n        (\"clf\", LogisticRegression(max_iter=1000)),\n    ])\n    \n    pipe.fit(X, y)\n    \n    def predict(X_val):\n        # Parse Cabin in validation set\n        cabin_data = X_val[\"Cabin\"].apply(parse_cabin)\n        X_val_copy = X_val.copy()\n        X_val_copy[\"Deck\"] = cabin_data.apply(lambda x: x[0])\n        X_val_copy[\"RoomNum\"] = cabin_data.apply(lambda x: x[1])\n        X_val_copy[\"Side\"] = cabin_data.apply(lambda x: x[2])\n        \n        # Extract group ID\n        X_val_copy[\"GroupId\"] = X_val_copy[\"PassengerId\"].apply(extract_group_id)\n        \n        # Fill missing spending with 0\n        for col in SPENDING:\n            X_val_copy[col] = X_val_copy[col].fillna(0)\n        \n        # Create aggregate spending features\n        X_val_copy[\"TotalSpending\"] = X_val_copy[SPENDING].sum(axis=1)\n        X_val_copy[\"HasSpent\"] = (X_val_copy[\"TotalSpending\"] > 0).astype(int)\n        \n        # Create explicit missingness flags for CryoSleep and VIP before filling\n        X_val_copy[\"CryoSleep_Missing\"] = X_val_copy[\"CryoSleep\"].isna().astype(int)\n        X_val_copy[\"VIP_Missing\"] = X_val_copy[\"VIP\"].isna().astype(int)\n        \n        # Handle CryoSleep and VIP\n        X_val_copy[\"CryoSleep\"] = X_val_copy[\"CryoSleep\"].fillna(\"Unknown\").astype(str)\n        X_val_copy[\"VIP\"] = X_val_copy[\"VIP\"].fillna(\"Unknown\").astype(str)\n        \n        return pipe.predict(X_val_copy[feature_cols]).astype(bool)\n    \n    return predict\n\n\nif __name__ == \"__main__\":\n    predict_fn = build_predict_fn()\n    score = prepare.evaluate(predict_fn)\n    print(f\"VAL_ACCURACY: {score:.4f}\")\n", "notes_append": "Iteration 15: Added TotalSpending (sum of five spending cols) and HasSpent (binary indicator) to capture the inverse spending-transport relationship revealed by data inspection. Testing whether aggregate spending features allow LogisticRegression to better learn spending-transport modulation beyond the plateaued 0.7907.", "stdout": "VAL_ACCURACY: 0.7884\n", "stderr": "", "returncode": 0, "score": 0.7884, "kept": false, "status": "reverted", "commit_hash": null, "input_tokens": 4596, "output_tokens": 2520, "cost_usd": 0.017196}
