{"iteration": 2, "timestamp": "2026-05-08T21:16:35", "previous_best": 0.8143, "duration_seconds": 4.08, "agent_response_raw": "<reflection>\nThe last iteration (iter 25) regressed to 0.8068 by removing GroupId and RoomNum. The best score remains 0.8143 from iteration 0. Notes show that iterations 19–20 attempted hyperparameter tuning and regressed, suggesting the feature set (not hyperparameters) is the limiting factor. The current script has cabin parsing, GroupId, missingness flags, and HighSpender; removing GroupId hurt. I should restore that and investigate what's actually helping or hurting.\n</reflection>\n\n<observations>\n- The best model (0.8143) includes cabin parsing (Deck, RoomNum, Side), GroupId extraction from PassengerId, spending columns filled as 0, and missingness flags for CryoSleep and VIP. This suggests group-level structure and cabin location are predictive.\n- Iteration 25's removal of GroupId and RoomNum immediately regressed to 0.8068, indicating these features do carry signal despite high cardinality. GroupId likely captures family/group patterns that correlate with transport.\n- The HighSpender feature (added in iter 22) was kept through recent iterations, but no experiment has isolated its contribution. It may be noise or it may be helping; unclear.\n- RoomNum is numeric (passenger cabin room number), which should be processable by the imputer and scaler without overfitting risk in a dataset of 8,700 rows. Removing it was premature.\n- The notes show three consecutive iterations (19–20–21) tuning hyperparameters (max_depth, n_estimators, learning_rate) all regressed or returned to baseline, confirming that feature engineering, not hyperparameter tuning, is the path forward.\n</observations>\n\n<hypothesis>\nRestoring GroupId and RoomNum (which were present in the best model 0.8143) and removing the HighSpender feature (which has not been isolated or justified) will return to or exceed the best score. GroupId encodes group membership which likely correlates with transport outcome; RoomNum provides fine-grained cabin position information.\n</hypothesis>\n\n<plan>\nI will revert to the feature set from the best-scoring iteration (iter 0 baseline, which achieved 0.8143) but keep the cabin parsing, GroupId extraction, and missingness flags that are beneficial. I will explicitly remove HighSpender to test whether it is neutral or harmful. This is a regression to a known-good state before exploring further.\n</plan>\n\n<code>\n```python\n\"\"\"\ntrain.py — XGBoost with cabin parsing, GroupId, and missingness flags.\nIteration 26: Restore best-performing feature set (iter 0): cabin parsing + GroupId + missingness flags.\nRemove HighSpender (unvalidated); restore RoomNum which was removed in iter 25 and caused regression.\n\"\"\"\nimport sys, pathlib\nsys.path.insert(0, str(pathlib.Path(__file__).resolve().parent.parent))\n\nimport pandas as pd\nimport numpy as np\nimport xgboost as xgb\nfrom sklearn.impute import SimpleImputer\nfrom sklearn.pipeline import Pipeline\nfrom sklearn.preprocessing import StandardScaler, OneHotEncoder\nfrom sklearn.compose import ColumnTransformer\n\nimport prepare\n\nNUMERIC = [\"Age\", \"RoomService\", \"FoodCourt\", \"ShoppingMall\", \"Spa\", \"VRDeck\"]\nCATEGORICAL = [\"HomePlanet\", \"Destination\", \"CryoSleep\", \"VIP\"]\nSPENDING = [\"RoomService\", \"FoodCourt\", \"ShoppingMall\", \"Spa\", \"VRDeck\"]\n\n\ndef parse_cabin(cabin_str):\n    \"\"\"Parse Cabin 'F/0/S' into deck, room_num, side.\"\"\"\n    if pd.isna(cabin_str):\n        return np.nan, np.nan, np.nan\n    parts = str(cabin_str).split(\"/\")\n    if len(parts) == 3:\n        return parts[0], int(parts[1]) if parts[1].isdigit() else np.nan, parts[2]\n    return np.nan, np.nan, np.nan\n\n\ndef extract_group_id(passenger_id):\n    \"\"\"Extract group ID from PassengerId (e.g., '0001_01' -> '0001').\"\"\"\n    if pd.isna(passenger_id):\n        return np.nan\n    return str(passenger_id).split(\"_\")[0]\n\n\ndef build_predict_fn():\n    train_df, _ = prepare.load_split()\n    \n    # Parse Cabin into Deck, RoomNum, Side\n    cabin_data = train_df[\"Cabin\"].apply(parse_cabin)\n    train_df[\"Deck\"] = cabin_data.apply(lambda x: x[0])\n    train_df[\"RoomNum\"] = cabin_data.apply(lambda x: x[1])\n    train_df[\"Side\"] = cabin_data.apply(lambda x: x[2])\n    \n    # Extract group ID from PassengerId\n    train_df[\"GroupId\"] = train_df[\"PassengerId\"].apply(extract_group_id)\n    \n    # Fill missing values in spending columns with 0 (indicates not spent)\n    for col in SPENDING:\n        train_df[col] = train_df[col].fillna(0)\n    \n    # Create explicit missingness flags for CryoSleep and VIP before filling\n    train_df[\"CryoSleep_Missing\"] = train_df[\"CryoSleep\"].isna().astype(int)\n    train_df[\"VIP_Missing\"] = train_df[\"VIP\"].isna().astype(int)\n    \n    # Convert CryoSleep and VIP to string for categorical encoding\n    train_df[\"CryoSleep\"] = train_df[\"CryoSleep\"].fillna(\"Unknown\").astype(str)\n    train_df[\"VIP\"] = train_df[\"VIP\"].fillna(\"Unknown\").astype(str)\n    \n    # Build feature set: core features + cabin parsing + missingness flags\n    # (removed HighSpender, keeping GroupId and RoomNum)\n    feature_cols = (\n        [\"Age\"] + SPENDING + CATEGORICAL + \n        [\"Deck\", \"RoomNum\", \"Side\", \"GroupId\"] + \n        [\"CryoSleep_Missing\", \"VIP_Missing\"]\n    )\n    X = train_df[feature_cols]\n    y = train_df[\"Transported\"].astype(int)\n    \n    # Define preprocessing for numeric and categorical columns\n    numeric_transformer = Pipeline([\n        (\"imputer\", SimpleImputer(strategy=\"median\")),\n        (\"scaler\", StandardScaler()),\n    ])\n    \n    categorical_transformer = Pipeline([\n        (\"imputer\", SimpleImputer(strategy=\"most_frequent\")),\n        (\"onehot\", OneHotEncoder(handle_unknown=\"ignore\", sparse_output=False)),\n    ])\n    \n    preprocessor = ColumnTransformer([\n        (\"num\", numeric_transformer, [\"Age\", \"RoomNum\", \"CryoSleep_Missing\", \"VIP_Missing\"] + SPENDING),\n        (\"cat\", categorical_transformer, CATEGORICAL + [\"Deck\", \"Side\", \"GroupId\"]),\n    ])\n    \n    pipe = Pipeline([\n        (\"preprocessor\", preprocessor),\n        (\"clf\", xgb.XGBClassifier(n_estimators=100, max_depth=6, learning_rate=0.1, random_state=42, verbosity=0)),\n    ])\n    \n    pipe.fit(X, y)\n    \n    def predict(X_val):\n        # Parse Cabin in validation set\n        cabin_data = X_val[\"Cabin\"].apply(parse_cabin)\n        X_val_copy = X_val.copy()\n        X_val_copy[\"Deck\"] = cabin_data.apply(lambda x: x[0])\n        X_val_copy[\"RoomNum\"] = cabin_data.apply(lambda x: x[1])\n        X_val_copy[\"Side\"] = cabin_data.apply(lambda x: x[2])\n        \n        # Extract group ID\n        X_val_copy[\"GroupId\"] = X_val_copy[\"PassengerId\"].apply(extract_group_id)\n        \n        # Fill missing spending with 0\n        for col in SPENDING:\n            X_val_copy[col] = X_val_copy[col].fillna(0)\n        \n        # Create explicit missingness flags for CryoSleep and VIP before filling\n        X_val_copy[\"CryoSleep_Missing\"] = X_val_copy[\"CryoSleep\"].isna().astype(int)\n        X_val_copy[\"VIP_Missing\"] = X_val_copy[\"VIP\"].isna().astype(int)\n        \n        # Handle CryoSleep and VIP\n        X_val_copy[\"CryoSleep\"] = X_val_copy[\"CryoSleep\"].fillna(\"Unknown\").astype(str)\n        X_val_copy[\"VIP\"] = X_val_copy[\"VIP\"].fillna(\"Unknown\").astype(str)\n        \n        return pipe.predict(X_val_copy[feature_cols]).astype(bool)\n    \n    return predict\n\n\nif __name__ == \"__main__\":\n    predict_fn = build_predict_fn()\n    score = prepare.evaluate(predict_fn)\n    print(f\"VAL_ACCURACY: {score:.4f}\")\n```\n</code>\n\n<notes_append>\nIteration 26: Restored best-performing feature set (cabin parsing + GroupId + RoomNum + missingness flags), removed unvalidated HighSpender. Returning to known-good state before exploring further feature/model changes.\n</notes_append>", "reflection": "The last iteration (iter 25) regressed to 0.8068 by removing GroupId and RoomNum. The best score remains 0.8143 from iteration 0. Notes show that iterations 19–20 attempted hyperparameter tuning and regressed, suggesting the feature set (not hyperparameters) is the limiting factor. The current script has cabin parsing, GroupId, missingness flags, and HighSpender; removing GroupId hurt. I should restore that and investigate what's actually helping or hurting.", "observations": ["The best model (0.8143) includes cabin parsing (Deck, RoomNum, Side), GroupId extraction from PassengerId, spending columns filled as 0, and missingness flags for CryoSleep and VIP. This suggests group-level structure and cabin location are predictive.", "Iteration 25's removal of GroupId and RoomNum immediately regressed to 0.8068, indicating these features do carry signal despite high cardinality. GroupId likely captures family/group patterns that correlate with transport.", "The HighSpender feature (added in iter 22) was kept through recent iterations, but no experiment has isolated its contribution. It may be noise or it may be helping; unclear.", "RoomNum is numeric (passenger cabin room number), which should be processable by the imputer and scaler without overfitting risk in a dataset of 8,700 rows. Removing it was premature.", "The notes show three consecutive iterations (19–20–21) tuning hyperparameters (max_depth, n_estimators, learning_rate) all regressed or returned to baseline, confirming that feature engineering, not hyperparameter tuning, is the path forward."], "hypothesis": "Restoring GroupId and RoomNum (which were present in the best model 0.8143) and removing the HighSpender feature (which has not been isolated or justified) will return to or exceed the best score. GroupId encodes group membership which likely correlates with transport outcome; RoomNum provides fine-grained cabin position information.", "plan": "I will revert to the feature set from the best-scoring iteration (iter 0 baseline, which achieved 0.8143) but keep the cabin parsing, GroupId extraction, and missingness flags that are beneficial. I will explicitly remove HighSpender to test whether it is neutral or harmful. This is a regression to a known-good state before exploring further.", "code": "\"\"\"\ntrain.py — XGBoost with cabin parsing, GroupId, and missingness flags.\nIteration 26: Restore best-performing feature set (iter 0): cabin parsing + GroupId + missingness flags.\nRemove HighSpender (unvalidated); restore RoomNum which was removed in iter 25 and caused regression.\n\"\"\"\nimport sys, pathlib\nsys.path.insert(0, str(pathlib.Path(__file__).resolve().parent.parent))\n\nimport pandas as pd\nimport numpy as np\nimport xgboost as xgb\nfrom sklearn.impute import SimpleImputer\nfrom sklearn.pipeline import Pipeline\nfrom sklearn.preprocessing import StandardScaler, OneHotEncoder\nfrom sklearn.compose import ColumnTransformer\n\nimport prepare\n\nNUMERIC = [\"Age\", \"RoomService\", \"FoodCourt\", \"ShoppingMall\", \"Spa\", \"VRDeck\"]\nCATEGORICAL = [\"HomePlanet\", \"Destination\", \"CryoSleep\", \"VIP\"]\nSPENDING = [\"RoomService\", \"FoodCourt\", \"ShoppingMall\", \"Spa\", \"VRDeck\"]\n\n\ndef parse_cabin(cabin_str):\n    \"\"\"Parse Cabin 'F/0/S' into deck, room_num, side.\"\"\"\n    if pd.isna(cabin_str):\n        return np.nan, np.nan, np.nan\n    parts = str(cabin_str).split(\"/\")\n    if len(parts) == 3:\n        return parts[0], int(parts[1]) if parts[1].isdigit() else np.nan, parts[2]\n    return np.nan, np.nan, np.nan\n\n\ndef extract_group_id(passenger_id):\n    \"\"\"Extract group ID from PassengerId (e.g., '0001_01' -> '0001').\"\"\"\n    if pd.isna(passenger_id):\n        return np.nan\n    return str(passenger_id).split(\"_\")[0]\n\n\ndef build_predict_fn():\n    train_df, _ = prepare.load_split()\n    \n    # Parse Cabin into Deck, RoomNum, Side\n    cabin_data = train_df[\"Cabin\"].apply(parse_cabin)\n    train_df[\"Deck\"] = cabin_data.apply(lambda x: x[0])\n    train_df[\"RoomNum\"] = cabin_data.apply(lambda x: x[1])\n    train_df[\"Side\"] = cabin_data.apply(lambda x: x[2])\n    \n    # Extract group ID from PassengerId\n    train_df[\"GroupId\"] = train_df[\"PassengerId\"].apply(extract_group_id)\n    \n    # Fill missing values in spending columns with 0 (indicates not spent)\n    for col in SPENDING:\n        train_df[col] = train_df[col].fillna(0)\n    \n    # Create explicit missingness flags for CryoSleep and VIP before filling\n    train_df[\"CryoSleep_Missing\"] = train_df[\"CryoSleep\"].isna().astype(int)\n    train_df[\"VIP_Missing\"] = train_df[\"VIP\"].isna().astype(int)\n    \n    # Convert CryoSleep and VIP to string for categorical encoding\n    train_df[\"CryoSleep\"] = train_df[\"CryoSleep\"].fillna(\"Unknown\").astype(str)\n    train_df[\"VIP\"] = train_df[\"VIP\"].fillna(\"Unknown\").astype(str)\n    \n    # Build feature set: core features + cabin parsing + missingness flags\n    # (removed HighSpender, keeping GroupId and RoomNum)\n    feature_cols = (\n        [\"Age\"] + SPENDING + CATEGORICAL + \n        [\"Deck\", \"RoomNum\", \"Side\", \"GroupId\"] + \n        [\"CryoSleep_Missing\", \"VIP_Missing\"]\n    )\n    X = train_df[feature_cols]\n    y = train_df[\"Transported\"].astype(int)\n    \n    # Define preprocessing for numeric and categorical columns\n    numeric_transformer = Pipeline([\n        (\"imputer\", SimpleImputer(strategy=\"median\")),\n        (\"scaler\", StandardScaler()),\n    ])\n    \n    categorical_transformer = Pipeline([\n        (\"imputer\", SimpleImputer(strategy=\"most_frequent\")),\n        (\"onehot\", OneHotEncoder(handle_unknown=\"ignore\", sparse_output=False)),\n    ])\n    \n    preprocessor = ColumnTransformer([\n        (\"num\", numeric_transformer, [\"Age\", \"RoomNum\", \"CryoSleep_Missing\", \"VIP_Missing\"] + SPENDING),\n        (\"cat\", categorical_transformer, CATEGORICAL + [\"Deck\", \"Side\", \"GroupId\"]),\n    ])\n    \n    pipe = Pipeline([\n        (\"preprocessor\", preprocessor),\n        (\"clf\", xgb.XGBClassifier(n_estimators=100, max_depth=6, learning_rate=0.1, random_state=42, verbosity=0)),\n    ])\n    \n    pipe.fit(X, y)\n    \n    def predict(X_val):\n        # Parse Cabin in validation set\n        cabin_data = X_val[\"Cabin\"].apply(parse_cabin)\n        X_val_copy = X_val.copy()\n        X_val_copy[\"Deck\"] = cabin_data.apply(lambda x: x[0])\n        X_val_copy[\"RoomNum\"] = cabin_data.apply(lambda x: x[1])\n        X_val_copy[\"Side\"] = cabin_data.apply(lambda x: x[2])\n        \n        # Extract group ID\n        X_val_copy[\"GroupId\"] = X_val_copy[\"PassengerId\"].apply(extract_group_id)\n        \n        # Fill missing spending with 0\n        for col in SPENDING:\n            X_val_copy[col] = X_val_copy[col].fillna(0)\n        \n        # Create explicit missingness flags for CryoSleep and VIP before filling\n        X_val_copy[\"CryoSleep_Missing\"] = X_val_copy[\"CryoSleep\"].isna().astype(int)\n        X_val_copy[\"VIP_Missing\"] = X_val_copy[\"VIP\"].isna().astype(int)\n        \n        # Handle CryoSleep and VIP\n        X_val_copy[\"CryoSleep\"] = X_val_copy[\"CryoSleep\"].fillna(\"Unknown\").astype(str)\n        X_val_copy[\"VIP\"] = X_val_copy[\"VIP\"].fillna(\"Unknown\").astype(str)\n        \n        return pipe.predict(X_val_copy[feature_cols]).astype(bool)\n    \n    return predict\n\n\nif __name__ == \"__main__\":\n    predict_fn = build_predict_fn()\n    score = prepare.evaluate(predict_fn)\n    print(f\"VAL_ACCURACY: {score:.4f}\")\n", "notes_append": "Iteration 26: Restored best-performing feature set (cabin parsing + GroupId + RoomNum + missingness flags), removed unvalidated HighSpender. Returning to known-good state before exploring further feature/model changes.", "stdout": "VAL_ACCURACY: 0.8143\n", "stderr": "", "returncode": 0, "score": 0.8143, "kept": true, "status": "kept", "commit_hash": "9599f65", "input_tokens": 4034, "output_tokens": 2334, "cost_usd": 0.015704}
