{"iteration": 5, "timestamp": "2026-05-08T21:14:06", "previous_best": 0.8143, "duration_seconds": 4.16, "agent_response_raw": "<reflection>\nThe current best score is 0.8143, achieved with XGBoost (max_depth=6, n_estimators=100, learning_rate=0.1) combined with cabin parsing, GroupId extraction, spending-as-zero imputation, and explicit missingness flags. Recent hyperparameter tweaks (increasing depth, n_estimators, adjusting learning_rate) regressed the score, suggesting the current feature set has reached a local plateau and structural changes (new features or different engineering) are needed to break through.\n</reflection>\n\n<observations>\n- The model has been stable at 0.8143 for multiple iterations, suggesting the feature engineering (cabin parsing, GroupId, missingness flags) is solid but may be leaving signal on the table.\n- Previous attempts to add aggregate spending features (TotalSpending, HasSpent) and GroupSize were reverted or didn't improve the score, indicating those particular feature ideas don't help and may introduce noise.\n- The spending columns are filled with 0 for missing values (interpreted as \"no spending\"), which is a strong domain assumption. This assumption may be worth revisiting or complementing with other spending-based features.\n- The Cabin column is parsed into three separate features (Deck, RoomNum, Side), but RoomNum may be sparse/noisy and Side is categorical with limited values. Deck alone might be sufficient, or we could explore whether cabin location encodes passenger tier information.\n- No interaction features or non-linear transformations of the spending columns have been tried yet; the model relies entirely on XGBoost to learn interactions implicitly.\n</observations>\n\n<hypothesis>\nCreating a binary feature indicating whether a passenger spent any money across all spending categories (not just zero/nonzero but capturing high-spenders vs. low-spenders) will help the model better segment passengers, because spending behavior appears correlated with transport likelihood in a non-linear way that the current zero-filling + median imputation may not fully capture.\n</hypothesis>\n\n<plan>\nI will add a quantile-based binning feature for total spending: create a \"HighSpender\" flag that is 1 if the sum of spending columns (after filling NaN with 0) is in the top quartile, 0 otherwise. This is different from the simple TotalSpending and HasSpent features that were tried before; it captures a tier/segment signal that may help XGBoost learn conditional transport probabilities by spending level. The feature is simple, interpretable, and tests whether spending segmentation improves the model without adding the noise that previous aggregate features did.\n</plan>\n\n<code>\n```python\n\"\"\"\ntrain.py — XGBoost with cabin parsing, GroupId, missingness flags, and HighSpender tier.\nIteration 22: Add HighSpender (top quartile of total spending) to test spending-level segmentation.\n\"\"\"\nimport sys, pathlib\nsys.path.insert(0, str(pathlib.Path(__file__).resolve().parent.parent))\n\nimport pandas as pd\nimport numpy as np\nimport xgboost as xgb\nfrom sklearn.impute import SimpleImputer\nfrom sklearn.pipeline import Pipeline\nfrom sklearn.preprocessing import StandardScaler, OneHotEncoder\nfrom sklearn.compose import ColumnTransformer\n\nimport prepare\n\nNUMERIC = [\"Age\", \"RoomService\", \"FoodCourt\", \"ShoppingMall\", \"Spa\", \"VRDeck\"]\nCATEGORICAL = [\"HomePlanet\", \"Destination\", \"CryoSleep\", \"VIP\"]\nSPENDING = [\"RoomService\", \"FoodCourt\", \"ShoppingMall\", \"Spa\", \"VRDeck\"]\n\n\ndef parse_cabin(cabin_str):\n    \"\"\"Parse Cabin 'F/0/S' into deck, room_num, side.\"\"\"\n    if pd.isna(cabin_str):\n        return np.nan, np.nan, np.nan\n    parts = str(cabin_str).split(\"/\")\n    if len(parts) == 3:\n        return parts[0], int(parts[1]) if parts[1].isdigit() else np.nan, parts[2]\n    return np.nan, np.nan, np.nan\n\n\ndef extract_group_id(passenger_id):\n    \"\"\"Extract group ID from PassengerId (e.g., '0001_01' -> '0001').\"\"\"\n    if pd.isna(passenger_id):\n        return np.nan\n    return str(passenger_id).split(\"_\")[0]\n\n\ndef build_predict_fn():\n    train_df, _ = prepare.load_split()\n    \n    # Parse Cabin into Deck, RoomNum, Side\n    cabin_data = train_df[\"Cabin\"].apply(parse_cabin)\n    train_df[\"Deck\"] = cabin_data.apply(lambda x: x[0])\n    train_df[\"RoomNum\"] = cabin_data.apply(lambda x: x[1])\n    train_df[\"Side\"] = cabin_data.apply(lambda x: x[2])\n    \n    # Extract group ID from PassengerId\n    train_df[\"GroupId\"] = train_df[\"PassengerId\"].apply(extract_group_id)\n    \n    # Fill missing values in spending columns with 0 (indicates not spent)\n    for col in SPENDING:\n        train_df[col] = train_df[col].fillna(0)\n    \n    # Create HighSpender feature: 1 if total spending is in top quartile\n    total_spending = train_df[SPENDING].sum(axis=1)\n    spending_q3 = total_spending.quantile(0.75)\n    train_df[\"HighSpender\"] = (total_spending >= spending_q3).astype(int)\n    \n    # Create explicit missingness flags for CryoSleep and VIP before filling\n    train_df[\"CryoSleep_Missing\"] = train_df[\"CryoSleep\"].isna().astype(int)\n    train_df[\"VIP_Missing\"] = train_df[\"VIP\"].isna().astype(int)\n    \n    # Convert CryoSleep and VIP to string for categorical encoding\n    train_df[\"CryoSleep\"] = train_df[\"CryoSleep\"].fillna(\"Unknown\").astype(str)\n    train_df[\"VIP\"] = train_df[\"VIP\"].fillna(\"Unknown\").astype(str)\n    \n    # Build feature set: core features + cabin parsing + missingness flags + HighSpender\n    feature_cols = (\n        [\"Age\"] + SPENDING + CATEGORICAL + \n        [\"Deck\", \"RoomNum\", \"Side\", \"GroupId\"] + \n        [\"CryoSleep_Missing\", \"VIP_Missing\", \"HighSpender\"]\n    )\n    X = train_df[feature_cols]\n    y = train_df[\"Transported\"].astype(int)\n    \n    # Define preprocessing for numeric and categorical columns\n    numeric_transformer = Pipeline([\n        (\"imputer\", SimpleImputer(strategy=\"median\")),\n        (\"scaler\", StandardScaler()),\n    ])\n    \n    categorical_transformer = Pipeline([\n        (\"imputer\", SimpleImputer(strategy=\"most_frequent\")),\n        (\"onehot\", OneHotEncoder(handle_unknown=\"ignore\", sparse_output=False)),\n    ])\n    \n    preprocessor = ColumnTransformer([\n        (\"num\", numeric_transformer, [\"Age\", \"RoomNum\", \"CryoSleep_Missing\", \"VIP_Missing\", \"HighSpender\"] + SPENDING),\n        (\"cat\", categorical_transformer, CATEGORICAL + [\"Deck\", \"Side\", \"GroupId\"]),\n    ])\n    \n    pipe = Pipeline([\n        (\"preprocessor\", preprocessor),\n        (\"clf\", xgb.XGBClassifier(n_estimators=100, max_depth=6, learning_rate=0.1, random_state=42, verbosity=0)),\n    ])\n    \n    pipe.fit(X, y)\n    \n    def predict(X_val):\n        # Parse Cabin in validation set\n        cabin_data = X_val[\"Cabin\"].apply(parse_cabin)\n        X_val_copy = X_val.copy()\n        X_val_copy[\"Deck\"] = cabin_data.apply(lambda x: x[0])\n        X_val_copy[\"RoomNum\"] = cabin_data.apply(lambda x: x[1])\n        X_val_copy[\"Side\"] = cabin_data.apply(lambda x: x[2])\n        \n        # Extract group ID\n        X_val_copy[\"GroupId\"] = X_val_copy[\"PassengerId\"].apply(extract_group_id)\n        \n        # Fill missing spending with 0\n        for col in SPENDING:\n            X_val_copy[col] = X_val_copy[col].fillna(0)\n        \n        # Create HighSpender feature using same threshold as training\n        total_spending = X_val_copy[SPENDING].sum(axis=1)\n        X_val_copy[\"HighSpender\"] = (total_spending >= spending_q3).astype(int)\n        \n        # Create explicit missingness flags for CryoSleep and VIP before filling\n        X_val_copy[\"CryoSleep_Missing\"] = X_val_copy[\"CryoSleep\"].isna().astype(int)\n        X_val_copy[\"VIP_Missing\"] = X_val_copy[\"VIP\"].isna().astype(int)\n        \n        # Handle CryoSleep and VIP\n        X_val_copy[\"CryoSleep\"] = X_val_copy[\"CryoSleep\"].fillna(\"Unknown\").astype(str)\n        X_val_copy[\"VIP\"] = X_val_copy[\"VIP\"].fillna(\"Unknown\").astype(str)\n        \n        return pipe.predict(X_val_copy[feature_cols]).astype(bool)\n    \n    return predict\n\n\nif __name__ == \"__main__\":\n    predict_fn = build_predict_fn()\n    score = prepare.evaluate(predict_fn)\n    print(f\"VAL_ACCURACY: {score:.4f}\")\n```\n</code>\n\n<notes_append>\nIteration 22: Added HighSpender (binary indicator: 1 if total spending >= 75th percentile) to segment passengers by spending tier. This is a simpler, threshold-based approach to spending segmentation compared to TotalSpending/HasSpent (iter 15) that may capture non-linear spending-transport relationship without noise.\n</notes_append>", "reflection": "The current best score is 0.8143, achieved with XGBoost (max_depth=6, n_estimators=100, learning_rate=0.1) combined with cabin parsing, GroupId extraction, spending-as-zero imputation, and explicit missingness flags. Recent hyperparameter tweaks (increasing depth, n_estimators, adjusting learning_rate) regressed the score, suggesting the current feature set has reached a local plateau and structural changes (new features or different engineering) are needed to break through.", "observations": ["The model has been stable at 0.8143 for multiple iterations, suggesting the feature engineering (cabin parsing, GroupId, missingness flags) is solid but may be leaving signal on the table.", "Previous attempts to add aggregate spending features (TotalSpending, HasSpent) and GroupSize were reverted or didn't improve the score, indicating those particular feature ideas don't help and may introduce noise.", "The spending columns are filled with 0 for missing values (interpreted as \"no spending\"), which is a strong domain assumption. This assumption may be worth revisiting or complementing with other spending-based features.", "The Cabin column is parsed into three separate features (Deck, RoomNum, Side), but RoomNum may be sparse/noisy and Side is categorical with limited values. Deck alone might be sufficient, or we could explore whether cabin location encodes passenger tier information.", "No interaction features or non-linear transformations of the spending columns have been tried yet; the model relies entirely on XGBoost to learn interactions implicitly."], "hypothesis": "Creating a binary feature indicating whether a passenger spent any money across all spending categories (not just zero/nonzero but capturing high-spenders vs. low-spenders) will help the model better segment passengers, because spending behavior appears correlated with transport likelihood in a non-linear way that the current zero-filling + median imputation may not fully capture.", "plan": "I will add a quantile-based binning feature for total spending: create a \"HighSpender\" flag that is 1 if the sum of spending columns (after filling NaN with 0) is in the top quartile, 0 otherwise. This is different from the simple TotalSpending and HasSpent features that were tried before; it captures a tier/segment signal that may help XGBoost learn conditional transport probabilities by spending level. The feature is simple, interpretable, and tests whether spending segmentation improves the model without adding the noise that previous aggregate features did.", "code": "\"\"\"\ntrain.py — XGBoost with cabin parsing, GroupId, missingness flags, and HighSpender tier.\nIteration 22: Add HighSpender (top quartile of total spending) to test spending-level segmentation.\n\"\"\"\nimport sys, pathlib\nsys.path.insert(0, str(pathlib.Path(__file__).resolve().parent.parent))\n\nimport pandas as pd\nimport numpy as np\nimport xgboost as xgb\nfrom sklearn.impute import SimpleImputer\nfrom sklearn.pipeline import Pipeline\nfrom sklearn.preprocessing import StandardScaler, OneHotEncoder\nfrom sklearn.compose import ColumnTransformer\n\nimport prepare\n\nNUMERIC = [\"Age\", \"RoomService\", \"FoodCourt\", \"ShoppingMall\", \"Spa\", \"VRDeck\"]\nCATEGORICAL = [\"HomePlanet\", \"Destination\", \"CryoSleep\", \"VIP\"]\nSPENDING = [\"RoomService\", \"FoodCourt\", \"ShoppingMall\", \"Spa\", \"VRDeck\"]\n\n\ndef parse_cabin(cabin_str):\n    \"\"\"Parse Cabin 'F/0/S' into deck, room_num, side.\"\"\"\n    if pd.isna(cabin_str):\n        return np.nan, np.nan, np.nan\n    parts = str(cabin_str).split(\"/\")\n    if len(parts) == 3:\n        return parts[0], int(parts[1]) if parts[1].isdigit() else np.nan, parts[2]\n    return np.nan, np.nan, np.nan\n\n\ndef extract_group_id(passenger_id):\n    \"\"\"Extract group ID from PassengerId (e.g., '0001_01' -> '0001').\"\"\"\n    if pd.isna(passenger_id):\n        return np.nan\n    return str(passenger_id).split(\"_\")[0]\n\n\ndef build_predict_fn():\n    train_df, _ = prepare.load_split()\n    \n    # Parse Cabin into Deck, RoomNum, Side\n    cabin_data = train_df[\"Cabin\"].apply(parse_cabin)\n    train_df[\"Deck\"] = cabin_data.apply(lambda x: x[0])\n    train_df[\"RoomNum\"] = cabin_data.apply(lambda x: x[1])\n    train_df[\"Side\"] = cabin_data.apply(lambda x: x[2])\n    \n    # Extract group ID from PassengerId\n    train_df[\"GroupId\"] = train_df[\"PassengerId\"].apply(extract_group_id)\n    \n    # Fill missing values in spending columns with 0 (indicates not spent)\n    for col in SPENDING:\n        train_df[col] = train_df[col].fillna(0)\n    \n    # Create HighSpender feature: 1 if total spending is in top quartile\n    total_spending = train_df[SPENDING].sum(axis=1)\n    spending_q3 = total_spending.quantile(0.75)\n    train_df[\"HighSpender\"] = (total_spending >= spending_q3).astype(int)\n    \n    # Create explicit missingness flags for CryoSleep and VIP before filling\n    train_df[\"CryoSleep_Missing\"] = train_df[\"CryoSleep\"].isna().astype(int)\n    train_df[\"VIP_Missing\"] = train_df[\"VIP\"].isna().astype(int)\n    \n    # Convert CryoSleep and VIP to string for categorical encoding\n    train_df[\"CryoSleep\"] = train_df[\"CryoSleep\"].fillna(\"Unknown\").astype(str)\n    train_df[\"VIP\"] = train_df[\"VIP\"].fillna(\"Unknown\").astype(str)\n    \n    # Build feature set: core features + cabin parsing + missingness flags + HighSpender\n    feature_cols = (\n        [\"Age\"] + SPENDING + CATEGORICAL + \n        [\"Deck\", \"RoomNum\", \"Side\", \"GroupId\"] + \n        [\"CryoSleep_Missing\", \"VIP_Missing\", \"HighSpender\"]\n    )\n    X = train_df[feature_cols]\n    y = train_df[\"Transported\"].astype(int)\n    \n    # Define preprocessing for numeric and categorical columns\n    numeric_transformer = Pipeline([\n        (\"imputer\", SimpleImputer(strategy=\"median\")),\n        (\"scaler\", StandardScaler()),\n    ])\n    \n    categorical_transformer = Pipeline([\n        (\"imputer\", SimpleImputer(strategy=\"most_frequent\")),\n        (\"onehot\", OneHotEncoder(handle_unknown=\"ignore\", sparse_output=False)),\n    ])\n    \n    preprocessor = ColumnTransformer([\n        (\"num\", numeric_transformer, [\"Age\", \"RoomNum\", \"CryoSleep_Missing\", \"VIP_Missing\", \"HighSpender\"] + SPENDING),\n        (\"cat\", categorical_transformer, CATEGORICAL + [\"Deck\", \"Side\", \"GroupId\"]),\n    ])\n    \n    pipe = Pipeline([\n        (\"preprocessor\", preprocessor),\n        (\"clf\", xgb.XGBClassifier(n_estimators=100, max_depth=6, learning_rate=0.1, random_state=42, verbosity=0)),\n    ])\n    \n    pipe.fit(X, y)\n    \n    def predict(X_val):\n        # Parse Cabin in validation set\n        cabin_data = X_val[\"Cabin\"].apply(parse_cabin)\n        X_val_copy = X_val.copy()\n        X_val_copy[\"Deck\"] = cabin_data.apply(lambda x: x[0])\n        X_val_copy[\"RoomNum\"] = cabin_data.apply(lambda x: x[1])\n        X_val_copy[\"Side\"] = cabin_data.apply(lambda x: x[2])\n        \n        # Extract group ID\n        X_val_copy[\"GroupId\"] = X_val_copy[\"PassengerId\"].apply(extract_group_id)\n        \n        # Fill missing spending with 0\n        for col in SPENDING:\n            X_val_copy[col] = X_val_copy[col].fillna(0)\n        \n        # Create HighSpender feature using same threshold as training\n        total_spending = X_val_copy[SPENDING].sum(axis=1)\n        X_val_copy[\"HighSpender\"] = (total_spending >= spending_q3).astype(int)\n        \n        # Create explicit missingness flags for CryoSleep and VIP before filling\n        X_val_copy[\"CryoSleep_Missing\"] = X_val_copy[\"CryoSleep\"].isna().astype(int)\n        X_val_copy[\"VIP_Missing\"] = X_val_copy[\"VIP\"].isna().astype(int)\n        \n        # Handle CryoSleep and VIP\n        X_val_copy[\"CryoSleep\"] = X_val_copy[\"CryoSleep\"].fillna(\"Unknown\").astype(str)\n        X_val_copy[\"VIP\"] = X_val_copy[\"VIP\"].fillna(\"Unknown\").astype(str)\n        \n        return pipe.predict(X_val_copy[feature_cols]).astype(bool)\n    \n    return predict\n\n\nif __name__ == \"__main__\":\n    predict_fn = build_predict_fn()\n    score = prepare.evaluate(predict_fn)\n    print(f\"VAL_ACCURACY: {score:.4f}\")\n", "notes_append": "Iteration 22: Added HighSpender (binary indicator: 1 if total spending >= 75th percentile) to segment passengers by spending tier. This is a simpler, threshold-based approach to spending segmentation compared to TotalSpending/HasSpent (iter 15) that may capture non-linear spending-transport relationship without noise.", "stdout": "VAL_ACCURACY: 0.8143\n", "stderr": "", "returncode": 0, "score": 0.8143, "kept": true, "status": "kept", "commit_hash": "413e133", "input_tokens": 4009, "output_tokens": 2499, "cost_usd": 0.016503999999999998}
