{"iteration": 4, "timestamp": "2026-05-08T21:19:26", "previous_best": 0.8189, "duration_seconds": 4.13, "agent_response_raw": "<reflection>\nThe last iteration (iter 32) achieved 0.8189, which is our current best — beating the baseline of 0.78. The CryoSleep_NoSpending interaction feature appears to have helped. However, we're still working with features that have known issues (GroupId has high cardinality and caused problems in iter 28). Before exploring more interactions or hyperparameter tweaking, I should examine what's actually predictive in the data more systematically — e.g., correlation with target, feature importance from the trained model, and whether simpler models might give us signal about which features truly matter.\n</reflection>\n\n<observations>\n- The current best score (0.8189) is modest improvement over the 0.8143 baseline from iter 26, and came from adding one interaction feature (CryoSleep_NoSpending). This suggests low-hanging fruit may still exist in feature engineering rather than hyperparameter tuning.\n- Notes reveal a pattern: high-cardinality features (GroupId treated categorically, spending ratios) have been added and removed multiple times without clear net gain. This suggests either the cardinality is hurting generalization, or the signal isn't there.\n- The model currently includes many features (Age, 5 spending columns, TotalSpending, CryoSleep_NoSpending, 4 categorical, Deck, RoomNum, Side, GroupId, 2 missingness flags, plus one-hot encoding explosion). It's plausible that a simpler model would generalize better.\n- We haven't yet printed feature importance or examined which features the XGBoost model actually relies on. This would clarify whether expensive feature engineering (e.g., cabin parsing) is earning its keep.\n- The dataset is small (8,700 rows). With heavy preprocessing and one-hot encoding, we may be at risk of overfitting. A diagnostic step: train a simple model (logistic regression or shallow tree) on the raw features to see what the ceiling is before engineering.\n</observations>\n\n<hypothesis>\nPrinting the feature importance of the current XGBoost model and examining correlation of individual features with the target will reveal which engineered features (cabin parsing, GroupId, spending interactions) are actually driving predictions. This will guide whether to simplify the feature set or engineer more intelligently.\n</hypothesis>\n\n<plan>\nI will add code to print feature importance from the trained XGBoost model, and also compute correlation of key engineered features with the target. This diagnostic step will cost no time (under 60s) and will give concrete guidance for the next iteration — either confirming that cabin parsing and interactions help, or revealing that we're over-engineering and should backtrack to simpler features.\n</plan>\n\n<code>\n```python\n\"\"\"\ntrain.py — XGBoost with cabin parsing, GroupId, and cryo-sleep/spending interaction.\nIteration 33: Add feature importance diagnostics to understand which engineered features\ndrive predictions. This will guide whether to simplify or continue engineering.\n\"\"\"\nimport sys, pathlib\nsys.path.insert(0, str(pathlib.Path(__file__).resolve().parent.parent))\n\nimport pandas as pd\nimport numpy as np\nimport xgboost as xgb\nfrom sklearn.impute import SimpleImputer\nfrom sklearn.pipeline import Pipeline\nfrom sklearn.preprocessing import StandardScaler, OneHotEncoder\nfrom sklearn.compose import ColumnTransformer\n\nimport prepare\n\nNUMERIC = [\"Age\", \"RoomService\", \"FoodCourt\", \"ShoppingMall\", \"Spa\", \"VRDeck\"]\nCATEGORICAL = [\"HomePlanet\", \"Destination\", \"CryoSleep\", \"VIP\"]\nSPENDING = [\"RoomService\", \"FoodCourt\", \"ShoppingMall\", \"Spa\", \"VRDeck\"]\n\n\ndef parse_cabin(cabin_str):\n    \"\"\"Parse Cabin 'F/0/S' into deck, room_num, side.\"\"\"\n    if pd.isna(cabin_str):\n        return np.nan, np.nan, np.nan\n    parts = str(cabin_str).split(\"/\")\n    if len(parts) == 3:\n        return parts[0], int(parts[1]) if parts[1].isdigit() else np.nan, parts[2]\n    return np.nan, np.nan, np.nan\n\n\ndef extract_group_id(passenger_id):\n    \"\"\"Extract group ID from PassengerId (e.g., '0001_01' -> '0001').\"\"\"\n    if pd.isna(passenger_id):\n        return np.nan\n    return str(passenger_id).split(\"_\")[0]\n\n\ndef engineer_features(df):\n    \"\"\"Engineer interaction and spending features.\"\"\"\n    df_copy = df.copy()\n    \n    # Fill missing spending with 0\n    for col in SPENDING:\n        df_copy[col] = df_copy[col].fillna(0)\n    \n    # Total spending\n    df_copy[\"TotalSpending\"] = df_copy[SPENDING].sum(axis=1)\n    \n    # Interaction: CryoSleep and zero spending\n    # If CryoSleep is missing, treat as False for this interaction\n    cryo_status = df_copy[\"CryoSleep\"].fillna(False)\n    df_copy[\"CryoSleep_NoSpending\"] = (\n        (cryo_status == True) & (df_copy[\"TotalSpending\"] == 0)\n    ).astype(int)\n    \n    return df_copy\n\n\ndef build_predict_fn():\n    train_df, _ = prepare.load_split()\n    \n    # Parse Cabin into Deck, RoomNum, Side\n    cabin_data = train_df[\"Cabin\"].apply(parse_cabin)\n    train_df[\"Deck\"] = cabin_data.apply(lambda x: x[0])\n    train_df[\"RoomNum\"] = cabin_data.apply(lambda x: x[1])\n    train_df[\"Side\"] = cabin_data.apply(lambda x: x[2])\n    \n    # Extract group ID from PassengerId\n    train_df[\"GroupId\"] = train_df[\"PassengerId\"].apply(extract_group_id)\n    \n    # Engineer features\n    train_df = engineer_features(train_df)\n    \n    # Create explicit missingness flags for CryoSleep and VIP before filling\n    train_df[\"CryoSleep_Missing\"] = train_df[\"CryoSleep\"].isna().astype(int)\n    train_df[\"VIP_Missing\"] = train_df[\"VIP\"].isna().astype(int)\n    \n    # Convert CryoSleep and VIP to string for categorical encoding\n    train_df[\"CryoSleep\"] = train_df[\"CryoSleep\"].fillna(\"Unknown\").astype(str)\n    train_df[\"VIP\"] = train_df[\"VIP\"].fillna(\"Unknown\").astype(str)\n    \n    # Build feature set\n    feature_cols = (\n        [\"Age\"] + SPENDING + [\"TotalSpending\", \"CryoSleep_NoSpending\"] +\n        CATEGORICAL + \n        [\"Deck\", \"RoomNum\", \"Side\", \"GroupId\"] + \n        [\"CryoSleep_Missing\", \"VIP_Missing\"]\n    )\n    X = train_df[feature_cols]\n    y = train_df[\"Transported\"].astype(int)\n    \n    # Define preprocessing for numeric and categorical columns\n    numeric_transformer = Pipeline([\n        (\"imputer\", SimpleImputer(strategy=\"median\")),\n        (\"scaler\", StandardScaler()),\n    ])\n    \n    categorical_transformer = Pipeline([\n        (\"imputer\", SimpleImputer(strategy=\"most_frequent\")),\n        (\"onehot\", OneHotEncoder(handle_unknown=\"ignore\", sparse_output=False)),\n    ])\n    \n    numeric_feature_cols = (\n        [\"Age\", \"RoomNum\", \"CryoSleep_Missing\", \"VIP_Missing\"] + \n        SPENDING + [\"TotalSpending\", \"CryoSleep_NoSpending\"]\n    )\n    categorical_feature_cols = CATEGORICAL + [\"Deck\", \"Side\", \"GroupId\"]\n    \n    preprocessor = ColumnTransformer([\n        (\"num\", numeric_transformer, numeric_feature_cols),\n        (\"cat\", categorical_transformer, categorical_feature_cols),\n    ])\n    \n    pipe = Pipeline([\n        (\"preprocessor\", preprocessor),\n        (\"clf\", xgb.XGBClassifier(n_estimators=100, max_depth=6, learning_rate=0.1, random_state=42, verbosity=0)),\n    ])\n    \n    pipe.fit(X, y)\n    \n    # Print feature importance diagnostics\n    xgb_model = pipe.named_steps[\"clf\"]\n    feature_names = (\n        numeric_feature_cols + \n        list(pipe.named_steps[\"preprocessor\"].named_transformers_[\"cat\"].named_steps[\"onehot\"].get_feature_names_out(categorical_feature_cols))\n    )\n    importances = xgb_model.feature_importances_\n    importance_df = pd.DataFrame({\n        \"feature\": feature_names,\n        \"importance\": importances\n    }).sort_values(\"importance\", ascending=False)\n    \n    print(\"=== Top 15 Feature Importances ===\", file=sys.stderr)\n    print(importance_df.head(15).to_string(index=False), file=sys.stderr)\n    \n    # Print correlations of key engineered features with target\n    print(\"\\n=== Correlation of Key Features with Target ===\", file=sys.stderr)\n    corr_df = train_df[[\"Age\", \"TotalSpending\", \"CryoSleep_NoSpending\", \"CryoSleep_Missing\", \"VIP_Missing\", \"RoomNum\", \"Transported\"]].corr()[\"Transported\"].sort_values(ascending=False)\n    print(corr_df.to_string(), file=sys.stderr)\n    \n    def predict(X_val):\n        # Parse Cabin in validation set\n        cabin_data = X_val[\"Cabin\"].apply(parse_cabin)\n        X_val_copy = X_val.copy()\n        X_val_copy[\"Deck\"] = cabin_data.apply(lambda x: x[0])\n        X_val_copy[\"RoomNum\"] = cabin_data.apply(lambda x: x[1])\n        X_val_copy[\"Side\"] = cabin_data.apply(lambda x: x[2])\n        \n        # Extract group ID\n        X_val_copy[\"GroupId\"] = X_val_copy[\"PassengerId\"].apply(extract_group_id)\n        \n        # Engineer features\n        X_val_copy = engineer_features(X_val_copy)\n        \n        # Create explicit missingness flags for CryoSleep and VIP before filling\n        X_val_copy[\"CryoSleep_Missing\"] = X_val_copy[\"CryoSleep\"].isna().astype(int)\n        X_val_copy[\"VIP_Missing\"] = X_val_copy[\"VIP\"].isna().astype(int)\n        \n        # Handle CryoSleep and VIP\n        X_val_copy[\"CryoSleep\"] = X_val_copy[\"CryoSleep\"].fillna(\"Unknown\").astype(str)\n        X_val_copy[\"VIP\"] = X_val_copy[\"VIP\"].fillna(\"Unknown\").astype(str)\n        \n        return pipe.predict(X_val_copy[feature_cols]).astype(bool)\n    \n    return predict\n\n\nif __name__ == \"__main__\":\n    predict_fn = build_predict_fn()\n    score = prepare.evaluate(predict_fn)\n    print(f\"VAL_ACCURACY: {score:.4f}\")\n```\n</code>\n\n<notes_append>\nIteration 33: Added feature importance diagnostics (XGBoost importance + correlation analysis) to understand which engineered features actually drive predictions and guide next feature engineering or simplification decision.\n</notes_append>", "reflection": "The last iteration (iter 32) achieved 0.8189, which is our current best — beating the baseline of 0.78. The CryoSleep_NoSpending interaction feature appears to have helped. However, we're still working with features that have known issues (GroupId has high cardinality and caused problems in iter 28). Before exploring more interactions or hyperparameter tweaking, I should examine what's actually predictive in the data more systematically — e.g., correlation with target, feature importance from the trained model, and whether simpler models might give us signal about which features truly matter.", "observations": ["The current best score (0.8189) is modest improvement over the 0.8143 baseline from iter 26, and came from adding one interaction feature (CryoSleep_NoSpending). This suggests low-hanging fruit may still exist in feature engineering rather than hyperparameter tuning.", "Notes reveal a pattern: high-cardinality features (GroupId treated categorically, spending ratios) have been added and removed multiple times without clear net gain. This suggests either the cardinality is hurting generalization, or the signal isn't there.", "The model currently includes many features (Age, 5 spending columns, TotalSpending, CryoSleep_NoSpending, 4 categorical, Deck, RoomNum, Side, GroupId, 2 missingness flags, plus one-hot encoding explosion). It's plausible that a simpler model would generalize better.", "We haven't yet printed feature importance or examined which features the XGBoost model actually relies on. This would clarify whether expensive feature engineering (e.g., cabin parsing) is earning its keep.", "The dataset is small (8,700 rows). With heavy preprocessing and one-hot encoding, we may be at risk of overfitting. A diagnostic step: train a simple model (logistic regression or shallow tree) on the raw features to see what the ceiling is before engineering."], "hypothesis": "Printing the feature importance of the current XGBoost model and examining correlation of individual features with the target will reveal which engineered features (cabin parsing, GroupId, spending interactions) are actually driving predictions. This will guide whether to simplify the feature set or engineer more intelligently.", "plan": "I will add code to print feature importance from the trained XGBoost model, and also compute correlation of key engineered features with the target. This diagnostic step will cost no time (under 60s) and will give concrete guidance for the next iteration — either confirming that cabin parsing and interactions help, or revealing that we're over-engineering and should backtrack to simpler features.", "code": "\"\"\"\ntrain.py — XGBoost with cabin parsing, GroupId, and cryo-sleep/spending interaction.\nIteration 33: Add feature importance diagnostics to understand which engineered features\ndrive predictions. This will guide whether to simplify or continue engineering.\n\"\"\"\nimport sys, pathlib\nsys.path.insert(0, str(pathlib.Path(__file__).resolve().parent.parent))\n\nimport pandas as pd\nimport numpy as np\nimport xgboost as xgb\nfrom sklearn.impute import SimpleImputer\nfrom sklearn.pipeline import Pipeline\nfrom sklearn.preprocessing import StandardScaler, OneHotEncoder\nfrom sklearn.compose import ColumnTransformer\n\nimport prepare\n\nNUMERIC = [\"Age\", \"RoomService\", \"FoodCourt\", \"ShoppingMall\", \"Spa\", \"VRDeck\"]\nCATEGORICAL = [\"HomePlanet\", \"Destination\", \"CryoSleep\", \"VIP\"]\nSPENDING = [\"RoomService\", \"FoodCourt\", \"ShoppingMall\", \"Spa\", \"VRDeck\"]\n\n\ndef parse_cabin(cabin_str):\n    \"\"\"Parse Cabin 'F/0/S' into deck, room_num, side.\"\"\"\n    if pd.isna(cabin_str):\n        return np.nan, np.nan, np.nan\n    parts = str(cabin_str).split(\"/\")\n    if len(parts) == 3:\n        return parts[0], int(parts[1]) if parts[1].isdigit() else np.nan, parts[2]\n    return np.nan, np.nan, np.nan\n\n\ndef extract_group_id(passenger_id):\n    \"\"\"Extract group ID from PassengerId (e.g., '0001_01' -> '0001').\"\"\"\n    if pd.isna(passenger_id):\n        return np.nan\n    return str(passenger_id).split(\"_\")[0]\n\n\ndef engineer_features(df):\n    \"\"\"Engineer interaction and spending features.\"\"\"\n    df_copy = df.copy()\n    \n    # Fill missing spending with 0\n    for col in SPENDING:\n        df_copy[col] = df_copy[col].fillna(0)\n    \n    # Total spending\n    df_copy[\"TotalSpending\"] = df_copy[SPENDING].sum(axis=1)\n    \n    # Interaction: CryoSleep and zero spending\n    # If CryoSleep is missing, treat as False for this interaction\n    cryo_status = df_copy[\"CryoSleep\"].fillna(False)\n    df_copy[\"CryoSleep_NoSpending\"] = (\n        (cryo_status == True) & (df_copy[\"TotalSpending\"] == 0)\n    ).astype(int)\n    \n    return df_copy\n\n\ndef build_predict_fn():\n    train_df, _ = prepare.load_split()\n    \n    # Parse Cabin into Deck, RoomNum, Side\n    cabin_data = train_df[\"Cabin\"].apply(parse_cabin)\n    train_df[\"Deck\"] = cabin_data.apply(lambda x: x[0])\n    train_df[\"RoomNum\"] = cabin_data.apply(lambda x: x[1])\n    train_df[\"Side\"] = cabin_data.apply(lambda x: x[2])\n    \n    # Extract group ID from PassengerId\n    train_df[\"GroupId\"] = train_df[\"PassengerId\"].apply(extract_group_id)\n    \n    # Engineer features\n    train_df = engineer_features(train_df)\n    \n    # Create explicit missingness flags for CryoSleep and VIP before filling\n    train_df[\"CryoSleep_Missing\"] = train_df[\"CryoSleep\"].isna().astype(int)\n    train_df[\"VIP_Missing\"] = train_df[\"VIP\"].isna().astype(int)\n    \n    # Convert CryoSleep and VIP to string for categorical encoding\n    train_df[\"CryoSleep\"] = train_df[\"CryoSleep\"].fillna(\"Unknown\").astype(str)\n    train_df[\"VIP\"] = train_df[\"VIP\"].fillna(\"Unknown\").astype(str)\n    \n    # Build feature set\n    feature_cols = (\n        [\"Age\"] + SPENDING + [\"TotalSpending\", \"CryoSleep_NoSpending\"] +\n        CATEGORICAL + \n        [\"Deck\", \"RoomNum\", \"Side\", \"GroupId\"] + \n        [\"CryoSleep_Missing\", \"VIP_Missing\"]\n    )\n    X = train_df[feature_cols]\n    y = train_df[\"Transported\"].astype(int)\n    \n    # Define preprocessing for numeric and categorical columns\n    numeric_transformer = Pipeline([\n        (\"imputer\", SimpleImputer(strategy=\"median\")),\n        (\"scaler\", StandardScaler()),\n    ])\n    \n    categorical_transformer = Pipeline([\n        (\"imputer\", SimpleImputer(strategy=\"most_frequent\")),\n        (\"onehot\", OneHotEncoder(handle_unknown=\"ignore\", sparse_output=False)),\n    ])\n    \n    numeric_feature_cols = (\n        [\"Age\", \"RoomNum\", \"CryoSleep_Missing\", \"VIP_Missing\"] + \n        SPENDING + [\"TotalSpending\", \"CryoSleep_NoSpending\"]\n    )\n    categorical_feature_cols = CATEGORICAL + [\"Deck\", \"Side\", \"GroupId\"]\n    \n    preprocessor = ColumnTransformer([\n        (\"num\", numeric_transformer, numeric_feature_cols),\n        (\"cat\", categorical_transformer, categorical_feature_cols),\n    ])\n    \n    pipe = Pipeline([\n        (\"preprocessor\", preprocessor),\n        (\"clf\", xgb.XGBClassifier(n_estimators=100, max_depth=6, learning_rate=0.1, random_state=42, verbosity=0)),\n    ])\n    \n    pipe.fit(X, y)\n    \n    # Print feature importance diagnostics\n    xgb_model = pipe.named_steps[\"clf\"]\n    feature_names = (\n        numeric_feature_cols + \n        list(pipe.named_steps[\"preprocessor\"].named_transformers_[\"cat\"].named_steps[\"onehot\"].get_feature_names_out(categorical_feature_cols))\n    )\n    importances = xgb_model.feature_importances_\n    importance_df = pd.DataFrame({\n        \"feature\": feature_names,\n        \"importance\": importances\n    }).sort_values(\"importance\", ascending=False)\n    \n    print(\"=== Top 15 Feature Importances ===\", file=sys.stderr)\n    print(importance_df.head(15).to_string(index=False), file=sys.stderr)\n    \n    # Print correlations of key engineered features with target\n    print(\"\\n=== Correlation of Key Features with Target ===\", file=sys.stderr)\n    corr_df = train_df[[\"Age\", \"TotalSpending\", \"CryoSleep_NoSpending\", \"CryoSleep_Missing\", \"VIP_Missing\", \"RoomNum\", \"Transported\"]].corr()[\"Transported\"].sort_values(ascending=False)\n    print(corr_df.to_string(), file=sys.stderr)\n    \n    def predict(X_val):\n        # Parse Cabin in validation set\n        cabin_data = X_val[\"Cabin\"].apply(parse_cabin)\n        X_val_copy = X_val.copy()\n        X_val_copy[\"Deck\"] = cabin_data.apply(lambda x: x[0])\n        X_val_copy[\"RoomNum\"] = cabin_data.apply(lambda x: x[1])\n        X_val_copy[\"Side\"] = cabin_data.apply(lambda x: x[2])\n        \n        # Extract group ID\n        X_val_copy[\"GroupId\"] = X_val_copy[\"PassengerId\"].apply(extract_group_id)\n        \n        # Engineer features\n        X_val_copy = engineer_features(X_val_copy)\n        \n        # Create explicit missingness flags for CryoSleep and VIP before filling\n        X_val_copy[\"CryoSleep_Missing\"] = X_val_copy[\"CryoSleep\"].isna().astype(int)\n        X_val_copy[\"VIP_Missing\"] = X_val_copy[\"VIP\"].isna().astype(int)\n        \n        # Handle CryoSleep and VIP\n        X_val_copy[\"CryoSleep\"] = X_val_copy[\"CryoSleep\"].fillna(\"Unknown\").astype(str)\n        X_val_copy[\"VIP\"] = X_val_copy[\"VIP\"].fillna(\"Unknown\").astype(str)\n        \n        return pipe.predict(X_val_copy[feature_cols]).astype(bool)\n    \n    return predict\n\n\nif __name__ == \"__main__\":\n    predict_fn = build_predict_fn()\n    score = prepare.evaluate(predict_fn)\n    print(f\"VAL_ACCURACY: {score:.4f}\")\n", "notes_append": "Iteration 33: Added feature importance diagnostics (XGBoost importance + correlation analysis) to understand which engineered features actually drive predictions and guide next feature engineering or simplification decision.", "stdout": "VAL_ACCURACY: 0.8189\n", "stderr": "=== Top 15 Feature Importances ===\n             feature  importance\n    HomePlanet_Earth    0.188689\n       TotalSpending    0.159076\nCryoSleep_NoSpending    0.075553\n              Deck_E    0.068564\n   HomePlanet_Europa    0.053969\n              Deck_G    0.043250\n        ShoppingMall    0.034362\n           FoodCourt    0.034175\n                 Spa    0.031885\n         RoomService    0.027735\n              VRDeck    0.026418\n              Side_P    0.026098\n              Deck_F    0.020609\n              Deck_C    0.018834\n             RoomNum    0.015173\n\n=== Correlation of Key Features with Target ===\nTransported             1.000000\nCryoSleep_NoSpending    0.462554\nCryoSleep_Missing      -0.004878\nVIP_Missing            -0.006887\nRoomNum                -0.045421\nAge                    -0.079660\nTotalSpending          -0.203060\n", "returncode": 0, "score": 0.8189, "kept": true, "status": "kept", "commit_hash": "742cd0d", "input_tokens": 4163, "output_tokens": 2881, "cost_usd": 0.018568}
