{"iteration": 3, "timestamp": "2026-05-08T21:59:21", "previous_best": 0.8235, "duration_seconds": 10.88, "agent_response_raw": "<reflection>\nIteration 54 (CryoSleep × Deck interaction) regressed from 0.8235 to 0.8143, confirming that adding complex categorical interactions hurts more than helps. The best score remains 0.8235 from iteration 1, which used group-level features (GroupSize, GroupMedianSpending) without interaction terms. The pattern suggests that we've hit diminishing returns with simple feature engineering and need to either: (1) try a structurally different model class, (2) revisit the feature space more carefully (e.g., cabin/deck structure), or (3) tune hyperparameters more aggressively on top of the good feature engineering.\n</reflection>\n\n<observations>\n- Iteration 1 (group features only) scored 0.8235 and has held best across multiple follow-ups; iteration 54 adding explicit CryoSleep×Deck interaction dropped to 0.8143, suggesting that categorical interactions are overfitting or adding noise.\n- The notes show we've tested LightGBM (regressed to ~0.8177), logistic regression (0.7930), and XGBoost hyperparameter variants; XGBoost with baseline hyperparams (n_estimators=100, max_depth=6, learning_rate=0.1) appears to be the sweet spot.\n- Spending imputation strategy (per-HomePlanet median + global fallback) has been consistent since iteration 0 and seems solid; the group features added in iter 1 improved over baseline 0.8229.\n- The data is small (~8,700 rows), so we can afford more expensive feature engineering (e.g., target encoding, polynomial features) without overfitting too badly, and the model is simple enough that subtle feature interactions might matter.\n- Cabin/Deck structure hints (from program.md) suggest group structure and cabin assignment encode information; we've parsed Deck/RoomNum/Side but haven't explored their interaction with group membership or spending patterns deeply.\n</observations>\n\n<hypothesis>\nDeck assignment within a group may be predictive beyond its marginal effect: groups where members are spread across decks (high variance in Deck within group) or groups assigned to specific decks may have different transport rates. Adding group-level Deck variance and group's modal Deck will capture this structure without creating sparse categorical interactions.\n</hypothesis>\n\n<plan>\nModify `add_group_features()` to compute two additional aggregates per group: the modal (most frequent) Deck assignment and the count of distinct Decks in each group. These numeric features capture group-level cabin structure without creating sparse categorical combinations. Test whether this structure-aware aggregation breaks through 0.8235 without overfitting.\n</plan>\n\n<code>\n```python\n\"\"\"\ntrain.py — Iteration 55: Add group-level Deck aggregates.\nCompute group modal Deck and count of distinct Decks per group.\nTest whether cabin structure (deck diversity, deck assignment) at group level improves beyond 0.8235.\n\"\"\"\nimport sys, pathlib\nsys.path.insert(0, str(pathlib.Path(__file__).resolve().parent.parent))\n\nimport pandas as pd\nimport numpy as np\nimport xgboost as xgb\nfrom sklearn.impute import SimpleImputer\nfrom sklearn.pipeline import Pipeline\nfrom sklearn.preprocessing import StandardScaler, OneHotEncoder\nfrom sklearn.compose import ColumnTransformer\n\nimport prepare\n\nNUMERIC = [\"Age\", \"RoomService\", \"FoodCourt\", \"ShoppingMall\", \"Spa\", \"VRDeck\"]\nCATEGORICAL = [\"HomePlanet\", \"Destination\", \"CryoSleep\", \"VIP\"]\nSPENDING = [\"RoomService\", \"FoodCourt\", \"ShoppingMall\", \"Spa\", \"VRDeck\"]\n\n\ndef parse_cabin(cabin_str):\n    \"\"\"Parse Cabin 'F/0/S' into deck, room_num, side.\"\"\"\n    if pd.isna(cabin_str):\n        return np.nan, np.nan, np.nan\n    parts = str(cabin_str).split(\"/\")\n    if len(parts) == 3:\n        return parts[0], int(parts[1]) if parts[1].isdigit() else np.nan, parts[2]\n    return np.nan, np.nan, np.nan\n\n\ndef extract_group_id(passenger_id):\n    \"\"\"Extract group ID from PassengerId (e.g., '0001_01' -> '0001').\"\"\"\n    if pd.isna(passenger_id):\n        return np.nan\n    return str(passenger_id).split(\"_\")[0]\n\n\ndef engineer_features(df):\n    \"\"\"Engineer spending and spending-cryo interaction features.\"\"\"\n    df_copy = df.copy()\n    \n    # Track which spending values were originally recorded (not missing)\n    spending_recorded = ~df_copy[SPENDING].isna().any(axis=1)\n    df_copy[\"Spending_Recorded\"] = spending_recorded.astype(int)\n    \n    # Fill missing spending with median per HomePlanet group\n    for col in SPENDING:\n        missing_mask = df_copy[col].isna()\n        if missing_mask.any():\n            # Compute median per HomePlanet (ignoring NaN within groups)\n            group_medians = df_copy.groupby(\"HomePlanet\")[col].median()\n            # Fill group-wise; any remaining NaN (if whole planet has no data) use global median\n            df_copy.loc[missing_mask, col] = df_copy.loc[missing_mask, \"HomePlanet\"].map(group_medians)\n            global_median = df_copy[col].median()\n            # Fix: use direct assignment instead of inplace to avoid CoW issues\n            df_copy[col] = df_copy[col].fillna(global_median)\n    \n    # Total spending\n    df_copy[\"TotalSpending\"] = df_copy[SPENDING].sum(axis=1)\n    \n    # Interaction: CryoSleep status and spending ratio\n    cryo_status = df_copy[\"CryoSleep\"].fillna(False)\n    log_spending = np.log1p(df_copy[\"TotalSpending\"])\n    df_copy[\"CryoSleep_LogSpending\"] = (\n        (cryo_status == True) * log_spending\n    )\n    \n    return df_copy\n\n\ndef add_group_features(df):\n    \"\"\"Add group-level aggregate features based on PassengerId group.\"\"\"\n    df_copy = df.copy()\n    \n    # Extract group ID\n    df_copy[\"GroupId\"] = df_copy[\"PassengerId\"].apply(extract_group_id)\n    \n    # Compute group size\n    group_sizes = df_copy.groupby(\"GroupId\").size()\n    df_copy[\"GroupSize\"] = df_copy[\"GroupId\"].map(group_sizes)\n    \n    # Compute group median total spending\n    group_median_spending = df_copy.groupby(\"GroupId\")[\"TotalSpending\"].median()\n    df_copy[\"GroupMedianSpending\"] = df_copy[\"GroupId\"].map(group_median_spending)\n    \n    # Compute group modal (most frequent) Deck\n    def get_modal_deck(group):\n        decks = group.dropna()\n        if len(decks) == 0:\n            return np.nan\n        return decks.mode()[0] if len(decks.mode()) > 0 else np.nan\n    \n    group_modal_deck = df_copy.groupby(\"GroupId\")[\"Deck\"].apply(get_modal_deck)\n    df_copy[\"GroupModalDeck\"] = df_copy[\"GroupId\"].map(group_modal_deck)\n    \n    # Compute count of distinct Decks per group\n    group_deck_diversity = df_copy.groupby(\"GroupId\")[\"Deck\"].nunique()\n    df_copy[\"GroupDeckDiversity\"] = df_copy[\"GroupId\"].map(group_deck_diversity)\n    \n    return df_copy\n\n\ndef build_predict_fn():\n    train_df, _ = prepare.load_split()\n    \n    # Parse Cabin into Deck, RoomNum, Side\n    cabin_data = train_df[\"Cabin\"].apply(parse_cabin)\n    train_df[\"Deck\"] = cabin_data.apply(lambda x: x[0])\n    train_df[\"RoomNum\"] = cabin_data.apply(lambda x: x[1])\n    train_df[\"Side\"] = cabin_data.apply(lambda x: x[2])\n    \n    # Engineer features (including smart spending imputation)\n    train_df = engineer_features(train_df)\n    \n    # Add group-level features\n    train_df = add_group_features(train_df)\n    \n    # Create explicit missingness flags for CryoSleep and VIP before filling\n    train_df[\"CryoSleep_Missing\"] = train_df[\"CryoSleep\"].isna().astype(int)\n    train_df[\"VIP_Missing\"] = train_df[\"VIP\"].isna().astype(int)\n    \n    # Convert CryoSleep and VIP to string for categorical encoding\n    train_df[\"CryoSleep\"] = train_df[\"CryoSleep\"].fillna(\"Unknown\").astype(str)\n    train_df[\"VIP\"] = train_df[\"VIP\"].fillna(\"Unknown\").astype(str)\n    \n    # Build feature set\n    feature_cols = (\n        [\"Age\"] + SPENDING + [\"TotalSpending\", \"CryoSleep_LogSpending\", \"Spending_Recorded\"] +\n        CATEGORICAL + \n        [\"Deck\", \"RoomNum\", \"Side\", \"GroupId\"] + \n        [\"CryoSleep_Missing\", \"VIP_Missing\"] +\n        [\"GroupSize\", \"GroupMedianSpending\", \"GroupModalDeck\", \"GroupDeckDiversity\"]\n    )\n    X = train_df[feature_cols]\n    y = train_df[\"Transported\"].astype(int)\n    \n    # Define preprocessing for numeric and categorical columns\n    numeric_transformer = Pipeline([\n        (\"imputer\", SimpleImputer(strategy=\"median\")),\n        (\"scaler\", StandardScaler()),\n    ])\n    \n    categorical_transformer = Pipeline([\n        (\"imputer\", SimpleImputer(strategy=\"most_frequent\")),\n        (\"onehot\", OneHotEncoder(handle_unknown=\"ignore\", sparse_output=False)),\n    ])\n    \n    numeric_feature_cols = (\n        [\"Age\", \"RoomNum\", \"CryoSleep_Missing\", \"VIP_Missing\", \"Spending_Recorded\"] + \n        SPENDING + [\"TotalSpending\", \"CryoSleep_LogSpending\"] +\n        [\"GroupSize\", \"GroupMedianSpending\", \"GroupDeckDiversity\"]\n    )\n    categorical_feature_cols = CATEGORICAL + [\"Deck\", \"Side\", \"GroupId\", \"GroupModalDeck\"]\n    \n    preprocessor = ColumnTransformer([\n        (\"num\", numeric_transformer, numeric_feature_cols),\n        (\"cat\", categorical_transformer, categorical_feature_cols),\n    ])\n    \n    pipe = Pipeline([\n        (\"preprocessor\", preprocessor),\n        (\"clf\", xgb.XGBClassifier(n_estimators=100, max_depth=6, learning_rate=0.1, random_state=42, verbosity=0)),\n    ])\n    \n    pipe.fit(X, y)\n    \n    def predict(X_val):\n        # Parse Cabin in validation set\n        cabin_data = X_val[\"Cabin\"].apply(parse_cabin)\n        X_val_copy = X_val.copy()\n        X_val_copy[\"Deck\"] = cabin_data.apply(lambda x: x[0])\n        X_val_copy[\"RoomNum\"] = cabin_data.apply(lambda x: x[1])\n        X_val_copy[\"Side\"] = cabin_data.apply(lambda x: x[2])\n        \n        # Engineer features (using same smart spending imputation)\n        X_val_copy = engineer_features(X_val_copy)\n        \n        # Add group-level features (computed from training group stats)\n        X_val_copy[\"GroupId\"] = X_val_copy[\"PassengerId\"].apply(extract_group_id)\n        X_val_copy[\"GroupSize\"] = X_val_copy[\"GroupId\"].map(pd.Series(\n            train_df.groupby(\"GroupId\").size().to_dict()\n        ))\n        X_val_copy[\"GroupMedianSpending\"] = X_val_copy[\"GroupId\"].map(pd.Series(\n            train_df.groupby(\"GroupId\")[\"TotalSpending\"].median().to_dict()\n        ))\n        \n        # Map group modal deck and deck diversity\n        def get_modal_deck(group):\n            decks = group.dropna()\n            if len(decks) == 0:\n                return np.nan\n            return decks.mode()[0] if len(decks.mode()) > 0 else np.nan\n        \n        train_group_modal_deck = train_df.groupby(\"GroupId\")[\"Deck\"].apply(get_modal_deck)\n        train_group_deck_diversity = train_df.groupby(\"GroupId\")[\"Deck\"].nunique()\n        \n        X_val_copy[\"GroupModalDeck\"] = X_val_copy[\"GroupId\"].map(pd.Series(train_group_modal_deck.to_dict()))\n        X_val_copy[\"GroupDeckDiversity\"] = X_val_copy[\"GroupId\"].map(pd.Series(train_group_deck_diversity.to_dict()))\n        \n        # Create explicit missingness flags for CryoSleep and VIP before filling\n        X_val_copy[\"CryoSleep_Missing\"] = X_val_copy[\"CryoSleep\"].isna().astype(int)\n        X_val_copy[\"VIP_Missing\"] = X_val_copy[\"VIP\"].isna().astype(int)\n        \n        # Handle CryoSleep and VIP\n        X_val_copy[\"CryoSleep\"] = X_val_copy[\"CryoSleep\"].fillna(\"Unknown\").astype(str)\n        X_val_copy[\"VIP\"] = X_val_copy[\"VIP\"].fillna(\"Unknown\").astype(str)\n        \n        return pipe.predict(X_val_copy[feature_cols]).astype(bool)\n    \n    return predict\n\n\nif __name__ == \"__main__\":\n    predict_fn = build_predict_fn()\n    score = prepare.evaluate(predict_fn)\n    print(f\"VAL_ACCURACY: {score:.4f}\")\n```\n</code>\n\n<notes_append>\nIteration 55: Added GroupModalDeck (most frequent Deck in group) and GroupDeckDiversity (count of distinct Decks per group) as group-level cabin structure features. Hypothesis: group cabin assignment encodes information beyond individual Deck; modal Deck + diversity capture assignment patterns. Testing whether cabin structure aggregates avoid sparse interaction pitfalls of iter 54.\n</notes_append>", "reflection": "Iteration 54 (CryoSleep × Deck interaction) regressed from 0.8235 to 0.8143, confirming that adding complex categorical interactions hurts more than helps. The best score remains 0.8235 from iteration 1, which used group-level features (GroupSize, GroupMedianSpending) without interaction terms. The pattern suggests that we've hit diminishing returns with simple feature engineering and need to either: (1) try a structurally different model class, (2) revisit the feature space more carefully (e.g., cabin/deck structure), or (3) tune hyperparameters more aggressively on top of the good feature engineering.", "observations": ["Iteration 1 (group features only) scored 0.8235 and has held best across multiple follow-ups; iteration 54 adding explicit CryoSleep×Deck interaction dropped to 0.8143, suggesting that categorical interactions are overfitting or adding noise.", "The notes show we've tested LightGBM (regressed to ~0.8177), logistic regression (0.7930), and XGBoost hyperparameter variants; XGBoost with baseline hyperparams (n_estimators=100, max_depth=6, learning_rate=0.1) appears to be the sweet spot.", "Spending imputation strategy (per-HomePlanet median + global fallback) has been consistent since iteration 0 and seems solid; the group features added in iter 1 improved over baseline 0.8229.", "The data is small (~8,700 rows), so we can afford more expensive feature engineering (e.g., target encoding, polynomial features) without overfitting too badly, and the model is simple enough that subtle feature interactions might matter.", "Cabin/Deck structure hints (from program.md) suggest group structure and cabin assignment encode information; we've parsed Deck/RoomNum/Side but haven't explored their interaction with group membership or spending patterns deeply."], "hypothesis": "Deck assignment within a group may be predictive beyond its marginal effect: groups where members are spread across decks (high variance in Deck within group) or groups assigned to specific decks may have different transport rates. Adding group-level Deck variance and group's modal Deck will capture this structure without creating sparse categorical interactions.", "plan": "Modify `add_group_features()` to compute two additional aggregates per group: the modal (most frequent) Deck assignment and the count of distinct Decks in each group. These numeric features capture group-level cabin structure without creating sparse categorical combinations. Test whether this structure-aware aggregation breaks through 0.8235 without overfitting.", "code": "\"\"\"\ntrain.py — Iteration 55: Add group-level Deck aggregates.\nCompute group modal Deck and count of distinct Decks per group.\nTest whether cabin structure (deck diversity, deck assignment) at group level improves beyond 0.8235.\n\"\"\"\nimport sys, pathlib\nsys.path.insert(0, str(pathlib.Path(__file__).resolve().parent.parent))\n\nimport pandas as pd\nimport numpy as np\nimport xgboost as xgb\nfrom sklearn.impute import SimpleImputer\nfrom sklearn.pipeline import Pipeline\nfrom sklearn.preprocessing import StandardScaler, OneHotEncoder\nfrom sklearn.compose import ColumnTransformer\n\nimport prepare\n\nNUMERIC = [\"Age\", \"RoomService\", \"FoodCourt\", \"ShoppingMall\", \"Spa\", \"VRDeck\"]\nCATEGORICAL = [\"HomePlanet\", \"Destination\", \"CryoSleep\", \"VIP\"]\nSPENDING = [\"RoomService\", \"FoodCourt\", \"ShoppingMall\", \"Spa\", \"VRDeck\"]\n\n\ndef parse_cabin(cabin_str):\n    \"\"\"Parse Cabin 'F/0/S' into deck, room_num, side.\"\"\"\n    if pd.isna(cabin_str):\n        return np.nan, np.nan, np.nan\n    parts = str(cabin_str).split(\"/\")\n    if len(parts) == 3:\n        return parts[0], int(parts[1]) if parts[1].isdigit() else np.nan, parts[2]\n    return np.nan, np.nan, np.nan\n\n\ndef extract_group_id(passenger_id):\n    \"\"\"Extract group ID from PassengerId (e.g., '0001_01' -> '0001').\"\"\"\n    if pd.isna(passenger_id):\n        return np.nan\n    return str(passenger_id).split(\"_\")[0]\n\n\ndef engineer_features(df):\n    \"\"\"Engineer spending and spending-cryo interaction features.\"\"\"\n    df_copy = df.copy()\n    \n    # Track which spending values were originally recorded (not missing)\n    spending_recorded = ~df_copy[SPENDING].isna().any(axis=1)\n    df_copy[\"Spending_Recorded\"] = spending_recorded.astype(int)\n    \n    # Fill missing spending with median per HomePlanet group\n    for col in SPENDING:\n        missing_mask = df_copy[col].isna()\n        if missing_mask.any():\n            # Compute median per HomePlanet (ignoring NaN within groups)\n            group_medians = df_copy.groupby(\"HomePlanet\")[col].median()\n            # Fill group-wise; any remaining NaN (if whole planet has no data) use global median\n            df_copy.loc[missing_mask, col] = df_copy.loc[missing_mask, \"HomePlanet\"].map(group_medians)\n            global_median = df_copy[col].median()\n            # Fix: use direct assignment instead of inplace to avoid CoW issues\n            df_copy[col] = df_copy[col].fillna(global_median)\n    \n    # Total spending\n    df_copy[\"TotalSpending\"] = df_copy[SPENDING].sum(axis=1)\n    \n    # Interaction: CryoSleep status and spending ratio\n    cryo_status = df_copy[\"CryoSleep\"].fillna(False)\n    log_spending = np.log1p(df_copy[\"TotalSpending\"])\n    df_copy[\"CryoSleep_LogSpending\"] = (\n        (cryo_status == True) * log_spending\n    )\n    \n    return df_copy\n\n\ndef add_group_features(df):\n    \"\"\"Add group-level aggregate features based on PassengerId group.\"\"\"\n    df_copy = df.copy()\n    \n    # Extract group ID\n    df_copy[\"GroupId\"] = df_copy[\"PassengerId\"].apply(extract_group_id)\n    \n    # Compute group size\n    group_sizes = df_copy.groupby(\"GroupId\").size()\n    df_copy[\"GroupSize\"] = df_copy[\"GroupId\"].map(group_sizes)\n    \n    # Compute group median total spending\n    group_median_spending = df_copy.groupby(\"GroupId\")[\"TotalSpending\"].median()\n    df_copy[\"GroupMedianSpending\"] = df_copy[\"GroupId\"].map(group_median_spending)\n    \n    # Compute group modal (most frequent) Deck\n    def get_modal_deck(group):\n        decks = group.dropna()\n        if len(decks) == 0:\n            return np.nan\n        return decks.mode()[0] if len(decks.mode()) > 0 else np.nan\n    \n    group_modal_deck = df_copy.groupby(\"GroupId\")[\"Deck\"].apply(get_modal_deck)\n    df_copy[\"GroupModalDeck\"] = df_copy[\"GroupId\"].map(group_modal_deck)\n    \n    # Compute count of distinct Decks per group\n    group_deck_diversity = df_copy.groupby(\"GroupId\")[\"Deck\"].nunique()\n    df_copy[\"GroupDeckDiversity\"] = df_copy[\"GroupId\"].map(group_deck_diversity)\n    \n    return df_copy\n\n\ndef build_predict_fn():\n    train_df, _ = prepare.load_split()\n    \n    # Parse Cabin into Deck, RoomNum, Side\n    cabin_data = train_df[\"Cabin\"].apply(parse_cabin)\n    train_df[\"Deck\"] = cabin_data.apply(lambda x: x[0])\n    train_df[\"RoomNum\"] = cabin_data.apply(lambda x: x[1])\n    train_df[\"Side\"] = cabin_data.apply(lambda x: x[2])\n    \n    # Engineer features (including smart spending imputation)\n    train_df = engineer_features(train_df)\n    \n    # Add group-level features\n    train_df = add_group_features(train_df)\n    \n    # Create explicit missingness flags for CryoSleep and VIP before filling\n    train_df[\"CryoSleep_Missing\"] = train_df[\"CryoSleep\"].isna().astype(int)\n    train_df[\"VIP_Missing\"] = train_df[\"VIP\"].isna().astype(int)\n    \n    # Convert CryoSleep and VIP to string for categorical encoding\n    train_df[\"CryoSleep\"] = train_df[\"CryoSleep\"].fillna(\"Unknown\").astype(str)\n    train_df[\"VIP\"] = train_df[\"VIP\"].fillna(\"Unknown\").astype(str)\n    \n    # Build feature set\n    feature_cols = (\n        [\"Age\"] + SPENDING + [\"TotalSpending\", \"CryoSleep_LogSpending\", \"Spending_Recorded\"] +\n        CATEGORICAL + \n        [\"Deck\", \"RoomNum\", \"Side\", \"GroupId\"] + \n        [\"CryoSleep_Missing\", \"VIP_Missing\"] +\n        [\"GroupSize\", \"GroupMedianSpending\", \"GroupModalDeck\", \"GroupDeckDiversity\"]\n    )\n    X = train_df[feature_cols]\n    y = train_df[\"Transported\"].astype(int)\n    \n    # Define preprocessing for numeric and categorical columns\n    numeric_transformer = Pipeline([\n        (\"imputer\", SimpleImputer(strategy=\"median\")),\n        (\"scaler\", StandardScaler()),\n    ])\n    \n    categorical_transformer = Pipeline([\n        (\"imputer\", SimpleImputer(strategy=\"most_frequent\")),\n        (\"onehot\", OneHotEncoder(handle_unknown=\"ignore\", sparse_output=False)),\n    ])\n    \n    numeric_feature_cols = (\n        [\"Age\", \"RoomNum\", \"CryoSleep_Missing\", \"VIP_Missing\", \"Spending_Recorded\"] + \n        SPENDING + [\"TotalSpending\", \"CryoSleep_LogSpending\"] +\n        [\"GroupSize\", \"GroupMedianSpending\", \"GroupDeckDiversity\"]\n    )\n    categorical_feature_cols = CATEGORICAL + [\"Deck\", \"Side\", \"GroupId\", \"GroupModalDeck\"]\n    \n    preprocessor = ColumnTransformer([\n        (\"num\", numeric_transformer, numeric_feature_cols),\n        (\"cat\", categorical_transformer, categorical_feature_cols),\n    ])\n    \n    pipe = Pipeline([\n        (\"preprocessor\", preprocessor),\n        (\"clf\", xgb.XGBClassifier(n_estimators=100, max_depth=6, learning_rate=0.1, random_state=42, verbosity=0)),\n    ])\n    \n    pipe.fit(X, y)\n