{"iteration": 2, "timestamp": "2026-05-08T21:24:46", "previous_best": 0.8189, "duration_seconds": 1.53, "agent_response_raw": "<reflection>\nThe last run (iteration 38) attempted to simplify to logistic regression but the score dropped sharply to 0.7246, reverting back to 0.8189. The notes show a long plateau at 0.8143–0.8189 despite 38 iterations of feature engineering, interaction terms, and model swaps. This suggests the current best (0.8189, iteration 0) is a simple baseline logistic regression that is hard to beat with the strategies tried so far. I need to step back and inspect the data more carefully to find structural patterns that haven't been exploited yet.\n</reflection>\n\n<observations>\n- Iteration 0 achieved 0.8189 with a simple logistic regression on raw numeric columns, and 38 subsequent attempts to improve it failed (many reverted). This suggests either: (a) the simple baseline is near-optimal for this dataset, or (b) improvements require structural insights we haven't discovered yet.\n- The hints mention that some columns encode multiple pieces of information, that missing values may be predictive, and that identifier columns can encode group structure. We've parsed Cabin and extracted GroupId, but we haven't systematically tested whether *missing patterns themselves* are more informative than the values.\n- Most feature engineering attempts added complexity (interactions, transformations, regularization tweaks) without yielding consistent gains. We've never done a pure data exploration pass: print the raw data, look at distributions, check correlations with the target, and identify the simplest structural differences between transported and non-transported passengers.\n- The script currently imports all these feature engineering functions but iteration 38 attempted simplification and failed. Before trying another model, I should actually read the data and see what distinguishes the two classes.\n</observations>\n\n<hypothesis>\nThe dataset has structural patterns (feature correlations, missing-value distributions, or simple non-linear separations) that can be discovered through exploratory data analysis (EDA) rather than blind feature engineering. A short EDA script will reveal which columns actually differ between transported and non-transported passengers, and that will guide a more informed feature selection.\n</hypothesis>\n\n<plan>\nFirst, I will write a simple EDA script to print: (1) summary statistics of the dataset, (2) missingness patterns, (3) distributions of key features split by Transported status, and (4) correlation of features with the target. This will tell us what the data actually looks like before we try to model it. Then, based on those findings, I will either refine the features in train.py or propose a different approach.\n</plan>\n\n<code>\n```python\n\"\"\"\ntrain.py — EDA first: understand the data before modeling.\n\"\"\"\nimport sys, pathlib\nsys.path.insert(0, str(pathlib.Path(__file__).resolve().parent.parent))\n\nimport pandas as pd\nimport numpy as np\nimport prepare\n\n# Load data\ntrain_df, val_df = prepare.load_split()\n\nprint(\"=\" * 60)\nprint(\"DATASET SHAPE & SUMMARY\")\nprint(\"=\" * 60)\nprint(f\"Train shape: {train_df.shape}\")\nprint(f\"Val shape: {val_df.shape}\")\nprint(f\"\\nTarget distribution (train):\\n{train_df['Transported'].value_counts()}\")\nprint(f\"\\nColumn dtypes:\\n{train_df.dtypes}\")\n\nprint(\"\\n\" + \"=\" * 60)\nprint(\"MISSINGNESS\")\nprint(\"=\" * 60)\nprint(train_df.isnull().sum())\n\nprint(\"\\n\" + \"=\" * 60)\nprint(\"NUMERIC COLUMNS: SUMMARY STATS BY TRANSPORTED\")\nprint(\"=\" * 60)\nnumeric_cols = [\"Age\", \"RoomService\", \"FoodCourt\", \"ShoppingMall\", \"Spa\", \"VRDeck\"]\nfor col in numeric_cols:\n    transported_mean = train_df[train_df[\"Transported\"]][\"\\ \" + col].mean()\n    not_transported_mean = train_df[~train_df[\"Transported\"]][col].mean()\n    print(f\"{col}:\")\n    print(f\"  Transported: mean={transported_mean:.2f}, null_count={train_df[train_df['Transported']][col].isnull().sum()}\")\n    print(f\"  Not transported: mean={not_transported_mean:.2f}, null_count={train_df[~train_df['Transported']][col].isnull().sum()}\")\n\nprint(\"\\n\" + \"=\" * 60)\nprint(\"CATEGORICAL COLUMNS: VALUE COUNTS BY TRANSPORTED\")\nprint(\"=\" * 60)\ncategorical_cols = [\"HomePlanet\", \"CryoSleep\", \"VIP\", \"Destination\"]\nfor col in categorical_cols:\n    print(f\"\\n{col}:\")\n    print(f\"  Transported=True:\\n{train_df[train_df['Transported']][col].value_counts(dropna=False)}\")\n    print(f\"  Transported=False:\\n{train_df[~train_df['Transported']][col].value_counts(dropna=False)}\")\n\nprint(\"\\n\" + \"=\" * 60)\nprint(\"CABIN PARSING\")\nprint(\"=\" * 60)\ncabin_null = train_df[\"Cabin\"].isnull().sum()\nprint(f\"Cabin missing: {cabin_null}\")\ndef parse_cabin(cabin_str):\n    if pd.isna(cabin_str):\n        return np.nan, np.nan, np.nan\n    parts = str(cabin_str).split(\"/\")\n    if len(parts) == 3:\n        return parts[0], int(parts[1]) if parts[1].isdigit() else np.nan, parts[2]\n    return np.nan, np.nan, np.nan\n\ncabin_data = train_df[\"Cabin\"].apply(parse_cabin)\ntrain_df[\"Deck\"] = cabin_data.apply(lambda x: x[0])\ntrain_df[\"RoomNum\"] = cabin_data.apply(lambda x: x[1])\ntrain_df[\"Side\"] = cabin_data.apply(lambda x: x[2])\n\nprint(\"\\nDeck distribution (Transported=True):\")\nprint(train_df[train_df[\"Transported\"]][\"Deck\"].value_counts(dropna=False))\nprint(\"\\nDeck distribution (Transported=False):\")\nprint(train_df[~train_df[\"Transported\"]][\"Deck\"].value_counts(dropna=False))\n\nprint(\"\\nSide distribution (Transported=True):\")\nprint(train_df[train_df[\"Transported\"]][\"Side\"].value_counts(dropna=False))\nprint(\"\\nSide distribution (Transported=False):\")\nprint(train_df[~train_df[\"Transported\"]][\"Side\"].value_counts(dropna=False))\n\nprint(\"\\n\" + \"=\" * 60)\nprint(\"CORRELATION WITH TARGET (numeric only)\")\nprint(\"=\" * 60)\nnumeric_with_target = train_df[numeric_cols + [\"Transported\"]].copy()\nfor col in numeric_cols:\n    numeric_with_target[col] = numeric_with_target[col].fillna(numeric_with_target[col].median())\ncorr = numeric_with_target.corr()[\"Transported\"].drop(\"Transported\").sort_values(ascending=False)\nprint(corr)\n\n# Dummy: output score for the harness\nprint(\"\\nVAL_ACCURACY: 0.0000\")\n```\n</code>\n\n<notes_append>\nIteration 39: Running EDA to understand data distributions and missing-value patterns before resuming modeling. Previous 38 iterations showed plateau at 0.8189; need structural insight rather than hyperparameter tuning.\n</notes_append>", "reflection": "The last run (iteration 38) attempted to simplify to logistic regression but the score dropped sharply to 0.7246, reverting back to 0.8189. The notes show a long plateau at 0.8143–0.8189 despite 38 iterations of feature engineering, interaction terms, and model swaps. This suggests the current best (0.8189, iteration 0) is a simple baseline logistic regression that is hard to beat with the strategies tried so far. I need to step back and inspect the data more carefully to find structural patterns that haven't been exploited yet.", "observations": ["Iteration 0 achieved 0.8189 with a simple logistic regression on raw numeric columns, and 38 subsequent attempts to improve it failed (many reverted). This suggests either: (a) the simple baseline is near-optimal for this dataset, or (b) improvements require structural insights we haven't discovered yet.", "The hints mention that some columns encode multiple pieces of information, that missing values may be predictive, and that identifier columns can encode group structure. We've parsed Cabin and extracted GroupId, but we haven't systematically tested whether *missing patterns themselves* are more informative than the values.", "Most feature engineering attempts added complexity (interactions, transformations, regularization tweaks) without yielding consistent gains. We've never done a pure data exploration pass: print the raw data, look at distributions, check correlations with the target, and identify the simplest structural differences between transported and non-transported passengers.", "The script currently imports all these feature engineering functions but iteration 38 attempted simplification and failed. Before trying another model, I should actually read the data and see what distinguishes the two classes."], "hypothesis": "The dataset has structural patterns (feature correlations, missing-value distributions, or simple non-linear separations) that can be discovered through exploratory data analysis (EDA) rather than blind feature engineering. A short EDA script will reveal which columns actually differ between transported and non-transported passengers, and that will guide a more informed feature selection.", "plan": "First, I will write a simple EDA script to print: (1) summary statistics of the dataset, (2) missingness patterns, (3) distributions of key features split by Transported status, and (4) correlation of features with the target. This will tell us what the data actually looks like before we try to model it. Then, based on those findings, I will either refine the features in train.py or propose a different approach.", "code": "\"\"\"\ntrain.py — EDA first: understand the data before modeling.\n\"\"\"\nimport sys, pathlib\nsys.path.insert(0, str(pathlib.Path(__file__).resolve().parent.parent))\n\nimport pandas as pd\nimport numpy as np\nimport prepare\n\n# Load data\ntrain_df, val_df = prepare.load_split()\n\nprint(\"=\" * 60)\nprint(\"DATASET SHAPE & SUMMARY\")\nprint(\"=\" * 60)\nprint(f\"Train shape: {train_df.shape}\")\nprint(f\"Val shape: {val_df.shape}\")\nprint(f\"\\nTarget distribution (train):\\n{train_df['Transported'].value_counts()}\")\nprint(f\"\\nColumn dtypes:\\n{train_df.dtypes}\")\n\nprint(\"\\n\" + \"=\" * 60)\nprint(\"MISSINGNESS\")\nprint(\"=\" * 60)\nprint(train_df.isnull().sum())\n\nprint(\"\\n\" + \"=\" * 60)\nprint(\"NUMERIC COLUMNS: SUMMARY STATS BY TRANSPORTED\")\nprint(\"=\" * 60)\nnumeric_cols = [\"Age\", \"RoomService\", \"FoodCourt\", \"ShoppingMall\", \"Spa\", \"VRDeck\"]\nfor col in numeric_cols:\n    transported_mean = train_df[train_df[\"Transported\"]][\"\\ \" + col].mean()\n    not_transported_mean = train_df[~train_df[\"Transported\"]][col].mean()\n    print(f\"{col}:\")\n    print(f\"  Transported: mean={transported_mean:.2f}, null_count={train_df[train_df['Transported']][col].isnull().sum()}\")\n    print(f\"  Not transported: mean={not_transported_mean:.2f}, null_count={train_df[~train_df['Transported']][col].isnull().sum()}\")\n\nprint(\"\\n\" + \"=\" * 60)\nprint(\"CATEGORICAL COLUMNS: VALUE COUNTS BY TRANSPORTED\")\nprint(\"=\" * 60)\ncategorical_cols = [\"HomePlanet\", \"CryoSleep\", \"VIP\", \"Destination\"]\nfor col in categorical_cols:\n    print(f\"\\n{col}:\")\n    print(f\"  Transported=True:\\n{train_df[train_df['Transported']][col].value_counts(dropna=False)}\")\n    print(f\"  Transported=False:\\n{train_df[~train_df['Transported']][col].value_counts(dropna=False)}\")\n\nprint(\"\\n\" + \"=\" * 60)\nprint(\"CABIN PARSING\")\nprint(\"=\" * 60)\ncabin_null = train_df[\"Cabin\"].isnull().sum()\nprint(f\"Cabin missing: {cabin_null}\")\ndef parse_cabin(cabin_str):\n    if pd.isna(cabin_str):\n        return np.nan, np.nan, np.nan\n    parts = str(cabin_str).split(\"/\")\n    if len(parts) == 3:\n        return parts[0], int(parts[1]) if parts[1].isdigit() else np.nan, parts[2]\n    return np.nan, np.nan, np.nan\n\ncabin_data = train_df[\"Cabin\"].apply(parse_cabin)\ntrain_df[\"Deck\"] = cabin_data.apply(lambda x: x[0])\ntrain_df[\"RoomNum\"] = cabin_data.apply(lambda x: x[1])\ntrain_df[\"Side\"] = cabin_data.apply(lambda x: x[2])\n\nprint(\"\\nDeck distribution (Transported=True):\")\nprint(train_df[train_df[\"Transported\"]][\"Deck\"].value_counts(dropna=False))\nprint(\"\\nDeck distribution (Transported=False):\")\nprint(train_df[~train_df[\"Transported\"]][\"Deck\"].value_counts(dropna=False))\n\nprint(\"\\nSide distribution (Transported=True):\")\nprint(train_df[train_df[\"Transported\"]][\"Side\"].value_counts(dropna=False))\nprint(\"\\nSide distribution (Transported=False):\")\nprint(train_df[~train_df[\"Transported\"]][\"Side\"].value_counts(dropna=False))\n\nprint(\"\\n\" + \"=\" * 60)\nprint(\"CORRELATION WITH TARGET (numeric only)\")\nprint(\"=\" * 60)\nnumeric_with_target = train_df[numeric_cols + [\"Transported\"]].copy()\nfor col in numeric_cols:\n    numeric_with_target[col] = numeric_with_target[col].fillna(numeric_with_target[col].median())\ncorr = numeric_with_target.corr()[\"Transported\"].drop(\"Transported\").sort_values(ascending=False)\nprint(corr)\n\n# Dummy: output score for the harness\nprint(\"\\nVAL_ACCURACY: 0.0000\")\n", "notes_append": "Iteration 39: Running EDA to understand data distributions and missing-value patterns before resuming modeling. Previous 38 iterations showed plateau at 0.8189; need structural insight rather than hyperparameter tuning.", "stdout": "============================================================\nDATASET SHAPE & SUMMARY\n============================================================\nTrain shape: (6954, 14)\nVal shape: (1739, 14)\n\nTarget distribution (train):\nTransported\nTrue     3502\nFalse    3452\nName: count, dtype: int64\n\nColumn dtypes:\nPassengerId         str\nHomePlanet          str\nCryoSleep        object\nCabin               str\nDestination         str\nAge             float64\nVIP              object\nRoomService     float64\nFoodCourt       float64\nShoppingMall    float64\nSpa             float64\nVRDeck          float64\nName                str\nTransported        bool\ndtype: object\n\n============================================================\nMISSINGNESS\n============================================================\nPassengerId       0\nHomePlanet      169\nCryoSleep       168\nCabin           161\nDestination     153\nAge             139\nVIP             158\nRoomService     145\nFoodCourt       154\nShoppingMall    169\nSpa             150\nVRDeck          144\nName            159\nTransported       0\ndtype: int64\n\n============================================================\nNUMERIC COLUMNS: SUMMARY STATS BY TRANSPORTED\n============================================================\n", "stderr": "ost recent call last):\n  File \"C:\\Roger\\Creating\\Blog\\spaceship-titanic-autoresearch\\.venv\\Lib\\site-packages\\pandas\\core\\indexes\\base.py\", line 3641, in get_loc\n    return self._engine.get_loc(casted_key)\n           ~~~~~~~~~~~~~~~~~~~~^^^^^^^^^^^^\n  File \"pandas/_libs/index.pyx\", line 168, in pandas._libs.index.IndexEngine.get_loc\n  File \"pandas/_libs/index.pyx\", line 197, in pandas._libs.index.IndexEngine.get_loc\n  File \"pandas/_libs/hashtable_class_helper.pxi\", line 7668, in pandas._libs.hashtable.PyObjectHashTable.get_item\n  File \"pandas/_libs/hashtable_class_helper.pxi\", line 7676, in pandas._libs.hashtable.PyObjectHashTable.get_item\nKeyError: '\\\\ Age'\n\nThe above exception was the direct cause of the following exception:\n\nTraceback (most recent call last):\n<unknown>:2: SyntaxWarning: invalid escape sequence '\\ '\n<unknown>:1: SyntaxWarning: invalid escape sequence '\\ '\n  File \"C:\\Roger\\Creating\\Blog\\spaceship-titanic-autoresearch\\workspace\\train.py\", line 32, in <module>\n    transported_mean = train_df[train_df[\"Transported\"]][\"\\ \" + col].mean()\n                       ~~~~~~~~~~~~~~~~~~~~~~~~~~~~~~~~~^^^^^^^^^^^^\n  File \"C:\\Roger\\Creating\\Blog\\spaceship-titanic-autoresearch\\.venv\\Lib\\site-packages\\pandas\\core\\frame.py\", line 4378, in __getitem__\n    indexer = self.columns.get_loc(key)\n  File \"C:\\Roger\\Creating\\Blog\\spaceship-titanic-autoresearch\\.venv\\Lib\\site-packages\\pandas\\core\\indexes\\base.py\", line 3648, in get_loc\n    raise KeyError(key) from err\nKeyError: '\\\\ Age'\n", "returncode": 1, "score": null, "kept": false, "status": "crashed", "commit_hash": null, "input_tokens": 4130, "output_tokens": 1828, "cost_usd": 0.01327}
