{"iteration": 4, "timestamp": "2026-05-08T22:10:35", "previous_best": 0.8235, "duration_seconds": 4.34, "agent_response_raw": "<reflection>\nThe last run scored 0.8079, which is significantly below the iter 0 baseline of 0.8235. Despite claiming to restore the \"exact iter 0 baseline,\" the code is still losing ~0.016 accuracy. This suggests either the feature engineering (TotalSpending, CryoSleep_LogSpending, Spending_Recorded, group features) is hurting rather than helping, or there's a subtle bug in how features are being constructed or passed to the model. I need to strip the code back to absolute basics—just the original 6 numeric columns and 4 categorical columns—and verify the baseline holds before adding anything else.\n</reflection>\n\n<observations>\n- The current code includes TotalSpending, CryoSleep_LogSpending, Spending_Recorded, group features, and missingness flags, yet scores 0.8079 instead of 0.8235. This suggests at least one of these engineered features is degrading generalization.\n- The iter 0 baseline in notes.md mentions just \"Age + 5 spending + 4 categorical + parsed Cabin\"; the current code has drifted significantly with additional engineering that is not in the original.\n- The model pipeline structure looks sound (imputation, scaling, one-hot encoding), but if the baseline feature set is wrong, no amount of preprocessing cleanup will help.\n- No EDA has been run on the actual raw data in this iteration, so I don't know which features are actually correlated with the target. Before adding features, I should verify the minimal set works.\n</observations>\n\n<hypothesis>\nRestoring the absolute minimal baseline—Age + RoomService + FoodCourt + ShoppingMall + Spa + VRDeck + HomePlanet + Destination + CryoSleep + VIP + parsed Cabin (Deck, RoomNum, Side only)—without any engineered features (TotalSpending, interactions, group aggregates, missingness flags) will recover the 0.8235 baseline accuracy, confirming that the prior engineering was the source of regression.\n</hypothesis>\n\n<plan>\nRewrite train.py to use only the exact minimal feature set: Age, 5 spending columns, 4 categorical columns, and parsed Cabin (Deck, RoomNum, Side). Remove TotalSpending, CryoSleep_LogSpending, Spending_Recorded, group features, and all missingness flags. Keep the same XGBoost hyperparameters (max_depth=6, n_estimators=100, learning_rate=0.1) and preprocessing pipeline. This will establish the true baseline and isolate the cause of the 0.8079 regression.\n</plan>\n\n<code>\n```python\n\"\"\"\ntrain.py — Iteration 77: Restore absolute minimal baseline.\nAge + 5 spending + 4 categorical + parsed Cabin only.\nRemove all engineered features to recover 0.8235.\n\"\"\"\nimport sys, pathlib\nsys.path.insert(0, str(pathlib.Path(__file__).resolve().parent.parent))\n\nimport pandas as pd\nimport numpy as np\nimport xgboost as xgb\nfrom sklearn.impute import SimpleImputer\nfrom sklearn.pipeline import Pipeline\nfrom sklearn.preprocessing import StandardScaler\nfrom sklearn.preprocessing import OneHotEncoder\nfrom sklearn.compose import ColumnTransformer\n\nimport prepare\n\nNUMERIC = [\"Age\", \"RoomService\", \"FoodCourt\", \"ShoppingMall\", \"Spa\", \"VRDeck\"]\nCATEGORICAL = [\"HomePlanet\", \"Destination\", \"CryoSleep\", \"VIP\"]\n\n\ndef parse_cabin(cabin_str):\n    \"\"\"Parse Cabin 'F/0/S' into deck, room_num, side.\"\"\"\n    if pd.isna(cabin_str):\n        return np.nan, np.nan, np.nan\n    parts = str(cabin_str).split(\"/\")\n    if len(parts) == 3:\n        return parts[0], int(parts[1]) if parts[1].isdigit() else np.nan, parts[2]\n    return np.nan, np.nan, np.nan\n\n\ndef build_predict_fn():\n    train_df, _ = prepare.load_split()\n    \n    # Parse Cabin into Deck, RoomNum, Side\n    cabin_data = train_df[\"Cabin\"].apply(parse_cabin)\n    train_df[\"Deck\"] = cabin_data.apply(lambda x: x[0])\n    train_df[\"RoomNum\"] = cabin_data.apply(lambda x: x[1])\n    train_df[\"Side\"] = cabin_data.apply(lambda x: x[2])\n    \n    # Feature set: minimal baseline\n    feature_cols = NUMERIC + CATEGORICAL + [\"Deck\", \"RoomNum\", \"Side\"]\n    X = train_df[feature_cols]\n    y = train_df[\"Transported\"].astype(int)\n    \n    # Preprocessing: numeric imputation + scaling, categorical imputation + one-hot\n    numeric_transformer = Pipeline([\n        (\"imputer\", SimpleImputer(strategy=\"median\")),\n        (\"scaler\", StandardScaler()),\n    ])\n    \n    categorical_transformer = Pipeline([\n        (\"imputer\", SimpleImputer(strategy=\"most_frequent\")),\n        (\"onehot\", OneHotEncoder(handle_unknown=\"ignore\", sparse_output=False)),\n    ])\n    \n    preprocessor = ColumnTransformer([\n        (\"num\", numeric_transformer, NUMERIC),\n        (\"cat\", categorical_transformer, CATEGORICAL + [\"Deck\", \"RoomNum\", \"Side\"]),\n    ])\n    \n    # XGBoost model with baseline hyperparameters\n    pipe = Pipeline([\n        (\"preprocessor\", preprocessor),\n        (\"clf\", xgb.XGBClassifier(\n            max_depth=6,\n            n_estimators=100,\n            learning_rate=0.1,\n            random_state=42,\n            verbosity=0\n        )),\n    ])\n    \n    pipe.fit(X, y)\n    \n    def predict(X_val):\n        X_val_copy = X_val.copy()\n        \n        # Parse Cabin\n        cabin_data = X_val_copy[\"Cabin\"].apply(parse_cabin)\n        X_val_copy[\"Deck\"] = cabin_data.apply(lambda x: x[0])\n        X_val_copy[\"RoomNum\"] = cabin_data.apply(lambda x: x[1])\n        X_val_copy[\"Side\"] = cabin_data.apply(lambda x: x[2])\n        \n        return pipe.predict(X_val_copy[feature_cols]).astype(bool)\n    \n    return predict\n\n\nif __name__ == \"__main__\":\n    predict_fn = build_predict_fn()\n    score = prepare.evaluate(predict_fn)\n    print(f\"VAL_ACCURACY: {score:.4f}\")\n```\n</code>\n\n<notes_append>\nIteration 77: Stripped to absolute minimal baseline: Age + 5 spending + 4 categorical + parsed Cabin (Deck/RoomNum/Side). Removed TotalSpending, CryoSleep_LogSpending, Spending_Recorded, group features, and all missingness flags. Hypothesis: prior engineering was degrading generalization; expect to recover 0.8235.\n</notes_append>", "reflection": "The last run scored 0.8079, which is significantly below the iter 0 baseline of 0.8235. Despite claiming to restore the \"exact iter 0 baseline,\" the code is still losing ~0.016 accuracy. This suggests either the feature engineering (TotalSpending, CryoSleep_LogSpending, Spending_Recorded, group features) is hurting rather than helping, or there's a subtle bug in how features are being constructed or passed to the model. I need to strip the code back to absolute basics—just the original 6 numeric columns and 4 categorical columns—and verify the baseline holds before adding anything else.", "observations": ["The current code includes TotalSpending, CryoSleep_LogSpending, Spending_Recorded, group features, and missingness flags, yet scores 0.8079 instead of 0.8235. This suggests at least one of these engineered features is degrading generalization.", "The iter 0 baseline in notes.md mentions just \"Age + 5 spending + 4 categorical + parsed Cabin\"; the current code has drifted significantly with additional engineering that is not in the original.", "The model pipeline structure looks sound (imputation, scaling, one-hot encoding), but if the baseline feature set is wrong, no amount of preprocessing cleanup will help.", "No EDA has been run on the actual raw data in this iteration, so I don't know which features are actually correlated with the target. Before adding features, I should verify the minimal set works."], "hypothesis": "Restoring the absolute minimal baseline—Age + RoomService + FoodCourt + ShoppingMall + Spa + VRDeck + HomePlanet + Destination + CryoSleep + VIP + parsed Cabin (Deck, RoomNum, Side only)—without any engineered features (TotalSpending, interactions, group aggregates, missingness flags) will recover the 0.8235 baseline accuracy, confirming that the prior engineering was the source of regression.", "plan": "Rewrite train.py to use only the exact minimal feature set: Age, 5 spending columns, 4 categorical columns, and parsed Cabin (Deck, RoomNum, Side). Remove TotalSpending, CryoSleep_LogSpending, Spending_Recorded, group features, and all missingness flags. Keep the same XGBoost hyperparameters (max_depth=6, n_estimators=100, learning_rate=0.1) and preprocessing pipeline. This will establish the true baseline and isolate the cause of the 0.8079 regression.", "code": "\"\"\"\ntrain.py — Iteration 77: Restore absolute minimal baseline.\nAge + 5 spending + 4 categorical + parsed Cabin only.\nRemove all engineered features to recover 0.8235.\n\"\"\"\nimport sys, pathlib\nsys.path.insert(0, str(pathlib.Path(__file__).resolve().parent.parent))\n\nimport pandas as pd\nimport numpy as np\nimport xgboost as xgb\nfrom sklearn.impute import SimpleImputer\nfrom sklearn.pipeline import Pipeline\nfrom sklearn.preprocessing import StandardScaler\nfrom sklearn.preprocessing import OneHotEncoder\nfrom sklearn.compose import ColumnTransformer\n\nimport prepare\n\nNUMERIC = [\"Age\", \"RoomService\", \"FoodCourt\", \"ShoppingMall\", \"Spa\", \"VRDeck\"]\nCATEGORICAL = [\"HomePlanet\", \"Destination\", \"CryoSleep\", \"VIP\"]\n\n\ndef parse_cabin(cabin_str):\n    \"\"\"Parse Cabin 'F/0/S' into deck, room_num, side.\"\"\"\n    if pd.isna(cabin_str):\n        return np.nan, np.nan, np.nan\n    parts = str(cabin_str).split(\"/\")\n    if len(parts) == 3:\n        return parts[0], int(parts[1]) if parts[1].isdigit() else np.nan, parts[2]\n    return np.nan, np.nan, np.nan\n\n\ndef build_predict_fn():\n    train_df, _ = prepare.load_split()\n    \n    # Parse Cabin into Deck, RoomNum, Side\n    cabin_data = train_df[\"Cabin\"].apply(parse_cabin)\n    train_df[\"Deck\"] = cabin_data.apply(lambda x: x[0])\n    train_df[\"RoomNum\"] = cabin_data.apply(lambda x: x[1])\n    train_df[\"Side\"] = cabin_data.apply(lambda x: x[2])\n    \n    # Feature set: minimal baseline\n    feature_cols = NUMERIC + CATEGORICAL + [\"Deck\", \"RoomNum\", \"Side\"]\n    X = train_df[feature_cols]\n    y = train_df[\"Transported\"].astype(int)\n    \n    # Preprocessing: numeric imputation + scaling, categorical imputation + one-hot\n    numeric_transformer = Pipeline([\n        (\"imputer\", SimpleImputer(strategy=\"median\")),\n        (\"scaler\", StandardScaler()),\n    ])\n    \n    categorical_transformer = Pipeline([\n        (\"imputer\", SimpleImputer(strategy=\"most_frequent\")),\n        (\"onehot\", OneHotEncoder(handle_unknown=\"ignore\", sparse_output=False)),\n    ])\n    \n    preprocessor = ColumnTransformer([\n        (\"num\", numeric_transformer, NUMERIC),\n        (\"cat\", categorical_transformer, CATEGORICAL + [\"Deck\", \"RoomNum\", \"Side\"]),\n    ])\n    \n    # XGBoost model with baseline hyperparameters\n    pipe = Pipeline([\n        (\"preprocessor\", preprocessor),\n        (\"clf\", xgb.XGBClassifier(\n            max_depth=6,\n            n_estimators=100,\n            learning_rate=0.1,\n            random_state=42,\n            verbosity=0\n        )),\n    ])\n    \n    pipe.fit(X, y)\n    \n    def predict(X_val):\n        X_val_copy = X_val.copy()\n        \n        # Parse Cabin\n        cabin_data = X_val_copy[\"Cabin\"].apply(parse_cabin)\n        X_val_copy[\"Deck\"] = cabin_data.apply(lambda x: x[0])\n        X_val_copy[\"RoomNum\"] = cabin_data.apply(lambda x: x[1])\n        X_val_copy[\"Side\"] = cabin_data.apply(lambda x: x[2])\n        \n        return pipe.predict(X_val_copy[feature_cols]).astype(bool)\n    \n    return predict\n\n\nif __name__ == \"__main__\":\n    predict_fn = build_predict_fn()\n    score = prepare.evaluate(predict_fn)\n    print(f\"VAL_ACCURACY: {score:.4f}\")\n", "notes_append": "Iteration 77: Stripped to absolute minimal baseline: Age + 5 spending + 4 categorical + parsed Cabin (Deck/RoomNum/Side). Removed TotalSpending, CryoSleep_LogSpending, Spending_Recorded, group features, and all missingness flags. Hypothesis: prior engineering was degrading generalization; expect to recover 0.8235.", "stdout": "VAL_ACCURACY: 0.8091\n", "stderr": "", "returncode": 0, "score": 0.8091, "kept": false, "status": "reverted", "commit_hash": null, "input_tokens": 5363, "output_tokens": 1746, "cost_usd": 0.014093}
