{"iteration": 3, "timestamp": "2026-05-08T22:38:39", "previous_best": 0.8235, "duration_seconds": 11.93, "agent_response_raw": "<reflection>\nIteration 90 removed many features (PassengerId, GroupId, group aggregates, polynomial features) and regressed to 0.8183, below the current best of 0.8235. This confirms that those features, despite having low individual importance scores, were collectively helping. The notes indicate iter 80-89 achieved 0.8235 with a richer feature set. I should revert to the iter 80 baseline and approach feature selection more carefully: instead of blindly dropping low-importance features, I should verify which removed features actually hurt generalization.\n</reflection>\n\n<observations>\n- Iteration 90's aggressive feature removal (dropping PassengerId, GroupId, group-level aggregates, and polynomial features) caused a 0.5% accuracy drop to 0.8183, suggesting those features contained genuine signal despite appearing \"low importance\" in the diagnostic output.\n- The best score of 0.8235 was achieved with a full feature set including PassengerId-derived features (GroupId, GroupSize, GroupMedianSpending) and interaction features (CryoSleep_LogSpending, Deck_TotalSpending, age polynomials).\n- One-hot encoding of PassengerId and GroupId creates thousands of sparse features, which on a ~7000-row training set may actually encode real group-level structure (families, booking cohorts) rather than pure noise.\n- The diagnostic approach of looking at XGBoost feature importance is unreliable for this dataset size—importance scores are noisy when features are correlated or interact non-additively, and low importance doesn't mean low signal.\n- The safest next step is to restore the iter 80 configuration (which scored 0.8235) and make one targeted change: instead of feature selection by importance, try a different hyperparameter or a single new feature that has a clear domain rationale.\n</observations>\n\n<hypothesis>\nRestoring the iter 80 configuration (full feature set with PassengerId, GroupId, group aggregates, CryoSleep_LogSpending, Deck_TotalSpending, age polynomials) will return to 0.8235 validation accuracy. Once baseline is re-confirmed, a small data-driven change (e.g., tuning XGBoost regularization or adding a cabin-location interaction) will push above 0.8235 without the volatility of feature-selection guessing.\n</hypothesis>\n\n<plan>\nI will restore the iter 80 configuration exactly: XGBoost with max_depth=6, n_estimators=100, learning_rate=0.1, all original engineered features (TotalSpending, group features, polynomial age terms, Deck_TotalSpending), and the full feature list. This re-establishes the known-good baseline at 0.8235, confirming reproducibility. Once confirmed, the next iteration can safely explore a targeted refinement.\n</plan>\n\n<code>\n```python\n\"\"\"\ntrain.py — Iteration 91: Restore iter 80 baseline configuration.\n\"\"\"\nimport sys, pathlib\nsys.path.insert(0, str(pathlib.Path(__file__).resolve().parent.parent))\n\nimport pandas as pd\nimport numpy as np\nimport xgboost as xgb\nfrom sklearn.impute import SimpleImputer\nfrom sklearn.pipeline import Pipeline\nfrom sklearn.preprocessing import StandardScaler, OneHotEncoder\nfrom sklearn.compose import ColumnTransformer\n\nimport prepare\n\nNUMERIC = [\"Age\", \"RoomService\", \"FoodCourt\", \"ShoppingMall\", \"Spa\", \"VRDeck\"]\nCATEGORICAL = [\"HomePlanet\", \"Destination\", \"CryoSleep\", \"VIP\"]\nSPENDING = [\"RoomService\", \"FoodCourt\", \"ShoppingMall\", \"Spa\", \"VRDeck\"]\n\n\ndef parse_cabin(cabin_str):\n    \"\"\"Parse Cabin 'F/0/S' into deck, room_num, side.\"\"\"\n    if pd.isna(cabin_str):\n        return np.nan, np.nan, np.nan\n    parts = str(cabin_str).split(\"/\")\n    if len(parts) == 3:\n        return parts[0], int(parts[1]) if parts[1].isdigit() else np.nan, parts[2]\n    return np.nan, np.nan, np.nan\n\n\ndef extract_group_id(passenger_id):\n    \"\"\"Extract group ID from PassengerId (e.g., '0001_01' -> '0001').\"\"\"\n    if pd.isna(passenger_id):\n        return np.nan\n    return str(passenger_id).split(\"_\")[0]\n\n\ndef engineer_features(df):\n    \"\"\"Engineer spending, interaction, and polynomial features.\"\"\"\n    df_copy = df.copy()\n    \n    # Track which rows have any spending data recorded\n    spending_recorded = ~df_copy[SPENDING].isna().any(axis=1)\n    df_copy[\"Spending_Recorded\"] = spending_recorded.astype(int)\n    \n    # Fill missing spending with median per HomePlanet group\n    for col in SPENDING:\n        missing_mask = df_copy[col].isna()\n        if missing_mask.any():\n            group_medians = df_copy.groupby(\"HomePlanet\")[col].median()\n            df_copy.loc[missing_mask, col] = df_copy.loc[missing_mask, \"HomePlanet\"].map(group_medians)\n            global_median = df_copy[col].median()\n            df_copy[col] = df_copy[col].fillna(global_median)\n    \n    # Total spending\n    df_copy[\"TotalSpending\"] = df_copy[SPENDING].sum(axis=1)\n    \n    # Interaction: CryoSleep status and log spending\n    cryo_status = df_copy[\"CryoSleep\"].fillna(False)\n    log_spending = np.log1p(df_copy[\"TotalSpending\"])\n    df_copy[\"CryoSleep_LogSpending\"] = (\n        (cryo_status == True) * log_spending\n    )\n    \n    # Age polynomial and interactions\n    age = df_copy[\"Age\"].fillna(df_copy[\"Age\"].median())\n    df_copy[\"Age_Squared\"] = age ** 2\n    df_copy[\"Age_LogSpending\"] = age * log_spending\n    df_copy[\"Age_CryoSleep\"] = age * (cryo_status == True).astype(int)\n    \n    return df_copy\n\n\ndef add_group_features(df):\n    \"\"\"Add group-level aggregate features based on PassengerId group.\"\"\"\n    df_copy = df.copy()\n    \n    # Extract group ID\n    df_copy[\"GroupId\"] = df_copy[\"PassengerId\"].apply(extract_group_id)\n    \n    # Compute group size\n    group_sizes = df_copy.groupby(\"GroupId\").size()\n    df_copy[\"GroupSize\"] = df_copy[\"GroupId\"].map(group_sizes)\n    \n    # Compute group median total spending\n    group_median_spending = df_copy.groupby(\"GroupId\")[\"TotalSpending\"].median()\n    df_copy[\"GroupMedianSpending\"] = df_copy[\"GroupId\"].map(group_median_spending)\n    \n    return df_copy\n\n\ndef build_predict_fn():\n    train_df, _ = prepare.load_split()\n    \n    # Parse Cabin into Deck, RoomNum, Side\n    cabin_data = train_df[\"Cabin\"].apply(parse_cabin)\n    train_df[\"Deck\"] = cabin_data.apply(lambda x: x[0])\n    train_df[\"RoomNum\"] = cabin_data.apply(lambda x: x[1])\n    train_df[\"Side\"] = cabin_data.apply(lambda x: x[2])\n    \n    # Engineer features\n    train_df = engineer_features(train_df)\n    \n    # Add group-level features\n    train_df = add_group_features(train_df)\n    \n    # Create explicit missingness flags for CryoSleep and VIP\n    train_df[\"CryoSleep_Missing\"] = train_df[\"CryoSleep\"].isna().astype(int)\n    train_df[\"VIP_Missing\"] = train_df[\"VIP\"].isna().astype(int)\n    \n    # Convert CryoSleep and VIP to string for categorical encoding\n    train_df[\"CryoSleep\"] = train_df[\"CryoSleep\"].fillna(\"Unknown\").astype(str)\n    train_df[\"VIP\"] = train_df[\"VIP\"].fillna(\"Unknown\").astype(str)\n    \n    # Deck_TotalSpending interaction: map Deck to ordinal, multiply by TotalSpending\n    deck_order = {\"A\": 1, \"B\": 2, \"C\": 3, \"D\": 4, \"E\": 5, \"F\": 6, \"G\": 7, \"T\": 8}\n    deck_ordinal = train_df[\"Deck\"].map(deck_order).fillna(0)\n    train_df[\"Deck_TotalSpending\"] = deck_ordinal * train_df[\"TotalSpending\"]\n    \n    # Build feature set\n    feature_cols = (\n        [\"Age\", \"Age_Squared\", \"Age_LogSpending\", \"Age_CryoSleep\"] + \n        SPENDING + \n        [\"TotalSpending\", \"CryoSleep_LogSpending\", \"Spending_Recorded\"] +\n        CATEGORICAL + \n        [\"Deck\", \"RoomNum\", \"Side\", \"PassengerId\", \"GroupId\"] + \n        [\"CryoSleep_Missing\", \"VIP_Missing\"] +\n        [\"GroupSize\", \"GroupMedianSpending\", \"Deck_TotalSpending\"]\n    )\n    X = train_df[feature_cols]\n    y = train_df[\"Transported\"].astype(int)\n    \n    # Define preprocessing\n    numeric_transformer = Pipeline([\n        (\"imputer\", SimpleImputer(strategy=\"median\")),\n        (\"scaler\", StandardScaler()),\n    ])\n    \n    categorical_transformer = Pipeline([\n        (\"imputer\", SimpleImputer(strategy=\"most_frequent\")),\n        (\"onehot\", OneHotEncoder(handle_unknown=\"ignore\", sparse_output=False)),\n    ])\n    \n    numeric_feature_cols = (\n        [\"Age\", \"Age_Squared\", \"Age_LogSpending\", \"Age_CryoSleep\", \"CryoSleep_Missing\", \"VIP_Missing\", \"Spending_Recorded\"] + \n        SPENDING + [\"TotalSpending\", \"CryoSleep_LogSpending\", \"GroupSize\", \"GroupMedianSpending\", \"Deck_TotalSpending\"]\n    )\n    categorical_feature_cols = CATEGORICAL + [\"Deck\", \"Side\", \"PassengerId\", \"GroupId\"]\n    \n    preprocessor = ColumnTransformer([\n        (\"num\", numeric_transformer, numeric_feature_cols),\n        (\"cat\", categorical_transformer, categorical_feature_cols),\n    ])\n    \n    # XGBoost with iter 80 hyperparameters\n    pipe = Pipeline([\n        (\"preprocessor\", preprocessor),\n        (\"clf\", xgb.XGBClassifier(max_depth=6, n_estimators=100, learning_rate=0.1, random_state=42, verbosity=0)),\n    ])\n    \n    pipe.fit(X, y)\n    \n    def predict(X_val):\n        cabin_data = X_val[\"Cabin\"].apply(parse_cabin)\n        X_val_copy = X_val.copy()\n        X_val_copy[\"Deck\"] = cabin_data.apply(lambda x: x[0])\n        X_val_copy[\"RoomNum\"] = cabin_data.apply(lambda x: x[1])\n        X_val_copy[\"Side\"] = cabin_data.apply(lambda x: x[2])\n        \n        # Engineer features\n        X_val_copy = engineer_features(X_val_copy)\n        \n        # Add group-level features from training stats\n        X_val_copy[\"GroupId\"] = X_val_copy[\"PassengerId\"].apply(extract_group_id)\n        X_val_copy[\"GroupSize\"] = X_val_copy[\"GroupId\"].map(pd.Series(\n            train_df.groupby(\"GroupId\").size().to_dict()\n        ))\n        X_val_copy[\"GroupMedianSpending\"] = X_val_copy[\"GroupId\"].map(pd.Series(\n            train_df.groupby(\"GroupId\")[\"TotalSpending\"].median().to_dict()\n        ))\n        \n        # Missingness flags\n        X_val_copy[\"CryoSleep_Missing\"] = X_val_copy[\"CryoSleep\"].isna().astype(int)\n        X_val_copy[\"VIP_Missing\"] = X_val_copy[\"VIP\"].isna().astype(int)\n        \n        # Handle CryoSleep and VIP\n        X_val_copy[\"CryoSleep\"] = X_val_copy[\"CryoSleep\"].fillna(\"Unknown\").astype(str)\n        X_val_copy[\"VIP\"] = X_val_copy[\"VIP\"].fillna(\"Unknown\").astype(str)\n        \n        # Deck_TotalSpending interaction\n        deck_ordinal = X_val_copy[\"Deck\"].map(deck_order).fillna(0)\n        X_val_copy[\"Deck_TotalSpending\"] = deck_ordinal * X_val_copy[\"TotalSpending\"]\n        \n        return pipe.predict(X_val_copy[feature_cols]).astype(bool)\n    \n    return predict\n\n\nif __name__ == \"__main__\":\n    predict_fn = build_predict_fn()\n    score = prepare.evaluate(predict_fn)\n    print(f\"VAL_ACCURACY: {score:.4f}\")\n```\n</code>\n\n<notes_append>\nIteration 91: Restored iter 80 baseline (XGBoost max_depth=6, n_est=100, lr=0.1, full feature set including PassengerId, GroupId, group aggregates, polynomial age features, Deck_TotalSpending interaction) to re-confirm 0.8235 score and verify reproducibility after iter 90 regression. Feature selection by importance was unreliable; group-based and polynomial features contributed real signal despite low individual importance scores.\n</notes_append>", "reflection": "Iteration 90 removed many features (PassengerId, GroupId, group aggregates, polynomial features) and regressed to 0.8183, below the current best of 0.8235. This confirms that those features, despite having low individual importance scores, were collectively helping. The notes indicate iter 80-89 achieved 0.8235 with a richer feature set. I should revert to the iter 80 baseline and approach feature selection more carefully: instead of blindly dropping low-importance features, I should verify which removed features actually hurt generalization.", "observations": ["Iteration 90's aggressive feature removal (dropping PassengerId, GroupId, group-level aggregates, and polynomial features) caused a 0.5% accuracy drop to 0.8183, suggesting those features contained genuine signal despite appearing \"low importance\" in the diagnostic output.", "The best score of 0.8235 was achieved with a full feature set including PassengerId-derived features (GroupId, GroupSize, GroupMedianSpending) and interaction features (CryoSleep_LogSpending, Deck_TotalSpending, age polynomials).", "One-hot encoding of PassengerId and GroupId creates thousands of sparse features, which on a ~7000-row training set may actually encode real group-level structure (families, booking cohorts) rather than pure noise.", "The diagnostic approach of looking at XGBoost feature importance is unreliable for this dataset size—importance scores are noisy when features are correlated or interact non-additively, and low importance doesn't mean low signal.", "The safest next step is to restore the iter 80 configuration (which scored 0.8235) and make one targeted change: instead of feature selection by importance, try a different hyperparameter or a single new feature that has a clear domain rationale."], "hypothesis": "Restoring the iter 80 configuration (full feature set with PassengerId, GroupId, group aggregates, CryoSleep_LogSpending, Deck_TotalSpending, age polynomials) will return to 0.8235 validation accuracy. Once baseline is re-confirmed, a small data-driven change (e.g., tuning XGBoost regularization or adding a cabin-location interaction) will push above 0.8235 without the volatility of feature-selection guessing.", "plan": "I will restore the iter 80 configuration exactly: XGBoost with max_depth=6, n_estimators=100, learning_rate=0.1, all original engineered features (TotalSpending, group features, polynomial age terms, Deck_TotalSpending), and the full feature list. This re-establishes the known-good baseline at 0.8235, confirming reproducibility. Once confirmed, the next iteration can safely explore a targeted refinement.", "code": "\"\"\"\ntrain.py — Iteration 91: Restore iter 80 baseline configuration.\n\"\"\"\nimport sys, pathlib\nsys.path.insert(0, str(pathlib.Path(__file__).resolve().parent.parent))\n\nimport pandas as pd\nimport numpy as np\nimport xgboost as xgb\nfrom sklearn.impute import SimpleImputer\nfrom sklearn.pipeline import Pipeline\nfrom sklearn.preprocessing import StandardScaler, OneHotEncoder\nfrom sklearn.compose import ColumnTransformer\n\nimport prepare\n\nNUMERIC = [\"Age\", \"RoomService\", \"FoodCourt\", \"ShoppingMall\", \"Spa\", \"VRDeck\"]\nCATEGORICAL = [\"HomePlanet\", \"Destination\", \"CryoSleep\", \"VIP\"]\nSPENDING = [\"RoomService\", \"FoodCourt\", \"ShoppingMall\", \"Spa\", \"VRDeck\"]\n\n\ndef parse_cabin(cabin_str):\n    \"\"\"Parse Cabin 'F/0/S' into deck, room_num, side.\"\"\"\n    if pd.isna(cabin_str):\n        return np.nan, np.nan, np.nan\n    parts = str(cabin_str).split(\"/\")\n    if len(parts) == 3:\n        return parts[0], int(parts[1]) if parts[1].isdigit() else np.nan, parts[2]\n    return np.nan, np.nan, np.nan\n\n\ndef extract_group_id(passenger_id):\n    \"\"\"Extract group ID from PassengerId (e.g., '0001_01' -> '0001').\"\"\"\n    if pd.isna(passenger_id):\n        return np.nan\n    return str(passenger_id).split(\"_\")[0]\n\n\ndef engineer_features(df):\n    \"\"\"Engineer spending, interaction, and polynomial features.\"\"\"\n    df_copy = df.copy()\n    \n    # Track which rows have any spending data recorded\n    spending_recorded = ~df_copy[SPENDING].isna().any(axis=1)\n    df_copy[\"Spending_Recorded\"] = spending_recorded.astype(int)\n    \n    # Fill missing spending with median per HomePlanet group\n    for col in SPENDING:\n        missing_mask = df_copy[col].isna()\n        if missing_mask.any():\n            group_medians = df_copy.groupby(\"HomePlanet\")[col].median()\n            df_copy.loc[missing_mask, col] = df_copy.loc[missing_mask, \"HomePlanet\"].map(group_medians)\n            global_median = df_copy[col].median()\n            df_copy[col] = df_copy[col].fillna(global_median)\n    \n    # Total spending\n    df_copy[\"TotalSpending\"] = df_copy[SPENDING].sum(axis=1)\n    \n    # Interaction: CryoSleep status and log spending\n    cryo_status = df_copy[\"CryoSleep\"].fillna(False)\n    log_spending = np.log1p(df_copy[\"TotalSpending\"])\n    df_copy[\"CryoSleep_LogSpending\"] = (\n        (cryo_status == True) * log_spending\n    )\n    \n    # Age polynomial and interactions\n    age = df_copy[\"Age\"].fillna(df_copy[\"Age\"].median())\n    df_copy[\"Age_Squared\"] = age ** 2\n    df_copy[\"Age_LogSpending\"] = age * log_spending\n    df_copy[\"Age_CryoSleep\"] = age * (cryo_status == True).astype(int)\n    \n    return df_copy\n\n\ndef add_group_features(df):\n    \"\"\"Add group-level aggregate features based on PassengerId group.\"\"\"\n    df_copy = df.copy()\n    \n    # Extract group ID\n    df_copy[\"GroupId\"] = df_copy[\"PassengerId\"].apply(extract_group_id)\n    \n    # Compute group size\n    group_sizes = df_copy.groupby(\"GroupId\").size()\n    df_copy[\"GroupSize\"] = df_copy[\"GroupId\"].map(group_sizes)\n    \n    # Compute group median total spending\n    group_median_spending = df_copy.groupby(\"GroupId\")[\"TotalSpending\"].median()\n    df_copy[\"GroupMedianSpending\"] = df_copy[\"GroupId\"].map(group_median_spending)\n    \n    return df_copy\n\n\ndef build_predict_fn():\n    train_df, _ = prepare.load_split()\n    \n    # Parse Cabin into Deck, RoomNum, Side\n    cabin_data = train_df[\"Cabin\"].apply(parse_cabin)\n    train_df[\"Deck\"] = cabin_data.apply(lambda x: x[0])\n    train_df[\"RoomNum\"] = cabin_data.apply(lambda x: x[1])\n    train_df[\"Side\"] = cabin_data.apply(lambda x: x[2])\n    \n    # Engineer features\n    train_df = engineer_features(train_df)\n    \n    # Add group-level features\n    train_df = add_group_features(train_df)\n    \n    # Create explicit missingness flags for CryoSleep and VIP\n    train_df[\"CryoSleep_Missing\"] = train_df[\"CryoSleep\"].isna().astype(int)\n    train_df[\"VIP_Missing\"] = train_df[\"VIP\"].isna().astype(int)\n    \n    # Convert CryoSleep and VIP to string for categorical encoding\n    train_df[\"CryoSleep\"] = train_df[\"CryoSleep\"].fillna(\"Unknown\").astype(str)\n    train_df[\"VIP\"] = train_df[\"VIP\"].fillna(\"Unknown\").astype(str)\n    \n    # Deck_TotalSpending interaction: map Deck to ordinal, multiply by TotalSpending\n    deck_order = {\"A\": 1, \"B\": 2, \"C\": 3, \"D\": 4, \"E\": 5, \"F\": 6, \"G\": 7, \"T\": 8}\n    deck_ordinal = train_df[\"Deck\"].map(deck_order).fillna(0)\n    train_df[\"Deck_TotalSpending\"] = deck_ordinal * train_df[\"TotalSpending\"]\n    \n    # Build feature set\n    feature_cols = (\n        [\"Age\", \"Age_Squared\", \"Age_LogSpending\", \"Age_CryoSleep\"] + \n        SPENDING + \n        [\"TotalSpending\", \"CryoSleep_LogSpending\", \"Spending_Recorded\"] +\n        CATEGORICAL + \n        [\"Deck\", \"RoomNum\", \"Side\", \"PassengerId\", \"GroupId\"] + \n        [\"CryoSleep_Missing\", \"VIP_Missing\"] +\n        [\"GroupSize\", \"GroupMedianSpending\", \"Deck_TotalSpending\"]\n    )\n    X = train_df[feature_cols]\n    y = train_df[\"Transported\"].astype(int)\n    \n    # Define preprocessing\n    numeric_transformer = Pipeline([\n        (\"imputer\", SimpleImputer(strategy=\"median\")),\n        (\"scaler\", StandardScaler()),\n    ])\n    \n    categorical_transformer = Pipeline([\n        (\"imputer\", SimpleImputer(strategy=\"most_frequent\")),\n        (\"onehot\", OneHotEncoder(handle_unknown=\"ignore\", sparse_output=False)),\n    ])\n    \n    numeric_feature_cols = (\n        [\"Age\", \"Age_Squared\", \"Age_LogSpending\", \"Age_CryoSleep\", \"CryoSleep_Missing\", \"VIP_Missing\", \"Spending_Recorded\"] + \n        SPENDING + [\"TotalSpending\", \"CryoSleep_LogSpending\", \"GroupSize\", \"GroupMedianSpending\", \"Deck_TotalSpending\"]\n    )\n    categorical_feature_cols = CATEGORICAL + [\"Deck\", \"Side\", \"PassengerId\", \"GroupId\"]\n    \n    preprocessor = ColumnTransformer([\n        (\"num\", numeric_transformer, numeric_feature_cols),\n        (\"cat\", categorical_transformer, categorical_feature_cols),\n    ])\n    \n    # XGBoost with iter 80 hyperparameters\n    pipe = Pipeline([\n        (\"preprocessor\", preprocessor),\n        (\"clf\", xgb.XGBClassifier(max_depth=6, n_estimators=100, learning_rate=0.1, random_state=42, verbosity=0)),\n    ])\n    \n    pipe.fit(X, y)\n    \n    def predict(X_val):\n        cabin_data = X_val[\"Cabin\"].apply(parse_cabin)\n        X_val_copy = X_val.copy()\n        X_val_copy[\"Deck\"] = cabin_data.apply(lambda x: x[0])\n        X_val_copy[\"RoomNum\"] = cabin_data.apply(lambda x: x[1])\n        X_val_copy[\"Side\"] = cabin_data.apply(lambda x: x[2])\n        \n        # Engineer features\n        X_val_copy = engineer_features(X_val_copy)\n        \n        # Add group-level features from training stats\n        X_val_copy[\"GroupId\"] = X_val_copy[\"PassengerId\"].apply(extract_group_id)\n        X_val_copy[\"GroupSize\"] = X_val_copy[\"GroupId\"].map(pd.Series(\n            train_df.groupby(\"GroupId\").size().to_dict()\n        ))\n        X_val_copy[\"GroupMedianSpending\"] = X_val_copy[\"GroupId\"].map(pd.Series(\n            train_df.groupby(\"GroupId\")[\"TotalSpending\"].median().to_dict()\n        ))\n        \n        # Missingness flags\n        X_val_copy[\"CryoSleep_Missing\"] = X_val_copy[\"CryoSleep\"].isna().astype(int)\n        X_val_copy[\"VIP_Missing\"] = X_val_copy[\"VIP\"].isna().astype(int)\n        \n        # Handle CryoSleep and VIP\n        X_val_copy[\"CryoSleep\"] = X_val_copy[\"CryoSleep\"].fillna(\"Unkno