{"iteration": 0, "timestamp": "2026-05-08T21:24:27", "duration_seconds": 4.52, "agent_response_raw": null, "reflection": "(baseline — no agent call)", "observations": [], "hypothesis": null, "plan": "baseline logistic regression on raw numeric columns", "code": "\"\"\"\ntrain.py — XGBoost with cabin parsing, GroupId, and richer CryoSleep-spending interaction.\nIteration 36: Replace binary CryoSleep_NoSpending with CryoSleep_Spending_Ratio to test\nwhether the intensity of spending conditioned on cryo status improves prediction.\n\"\"\"\nimport sys, pathlib\nsys.path.insert(0, str(pathlib.Path(__file__).resolve().parent.parent))\n\nimport pandas as pd\nimport numpy as np\nimport xgboost as xgb\nfrom sklearn.impute import SimpleImputer\nfrom sklearn.pipeline import Pipeline\nfrom sklearn.preprocessing import StandardScaler, OneHotEncoder\nfrom sklearn.compose import ColumnTransformer\n\nimport prepare\n\nNUMERIC = [\"Age\", \"RoomService\", \"FoodCourt\", \"ShoppingMall\", \"Spa\", \"VRDeck\"]\nCATEGORICAL = [\"HomePlanet\", \"Destination\", \"CryoSleep\", \"VIP\"]\nSPENDING = [\"RoomService\", \"FoodCourt\", \"ShoppingMall\", \"Spa\", \"VRDeck\"]\n\n\ndef parse_cabin(cabin_str):\n    \"\"\"Parse Cabin 'F/0/S' into deck, room_num, side.\"\"\"\n    if pd.isna(cabin_str):\n        return np.nan, np.nan, np.nan\n    parts = str(cabin_str).split(\"/\")\n    if len(parts) == 3:\n        return parts[0], int(parts[1]) if parts[1].isdigit() else np.nan, parts[2]\n    return np.nan, np.nan, np.nan\n\n\ndef extract_group_id(passenger_id):\n    \"\"\"Extract group ID from PassengerId (e.g., '0001_01' -> '0001').\"\"\"\n    if pd.isna(passenger_id):\n        return np.nan\n    return str(passenger_id).split(\"_\")[0]\n\n\ndef engineer_features(df):\n    \"\"\"Engineer spending and spending-cryo interaction features.\"\"\"\n    df_copy = df.copy()\n    \n    # Fill missing spending with 0\n    for col in SPENDING:\n        df_copy[col] = df_copy[col].fillna(0)\n    \n    # Total spending\n    df_copy[\"TotalSpending\"] = df_copy[SPENDING].sum(axis=1)\n    \n    # Interaction: CryoSleep status and spending ratio\n    # For passengers in cryo-sleep, compute spending as a fraction; for others, set to 0.\n    # Use log-transformed spending to capture intensity better.\n    cryo_status = df_copy[\"CryoSleep\"].fillna(False)\n    log_spending = np.log1p(df_copy[\"TotalSpending\"])\n    df_copy[\"CryoSleep_LogSpending\"] = (\n        (cryo_status == True) * log_spending\n    )\n    \n    return df_copy\n\n\ndef build_predict_fn():\n    train_df, _ = prepare.load_split()\n    \n    # Parse Cabin into Deck, RoomNum, Side\n    cabin_data = train_df[\"Cabin\"].apply(parse_cabin)\n    train_df[\"Deck\"] = cabin_data.apply(lambda x: x[0])\n    train_df[\"RoomNum\"] = cabin_data.apply(lambda x: x[1])\n    train_df[\"Side\"] = cabin_data.apply(lambda x: x[2])\n    \n    # Extract group ID from PassengerId\n    train_df[\"GroupId\"] = train_df[\"PassengerId\"].apply(extract_group_id)\n    \n    # Engineer features\n    train_df = engineer_features(train_df)\n    \n    # Create explicit missingness flags for CryoSleep and VIP before filling\n    train_df[\"CryoSleep_Missing\"] = train_df[\"CryoSleep\"].isna().astype(int)\n    train_df[\"VIP_Missing\"] = train_df[\"VIP\"].isna().astype(int)\n    \n    # Convert CryoSleep and VIP to string for categorical encoding\n    train_df[\"CryoSleep\"] = train_df[\"CryoSleep\"].fillna(\"Unknown\").astype(str)\n    train_df[\"VIP\"] = train_df[\"VIP\"].fillna(\"Unknown\").astype(str)\n    \n    # Build feature set\n    feature_cols = (\n        [\"Age\"] + SPENDING + [\"TotalSpending\", \"CryoSleep_LogSpending\"] +\n        CATEGORICAL + \n        [\"Deck\", \"RoomNum\", \"Side\", \"GroupId\"] + \n        [\"CryoSleep_Missing\", \"VIP_Missing\"]\n    )\n    X = train_df[feature_cols]\n    y = train_df[\"Transported\"].astype(int)\n    \n    # Define preprocessing for numeric and categorical columns\n    numeric_transformer = Pipeline([\n        (\"imputer\", SimpleImputer(strategy=\"median\")),\n        (\"scaler\", StandardScaler()),\n    ])\n    \n    categorical_transformer = Pipeline([\n        (\"imputer\", SimpleImputer(strategy=\"most_frequent\")),\n        (\"onehot\", OneHotEncoder(handle_unknown=\"ignore\", sparse_output=False)),\n    ])\n    \n    numeric_feature_cols = (\n        [\"Age\", \"RoomNum\", \"CryoSleep_Missing\", \"VIP_Missing\"] + \n        SPENDING + [\"TotalSpending\", \"CryoSleep_LogSpending\"]\n    )\n    categorical_feature_cols = CATEGORICAL + [\"Deck\", \"Side\", \"GroupId\"]\n    \n    preprocessor = ColumnTransformer([\n        (\"num\", numeric_transformer, numeric_feature_cols),\n        (\"cat\", categorical_transformer, categorical_feature_cols),\n    ])\n    \n    pipe = Pipeline([\n        (\"preprocessor\", preprocessor),\n        (\"clf\", xgb.XGBClassifier(n_estimators=100, max_depth=6, learning_rate=0.1, random_state=42, verbosity=0)),\n    ])\n    \n    pipe.fit(X, y)\n    \n    def predict(X_val):\n        # Parse Cabin in validation set\n        cabin_data = X_val[\"Cabin\"].apply(parse_cabin)\n        X_val_copy = X_val.copy()\n        X_val_copy[\"Deck\"] = cabin_data.apply(lambda x: x[0])\n        X_val_copy[\"RoomNum\"] = cabin_data.apply(lambda x: x[1])\n        X_val_copy[\"Side\"] = cabin_data.apply(lambda x: x[2])\n        \n        # Extract group ID\n        X_val_copy[\"GroupId\"] = X_val_copy[\"PassengerId\"].apply(extract_group_id)\n        \n        # Engineer features\n        X_val_copy = engineer_features(X_val_copy)\n        \n        # Create explicit missingness flags for CryoSleep and VIP before filling\n        X_val_copy[\"CryoSleep_Missing\"] = X_val_copy[\"CryoSleep\"].isna().astype(int)\n        X_val_copy[\"VIP_Missing\"] = X_val_copy[\"VIP\"].isna().astype(int)\n        \n        # Handle CryoSleep and VIP\n        X_val_copy[\"CryoSleep\"] = X_val_copy[\"CryoSleep\"].fillna(\"Unknown\").astype(str)\n        X_val_copy[\"VIP\"] = X_val_copy[\"VIP\"].fillna(\"Unknown\").astype(str)\n        \n        return pipe.predict(X_val_copy[feature_cols]).astype(bool)\n    \n    return predict\n\n\nif __name__ == \"__main__\":\n    predict_fn = build_predict_fn()\n    score = prepare.evaluate(predict_fn)\n    print(f\"VAL_ACCURACY: {score:.4f}\")\n", "notes_append": null, "stdout": "VAL_ACCURACY: 0.8189\n", "stderr": "", "returncode": 0, "score": 0.8189, "previous_best": null, "kept": true, "status": "kept", "commit_hash": "30d3d09", "input_tokens": 0, "output_tokens": 0, "cost_usd": 0.0}
{"iteration": 1, "timestamp": "2026-05-08T21:24:28", "previous_best": 0.8189, "duration_seconds": 1.67, "agent_response_raw": "<reflection>\nThe best score remains 0.8189, achieved at iteration 0 with a baseline logistic regression. Despite 37 iterations of feature engineering and model variations (XGBoost, LightGBM), we've consistently plateaued at or near this baseline. The most recent attempt (iter 37) with LightGBM and aggressive regularization also yielded 0.8189, suggesting that the current feature engineering strategy is not yielding improvements. The time has come to step back, inspect the data more carefully to understand what signal actually drives the target, and test a fundamentally different feature or preprocessing approach.\n</reflection>\n\n<observations>\n- The baseline logistic regression achieves 0.8189, and despite extensive feature engineering (cabin parsing, GroupId, spending interactions, missingness flags), no improvement has been found. This suggests either: (a) the engineered features don't capture predictive signal, or (b) the models are overfitting/underfitting the engineered features.\n- The notes indicate multiple high-cardinality features (GroupId, spending ratios) were tried and removed, suggesting they may introduce noise. However, the core insight from the hints—that identifier columns encode group structure—has not been fully explored with simple aggregation-based features (e.g., group survival rate).\n- Spending columns are filled with 0 for missing values in the engineering step. This treats missing as \"no spending,\" but missing spending may indicate a fundamentally different passenger type and deserve its own feature signal.\n- The dataset is small (~8,700 rows), so robust simple features should be preferred over complex ones. A logistic regression baseline suggests the decision boundary is close to linear; overengineering for tree-based models may be counterproductive.\n- No attempt has been made to use PassengerId or GroupId as a simple aggregation feature (e.g., group size, group survival rate computed on training set), which the hints explicitly suggest may encode structure.\n</observations>\n\n<hypothesis>\nSparse, one-hot-encoded high-cardinality features (GroupId, high-cardinality Deck values) are introducing noise and harming generalization. A simpler approach using only low-cardinality features (Age, Deck, Side, spending totals, CryoSleep, VIP, HomePlanet, Destination) with straightforward imputation will outperform the current feature-heavy pipeline because the decision boundary in this dataset is closer to linear.\n</hypothesis>\n\n<plan>\nReturn to logistic regression with a minimal, clean feature set: Age, total spending, key categorical columns (HomePlanet, Destination, CryoSleep, VIP), and Deck/Side from cabin parsing (without RoomNum or GroupId). This tests whether simplicity and robustness beat feature proliferation. If this achieves >0.8189, we've found a better foundation; if not, it confirms that the feature engineering direction was correct and we need to refocus on aggregation-based features like group size or group survival rate.\n</plan>\n\n<code>\n```python\n\"\"\"\ntrain.py — Logistic regression with minimal clean feature set.\nIteration 38: Simplify to baseline-like approach with only proven features:\nAge, TotalSpending, Deck, Side, HomePlanet, Destination, CryoSleep, VIP.\nNo GroupId, no RoomNum, no high-cardinality or interaction features.\nTest whether simplicity outperforms 37 iterations of feature engineering.\n\"\"\"\nimport sys, pathlib\nsys.path.insert(0, str(pathlib.Path(__file__).resolve().parent.parent))\n\nimport pandas as pd\nimport numpy as np\nfrom sklearn.impute import SimpleImputer\nfrom sklearn.pipeline import Pipeline\nfrom sklearn.preprocessing import StandardScaler, OneHotEncoder\nfrom sklearn.compose import ColumnTransformer\nfrom sklearn.linear_model import LogisticRegression\n\nimport prepare\n\n\ndef parse_cabin(cabin_str):\n    \"\"\"Parse Cabin 'F/0/S' into deck, room_num, side.\"\"\"\n    if pd.isna(cabin_str):\n        return np.nan, np.nan, np.nan\n    parts = str(cabin_str).split(\"/\")\n    if len(parts) == 3:\n        return parts[0], int(parts[1]) if parts[1].isdigit() else np.nan, parts[2]\n    return np.nan, np.nan, np.nan\n\n\ndef build_predict_fn():\n    train_df, _ = prepare.load_split()\n    \n    # Parse Cabin into Deck and Side\n    cabin_data = train_df[\"Cabin\"].apply(parse_cabin)\n    train_df[\"Deck\"] = cabin_data.apply(lambda x: x[0])\n    train_df[\"Side\"] = cabin_data.apply(lambda x: x[2])\n    \n    # Compute TotalSpending (missing spending treated as 0)\n    spending_cols = [\"RoomService\", \"FoodCourt\", \"ShoppingMall\", \"Spa\", \"VRDeck\"]\n    for col in spending_cols:\n        train_df[col] = train_df[col].fillna(0)\n    train_df[\"TotalSpending\"] = train_df[spending_cols].sum(axis=1)\n    \n    # Build minimal clean feature set\n    numeric_features = [\"Age\", \"TotalSpending\"]\n    categorical_features = [\"HomePlanet\", \"Destination\", \"CryoSleep\", \"VIP\", \"Deck\", \"Side\"]\n    \n    feature_cols = numeric_features + categorical_features\n    X = train_df[feature_cols]\n    y = train_df[\"Transported\"].astype(int)\n    \n    # Define preprocessing\n    numeric_transformer = Pipeline([\n        (\"imputer\", SimpleImputer(strategy=\"median\")),\n        (\"scaler\", StandardScaler()),\n    ])\n    \n    categorical_transformer = Pipeline([\n        (\"imputer\", SimpleImputer(strategy=\"most_frequent\")),\n        (\"onehot\", OneHotEncoder(handle_unknown=\"ignore\", sparse_output=False)),\n    ])\n    \n    preprocessor = ColumnTransformer([\n        (\"num\", numeric_transformer, numeric_features),\n        (\"cat\", categorical_transformer, categorical_features),\n    ])\n    \n    pipe = Pipeline([\n        (\"preprocessor\", preprocessor),\n        (\"clf\", LogisticRegression(max_iter=500, random_state=42)),\n    ])\n    \n    pipe.fit(X, y)\n    \n    def predict(X_val):\n        # Parse Cabin\n        cabin_data = X_val[\"Cabin\"].apply(parse_cabin)\n        X_val_copy = X_val.copy()\n        X_val_copy[\"Deck\"] = cabin_data.apply(lambda x: x[0])\n        X_val_copy[\"Side\"] = cabin_data.apply(lambda x: x[2])\n        \n        # Compute TotalSpending\n        for col in spending_cols:\n            X_val_copy[col] = X_val_copy[col].fillna(0)\n        X_val_copy[\"TotalSpending\"] = X_val_copy[spending_cols].sum(axis=1)\n        \n        return pipe.predict(X_val_copy[feature_cols]).astype(bool)\n    \n    return predict\n\n\nif __name__ == \"__main__\":\n    predict_fn = build_predict_fn()\n    score = prepare.evaluate(predict_fn)\n    print(f\"VAL_ACCURACY: {score:.4f}\")\n```\n</code>\n\n<notes_append>\nIteration 38: Simplified to logistic regression with only minimal clean features (Age, TotalSpending, Deck, Side, HomePlanet, Destination, CryoSleep, VIP). Hypothesis: 37 iterations of feature engineering added noise; simplicity may outperform complexity. Testing whether baseline-like approach with cabin parsing beats 0.8189 plateau.\n</notes_append>", "reflection": "The best score remains 0.8189, achieved at iteration 0 with a baseline logistic regression. Despite 37 iterations of feature engineering and model variations (XGBoost, LightGBM), we've consistently plateaued at or near this baseline. The most recent attempt (iter 37) with LightGBM and aggressive regularization also yielded 0.8189, suggesting that the current feature engineering strategy is not yielding improvements. The time has come to step back, inspect the data more carefully to understand what signal actually drives the target, and test a fundamentally different feature or preprocessing approach.", "observations": ["The baseline logistic regression achieves 0.8189, and despite extensive feature engineering (cabin parsing, GroupId, spending interactions, missingness flags), no improvement has been found. This suggests either: (a) the engineered features don't capture predictive signal, or (b) the models are overfitting/underfitting the engineered features.", "The notes indicate multiple high-cardinality features (GroupId, spending ratios) were tried and removed, suggesting they may introduce noise. However, the core insight from the hints—that identifier columns encode group structure—has not been fully explored with simple aggregation-based features (e.g., group survival rate).", "Spending columns are filled with 0 for missing values in the engineering step. This treats missing as \"no spending,\" but missing spending may indicate a fundamentally different passenger type and deserve its own feature signal.", "The dataset is small (~8,700 rows), so robust simple features should be preferred over complex ones. A logistic regression baseline suggests the decision boundary is close to linear; overengineering for tree-based models may be counterproductive.", "No attempt has been made to use PassengerId or GroupId as a simple aggregation feature (e.g., group size, group survival rate computed on training set), which the hints explicitly suggest may encode structure."], "hypothesis": "Sparse, one-hot-encoded high-cardinality features (GroupId, high-cardinality Deck values) are introducing noise and harming generalization. A simpler approach using only low-cardinality features (Age, Deck, Side, spending totals, CryoSleep, VIP, HomePlanet, Destination) with straightforward imputation will outperform the current feature-heavy pipeline because the decision boundary in this dataset is closer to linear.", "plan": "Return to logistic regression with a minimal, clean feature set: Age, total spending, key categorical columns (HomePlanet, Destination, CryoSleep, VIP), and Deck/Side from cabin parsing (without RoomNum or GroupId). This tests whether simplicity and robustness beat feature proliferation. If this achieves >0.8189, we've found a better foundation; if not, it confirms that the feature engineering direction was correct and we need to refocus on aggregation-based features like group size or group survival rate.", "code": "\"\"\"\ntrain.py — Logistic regression with minimal clean feature set.\nIteration 38: Simplify to baseline-like approach with only proven features:\nAge, TotalSpending, Deck, Side, HomePlanet, Destination, CryoSleep, VIP.\nNo GroupId, no RoomNum, no high-cardinality or interaction features.\nTest whether simplicity outperforms 37 iterations of feature engineering.\n\"\"\"\nimport sys, pathlib\nsys.path.insert(0, str(pathlib.Path(__file__).resolve().parent.parent))\n\nimport pandas as pd\nimport numpy as np\nfrom sklearn.impute import SimpleImputer\nfrom sklearn.pipeline import Pipeline\nfrom sklearn.preprocessing import StandardScaler, OneHotEncoder\nfrom sklearn.compose import ColumnTransformer\nfrom sklearn.linear_model import LogisticRegression\n\nimport prepare\n\n\ndef parse_cabin(cabin_str):\n    \"\"\"Parse Cabin 'F/0/S' into deck, room_num, side.\"\"\"\n    if pd.isna(cabin_str):\n        return np.nan, np.nan, np.nan\n    parts = str(cabin_str).split(\"/\")\n    if len(parts) == 3:\n        return parts[0], int(parts[1]) if parts[1].isdigit() else np.nan, parts[2]\n    return np.nan, np.nan, np.nan\n\n\ndef build_predict_fn():\n    train_df, _ = prepare.load_split()\n    \n    # Parse Cabin into Deck and Side\n    cabin_data = train_df[\"Cabin\"].apply(parse_cabin)\n    train_df[\"Deck\"] = cabin_data.apply(lambda x: x[0])\n    train_df[\"Side\"] = cabin_data.apply(lambda x: x[2])\n    \n    # Compute TotalSpending (missing spending treated as 0)\n    spending_cols = [\"RoomService\", \"FoodCourt\", \"ShoppingMall\", \"Spa\", \"VRDeck\"]\n    for col in spending_cols:\n        train_df[col] = train_df[col].fillna(0)\n    train_df[\"TotalSpending\"] = train_df[spending_cols].sum(axis=1)\n    \n    # Build minimal clean feature set\n    numeric_features = [\"Age\", \"TotalSpending\"]\n    categorical_features = [\"HomePlanet\", \"Destination\", \"CryoSleep\", \"VIP\", \"Deck\", \"Side\"]\n    \n    feature_cols = numeric_features + categorical_features\n    X = train_df[feature_cols]\n    y = train_df[\"Transported\"].astype(int)\n    \n    # Define preprocessing\n    numeric_transformer = Pipeline([\n        (\"imputer\", SimpleImputer(strategy=\"median\")),\n        (\"scaler\", StandardScaler()),\n    ])\n    \n    categorical_transformer = Pipeline([\n        (\"imputer\", SimpleImputer(strategy=\"most_frequent\")),\n        (\"onehot\", OneHotEncoder(handle_unknown=\"ignore\", sparse_output=False)),\n    ])\n    \n    preprocessor = ColumnTransformer([\n        (\"num\", numeric_transformer, numeric_features),\n        (\"cat\", categorical_transformer, categorical_features),\n    ])\n    \n    pipe = Pipeline([\n        (\"preprocessor\", preprocessor),\n        (\"clf\", LogisticRegression(max_iter=500, random_state=42)),\n    ])\n    \n    pipe.fit(X, y)\n    \n    def predict(X_val):\n        # Parse Cabin\n        cabin_data = X_val[\"Cabin\"].apply(parse_cabin)\n        X_val_copy = X_val.copy()\n        X_val_copy[\"Deck\"] = cabin_data.apply(lambda x: x[0])\n        X_val_copy[\"Side\"] = cabin_data.apply(lambda x: x[2])\n        \n        # Compute TotalSpending\n        for col in spending_cols:\n            X_val_copy[col] = X_val_copy[col].fillna(0)\n        X_val_copy[\"TotalSpending\"] = X_val_copy[spending_cols].sum(axis=1)\n        \n        return pipe.predict(X_val_copy[feature_cols]).astype(bool)\n    \n    return predict\n\n\nif __name__ == \"__main__\":\n    predict_fn = build_predict_fn()\n    score = prepare.evaluate(predict_fn)\n    print(f\"VAL_ACCURACY: {score:.4f}\")\n", "notes_append": "Iteration 38: Simplified to logistic regression with only minimal clean features (Age, TotalSpending, Deck, Side, HomePlanet, Destination, CryoSleep, VIP). Hypothesis: 37 iterations of feature engineering added noise; simplicity may outperform complexity. Testing whether baseline-like approach with cabin parsing beats 0.8189 plateau.", "stdout": "VAL_ACCURACY: 0.7246\n", "stderr": "", "returncode": 0, "score": 0.7246, "kept": false, "status": "reverted", "commit_hash": null, "input_tokens": 4064, "output_tokens": 1883, "cost_usd": 0.013479}
