{"iteration": 3, "timestamp": "2026-05-08T23:05:02", "previous_best": 0.8235, "duration_seconds": 11.34, "agent_response_raw": "<reflection>\nThe baseline of 0.8235 is stable and confirmed across multiple iterations. The current model uses XGBoost with Cabin parsing (Deck/RoomNum/Side), spending features (TotalSpending, CryoSleep_LogSpending, Spending_Recorded), missingness flags (CryoSleep_Missing, VIP_Missing), and group-level aggregates. Recent iterations show that identifier features (PassengerId, GroupId) and structural column missingness flags (Age_Missing, RoomNum_Missing) are noise. The next direction should explore feature interactions or model tuning that preserves the clean 0.8235 baseline.\n</reflection>\n\n<observations>\n- The current model architecture is well-tuned at 0.8235 with stable components: Cabin parsing, spending aggregates, CryoSleep/VIP missingness flags, and group-level features all contribute to this score.\n- Recent experimentation has converged on identifying which features add signal (Deck, RoomNum, Side, group features) vs. noise (PassengerId, GroupId, Age_Missing, RoomNum_Missing).\n- The XGBoost hyperparameters (max_depth=6, n_estimators=100, learning_rate=0.1) were set in iter 80 and have remained stable; no systematic hyperparameter search has been conducted.\n- Group-level features (GroupSize, GroupMedianSpending) were added and kept at 0.8235, suggesting group structure in the data is real and predictive.\n- The spending features are heavily engineered (median imputation by HomePlanet, TotalSpending, CryoSleep_LogSpending interaction); there may be room to explore other spending-related interactions.\n</observations>\n\n<hypothesis>\nAdding a feature that captures whether a passenger has zero total spending (indicator of non-engagement or isolation) will improve accuracy because zero-spenders may have a different transportation likelihood than moderate or high spenders, and this is not currently captured by the log-spending interaction alone.\n</hypothesis>\n\n<plan>\nI will add a binary feature `HasZeroSpending` (1 if TotalSpending == 0, else 0) to the feature set. This is a low-cost addition that tests whether absolute zero spending is a distinct category from low spending, without adding model complexity or hyperparameter tuning.\n</plan>\n\n<code>\n```python\n\"\"\"\ntrain.py — Iteration 119: Add HasZeroSpending binary feature.\nTest whether zero spending is a distinct category from low spending.\n\"\"\"\nimport sys, pathlib\nsys.path.insert(0, str(pathlib.Path(__file__).resolve().parent.parent))\n\nimport pandas as pd\nimport numpy as np\nimport xgboost as xgb\nfrom sklearn.impute import SimpleImputer\nfrom sklearn.pipeline import Pipeline\nfrom sklearn.preprocessing import StandardScaler, OneHotEncoder\nfrom sklearn.compose import ColumnTransformer\n\nimport prepare\n\nNUMERIC = [\"Age\", \"RoomService\", \"FoodCourt\", \"ShoppingMall\", \"Spa\", \"VRDeck\"]\nCATEGORICAL = [\"HomePlanet\", \"Destination\", \"CryoSleep\", \"VIP\"]\nSPENDING = [\"RoomService\", \"FoodCourt\", \"ShoppingMall\", \"Spa\", \"VRDeck\"]\n\n\ndef parse_cabin(cabin_str):\n    \"\"\"Parse Cabin 'F/0/S' into deck, room_num, side.\"\"\"\n    if pd.isna(cabin_str):\n        return np.nan, np.nan, np.nan\n    parts = str(cabin_str).split(\"/\")\n    if len(parts) == 3:\n        return parts[0], int(parts[1]) if parts[1].isdigit() else np.nan, parts[2]\n    return np.nan, np.nan, np.nan\n\n\ndef extract_group_id(passenger_id):\n    \"\"\"Extract group ID from PassengerId (e.g., '0001_01' -> '0001').\"\"\"\n    if pd.isna(passenger_id):\n        return np.nan\n    return str(passenger_id).split(\"_\")[0]\n\n\ndef engineer_features(df):\n    \"\"\"Engineer spending and spending-cryo interaction features.\"\"\"\n    df_copy = df.copy()\n    \n    # Track which rows have any spending data recorded\n    spending_recorded = ~df_copy[SPENDING].isna().any(axis=1)\n    df_copy[\"Spending_Recorded\"] = spending_recorded.astype(int)\n    \n    # Fill missing spending with median per HomePlanet group, then global median\n    for col in SPENDING:\n        missing_mask = df_copy[col].isna()\n        if missing_mask.any():\n            group_medians = df_copy.groupby(\"HomePlanet\")[col].median()\n            df_copy.loc[missing_mask, col] = df_copy.loc[missing_mask, \"HomePlanet\"].map(group_medians)\n            global_median = df_copy[col].median()\n            df_copy[col] = df_copy[col].fillna(global_median)\n    \n    # Total spending\n    df_copy[\"TotalSpending\"] = df_copy[SPENDING].sum(axis=1)\n    \n    # Binary flag: has zero total spending\n    df_copy[\"HasZeroSpending\"] = (df_copy[\"TotalSpending\"] == 0).astype(int)\n    \n    # Interaction: CryoSleep status and log spending\n    cryo_status = df_copy[\"CryoSleep\"].fillna(False)\n    log_spending = np.log1p(df_copy[\"TotalSpending\"])\n    df_copy[\"CryoSleep_LogSpending\"] = (cryo_status == True) * log_spending\n    \n    return df_copy\n\n\ndef add_group_features(df):\n    \"\"\"Add group-level aggregate features based on PassengerId group.\"\"\"\n    df_copy = df.copy()\n    \n    # Extract group ID\n    df_copy[\"GroupId\"] = df_copy[\"PassengerId\"].apply(extract_group_id)\n    \n    # Compute group size\n    group_sizes = df_copy.groupby(\"GroupId\").size()\n    df_copy[\"GroupSize\"] = df_copy[\"GroupId\"].map(group_sizes)\n    \n    # Compute group median total spending\n    group_median_spending = df_copy.groupby(\"GroupId\")[\"TotalSpending\"].median()\n    df_copy[\"GroupMedianSpending\"] = df_copy[\"GroupId\"].map(group_median_spending)\n    \n    return df_copy\n\n\ndef build_predict_fn():\n    train_df, _ = prepare.load_split()\n    \n    # Parse Cabin into Deck, RoomNum, Side\n    cabin_data = train_df[\"Cabin\"].apply(parse_cabin)\n    train_df[\"Deck\"] = cabin_data.apply(lambda x: x[0])\n    train_df[\"RoomNum\"] = cabin_data.apply(lambda x: x[1])\n    train_df[\"Side\"] = cabin_data.apply(lambda x: x[2])\n    \n    # Engineer features\n    train_df = engineer_features(train_df)\n    \n    # Add group-level features\n    train_df = add_group_features(train_df)\n    \n    # Create explicit missingness flags for CryoSleep and VIP only\n    train_df[\"CryoSleep_Missing\"] = train_df[\"CryoSleep\"].isna().astype(int)\n    train_df[\"VIP_Missing\"] = train_df[\"VIP\"].isna().astype(int)\n    \n    # Convert CryoSleep and VIP to string for categorical encoding\n    train_df[\"CryoSleep\"] = train_df[\"CryoSleep\"].fillna(\"Unknown\").astype(str)\n    train_df[\"VIP\"] = train_df[\"VIP\"].fillna(\"Unknown\").astype(str)\n    \n    # Build feature set: order matters for reproducibility\n    feature_cols = (\n        [\"Age\"] + SPENDING + [\"TotalSpending\", \"CryoSleep_LogSpending\", \"Spending_Recorded\", \"HasZeroSpending\"] +\n        CATEGORICAL + \n        [\"Deck\", \"RoomNum\", \"Side\", \"PassengerId\", \"GroupId\"] + \n        [\"CryoSleep_Missing\", \"VIP_Missing\"] +\n        [\"GroupSize\", \"GroupMedianSpending\"]\n    )\n    X = train_df[feature_cols]\n    y = train_df[\"Transported\"].astype(int)\n    \n    # Define preprocessing\n    numeric_transformer = Pipeline([\n        (\"imputer\", SimpleImputer(strategy=\"median\")),\n        (\"scaler\", StandardScaler()),\n    ])\n    \n    categorical_transformer = Pipeline([\n        (\"imputer\", SimpleImputer(strategy=\"most_frequent\")),\n        (\"onehot\", OneHotEncoder(handle_unknown=\"ignore\", sparse_output=False)),\n    ])\n    \n    numeric_feature_cols = (\n        [\"Age\", \"RoomNum\", \"CryoSleep_Missing\", \"VIP_Missing\", \"Spending_Recorded\", \"HasZeroSpending\"] + \n        SPENDING + [\"TotalSpending\", \"CryoSleep_LogSpending\"] +\n        [\"GroupSize\", \"GroupMedianSpending\"]\n    )\n    categorical_feature_cols = CATEGORICAL + [\"Deck\", \"Side\", \"PassengerId\", \"GroupId\"]\n    \n    preprocessor = ColumnTransformer([\n        (\"num\", numeric_transformer, numeric_feature_cols),\n        (\"cat\", categorical_transformer, categorical_feature_cols),\n    ])\n    \n    # XGBoost with iter 80 hyperparameters\n    pipe = Pipeline([\n        (\"preprocessor\", preprocessor),\n        (\"clf\", xgb.XGBClassifier(\n            max_depth=6,\n            n_estimators=100,\n            learning_rate=0.1,\n            random_state=42,\n            verbosity=0\n        )),\n    ])\n    \n    pipe.fit(X, y)\n    \n    def predict(X_val):\n        cabin_data = X_val[\"Cabin\"].apply(parse_cabin)\n        X_val_copy = X_val.copy()\n        X_val_copy[\"Deck\"] = cabin_data.apply(lambda x: x[0])\n        X_val_copy[\"RoomNum\"] = cabin_data.apply(lambda x: x[1])\n        X_val_copy[\"Side\"] = cabin_data.apply(lambda x: x[2])\n        \n        # Engineer features\n        X_val_copy = engineer_features(X_val_copy)\n        \n        # Add group-level features from training stats\n        X_val_copy[\"GroupId\"] = X_val_copy[\"PassengerId\"].apply(extract_group_id)\n        X_val_copy[\"GroupSize\"] = X_val_copy[\"GroupId\"].map(pd.Series(\n            train_df.groupby(\"GroupId\").size().to_dict()\n        ))\n        X_val_copy[\"GroupMedianSpending\"] = X_val_copy[\"GroupId\"].map(pd.Series(\n            train_df.groupby(\"GroupId\")[\"TotalSpending\"].median().to_dict()\n        ))\n        \n        # Missingness flags for CryoSleep and VIP only\n        X_val_copy[\"CryoSleep_Missing\"] = X_val_copy[\"CryoSleep\"].isna().astype(int)\n        X_val_copy[\"VIP_Missing\"] = X_val_copy[\"VIP\"].isna().astype(int)\n        \n        # Handle CryoSleep and VIP\n        X_val_copy[\"CryoSleep\"] = X_val_copy[\"CryoSleep\"].fillna(\"Unknown\").astype(str)\n        X_val_copy[\"VIP\"] = X_val_copy[\"VIP\"].fillna(\"Unknown\").astype(str)\n        \n        return pipe.predict(X_val_copy[feature_cols]).astype(bool)\n    \n    return predict\n\n\nif __name__ == \"__main__\":\n    predict_fn = build_predict_fn()\n    score = prepare.evaluate(predict_fn)\n    print(f\"VAL_ACCURACY: {score:.4f}\")\n```\n</code>\n\n<notes_append>\nIteration 119: Added HasZeroSpending binary feature (1 if TotalSpending == 0, else 0). Low-cost test of whether zero spending is a distinct predictive category separate from low spending; fits with CryoSleep interaction pattern.\n</notes_append>", "reflection": "The baseline of 0.8235 is stable and confirmed across multiple iterations. The current model uses XGBoost with Cabin parsing (Deck/RoomNum/Side), spending features (TotalSpending, CryoSleep_LogSpending, Spending_Recorded), missingness flags (CryoSleep_Missing, VIP_Missing), and group-level aggregates. Recent iterations show that identifier features (PassengerId, GroupId) and structural column missingness flags (Age_Missing, RoomNum_Missing) are noise. The next direction should explore feature interactions or model tuning that preserves the clean 0.8235 baseline.", "observations": ["The current model architecture is well-tuned at 0.8235 with stable components: Cabin parsing, spending aggregates, CryoSleep/VIP missingness flags, and group-level features all contribute to this score.", "Recent experimentation has converged on identifying which features add signal (Deck, RoomNum, Side, group features) vs. noise (PassengerId, GroupId, Age_Missing, RoomNum_Missing).", "The XGBoost hyperparameters (max_depth=6, n_estimators=100, learning_rate=0.1) were set in iter 80 and have remained stable; no systematic hyperparameter search has been conducted.", "Group-level features (GroupSize, GroupMedianSpending) were added and kept at 0.8235, suggesting group structure in the data is real and predictive.", "The spending features are heavily engineered (median imputation by HomePlanet, TotalSpending, CryoSleep_LogSpending interaction); there may be room to explore other spending-related interactions."], "hypothesis": "Adding a feature that captures whether a passenger has zero total spending (indicator of non-engagement or isolation) will improve accuracy because zero-spenders may have a different transportation likelihood than moderate or high spenders, and this is not currently captured by the log-spending interaction alone.", "plan": "I will add a binary feature `HasZeroSpending` (1 if TotalSpending == 0, else 0) to the feature set. This is a low-cost addition that tests whether absolute zero spending is a distinct category from low spending, without adding model complexity or hyperparameter tuning.", "code": "\"\"\"\ntrain.py — Iteration 119: Add HasZeroSpending binary feature.\nTest whether zero spending is a distinct category from low spending.\n\"\"\"\nimport sys, pathlib\nsys.path.insert(0, str(pathlib.Path(__file__).resolve().parent.parent))\n\nimport pandas as pd\nimport numpy as np\nimport xgboost as xgb\nfrom sklearn.impute import SimpleImputer\nfrom sklearn.pipeline import Pipeline\nfrom sklearn.preprocessing import StandardScaler, OneHotEncoder\nfrom sklearn.compose import ColumnTransformer\n\nimport prepare\n\nNUMERIC = [\"Age\", \"RoomService\", \"FoodCourt\", \"ShoppingMall\", \"Spa\", \"VRDeck\"]\nCATEGORICAL = [\"HomePlanet\", \"Destination\", \"CryoSleep\", \"VIP\"]\nSPENDING = [\"RoomService\", \"FoodCourt\", \"ShoppingMall\", \"Spa\", \"VRDeck\"]\n\n\ndef parse_cabin(cabin_str):\n    \"\"\"Parse Cabin 'F/0/S' into deck, room_num, side.\"\"\"\n    if pd.isna(cabin_str):\n        return np.nan, np.nan, np.nan\n    parts = str(cabin_str).split(\"/\")\n    if len(parts) == 3:\n        return parts[0], int(parts[1]) if parts[1].isdigit() else np.nan, parts[2]\n    return np.nan, np.nan, np.nan\n\n\ndef extract_group_id(passenger_id):\n    \"\"\"Extract group ID from PassengerId (e.g., '0001_01' -> '0001').\"\"\"\n    if pd.isna(passenger_id):\n        return np.nan\n    return str(passenger_id).split(\"_\")[0]\n\n\ndef engineer_features(df):\n    \"\"\"Engineer spending and spending-cryo interaction features.\"\"\"\n    df_copy = df.copy()\n    \n    # Track which rows have any spending data recorded\n    spending_recorded = ~df_copy[SPENDING].isna().any(axis=1)\n    df_copy[\"Spending_Recorded\"] = spending_recorded.astype(int)\n    \n    # Fill missing spending with median per HomePlanet group, then global median\n    for col in SPENDING:\n        missing_mask = df_copy[col].isna()\n        if missing_mask.any():\n            group_medians = df_copy.groupby(\"HomePlanet\")[col].median()\n            df_copy.loc[missing_mask, col] = df_copy.loc[missing_mask, \"HomePlanet\"].map(group_medians)\n            global_median = df_copy[col].median()\n            df_copy[col] = df_copy[col].fillna(global_median)\n    \n    # Total spending\n    df_copy[\"TotalSpending\"] = df_copy[SPENDING].sum(axis=1)\n    \n    # Binary flag: has zero total spending\n    df_copy[\"HasZeroSpending\"] = (df_copy[\"TotalSpending\"] == 0).astype(int)\n    \n    # Interaction: CryoSleep status and log spending\n    cryo_status = df_copy[\"CryoSleep\"].fillna(False)\n    log_spending = np.log1p(df_copy[\"TotalSpending\"])\n    df_copy[\"CryoSleep_LogSpending\"] = (cryo_status == True) * log_spending\n    \n    return df_copy\n\n\ndef add_group_features(df):\n    \"\"\"Add group-level aggregate features based on PassengerId group.\"\"\"\n    df_copy = df.copy()\n    \n    # Extract group ID\n    df_copy[\"GroupId\"] = df_copy[\"PassengerId\"].apply(extract_group_id)\n    \n    # Compute group size\n    group_sizes = df_copy.groupby(\"GroupId\").size()\n    df_copy[\"GroupSize\"] = df_copy[\"GroupId\"].map(group_sizes)\n    \n    # Compute group median total spending\n    group_median_spending = df_copy.groupby(\"GroupId\")[\"TotalSpending\"].median()\n    df_copy[\"GroupMedianSpending\"] = df_copy[\"GroupId\"].map(group_median_spending)\n    \n    return df_copy\n\n\ndef build_predict_fn():\n    train_df, _ = prepare.load_split()\n    \n    # Parse Cabin into Deck, RoomNum, Side\n    cabin_data = train_df[\"Cabin\"].apply(parse_cabin)\n    train_df[\"Deck\"] = cabin_data.apply(lambda x: x[0])\n    train_df[\"RoomNum\"] = cabin_data.apply(lambda x: x[1])\n    train_df[\"Side\"] = cabin_data.apply(lambda x: x[2])\n    \n    # Engineer features\n    train_df = engineer_features(train_df)\n    \n    # Add group-level features\n    train_df = add_group_features(train_df)\n    \n    # Create explicit missingness flags for CryoSleep and VIP only\n    train_df[\"CryoSleep_Missing\"] = train_df[\"CryoSleep\"].isna().astype(int)\n    train_df[\"VIP_Missing\"] = train_df[\"VIP\"].isna().astype(int)\n    \n    # Convert CryoSleep and VIP to string for categorical encoding\n    train_df[\"CryoSleep\"] = train_df[\"CryoSleep\"].fillna(\"Unknown\").astype(str)\n    train_df[\"VIP\"] = train_df[\"VIP\"].fillna(\"Unknown\").astype(str)\n    \n    # Build feature set: order matters for reproducibility\n    feature_cols = (\n        [\"Age\"] + SPENDING + [\"TotalSpending\", \"CryoSleep_LogSpending\", \"Spending_Recorded\", \"HasZeroSpending\"] +\n        CATEGORICAL + \n        [\"Deck\", \"RoomNum\", \"Side\", \"PassengerId\", \"GroupId\"] + \n        [\"CryoSleep_Missing\", \"VIP_Missing\"] +\n        [\"GroupSize\", \"GroupMedianSpending\"]\n    )\n    X = train_df[feature_cols]\n    y = train_df[\"Transported\"].astype(int)\n    \n    # Define preprocessing\n    numeric_transformer = Pipeline([\n        (\"imputer\", SimpleImputer(strategy=\"median\")),\n        (\"scaler\", StandardScaler()),\n    ])\n    \n    categorical_transformer = Pipeline([\n        (\"imputer\", SimpleImputer(strategy=\"most_frequent\")),\n        (\"onehot\", OneHotEncoder(handle_unknown=\"ignore\", sparse_output=False)),\n    ])\n    \n    numeric_feature_cols = (\n        [\"Age\", \"RoomNum\", \"CryoSleep_Missing\", \"VIP_Missing\", \"Spending_Recorded\", \"HasZeroSpending\"] + \n        SPENDING + [\"TotalSpending\", \"CryoSleep_LogSpending\"] +\n        [\"GroupSize\", \"GroupMedianSpending\"]\n    )\n    categorical_feature_cols = CATEGORICAL + [\"Deck\", \"Side\", \"PassengerId\", \"GroupId\"]\n    \n    preprocessor = ColumnTransformer([\n        (\"num\", numeric_transformer, numeric_feature_cols),\n        (\"cat\", categorical_transformer, categorical_feature_cols),\n    ])\n    \n    # XGBoost with iter 80 hyperparameters\n    pipe = Pipeline([\n        (\"preprocessor\", preprocessor),\n        (\"clf\", xgb.XGBClassifier(\n            max_depth=6,\n            n_estimators=100,\n            learning_rate=0.1,\n            random_state=42,\n            verbosity=0\n        )),\n    ])\n    \n    pipe.fit(X, y)\n    \n    def predict(X_val):\n        cabin_data = X_val[\"Cabin\"].apply(parse_cabin)\n        X_val_copy = X_val.copy()\n        X_val_copy[\"Deck\"] = cabin_data.apply(lambda x: x[0])\n        X_val_copy[\"RoomNum\"] = cabin_data.apply(lambda x: x[1])\n        X_val_copy[\"Side\"] = cabin_data.apply(lambda x: x[2])\n        \n        # Engineer features\n        X_val_copy = engineer_features(X_val_copy)\n        \n        # Add group-level features from training stats\n        X_val_copy[\"GroupId\"] = X_val_copy[\"PassengerId\"].apply(extract_group_id)\n        X_val_copy[\"GroupSize\"] = X_val_copy[\"GroupId\"].map(pd.Series(\n            train_df.groupby(\"GroupId\").size().to_dict()\n        ))\n        X_val_copy[\"GroupMedianSpending\"] = X_val_copy[\"GroupId\"].map(pd.Series(\n            train_df.groupby(\"GroupId\")[\"TotalSpending\"].median().to_dict()\n        ))\n        \n        # Missingness flags for CryoSleep and VIP only\n        X_val_copy[\"CryoSleep_Missing\"] = X_val_copy[\"CryoSleep\"].isna().astype(int)\n        X_val_copy[\"VIP_Missing\"] = X_val_copy[\"VIP\"].isna().astype(int)\n        \n        # Handle CryoSleep and VIP\n        X_val_copy[\"CryoSleep\"] = X_val_copy[\"CryoSleep\"].fillna(\"Unknown\").astype(str)\n        X_val_copy[\"VIP\"] = X_val_copy[\"VIP\"].fillna(\"Unknown\").astype(str)\n        \n        return pipe.predict(X_val_copy[feature_cols]).astype(bool)\n    \n    return predict\n\n\nif __name__ == \"__main__\":\n    predict_fn = build_predict_fn()\n    score = prepare.evaluate(predict_fn)\n    print(f\"VAL_ACCURACY: {score:.4f}\")\n", "notes_append": "Iteration 119: Added HasZeroSpending binary feature (1 if TotalSpending == 0, else 0). Low-cost test of whether zero spending is a distinct predictive category separate from low spending; fits with CryoSleep interaction pattern.", "stdout": "VAL_ACCURACY: 0.8125\n", "stderr": "", "returncode": 0, "score": 0.8125, "kept": false, "status": "reverted", "commit_hash": null, "input_tokens": 4860, "output_tokens": 3059, "cost_usd": 0.020155}
