{"iteration": 5, "timestamp": "2026-05-08T21:28:20", "previous_best": 0.8229, "duration_seconds": 0, "agent_response_raw": "<reflection>\nExcellent: the last run restored 0.8229, confirming that the pandas CoW fix was necessary and the smart spending imputation + Spending_Recorded flag is a solid foundation. We're now at the baseline established in iteration 1. The notes show we've already tried group aggregates (iter 44, regressed to 0.8114), so that direction is exhausted. Time to explore a structurally different angle: the Cabin data (deck/room/side) and PassengerId group structure may encode more signal if engineered differently, or we may be missing interactions between cabin position and other features.\n</reflection>\n\n<observations>\n- We've confirmed 0.8229 is repeatable and the smart spending imputation (median per HomePlanet + Spending_Recorded flag) is working correctly after fixing the CoW issue.\n- Group aggregates (GroupSize, GroupMedianAge, GroupMeanSpending) regressed to 0.8114 in iteration 44, so that engineering direction is a dead end.\n- The Cabin parsing (Deck, RoomNum, Side) is implemented but RoomNum is sparse/noisy and may not be contributing positively. The hints mention \"identifier columns can encode group structure\" — we extract GroupId but don't deeply explore spatial patterns (e.g., are passengers from the same group or deck more likely to travel together?).\n- We haven't tried interactions between Cabin features and spending/cryo status, or between Deck and HomePlanet (structural correlations on the ship).\n- Three iterations of small tweaks to the same XGBoost pipeline suggest we should either (a) try a different model class, or (b) engineer fundamentally different features. Let's try the latter: cabin spatial structure + deck-destination correlations.\n</observations>\n\n<hypothesis>\nDeck position and room number patterns combined with destination and spending behaviour encode additional signal that a raw categorical split misses. Specifically, high-spending passengers on certain decks may have different transportation outcomes than those on others; engineering a Deck-Destination or Deck-TotalSpending interaction will capture this structure and improve accuracy beyond 0.8229.\n</hypothesis>\n\n<plan>\nI will add two new interaction features: (1) Deck-Destination cross-product (one-hot encoded), and (2) Deck-TotalSpending interaction (continuous). These capture spatial structure the current model treats independently. I'll add them to the feature list and re-train the XGBoost pipeline to test whether this localised structure improves generalisation.\n</plan>\n\n<code>\n```python\n\"\"\"\ntrain.py — Iteration 47: Add Deck-Destination and Deck-TotalSpending interactions.\nHypothesis: cabin spatial position (Deck) combined with travel destination or spending\nbehaviour encodes group structure not captured by treating these features independently.\n\"\"\"\nimport sys, pathlib\nsys.path.insert(0, str(pathlib.Path(__file__).resolve().parent.parent))\n\nimport pandas as pd\nimport numpy as np\nimport xgboost as xgb\nfrom sklearn.impute import SimpleImputer\nfrom sklearn.pipeline import Pipeline\nfrom sklearn.preprocessing import StandardScaler, OneHotEncoder\nfrom sklearn.compose import ColumnTransformer\n\nimport prepare\n\nNUMERIC = [\"Age\", \"RoomService\", \"FoodCourt\", \"ShoppingMall\", \"Spa\", \"VRDeck\"]\nCATEGORICAL = [\"HomePlanet\", \"Destination\", \"CryoSleep\", \"VIP\"]\nSPENDING = [\"RoomService\", \"FoodCourt\", \"ShoppingMall\", \"Spa\", \"VRDeck\"]\n\n\ndef parse_cabin(cabin_str):\n    \"\"\"Parse Cabin 'F/0/S' into deck, room_num, side.\"\"\"\n    if pd.isna(cabin_str):\n        return np.nan, np.nan, np.nan\n    parts = str(cabin_str).split(\"/\")\n    if len(parts) == 3:\n        return parts[0], int(parts[1]) if parts[1].isdigit() else np.nan, parts[2]\n    return np.nan, np.nan, np.nan\n\n\ndef extract_group_id(passenger_id):\n    \"\"\"Extract group ID from PassengerId (e.g., '0001_01' -> '0001').\"\"\"\n    if pd.isna(passenger_id):\n        return np.nan\n    return str(passenger_id).split(\"_\")[0]\n\n\ndef engineer_features(df):\n    \"\"\"Engineer spending and spending-cryo interaction features.\"\"\"\n    df_copy = df.copy()\n    \n    # Track which spending values were originally recorded (not missing)\n    spending_recorded = ~df_copy[SPENDING].isna().any(axis=1)\n    df_copy[\"Spending_Recorded\"] = spending_recorded.astype(int)\n    \n    # Fill missing spending with median per HomePlanet group\n    for col in SPENDING:\n        missing_mask = df_copy[col].isna()\n        if missing_mask.any():\n            # Compute median per HomePlanet (ignoring NaN within groups)\n            group_medians = df_copy.groupby(\"HomePlanet\")[col].median()\n            # Fill group-wise; any remaining NaN (if whole planet has no data) use global median\n            df_copy.loc[missing_mask, col] = df_copy.loc[missing_mask, \"HomePlanet\"].map(group_medians)\n            global_median = df_copy[col].median()\n            # Fix: use direct assignment instead of inplace to avoid CoW issues\n            df_copy[col] = df_copy[col].fillna(global_median)\n    \n    # Total spending\n    df_copy[\"TotalSpending\"] = df_copy[SPENDING].sum(axis=1)\n    \n    # Interaction: CryoSleep status and spending ratio\n    cryo_status = df_copy[\"CryoSleep\"].fillna(False)\n    log_spending = np.log1p(df_copy[\"TotalSpending\"])\n    df_copy[\"CryoSleep_LogSpending\"] = (\n        (cryo_status == True) * log_spending\n    )\n    \n    # New: Deck-Destination interaction (categorical cross-product)\n    # Create a combined feature encoding (Deck, Destination) pairs\n    df_copy[\"Deck_Destination\"] = (\n        df_copy[\"Deck\"].fillna(\"U\") + \"_\" + df_copy[\"Destination\"].fillna(\"U\")\n    )\n    \n    # New: Deck-TotalSpending interaction (numeric)\n    # Encode Deck as numeric for interaction (A=1, B=2, ..., T=20)\n    deck_to_num = {chr(65 + i): i + 1 for i in range(26)}\n    deck_numeric = df_copy[\"Deck\"].apply(lambda x: deck_to_num.get(x, 0) if pd.notna(x) else 0)\n    df_copy[\"Deck_TotalSpending\"] = deck_numeric * df_copy[\"TotalSpending\"]\n    \n    return df_copy\n\n\ndef build_predict_fn():\n    train_df, _ = prepare.load_split()\n    \n    # Parse Cabin into Deck, RoomNum, Side\n    cabin_data = train_df[\"Cabin\"].apply(parse_cabin)\n    train_df[\"Deck\"] = cabin_data.apply(lambda x: x[0])\n    train_df[\"RoomNum\"] = cabin_data.apply(lambda x: x[1])\n    train_df[\"Side\"] = cabin_data.apply(lambda x: x[2])\n    \n    # Extract group ID from PassengerId\n    train_df[\"GroupId\"] = train_df[\"PassengerId\"].apply(extract_group_id)\n    \n    # Engineer features (including smart spending imputation and new interactions)\n    train_df = engineer_features(train_df)\n    \n    # Create explicit missingness flags for CryoSleep and VIP before filling\n    train_df[\"CryoSleep_Missing\"] = train_df[\"CryoSleep\"].isna().astype(int)\n    train_df[\"VIP_Missing\"] = train_df[\"VIP\"].isna().astype(int)\n    \n    # Convert CryoSleep and VIP to string for categorical encoding\n    train_df[\"CryoSleep\"] = train_df[\"CryoSleep\"].fillna(\"Unknown\").astype(str)\n    train_df[\"VIP\"] = train_df[\"VIP\"].fillna(\"Unknown\").astype(str)\n    \n    # Build feature set (now including Deck_Destination and Deck_TotalSpending)\n    feature_cols = (\n        [\"Age\"] + SPENDING + [\"TotalSpending\", \"CryoSleep_LogSpending\", \"Spending_Recorded\"] +\n        CATEGORICAL + \n        [\"Deck\", \"RoomNum\", \"Side\", \"GroupId\", \"Deck_Destination\", \"Deck_TotalSpending\"] + \n        [\"CryoSleep_Missing\", \"VIP_Missing\"]\n    )\n    X = train_df[feature_cols]\n    y = train_df[\"Transported\"].astype(int)\n    \n    # Define preprocessing for numeric and categorical columns\n    numeric_transformer = Pipeline([\n        (\"imputer\", SimpleImputer(strategy=\"median\")),\n        (\"scaler\", StandardScaler()),\n    ])\n    \n    categorical_transformer = Pipeline([\n        (\"imputer\", SimpleImputer(strategy=\"most_frequent\")),\n        (\"onehot\", OneHotEncoder(handle_unknown=\"ignore\", sparse_output=False)),\n    ])\n    \n    numeric_feature_cols = (\n        [\"Age\", \"RoomNum\", \"CryoSleep_Missing\", \"VIP_Missing\", \"Spending_Recorded\"] + \n        SPENDING + [\"TotalSpending\", \"CryoSleep_LogSpending\", \"Deck_TotalSpending\"]\n    )\n    categorical_feature_cols = CATEGORICAL + [\"Deck\", \"Side\", \"GroupId\", \"Deck_Destination\"]\n    \n    preprocessor = ColumnTransformer([\n        (\"num\", numeric_transformer, numeric_feature_cols),\n        (\"cat\", categorical_transformer, categorical_feature_cols),\n    ])\n    \n    pipe = Pipeline([\n        (\"preprocessor\", preprocessor),\n        (\"clf\", xgb.XGBClassifier(n_estimators=100, max_depth=6, learning_rate=0.1, random_state=42, verbosity=0)),\n    ])\n    \n    pipe.fit(X, y)\n    \n    def predict(X_val):\n        # Parse Cabin in validation set\n        cabin_data = X_val[\"Cabin\"].apply(parse_cabin)\n        X_val_copy = X_val.copy()\n        X_val_copy[\"Deck\"] = cabin_data.apply(lambda x: x[0])\n        X_val_copy[\"RoomNum\"] = cabin_data.apply(lambda x: x[1])\n        X_val_copy[\"Side\"] = cabin_data.apply(lambda x: x[2])\n        \n        # Extract group ID\n        X_val_copy[\"GroupId\"] = X_val_copy[\"PassengerId\"].apply(extract_group_id)\n        \n        # Engineer features (using same smart spending imputation and interactions)\n        X_val_copy = engineer_features(X_val_copy)\n        \n        # Create explicit missingness flags for CryoSleep and VIP before filling\n        X_val_copy[\"CryoSleep_Missing\"] = X_val_copy[\"CryoSleep\"].isna().astype(int)\n        X_val_copy[\"VIP_Missing\"] = X_val_copy[\"VIP\"].isna().astype(int)\n        \n        # Handle CryoSleep and VIP\n        X_val_copy[\"CryoSleep\"] = X_val_copy[\"CryoSleep\"].fillna(\"Unknown\").astype(str)\n        X_val_copy[\"VIP\"] = X_val_copy[\"VIP\"].fillna(\"Unknown\").astype(str)\n        \n        return pipe.predict(X_val_copy[feature_cols]).astype(bool)\n    \n    return predict\n\n\nif __name__ == \"__main__\":\n    predict_fn = build_predict_fn()\n    score = prepare.evaluate(predict_fn)\n    print(f\"VAL_ACCURACY: {score:.4f}\")\n```\n</code>\n\n", "reflection": null, "observations": [], "hypothesis": null, "plan": null, "code": null, "notes_append": null, "stdout": "", "stderr": "missing <notes_append> tag", "returncode": null, "score": null, "kept": false, "status": "parse_failed", "commit_hash": null, "input_tokens": 4419, "output_tokens": 3000, "cost_usd": 0.019419}
{"iteration": 6, "timestamp": "2026-05-08T21:28:42", "previous_best": 0.8229, "duration_seconds": 0, "agent_response_raw": "<reflection>\nExcellent! Iteration 46 successfully restored the 0.8229 baseline by fixing the pandas CoW (Copy-on-Write) chained assignment issue. The fix of replacing `inplace=True` with direct assignment in `engineer_features` was the right move. Now that the baseline is solid and confirmed, I should investigate what structural improvements might push beyond 0.8229 without adding unjustified complexity.\n</reflection>\n\n<observations>\n- The 0.8229 score is now confirmed stable after fixing the pandas CoW bug. The smart spending imputation (median per HomePlanet + global fallback) and Spending_Recorded flag are working as intended.\n- The notes show that iterations 43–45 experimented with group-level aggregates (GroupSize, GroupMedianAge, GroupMeanSpending) which regressed to 0.8114. This suggests that naive group aggregation adds noise rather than signal, but it doesn't rule out more careful group-based features.\n- The current feature set includes cabin parsing (Deck, RoomNum, Side), CryoSleep/VIP missingness flags, and interaction features (CryoSleep_LogSpending). The model is XGBoost with modest hyperparameters (n_estimators=100, max_depth=6, lr=0.1).\n- Earlier notes mention that \"identifier columns can encode group structure\" and that some columns encode multiple pieces of information. The PassengerId prefix (GroupId) is extracted but used only as a categorical feature; we're not leveraging the structure of groups beyond that.\n- A potentially untapped signal: within a group (same GroupId), passengers may travel together, meaning their transportation status is correlated. A simpler approach than aggregate stats might be to encode whether a passenger is in a group vs. alone (binary flag).\n</observations>\n\n<hypothesis>\nAdding a simple binary flag indicating whether a passenger is in a group (GroupSize > 1 derived from GroupId) will improve accuracy beyond 0.8229, because group membership may be predictive of transportation risk without introducing the noise that full group statistics did.\n</hypothesis>\n\n<plan>\nI will add a lightweight \"InGroup\" binary feature: compute GroupSize (count of passengers sharing the same GroupId) and create an InGroup flag that is 1 if GroupSize > 1, else 0. This is much simpler than aggregating group statistics, captures whether a passenger travels alone or in a cohort, and tests whether group membership itself (not group averages) is predictive. I'll add this to the feature set and re-run.\n</plan>\n\n<code>\n```python\n\"\"\"\ntrain.py — Iteration 47: Add lightweight group membership flag.\nCompute GroupSize from GroupId and add InGroup binary flag (1 if traveling with others, 0 if alone).\nThis tests whether group membership structure encodes transportation risk without the noise of\nfull group aggregates that regressed in previous iterations.\n\"\"\"\nimport sys, pathlib\nsys.path.insert(0, str(pathlib.Path(__file__).resolve().parent.parent))\n\nimport pandas as pd\nimport numpy as np\nimport xgboost as xgb\nfrom sklearn.impute import SimpleImputer\nfrom sklearn.pipeline import Pipeline\nfrom sklearn.preprocessing import StandardScaler, OneHotEncoder\nfrom sklearn.compose import ColumnTransformer\n\nimport prepare\n\nNUMERIC = [\"Age\", \"RoomService\", \"FoodCourt\", \"ShoppingMall\", \"Spa\", \"VRDeck\"]\nCATEGORICAL = [\"HomePlanet\", \"Destination\", \"CryoSleep\", \"VIP\"]\nSPENDING = [\"RoomService\", \"FoodCourt\", \"ShoppingMall\", \"Spa\", \"VRDeck\"]\n\n\ndef parse_cabin(cabin_str):\n    \"\"\"Parse Cabin 'F/0/S' into deck, room_num, side.\"\"\"\n    if pd.isna(cabin_str):\n        return np.nan, np.nan, np.nan\n    parts = str(cabin_str).split(\"/\")\n    if len(parts) == 3:\n        return parts[0], int(parts[1]) if parts[1].isdigit() else np.nan, parts[2]\n    return np.nan, np.nan, np.nan\n\n\ndef extract_group_id(passenger_id):\n    \"\"\"Extract group ID from PassengerId (e.g., '0001_01' -> '0001').\"\"\"\n    if pd.isna(passenger_id):\n        return np.nan\n    return str(passenger_id).split(\"_\")[0]\n\n\ndef engineer_features(df):\n    \"\"\"Engineer spending and spending-cryo interaction features.\"\"\"\n    df_copy = df.copy()\n    \n    # Track which spending values were originally recorded (not missing)\n    spending_recorded = ~df_copy[SPENDING].isna().any(axis=1)\n    df_copy[\"Spending_Recorded\"] = spending_recorded.astype(int)\n    \n    # Fill missing spending with median per HomePlanet group\n    for col in SPENDING:\n        missing_mask = df_copy[col].isna()\n        if missing_mask.any():\n            # Compute median per HomePlanet (ignoring NaN within groups)\n            group_medians = df_copy.groupby(\"HomePlanet\")[col].median()\n            # Fill group-wise; any remaining NaN (if whole planet has no data) use global median\n            df_copy.loc[missing_mask, col] = df_copy.loc[missing_mask, \"HomePlanet\"].map(group_medians)\n            global_median = df_copy[col].median()\n            # Fix: use direct assignment instead of inplace to avoid CoW issues\n            df_copy[col] = df_copy[col].fillna(global_median)\n    \n    # Total spending\n    df_copy[\"TotalSpending\"] = df_copy[SPENDING].sum(axis=1)\n    \n    # Interaction: CryoSleep status and spending ratio\n    cryo_status = df_copy[\"CryoSleep\"].fillna(False)\n    log_spending = np.log1p(df_copy[\"TotalSpending\"])\n    df_copy[\"CryoSleep_LogSpending\"] = (\n        (cryo_status == True) * log_spending\n    )\n    \n    return df_copy\n\n\ndef build_predict_fn():\n    train_df, _ = prepare.load_split()\n    \n    # Parse Cabin into Deck, RoomNum, Side\n    cabin_data = train_df[\"Cabin\"].apply(parse_cabin)\n    train_df[\"Deck\"] = cabin_data.apply(lambda x: x[0])\n    train_df[\"RoomNum\"] = cabin_data.apply(lambda x: x[1])\n    train_df[\"Side\"] = cabin_data.apply(lambda x: x[2])\n    \n    # Extract group ID from PassengerId\n    train_df[\"GroupId\"] = train_df[\"PassengerId\"].apply(extract_group_id)\n    \n    # Compute group size and InGroup flag\n    group_sizes = train_df[\"GroupId\"].value_counts()\n    train_df[\"GroupSize\"] = train_df[\"GroupId\"].map(group_sizes)\n    train_df[\"InGroup\"] = (train_df[\"GroupSize\"] > 1).astype(int)\n    \n    # Engineer features (including smart spending imputation)\n    train_df = engineer_features(train_df)\n    \n    # Create explicit missingness flags for CryoSleep and VIP before filling\n    train_df[\"CryoSleep_Missing\"] = train_df[\"CryoSleep\"].isna().astype(int)\n    train_df[\"VIP_Missing\"] = train_df[\"VIP\"].isna().astype(int)\n    \n    # Convert CryoSleep and VIP to string for categorical encoding\n    train_df[\"CryoSleep\"] = train_df[\"CryoSleep\"].fillna(\"Unknown\").astype(str)\n    train_df[\"VIP\"] = train_df[\"VIP\"].fillna(\"Unknown\").astype(str)\n    \n    # Build feature set\n    feature_cols = (\n        [\"Age\"] + SPENDING + [\"TotalSpending\", \"CryoSleep_LogSpending\", \"Spending_Recorded\", \"InGroup\"] +\n        CATEGORICAL + \n        [\"Deck\", \"RoomNum\", \"Side\", \"GroupId\"] + \n        [\"CryoSleep_Missing\", \"VIP_Missing\"]\n    )\n    X = train_df[feature_cols]\n    y = train_df[\"Transported\"].astype(int)\n    \n    # Define preprocessing for numeric and categorical columns\n    numeric_transformer = Pipeline([\n        (\"imputer\", SimpleImputer(strategy=\"median\")),\n        (\"scaler\", StandardScaler()),\n    ])\n    \n    categorical_transformer = Pipeline([\n        (\"imputer\", SimpleImputer(strategy=\"most_frequent\")),\n        (\"onehot\", OneHotEncoder(handle_unknown=\"ignore\", sparse_output=False)),\n    ])\n    \n    numeric_feature_cols = (\n        [\"Age\", \"RoomNum\", \"CryoSleep_Missing\", \"VIP_Missing\", \"Spending_Recorded\", \"InGroup\"] + \n        SPENDING + [\"TotalSpending\", \"CryoSleep_LogSpending\"]\n    )\n    categorical_feature_cols = CATEGORICAL + [\"Deck\", \"Side\", \"GroupId\"]\n    \n    preprocessor = ColumnTransformer([\n        (\"num\", numeric_transformer, numeric_feature_cols),\n        (\"cat\", categorical_transformer, categorical_feature_cols),\n    ])\n    \n    pipe = Pipeline([\n        (\"preprocessor\", preprocessor),\n        (\"clf\", xgb.XGBClassifier(n_estimators=100, max_depth=6, learning_rate=0.1, random_state=42, verbosity=0)),\n    ])\n    \n    pipe.fit(X, y)\n    \n    def predict(X_val):\n        # Parse Cabin in validation set\n        cabin_data = X_val[\"Cabin\"].apply(parse_cabin)\n        X_val_copy = X_val.copy()\n        X_val_copy[\"Deck\"] = cabin_data.apply(lambda x: x[0])\n        X_val_copy[\"RoomNum\"] = cabin_data.apply(lambda x: x[1])\n        X_val_copy[\"Side\"] = cabin_data.apply(lambda x: x[2])\n        \n        # Extract group ID\n        X_val_copy[\"GroupId\"] = X_val_copy[\"PassengerId\"].apply(extract_group_id)\n        \n        # Compute group size and InGroup flag using training set distribution as fallback\n        # For validation, use the training group sizes where available; default unknown to solo\n        group_sizes = train_df[\"GroupId\"].value_counts()\n        X_val_copy[\"GroupSize\"] = X_val_copy[\"GroupId\"].map(group_sizes).fillna(1).astype(int)\n        X_val_copy[\"InGroup\"] = (X_val_copy[\"GroupSize\"] > 1).astype(int)\n        \n        # Engineer features (using same smart spending imputation)\n        X_val_copy = engineer_features(X_val_copy)\n        \n        # Create explicit missingness flags for CryoSleep and VIP before filling\n        X_val_copy[\"CryoSleep_Missing\"] = X_val_copy[\"CryoSleep\"].isna().astype(int)\n        X_val_copy[\"VIP_Missing\"] = X_val_copy[\"VIP\"].isna().astype(int)\n        \n        # Handle CryoSleep and VIP\n        X_val_copy[\"CryoSleep\"] = X_val_copy[\"CryoSleep\"].fillna(\"Unknown\").astype(str)\n        X_val_copy[\"VIP\"] = X_val_copy[\"VIP\"].fillna(\"Unknown\").astype(str)\n        \n        return pipe.predict(X_val_copy[feature_cols]).astype(bool)\n    \n    return predict\n\n\nif __name__ == \"__main__\":\n    predict_fn = build_predict_fn()\n    score = prepare.evaluate(predict_fn)\n    print(f\"VAL_ACCURACY: {score:.4f}\")\n```\n</code>\n\n<notes_append>\nIteration 47: Added lightweight InGroup binary flag (1 if passenger's GroupId has size > 1, else 0) to test whether group membership structure is predictive", "reflection": null, "observations": [], "hypothesis": null, "plan": null, "code": null, "notes_append": null, "stdout": "", "stderr": "missing <notes_append> tag", "returncode": null, "score": null, "kept": false, "status": "parse_failed", "commit_hash": null, "input_tokens": 4386, "output_tokens": 3000, "cost_usd": 0.019386}
