{"iteration": 2, "timestamp": "2026-05-08T20:51:33", "previous_best": 0.7901, "duration_seconds": 1.69, "agent_response_raw": "<reflection>\nThe baseline logistic regression with minimal feature engineering (Cabin parsing, GroupId, spending-as-zero, Unknown handling) holds at 0.7901. Recent iterations added TotalSpending, GroupSize, PersonId, AnySpending, and AgeMissing features, none of which improved the score — they were reverted in iteration 9. The current best remains 0.7901, suggesting we've plateaued with this feature set and model class. It's time to try a structurally different approach: either a different model (tree-based with proper regularization), or a radically different feature representation.\n</reflection>\n\n<observations>\n- The logistic regression baseline is robust and holds steady at 0.7901 across multiple feature engineering attempts (TotalSpending, GroupSize, PersonId, AnySpending, AgeMissing all failed to improve or were noise).\n- We have already parsed Cabin into Deck/RoomNum/Side and extracted GroupId from PassengerId. These structural features are being used but may not be fully exploited by logistic regression.\n- Spending columns are treated as zero when missing, which is reasonable (non-spending), but logistic regression may not capture the non-linear patterns that tree-based models could find.\n- One-hot encoding with handle_unknown=\"ignore\" successfully handles unseen categorical values in validation, which is why the pipeline is robust.\n- We haven't tried XGBoost with proper handling of categorical variables (via label encoding with fit-time category discovery, or native categorical support) since the label-encoding attempt failed due to GroupId mismatch.\n</observations>\n\n<hypothesis>\nXGBoost with LabelEncoder applied at preprocessing time (encoding training categories once, then safely handling unknowns in validation) will outperform logistic regression because tree-based models can capture non-linear interactions between spending, group structure, and cabin position without explicit feature engineering.\n</hypothesis>\n\n<plan>\nReplace LogisticRegression with XGBoost using a LabelEncoder-based preprocessor that encodes all categories once during training and gracefully handles unknown categories (by mapping them to a reserved class or using -1). This requires custom preprocessing logic but avoids the XGBoost + one-hot + unknown-category issue that caused crashes before. Keep all existing feature engineering (Cabin parsing, GroupId, spending-as-zero, Unknown handling) and test whether tree-based modelling unlocks better signal.\n</plan>\n\n<code>\n```python\n\"\"\"\ntrain.py — XGBoost with label encoding for categorical features and robust unknown handling.\n\"\"\"\nimport sys, pathlib\nsys.path.insert(0, str(pathlib.Path(__file__).resolve().parent.parent))\n\nimport pandas as pd\nimport numpy as np\nfrom sklearn.preprocessing import LabelEncoder\nimport xgboost as xgb\n\nimport prepare\n\nNUMERIC = [\"Age\", \"RoomService\", \"FoodCourt\", \"ShoppingMall\", \"Spa\", \"VRDeck\"]\nCATEGORICAL = [\"HomePlanet\", \"Destination\", \"CryoSleep\", \"VIP\"]\nSPENDING = [\"RoomService\", \"FoodCourt\", \"ShoppingMall\", \"Spa\", \"VRDeck\"]\n\n\ndef parse_cabin(cabin_str):\n    \"\"\"Parse Cabin 'F/0/S' into deck, room_num, side.\"\"\"\n    if pd.isna(cabin_str):\n        return np.nan, np.nan, np.nan\n    parts = str(cabin_str).split(\"/\")\n    if len(parts) == 3:\n        return parts[0], int(parts[1]) if parts[1].isdigit() else np.nan, parts[2]\n    return np.nan, np.nan, np.nan\n\n\ndef extract_group_id(passenger_id):\n    \"\"\"Extract group ID from PassengerId (e.g., '0001_01' -> '0001').\"\"\"\n    if pd.isna(passenger_id):\n        return np.nan\n    return str(passenger_id).split(\"_\")[0]\n\n\ndef build_predict_fn():\n    train_df, _ = prepare.load_split()\n    \n    # Parse Cabin into Deck, RoomNum, Side\n    cabin_data = train_df[\"Cabin\"].apply(parse_cabin)\n    train_df[\"Deck\"] = cabin_data.apply(lambda x: x[0])\n    train_df[\"RoomNum\"] = cabin_data.apply(lambda x: x[1])\n    train_df[\"Side\"] = cabin_data.apply(lambda x: x[2])\n    \n    # Extract group ID from PassengerId\n    train_df[\"GroupId\"] = train_df[\"PassengerId\"].apply(extract_group_id)\n    \n    # Fill missing values in spending columns with 0 (indicates not spent)\n    for col in SPENDING:\n        train_df[col] = train_df[col].fillna(0)\n    \n    # Convert CryoSleep and VIP to numeric (handle NaN explicitly)\n    train_df[\"CryoSleep\"] = train_df[\"CryoSleep\"].fillna(\"Unknown\").astype(str)\n    train_df[\"VIP\"] = train_df[\"VIP\"].fillna(\"Unknown\").astype(str)\n    \n    # Build feature set\n    feature_cols = [\"Age\"] + SPENDING + CATEGORICAL + [\"Deck\", \"RoomNum\", \"Side\", \"GroupId\"]\n    X = train_df[feature_cols].copy()\n    y = train_df[\"Transported\"].astype(int)\n    \n    # Impute Age with median\n    age_median = X[\"Age\"].median()\n    X[\"Age\"] = X[\"Age\"].fillna(age_median)\n    \n    # Impute RoomNum with median\n    room_median = X[\"RoomNum\"].median()\n    X[\"RoomNum\"] = X[\"RoomNum\"].fillna(room_median)\n    \n    # Fit label encoders for categorical columns\n    label_encoders = {}\n    for col in CATEGORICAL + [\"Deck\", \"Side\", \"GroupId\"]:\n        le = LabelEncoder()\n        # Fit on training values only\n        X[col] = X[col].astype(str)\n        le.fit(X[col])\n        label_encoders[col] = le\n        X[col] = le.transform(X[col])\n    \n    # Train XGBoost model\n    model = xgb.XGBClassifier(\n        n_estimators=100,\n        max_depth=5,\n        learning_rate=0.1,\n        subsample=0.8,\n        colsample_bytree=0.8,\n        random_state=42,\n        eval_metric=\"logloss\"\n    )\n    model.fit(X, y)\n    \n    def predict(X_val):\n        # Parse Cabin in validation set\n        cabin_data = X_val[\"Cabin\"].apply(parse_cabin)\n        X_val_copy = X_val.copy()\n        X_val_copy[\"Deck\"] = cabin_data.apply(lambda x: x[0])\n        X_val_copy[\"RoomNum\"] = cabin_data.apply(lambda x: x[1])\n        X_val_copy[\"Side\"] = cabin_data.apply(lambda x: x[2])\n        \n        # Extract group ID\n        X_val_copy[\"GroupId\"] = X_val_copy[\"PassengerId\"].apply(extract_group_id)\n        \n        # Fill missing spending with 0\n        for col in SPENDING:\n            X_val_copy[col] = X_val_copy[col].fillna(0)\n        \n        # Handle CryoSleep and VIP\n        X_val_copy[\"CryoSleep\"] = X_val_copy[\"CryoSleep\"].fillna(\"Unknown\").astype(str)\n        X_val_copy[\"VIP\"] = X_val_copy[\"VIP\"].fillna(\"Unknown\").astype(str)\n        \n        # Impute Age and RoomNum\n        X_val_copy[\"Age\"] = X_val_copy[\"Age\"].fillna(age_median)\n        X_val_copy[\"RoomNum\"] = X_val_copy[\"RoomNum\"].fillna(room_median)\n        \n        # Select features and encode categoricals\n        X_val_proc = X_val_copy[feature_cols].copy()\n        for col in CATEGORICAL + [\"Deck\", \"Side\", \"GroupId\"]:\n            X_val_proc[col] = X_val_proc[col].astype(str)\n            # Transform using fitted encoder; map unknown values to -1\n            try:\n                X_val_proc[col] = label_encoders[col].transform(X_val_proc[col])\n            except ValueError:\n                # Handle unknown values by mapping to -1\n                mask = ~X_val_proc[col].isin(label_encoders[col].classes_)\n                X_val_proc.loc[mask, col] = -1\n                X_val_proc.loc[~mask, col] = label_encoders[col].transform(X_val_proc.loc[~mask, col])\n        \n        return model.predict(X_val_proc).astype(bool)\n    \n    return predict\n\n\nif __name__ == \"__main__\":\n    predict_fn = build_predict_fn()\n    score = prepare.evaluate(predict_fn)\n    print(f\"VAL_ACCURACY: {score:.4f}\")\n```\n</code>\n\n<notes_append>\nIteration 10: Switched from LogisticRegression to XGBoost (n_estimators=100, max_depth=5, learning_rate=0.1) with LabelEncoder for categorical features, handling unknown values by mapping to -1. Tree-based model should capture non-linear interactions that logistic regression missed. Testing whether structural model change improves beyond 0.7901.\n</notes_append>", "reflection": "The baseline logistic regression with minimal feature engineering (Cabin parsing, GroupId, spending-as-zero, Unknown handling) holds at 0.7901. Recent iterations added TotalSpending, GroupSize, PersonId, AnySpending, and AgeMissing features, none of which improved the score — they were reverted in iteration 9. The current best remains 0.7901, suggesting we've plateaued with this feature set and model class. It's time to try a structurally different approach: either a different model (tree-based with proper regularization), or a radically different feature representation.", "observations": ["The logistic regression baseline is robust and holds steady at 0.7901 across multiple feature engineering attempts (TotalSpending, GroupSize, PersonId, AnySpending, AgeMissing all failed to improve or were noise).", "We have already parsed Cabin into Deck/RoomNum/Side and extracted GroupId from PassengerId. These structural features are being used but may not be fully exploited by logistic regression.", "Spending columns are treated as zero when missing, which is reasonable (non-spending), but logistic regression may not capture the non-linear patterns that tree-based models could find.", "One-hot encoding with handle_unknown=\"ignore\" successfully handles unseen categorical values in validation, which is why the pipeline is robust.", "We haven't tried XGBoost with proper handling of categorical variables (via label encoding with fit-time category discovery, or native categorical support) since the label-encoding attempt failed due to GroupId mismatch."], "hypothesis": "XGBoost with LabelEncoder applied at preprocessing time (encoding training categories once, then safely handling unknowns in validation) will outperform logistic regression because tree-based models can capture non-linear interactions between spending, group structure, and cabin position without explicit feature engineering.", "plan": "Replace LogisticRegression with XGBoost using a LabelEncoder-based preprocessor that encodes all categories once during training and gracefully handles unknown categories (by mapping them to a reserved class or using -1). This requires custom preprocessing logic but avoids the XGBoost + one-hot + unknown-category issue that caused crashes before. Keep all existing feature engineering (Cabin parsing, GroupId, spending-as-zero, Unknown handling) and test whether tree-based modelling unlocks better signal.", "code": "\"\"\"\ntrain.py — XGBoost with label encoding for categorical features and robust unknown handling.\n\"\"\"\nimport sys, pathlib\nsys.path.insert(0, str(pathlib.Path(__file__).resolve().parent.parent))\n\nimport pandas as pd\nimport numpy as np\nfrom sklearn.preprocessing import LabelEncoder\nimport xgboost as xgb\n\nimport prepare\n\nNUMERIC = [\"Age\", \"RoomService\", \"FoodCourt\", \"ShoppingMall\", \"Spa\", \"VRDeck\"]\nCATEGORICAL = [\"HomePlanet\", \"Destination\", \"CryoSleep\", \"VIP\"]\nSPENDING = [\"RoomService\", \"FoodCourt\", \"ShoppingMall\", \"Spa\", \"VRDeck\"]\n\n\ndef parse_cabin(cabin_str):\n    \"\"\"Parse Cabin 'F/0/S' into deck, room_num, side.\"\"\"\n    if pd.isna(cabin_str):\n        return np.nan, np.nan, np.nan\n    parts = str(cabin_str).split(\"/\")\n    if len(parts) == 3:\n        return parts[0], int(parts[1]) if parts[1].isdigit() else np.nan, parts[2]\n    return np.nan, np.nan, np.nan\n\n\ndef extract_group_id(passenger_id):\n    \"\"\"Extract group ID from PassengerId (e.g., '0001_01' -> '0001').\"\"\"\n    if pd.isna(passenger_id):\n        return np.nan\n    return str(passenger_id).split(\"_\")[0]\n\n\ndef build_predict_fn():\n    train_df, _ = prepare.load_split()\n    \n    # Parse Cabin into Deck, RoomNum, Side\n    cabin_data = train_df[\"Cabin\"].apply(parse_cabin)\n    train_df[\"Deck\"] = cabin_data.apply(lambda x: x[0])\n    train_df[\"RoomNum\"] = cabin_data.apply(lambda x: x[1])\n    train_df[\"Side\"] = cabin_data.apply(lambda x: x[2])\n    \n    # Extract group ID from PassengerId\n    train_df[\"GroupId\"] = train_df[\"PassengerId\"].apply(extract_group_id)\n    \n    # Fill missing values in spending columns with 0 (indicates not spent)\n    for col in SPENDING:\n        train_df[col] = train_df[col].fillna(0)\n    \n    # Convert CryoSleep and VIP to numeric (handle NaN explicitly)\n    train_df[\"CryoSleep\"] = train_df[\"CryoSleep\"].fillna(\"Unknown\").astype(str)\n    train_df[\"VIP\"] = train_df[\"VIP\"].fillna(\"Unknown\").astype(str)\n    \n    # Build feature set\n    feature_cols = [\"Age\"] + SPENDING + CATEGORICAL + [\"Deck\", \"RoomNum\", \"Side\", \"GroupId\"]\n    X = train_df[feature_cols].copy()\n    y = train_df[\"Transported\"].astype(int)\n    \n    # Impute Age with median\n    age_median = X[\"Age\"].median()\n    X[\"Age\"] = X[\"Age\"].fillna(age_median)\n    \n    # Impute RoomNum with median\n    room_median = X[\"RoomNum\"].median()\n    X[\"RoomNum\"] = X[\"RoomNum\"].fillna(room_median)\n    \n    # Fit label encoders for categorical columns\n    label_encoders = {}\n    for col in CATEGORICAL + [\"Deck\", \"Side\", \"GroupId\"]:\n        le = LabelEncoder()\n        # Fit on training values only\n        X[col] = X[col].astype(str)\n        le.fit(X[col])\n        label_encoders[col] = le\n        X[col] = le.transform(X[col])\n    \n    # Train XGBoost model\n    model = xgb.XGBClassifier(\n        n_estimators=100,\n        max_depth=5,\n        learning_rate=0.1,\n        subsample=0.8,\n        colsample_bytree=0.8,\n        random_state=42,\n        eval_metric=\"logloss\"\n    )\n    model.fit(X, y)\n    \n    def predict(X_val):\n        # Parse Cabin in validation set\n        cabin_data = X_val[\"Cabin\"].apply(parse_cabin)\n        X_val_copy = X_val.copy()\n        X_val_copy[\"Deck\"] = cabin_data.apply(lambda x: x[0])\n        X_val_copy[\"RoomNum\"] = cabin_data.apply(lambda x: x[1])\n        X_val_copy[\"Side\"] = cabin_data.apply(lambda x: x[2])\n        \n        # Extract group ID\n        X_val_copy[\"GroupId\"] = X_val_copy[\"PassengerId\"].apply(extract_group_id)\n        \n        # Fill missing spending with 0\n        for col in SPENDING:\n            X_val_copy[col] = X_val_copy[col].fillna(0)\n        \n        # Handle CryoSleep and VIP\n        X_val_copy[\"CryoSleep\"] = X_val_copy[\"CryoSleep\"].fillna(\"Unknown\").astype(str)\n        X_val_copy[\"VIP\"] = X_val_copy[\"VIP\"].fillna(\"Unknown\").astype(str)\n        \n        # Impute Age and RoomNum\n        X_val_copy[\"Age\"] = X_val_copy[\"Age\"].fillna(age_median)\n        X_val_copy[\"RoomNum\"] = X_val_copy[\"RoomNum\"].fillna(room_median)\n        \n        # Select features and encode categoricals\n        X_val_proc = X_val_copy[feature_cols].copy()\n        for col in CATEGORICAL + [\"Deck\", \"Side\", \"GroupId\"]:\n            X_val_proc[col] = X_val_proc[col].astype(str)\n            # Transform using fitted encoder; map unknown values to -1\n            try:\n                X_val_proc[col] = label_encoders[col].transform(X_val_proc[col])\n            except ValueError:\n                # Handle unknown values by mapping to -1\n                mask = ~X_val_proc[col].isin(label_encoders[col].classes_)\n                X_val_proc.loc[mask, col] = -1\n                X_val_proc.loc[~mask, col] = label_encoders[col].transform(X_val_proc.loc[~mask, col])\n        \n        return model.predict(X_val_proc).astype(bool)\n    \n    return predict\n\n\nif __name__ == \"__main__\":\n    predict_fn = build_predict_fn()\n    score = prepare.evaluate(predict_fn)\n    print(f\"VAL_ACCURACY: {score:.4f}\")\n", "notes_append": "Iteration 10: Switched from LogisticRegression to XGBoost (n_estimators=100, max_depth=5, learning_rate=0.1) with LabelEncoder for categorical features, handling unknown values by mapping to -1. Tree-based model should capture non-linear interactions that logistic regression missed. Testing whether structural model change improves beyond 0.7901.", "stdout": "", "stderr": "e 2181, in _setitem_single_column\n    self.obj._mgr.column_setitem(loc, plane_indexer, value)\n    ~~~~~~~~~~~~~~~~~~~~~~~~~~~~^^^^^^^^^^^^^^^^^^^^^^^^^^^\n  File \"C:\\Roger\\Creating\\Blog\\spaceship-titanic-autoresearch\\.venv\\Lib\\site-packages\\pandas\\core\\internals\\managers.py\", line 1520, in column_setitem\n    new_mgr = col_mgr.setitem((idx,), value)\n  File \"C:\\Roger\\Creating\\Blog\\spaceship-titanic-autoresearch\\.venv\\Lib\\site-packages\\pandas\\core\\internals\\managers.py\", line 604, in setitem\n    return self.apply(\"setitem\", indexer=indexer, value=value)\n           ~~~~~~~~~~^^^^^^^^^^^^^^^^^^^^^^^^^^^^^^^^^^^^^^^^^\n  File \"C:\\Roger\\Creating\\Blog\\spaceship-titanic-autoresearch\\.venv\\Lib\\site-packages\\pandas\\core\\internals\\managers.py\", line 442, in apply\n    applied = getattr(b, f)(**kwargs)\n  File \"C:\\Roger\\Creating\\Blog\\spaceship-titanic-autoresearch\\.venv\\Lib\\site-packages\\pandas\\core\\internals\\blocks.py\", line 1667, in setitem\n    values[indexer] = value\n    ~~~~~~^^^^^^^^^\n  File \"C:\\Roger\\Creating\\Blog\\spaceship-titanic-autoresearch\\.venv\\Lib\\site-packages\\pandas\\core\\arrays\\string_.py\", line 863, in __setitem__\n    value = self._maybe_convert_setitem_value(value)\n  File \"C:\\Roger\\Creating\\Blog\\spaceship-titanic-autoresearch\\.venv\\Lib\\site-packages\\pandas\\core\\arrays\\string_.py\", line 837, in _maybe_convert_setitem_value\n    raise TypeError(\n    ...<3 lines>...\n    )\nTypeError: Invalid value '-1' for dtype 'str'. Value should be a string or missing value, got 'int' instead.\n", "returncode": 1, "score": null, "kept": false, "status": "crashed", "commit_hash": null, "input_tokens": 3572, "output_tokens": 2368, "cost_usd": 0.015412}
