{"iteration": 1, "timestamp": "2026-05-08T23:04:07", "previous_best": 0.8235, "duration_seconds": 3.37, "agent_response_raw": "<reflection>\nThe baseline score of 0.8235 has been successfully restored and is now stable. The last iteration (116) removed PassengerId and GroupId from the feature set while keeping all cabin parsing and engineered features, which aligns with the 0.8235 target. The current model uses core features: Age, spending columns, categorical columns (HomePlanet, Destination, CryoSleep, VIP), Cabin-derived features (Deck, RoomNum, Side), and engineered features (TotalSpending, CryoSleep_LogSpending, Spending_Recorded, missingness flags).\n\nBefore attempting to beat 0.8235, I should systematically investigate what signal remains untapped in the data and whether the model's hyperparameters are well-tuned.\n</reflection>\n\n<observations>\n- The baseline score of 0.8235 has been stable for the last few iterations after removing identifier-based features (PassengerId, GroupId). This suggests those features were either sparse, overfitting, or noisy.\n- Cabin parsing (Deck, RoomNum, Side) proved valuable—removing them dropped the score to 0.8079, confirming they carry predictive signal.\n- The current feature engineering includes interaction terms (CryoSleep_LogSpending) and group-based aggregation (Spending_Recorded flag), but limited exploration of other interactions or nonlinear relationships beyond what XGBoost discovers internally.\n- Missing value indicators (CryoSleep_Missing, VIP_Missing) are included, but we haven't explored whether other columns' missingness patterns are predictive (e.g., Age_Missing, RoomNum_Missing).\n- Current XGBoost hyperparameters (max_depth=6, n_estimators=100, learning_rate=0.1) were inherited from iter 80 and never systematically tuned; there may be room for improvement through cross-validated hyperparameter search.\n</observations>\n\n<hypothesis>\nAdding missingness indicators for Age and RoomNum will improve accuracy because the absence of these values may correlate with transportation likelihood (passengers with incomplete cabin/age data may belong to a distinct subgroup).\n</hypothesis>\n\n<plan>\nI will add explicit missingness flags for Age and RoomNum to the feature set. These are structural columns where missing values may encode group membership (e.g., passengers traveling as part of a group vs. solo). This is a low-cost addition that tests whether absence is predictive without modifying the model class or hyperparameters.\n</plan>\n\n<code>\n```python\n\"\"\"\ntrain.py — Iteration 117: Add Age_Missing and RoomNum_Missing flags.\nTest whether absence of Age or RoomNum correlates with transportation.\n\"\"\"\nimport sys, pathlib\nsys.path.insert(0, str(pathlib.Path(__file__).resolve().parent.parent))\n\nimport pandas as pd\nimport numpy as np\nimport xgboost as xgb\nfrom sklearn.impute import SimpleImputer\nfrom sklearn.pipeline import Pipeline\nfrom sklearn.preprocessing import StandardScaler, OneHotEncoder\nfrom sklearn.compose import ColumnTransformer\n\nimport prepare\n\nNUMERIC = [\"Age\", \"RoomService\", \"FoodCourt\", \"ShoppingMall\", \"Spa\", \"VRDeck\"]\nCATEGORICAL = [\"HomePlanet\", \"Destination\", \"CryoSleep\", \"VIP\"]\nSPENDING = [\"RoomService\", \"FoodCourt\", \"ShoppingMall\", \"Spa\", \"VRDeck\"]\n\n\ndef parse_cabin(cabin_str):\n    \"\"\"Parse Cabin 'F/0/S' into deck, room_num, side.\"\"\"\n    if pd.isna(cabin_str):\n        return np.nan, np.nan, np.nan\n    parts = str(cabin_str).split(\"/\")\n    if len(parts) == 3:\n        return parts[0], int(parts[1]) if parts[1].isdigit() else np.nan, parts[2]\n    return np.nan, np.nan, np.nan\n\n\ndef engineer_features(df):\n    \"\"\"Engineer spending and spending-cryo interaction features.\"\"\"\n    df_copy = df.copy()\n    \n    # Track which rows have any spending data recorded\n    spending_recorded = ~df_copy[SPENDING].isna().any(axis=1)\n    df_copy[\"Spending_Recorded\"] = spending_recorded.astype(int)\n    \n    # Fill missing spending with median per HomePlanet group, then global median\n    for col in SPENDING:\n        missing_mask = df_copy[col].isna()\n        if missing_mask.any():\n            group_medians = df_copy.groupby(\"HomePlanet\")[col].median()\n            df_copy.loc[missing_mask, col] = df_copy.loc[missing_mask, \"HomePlanet\"].map(group_medians)\n            global_median = df_copy[col].median()\n            df_copy[col] = df_copy[col].fillna(global_median)\n    \n    # Total spending\n    df_copy[\"TotalSpending\"] = df_copy[SPENDING].sum(axis=1)\n    \n    # Interaction: CryoSleep status and log spending\n    cryo_status = df_copy[\"CryoSleep\"].fillna(False)\n    log_spending = np.log1p(df_copy[\"TotalSpending\"])\n    df_copy[\"CryoSleep_LogSpending\"] = (cryo_status == True) * log_spending\n    \n    return df_copy\n\n\ndef build_predict_fn():\n    train_df, _ = prepare.load_split()\n    \n    # Parse Cabin into Deck, RoomNum, Side\n    cabin_data = train_df[\"Cabin\"].apply(parse_cabin)\n    train_df[\"Deck\"] = cabin_data.apply(lambda x: x[0])\n    train_df[\"RoomNum\"] = cabin_data.apply(lambda x: x[1])\n    train_df[\"Side\"] = cabin_data.apply(lambda x: x[2])\n    \n    # Engineer features\n    train_df = engineer_features(train_df)\n    \n    # Create missingness flags\n    train_df[\"CryoSleep_Missing\"] = train_df[\"CryoSleep\"].isna().astype(int)\n    train_df[\"VIP_Missing\"] = train_df[\"VIP\"].isna().astype(int)\n    train_df[\"Age_Missing\"] = train_df[\"Age\"].isna().astype(int)\n    train_df[\"RoomNum_Missing\"] = train_df[\"RoomNum\"].isna().astype(int)\n    \n    # Convert CryoSleep and VIP to string for categorical encoding\n    train_df[\"CryoSleep\"] = train_df[\"CryoSleep\"].fillna(\"Unknown\").astype(str)\n    train_df[\"VIP\"] = train_df[\"VIP\"].fillna(\"Unknown\").astype(str)\n    \n    # Build feature set\n    feature_cols = (\n        [\"Age\"] + SPENDING + [\"TotalSpending\", \"CryoSleep_LogSpending\", \"Spending_Recorded\"] +\n        CATEGORICAL + \n        [\"Deck\", \"RoomNum\", \"Side\"] + \n        [\"CryoSleep_Missing\", \"VIP_Missing\", \"Age_Missing\", \"RoomNum_Missing\"]\n    )\n    X = train_df[feature_cols]\n    y = train_df[\"Transported\"].astype(int)\n    \n    # Define preprocessing\n    numeric_transformer = Pipeline([\n        (\"imputer\", SimpleImputer(strategy=\"median\")),\n        (\"scaler\", StandardScaler()),\n    ])\n    \n    categorical_transformer = Pipeline([\n        (\"imputer\", SimpleImputer(strategy=\"most_frequent\")),\n        (\"onehot\", OneHotEncoder(handle_unknown=\"ignore\", sparse_output=False)),\n    ])\n    \n    numeric_feature_cols = (\n        [\"Age\", \"RoomNum\", \"CryoSleep_Missing\", \"VIP_Missing\", \"Age_Missing\", \"RoomNum_Missing\", \"Spending_Recorded\"] + \n        SPENDING + [\"TotalSpending\", \"CryoSleep_LogSpending\"]\n    )\n    categorical_feature_cols = CATEGORICAL + [\"Deck\", \"Side\"]\n    \n    preprocessor = ColumnTransformer([\n        (\"num\", numeric_transformer, numeric_feature_cols),\n        (\"cat\", categorical_transformer, categorical_feature_cols),\n    ])\n    \n    # XGBoost with iter 80 hyperparameters\n    pipe = Pipeline([\n        (\"preprocessor\", preprocessor),\n        (\"clf\", xgb.XGBClassifier(\n            max_depth=6,\n            n_estimators=100,\n            learning_rate=0.1,\n            random_state=42,\n            verbosity=0\n        )),\n    ])\n    \n    pipe.fit(X, y)\n    \n    def predict(X_val):\n        cabin_data = X_val[\"Cabin\"].apply(parse_cabin)\n        X_val_copy = X_val.copy()\n        X_val_copy[\"Deck\"] = cabin_data.apply(lambda x: x[0])\n        X_val_copy[\"RoomNum\"] = cabin_data.apply(lambda x: x[1])\n        X_val_copy[\"Side\"] = cabin_data.apply(lambda x: x[2])\n        \n        # Engineer features\n        X_val_copy = engineer_features(X_val_copy)\n        \n        # Missingness flags\n        X_val_copy[\"CryoSleep_Missing\"] = X_val_copy[\"CryoSleep\"].isna().astype(int)\n        X_val_copy[\"VIP_Missing\"] = X_val_copy[\"VIP\"].isna().astype(int)\n        X_val_copy[\"Age_Missing\"] = X_val_copy[\"Age\"].isna().astype(int)\n        X_val_copy[\"RoomNum_Missing\"] = X_val_copy[\"RoomNum\"].isna().astype(int)\n        \n        # Handle CryoSleep and VIP\n        X_val_copy[\"CryoSleep\"] = X_val_copy[\"CryoSleep\"].fillna(\"Unknown\").astype(str)\n        X_val_copy[\"VIP\"] = X_val_copy[\"VIP\"].fillna(\"Unknown\").astype(str)\n        \n        return pipe.predict(X_val_copy[feature_cols]).astype(bool)\n    \n    return predict\n\n\nif __name__ == \"__main__\":\n    predict_fn = build_predict_fn()\n    score = prepare.evaluate(predict_fn)\n    print(f\"VAL_ACCURACY: {score:.4f}\")\n```\n</code>\n\n<notes_append>\nIteration 117: Added Age_Missing and RoomNum_Missing flags to feature set. Testing whether missingness in structural columns (Age, RoomNum) correlates with transportation likelihood, similar to CryoSleep_Missing and VIP_Missing. Low-cost addition to feature engineering.\n</notes_append>", "reflection": "The baseline score of 0.8235 has been successfully restored and is now stable. The last iteration (116) removed PassengerId and GroupId from the feature set while keeping all cabin parsing and engineered features, which aligns with the 0.8235 target. The current model uses core features: Age, spending columns, categorical columns (HomePlanet, Destination, CryoSleep, VIP), Cabin-derived features (Deck, RoomNum, Side), and engineered features (TotalSpending, CryoSleep_LogSpending, Spending_Recorded, missingness flags).\n\nBefore attempting to beat 0.8235, I should systematically investigate what signal remains untapped in the data and whether the model's hyperparameters are well-tuned.", "observations": ["The baseline score of 0.8235 has been stable for the last few iterations after removing identifier-based features (PassengerId, GroupId). This suggests those features were either sparse, overfitting, or noisy.", "Cabin parsing (Deck, RoomNum, Side) proved valuable—removing them dropped the score to 0.8079, confirming they carry predictive signal.", "The current feature engineering includes interaction terms (CryoSleep_LogSpending) and group-based aggregation (Spending_Recorded flag), but limited exploration of other interactions or nonlinear relationships beyond what XGBoost discovers internally.", "Missing value indicators (CryoSleep_Missing, VIP_Missing) are included, but we haven't explored whether other columns' missingness patterns are predictive (e.g., Age_Missing, RoomNum_Missing).", "Current XGBoost hyperparameters (max_depth=6, n_estimators=100, learning_rate=0.1) were inherited from iter 80 and never systematically tuned; there may be room for improvement through cross-validated hyperparameter search."], "hypothesis": "Adding missingness indicators for Age and RoomNum will improve accuracy because the absence of these values may correlate with transportation likelihood (passengers with incomplete cabin/age data may belong to a distinct subgroup).", "plan": "I will add explicit missingness flags for Age and RoomNum to the feature set. These are structural columns where missing values may encode group membership (e.g., passengers traveling as part of a group vs. solo). This is a low-cost addition that tests whether absence is predictive without modifying the model class or hyperparameters.", "code": "\"\"\"\ntrain.py — Iteration 117: Add Age_Missing and RoomNum_Missing flags.\nTest whether absence of Age or RoomNum correlates with transportation.\n\"\"\"\nimport sys, pathlib\nsys.path.insert(0, str(pathlib.Path(__file__).resolve().parent.parent))\n\nimport pandas as pd\nimport numpy as np\nimport xgboost as xgb\nfrom sklearn.impute import SimpleImputer\nfrom sklearn.pipeline import Pipeline\nfrom sklearn.preprocessing import StandardScaler, OneHotEncoder\nfrom sklearn.compose import ColumnTransformer\n\nimport prepare\n\nNUMERIC = [\"Age\", \"RoomService\", \"FoodCourt\", \"ShoppingMall\", \"Spa\", \"VRDeck\"]\nCATEGORICAL = [\"HomePlanet\", \"Destination\", \"CryoSleep\", \"VIP\"]\nSPENDING = [\"RoomService\", \"FoodCourt\", \"ShoppingMall\", \"Spa\", \"VRDeck\"]\n\n\ndef parse_cabin(cabin_str):\n    \"\"\"Parse Cabin 'F/0/S' into deck, room_num, side.\"\"\"\n    if pd.isna(cabin_str):\n        return np.nan, np.nan, np.nan\n    parts = str(cabin_str).split(\"/\")\n    if len(parts) == 3:\n        return parts[0], int(parts[1]) if parts[1].isdigit() else np.nan, parts[2]\n    return np.nan, np.nan, np.nan\n\n\ndef engineer_features(df):\n    \"\"\"Engineer spending and spending-cryo interaction features.\"\"\"\n    df_copy = df.copy()\n    \n    # Track which rows have any spending data recorded\n    spending_recorded = ~df_copy[SPENDING].isna().any(axis=1)\n    df_copy[\"Spending_Recorded\"] = spending_recorded.astype(int)\n    \n    # Fill missing spending with median per HomePlanet group, then global median\n    for col in SPENDING:\n        missing_mask = df_copy[col].isna()\n        if missing_mask.any():\n            group_medians = df_copy.groupby(\"HomePlanet\")[col].median()\n            df_copy.loc[missing_mask, col] = df_copy.loc[missing_mask, \"HomePlanet\"].map(group_medians)\n            global_median = df_copy[col].median()\n            df_copy[col] = df_copy[col].fillna(global_median)\n    \n    # Total spending\n    df_copy[\"TotalSpending\"] = df_copy[SPENDING].sum(axis=1)\n    \n    # Interaction: CryoSleep status and log spending\n    cryo_status = df_copy[\"CryoSleep\"].fillna(False)\n    log_spending = np.log1p(df_copy[\"TotalSpending\"])\n    df_copy[\"CryoSleep_LogSpending\"] = (cryo_status == True) * log_spending\n    \n    return df_copy\n\n\ndef build_predict_fn():\n    train_df, _ = prepare.load_split()\n    \n    # Parse Cabin into Deck, RoomNum, Side\n    cabin_data = train_df[\"Cabin\"].apply(parse_cabin)\n    train_df[\"Deck\"] = cabin_data.apply(lambda x: x[0])\n    train_df[\"RoomNum\"] = cabin_data.apply(lambda x: x[1])\n    train_df[\"Side\"] = cabin_data.apply(lambda x: x[2])\n    \n    # Engineer features\n    train_df = engineer_features(train_df)\n    \n    # Create missingness flags\n    train_df[\"CryoSleep_Missing\"] = train_df[\"CryoSleep\"].isna().astype(int)\n    train_df[\"VIP_Missing\"] = train_df[\"VIP\"].isna().astype(int)\n    train_df[\"Age_Missing\"] = train_df[\"Age\"].isna().astype(int)\n    train_df[\"RoomNum_Missing\"] = train_df[\"RoomNum\"].isna().astype(int)\n    \n    # Convert CryoSleep and VIP to string for categorical encoding\n    train_df[\"CryoSleep\"] = train_df[\"CryoSleep\"].fillna(\"Unknown\").astype(str)\n    train_df[\"VIP\"] = train_df[\"VIP\"].fillna(\"Unknown\").astype(str)\n    \n    # Build feature set\n    feature_cols = (\n        [\"Age\"] + SPENDING + [\"TotalSpending\", \"CryoSleep_LogSpending\", \"Spending_Recorded\"] +\n        CATEGORICAL + \n        [\"Deck\", \"RoomNum\", \"Side\"] + \n        [\"CryoSleep_Missing\", \"VIP_Missing\", \"Age_Missing\", \"RoomNum_Missing\"]\n    )\n    X = train_df[feature_cols]\n    y = train_df[\"Transported\"].astype(int)\n    \n    # Define preprocessing\n    numeric_transformer = Pipeline([\n        (\"imputer\", SimpleImputer(strategy=\"median\")),\n        (\"scaler\", StandardScaler()),\n    ])\n    \n    categorical_transformer = Pipeline([\n        (\"imputer\", SimpleImputer(strategy=\"most_frequent\")),\n        (\"onehot\", OneHotEncoder(handle_unknown=\"ignore\", sparse_output=False)),\n    ])\n    \n    numeric_feature_cols = (\n        [\"Age\", \"RoomNum\", \"CryoSleep_Missing\", \"VIP_Missing\", \"Age_Missing\", \"RoomNum_Missing\", \"Spending_Recorded\"] + \n        SPENDING + [\"TotalSpending\", \"CryoSleep_LogSpending\"]\n    )\n    categorical_feature_cols = CATEGORICAL + [\"Deck\", \"Side\"]\n    \n    preprocessor = ColumnTransformer([\n        (\"num\", numeric_transformer, numeric_feature_cols),\n        (\"cat\", categorical_transformer, categorical_feature_cols),\n    ])\n    \n    # XGBoost with iter 80 hyperparameters\n    pipe = Pipeline([\n        (\"preprocessor\", preprocessor),\n        (\"clf\", xgb.XGBClassifier(\n            max_depth=6,\n            n_estimators=100,\n            learning_rate=0.1,\n            random_state=42,\n            verbosity=0\n        )),\n    ])\n    \n    pipe.fit(X, y)\n    \n    def predict(X_val):\n        cabin_data = X_val[\"Cabin\"].apply(parse_cabin)\n        X_val_copy = X_val.copy()\n        X_val_copy[\"Deck\"] = cabin_data.apply(lambda x: x[0])\n        X_val_copy[\"RoomNum\"] = cabin_data.apply(lambda x: x[1])\n        X_val_copy[\"Side\"] = cabin_data.apply(lambda x: x[2])\n        \n        # Engineer features\n        X_val_copy = engineer_features(X_val_copy)\n        \n        # Missingness flags\n        X_val_copy[\"CryoSleep_Missing\"] = X_val_copy[\"CryoSleep\"].isna().astype(int)\n        X_val_copy[\"VIP_Missing\"] = X_val_copy[\"VIP\"].isna().astype(int)\n        X_val_copy[\"Age_Missing\"] = X_val_copy[\"Age\"].isna().astype(int)\n        X_val_copy[\"RoomNum_Missing\"] = X_val_copy[\"RoomNum\"].isna().astype(int)\n        \n        # Handle CryoSleep and VIP\n        X_val_copy[\"CryoSleep\"] = X_val_copy[\"CryoSleep\"].fillna(\"Unknown\").astype(str)\n        X_val_copy[\"VIP\"] = X_val_copy[\"VIP\"].fillna(\"Unknown\").astype(str)\n        \n        return pipe.predict(X_val_copy[feature_cols]).astype(bool)\n    \n    return predict\n\n\nif __name__ == \"__main__\":\n    predict_fn = build_predict_fn()\n    score = prepare.evaluate(predict_fn)\n    print(f\"VAL_ACCURACY: {score:.4f}\")\n", "notes_append": "Iteration 117: Added Age_Missing and RoomNum_Missing flags to feature set. Testing whether missingness in structural columns (Age, RoomNum) correlates with transportation likelihood, similar to CryoSleep_Missing and VIP_Missing. Low-cost addition to feature engineering.", "stdout": "VAL_ACCURACY: 0.8125\n", "stderr": "", "returncode": 0, "score": 0.8125, "kept": false, "status": "reverted", "commit_hash": null, "input_tokens": 4750, "output_tokens": 2673, "cost_usd": 0.018115}
