{"iteration": 3, "timestamp": "2026-05-08T20:51:52", "previous_best": 0.7901, "duration_seconds": 3.16, "agent_response_raw": "<reflection>\nThe last run crashed due to a type error when trying to assign -1 (an integer) to a string-dtype column. The issue is that I attempted to use LabelEncoder to map unknown categorical values to -1, but the underlying column is a string type. The pipeline from iteration 9 (which kept the simple one-hot encoding approach with handle_unknown=\"ignore\") was working and achieved 0.7901. I need to revert to that stable baseline and make a different structural change — perhaps trying a different model class or regularization approach rather than continuing to add features or switch to incompatible encodings.\n</reflection>\n\n<observations>\n- The one-hot encoding with handle_unknown=\"ignore\" from iteration 9 was stable and achieved 0.7901. This is the safest baseline to return to immediately.\n- Attempting to use LabelEncoder with -1 for unknowns fails because the categorical columns contain strings and pandas doesn't allow assigning integers to string-dtype Series without explicit conversion.\n- The notes show 10 iterations of feature engineering (adding TotalSpending, GroupSize, PersonId, AnySpending, AgeMissing) all reverted because they didn't beat 0.7901, suggesting that core feature set is solid but model may be at a plateau.\n- XGBoost with label encoding is structurally incompatible with the current data handling; logistic regression + one-hot encoding is proven to work.\n- Rather than continue adding features or fighting with encoders, a different approach is needed: either tune the logistic regression hyperparameters (e.g., regularization strength), try a different classifier (e.g., RandomForest), or investigate feature interactions within the one-hot framework.\n</observations>\n\n<hypothesis>\nA RandomForest classifier with the same one-hot-encoded features will capture non-linear interactions and conditional dependencies that logistic regression cannot, improving accuracy above 0.7901 while remaining simple and robust to unknown categorical values.\n</hypothesis>\n\n<plan>\nI will replace the LogisticRegression with a RandomForestClassifier (n_estimators=100, max_depth=10) in the pipeline, keeping all the proven feature engineering (Cabin parsing, GroupId, spending-as-zero, Unknown handling for NaN booleans) and the one-hot encoding strategy. RandomForest is a tree-based model that can learn non-linear patterns and feature interactions, and it handles categorical data (via one-hot encoding) as naturally as logistic regression does.\n</plan>\n\n<code>\n```python\n\"\"\"\ntrain.py — RandomForest classifier with proven feature engineering from iter 9.\n\"\"\"\nimport sys, pathlib\nsys.path.insert(0, str(pathlib.Path(__file__).resolve().parent.parent))\n\nimport pandas as pd\nimport numpy as np\nfrom sklearn.ensemble import RandomForestClassifier\nfrom sklearn.impute import SimpleImputer\nfrom sklearn.pipeline import Pipeline\nfrom sklearn.preprocessing import StandardScaler, OneHotEncoder\nfrom sklearn.compose import ColumnTransformer\n\nimport prepare\n\nNUMERIC = [\"Age\", \"RoomService\", \"FoodCourt\", \"ShoppingMall\", \"Spa\", \"VRDeck\"]\nCATEGORICAL = [\"HomePlanet\", \"Destination\", \"CryoSleep\", \"VIP\"]\nSPENDING = [\"RoomService\", \"FoodCourt\", \"ShoppingMall\", \"Spa\", \"VRDeck\"]\n\n\ndef parse_cabin(cabin_str):\n    \"\"\"Parse Cabin 'F/0/S' into deck, room_num, side.\"\"\"\n    if pd.isna(cabin_str):\n        return np.nan, np.nan, np.nan\n    parts = str(cabin_str).split(\"/\")\n    if len(parts) == 3:\n        return parts[0], int(parts[1]) if parts[1].isdigit() else np.nan, parts[2]\n    return np.nan, np.nan, np.nan\n\n\ndef extract_group_id(passenger_id):\n    \"\"\"Extract group ID from PassengerId (e.g., '0001_01' -> '0001').\"\"\"\n    if pd.isna(passenger_id):\n        return np.nan\n    return str(passenger_id).split(\"_\")[0]\n\n\ndef build_predict_fn():\n    train_df, _ = prepare.load_split()\n    \n    # Parse Cabin into Deck, RoomNum, Side\n    cabin_data = train_df[\"Cabin\"].apply(parse_cabin)\n    train_df[\"Deck\"] = cabin_data.apply(lambda x: x[0])\n    train_df[\"RoomNum\"] = cabin_data.apply(lambda x: x[1])\n    train_df[\"Side\"] = cabin_data.apply(lambda x: x[2])\n    \n    # Extract group ID from PassengerId\n    train_df[\"GroupId\"] = train_df[\"PassengerId\"].apply(extract_group_id)\n    \n    # Fill missing values in spending columns with 0 (indicates not spent)\n    for col in SPENDING:\n        train_df[col] = train_df[col].fillna(0)\n    \n    # Convert CryoSleep and VIP to numeric (handle NaN explicitly)\n    train_df[\"CryoSleep\"] = train_df[\"CryoSleep\"].fillna(\"Unknown\").astype(str)\n    train_df[\"VIP\"] = train_df[\"VIP\"].fillna(\"Unknown\").astype(str)\n    \n    # Build feature set: minimal core features only\n    feature_cols = [\"Age\"] + SPENDING + CATEGORICAL + [\"Deck\", \"RoomNum\", \"Side\", \"GroupId\"]\n    X = train_df[feature_cols]\n    y = train_df[\"Transported\"].astype(int)\n    \n    # Define preprocessing for numeric and categorical columns\n    numeric_transformer = Pipeline([\n        (\"imputer\", SimpleImputer(strategy=\"median\")),\n        (\"scaler\", StandardScaler()),\n    ])\n    \n    categorical_transformer = Pipeline([\n        (\"imputer\", SimpleImputer(strategy=\"most_frequent\")),\n        (\"onehot\", OneHotEncoder(handle_unknown=\"ignore\", sparse_output=False)),\n    ])\n    \n    preprocessor = ColumnTransformer([\n        (\"num\", numeric_transformer, [\"Age\", \"RoomNum\"] + SPENDING),\n        (\"cat\", categorical_transformer, CATEGORICAL + [\"Deck\", \"Side\", \"GroupId\"]),\n    ])\n    \n    pipe = Pipeline([\n        (\"preprocessor\", preprocessor),\n        (\"clf\", RandomForestClassifier(n_estimators=100, max_depth=10, random_state=42, n_jobs=-1)),\n    ])\n    \n    pipe.fit(X, y)\n    \n    def predict(X_val):\n        # Parse Cabin in validation set\n        cabin_data = X_val[\"Cabin\"].apply(parse_cabin)\n        X_val_copy = X_val.copy()\n        X_val_copy[\"Deck\"] = cabin_data.apply(lambda x: x[0])\n        X_val_copy[\"RoomNum\"] = cabin_data.apply(lambda x: x[1])\n        X_val_copy[\"Side\"] = cabin_data.apply(lambda x: x[2])\n        \n        # Extract group ID\n        X_val_copy[\"GroupId\"] = X_val_copy[\"PassengerId\"].apply(extract_group_id)\n        \n        # Fill missing spending with 0\n        for col in SPENDING:\n            X_val_copy[col] = X_val_copy[col].fillna(0)\n        \n        # Handle CryoSleep and VIP\n        X_val_copy[\"CryoSleep\"] = X_val_copy[\"CryoSleep\"].fillna(\"Unknown\").astype(str)\n        X_val_copy[\"VIP\"] = X_val_copy[\"VIP\"].fillna(\"Unknown\").astype(str)\n        \n        return pipe.predict(X_val_copy[feature_cols]).astype(bool)\n    \n    return predict\n\n\nif __name__ == \"__main__\":\n    predict_fn = build_predict_fn()\n    score = prepare.evaluate(predict_fn)\n    print(f\"VAL_ACCURACY: {score:.4f}\")\n```\n</code>\n\n<notes_append>\nIteration 11: Reverted to proven pipeline from iter 9 (one-hot encoding with LogisticRegression); replaced LogisticRegression with RandomForestClassifier (n_estimators=100, max_depth=10) to test whether tree-based model can capture non-linear interactions logistic regression missed, while keeping all proven feature engineering (Cabin parsing, GroupId, spending-as-zero, Unknown handling).\n</notes_append>", "reflection": "The last run crashed due to a type error when trying to assign -1 (an integer) to a string-dtype column. The issue is that I attempted to use LabelEncoder to map unknown categorical values to -1, but the underlying column is a string type. The pipeline from iteration 9 (which kept the simple one-hot encoding approach with handle_unknown=\"ignore\") was working and achieved 0.7901. I need to revert to that stable baseline and make a different structural change — perhaps trying a different model class or regularization approach rather than continuing to add features or switch to incompatible encodings.", "observations": ["The one-hot encoding with handle_unknown=\"ignore\" from iteration 9 was stable and achieved 0.7901. This is the safest baseline to return to immediately.", "Attempting to use LabelEncoder with -1 for unknowns fails because the categorical columns contain strings and pandas doesn't allow assigning integers to string-dtype Series without explicit conversion.", "The notes show 10 iterations of feature engineering (adding TotalSpending, GroupSize, PersonId, AnySpending, AgeMissing) all reverted because they didn't beat 0.7901, suggesting that core feature set is solid but model may be at a plateau.", "XGBoost with label encoding is structurally incompatible with the current data handling; logistic regression + one-hot encoding is proven to work.", "Rather than continue adding features or fighting with encoders, a different approach is needed: either tune the logistic regression hyperparameters (e.g., regularization strength), try a different classifier (e.g., RandomForest), or investigate feature interactions within the one-hot framework."], "hypothesis": "A RandomForest classifier with the same one-hot-encoded features will capture non-linear interactions and conditional dependencies that logistic regression cannot, improving accuracy above 0.7901 while remaining simple and robust to unknown categorical values.", "plan": "I will replace the LogisticRegression with a RandomForestClassifier (n_estimators=100, max_depth=10) in the pipeline, keeping all the proven feature engineering (Cabin parsing, GroupId, spending-as-zero, Unknown handling for NaN booleans) and the one-hot encoding strategy. RandomForest is a tree-based model that can learn non-linear patterns and feature interactions, and it handles categorical data (via one-hot encoding) as naturally as logistic regression does.", "code": "\"\"\"\ntrain.py — RandomForest classifier with proven feature engineering from iter 9.\n\"\"\"\nimport sys, pathlib\nsys.path.insert(0, str(pathlib.Path(__file__).resolve().parent.parent))\n\nimport pandas as pd\nimport numpy as np\nfrom sklearn.ensemble import RandomForestClassifier\nfrom sklearn.impute import SimpleImputer\nfrom sklearn.pipeline import Pipeline\nfrom sklearn.preprocessing import StandardScaler, OneHotEncoder\nfrom sklearn.compose import ColumnTransformer\n\nimport prepare\n\nNUMERIC = [\"Age\", \"RoomService\", \"FoodCourt\", \"ShoppingMall\", \"Spa\", \"VRDeck\"]\nCATEGORICAL = [\"HomePlanet\", \"Destination\", \"CryoSleep\", \"VIP\"]\nSPENDING = [\"RoomService\", \"FoodCourt\", \"ShoppingMall\", \"Spa\", \"VRDeck\"]\n\n\ndef parse_cabin(cabin_str):\n    \"\"\"Parse Cabin 'F/0/S' into deck, room_num, side.\"\"\"\n    if pd.isna(cabin_str):\n        return np.nan, np.nan, np.nan\n    parts = str(cabin_str).split(\"/\")\n    if len(parts) == 3:\n        return parts[0], int(parts[1]) if parts[1].isdigit() else np.nan, parts[2]\n    return np.nan, np.nan, np.nan\n\n\ndef extract_group_id(passenger_id):\n    \"\"\"Extract group ID from PassengerId (e.g., '0001_01' -> '0001').\"\"\"\n    if pd.isna(passenger_id):\n        return np.nan\n    return str(passenger_id).split(\"_\")[0]\n\n\ndef build_predict_fn():\n    train_df, _ = prepare.load_split()\n    \n    # Parse Cabin into Deck, RoomNum, Side\n    cabin_data = train_df[\"Cabin\"].apply(parse_cabin)\n    train_df[\"Deck\"] = cabin_data.apply(lambda x: x[0])\n    train_df[\"RoomNum\"] = cabin_data.apply(lambda x: x[1])\n    train_df[\"Side\"] = cabin_data.apply(lambda x: x[2])\n    \n    # Extract group ID from PassengerId\n    train_df[\"GroupId\"] = train_df[\"PassengerId\"].apply(extract_group_id)\n    \n    # Fill missing values in spending columns with 0 (indicates not spent)\n    for col in SPENDING:\n        train_df[col] = train_df[col].fillna(0)\n    \n    # Convert CryoSleep and VIP to numeric (handle NaN explicitly)\n    train_df[\"CryoSleep\"] = train_df[\"CryoSleep\"].fillna(\"Unknown\").astype(str)\n    train_df[\"VIP\"] = train_df[\"VIP\"].fillna(\"Unknown\").astype(str)\n    \n    # Build feature set: minimal core features only\n    feature_cols = [\"Age\"] + SPENDING + CATEGORICAL + [\"Deck\", \"RoomNum\", \"Side\", \"GroupId\"]\n    X = train_df[feature_cols]\n    y = train_df[\"Transported\"].astype(int)\n    \n    # Define preprocessing for numeric and categorical columns\n    numeric_transformer = Pipeline([\n        (\"imputer\", SimpleImputer(strategy=\"median\")),\n        (\"scaler\", StandardScaler()),\n    ])\n    \n    categorical_transformer = Pipeline([\n        (\"imputer\", SimpleImputer(strategy=\"most_frequent\")),\n        (\"onehot\", OneHotEncoder(handle_unknown=\"ignore\", sparse_output=False)),\n    ])\n    \n    preprocessor = ColumnTransformer([\n        (\"num\", numeric_transformer, [\"Age\", \"RoomNum\"] + SPENDING),\n        (\"cat\", categorical_transformer, CATEGORICAL + [\"Deck\", \"Side\", \"GroupId\"]),\n    ])\n    \n    pipe = Pipeline([\n        (\"preprocessor\", preprocessor),\n        (\"clf\", RandomForestClassifier(n_estimators=100, max_depth=10, random_state=42, n_jobs=-1)),\n    ])\n    \n    pipe.fit(X, y)\n    \n    def predict(X_val):\n        # Parse Cabin in validation set\n        cabin_data = X_val[\"Cabin\"].apply(parse_cabin)\n        X_val_copy = X_val.copy()\n        X_val_copy[\"Deck\"] = cabin_data.apply(lambda x: x[0])\n        X_val_copy[\"RoomNum\"] = cabin_data.apply(lambda x: x[1])\n        X_val_copy[\"Side\"] = cabin_data.apply(lambda x: x[2])\n        \n        # Extract group ID\n        X_val_copy[\"GroupId\"] = X_val_copy[\"PassengerId\"].apply(extract_group_id)\n        \n        # Fill missing spending with 0\n        for col in SPENDING:\n            X_val_copy[col] = X_val_copy[col].fillna(0)\n        \n        # Handle CryoSleep and VIP\n        X_val_copy[\"CryoSleep\"] = X_val_copy[\"CryoSleep\"].fillna(\"Unknown\").astype(str)\n        X_val_copy[\"VIP\"] = X_val_copy[\"VIP\"].fillna(\"Unknown\").astype(str)\n        \n        return pipe.predict(X_val_copy[feature_cols]).astype(bool)\n    \n    return predict\n\n\nif __name__ == \"__main__\":\n    predict_fn = build_predict_fn()\n    score = prepare.evaluate(predict_fn)\n    print(f\"VAL_ACCURACY: {score:.4f}\")\n", "notes_append": "Iteration 11: Reverted to proven pipeline from iter 9 (one-hot encoding with LogisticRegression); replaced LogisticRegression with RandomForestClassifier (n_estimators=100, max_depth=10) to test whether tree-based model can capture non-linear interactions logistic regression missed, while keeping all proven feature engineering (Cabin parsing, GroupId, spending-as-zero, Unknown handling).", "stdout": "VAL_ACCURACY: 0.7372\n", "stderr": "", "returncode": 0, "score": 0.7372, "kept": false, "status": "reverted", "commit_hash": null, "input_tokens": 4111, "output_tokens": 2074, "cost_usd": 0.014480999999999999}
