{"iteration": 5, "timestamp": "2026-05-08T20:52:32", "previous_best": 0.7907, "duration_seconds": 3.65, "agent_response_raw": "<reflection>\nIteration 12 confirmed that the explicit missingness flags (CryoSleep_Missing, VIP_Missing) are effective—we held at 0.7907, matching the best score from iteration 4, which also had these flags. The pipeline is now stable and clean. The notes show we've tried many feature additions (TotalSpending, GroupSize, PersonId, AnySpending, AgeMissing) that either regressed or didn't improve, and we've tested tree-based models (RandomForest, XGBoost) that underperformed the LogisticRegression + one-hot approach. The current bottleneck is likely either: (1) we've exhausted low-cost feature engineering, (2) LogisticRegression + one-hot encoding has fundamental limits on this data, or (3) there are still undiscovered patterns in the raw features or their interactions.\n</reflection>\n\n<observations>\n- The best score (0.7907) uses LogisticRegression with cabin parsing, GroupId, spending-as-zero, explicit missingness flags, and one-hot encoding. Tree-based models (RandomForest, XGBoost) regressed when tried, suggesting the data may be too small or the feature-to-sample ratio is unfavorable for trees without careful tuning.\n- Iterations 7–9 added many engineered features (TotalSpending, GroupSize, PersonId, AnySpending, AgeMissing) that either regressed or provided no lift. Iteration 9's simplification (removing these) was a reset, and iteration 12's minimal addition (just missingness flags) held the score, suggesting the core 0.7907 model is near its ceiling with this feature set.\n- The notes indicate we've tried LogisticRegression hyperparameter tuning (max_iter=1000) and tree-based structural changes; what we haven't systematically explored is regularization strength (C parameter in LogisticRegression) or class balance handling.\n- The spending columns are filled with 0 (not spending) rather than mean/median; this is a reasonable domain assumption, but it's worth testing whether a different imputation strategy (mean, or even a learned \"did not spend\" indicator) could help.\n- We have not yet tried any form of feature selection (e.g., dropping low-variance or low-correlation features) to see if the model is overfitting to noise, or tried different preprocessing orders (e.g., scaling before one-hot encoding, though that's unusual).\n</observations>\n\n<hypothesis>\nTuning the regularization strength (C parameter) of LogisticRegression or adding class weight balancing will improve validation accuracy, because the current model may be underfitting or sensitive to class imbalance on this small dataset (~8.7k rows, binary target).\n</hypothesis>\n\n<plan>\nI will experiment with LogisticRegression's `C` parameter (inverse regularization strength) and `class_weight='balanced'` to test whether the model is regularized appropriately. I'll try C=0.5 with class_weight='balanced' as a reasonable starting point (more permissive regularization + class balance) to see if it can squeeze out a small improvement. If successful, this is a low-complexity change; if not, I'll know to look at feature selection or alternative preprocessing instead.\n</plan>\n\n<code>\n```python\n\"\"\"\ntrain.py — logistic regression with cabin parsing, GroupId, explicit missingness flags, and tuned regularization.\n\"\"\"\nimport sys, pathlib\nsys.path.insert(0, str(pathlib.Path(__file__).resolve().parent.parent))\n\nimport pandas as pd\nimport numpy as np\nfrom sklearn.linear_model import LogisticRegression\nfrom sklearn.impute import SimpleImputer\nfrom sklearn.pipeline import Pipeline\nfrom sklearn.preprocessing import StandardScaler, OneHotEncoder\nfrom sklearn.compose import ColumnTransformer\n\nimport prepare\n\nNUMERIC = [\"Age\", \"RoomService\", \"FoodCourt\", \"ShoppingMall\", \"Spa\", \"VRDeck\"]\nCATEGORICAL = [\"HomePlanet\", \"Destination\", \"CryoSleep\", \"VIP\"]\nSPENDING = [\"RoomService\", \"FoodCourt\", \"ShoppingMall\", \"Spa\", \"VRDeck\"]\n\n\ndef parse_cabin(cabin_str):\n    \"\"\"Parse Cabin 'F/0/S' into deck, room_num, side.\"\"\"\n    if pd.isna(cabin_str):\n        return np.nan, np.nan, np.nan\n    parts = str(cabin_str).split(\"/\")\n    if len(parts) == 3:\n        return parts[0], int(parts[1]) if parts[1].isdigit() else np.nan, parts[2]\n    return np.nan, np.nan, np.nan\n\n\ndef extract_group_id(passenger_id):\n    \"\"\"Extract group ID from PassengerId (e.g., '0001_01' -> '0001').\"\"\"\n    if pd.isna(passenger_id):\n        return np.nan\n    return str(passenger_id).split(\"_\")[0]\n\n\ndef build_predict_fn():\n    train_df, _ = prepare.load_split()\n    \n    # Parse Cabin into Deck, RoomNum, Side\n    cabin_data = train_df[\"Cabin\"].apply(parse_cabin)\n    train_df[\"Deck\"] = cabin_data.apply(lambda x: x[0])\n    train_df[\"RoomNum\"] = cabin_data.apply(lambda x: x[1])\n    train_df[\"Side\"] = cabin_data.apply(lambda x: x[2])\n    \n    # Extract group ID from PassengerId\n    train_df[\"GroupId\"] = train_df[\"PassengerId\"].apply(extract_group_id)\n    \n    # Fill missing values in spending columns with 0 (indicates not spent)\n    for col in SPENDING:\n        train_df[col] = train_df[col].fillna(0)\n    \n    # Create explicit missingness flags for CryoSleep and VIP before filling\n    train_df[\"CryoSleep_Missing\"] = train_df[\"CryoSleep\"].isna().astype(int)\n    train_df[\"VIP_Missing\"] = train_df[\"VIP\"].isna().astype(int)\n    \n    # Convert CryoSleep and VIP to string for categorical encoding\n    train_df[\"CryoSleep\"] = train_df[\"CryoSleep\"].fillna(\"Unknown\").astype(str)\n    train_df[\"VIP\"] = train_df[\"VIP\"].fillna(\"Unknown\").astype(str)\n    \n    # Build feature set: core features + cabin parsing + missingness flags\n    feature_cols = (\n        [\"Age\"] + SPENDING + CATEGORICAL + \n        [\"Deck\", \"RoomNum\", \"Side\", \"GroupId\"] + \n        [\"CryoSleep_Missing\", \"VIP_Missing\"]\n    )\n    X = train_df[feature_cols]\n    y = train_df[\"Transported\"].astype(int)\n    \n    # Define preprocessing for numeric and categorical columns\n    numeric_transformer = Pipeline([\n        (\"imputer\", SimpleImputer(strategy=\"median\")),\n        (\"scaler\", StandardScaler()),\n    ])\n    \n    categorical_transformer = Pipeline([\n        (\"imputer\", SimpleImputer(strategy=\"most_frequent\")),\n        (\"onehot\", OneHotEncoder(handle_unknown=\"ignore\", sparse_output=False)),\n    ])\n    \n    preprocessor = ColumnTransformer([\n        (\"num\", numeric_transformer, [\"Age\", \"RoomNum\", \"CryoSleep_Missing\", \"VIP_Missing\"] + SPENDING),\n        (\"cat\", categorical_transformer, CATEGORICAL + [\"Deck\", \"Side\", \"GroupId\"]),\n    ])\n    \n    pipe = Pipeline([\n        (\"preprocessor\", preprocessor),\n        (\"clf\", LogisticRegression(max_iter=1000, C=0.5, class_weight=\"balanced\")),\n    ])\n    \n    pipe.fit(X, y)\n    \n    def predict(X_val):\n        # Parse Cabin in validation set\n        cabin_data = X_val[\"Cabin\"].apply(parse_cabin)\n        X_val_copy = X_val.copy()\n        X_val_copy[\"Deck\"] = cabin_data.apply(lambda x: x[0])\n        X_val_copy[\"RoomNum\"] = cabin_data.apply(lambda x: x[1])\n        X_val_copy[\"Side\"] = cabin_data.apply(lambda x: x[2])\n        \n        # Extract group ID\n        X_val_copy[\"GroupId\"] = X_val_copy[\"PassengerId\"].apply(extract_group_id)\n        \n        # Fill missing spending with 0\n        for col in SPENDING:\n            X_val_copy[col] = X_val_copy[col].fillna(0)\n        \n        # Create explicit missingness flags for CryoSleep and VIP before filling\n        X_val_copy[\"CryoSleep_Missing\"] = X_val_copy[\"CryoSleep\"].isna().astype(int)\n        X_val_copy[\"VIP_Missing\"] = X_val_copy[\"VIP\"].isna().astype(int)\n        \n        # Handle CryoSleep and VIP\n        X_val_copy[\"CryoSleep\"] = X_val_copy[\"CryoSleep\"].fillna(\"Unknown\").astype(str)\n        X_val_copy[\"VIP\"] = X_val_copy[\"VIP\"].fillna(\"Unknown\").astype(str)\n        \n        return pipe.predict(X_val_copy[feature_cols]).astype(bool)\n    \n    return predict\n\n\nif __name__ == \"__main__\":\n    predict_fn = build_predict_fn()\n    score = prepare.evaluate(predict_fn)\n    print(f\"VAL_ACCURACY: {score:.4f}\")\n```\n</code>\n\n<notes_append>\nIteration 13: Added LogisticRegression regularization tuning (C=0.5, class_weight='balanced') to test whether regularization strength or class balance handling improves beyond 0.7907, keeping all proven features (cabin parsing, GroupId, spending-as-zero, missingness flags).\n</notes_append>", "reflection": "Iteration 12 confirmed that the explicit missingness flags (CryoSleep_Missing, VIP_Missing) are effective—we held at 0.7907, matching the best score from iteration 4, which also had these flags. The pipeline is now stable and clean. The notes show we've tried many feature additions (TotalSpending, GroupSize, PersonId, AnySpending, AgeMissing) that either regressed or didn't improve, and we've tested tree-based models (RandomForest, XGBoost) that underperformed the LogisticRegression + one-hot approach. The current bottleneck is likely either: (1) we've exhausted low-cost feature engineering, (2) LogisticRegression + one-hot encoding has fundamental limits on this data, or (3) there are still undiscovered patterns in the raw features or their interactions.", "observations": ["The best score (0.7907) uses LogisticRegression with cabin parsing, GroupId, spending-as-zero, explicit missingness flags, and one-hot encoding. Tree-based models (RandomForest, XGBoost) regressed when tried, suggesting the data may be too small or the feature-to-sample ratio is unfavorable for trees without careful tuning.", "Iterations 7–9 added many engineered features (TotalSpending, GroupSize, PersonId, AnySpending, AgeMissing) that either regressed or provided no lift. Iteration 9's simplification (removing these) was a reset, and iteration 12's minimal addition (just missingness flags) held the score, suggesting the core 0.7907 model is near its ceiling with this feature set.", "The notes indicate we've tried LogisticRegression hyperparameter tuning (max_iter=1000) and tree-based structural changes; what we haven't systematically explored is regularization strength (C parameter in LogisticRegression) or class balance handling.", "The spending columns are filled with 0 (not spending) rather than mean/median; this is a reasonable domain assumption, but it's worth testing whether a different imputation strategy (mean, or even a learned \"did not spend\" indicator) could help.", "We have not yet tried any form of feature selection (e.g., dropping low-variance or low-correlation features) to see if the model is overfitting to noise, or tried different preprocessing orders (e.g., scaling before one-hot encoding, though that's unusual)."], "hypothesis": "Tuning the regularization strength (C parameter) of LogisticRegression or adding class weight balancing will improve validation accuracy, because the current model may be underfitting or sensitive to class imbalance on this small dataset (~8.7k rows, binary target).", "plan": "I will experiment with LogisticRegression's `C` parameter (inverse regularization strength) and `class_weight='balanced'` to test whether the model is regularized appropriately. I'll try C=0.5 with class_weight='balanced' as a reasonable starting point (more permissive regularization + class balance) to see if it can squeeze out a small improvement. If successful, this is a low-complexity change; if not, I'll know to look at feature selection or alternative preprocessing instead.", "code": "\"\"\"\ntrain.py — logistic regression with cabin parsing, GroupId, explicit missingness flags, and tuned regularization.\n\"\"\"\nimport sys, pathlib\nsys.path.insert(0, str(pathlib.Path(__file__).resolve().parent.parent))\n\nimport pandas as pd\nimport numpy as np\nfrom sklearn.linear_model import LogisticRegression\nfrom sklearn.impute import SimpleImputer\nfrom sklearn.pipeline import Pipeline\nfrom sklearn.preprocessing import StandardScaler, OneHotEncoder\nfrom sklearn.compose import ColumnTransformer\n\nimport prepare\n\nNUMERIC = [\"Age\", \"RoomService\", \"FoodCourt\", \"ShoppingMall\", \"Spa\", \"VRDeck\"]\nCATEGORICAL = [\"HomePlanet\", \"Destination\", \"CryoSleep\", \"VIP\"]\nSPENDING = [\"RoomService\", \"FoodCourt\", \"ShoppingMall\", \"Spa\", \"VRDeck\"]\n\n\ndef parse_cabin(cabin_str):\n    \"\"\"Parse Cabin 'F/0/S' into deck, room_num, side.\"\"\"\n    if pd.isna(cabin_str):\n        return np.nan, np.nan, np.nan\n    parts = str(cabin_str).split(\"/\")\n    if len(parts) == 3:\n        return parts[0], int(parts[1]) if parts[1].isdigit() else np.nan, parts[2]\n    return np.nan, np.nan, np.nan\n\n\ndef extract_group_id(passenger_id):\n    \"\"\"Extract group ID from PassengerId (e.g., '0001_01' -> '0001').\"\"\"\n    if pd.isna(passenger_id):\n        return np.nan\n    return str(passenger_id).split(\"_\")[0]\n\n\ndef build_predict_fn():\n    train_df, _ = prepare.load_split()\n    \n    # Parse Cabin into Deck, RoomNum, Side\n    cabin_data = train_df[\"Cabin\"].apply(parse_cabin)\n    train_df[\"Deck\"] = cabin_data.apply(lambda x: x[0])\n    train_df[\"RoomNum\"] = cabin_data.apply(lambda x: x[1])\n    train_df[\"Side\"] = cabin_data.apply(lambda x: x[2])\n    \n    # Extract group ID from PassengerId\n    train_df[\"GroupId\"] = train_df[\"PassengerId\"].apply(extract_group_id)\n    \n    # Fill missing values in spending columns with 0 (indicates not spent)\n    for col in SPENDING:\n        train_df[col] = train_df[col].fillna(0)\n    \n    # Create explicit missingness flags for CryoSleep and VIP before filling\n    train_df[\"CryoSleep_Missing\"] = train_df[\"CryoSleep\"].isna().astype(int)\n    train_df[\"VIP_Missing\"] = train_df[\"VIP\"].isna().astype(int)\n    \n    # Convert CryoSleep and VIP to string for categorical encoding\n    train_df[\"CryoSleep\"] = train_df[\"CryoSleep\"].fillna(\"Unknown\").astype(str)\n    train_df[\"VIP\"] = train_df[\"VIP\"].fillna(\"Unknown\").astype(str)\n    \n    # Build feature set: core features + cabin parsing + missingness flags\n    feature_cols = (\n        [\"Age\"] + SPENDING + CATEGORICAL + \n        [\"Deck\", \"RoomNum\", \"Side\", \"GroupId\"] + \n        [\"CryoSleep_Missing\", \"VIP_Missing\"]\n    )\n    X = train_df[feature_cols]\n    y = train_df[\"Transported\"].astype(int)\n    \n    # Define preprocessing for numeric and categorical columns\n    numeric_transformer = Pipeline([\n        (\"imputer\", SimpleImputer(strategy=\"median\")),\n        (\"scaler\", StandardScaler()),\n    ])\n    \n    categorical_transformer = Pipeline([\n        (\"imputer\", SimpleImputer(strategy=\"most_frequent\")),\n        (\"onehot\", OneHotEncoder(handle_unknown=\"ignore\", sparse_output=False)),\n    ])\n    \n    preprocessor = ColumnTransformer([\n        (\"num\", numeric_transformer, [\"Age\", \"RoomNum\", \"CryoSleep_Missing\", \"VIP_Missing\"] + SPENDING),\n        (\"cat\", categorical_transformer, CATEGORICAL + [\"Deck\", \"Side\", \"GroupId\"]),\n    ])\n    \n    pipe = Pipeline([\n        (\"preprocessor\", preprocessor),\n        (\"clf\", LogisticRegression(max_iter=1000, C=0.5, class_weight=\"balanced\")),\n    ])\n    \n    pipe.fit(X, y)\n    \n    def predict(X_val):\n        # Parse Cabin in validation set\n        cabin_data = X_val[\"Cabin\"].apply(parse_cabin)\n        X_val_copy = X_val.copy()\n        X_val_copy[\"Deck\"] = cabin_data.apply(lambda x: x[0])\n        X_val_copy[\"RoomNum\"] = cabin_data.apply(lambda x: x[1])\n        X_val_copy[\"Side\"] = cabin_data.apply(lambda x: x[2])\n        \n        # Extract group ID\n        X_val_copy[\"GroupId\"] = X_val_copy[\"PassengerId\"].apply(extract_group_id)\n        \n        # Fill missing spending with 0\n        for col in SPENDING:\n            X_val_copy[col] = X_val_copy[col].fillna(0)\n        \n        # Create explicit missingness flags for CryoSleep and VIP before filling\n        X_val_copy[\"CryoSleep_Missing\"] = X_val_copy[\"CryoSleep\"].isna().astype(int)\n        X_val_copy[\"VIP_Missing\"] = X_val_copy[\"VIP\"].isna().astype(int)\n        \n        # Handle CryoSleep and VIP\n        X_val_copy[\"CryoSleep\"] = X_val_copy[\"CryoSleep\"].fillna(\"Unknown\").astype(str)\n        X_val_copy[\"VIP\"] = X_val_copy[\"VIP\"].fillna(\"Unknown\").astype(str)\n        \n        return pipe.predict(X_val_copy[feature_cols]).astype(bool)\n    \n    return predict\n\n\nif __name__ == \"__main__\":\n    predict_fn = build_predict_fn()\n    score = prepare.evaluate(predict_fn)\n    print(f\"VAL_ACCURACY: {score:.4f}\")\n", "notes_append": "Iteration 13: Added LogisticRegression regularization tuning (C=0.5, class_weight='balanced') to test whether regularization strength or class balance handling improves beyond 0.7907, keeping all proven features (cabin parsing, GroupId, spending-as-zero, missingness flags).", "stdout": "VAL_ACCURACY: 0.7901\n", "stderr": "", "returncode": 0, "score": 0.7901, "kept": false, "status": "reverted", "commit_hash": null, "input_tokens": 3890, "output_tokens": 2457, "cost_usd": 0.016175000000000002}
