{"iteration": 4, "timestamp": "2026-05-08T22:39:16", "previous_best": 0.8235, "duration_seconds": 11.56, "agent_response_raw": "<reflection>\nThe last run scored 0.8125, which is a regression from the current best of 0.8235. According to the notes, iteration 91 attempted to restore the iter 80 baseline but achieved only 0.8125. This suggests either the restoration wasn't exact, or there's been drift in the codebase. The current train.py has feature importance diagnostics printing to stderr, which was added in iter 89. I need to examine what went wrong and either restore the exact iter 80 config or identify what changed.\n</reflection>\n\n<observations>\n- The score dropped from 0.8235 to 0.8125, a regression of ~0.01. The notes say iter 91 attempted to restore iter 80 but failed to achieve the baseline.\n- The current code still includes the feature importance diagnostic (printing to stderr), which shouldn't affect the model itself but suggests the codebase drifted from a known good state.\n- The notes mention iter 90 removed many features (PassengerId, GroupId, group aggregates) and regressed to 0.8183, then iter 91 tried to restore iter 80 but got 0.8125 instead—worse than iter 90. This suggests the restoration attempt had a subtle error.\n- The current code includes features like `CryoSleep_LogSpending`, `GroupSize`, `GroupMedianSpending`, and group-based aggregates, which the notes indicate were valuable in iter 80.\n- The best score is still 0.8235 from iter 0 (which was actually a previous iteration labeled as iter 1 in the recent history). I should audit the exact configuration against what worked.\n</observations>\n\n<hypothesis>\nThe iter 80 baseline code that achieved 0.8235 had a specific configuration of features and hyperparameters. Iter 91's attempt to restore it introduced a subtle bug (e.g., wrong feature list, missing preprocessing step, or hyperparameter mismatch). By carefully reviewing the feature engineering pipeline and ensuring all engineered features are included in the correct order without typos, I can restore the 0.8235 score.\n</hypothesis>\n\n<plan>\nI will audit the current code against the known-good iter 80 structure. The main areas to verify: (1) all engineered features (TotalSpending, CryoSleep_LogSpending, Spending_Recorded, Deck/RoomNum/Side, group aggregates, missingness flags) are created correctly; (2) the feature column list matches exactly; (3) XGBoost hyperparameters are max_depth=6, n_estimators=100, learning_rate=0.1. I'll also remove the feature importance print statements to clean up stderr and focus on the core pipeline.\n</plan>\n\n<code>\n```python\n\"\"\"\ntrain.py — Iteration 92: Restore iter 80 baseline cleanly (0.8235 target).\nAudit feature engineering and remove diagnostic prints.\n\"\"\"\nimport sys, pathlib\nsys.path.insert(0, str(pathlib.Path(__file__).resolve().parent.parent))\n\nimport pandas as pd\nimport numpy as np\nimport xgboost as xgb\nfrom sklearn.impute import SimpleImputer\nfrom sklearn.pipeline import Pipeline\nfrom sklearn.preprocessing import StandardScaler, OneHotEncoder\nfrom sklearn.compose import ColumnTransformer\n\nimport prepare\n\nNUMERIC = [\"Age\", \"RoomService\", \"FoodCourt\", \"ShoppingMall\", \"Spa\", \"VRDeck\"]\nCATEGORICAL = [\"HomePlanet\", \"Destination\", \"CryoSleep\", \"VIP\"]\nSPENDING = [\"RoomService\", \"FoodCourt\", \"ShoppingMall\", \"Spa\", \"VRDeck\"]\n\n\ndef parse_cabin(cabin_str):\n    \"\"\"Parse Cabin 'F/0/S' into deck, room_num, side.\"\"\"\n    if pd.isna(cabin_str):\n        return np.nan, np.nan, np.nan\n    parts = str(cabin_str).split(\"/\")\n    if len(parts) == 3:\n        return parts[0], int(parts[1]) if parts[1].isdigit() else np.nan, parts[2]\n    return np.nan, np.nan, np.nan\n\n\ndef extract_group_id(passenger_id):\n    \"\"\"Extract group ID from PassengerId (e.g., '0001_01' -> '0001').\"\"\"\n    if pd.isna(passenger_id):\n        return np.nan\n    return str(passenger_id).split(\"_\")[0]\n\n\ndef engineer_features(df):\n    \"\"\"Engineer spending and spending-cryo interaction features.\"\"\"\n    df_copy = df.copy()\n    \n    # Track which rows have any spending data recorded\n    spending_recorded = ~df_copy[SPENDING].isna().any(axis=1)\n    df_copy[\"Spending_Recorded\"] = spending_recorded.astype(int)\n    \n    # Fill missing spending with median per HomePlanet group, then global median\n    for col in SPENDING:\n        missing_mask = df_copy[col].isna()\n        if missing_mask.any():\n            group_medians = df_copy.groupby(\"HomePlanet\")[col].median()\n            df_copy.loc[missing_mask, col] = df_copy.loc[missing_mask, \"HomePlanet\"].map(group_medians)\n            global_median = df_copy[col].median()\n            df_copy[col] = df_copy[col].fillna(global_median)\n    \n    # Total spending\n    df_copy[\"TotalSpending\"] = df_copy[SPENDING].sum(axis=1)\n    \n    # Interaction: CryoSleep status and log spending\n    cryo_status = df_copy[\"CryoSleep\"].fillna(False)\n    log_spending = np.log1p(df_copy[\"TotalSpending\"])\n    df_copy[\"CryoSleep_LogSpending\"] = (cryo_status == True) * log_spending\n    \n    return df_copy\n\n\ndef add_group_features(df):\n    \"\"\"Add group-level aggregate features based on PassengerId group.\"\"\"\n    df_copy = df.copy()\n    \n    # Extract group ID\n    df_copy[\"GroupId\"] = df_copy[\"PassengerId\"].apply(extract_group_id)\n    \n    # Compute group size\n    group_sizes = df_copy.groupby(\"GroupId\").size()\n    df_copy[\"GroupSize\"] = df_copy[\"GroupId\"].map(group_sizes)\n    \n    # Compute group median total spending\n    group_median_spending = df_copy.groupby(\"GroupId\")[\"TotalSpending\"].median()\n    df_copy[\"GroupMedianSpending\"] = df_copy[\"GroupId\"].map(group_median_spending)\n    \n    return df_copy\n\n\ndef build_predict_fn():\n    train_df, _ = prepare.load_split()\n    \n    # Parse Cabin into Deck, RoomNum, Side\n    cabin_data = train_df[\"Cabin\"].apply(parse_cabin)\n    train_df[\"Deck\"] = cabin_data.apply(lambda x: x[0])\n    train_df[\"RoomNum\"] = cabin_data.apply(lambda x: x[1])\n    train_df[\"Side\"] = cabin_data.apply(lambda x: x[2])\n    \n    # Engineer features\n    train_df = engineer_features(train_df)\n    \n    # Add group-level features\n    train_df = add_group_features(train_df)\n    \n    # Create explicit missingness flags for CryoSleep and VIP\n    train_df[\"CryoSleep_Missing\"] = train_df[\"CryoSleep\"].isna().astype(int)\n    train_df[\"VIP_Missing\"] = train_df[\"VIP\"].isna().astype(int)\n    \n    # Convert CryoSleep and VIP to string for categorical encoding\n    train_df[\"CryoSleep\"] = train_df[\"CryoSleep\"].fillna(\"Unknown\").astype(str)\n    train_df[\"VIP\"] = train_df[\"VIP\"].fillna(\"Unknown\").astype(str)\n    \n    # Build feature set: order matters for reproducibility\n    feature_cols = (\n        [\"Age\"] + SPENDING + [\"TotalSpending\", \"CryoSleep_LogSpending\", \"Spending_Recorded\"] +\n        CATEGORICAL + \n        [\"Deck\", \"RoomNum\", \"Side\", \"PassengerId\", \"GroupId\"] + \n        [\"CryoSleep_Missing\", \"VIP_Missing\"] +\n        [\"GroupSize\", \"GroupMedianSpending\"]\n    )\n    X = train_df[feature_cols]\n    y = train_df[\"Transported\"].astype(int)\n    \n    # Define preprocessing\n    numeric_transformer = Pipeline([\n        (\"imputer\", SimpleImputer(strategy=\"median\")),\n        (\"scaler\", StandardScaler()),\n    ])\n    \n    categorical_transformer = Pipeline([\n        (\"imputer\", SimpleImputer(strategy=\"most_frequent\")),\n        (\"onehot\", OneHotEncoder(handle_unknown=\"ignore\", sparse_output=False)),\n    ])\n    \n    numeric_feature_cols = (\n        [\"Age\", \"RoomNum\", \"CryoSleep_Missing\", \"VIP_Missing\", \"Spending_Recorded\"] + \n        SPENDING + [\"TotalSpending\", \"CryoSleep_LogSpending\"] +\n        [\"GroupSize\", \"GroupMedianSpending\"]\n    )\n    categorical_feature_cols = CATEGORICAL + [\"Deck\", \"Side\", \"PassengerId\", \"GroupId\"]\n    \n    preprocessor = ColumnTransformer([\n        (\"num\", numeric_transformer, numeric_feature_cols),\n        (\"cat\", categorical_transformer, categorical_feature_cols),\n    ])\n    \n    # XGBoost with iter 80 hyperparameters\n    pipe = Pipeline([\n        (\"preprocessor\", preprocessor),\n        (\"clf\", xgb.XGBClassifier(\n            max_depth=6,\n            n_estimators=100,\n            learning_rate=0.1,\n            random_state=42,\n            verbosity=0\n        )),\n    ])\n    \n    pipe.fit(X, y)\n    \n    def predict(X_val):\n        cabin_data = X_val[\"Cabin\"].apply(parse_cabin)\n        X_val_copy = X_val.copy()\n        X_val_copy[\"Deck\"] = cabin_data.apply(lambda x: x[0])\n        X_val_copy[\"RoomNum\"] = cabin_data.apply(lambda x: x[1])\n        X_val_copy[\"Side\"] = cabin_data.apply(lambda x: x[2])\n        \n        # Engineer features\n        X_val_copy = engineer_features(X_val_copy)\n        \n        # Add group-level features from training stats\n        X_val_copy[\"GroupId\"] = X_val_copy[\"PassengerId\"].apply(extract_group_id)\n        X_val_copy[\"GroupSize\"] = X_val_copy[\"GroupId\"].map(pd.Series(\n            train_df.groupby(\"GroupId\").size().to_dict()\n        ))\n        X_val_copy[\"GroupMedianSpending\"] = X_val_copy[\"GroupId\"].map(pd.Series(\n            train_df.groupby(\"GroupId\")[\"TotalSpending\"].median().to_dict()\n        ))\n        \n        # Missingness flags\n        X_val_copy[\"CryoSleep_Missing\"] = X_val_copy[\"CryoSleep\"].isna().astype(int)\n        X_val_copy[\"VIP_Missing\"] = X_val_copy[\"VIP\"].isna().astype(int)\n        \n        # Handle CryoSleep and VIP\n        X_val_copy[\"CryoSleep\"] = X_val_copy[\"CryoSleep\"].fillna(\"Unknown\").astype(str)\n        X_val_copy[\"VIP\"] = X_val_copy[\"VIP\"].fillna(\"Unknown\").astype(str)\n        \n        return pipe.predict(X_val_copy[feature_cols]).astype(bool)\n    \n    return predict\n\n\nif __name__ == \"__main__\":\n    predict_fn = build_predict_fn()\n    score = prepare.evaluate(predict_fn)\n    print(f\"VAL_ACCURACY: {score:.4f}\")\n```\n</code>\n\n<notes_append>\nIteration 92: Removed feature importance diagnostic prints and re-verified iter 80 baseline structure. Added PassengerId and GroupId back to categorical feature list (they were present in iter 80). Targeting 0.8235 restoration with clean, focused pipeline.\n</notes_append>", "reflection": "The last run scored 0.8125, which is a regression from the current best of 0.8235. According to the notes, iteration 91 attempted to restore the iter 80 baseline but achieved only 0.8125. This suggests either the restoration wasn't exact, or there's been drift in the codebase. The current train.py has feature importance diagnostics printing to stderr, which was added in iter 89. I need to examine what went wrong and either restore the exact iter 80 config or identify what changed.", "observations": ["The score dropped from 0.8235 to 0.8125, a regression of ~0.01. The notes say iter 91 attempted to restore iter 80 but failed to achieve the baseline.", "The current code still includes the feature importance diagnostic (printing to stderr), which shouldn't affect the model itself but suggests the codebase drifted from a known good state.", "The notes mention iter 90 removed many features (PassengerId, GroupId, group aggregates) and regressed to 0.8183, then iter 91 tried to restore iter 80 but got 0.8125 instead—worse than iter 90. This suggests the restoration attempt had a subtle error.", "The current code includes features like `CryoSleep_LogSpending`, `GroupSize`, `GroupMedianSpending`, and group-based aggregates, which the notes indicate were valuable in iter 80.", "The best score is still 0.8235 from iter 0 (which was actually a previous iteration labeled as iter 1 in the recent history). I should audit the exact configuration against what worked."], "hypothesis": "The iter 80 baseline code that achieved 0.8235 had a specific configuration of features and hyperparameters. Iter 91's attempt to restore it introduced a subtle bug (e.g., wrong feature list, missing preprocessing step, or hyperparameter mismatch). By carefully reviewing the feature engineering pipeline and ensuring all engineered features are included in the correct order without typos, I can restore the 0.8235 score.", "plan": "I will audit the current code against the known-good iter 80 structure. The main areas to verify: (1) all engineered features (TotalSpending, CryoSleep_LogSpending, Spending_Recorded, Deck/RoomNum/Side, group aggregates, missingness flags) are created correctly; (2) the feature column list matches exactly; (3) XGBoost hyperparameters are max_depth=6, n_estimators=100, learning_rate=0.1. I'll also remove the feature importance print statements to clean up stderr and focus on the core pipeline.", "code": "\"\"\"\ntrain.py — Iteration 92: Restore iter 80 baseline cleanly (0.8235 target).\nAudit feature engineering and remove diagnostic prints.\n\"\"\"\nimport sys, pathlib\nsys.path.insert(0, str(pathlib.Path(__file__).resolve().parent.parent))\n\nimport pandas as pd\nimport numpy as np\nimport xgboost as xgb\nfrom sklearn.impute import SimpleImputer\nfrom sklearn.pipeline import Pipeline\nfrom sklearn.preprocessing import StandardScaler, OneHotEncoder\nfrom sklearn.compose import ColumnTransformer\n\nimport prepare\n\nNUMERIC = [\"Age\", \"RoomService\", \"FoodCourt\", \"ShoppingMall\", \"Spa\", \"VRDeck\"]\nCATEGORICAL = [\"HomePlanet\", \"Destination\", \"CryoSleep\", \"VIP\"]\nSPENDING = [\"RoomService\", \"FoodCourt\", \"ShoppingMall\", \"Spa\", \"VRDeck\"]\n\n\ndef parse_cabin(cabin_str):\n    \"\"\"Parse Cabin 'F/0/S' into deck, room_num, side.\"\"\"\n    if pd.isna(cabin_str):\n        return np.nan, np.nan, np.nan\n    parts = str(cabin_str).split(\"/\")\n    if len(parts) == 3:\n        return parts[0], int(parts[1]) if parts[1].isdigit() else np.nan, parts[2]\n    return np.nan, np.nan, np.nan\n\n\ndef extract_group_id(passenger_id):\n    \"\"\"Extract group ID from PassengerId (e.g., '0001_01' -> '0001').\"\"\"\n    if pd.isna(passenger_id):\n        return np.nan\n    return str(passenger_id).split(\"_\")[0]\n\n\ndef engineer_features(df):\n    \"\"\"Engineer spending and spending-cryo interaction features.\"\"\"\n    df_copy = df.copy()\n    \n    # Track which rows have any spending data recorded\n    spending_recorded = ~df_copy[SPENDING].isna().any(axis=1)\n    df_copy[\"Spending_Recorded\"] = spending_recorded.astype(int)\n    \n    # Fill missing spending with median per HomePlanet group, then global median\n    for col in SPENDING:\n        missing_mask = df_copy[col].isna()\n        if missing_mask.any():\n            group_medians = df_copy.groupby(\"HomePlanet\")[col].median()\n            df_copy.loc[missing_mask, col] = df_copy.loc[missing_mask, \"HomePlanet\"].map(group_medians)\n            global_median = df_copy[col].median()\n            df_copy[col] = df_copy[col].fillna(global_median)\n    \n    # Total spending\n    df_copy[\"TotalSpending\"] = df_copy[SPENDING].sum(axis=1)\n    \n    # Interaction: CryoSleep status and log spending\n    cryo_status = df_copy[\"CryoSleep\"].fillna(False)\n    log_spending = np.log1p(df_copy[\"TotalSpending\"])\n    df_copy[\"CryoSleep_LogSpending\"] = (cryo_status == True) * log_spending\n    \n    return df_copy\n\n\ndef add_group_features(df):\n    \"\"\"Add group-level aggregate features based on PassengerId group.\"\"\"\n    df_copy = df.copy()\n    \n    # Extract group ID\n    df_copy[\"GroupId\"] = df_copy[\"PassengerId\"].apply(extract_group_id)\n    \n    # Compute group size\n    group_sizes = df_copy.groupby(\"GroupId\").size()\n    df_copy[\"GroupSize\"] = df_copy[\"GroupId\"].map(group_sizes)\n    \n    # Compute group median total spending\n    group_median_spending = df_copy.groupby(\"GroupId\")[\"TotalSpending\"].median()\n    df_copy[\"GroupMedianSpending\"] = df_copy[\"GroupId\"].map(group_median_spending)\n    \n    return df_copy\n\n\ndef build_predict_fn():\n    train_df, _ = prepare.load_split()\n    \n    # Parse Cabin into Deck, RoomNum, Side\n    cabin_data = train_df[\"Cabin\"].apply(parse_cabin)\n    train_df[\"Deck\"] = cabin_data.apply(lambda x: x[0])\n    train_df[\"RoomNum\"] = cabin_data.apply(lambda x: x[1])\n    train_df[\"Side\"] = cabin_data.apply(lambda x: x[2])\n    \n    # Engineer features\n    train_df = engineer_features(train_df)\n    \n    # Add group-level features\n    train_df = add_group_features(train_df)\n    \n    # Create explicit missingness flags for CryoSleep and VIP\n    train_df[\"CryoSleep_Missing\"] = train_df[\"CryoSleep\"].isna().astype(int)\n    train_df[\"VIP_Missing\"] = train_df[\"VIP\"].isna().astype(int)\n    \n    # Convert CryoSleep and VIP to string for categorical encoding\n    train_df[\"CryoSleep\"] = train_df[\"CryoSleep\"].fillna(\"Unknown\").astype(str)\n    train_df[\"VIP\"] = train_df[\"VIP\"].fillna(\"Unknown\").astype(str)\n    \n    # Build feature set: order matters for reproducibility\n    feature_cols = (\n        [\"Age\"] + SPENDING + [\"TotalSpending\", \"CryoSleep_LogSpending\", \"Spending_Recorded\"] +\n        CATEGORICAL + \n        [\"Deck\", \"RoomNum\", \"Side\", \"PassengerId\", \"GroupId\"] + \n        [\"CryoSleep_Missing\", \"VIP_Missing\"] +\n        [\"GroupSize\", \"GroupMedianSpending\"]\n    )\n    X = train_df[feature_cols]\n    y = train_df[\"Transported\"].astype(int)\n    \n    # Define preprocessing\n    numeric_transformer = Pipeline([\n        (\"imputer\", SimpleImputer(strategy=\"median\")),\n        (\"scaler\", StandardScaler()),\n    ])\n    \n    categorical_transformer = Pipeline([\n        (\"imputer\", SimpleImputer(strategy=\"most_frequent\")),\n        (\"onehot\", OneHotEncoder(handle_unknown=\"ignore\", sparse_output=False)),\n    ])\n    \n    numeric_feature_cols = (\n        [\"Age\", \"RoomNum\", \"CryoSleep_Missing\", \"VIP_Missing\", \"Spending_Recorded\"] + \n        SPENDING + [\"TotalSpending\", \"CryoSleep_LogSpending\"] +\n        [\"GroupSize\", \"GroupMedianSpending\"]\n    )\n    categorical_feature_cols = CATEGORICAL + [\"Deck\", \"Side\", \"PassengerId\", \"GroupId\"]\n    \n    preprocessor = ColumnTransformer([\n        (\"num\", numeric_transformer, numeric_feature_cols),\n        (\"cat\", categorical_transformer, categorical_feature_cols),\n    ])\n    \n    # XGBoost with iter 80 hyperparameters\n    pipe = Pipeline([\n        (\"preprocessor\", preprocessor),\n        (\"clf\", xgb.XGBClassifier(\n            max_depth=6,\n            n_estimators=100,\n            learning_rate=0.1,\n            random_state=42,\n            verbosity=0\n        )),\n    ])\n    \n    pipe.fit(X, y)\n    \n    def predict(X_val):\n        cabin_data = X_val[\"Cabin\"].apply(parse_cabin)\n        X_val_copy = X_val.copy()\n        X_val_copy[\"Deck\"] = cabin_data.apply(lambda x: x[0])\n        X_val_copy[\"RoomNum\"] = cabin_data.apply(lambda x: x[1])\n        X_val_copy[\"Side\"] = cabin_data.apply(lambda x: x[2])\n        \n        # Engineer features\n        X_val_copy = engineer_features(X_val_copy)\n        \n        # Add group-level features from training stats\n        X_val_copy[\"GroupId\"] = X_val_copy[\"PassengerId\"].apply(extract_group_id)\n        X_val_copy[\"GroupSize\"] = X_val_copy[\"GroupId\"].map(pd.Series(\n            train_df.groupby(\"GroupId\").size().to_dict()\n        ))\n        X_val_copy[\"GroupMedianSpending\"] = X_val_copy[\"GroupId\"].map(pd.Series(\n            train_df.groupby(\"GroupId\")[\"TotalSpending\"].median().to_dict()\n        ))\n        \n        # Missingness flags\n        X_val_copy[\"CryoSleep_Missing\"] = X_val_copy[\"CryoSleep\"].isna().astype(int)\n        X_val_copy[\"VIP_Missing\"] = X_val_copy[\"VIP\"].isna().astype(int)\n        \n        # Handle CryoSleep and VIP\n        X_val_copy[\"CryoSleep\"] = X_val_copy[\"CryoSleep\"].fillna(\"Unknown\").astype(str)\n        X_val_copy[\"VIP\"] = X_val_copy[\"VIP\"].fillna(\"Unknown\").astype(str)\n        \n        return pipe.predict(X_val_copy[feature_cols]).astype(bool)\n    \n    return predict\n\n\nif __name__ == \"__main__\":\n    predict_fn = build_predict_fn()\n    score = prepare.evaluate(predict_fn)\n    print(f\"VAL_ACCURACY: {score:.4f}\")\n", "notes_append": "Iteration 92: Removed feature importance diagnostic prints and re-verified iter 80 baseline structure. Added PassengerId and GroupId back to categorical feature list (they were present in iter 80). Targeting 0.8235 restoration with clean, focused pipeline.", "stdout": "VAL_ACCURACY: 0.8235\n", "stderr": "", "returncode": 0, "score": 0.8235, "kept": true, "status": "kept", "commit_hash": "7ed8751", "input_tokens": 5133, "output_tokens": 3086, "cost_usd": 0.020563}
