{"iteration": 2, "timestamp": "2026-05-08T20:33:18", "previous_best": 0.7884, "duration_seconds": 4.51, "agent_response_raw": "<reflection>\nThe current best score is 0.7884, which is above the baseline of 0.78. The Cabin parsing and categorical feature engineering are working. However, I'm at a plateau and should look deeper into the data structure. The hints mention that missing values may not be missing at random, and that identifier columns can encode group structure. I haven't explored the PassengerId structure yet, nor have I checked whether the pattern of missing values themselves is predictive.\n</reflection>\n\n<observations>\n- The PassengerId column (e.g., \"0001_01\") likely encodes group structure: the first part is a group ID, the second is position within that group. Groups may travel together and share transportation fate.\n- Missing values across spending columns (RoomService, FoodCourt, etc.) may indicate passengers who didn't spend, which could be a distinct behavioral pattern rather than true missingness.\n- The current model treats numeric imputation (median) and categorical imputation (mode) independently, but the spending columns have a special structure: a zero might mean \"didn't use\" rather than \"unknown\".\n- CryoSleep and VIP are already numeric (True/False/NaN) in the data, converting to string may be losing information; NaN in these could itself be predictive.\n- I have not yet explored interaction effects or whether the Transported outcome depends on group membership from PassengerId.\n</observations>\n\n<hypothesis>\nExtracting the group ID from PassengerId and using it as a feature (or grouping by it) will improve accuracy, because passengers in the same group likely share the same transportation fate. Additionally, treating missing values in spending columns as explicit zeros (indicating non-use) rather than imputing with median will better capture behavior.\n</hypothesis>\n\n<plan>\nI will extract the group ID from PassengerId, add it as a categorical feature, and fill missing values in spending columns with 0 instead of median imputation. This captures the structure that missing spending likely means the passenger didn't use that service, which may correlate with being transported.\n</plan>\n\n<code>\n```python\n\"\"\"\ntrain.py — group structure from PassengerId, explicit zero imputation for spending.\n\"\"\"\nimport sys, pathlib\nsys.path.insert(0, str(pathlib.Path(__file__).resolve().parent.parent))\n\nimport pandas as pd\nimport numpy as np\nfrom sklearn.linear_model import LogisticRegression\nfrom sklearn.impute import SimpleImputer\nfrom sklearn.pipeline import Pipeline\nfrom sklearn.preprocessing import StandardScaler, OneHotEncoder\nfrom sklearn.compose import ColumnTransformer\n\nimport prepare\n\nNUMERIC = [\"Age\", \"RoomService\", \"FoodCourt\", \"ShoppingMall\", \"Spa\", \"VRDeck\"]\nCATEGORICAL = [\"HomePlanet\", \"Destination\", \"CryoSleep\", \"VIP\"]\nSPENDING = [\"RoomService\", \"FoodCourt\", \"ShoppingMall\", \"Spa\", \"VRDeck\"]\n\n\ndef parse_cabin(cabin_str):\n    \"\"\"Parse Cabin 'F/0/S' into deck, room_num, side.\"\"\"\n    if pd.isna(cabin_str):\n        return np.nan, np.nan, np.nan\n    parts = str(cabin_str).split(\"/\")\n    if len(parts) == 3:\n        return parts[0], int(parts[1]) if parts[1].isdigit() else np.nan, parts[2]\n    return np.nan, np.nan, np.nan\n\n\ndef extract_group_id(passenger_id):\n    \"\"\"Extract group ID from PassengerId (e.g., '0001_01' -> '0001').\"\"\"\n    if pd.isna(passenger_id):\n        return np.nan\n    return str(passenger_id).split(\"_\")[0]\n\n\ndef build_predict_fn():\n    train_df, _ = prepare.load_split()\n    \n    # Parse Cabin into Deck, RoomNum, Side\n    cabin_data = train_df[\"Cabin\"].apply(parse_cabin)\n    train_df[\"Deck\"] = cabin_data.apply(lambda x: x[0])\n    train_df[\"RoomNum\"] = cabin_data.apply(lambda x: x[1])\n    train_df[\"Side\"] = cabin_data.apply(lambda x: x[2])\n    \n    # Extract group ID from PassengerId\n    train_df[\"GroupId\"] = train_df[\"PassengerId\"].apply(extract_group_id)\n    \n    # Fill missing values in spending columns with 0 (not used)\n    for col in SPENDING:\n        train_df[col] = train_df[col].fillna(0)\n    \n    # Convert CryoSleep and VIP to numeric (handle NaN explicitly)\n    train_df[\"CryoSleep\"] = train_df[\"CryoSleep\"].fillna(\"Unknown\").astype(str)\n    train_df[\"VIP\"] = train_df[\"VIP\"].fillna(\"Unknown\").astype(str)\n    \n    # Build feature set\n    X = train_df[[\"Age\"] + SPENDING + CATEGORICAL + [\"Deck\", \"RoomNum\", \"Side\", \"GroupId\"]]\n    y = train_df[\"Transported\"].astype(int)\n    \n    # Define preprocessing for numeric and categorical columns\n    numeric_transformer = Pipeline([\n        (\"imputer\", SimpleImputer(strategy=\"median\")),\n        (\"scaler\", StandardScaler()),\n    ])\n    \n    categorical_transformer = Pipeline([\n        (\"imputer\", SimpleImputer(strategy=\"most_frequent\")),\n        (\"onehot\", OneHotEncoder(handle_unknown=\"ignore\", sparse_output=False)),\n    ])\n    \n    preprocessor = ColumnTransformer([\n        (\"num\", numeric_transformer, [\"Age\", \"RoomNum\"]),\n        (\"cat\", categorical_transformer, CATEGORICAL + [\"Deck\", \"Side\", \"GroupId\"]),\n        (\"spending\", numeric_transformer, SPENDING),\n    ])\n    \n    pipe = Pipeline([\n        (\"preprocessor\", preprocessor),\n        (\"clf\", LogisticRegression(max_iter=1000)),\n    ])\n    \n    pipe.fit(X, y)\n    \n    def predict(X_val):\n        # Parse Cabin in validation set\n        cabin_data = X_val[\"Cabin\"].apply(parse_cabin)\n        X_val_copy = X_val.copy()\n        X_val_copy[\"Deck\"] = cabin_data.apply(lambda x: x[0])\n        X_val_copy[\"RoomNum\"] = cabin_data.apply(lambda x: x[1])\n        X_val_copy[\"Side\"] = cabin_data.apply(lambda x: x[2])\n        \n        # Extract group ID\n        X_val_copy[\"GroupId\"] = X_val_copy[\"PassengerId\"].apply(extract_group_id)\n        \n        # Fill missing spending with 0\n        for col in SPENDING:\n            X_val_copy[col] = X_val_copy[col].fillna(0)\n        \n        # Handle CryoSleep and VIP\n        X_val_copy[\"CryoSleep\"] = X_val_copy[\"CryoSleep\"].fillna(\"Unknown\").astype(str)\n        X_val_copy[\"VIP\"] = X_val_copy[\"VIP\"].fillna(\"Unknown\").astype(str)\n        \n        return pipe.predict(X_val_copy[[\"Age\"] + SPENDING + CATEGORICAL + [\"Deck\", \"RoomNum\", \"Side\", \"GroupId\"]]).astype(bool)\n    \n    return predict\n\n\nif __name__ == \"__main__\":\n    predict_fn = build_predict_fn()\n    score = prepare.evaluate(predict_fn)\n    print(f\"VAL_ACCURACY: {score:.4f}\")\n```\n</code>\n\n<notes_append>\nIteration 3: Extracted GroupId from PassengerId (group structure), filled missing spending values with 0 instead of median imputation (indicating non-use), and handled NaN in CryoSleep/VIP as explicit \"Unknown\" category. Testing whether group membership and spending patterns improve on 0.7884.\n</notes_append>", "reflection": "The current best score is 0.7884, which is above the baseline of 0.78. The Cabin parsing and categorical feature engineering are working. However, I'm at a plateau and should look deeper into the data structure. The hints mention that missing values may not be missing at random, and that identifier columns can encode group structure. I haven't explored the PassengerId structure yet, nor have I checked whether the pattern of missing values themselves is predictive.", "observations": ["The PassengerId column (e.g., \"0001_01\") likely encodes group structure: the first part is a group ID, the second is position within that group. Groups may travel together and share transportation fate.", "Missing values across spending columns (RoomService, FoodCourt, etc.) may indicate passengers who didn't spend, which could be a distinct behavioral pattern rather than true missingness.", "The current model treats numeric imputation (median) and categorical imputation (mode) independently, but the spending columns have a special structure: a zero might mean \"didn't use\" rather than \"unknown\".", "CryoSleep and VIP are already numeric (True/False/NaN) in the data, converting to string may be losing information; NaN in these could itself be predictive.", "I have not yet explored interaction effects or whether the Transported outcome depends on group membership from PassengerId."], "hypothesis": "Extracting the group ID from PassengerId and using it as a feature (or grouping by it) will improve accuracy, because passengers in the same group likely share the same transportation fate. Additionally, treating missing values in spending columns as explicit zeros (indicating non-use) rather than imputing with median will better capture behavior.", "plan": "I will extract the group ID from PassengerId, add it as a categorical feature, and fill missing values in spending columns with 0 instead of median imputation. This captures the structure that missing spending likely means the passenger didn't use that service, which may correlate with being transported.", "code": "\"\"\"\ntrain.py — group structure from PassengerId, explicit zero imputation for spending.\n\"\"\"\nimport sys, pathlib\nsys.path.insert(0, str(pathlib.Path(__file__).resolve().parent.parent))\n\nimport pandas as pd\nimport numpy as np\nfrom sklearn.linear_model import LogisticRegression\nfrom sklearn.impute import SimpleImputer\nfrom sklearn.pipeline import Pipeline\nfrom sklearn.preprocessing import StandardScaler, OneHotEncoder\nfrom sklearn.compose import ColumnTransformer\n\nimport prepare\n\nNUMERIC = [\"Age\", \"RoomService\", \"FoodCourt\", \"ShoppingMall\", \"Spa\", \"VRDeck\"]\nCATEGORICAL = [\"HomePlanet\", \"Destination\", \"CryoSleep\", \"VIP\"]\nSPENDING = [\"RoomService\", \"FoodCourt\", \"ShoppingMall\", \"Spa\", \"VRDeck\"]\n\n\ndef parse_cabin(cabin_str):\n    \"\"\"Parse Cabin 'F/0/S' into deck, room_num, side.\"\"\"\n    if pd.isna(cabin_str):\n        return np.nan, np.nan, np.nan\n    parts = str(cabin_str).split(\"/\")\n    if len(parts) == 3:\n        return parts[0], int(parts[1]) if parts[1].isdigit() else np.nan, parts[2]\n    return np.nan, np.nan, np.nan\n\n\ndef extract_group_id(passenger_id):\n    \"\"\"Extract group ID from PassengerId (e.g., '0001_01' -> '0001').\"\"\"\n    if pd.isna(passenger_id):\n        return np.nan\n    return str(passenger_id).split(\"_\")[0]\n\n\ndef build_predict_fn():\n    train_df, _ = prepare.load_split()\n    \n    # Parse Cabin into Deck, RoomNum, Side\n    cabin_data = train_df[\"Cabin\"].apply(parse_cabin)\n    train_df[\"Deck\"] = cabin_data.apply(lambda x: x[0])\n    train_df[\"RoomNum\"] = cabin_data.apply(lambda x: x[1])\n    train_df[\"Side\"] = cabin_data.apply(lambda x: x[2])\n    \n    # Extract group ID from PassengerId\n    train_df[\"GroupId\"] = train_df[\"PassengerId\"].apply(extract_group_id)\n    \n    # Fill missing values in spending columns with 0 (not used)\n    for col in SPENDING:\n        train_df[col] = train_df[col].fillna(0)\n    \n    # Convert CryoSleep and VIP to numeric (handle NaN explicitly)\n    train_df[\"CryoSleep\"] = train_df[\"CryoSleep\"].fillna(\"Unknown\").astype(str)\n    train_df[\"VIP\"] = train_df[\"VIP\"].fillna(\"Unknown\").astype(str)\n    \n    # Build feature set\n    X = train_df[[\"Age\"] + SPENDING + CATEGORICAL + [\"Deck\", \"RoomNum\", \"Side\", \"GroupId\"]]\n    y = train_df[\"Transported\"].astype(int)\n    \n    # Define preprocessing for numeric and categorical columns\n    numeric_transformer = Pipeline([\n        (\"imputer\", SimpleImputer(strategy=\"median\")),\n        (\"scaler\", StandardScaler()),\n    ])\n    \n    categorical_transformer = Pipeline([\n        (\"imputer\", SimpleImputer(strategy=\"most_frequent\")),\n        (\"onehot\", OneHotEncoder(handle_unknown=\"ignore\", sparse_output=False)),\n    ])\n    \n    preprocessor = ColumnTransformer([\n        (\"num\", numeric_transformer, [\"Age\", \"RoomNum\"]),\n        (\"cat\", categorical_transformer, CATEGORICAL + [\"Deck\", \"Side\", \"GroupId\"]),\n        (\"spending\", numeric_transformer, SPENDING),\n    ])\n    \n    pipe = Pipeline([\n        (\"preprocessor\", preprocessor),\n        (\"clf\", LogisticRegression(max_iter=1000)),\n    ])\n    \n    pipe.fit(X, y)\n    \n    def predict(X_val):\n        # Parse Cabin in validation set\n        cabin_data = X_val[\"Cabin\"].apply(parse_cabin)\n        X_val_copy = X_val.copy()\n        X_val_copy[\"Deck\"] = cabin_data.apply(lambda x: x[0])\n        X_val_copy[\"RoomNum\"] = cabin_data.apply(lambda x: x[1])\n        X_val_copy[\"Side\"] = cabin_data.apply(lambda x: x[2])\n        \n        # Extract group ID\n        X_val_copy[\"GroupId\"] = X_val_copy[\"PassengerId\"].apply(extract_group_id)\n        \n        # Fill missing spending with 0\n        for col in SPENDING:\n            X_val_copy[col] = X_val_copy[col].fillna(0)\n        \n        # Handle CryoSleep and VIP\n        X_val_copy[\"CryoSleep\"] = X_val_copy[\"CryoSleep\"].fillna(\"Unknown\").astype(str)\n        X_val_copy[\"VIP\"] = X_val_copy[\"VIP\"].fillna(\"Unknown\").astype(str)\n        \n        return pipe.predict(X_val_copy[[\"Age\"] + SPENDING + CATEGORICAL + [\"Deck\", \"RoomNum\", \"Side\", \"GroupId\"]]).astype(bool)\n    \n    return predict\n\n\nif __name__ == \"__main__\":\n    predict_fn = build_predict_fn()\n    score = prepare.evaluate(predict_fn)\n    print(f\"VAL_ACCURACY: {score:.4f}\")\n", "notes_append": "Iteration 3: Extracted GroupId from PassengerId (group structure), filled missing spending values with 0 instead of median imputation (indicating non-use), and handled NaN in CryoSleep/VIP as explicit \"Unknown\" category. Testing whether group membership and spending patterns improve on 0.7884.", "stdout": "VAL_ACCURACY: 0.7901\n", "stderr": "", "returncode": 0, "score": 0.7901, "kept": true, "status": "kept", "commit_hash": "6504738", "input_tokens": 2869, "output_tokens": 1945, "cost_usd": 0.012594}
